doc_id,report_year,period_end_date,report_year_source,run_date_utc,part,section_title,subsection_title,page_start,page_end,section_text,word_count
Shetland-2020-2021,2020-21,,pdf_cover,2026-03-13T09:09:14+00:00,Unknown,UNSCHEDULED CARE,Unknown,25,25,"appointment and/or treatment in Shetland Graph 4 shows that the Board has not achieved the 18-week access standard from GP referral to outpatient appointment and/or treatment in Shetland over the last five years, averaging around 84.5% against the 90% performance standard. This has been primarily due to issues in meeting the 95% target of a first outpatient appointment within 12 weeks. This target was met in only three months during 2020–21, although this was a modest improvement on 2019–20, when it was met only twice. NHS Shetland’s performance ranged from a low of 58.3% in December to a high of 100% in April. However, the overall annual average performance in 2020–21 of 83.6% was lower than the 2019–20 performance of 86.9%. This struggle to meet the 12-week access target to first outpatient appointment has meant that NHS Shetland has also been unable to meet the Referral to Treatment Target (RTT) in a number of specialities, largely due to our reliance on visiting services, which has in turn impacted our overall performance against the RTT. At year-end, the Board’s performance against the 12-week target for outpatients in 2020–21 fell in relation to 2019–20, with 325 outpatient appointments waiting longer than 12 weeks at 31 March 2021, compared to 127 at 31 March 2020. In 2020–21 Orthopaedics accounted for 34% of these delays, with109 cases, while in 2019–20 Orthopaedics accounted for only 4% of delays, with 5 cases. The other specialties primarily comprising the 2020–21 treatment-delay figures were Ophthalmology, with 75 cases, up from 26 in 2019–20; Rheumatology, with 46 cases, an increase from 0 the year before; and Ear Nose and Throat (ENT), with 20 cases, a drop from the previous year’s 63. For new outpatient cases, 192 patients had been waiting longer than 26 weeks for their first appointment at 31 March 2021, a significant increase from the 23 patients waiting over 26 weeks at 31 March 2020. This rise is due to the impact of Covid-19, and NHS Shetland has put recovery plans in place to reduce the number of patients waiting over 12 weeks, using additional allocations from the Scottish Government, ring-fenced to improve our access targets in 2021–22. As highlighted in Graph 5 below, the Board has had good compliance in the four years prior to 2020–21 regarding patients waiting less than six weeks for one or more of the eight key diagnostic tests.",397
Shetland-2020-2021,2020-21,,pdf_cover,2026-03-13T09:09:14+00:00,Unknown,UNSCHEDULED CARE,Unknown,26,26,"key diagnostic tests At 31 March 2020, there were 20 patients who had to wait longer than six weeks, and compliance with this standard was at 98.0%. However, performance has fallen during 2020–21, with 162 patients at 31 March 2021 with a wait longer than six weeks. The primary delay in respect of diagnostics is non-obstetric ultrasound. Figure 11—Graph 6: Cancer: 62 day standard from referral to start of treatment for newly diagnosed primary cancers The cancer targets require 95% of patients to start cancer treatment within 62 days of referral with suspected cancer, and for patients diagnosed with cancer to receive their first treatment within 31 days of the “decision to treat”. As Graph 6 shows, the Board’s joint cancer pathways with NHS Grampian did not maintain 100% compliance with the 62 day Treatment Target over the last five years, although in 2020–21 only two patients’ treatment-time wait exceeded 62 days, and in 2019–20, only three did. A principle factor behind the non-compliance was access to diagnostic services provided by NHS Grampian, which is actively working to improve patient flow in this pathway for all the Health Boards they manage. As Graph 7 below shows, the Board’s joint pathways with NHS Grampian has consistently maintained full compliance over the last five years with the 31-day Cancer Treatment Target. In 2020–21, all patients’ treatment plans met the 31-day performance standard, although in 2019–20, the patients’ treatment time wait exceeded 31 days in two cases. NHS Shetland is actively participating in the Detecting Cancer Early Programme.",255
Shetland-2020-2021,2020-21,,pdf_cover,2026-03-13T09:09:14+00:00,Unknown,UNSCHEDULED CARE,Unknown,27,27,"treatment for newly diagnosed primary cancers The Board continues to actively manage its general waiting times and cancer targets, and it is working closely with NHS Grampian to reduce delays and improve access. While overall the Board continues to have some of the best access-target performance across Scotland, we recognise that we will continue to experience risks in sustaining performance, particularly where individual visiting services have staffing issues. Work continues to make all pathways sustainable, as well as to address the additional requirement in 2021–22 of working through the backlog caused by the initial focus on containment during the Covid-19 pandemic. The most up-to-date summary information is published at NHS Scotland’s NHS Performs website for selected statistics. Information is also published on the Public Health Scotland website in more detail for all national performance measures Summary Analysis of other Non-Financial Indicators Primary Care The Scottish Government GP access survey takes places every two years. The last survey took place in November 2019, however the result of the survey was not published 13 October 2020. Figure 13—Graph 8: GPs target to provide 48 hour access to an appropriate member of the GP practice team",193
Shetland-2020-2021,2020-21,,pdf_cover,2026-03-13T09:09:14+00:00,Unknown,UNSCHEDULED CARE,Unknown,28,28,"shows patient’s view of local practices ability to provide access to an appropriate member of the practice team has met in the last three surveys. Locally in 2020–21 all practices continued to meet the 48-hour access target. Figure 14—Graph 9: GPs to provide advanced booking to an appropriate member of GP practice team Graph 9 shows patient’s view of local practices ability to provide advance booking to an appropriate member of the practice team has not been met in the last three surveys. The performance in the survey released on 13 October 2020 does show a positive movement in the trend although still significantly below the target by 20.0% points. In respect of advanced booking, access to the GP Practice Team, in 2020–21 NHS Shetland continues to perform below the NHS Scotland target. NHS Shetland is now responsible for operating eight out of the 10 practices in Shetland. There are currently a number of vacancies in practices resulting in the use of locums. In addition to recruitment to these posts substantively, the Board, as part of an initiative funded by the Scottish Government, has created a remote and rural GP recruitment hub for both short-term and substantive posts in partnership with three other North of Scotland Boards to address our common challenge. NHS Shetland hosts the hub and has recruited GPs to some of the vacant posts as a result of this initiative. Primary Care Improvement funding is being used to redesign local services in line with the new GP contract to improve access and quality of service provision across the isles. In line with the new GP contract the purpose of this initiative is to create a focus on sustainable multi-disciplinary team working. Public Health including Health Improvement and Tackling Health Inequalities The Public Health team focus in 2020–21 was on the Pandemic Disease Plan that NHS Shetland officially implemented on 16 March 2020 in response to Covid-19 pandemic. The first confirmed cases of Covid-19 in Shetland was on 8 March 2020 and by 31 March 2020, there were 36 test-confirmed cases of Covid-19 in Shetland. During 2020– 21 there was a further 196 test-confirmed cases of Covid-19 in Shetland so at 31 March 2021 the cumulative number of test-confirmed cases of Covid-19 was 232. The first wave stating in March had 54 cases in total. The second wave had 134 cases. As the trend report below illustrates following wave 1 that started in March 2020 the second wave in Shetland started in mid-December 2020 with peak in January 2021.",421
Shetland-2020-2021,2020-21,,pdf_cover,2026-03-13T09:09:14+00:00,Unknown,UNSCHEDULED CARE,Unknown,29,29,"local contact tracing team had spoken to 823 people whilst investigating positive cases. Figure 15—Trend data by NHS Board NHS Shetland started the Covid-19 immunisation campaign on 11 December 2020. The campaign was significantly scaled up from February 2021 when the mass vaccination centres in Lerwick started to open . At 31 March 2021 the number of people having received their first dose was 12,446, 66.1% of the adult population. In respect of the second dose 2,777 people have received this, 14.8% of the adult population. Bar chart 4 below highlights how successful this local campaign was at 31 March 2021 across the age groups. Figure 16—Bar Chart 4: NHS Shetland Covid-19 vaccine immunisation rate at 31 March 2021 Further information on Public Health activity is available through the Public Health Annual reports . Reports includes details on our actions to tackle inequalities locally. In respect of tackling inequalities the Board discussed and approved Shetland’s second Annual Child Poverty Action Report (ACPAR).",162
Shetland-2020-2021,2020-21,,pdf_cover,2026-03-13T09:09:14+00:00,Unknown,INFECTION CONTROL,Unknown,30,30,"Healthcare Associated Infection (HAI) reports are presented at each Board meeting . Work to prevent HAI including Staphylococcus aureus bacteraemia (SAB), Clostridium difficile (C Diff) and E Coli Bacteraemias continues, with local surveillance and monitoring of every individual case both in hospital and in the community. Regular reports to the Board also include audit compliance performance data highlighting trends in hand hygiene, cleaning and estates monitoring. Overall the data demonstrates a high standard of infection prevention and control in place in NHS Shetland with a strong audit programme to demonstrate compliance to national standards. Positive Healthcare Environment Inspectorate inspection reports across the years reflect this. - Sustainability and Environmental NHS Shetland have engaged with specialist consultants to develop a NHS Shetland Net Zero Route map to achieve the current Scottish Government targets. The route map is currently scheduled to be presented to the Board for consideration and approval at its June 2021 meeting. NHS Shetland are currently using the NHS Scotland Climate Change Adaptation Assessment Tool to assess the risks and produce an Adaptation Action Plan. This is currently programmed to be completed by September 2021 for consideration and approval by the Board in October 2021. The Board is committed to sustainability and to reducing its impact on the environment as laid down in the Scottish Health Technical Memorandum 07-02. In line with this, the Board has taken the following actions: - Continued to implement our Sustainability and Environmental Management Policy with action plan; - NHS Shetland have a nominated Green Champion, Gary Robinson Board Chair - Joint appointment with Sustrans Scotland for active travel project officer post; - Working in partnership with ZetTrans on progressing sustainable transport and active travel across Shetland with local community; - Ongoing monitoring to reduce where possible electricity and water consumption; - Gilbert Bain and Montfield accommodation, Lerwick Health Centre and Breiwick House continue to use the Shetland Heat Energy and Power (SHEP) district heating system, minimising carbon dioxide (CO2) emissions from heat energy; - Reduced planned patient travel flights off-island via repatriation schemes; and - Increased the number of electric and hybrid vehicles in the Board fleet. Continued to expanding the number of e-bikes for staff business travel to increase active travel. NHS Shetland have an established Environmental and Sustainability Group, Waste Group. Transport Group and Energy Group with identified leads.",388
Shetland-2020-2021,2020-21,,pdf_cover,2026-03-13T09:09:14+00:00,Unknown,INFECTION CONTROL,A) PPE,31,31,"Shetland during 2020–21 Adapting Adaptability was key to meeting the challenges of a potential surge of Covid-19 patients at the Gilbert Bain Hospital and managing community transmission of the Covid-19 virus At the Gilbert Bain Hospital, the Ronas Ward was re-opened in anticipation of a surge of Covid-19 patients. Red and green pathways were worked out, to prevent Covid-19- positive patients from infecting those who were not infected. Every passage and ward became a maze of red vs green. All elective surgery was stopped, and part of the theatre converted into a makeshift ventilation unit for highly infectious but critically ill patients. Oxygen stocks were laid in. Hospital visiting was stopped to prevent the spread of the virus. A PPE store was set up in the Physio gym and manned by dentists, (unable to work due to their reliance on aerosol generating procedures) and the military. This central point was pivotal in the managing distribution of masks, hand gel and protective clothing. The hospital laundry, anticipating a surge in requests for scrubs, , appealed to the local community for assistance. The response was overwhelming the community responded turning old duvets and sheets into thousands of items of scrubs that were distributed to NHS facilities across the isles. At first, Covid-19 testing systems were established but all specimens were initially sent to Aberdeen. The laboratory in the Gilbert Bain Hospital then received a testing machine and staff worked round the clock to process tests. This significantly reduced the time to confirm if a test was positive or negative. The work of the lab staff was not in the public eye, but it played a major part in containing the pandemic in Shetland. Those early days demanded strong leadership and difficult decisions. Hours before they were due to start, Board Chair Gary Robinson advised the jarls of the Delting and South Mainland Up Helly Aa celebrations to consider postponing their events in the interest of public safety . They agreed, and in hindsight it is clear that these actions prevented the spread of the virus and, without a doubt, saved lives. In the community the virus continued to spread in March and April during Shetland’s first wave . A contact tracing team was set up and the Public Health team grappled with telling individuals they had to isolate for two weeks. Encouraging compliance was not difficult in the early stages of the lockdown, but it became more challenging as people realised what it meant—not leaving the house under any circumstances for an extended period of time. In the initial stages of Covid-19, the Scottish Ambulance Service (SAS) was not able to safely transfer patients requiring an intensive care unit bed to Aberdeen via air ambulance. During this time, NHS Scotland relied upon the invaluable assistance of the RAF to fly patients to Aberdeen in their A400 Atlas Airbus, dispatched from RAF Brize Norton.",481
Shetland-2020-2021,2020-21,,pdf_cover,2026-03-13T09:09:14+00:00,Unknown,CAROL COLLIGAN,Unknown,32,32,"Carol Colligan Moments of Celebration Despite the changes, and the added strain, there were moments of celebration. Six junior doctors who were in Shetland completing the final stage of their training when the pandemic was declared, sacrificed their summer holidays and remained to support the clinical team. When their graduation was cancelled, their colleagues organised a virtual graduation in the hospital canteen which was livestreamed for their families to watch. In July NHS Shetland was in the news when the domestic team achieved the best figures in Scotland for the first quarter in the National Cleaning Compliance Audit. At the time, Head of Estates and Facilities Lawson Bisset told the media that all the staff in his team “treat our premises with pride, as if their family or friends were coming in as patients or visitors.” A few weeks later, the annual Excellence in Care event went ahead on TEAMS shining a light on services and work across the health board. Most notably, in the practice education category, the work of senior infection control nurses Linda Turner and Michelle Wilkinson was recognised. They spoke about supporting care homes with infection prevention and control at the height of the pandemic. Keeping the Wheels Turning As the winter approached, the flu vaccination programme was rolled out. The old way of doing things—inviting big groups of vulnerable people to mass vaccination clinics—",229
Shetland-2020-2021,2020-21,,pdf_cover,2026-03-13T09:09:14+00:00,Unknown,CAROL COLLIGAN,Unknown,33,33,"Community Nursing and Primacy Care teams did what they do best and vaccinated as many people as possible using an appointment-based system. The year ended with a second major Covid-19 outbreak fuelled by community transmission. The Public Health team, supported by other key staff, worked through Christmas and New Year to contain the outbreak through contact tracing, asked the community to stay at home and avoid family and friends despite the festive season. Two staff in the hospital were infected and their colleagues asked to isolate. While this was happening, planning was underway to roll out the Covid-19 vaccination programme—the biggest ever done. As soon as the second Shetland outbreak was stopped (and despite the emergence of more clusters, some of them on vessels lying off-shore and so complicated to manage) the vaccination roll-out began. By end of March, this year Shetland’s population was reported to be amongst the best vaccinated against Covid-19 in Scotland with 14.8% of the population fully vaccinated. By April, this year Shetland’s population was reported to be the best vaccinated against Covid-19 in Scotland with 43.6% of the population fully vaccinated. Board Chair Gary Robinson told the Board at its April meeting that this meant that the most vulnerable in the community were as well protected as was possible. Royals and the Media In the same month NHS Shetland’s Community Nursing team made international headlines when both the BBC and CNN accompanied nurse Margaret Cooper to Fair Isle to complete vaccinations for the islanders. Fair Isle became the first community in the UK to be fully vaccinated. It took the nurse (and the media teams) three attempts to reach the island due to bad weather. Fair Isle nurse Kirstin Robson told journalists, “It’s been great because we’ve had ten days without a boat, so the boat managed to come in, we have a full shop and we have had the second vaccinations. The sun is out and the lambs are coming!”. Another big moment was a phone call from the Duke of Cambridge, Prince William who spoke to Employee Director Ian Sandilands about the vaccination rollout. Prince William sent his regards and thanks to the NHS Shetland team. Milestones Beyond Covid-19, one of the most notable clinical events of the year was a faecal matter transplant done by Consultant Surgeon Beatrix Weber in February. The donated faeces was flown from Birmingham to Shetland for a patient suffering from Clostridium Difficile Infection. No summing up of the year would be complete without noting some big moments for our staff. Among the many who retired were Director of Pharmacy Chris Nicolson and Chief Nurse (Acute) Alison Mustard. Antony Visocchi took over, on an interim basis, as Director of Dentistry, Brian Chittick took the reins, also on an interim basis, as Chief Officer of the IJB. At the height of the pandemic, on 8 July 2020, CEO Michael Dickson",481
Shetland-2020-2021,2020-21,,pdf_cover,2026-03-13T09:09:14+00:00,Unknown,ACCOUNTABILITY REPORT,Unknown,34,34,"Corporate Governance Report Directors’ Report - Date of Issue The Accountable Officer authorised these audited financial statements for issue on 25 June 2021 as that was the date the financial statements were approved by the Board. - Appointment of auditor The Public Finance and Accountability (Scotland) Act 2000 places personal responsibility on the Auditor General for Scotland to decide who will audit each Scottish health body. For the financial years 2016–17 to 2020–21, the Auditor General appointed Deloitte LLP to audit Shetland Health Board. However, as a result of the Covid-19 pandemic, Deloitte’s appointment has been extended by one year to include 2021–22. The general and statutory duties of the auditors of health bodies are set out in the Code of Audit Practice, issued by Audit Scotland and approved by the Auditor General. - Board membership Under the terms of the Scottish Health Plan, the Health Board is a board of governance, and its membership will be conditioned by the functions of the Board. Members of Health Boards are selected on the basis of their position or the particular expertise that enables them to contribute to the functions and decision-making process at a strategic level and reflects the partnership approach which is essential to improving health and healthcare. The Health Board has collective responsibility for the performance of the local NHS system as a whole, the partnership approach, which is essential to improving health and health care. The Board Members’ responsibilities in relation to the financial statements are set out in a statement following this report. The terms “Board Members” and “Directors” are interchangeable in this report. The names and positions of the Board Members are set out below: Executive Board Members Position Held Michael Dickson Chief Executive Kirsty Brightwell Medical Director (from 6 July 2020) Brian Chittick Interim Medical Director (until 5 July 2020) Kathleen Carolan Director of Nursing and Acute Services Colin Marsland Director of Finance",318
Shetland-2020-2021,2020-21,,pdf_cover,2026-03-13T09:09:14+00:00,Unknown,POSITION HELD,Unknown,35,35,"Executive Board Members Position Held Lorraine Hall Director of Human Resources and Support Services Susan Webb Director of Public Health Non-Executive Board Members Position Held Gary Robinson Chairman Natasha Cornick Shona Manson Jane Haswell Lincoln Carroll Colin Campbell Position Held Stakeholder Non-Executive Board Members Ian Sandilands Chair, Area Partnership Forum Edna Watson Chair, Area Clinical Forum (until 28 February 2021) Amanda McDermott Chair, Area Clinical Forum (from 1 March 2021) Malcolm Bell Vice Chair / Shetland Islands Council Member Board Members’ and senior managers’ interests Details of any interests of board members, senior managers and other senior staff in contracts or potential contractors with the Health Board as required by IAS 24 are disclosed in note 20. A register of interests, which includes details of company directorships or other significant interests held by Board members that may conflict with their management responsibilities, is available for inspection at the Board’s Headquarter, Montfield, Burgh Road, Lerwick, ZE1 0LA or on the Board's website . All Directors appointed by the Cabinet Secretary (shown in the remuneration report) are also Trustees of the Shetland Health Board Endowment Fund, which are consolidated into these accounts. Directors’ third party indemnity provisions The Board has not provided a qualifying third party indemnity provision for any of its Directors at any time during the financial year 2020–21 (nor were any provided in 2019– 20).",226
Shetland-2020-2021,2020-21,,pdf_cover,2026-03-13T09:09:14+00:00,Unknown,VALUE OF LAND,Unknown,36,36,"Deloitte LLP did not undertake any non-audit work for the Board in 2020–21 (nor in 2019–20). Value of Land The value of land owned by the Board is included at current market value, with details provided in Note 7 . Public Services Reform (Scotland) Act 2010 Sections 31 and 32 of the Public Services Reform (Scotland) Act 2010 imposed duties on the Scottish Government, as well as listed Public Bodies, to publish information on expenditure and certain other matters as soon as is reasonably practicable after the end of each financial year. NHS Shetland has met the requirements of the Public Services Reform (Scotland) Act 2010. You can find the relevant documentation on NHS Shetland’s external website. Personal data related incidents reported to the Information Commissioner During 2020–21 there were twelve cases reported to the Information Commissioner’s Office (ICO). In comparison, during 2019–20 there were nine cases reported to the ICO. This increase reflects a greater organisational awareness of, and response to, the requirements of the Data Protection Act 2018. The ICO concluded that no further action was necessary in all twelve cases. They made recommendations for improvements to procedures and, in cases involving human error, highlighted the importance of ensuring staff training was effective and up-to-date. Disclosure of Information to Auditor The Directors who held office at the date of approval of this Directors’ Report confirm that, so far as they are each aware, there is no relevant audit information of which the Board’s auditor is unaware; and each Director has taken all the steps that he/she ought reasonably to have taken as a Director to make himself/herself aware of any relevant audit information and to establish that the Board’s auditor is aware of that information. Financial instruments Information regarding the Financial Risk Management Objectives and policies of the Board and the exposure of the Board to price risk, credit risk, liquidity risk and cash flow risk is disclosed in Note 19 .",324
