doc_id,report_year,period_end_date,report_year_source,run_date_utc,part,section_title,subsection_title,page_start,page_end,section_text,word_count
Shetland-2020-2021,2020-21,,pdf_cover,2026-03-13T09:09:14+00:00,Unknown,HIGHEST EARNING DIRECTOR’S,Unknown,63,63,"The Director of Public Health is a joint post between NHS Shetland (NHSS) and NHS Grampian (NHSG). They are employed by NHSG and provide services to NHSS through a Service Level Agreement (SLA). The annual cost of the SLA is £35k-£40k. Their full annual salary paid by NHS Grampian was £185k-£190k. Higher paid employees’ remuneration (Audited Information) Other employees whose remuneration fell within the following ranges: 2021 2020 Number Number Clinicians 6 £70,001 to £80,000 10 10 £80,001 to £90,000 9 5 £90,001 to £100,000 4 3 £100,001 to £110,000 1 1 £110,001 to £120,000 3 0 £120,001 to £130,000 3 4 £130,001 to £140,000 2 2 £140,001 to £150,000 2 3 £150,001 to £160,000 2 1 £160,001 to £170,000 2 1 £170,001 to £180,000 1 1 £180,001 to £190,000 0 1 £190,001 to £200,000 0 3 £200,001 and above 1 Other 2 £70,001 to £80,000 2 0 £80,001 to £90,000 2",152
Shetland-2020-2021,2020-21,,pdf_cover,2026-03-13T09:09:14+00:00,Unknown,HIGHEST EARNING DIRECTOR’S,Unknown,64,64,"DocuSign Envelope ID: 1AB19955-EB3E-4D79-9321-9538B5ACD82E 2021 2020 Number Number 1 £90,001 to £100,000 1 61",14
Shetland-2020-2021,2020-21,,pdf_cover,2026-03-13T09:09:14+00:00,Unknown,STAFF COSTS (AUDITED INFORMATION),Unknown,65,65,"Salaries Social NHS Inward Agency Total and security scheme secondees and other wages costs employers’ directly costs engaged staff £000 £000 £000 £000 £000 £000 633 Executive 454 70 109 0 0 Board Members 98 Non- 95 3 0 0 0 Executive Members Permanent 27,828 3,051 5,006 0 0 35,885 staff Inward 0 0 0 2,607 0 2,607 Secondees Other Staff 0 0 0 0 5,147 5,147 Outward 0 0 0 0 0 0 Secondees 2021 total 28,377 3,124 5,115 2,607 5,147 44,370 2020 total 24,717 2,673 4,511 1,847 3,164 36,912",91
Shetland-2020-2021,2020-21,,pdf_cover,2026-03-13T09:09:14+00:00,Unknown,NON-EXECUTIVE MEMBERS,Unknown,66,66,"WTE Executive Board Members 5 Non-Executive Members 2 Permanent staff 656 Inward Secondees 0 Other Staff 0 Outward Secondees 0 2021 total 663 Included in the total staff numbers above 0 were staff engaged directly on capital projects, charged to capital expenditure of: Included in the total staff numbers above 50 were disabled staff of: Included in the total staff numbers above 0 were Special Advisers of: 2020 total 598 Included in the total staff numbers above 0 were staff engaged directly on capital projects, charged to capital expenditure of: Included in the total staff numbers above 59 were disabled staff of: Included in the total staff numbers above 0 were Special Advisers of: Note: Staff pension benefits are provided through the NHS Superannuation Scheme for Scotland. Details of the scheme are included in Note 19 .",137
Shetland-2020-2021,2020-21,,pdf_cover,2026-03-13T09:09:14+00:00,Unknown,STAFF COMPOSITION (UNAUDITED INFORMATION),Unknown,67,67,"Staff composition (Unaudited Information) Head Count of Staff 2021 2020 Female Total Female Total Male Male Executive Directors 2 4 6 3 3 6 Non-Executive Directors 5 4 9 5 4 9 and Employee Director Senior Employees 1 0 1 0 1 1 Other 153 647 800 123 602 725 Total Headcount 161 655 816 131 610 741 Sickness absence data (Unaudited Information) 2021 2020 Sickness absence rate 2.9% 3.8% The NHS Scotland AOP compliance standard for Boards to achieve is a sickness absence rate of 4.0% or less. NHS Shetland moved from non-compliant to compliant against this KPI in 2019–20 and has remained compliant during the challenges in 2020–21. Staff policies applied during the financial year relating to the employment of disabled persons (Unaudited Information): - The Board gives full and fair consideration to applications for employment made by disabled persons, having a regard to their particular aptitudes and abilities. - The Board also continues the employment of and arranges appropriate training for employees of the Board who have become disabled persons during the period when they were employed. - Policies include ‘Embracing Equality, Diversity and Human Rights’ and ‘Ensuring Safe and Fair Recruitment, Selection and Employment’. You can find the relevant documentation on NHS Shetland’s external website . Exit packages (Audited Information) None in 2020–21 or prior year. The Trade Union (Facility Time Publication Requirements) Regulations 2017 (Unaudited Information)",231
Shetland-2020-2021,2020-21,,pdf_cover,2026-03-13T09:09:14+00:00,Unknown,THE TRADE UNION (FACILITY TIME PUBLICATION REQUIREMENTS) REGULATIONS 2017 CAME,Unknown,68,68,"The Trade Union (Facility Time Publication Requirements) Regulations 2017 came into force. On 1 April 2017. The regulations place a legislative requirement on relevant public sector employers to collate and publish, on an annual basis, a range of data on the amount and cost of facility time within their organisation. The data is required to be published on a website maintained by or on behalf of the employer before 31 July each year. Relevant Union Officials Number of employees who were Full time equivalent employee relevant union officials during the number year 1 April 2020 to 31 March 2021 15 15 Percentage of time spent of facility time Percentage of time Number of representatives 0% 0 1–50% 15 51–99% 0 100% 0 Percentage of pay bill spent on facility time £000’s Total cost of facility time 6 Total pay bill 45,853 Percentage of the total pay bill spent 0.01% on facility time - Paid trade union activities Time spent on paid trade union 2% activities as a percentage of total paid facility time hours Staff Turnover Percentage (Unaudited Information) 2020–21 12%",181
Shetland-2020-2021,2020-21,,pdf_cover,2026-03-13T09:09:14+00:00,Unknown,OFF PAYROLL ENGAGEMENT (UNAUDITED INFORMATION),Unknown,69,69,"2019–20 11% Staff turnover is calculated as follows and has remained consistent year on year. Total number of leavers in year /Average number of staff in year (headcount) x 100 Off Payroll Engagement (Unaudited Information) The use of locum agency medical and nursing staff throughout the year is disclosed in section (c) above. These staff are either (1) remunerated through NHS Shetland’s payroll when deemed ‘employed for tax purposes’ or under IR35 legislation (2) remunerated through a third party payroll service provided by Liaison Financial Services Limited, or (3) remunerated through the payroll of the Agency provider. Staff Survey (Unaudited Information) NHS Shetland participates in iMatter , NHS Scotland’s Staff Experience continuous improvement tool. iMatter is designed to help individuals, teams, Directorates and Boards, understand and improve staff experience. This is a term used to describe the extent to which employees feel motivated, supported and cared for at work. It is reflected in levels of engagement, motivation and productivity. The process is based on a staff engagement questionnaire which all staff are asked to respond to, which then generates a Team Report containing the results. The Line Manager discusses the report with the team and agree what the teams' main strength is along with up to 3 improvement actions that are specific for them for the months ahead. This improvement plan is captured on a team 'Storyboard' which the team then uses to monitor progress prior to the next iMatter run. The process is then completed annually. Expenditure on Consultancy (Unaudited Information) There has been three consultancy firms engaged during 2020–21. Digital Health and Care Innovation Centre in respect of the Clinical Strategy review through iHub, Anderson Solutions for Shetland Children Partnership, a new framework for partnership project and Affinaod in respect of Mental Health staff wellbeing. The Net Zero Route map energy consultant reference in the report are being paid by Health Facilities Scotland for this project and not NHS Shetland Other Employee Matters (Unaudited Information) The Board has policies and procedures in place for other employee matters such as other diversity issues and equal treatment in employment and occupation; employment issues including employee consultation and/or participation; health and safety at work; trade union relationships; and human capital management such as career management and employability, pay policy etc. Policies include ‘Eliminating Bullying and Harassment’, ‘Work Life Balance’ and ‘Health and Safety Policy’. You can find the relevant documentation on NHS Shetland’s external website .",405
Shetland-2020-2021,2020-21,,pdf_cover,2026-03-13T09:09:14+00:00,Unknown,ACCOUNTABILITY REPORT,Unknown,70,70,"Parliamentary Accountability Report (Audited Information) There are no disclosures applicable, as NHS Shetland is not aware of any attempted fraud or irregular activities during 2020–21 or prior year that incurred a loss and only two payments were made within our delegated limits in respect of a medical negligence claim for £0.168m. The Board as required has provided for CNORIS claims notified to it and which will be settled at a future date; details of these provisions can be found in Note 13. Approval and signing of the Accountability Report Signed Date: 21 July 2021 By Michael Dickson, Chief Executive as Accountable Officer",102
Shetland-2020-2021,2020-21,,pdf_cover,2026-03-13T09:09:14+00:00,Unknown,ACCOUNTABILITY REPORT,Unknown,71,71,"Independent auditor’s report To the members of Shetland Health Board, the Auditor General for Scotland and the Scottish Parliament. Report on the audit of the financial statements Opinion on financial statements We have audited the financial statements in the annual report and accounts of Shetland Health Board and its group for the year ended 31 March 2021 under the National Health Service (Scotland) Act 1978. The financial statements comprise the Statement of Comprehensive Net Expenditure, the Consolidated Statement of Financial Position, the Consolidated Statement of Cash Flows, the Consolidated Statement of Changes in Taxpayers’ Equity and notes to the financial statements, including a summary of significant accounting policies. The financial reporting framework that has been applied in their preparation is applicable law and International Financial Reporting Standards (IFRSs) as adopted by the European Union, and as interpreted and adapted by the 2020/21 Government Financial Reporting Manual (the 2020/21 FReM). In our opinion the accompanying financial statements: - give a true and fair view in accordance with the National Health Service (Scotland) Act 1978 and directions made thereunder by the Scottish Ministers of the state of the affairs of the board and its group as at 31 March 2021 and of the net expenditure for the year then ended; - have been properly prepared in accordance with IFRSs as adopted by the European Union, as interpreted and adapted by the 2020/21 FReM; and - have been prepared in accordance with the requirements of the National Health Service (Scotland) Act 1978 and directions made thereunder by the Scottish Ministers. Basis of opinion We conducted our audit in accordance with applicable law and International Standards on Auditing (UK) (ISAs (UK)), as required by the Code of Audit Practice approved by the Auditor General for Scotland. Our responsibilities under those standards are further described in the auditor’s responsibilities for the audit of the financial statements section of our report. We were appointed by the Auditor General on 31 May 2016. The period of total uninterrupted appointment is 5 years. We are independent of the board and its group in accordance with the ethical requirements that are relevant to our audit of the financial statements in the UK including the Financial Reporting Council’s Ethical Standard, and we have fulfilled our other ethical responsibilities in accordance with these requirements. Non-audit services prohibited by the Ethical Standard were not provided to the board. We believe that",399
Shetland-2020-2021,2020-21,,pdf_cover,2026-03-13T09:09:14+00:00,Unknown,ACCOUNTABILITY REPORT,Unknown,72,72,"the audit evidence we have obtained is sufficient and appropriate to provide a basis for our opinion. Conclusions relating to going concern basis of accounting We have concluded that the use of the going concern basis of accounting in the preparation of the financial statements is appropriate. Based on the work we have performed, we have not identified any material uncertainties relating to events or conditions that, individually or collectively, may cast significant doubt on the body’s ability to continue to adopt the going concern basis of accounting for a period of at least twelve months from when the financial statements are authorised for issue. Risks of material misstatement We report in a separate Annual Audit Report, available from the Audit Scotland website , the most significant assessed risks of material misstatement that we identified and our judgements thereon. Responsibilities of the Accountable Officer for the financial statements As explained more fully in the Statement of the Chief Executive's Responsibilities as the Accountable Officer, the Accountable Officer is responsible for the preparation of financial statements that give a true and fair view in accordance with the financial reporting framework, and for such internal control as the Accountable Officer determines is necessary to enable the preparation of financial statements that are free from material misstatement, whether due to fraud or error. In preparing the financial statements, the Accountable Officer is responsible for assessing the ability of the board and its group to continue as a going concern, disclosing, as applicable, matters related to going concern and using the going concern basis of accounting unless deemed inappropriate. Auditor’s responsibilities for the audit of the financial statements Our objectives are to obtain reasonable assurance about whether the financial statements as a whole are free from material misstatement, whether due to fraud or error, and to issue an auditor’s report that includes our opinion. Reasonable assurance is a high level of assurance, but is not a guarantee that an audit conducted in accordance with ISAs (UK) will always detect a material misstatement when it exists. Misstatements can arise from fraud or error and are considered material if, individually or in the aggregate, they could reasonably be expected to influence the economic decisions of users taken on the basis of these financial statements. A further description of the auditor’s responsibilities for the audit of the financial statements is located on the Financial Reporting Council's website . This description forms part of our auditor’s report.",409
Shetland-2020-2021,2020-21,,pdf_cover,2026-03-13T09:09:14+00:00,Unknown,ACCOUNTABILITY REPORT,Unknown,73,73,"Extent to which the audit was considered capable of detecting irregularities, including fraud Irregularities, including fraud, are instances of non-compliance with laws and regulations. We design procedures in line with our responsibilities outlined above to detect material misstatements in respect of irregularities, including fraud. Procedures include: - considering the nature of the board’s control environment and reviewing the board’s documentation of their policies and procedures relating to fraud and compliance with laws and regulations. We also enquired with management, internal audit and those charged with governance about their own identification and assessment of the risks of irregularities; - obtaining an understanding of the applicable legal and regulatory framework and how the board is complying with that framework; - identifying which laws and regulations are significant in the context of the board; - assessing the susceptibility of the financial statements to material misstatement, including how fraud might occur; and - considering whether the audit team collectively has the appropriate competence and capabilities to identify or recognise non-compliance with laws and regulations. We obtained an understanding of the legal and regulatory framework that the body operates in, and identified the key laws and regulations that: - had a direct effect on the determination of material amounts and disclosures in the financial statements. This included the National Health Service (Scotland) Act 1978 and the Public Bodes (Joint Working) Scotland Act 2014. - do not have a direct effect on the financial statements but compliance with which may be fundamental to the body’s ability to operate or to avoid a material penalty. These included the Data Protection Act 2018 and relevant employment legislation. We discussed among the audit engagement team regarding the opportunities and incentives that may exist within the organisation for fraud and how and where fraud might occur in the financial statements. As a result of the performing the above, we identified the greatest potential for fraud was in relation to the requirement to operate within the expenditure resource limits set by the Scottish Government. The risk is that the expenditure in relation to year- end transactions may be subject to potential manipulation in an attempt to align with its tolerance target or achieve a breakeven position. In response to this risk, we obtained independent confirmation of the resource limits allocated by the Scottish Government and, tested a sample of accruals, prepayments and invoices received",393
Shetland-2020-2021,2020-21,,pdf_cover,2026-03-13T09:09:14+00:00,Unknown,ACCOUNTABILITY REPORT,Unknown,74,74,"around the year-end to assess whether they have been recorded in the correct period. In common with all audits under ISAs (UK), we are also required to perform specific procedures to respond to the risk of management override. In addressing the risk of fraud through management override of controls, we tested the appropriateness of journal entries and other adjustments; assessed whether the judgements made in making accounting estimates are indicative of a potential bias; and evaluated the business rationale of any significant transactions that are unusual or outside the normal course of business. In addition to the above, our procedures to respond to the risks identified included the following: - reviewing financial statement disclosures by testing to supporting documentation to assess compliance with provisions of relevant laws and regulations described as having a direct effect on the financial statements; - performing analytical procedures to identify any unusual or unexpected relationships that may indicate risks of material misstatement due to fraud; - enquiring of management, internal audit and external legal counsel concerning actual and potential litigation and claims, and instances of non-compliance with laws and regulations; and - reading minutes of meetings of those charged with governance and reviewing internal audit reports. The extent to which our procedures are capable of detecting irregularities, including fraud, is affected by the inherent difficulty in detecting irregularities, the effectiveness of the board’s controls, and the nature, timing and extent of the audit procedures performed. Irregularities that result from fraud are inherently more difficult to detect than irregularities that result from error as fraud may involve collusion, intentional omissions, misrepresentations, or the override of internal control. The capability of the audit to detect fraud and other irregularities depends on factors such as the skilfulness of the perpetrator, the frequency and extent of manipulation, the degree of collusion involved, the relative size of individual amounts manipulated, and the seniority of those individuals involved. Reporting on regularity of expenditure and income Opinion on regularity In our opinion in all material respects the expenditure and income in the financial statements were incurred or applied in accordance with any applicable enactments and guidance issued by the Scottish Ministers.",359
Shetland-2020-2021,2020-21,,pdf_cover,2026-03-13T09:09:14+00:00,Unknown,REMUNERATION AND STAFF REPORT,Unknown,75,75,"Responsibilities for regularity The Accountable Officer is responsible for ensuring the regularity of expenditure and income. In addition to our responsibilities to detect material misstatements in the financial statements in respect of irregularities, we are responsible for expressing an opinion on the regularity of expenditure and income in accordance with the Public Finance and Accountability (Scotland) Act 2000. Reporting on other requirements Opinion prescribed by the Auditor General for Scotland on audited part of the Remuneration and Staff Report We have audited the parts of the Remuneration and Staff Report described as audited. In our opinion, the audited part of the Remuneration and Staff Report has been properly prepared in accordance with the National Health Service (Scotland) Act 1978 and directions made thereunder by the Scottish Ministers. Statutory other information The Accountable Officer is responsible for the statutory other information in the annual report and accounts. The statutory other information comprises the Performance Report and the Accountability Report excluding the audited part of the Remuneration and Staff Report. Our responsibility is to read all the statutory other information and, in doing so, consider whether the statutory other information is materially inconsistent with the financial statements or our knowledge obtained in the audit or otherwise appears to be materially misstated. If we identify such material inconsistencies or apparent material misstatements, we are required to determine whether this gives rise to a material misstatement in the financial statements themselves. If, based on the work we have performed, we conclude that there is a material misstatement of this statutory other information, we are required to report that fact. We have nothing to report in this regard. Our opinion on the financial statements does not cover the statutory other information and we do not express any form of assurance conclusion thereon except on the Performance Report and Governance Statement to the extent explicitly stated in the following opinions prescribed by the Auditor General for Scotland. Opinions prescribed by the Auditor General for Scotland on Performance Report and Governance Statement In our opinion, based on the work undertaken in the course of the audit: - the information given in the Performance Report for the financial year for which the financial statements are prepared is consistent with the financial statements and that report has been prepared in accordance with the National",385
Shetland-2020-2021,2020-21,,pdf_cover,2026-03-13T09:09:14+00:00,Unknown,REMUNERATION AND STAFF REPORT,Unknown,76,76,"Health Service (Scotland) Act 1978 and directions made thereunder by the Scottish Ministers; and - the information given in the Governance Statement for the financial year for which the financial statements are prepared is consistent with the financial statements and that report has been prepared in accordance with the National Health Service (Scotland) Act 1978 and directions made thereunder by the Scottish Ministers. Matters on which we are required to report by exception We are required by the Auditor General for Scotland to report to you if, in our opinion: - adequate accounting records have not been kept; or - the financial statements and the audited part of the Remuneration and Staff Report are not in agreement with the accounting records; or - we have not received all the information and explanations we require for our audit; or - there has been a failure to achieve a prescribed financial objective. We have nothing to report in respect of these matters. Conclusions on wider scope responsibilities In addition to our responsibilities for the annual report and accounts, our conclusions on the wider scope responsibilities specified in the Code of Audit Practice are set out in our Annual Audit Report. Use of our report This report is made solely to the parties to whom it is addressed in accordance with the Public Finance and Accountability (Scotland) Act 2000 and for no other purpose. In accordance with paragraph 120 of the Code of Audit Practice, we do not undertake to have responsibilities to members or officers, in their individual capacities, or to third parties. Pat Kenny, CPFA (for and on behalf of Deloitte LLP) 110 Queen Street Glasgow G1 3BX United Kingdom 21 July 2021",282
Shetland-2020-2021,2020-21,,pdf_cover,2026-03-13T09:09:14+00:00,Unknown,REMUNERATION AND STAFF REPORT,Unknown,77,77,"Shetland NHS Board Statements and Summaries SoCNE for the Year Ended 31 March 2021 2020 2021 £000 Note £000 36,912 Staff costs 3a 44,370 Other operating expenditure 3,171 Independent Primary Care Services 3,600 7,571 Drugs and medical supplies 8,727 50,683 Other health care expenditure 55,642 98,337 Gross expenditure for the year 112,339 (32,295) Less: operating income 4 (35,322) (36) Associates and joint ventures (596) accounted for on an equity basis 66,006 Net expenditure for the year 76,421 - Other Comprehensive Net Expenditure (will not be reclassified subsequently to the SoCNE) 2020 2021 £000 £000 Net (gain) / loss on revaluation of 179 (327) investments (273) Net gain on revaluation of property 0 Other comprehensive expenditure (94) (327) 65,912 Comprehensive net expenditure 76,094 The Notes to the Accounts, numbered 1 to 21, form an integral part of these Accounts.",138
