doc_id,page,proposed_subsection,toc_subsection,reason,top_lines_snippet
Grampian-2021-2022,55,I I I,iii) Statement of Health Board Members’ Responsibilities in respect of the Accounts,allow_list_reject(score=0.333),"Draft V4 ~""ss«s2.s < = = “““""“<—““*ee# @ @& @ ee ee eo we ee ee ee ee | ‘ ' a = arcs _ oasis - Strategic -———=— =e = - 7. -———<—<—-—-—=— 7 ! ‘ \ , F ” A. ' is Wider 1 Cohort x | | cualtvandsofety : 1s othe NHS Partnars & TSI VI | Adsurance Group ' 1G ge ‘ pith & “ infrastructure Peferrerce >! igé Grampian Area Partnership ' ; aca =_ 18 "" Forum ' g |__ Assurance Group Coromirine | By r ' ‘ | 1S 3 — 3 [compliance iu : ’ Clinical & Non-Clinical Support & Corporate Services 4g |_Asturance Group ; ational deli BAU focussed thw f 4 5 a ' Operational de wery/ ussed on pathways of care | 5 [Toms = rence System Operational Pathway redesi ects within portfolios Ergagemant tryapevert i Response Team (S-ORT) es ude gn/ proj — —— re Corvrvtes P / | @ System/Enabling Programmes (across portfolios) ete eee / I I I d - ‘Y ’ Operational Delivery of Re-Mobilisation Plan ~ ee ee ee - 54"
Grampian-2021-2022,72,A SENIOR EMPLOYEES,b) Remuneration and Staff Report,allow_list_reject(score=0.432),"NHS GRAMPIAN REMUNERATION REPORT FOR THE YEAR ENDED 31 MARCH 2022 Publication of pension benefits is required in accordance with the Financial Reporting Manual (FReM) and the Companies Act (2006). This calculation aims to bring public bodies in line with other industries in disclosing an assessed cumulative pension benefit for a standard 20 year period, which is the estimated life span following retirement. The other figures shown as part of the single total figure of remuneration relate to actual earnings payable in 2021/22. Sub Total Value of Pension Total accrued Performance Real increase in Total accrued lump Real increase in earnings Benefits (to be Total pension at Cash Equivalent Cash Equivalent Salary (bands of Related Bonus pension at sum at pensionable lump sum at Real increase in paid in Benefits in Kind paid over 20 Remuneration pensionable age at Transfer Value Transfer Value £5,000) (bands of pensionable age age at 31 March 2022 pensionable age CETV in year Notes 2021/22 years following (bands of £5,000) 31 March 2022 (CETV) at 31/3/21 (CETV) at 31/3/22 £5,000) (bands of £2,500) (bands of £5,000) (bands of £2,500) (see (bands of retirement) (bands of £5,000) below) £5,000) £000 £000 £000 £000 £000 £000 £000 £000 £000 £000 £000 £000 £000 Remuneration of: Executive Members Chief Executive - Professor Caroline Hiscox 140-145 0 0.0 140-145 100 240-245 35-40 5-7.5 70-75 7.5-10 541 637 96 Medical Director - Professor Nick Fluck 210-215 0 0.0 210-215 0 210-215 60-65 0 180-185 0 1,372 1,404 32 Director of Finance - Mr Alan Gray (to 31 March 2022) 145-150 0 6.2 150-155 40 190-195 30-35 2.5-5 0 0 434 487 53 Executive Nurse Director - Dr June Brown 110-115 0 0.0 110-115 65 175-180 30-35 2.5-5 70-75 5-7.5 491 560 69 Director of Public Health - Mrs Susan Webb 130-135 0 0.0 130-135 62 190-195 55-60 2.5-5 115-120 2.5-5 998 1,081 83 Non Executive Members Chair - Professor Lynda Lynch (to 31 December 2021) b 30-35 0 0 30-35 N/A 30-35 N/A N/A N/A N/A N/A N/A N/A Interim Chair - Dr John Tomlinson (from 7 June 2021) b/e 30-35 0 0 30-35 N/A 30-35 N/A N/A N/A N/A N/A N/A N/A Mrs Amy Anderson e/k 35-40 0 0 35-40 6 40-45 0-5 0-5 N/A N/A 3 7 5 Mrs Rhona Atkinson e 25-30 0 0 25-30 N/A 25-30 N/A N/A N/A N/A N/A N/A N/A Professor Siladitya Bhattacharya e/j 5-10 0 0 5-10 N/A 5-10 N/A N/A N/A N/A N/A N/A N/A Ms Kim Cruttenden c/e 100-105 0 0 100-105 26 125-130 20-25 0-2.5 40-45 0-2.5 328 356 28 Councillor Isobel Davidson (to 30 April 2022) 5-10 0 0 5-10 N/A 5-10 N/A N/A N/A N/A N/A N/A N/A Mr Albert Donald 5-10 0 0 5-10 N/A 5-10 N/A N/A N/A N/A N/A N/A N/A Ms Joyce Duncan e 15-20 0 0 15-20 N/A 15-20 N/A N/A N/A N/A N/A N/A N/A Mrs Luan Grugeon e 25-30 0 0 25-30 N/A 25-30 N/A N/A N/A N/A N/A N/A N/A Councillor Ryan Houghton (from 25 May 2021 to 30 April 2022) 5-10 0 0 5-10 N/A 5-10 N/A N/A N/A N/A N/A N/A N/A Miss Rachael Little d/e 65-70 0 0 65-70 16 80-85 15-20 0-2.5 0 0 148 161 12 Councillor Shona Morrison (to 30 April 2022) 5-10 0 0 5-10 N/A 5-10 N/A N/A N/A N/A N/A N/A N/A Mr Roderick Murray (from 15 April 2021) e/g 10-15 0 0 10-15 N/A 10-15 N/A N/A N/A N/A N/A N/A N/A Mr Jonathan Passmore (to 14 April 2021) 0-5 0 0 0-5 N/A 0-5 N/A N/A N/A N/A N/A N/A N/A Mr Sandy Riddell e 15-20 0 0 15-20 N/A 15-20 N/A N/A N/A N/A N/A N/A N/A Mr Dennis Robertson e 25-30 0 0 25-30 N/A 25-30 N/A N/A N/A N/A N/A N/A N/A SENIOR EMPLOYEES Director of Facilities and eHealth - Mr Paul Allen a/l 115-120 0 7.3 125-130 27 150-155 30-35 0-2.5 50-55 0 533 573 40 Acute Medical Director and Portfolio Lead (Surgery & clinical Support) - Mr Paul Bachoo a/l 245-250 0 0.0 245-250 37 280-285 55-60 2.5-5 145-150 0 1,224 1,294 70 Chief Officer Moray IJB and Portfolio Lead Moray - Mr Simon Bokor-Ingr a/i 105-110 0 0.0 105-110 64 170-175 40-45 2.5-5 85-90 2.5-5 744 823 79 Director of Strategy and Deputy Chief Executive - Dr Adam Coldwells 135-140 0 0.0 135-140 32 170-175 55-60 2.5-5 110-115 0 968 1,022 53 Chief Officer Aberdeen City IJB and Portfolio Lead Medicine & Unscheduled Care/Mental Health - Ms Sandra Macleod a/i 120-125 0 0.0 120-125 32 150-155 5-10 0-2.5 0 0 72 105 33 Acute Nurse Director and Portfolio Lead (Family) - Ms Janet McNicol a 95-100 0 0.0 95-100 71 165-170 40-45 2.5-5 130-135 10-15 915 1,024 96 Chief Officer Aberdeenshire IJB and Portfolio Lead Aberdeenshire - Ms Pamela Milliken (from 10 May 2021) a/f/i 85-90 0 0.0 85-90 73 160-165 35-40 2.5-5 90-95 5-10 653 739 85 Director of people and Culture - Mr Tom Power 100-105 0 0.0 100-105 32 130-135 15-20 0-2.5 0 0 176 206 30 NOTES : a) The number of senior employees disclosed in the remuneration report is expanded to reflect changes in the organisations Leadership and Management structure with effect from 1 April 2021, designed to support the short term system challenges arising from the ongoing management of the COVID pandemic and also to support the planned implementation of portfolio management arrangements to deliver strategic change. b) The Board appointed Dr John Tomlinson as Vice Chair in June 2021 and he acted as Interim Chair during a period of absence of Professor Lynda Lynch, the Chair, from 7 June 2021, in accordance with the Board’s Standing Orders. Professor Lynch resigned her position as Board Chair with effect from 31 December 2021, and Dr Tomlinson was approved by Scottish Ministers to continue to act as Interim Chair until the appointment of a new chair in 2022. c) The remuneration disclosure for Ms Kim Cruttenden includes total earnings both in her role as a Senior Clinical Pharmacist with NHS Grampian and for her additional duties as an NHS Board member. d) Miss Rachael Little worked in a full time capacity as Employee Director of NHS Grampian. e) Non Executive Board Members who were members of the Integration Joint Boards (IJB's) and who assumed additional responsibilities during the year received additional remuneration. f) Ms Pamela Milliken was appointed as Chief Officer of the Aberdeenshire Integration Joint Board on 10 May 2021. Her full year equivalent salary is in the range £95k-£100k. g) Mr Roderick Murray was appointed to the Board on 15 April 2021 and assumed additional responsibilities during the year. His full year equivalent salary is in the range £15k-£20k. h) Mr Jonathan Passmore's appointment to the Board expired on 15 April 2021. His full year equivalent salary is in the range £15k-£20k. i) Integration Joint Board (IJB) Chief Officers who assumed additional responsibilities as Portfolio Lead, received no additional remuneration. The remuneration and pension benefit disclosed relates to their role as Chief Officer and this is also disclosed in the respective IJB Annual Report and Accounts. j) Professor Siladitya Bhattacharya was an employee of the University of Aberdeen, School of Medicine and Dentistry.The remuneration disclosed above represents the fee paid to the University with regard to his duties as a non executive member. k) The remuneration disclosure for Mrs Amy Anderson includes total earnings both in her part time role as part of NHS Grampian's Health Promotion team and for her additional duties as an NHS Board member. l) A recent decision by the Court of Appeal (McCloud (Judiciary scheme)/Sargeant (Firefighters’ Scheme) cases) that the transitional protections provided as part of the 2015 reforms unlawfully discriminated on the grounds of age. Consequently those members of the pre -2015 schemes (i.e. 1995 and 2008 schemes) who received transitional protection and moved to the new post-2015 CARE arrangements on or after 1 April 2015. will be allowed a choice of scheme i.e. whether to be a member of the old scheme (1995 or 2008) or the new 2015 scheme for the period after 1 April 2015 up to 31 March 2022. Timing for implementtion of these changes will be agreed during 2022/23 and the disclosed pension benefit figures for those above who are affected may change in future years. 71"
Grampian-2021-2022,73,A SENIOR EMPLOYEES,i) Remuneration Report,allow_list_reject(score=0.432),"NHS GRAMPIAN REMUNERATION REPORT FOR THE YEAR ENDED 31 MARCH 2021 Publication of pension benefits is required in accordance with the Financial Reporting Manual (FReM) and the Companies Act (2006). This calculation aims to bring public bodies in line with other industries in disclosing an assessed cumulative pension benefit for a standard 20 year period, which is the estimated life span following retirement. The other figures shown as part of the single total figure of remuneration relate to actual earnings payable in 2020/21. Sub Total Value of Pension Total accrued Performance Real increase in Total accrued lump Real increase in earnings Benefits (to be Total pension at Cash Equivalent Cash Equivalent Salary (bands of Related Bonus pension at sum at pensionable lump sum at Real increase in paid in Benefits in Kind paid over 20 Remuneration pensionable age at Transfer Value Transfer Value £5,000) (bands of pensionable age age at 31 March 2021 pensionable age CETV in year Notes 2020/21 years following (bands of £5,000) 31 March 2021 (CETV) at 31/3/20 (CETV) at 31/3/21 £5,000) (bands of £2,500) (bands of £5,000) (bands of £2,500) (see (bands of retirement) (bands of £5,000) below) £5,000) £000 £000 £000 £000 £000 £000 £000 £000 £000 £000 £000 £000 £000 Remuneration of: Executive Members Professor Amanda Croft b 110-115 0 0.0 110-115 146 255-260 55-60 5-7.5 175-180 20-22.5 1,110 1,291 159 Professor Nick Fluck 205-210 0 0.0 205-210 0 205-210 55-60 0 175-180 0 1,301 1,331 30 Mr Alan Gray 140-145 0 6.0 150-155 39 185-190 25-30 2.5-5 0 0 372 421 49 Professor Caroline Hiscox a/i 130-135 0 0.0 130-135 93 225-230 30-35 5-7.5 60-65 7.5-10 431 516 86 Mrs Susan Webb c/i 155-160 0 0.0 155-160 45 200-205 50-55 2.5-5 110-115 2.5-5 894 968 74 Non Executive Members Chair - Professor Lynda Lynch 40-45 0 0 40-45 N/A 40-45 N/A N/A N/A N/A N/A N/A N/A Vice Chair - Mrs Rhona Atkinson f 25-30 0 0 25-30 N/A 25-30 N/A N/A N/A N/A N/A N/A N/A Mrs Amy Anderson f/j 30-35 0 0 30-35 4 35-40 0-5 0-5 0 0 0 3 3 Professor Siladitya Bhattacharya 5-10 0 0 5-10 N/A 5-10 N/A N/A N/A N/A N/A N/A N/A Ms Kim Cruttenden d 95-100 0 0 95-100 31 125-130 20-25 0-2.5 35-40 0-2.5 287 317 30 Councillor Isobel Davidson 5-10 0 0 5-10 N/A 5-10 N/A N/A N/A N/A N/A N/A N/A Mr Albert Donald 5-10 0 0 5-10 N/A 5-10 N/A N/A N/A N/A N/A N/A N/A Ms Joyce Duncan f 15-20 0 0 15-20 N/A 15-20 N/A N/A N/A N/A N/A N/A N/A Mrs Luan Grugeon f 25-30 0 0 25-30 N/A 25-30 N/A N/A N/A N/A N/A N/A N/A Miss Rachael Little e/f 60-65 0 0 60-65 19 80-85 10-15 0-2.5 0 0 129 143 14 Councillor Douglas Lumsden (to 19 March 2021) 5-10 0 0 5-10 N/A 5-10 N/A N/A N/A N/A N/A N/A N/A Councillor Shona Morrison 5-10 0 0 5-10 N/A 5-10 N/A N/A N/A N/A N/A N/A N/A Mr Jonathan Passmore f 15-20 0 0 15-20 N/A 15-20 N/A N/A N/A N/A N/A N/A N/A Mr Sandy Riddell f 15-20 0 0 15-20 N/A 15-20 N/A N/A N/A N/A N/A N/A N/A Mr Dennis Robertson f 20-25 0 0 20-25 N/A 20-25 N/A N/A N/A N/A N/A N/A N/A Mr John Tomlinson f 15-20 0 0 15-20 N/A 15-20 N/A N/A N/A N/A N/A N/A N/A SENIOR EMPLOYEES Dr June Brown (from 2 November 2020) g 35-40 0 0 35-40 39 75-80 25-30 2.5-5 65-70 7.5-10 387 476 90 Dr Adam Coldwells i 135-140 0 0.2 135-140 46 185-190 50-55 2.5-5 110-115 0-2.5 875 939 64 Mr Tom Power (from 1 July 2020) h 70-75 0 0 70-75 35 105-110 10-15 2.5-5 134 171 37 NOTES : a) Professor Caroline Hiscox was appointed as Chief Executive and accountable officer for NHS Grampian on 2 November 2020. Prior to this, Professor Hiscox was the Executive Nurse Director. b) Professor Croft was Chief Executive and accountable officer of NHS Grampian until 1 November 2020 and formally retired from NHS Grampian service on 31 December 2020. Her full year equivalent salary was in the range £145k-£150k c) Mrs Susan Webb was Director of Public Health for both NHS Grampian and NHS Shetland. Both roles were performed as an employee of NHS Grampian and 17% of Mrs Webb's salary was recharged to NHS Shetland under a Service Level Agreement between the two Boards.The remuneration disclosed above represents the 83% of cost met by NHS Grampian during 2020/21. The disclosed pension figures relate to service accrued in both NHS Grampian and NHS Shetland roles and includes additional years purchased at her own personal cost. d) The remuneration disclosure for Ms Kim Cruttenden includes total earnings both in her role as a Senior Clinical Pharmacist with NHS Grampian and for her additional duties as an NHS Board member. e) Miss Rachael Little worked in a full time capacity as Employee Director of NHS Grampian. f) Non Executive Board Members who were members of the Integration Joint Boards and who assumed additional responsibilities during the year received additional remuneration. g) Dr June Brown was appointed Interim Nurse Director with effect from 2 November 2020. Her full year equivalent salary was in the range £95k-£100k h) Mr Tom Power was appointed as Director of People and Culture on 1 July 2020. His full year equivalent salary was in the range £90k-£95k i) Executive Board members and Senior Managers received overtime during the COVID pandemic in line with Scottish Government Direction, where this was deemed helpful for the provision of clinical or other services necessary to the continued operation of NHS Scotland and subject to the scrutiny and agreement of the NHS Grampian Remuneration Committee. j) The remuneration disclosure for Mrs Amy Anderson has been restated to include total earnings both in her part time role as part of NHS Grampian's Health Promotion team and for her additional duties as an NHS Board member. 72"
Grampian-2021-2022,76,A formal process was implemented and managed through a Deployment Hub to address,i) Remuneration Report,allow_list_reject(score=0.324),"b) REMUNERATION AND STAFF REPORT ii) STAFF REPORT 1.The Workforce (cont) Temporary Deployment Temporary deployment of staff was simultaneously part of the response to meet workforce gaps. On the whole this happened within local services and was based on individual service need and workforce availability. A formal process was implemented and managed through a Deployment Hub to address specific resource needs around Operation Iris and in particular the need to resource additional surge wards / beds. Learning was identified from previous deployment experiences during the earlier stages of the pandemic. These helped to refine the process including the person centred and compassionate approach. All corporate services were asked to complete a Workforce Prioritisation Assessment Template – Capacity to support the workforce demands based on 6 weighted criteria. A similar Workforce Prioritisation Assessment Template – Demand was completed by areas who required staff. These templates were then used to support prioritisation of staff capacity for deployment. Outcomes were collated and assessed through the Deployment Group and an overall status reported through to the Workforce Cell established during Operation Iris. Additional Hours and Overtime Additional hours and overtime were also a feature of ensuring a safe workforce and meeting the service requirements triggered by COVID-19 and winter pressures. The continued use of the variation order issued from the Scottish Government in March 2020, which temporarily expanded the staff groups eligible to receive overtime payments in relation to the COVID-19 response, was reviewed and agreed by the Remuneration Committee in April 2020, September 2020 and March 2021. Supplementary Staffing Whilst the significant pressures of winter 2021/22 required greater use of agency staff than anticipated, work to progress commitments to reduce the costs of agency and supplementary staffing continued. This has included the introduction of direct engagement for Medical Locums to mitigate the impact of IR35 costs being passed on to the Board by Agencies. Scoping of a Medical staff bank has also commenced, with the intent of moving to a single staff bank remaining a priority for the early years of Our Plan for the Future. Targeted Health and Wellbeing Support To support staff through this period the Board further developed and embedded in Partnership ‘We Care’, a Health and Wellbeing Programme to align and improve access to existing support for staff wellbeing. This encouraged teams to integrate wellbeing into their work practices and to support a wellbeing culture in the workplace. A range of training, resources, activities and information to support staff health and wellbeing were implemented through 5 workstreams:"
Grampian-2021-2022,84,I have audited the financial statements in the annual report and accounts of,,allow_list_reject(score=0.385),"Reporting on the audit of the financial statements Opinion on financial statements I have audited the financial statements in the annual report and accounts of Grampian Health Board and its group for the year ended 31 March 2022 under the National Health Service (Scotland) Act 1978. The financial statements comprise the Consolidated Statement of Comprehensive Net Expenditure, the Consolidated Statement of Financial Position, the Consolidated Cash Flow Statement, the Consolidated Statement of Changes in Taxpayers’ Equity and notes to the accounts, including significant accounting policies. The financial reporting framework that has been applied in their preparation is applicable law and UK adopted international accounting standards, as interpreted and adapted by the 2021/22 Government Financial Reporting Manual (the 2021/22 FReM). In my opinion the accompanying financial statements: - give a true and fair view in accordance with the National Health Service (Scotland) Act 1978 and directions made thereunder by the Scottish Ministers of the state of the affairs of the board and its group as at 31 March 2022 and of the net expenditure for the year then ended; - have been properly prepared in accordance with UK adopted international accounting standards, as interpreted and adapted by the 2021/22 FReM; and - have been prepared in accordance with the requirements of the National Health Service (Scotland) Act 1978 and directions made thereunder by the Scottish Ministers. Basis for opinion I conducted my audit in accordance with applicable law and International Standards on Auditing (UK) (ISAs (UK)), as required by the Code of Audit Practice approved by the Auditor General for Scotland. My responsibilities under those standards are further described in the auditor’s responsibilities for the audit of the financial statements section of my report. I was appointed by the Auditor General on 18 July 2016. The period of total uninterrupted appointment is six years. I am independent of the board and its group in accordance with the ethical requirements that are relevant to my audit of the financial statements in the UK including the Financial Reporting Council’s Ethical Standard, and I have fulfilled my other ethical responsibilities in accordance with these requirements. Non- audit services prohibited by the Ethical Standard were not provided to the board. I believe that the audit evidence I have obtained is sufficient and appropriate to provide a basis for my opinion. Conclusions relating to going concern basis of accounting I have concluded that the use of the going concern basis of accounting in the preparation of the financial statements is appropriate. Based on the work I have performed, I have not identified any material uncertainties relating to events or conditions that, individually or collectively, may cast significant doubt on the ability of the board and its group to continue to adopt the going concern"
Grampian-2021-2022,85,I report in my Annual Audit Report the most significant assessed risks of material,,allow_list_reject(score=0.346),"website . Risks of material misstatement I report in my Annual Audit Report the most significant assessed risks of material misstatement that I identified and my judgements thereon. Responsibilities of the Accountable Officer for the financial statements As explained more fully in the Statement of the Chief Executive's Responsibilities as the Accountable Officer, the Accountable Officer is responsible for the preparation of financial statements that give a true and fair view in accordance with the financial reporting framework, and for such internal control as the Accountable Officer determines is necessary to enable the preparation of financial statements that are free from material misstatement, whether due to fraud or error. In preparing the financial statements, the Accountable Officer is responsible for assessing the ability of the board and its group to continue as a going concern, disclosing, as applicable, matters related to going concern and using the going concern basis of accounting unless there is an intention to discontinue the board’s operations. Auditor’s responsibilities for the audit of the financial statements My objectives are to obtain reasonable assurance about whether the financial statements as a whole are free from material misstatement, whether due to fraud or error, and to issue an auditor’s report that includes my opinion. Reasonable assurance is a high level of assurance, but is not a guarantee that an audit conducted in accordance with ISAs (UK) will always detect a material misstatement when it exists. Misstatements can arise from fraud or error and are considered material if, individually or in the aggregate, they could reasonably be expected to influence the decisions of users taken on the basis of these financial statements. Irregularities, including fraud, are instances of non-compliance with laws and regulations. I design procedures in line with my responsibilities outlined above to detect material misstatements in respect of irregularities, including fraud. Procedures include: - obtaining an understanding of the applicable legal and regulatory framework and how the board is complying with that framework; - identifying which laws and regulations are significant in the context of the board; - assessing the susceptibility of the financial statements to material misstatement, including how fraud might occur; and - considering whether the audit team collectively has the appropriate competence and capabilities to identify or recognise non-compliance with laws and regulations. The extent to which my procedures are capable of detecting irregularities, including fraud, is affected by the inherent difficulty in detecting irregularities, the effectiveness of the board’s controls, and the nature, timing and extent of the audit procedures performed. Irregularities that result from fraud are inherently more difficult to detect than irregularities that result from error as fraud may involve collusion, intentional"
