doc_id,report_year,period_end_date,report_year_source,run_date_utc,part,section_title,subsection_title,page_start,page_end,section_text,word_count
Grampian-2008-2009,2008-2009,,pdf_cover,2026-03-13T08:22:10+00:00,Unknown,STATEMENT OF THE CHIEF EXECUTIVE’S RESPONSIBILITIES AS THE ACCOUNTABLE,REMUNERATION REPORT,22,22,"GRAMPIAN HEALTH BOARD ANNUAL ACCOUNTS 2008/09 STATEMENT OF HEALTH BOARD MEMBERS’ RESPONSIBILITIES IN RESPECT OF THE ACCOUNTS Under the National Health Service (Scotland) Act 1978, the Health Board is required to prepare accounts in accordance with the directions of Scottish Ministers which require that those accounts give a true and fair view of the state of affairs of the Health Board as at 31 March 2009 and of its operating costs for the year then ended. In preparing these accounts the Directors are required to: - Apply on a consistent basis the accounting policies and standards approved for NHS Scotland by the Scottish Ministers. - Make judgements and estimates that are reasonable and prudent. - State where applicable accounting standards as set out in the Financial Reporting Manual have not been followed where the effect of the departure is material. - Prepare the accounts on the going concern basis unless it is inappropriate to presume that the Board will continue to operate. The Health Board members are responsible for ensuring that proper accounting records are maintained which disclose with reasonable accuracy at any time the financial position of the Board and enable them to ensure that the accounts comply with the National Health Service (Scotland) Act 1978 and the requirements of the Scottish Ministers. They are also responsible for safeguarding the assets of the Board and hence taking reasonable steps for the prevention of fraud and other irregularities. The NHS Board members confirm they have discharged the above responsibilities during the financial year and in preparing the accounts. ...................................................................................... Dr David Cameron Chairman Grampian Health Board ...................................................................................... Mr Alan Gall Director of Finance Grampian Health Board 26 June 2009 Date",280
Grampian-2008-2009,2008-2009,,pdf_cover,2026-03-13T08:22:10+00:00,Unknown,STATEMENT ON INTERNAL CONTROL,Unknown,23,23,"GRAMPIAN HEALTH BOARD STATEMENT ON INTERNAL CONTROL Scope of Responsibility As Accountable Officer, I have responsibility for maintaining a sound system of internal control that supports the achievement of the organisation’s policies, aims and objectives, set by Scottish Ministers, whilst safeguarding the public funds and assets for which I am personally responsible, in accordance with the responsibilities assigned to me. In terms of enabling me to discharge my responsibilities as Accountable Officer, the following arrangements and processes have been in place throughout the financial year to manage risk within the organisation: - A Board which meets regularly to consider the plans and strategic direction of the organisation (the Board comprises the senior management of the organisation and Non-Executive members). - Single system governance and risk management arrangements with clear supporting lines of accountability and agreed scheme of delegation and standing orders. - The consideration by the Board of periodic reports from the chairs of the performance governance, staff governance, clinical governance and audit committees, concerning any significant matters on governance, risk and internal controls. - Robust prioritisation of risks and allocation of responsibility for mitigating action to named senior officers. - A strong focus on best value and commitment to ensuring that resources are used efficiently, effectively and economically taking into consideration equal opportunities and sustainable development requirements. - Clear allocation of responsibilities for ensuring that we continue to review and develop our organisational arrangements and services in line with national standards and guidance. - Further development of arrangements to secure continuous improvement in performance, including allocation of lead responsibilities for strategic change projects and implementation of improvement actions across all our clinical and non clinical activities. The Scottish Public Finance Manual (SPFM) is issued by the Scottish Ministers to provide guidance to the Scottish Government and other relevant bodies on the proper handling of public funds. It is mainly designed to ensure compliance with statutory and parliamentary requirements, promote value for money and high standards of propriety, and secure effective accountability and good systems of internal control. Purpose of the System of Internal Control The system of internal control is designed to manage rather than eliminate the risk of failure to achieve the organisation’s policies, aims and objectives; it can therefore only provide reasonable and not absolute assurance of effectiveness. The system of internal control is based on an ongoing process designed to identify and prioritise the principal risks to the achievement of the organisation’s policies, aims and objectives, to evaluate the likelihood of those risks being realised and the impact should they be realised, and to manage them efficiently, effectively and economically. This process has been in place for the year up to the date of approval of the annual report and accounts and accords with guidance from the Scottish Government Health Directorates.",465
Grampian-2008-2009,2008-2009,,pdf_cover,2026-03-13T08:22:10+00:00,Unknown,RISK AND CONTROL FRAMEWORK,Unknown,24,24,"Risk and Control Framework All NHS Scotland bodies are subject to the requirements of the SPFM and must operate a risk management strategy in accordance with relevant guidance issued by the Scottish Ministers. The general principles for a successful risk management strategy are set out in the SPFM. - The risk management strategy clearly sets out the importance of risk management to the delivery of our objectives, the responsibilities of staff across NHS Grampian and the supporting organisational arrangements for the identification, assessment and reporting of risks and the steps to be taken to develop and implement mitigating action. - We have implemented an assurance framework to assist each of the core governance committees to identify and assess risks that fall within their remit. - Risk Control Plans have been established for each sector which set out the steps being taken to manage risks linked to delivery of corporate objectives, performance targets and key strategic projects. - Risks associated with information that we are responsible for are subject to regular review and independent audit as part of our overall governance and risk management arrangements. During the year under review we utilised the Scottish Government Information Governance Toolkit to review all our current information policies and procedures and assess the risks associated with information we hold and share both internally and externally. We have also commissioned internal audit to independently assess the effectiveness of our arrangements in relation to medical records. The findings and agreed actions for improvement have been allocated to senior officers, with implementation being subject to regular review by the eHealth and Audit Committees. As Chief Executive I have also taken personal responsibility for ensuring that regular monitoring is undertaken of our information governance arrangements and that improvement actions are taken to address identified risks in accordance with agreed implementation timetables. - We have implemented an IT web enabled system to facilitate the electronic recording, assessment and reporting of risks and incidents in line with our risk management strategy. - Commitment to the continuation of our programme of raising risk awareness amongst all staff on an ongoing basis. More generally, the organisation is committed to a process of continuous development and improvement, developing systems in response to any relevant reviews and developments in best practice in this area. In particular, in the period covering the year to 31 March 2009 and up to the signing of the accounts, the organisation has implemented the following actions to further enhance the Board’s system of internal control: - Refocusing and prioritisation of the strategic service design projects underpinning the change and innovation programme in order to address areas of financial pressure and/or support more effective delivery of patient care. - Appointment of a Director of Human Resources and Strategic Change to lead on organisational change and continuous service improvement and support management drive forward actions to improve effectiveness and efficiency across all our clinical and non clinical services. - Implementation of the improvement actions identified by self evaluation reviews undertaken by the core governance committees of the Board. NHS Grampian is also committed to ensuring that its activities are undertaken in a manner that will secure best value in the use of public funds. The Board is committed to incorporating the principles of best value within its planning, performance and delivery activities. Best value is part of everyday business and integral to the Board’s decision making in all key areas.",569
Grampian-2008-2009,2008-2009,,pdf_cover,2026-03-13T08:22:10+00:00,Unknown,HUMAN RESOURCES AND STRATEGIC CHANGE WITH RESPONSIBILITY FOR ORGANISATIONAL DEVELOPMENT AND,Unknown,25,25,"To further progress the embedding of a culture of best value across the organisation, NHS Grampian seconded an experienced member of staff from Aberdeenshire Council to lead the further development and awareness of the requirements of Best Value following from the completion of a comprehensive baseline assessment. A short life Best Value Steering Group was established to oversee this work. Examples of good practice highlighted by our review included the arrangements for improving patient safety, particularly the reporting arrangements across NHS Grampian, the incorporation of best value principles within our key strategic change programmes and open accountability to the public for performance improvement. The work undertaken on the Best Value project, together with the appointment of a Director for Human Resources and Strategic Change with responsibility for Organisational Development and Continuous Service Improvement, demonstrates the commitment the Board has to driving improvement and embedding best value across all services. This will be particularly important in supporting the Board address known financial and activity pressures. During the financial year ending 31 March 2010 we will continue to seek opportunities to enhance the Board’s system of internal control with a specific focus on delivery of safe and effective patient care, achievement of priority access targets and demonstrating best value and the efficient use of resources. Review of Effectiveness As Accountable Officer, I also have responsibility for reviewing the effectiveness of the system of internal control. My review of the effectiveness of the system of internal control is informed by: - The executive managers within the organisation who have responsibility for the development and maintenance of the internal control framework. - The work of the Internal Auditors, who submit to the organisation's Audit Committee regular reports which include their independent and objective opinion on the adequacy and effectiveness of the organisation's systems of internal control together with recommendations for improvement. - Comments made by the External Auditors in their management letters and other reports. In addition to the above, the processes that have been applied in maintaining and reviewing the effectiveness of the system of internal control include: - The approval of annual statements of assurance from each of the core governance committees of the Board. - Independent consideration of the statement on internal control and its disclosures by Internal Audit, the Audit Committee and the Assurance Framework Steering Group. - Consideration and approval of the annual accounts, including the Statement on Internal Control by the Board. During the year, minutes of the meetings of the core governance committees were provided to all Board members. At each Board meeting the Chairs of these governance committees are given the opportunity to raise or highlight any significant matters. I have been advised on the implications of the result of my review of the effectiveness of the system of internal control by the Board and the Audit Committee and a plan to address weaknesses and ensure continuous improvement of the system is in place.",488
Grampian-2008-2009,2008-2009,,pdf_cover,2026-03-13T08:22:10+00:00,Unknown,MR RICHARD CAREY,Unknown,26,26,"Disclosures During the year ended 31 March 2009, there were no significant control weaknesses or failure to achieve the standards set out in the guidance on the Statement on Internal Control. ………………………………………………… Mr Richard Carey Chief Executive Grampian Health Board 26 June 2009 Date",44
Grampian-2008-2009,2008-2009,,pdf_cover,2026-03-13T08:22:10+00:00,Unknown,INDEPENDENT AUDITOR'S REPORT,REMUNERATION REPORT,27,27,"Independent Auditor’s Report Independent auditor’s report to the members of Grampian Health Board, the Auditor General for Scotland and the Scottish Parliament I have audited the financial statements of Grampian Health Board for the year ended 31 March 2009 under the National Health Service (Scotland) Act 1978. These comprise the Operating Cost Statement and Statement of Recognised Gains and Losses, the Balance Sheet, the Cash Flow Statement and the related notes. These financial statements have been prepared under the accounting policies set out within them. I have also audited the information in the Remuneration Report that is described in that report as having been audited. This report is made solely to the parties to whom it is addressed in accordance with the Public Finance and Accountability (Scotland) Act 2000 and for no other purpose. In accordance with paragraph 123 of the Code of Audit Practice approved by the Auditor General for Scotland, I do not undertake to have responsibilities to members or officers, in their individual capacities, or to third parties. Respective responsibilities of the Board, Accountable Officer and auditor The Board and Accountable Officer are responsible for preparing the Annual Report, which includes the Remuneration Report, and the financial statements in accordance with the National Health Service (Scotland) Act 1978 and directions made there under by the Scottish Ministers. The Accountable Officer is also responsible for ensuring the regularity of expenditure and income. These responsibilities are set out in the Statement of the Chief Executive’s Responsibilities as the Accountable Officer of the Health Board. My responsibility is to audit the financial statements and the part of the Remuneration Report to be audited in accordance with relevant legal and regulatory requirements and with International Standards on Auditing (UK and Ireland) as required by the Code of Audit Practice approved by the Auditor General for Scotland. I report to you my opinion as to whether the financial statements give a true and fair view and whether the financial statements and the part of the Remuneration Report to be audited have been properly prepared in accordance with the National Health Service (Scotland) Act 1978 and directions made there under by the Scottish Ministers. I report to you whether, in my opinion, the information which comprises the Operating and Financial Review and Directors Report, included in the Annual Report, is consistent with the financial statements. I also report whether in all material respects the expenditure and income shown in the financial statements were incurred or applied in accordance with any applicable enactments and guidance issued by the Scottish Ministers. In addition, I report to you if, in my opinion, the body has not kept proper accounting records, if I have not received all the information and explanations I require for my audit, or if information specified by relevant authorities regarding remuneration and other transactions is not disclosed. I review whether the Statement on Internal Control reflects the Board’s compliance with the Scottish Government Health Directorates’ guidance, and I report if, in my opinion, it does not. I am not required to consider whether this statement covers all risks and controls, or form an opinion on the effectiveness of the body’s corporate governance procedures or its risk and control procedures. I read the other information contained in the Annual Report and consider whether it is consistent with the audited financial statements. This other information comprises only that part of the Remuneration Report that has not been audited. I consider the implications for my report if I become aware of any apparent misstatements or material inconsistencies with the financial statements. My responsibilities do not extend to any other information. Basis of audit opinion I conducted my audit in accordance with the Public Finance and Accountability (Scotland) Act 2000",623
Grampian-2008-2009,2008-2009,,pdf_cover,2026-03-13T08:22:10+00:00,Unknown,INDEPENDENT AUDITOR'S REPORT,REMUNERATION REPORT,28,28,"required by the Code of Audit Practice approved by the Auditor General for Scotland. My audit includes examination, on a test basis, of evidence relevant to the amounts, disclosures and regularity of expenditure and income included in the financial statements and the part of the Remuneration Report to be audited. It also includes an assessment of the significant estimates and judgements made by the Board and Accountable Officer in the preparation of the financial statements, and of whether the accounting policies are most appropriate to the body’s circumstances, consistently applied and adequately disclosed. I planned and performed my audit so as to obtain all the information and explanations which I considered necessary in order to provide me with sufficient evidence to give reasonable assurance that the financial statements and the part of the Remuneration Report to be audited are free from material misstatement, whether caused by fraud or error, and that in all material respects the expenditure and income shown in the financial statements were incurred or applied in accordance with any applicable enactments and guidance issued by the Scottish Ministers. In forming my opinion I also evaluated the overall adequacy of the presentation of information in the financial statements and the part of the Remuneration Report to be audited. Opinions Financial statements In my opinion - the financial statements give a true and fair view, in accordance with the National Health Service (Scotland) Act 1978 and directions made thereunder by the Scottish Ministers, of the state of affairs of the Board as at 31 March 2009 and of its net operating cost position, recognised gains and losses and cash flows for the year then ended; - the financial statements and the part of the Remuneration Report to be audited have been properly prepared in accordance with the National Health Service (Scotland) Act 1978 and directions made thereunder by the Scottish Ministers; and - information which comprises the Operating and Financial Review and Directors Report, included in the Annual Report, is consistent with the financial statements. Equal Pay Without qualifying our opinion we draw attention to Note 21 to the financial statements. The Board has received a number of claims under the Equal Pay Act 1970 claiming compensation for inequalities under previous pay arrangements. The NHS Scotland Central Legal Office has co-ordinated the legal response to all claims and has advised that the claims are not specific enough for any estimate of the potential liability to be made. The ultimate outcome of the matter cannot presently be determined, and no provision for any liability that may result has been made in the financial statements. Regularity In my opinion in all material respects the expenditure and income shown in the financial statements were incurred or applied in accordance with any applicable enactments and guidance issued by the Scottish Ministers. David McConnell Assistant Director of Audit (Health) Audit Scotland 7 th floor, Plaza Tower EAST KILBRIDE G74 1LW Date……………………..",487
Grampian-2008-2009,2008-2009,,pdf_cover,2026-03-13T08:22:10+00:00,Unknown,CLINICAL SERVICES COSTS,Unknown,29,29,"OPERATING COST STATEMENT FOR THE YEAR ENDED 31 MARCH 2009 2008-09 2007-08 Note £000 £000 Clinical Services Costs Hospital and Community 4 669,642 634,630 Less: Hospital and Community Income 8 (16,116) (14,570) 653,526 620,060 Family Health 5 207,491 202,284 Less: Family Health Income 8 (8,469) (10,034) 199,022 192,250 852,548 812,310 Total Clinical Services Costs Administration Costs 6 4,732 4,157 Other Non-Clinical Services 7 12,267 11,661 Less: Other Operating Income 8 (69,848) (66,751) (57,581) (55,090) 761,377 Net Operating Costs 799,699 SUMMARY OF REVENUE RESOURCE OUTTURN 799,699 761,377 Net Operating Costs (per above) Less: Capital Grants to Public Bodies 9 (3,306) (464) Less: Disposal of Fixed Assets 9 (281) (163) Less: Annually Managed Expenditure (Write Downs) (3,184) (2,174) Less: FHS Non Discretionary Allocation (43,075) (35,722) 722,854 Net Resource Outturn 749,853 Revenue Resource Limit 756,339 729,245 6,391 Saving against Revenue Resource Limit 6,486",140
Grampian-2008-2009,2008-2009,,pdf_cover,2026-03-13T08:22:10+00:00,Unknown,NET (LOSS)/GAIN ON REVALUATION OF TANGIBLE FIXED ASSETS,Unknown,30,30,"STATEMENT OF RECOGNISED GAINS AND LOSSES FOR THE YEAR ENDED 31 MARCH 2009 2008-09 2007-08 Note £000 £000 11 (6,397) 26,813 Net (Loss)/Gain on Revaluation of Tangible Fixed Assets Net (Loss) on Revaluation of Intangible Fixed Assets 10 (120) (63) Movement in Donated Asset Reserve due to Receipts 20 300 106 (6,217) 26,856 Total Recognised (Losses)/Gains for the Year",59
Grampian-2008-2009,2008-2009,,pdf_cover,2026-03-13T08:22:10+00:00,Unknown,BALANCE SHEET AS AT 31 MARCH 2009,Unknown,31,31,"BALANCE SHEET AS AT 31 MARCH 2009 As at As at 31/3/2009 31/3/2008 Note £000 £000 FIXED ASSETS Intangible Fixed Assets 10 369 21 Tangible Fixed Assets 11 407,974 404,165 404,186 Total Fixed Assets 408,343 13 4,566 11,175 Debtors falling due after more than one year CURRENT ASSETS Stocks 12 4,177 5,040 Debtors 13 31,032 26,947 Investments 14 1 1 Cash at bank and in hand 15 1,346 1,709 36,919 33,334 CURRENT LIABILITIES: Creditors due within one year 16 (126,239) (104,123) (92,905) NET CURRENT (LIABILITIES) (67,204) 322,456 TOTAL ASSETS LESS CURRENT LIABILITIES 345,705 16 (102) 0 CREDITORS DUE AFTER MORE THAN 1 YEAR 17 (10,030) (16,845) PROVISIONS FOR LIABILITIES AND CHARGES 305,611 335,573 FINANCED BY: General Fund 19 223,720 186,608 Revaluation Reserve 20 96,895 103,729 Donated Asset Reserve 20 14,958 15,274 335,573 305,611 Adopted by the Board on 26 June 2009 Mr Richard Carey Mr Alan Gall Chief Executive Director of Finance",152
Grampian-2008-2009,2008-2009,,pdf_cover,2026-03-13T08:22:10+00:00,Unknown,BALANCE SHEET AS AT 31 MARCH 2009,REMUNERATION REPORT,32,32,"CASH FLOW STATEMENT FOR THE YEAR ENDED 31 MARCH 2009 2008-09 2008-09 2007-08 2007-08 Note £000 £000 £000 £000 NET OPERATING CASHFLOW Net cash (outflow) from operating activities (719,298) (787,479) CAPITAL EXPENDITURE Payments to acquire fixed assets (29,261) (38,466) Receipts from sale of fixed assets 623 232 Net cash (outflow) for capital expenditure (28,638) (38,234) (747,936) Net cash (outflow) before Financing (825,713) FINANCING Funding 19 747,936 825,713 Movement in general fund working capital (1,935) 363 Cash drawn down 746,001 826,076 746,001 Net cash inflow from financing 826,076 (1,935) Increase/(decrease) in cash in year 363 NOTES 1. Reconciliation of operating cost to operating cash flow Net Operating Cost for the year (761,377) (799,699) Expenditure not involving payment of cash 3 33,286 37,983 Net movement on working capital 18 8,793 (25,763) (719,298) Operating cash (outflow) (787,479) 2. Reconciliation of net cash flow to movement in net debt/cash Increase/(decrease) in cash in year 15 (1,935) 363 Net cash at 1 April 15 3,281 1,346 1,346 Net cash at 31 March 1,709",168
