id,x,y,label,text,page,section,category,highlight
Grampian-2024-2025:p0108_001,-1.7839274,5.225956,FINANCIAL STATEMENTS,with the Charities and Trustee Investment (Scotland) Act 2005 and the Charities Accounts (Scotland) Regulations 2006. The accounting policies have been aligned to the policies of the Board for the purposes of consolidat…,108,FINANCIAL STATEMENTS,Financial narrative,False
Grampian-2024-2025:p0108_002,-1.9500537,5.099272,FINANCIAL STATEMENTS,Joint Arrangements each IJB is considered to be a Joint Venture and the primary financial statements have been amended for the additional disclosure required to accurately reflect the interest of IJBs using the equity m…,108,FINANCIAL STATEMENTS,Financial narrative,False
Grampian-2024-2025:p0109_000,-1.6617342,3.580708,FINANCIAL STATEMENTS,6) Funding 6 (a) Grampian Health Board Most of the expenditure of the Health Board as Commissioner is met from funds advanced by the Scottish Government within an approved revenue resource limit (RRL) . Cash drawn down…,109,FINANCIAL STATEMENTS,Financial narrative,False
Grampian-2024-2025:p0109_001,-1.7064729,3.6419156,FINANCIAL STATEMENTS,"for the provision of specific pharmaceutical, dental or ophthalmic services identified by the Scottish Government. Non-discretionary expenditure is disclosed in the accounts and deducted from operating costs charged aga…",109,FINANCIAL STATEMENTS,Financial narrative,False
Grampian-2024-2025:p0109_002,-1.6171829,3.7766817,FINANCIAL STATEMENTS,"NHS Grampian Charity Funds has received its entitlement to the resources, it is probable that the resources will be received and the monetary value of incoming resources can be measured with sufficient reliability. Lega…",109,FINANCIAL STATEMENTS,Financial narrative,False
Grampian-2024-2025:p0110_000,-3.5044863,0.89054996,FINANCIAL STATEMENTS,"7) Property, plant and equipment The treatment of capital assets e.g. Property, Plant and Equipment in the accounts (capitalisation, valuation, depreciation, particulars concerning donated assets) is in accordance with…",110,FINANCIAL STATEMENTS,Financial narrative,False
Grampian-2024-2025:p0110_001,-3.5753126,0.9876192,FINANCIAL STATEMENTS,"or greater than £5,000. In cases where a new hospital would face an exceptional write off of items of equipment costing individually less than £5,000, the Board has the option to capitalise initial revenue equipment cos…",110,FINANCIAL STATEMENTS,Financial narrative,False
Grampian-2024-2025:p0110_002,-3.5797122,0.88078,FINANCIAL STATEMENTS,"building assets are reassessed by valuers under an agreed programme. All property assets are subject to a full professional valuation at least every 5 years, but more frequently should market forces dictate, and adjuste…",110,FINANCIAL STATEMENTS,Financial narrative,False
Grampian-2024-2025:p0111_000,-3.5017097,1.01747,FINANCIAL STATEMENTS," Non-specialised equipment, installations and fittings are valued at fair value, using the most appropriate valuation methodology available. A depreciated historical cost basis is considered an appropriate proxy for fa…",111,FINANCIAL STATEMENTS,Financial narrative,False
Grampian-2024-2025:p0111_001,-3.466284,1.3215854,FINANCIAL STATEMENTS,current value in existing use. Assets have been assessed as surplus where there is no clear plan to bring the asset back into future use as an operational asset. Assets under construction are valued at current cost. No…,111,FINANCIAL STATEMENTS,Financial narrative,False
Grampian-2024-2025:p0111_002,-3.4481466,1.4452479,FINANCIAL STATEMENTS,"can vary significantly as the programme progresses and it is often difficult to accurately analyse work in progress between the aspects of the programme that will deliver future economic benefit, i.e. the capital expend…",111,FINANCIAL STATEMENTS,Financial narrative,False
Grampian-2024-2025:p0112_000,-3.5380776,1.1335543,FINANCIAL STATEMENTS,Permanent decreases in asset values and impairments are charged gross to the Statement of Comprehensive Net Expenditure. Any related balance on the revaluation reserve is transferred to the general fund. Upward movement…,112,FINANCIAL STATEMENTS,Financial narrative,False
Grampian-2024-2025:p0112_001,-3.4259806,0.96076727,FINANCIAL STATEMENTS,"land is considered to have an infinite life and is not depreciated. 2) Property, Plant and Equipment which has been reclassified as ‘Held for Sale’ and non-operational assets which have been declared surplus cease to be…",112,FINANCIAL STATEMENTS,Financial narrative,False
Grampian-2024-2025:p0113_000,-3.1336758,1.2432897,FINANCIAL STATEMENTS,"Vehicles 7-10 Office, information technology, short- life medical and other equipment 5 Specialist Assets 1-20 8) Intangible Assets 8(a) Recognition Intangible assets are non-monetary assets without physical substance w…",113,FINANCIAL STATEMENTS,Financial narrative,False
Grampian-2024-2025:p0113_001,-3.1940708,1.2323962,FINANCIAL STATEMENTS,"as intangible assets. Expenditure on research is not capitalised. Software: Software which is integral to the operation of hardware e.g. an operating system is capitalised as part of the relevant item of property, plant…",113,FINANCIAL STATEMENTS,Financial narrative,False
Grampian-2024-2025:p0114_000,-3.3369303,1.3131934,FINANCIAL STATEMENTS,"8(b) Measurement Valuation: Intangible assets are recognised initially at cost, comprising all directly attributable costs needed to create, produce and prepare the asset to the point that it is capable of operating in…",114,FINANCIAL STATEMENTS,Financial narrative,False
Grampian-2024-2025:p0114_001,-3.4707303,1.5735978,FINANCIAL STATEMENTS,"These measures are a proxy for fair value. Revaluation and impairment: Increases in asset values arising from revaluations are recognised in the revaluation reserve, except where, and to the extent that, they reverse im…",114,FINANCIAL STATEMENTS,Financial narrative,False
Grampian-2024-2025:p0114_002,-3.214378,1.1791735,FINANCIAL STATEMENTS,"for sale’ measured at the lower of their carrying amount or ‘fair value less costs to sell’. Operational assets which are in use delivering front line services or back office functions, and surplus assets with restricti…",114,FINANCIAL STATEMENTS,Financial narrative,False
Grampian-2024-2025:p0115_000,-3.2189314,1.0846028,FINANCIAL STATEMENTS,3) Other intangible assets: amortised over their expected useful life; and 4) Intangible assets which have been reclassified as ‘Held for Sale’ cease to be amortised upon the reclassification. Amortisation is charged on…,115,FINANCIAL STATEMENTS,Financial narrative,False
Grampian-2024-2025:p0115_001,-1.6698349,3.7201645,FINANCIAL STATEMENTS, the sale is expected to be completed within 12 months of the date of classification as ‘Held for Sale’; and  the actions needed to complete the plan indicate it is unlikely that the plan will be dropped or significan…,115,FINANCIAL STATEMENTS,Financial narrative,False
Grampian-2024-2025:p0115_002,-1.5671139,3.9484968,FINANCIAL STATEMENTS,"when scrapping or demolition occurs. 10) Donated Assets Charitable donations and legacies for the benefit of health services in Grampian are generally either made to the NHS Grampian Charity Funds, a separate legal orga…",115,FINANCIAL STATEMENTS,Financial narrative,False
Grampian-2024-2025:p0116_000,-2.447014,0.29758504,FINANCIAL STATEMENTS,"11) Sale of property, plant and equipment, intangible assets and non-current assets held for sale Disposal of non-current assets is accounted for as a reduction to the value of assets equal to the net book value of the…",116,FINANCIAL STATEMENTS,Financial narrative,False
Grampian-2024-2025:p0116_001,-2.3563635,0.23578347,FINANCIAL STATEMENTS,"of contract that are leases in substance are determined by evaluating whether they convey the right to control the use of an identified asset, as represented by rights both to obtain substantially all the economic benef…",116,FINANCIAL STATEMENTS,Financial narrative,False
Grampian-2024-2025:p0116_002,-2.320546,0.048230313,FINANCIAL STATEMENTS,"of the payments for the remaining lease term (as defined above), net of irrecoverable value added tax, discounted either by the rate implicit in the lease, or, where this cannot be determined, the rate advised by HM Tre…",116,FINANCIAL STATEMENTS,Financial narrative,False
Grampian-2024-2025:p0117_000,-2.3897007,0.16042954,FINANCIAL STATEMENTS,"changes in the relevant index, while assets held under peppercorn or nil consideration have been valued using market prices or rentals for equivalent land and properties. The liability is adjusted for the accrual of int…",117,FINANCIAL STATEMENTS,Financial narrative,False
Grampian-2024-2025:p0117_001,-2.4098203,0.53155935,FINANCIAL STATEMENTS,"of the underlying asset, where these are observable; otherwise, it maximises the use of other observable data, including the fair values of similar assets, or prices of contracts for similar non-lease components. In som…",117,FINANCIAL STATEMENTS,Financial narrative,False
Grampian-2024-2025:p0117_002,-2.5286832,0.739049,FINANCIAL STATEMENTS,"‘on-balance sheet’ by the Board. The underlying assets are recognised as Property, Plant and Equipment and Intangible Assets at their fair value. An equivalent liability is recognised in accordance with IFRS 16. Where i…",117,FINANCIAL STATEMENTS,Financial narrative,False
Grampian-2024-2025:p0118_000,-3.3982387,1.6394943,FINANCIAL STATEMENTS,13) Impairment of non-financial assets Assets that are subject to depreciation and amortisation are reviewed for impairment whenever events or changes in circumstances indicate that the carrying amount may not be recove…,118,FINANCIAL STATEMENTS,Financial narrative,False
Grampian-2024-2025:p0118_001,-3.0651088,2.0182338,FINANCIAL STATEMENTS,of the impairment. Impairment losses charged to the Statement of Comprehensive Net Expenditure are deducted from future operating costs to the extent that they are identified as being reversed in subsequent revaluations…,118,FINANCIAL STATEMENTS,Financial narrative,False
Grampian-2024-2025:p0118_002,-3.0531256,2.2766523,FINANCIAL STATEMENTS,of average purchase price is deemed to represent current cost for certain categories of inventories. Work in progress is valued at the cost of the direct materials plus the conversion costs and other costs incurred to b…,118,FINANCIAL STATEMENTS,Financial narrative,False
Grampian-2024-2025:p0119_000,-4.2324333,2.9250793,FINANCIAL STATEMENTS,"17(b) Pension Costs The Board participates in the NHS Superannuation Scheme for Scotland providing defined benefits, where contributions are credited to the Exchequer and are deemed to be invested in a portfolio of Gove…",119,FINANCIAL STATEMENTS,Financial narrative,False
Grampian-2024-2025:p0119_001,-3.9981086,2.9805546,FINANCIAL STATEMENTS,April 2012 and were within 10 years of their normal retirement age. Some members who were close to retirement but did not qualify for full protection will remain in their current section beyond 1 April 2015 and join the…,119,FINANCIAL STATEMENTS,Financial narrative,False
Grampian-2024-2025:p0119_002,-3.2476144,2.9223003,FINANCIAL STATEMENTS,by the Government Actuary who determines the rate of contributions required. The most recent actuarial valuation is published by the Scottish Public Pensions Agency and is available on their website. Additional pension…,119,FINANCIAL STATEMENTS,Financial narrative,False
Grampian-2024-2025:p0119_003,-3.1728492,2.6438792,FINANCIAL STATEMENTS,"all claims notified to the NHS Central Legal Office according to the value of the claim and the probability of settlement. Claims assessed as ‘Category 3’ are deemed most likely and provided for in full, those in ‘Categ…",119,FINANCIAL STATEMENTS,Financial narrative,False
Grampian-2024-2025:p0120_000,-3.0882347,2.7639318,FINANCIAL STATEMENTS,"As a participant in the CNORIS scheme the Board is also liable to meet the cost of contributions to the scheme in future years and is required, additionally, to provide for the Board’s share of the total CNORIS liabilit…",120,FINANCIAL STATEMENTS,Financial narrative,False
Grampian-2024-2025:p0120_001,-3.039688,1.8697096,FINANCIAL STATEMENTS,"does not apply and input tax on purchases is not recoverable. Irrecoverable VAT is charged to the relevant expenditure category or included in the capitalised purchase cost of property, plant and equipment. Where output…",120,FINANCIAL STATEMENTS,Financial narrative,False
Grampian-2024-2025:p0120_002,-2.9792495,1.9119731,FINANCIAL STATEMENTS,"not recognised as assets, but are disclosed in note 14 where an inflow of economic benefits is probable. Contingent liabilities are not recognised, but are disclosed in note 14, unless the probability of a transfer of e…",120,FINANCIAL STATEMENTS,Financial narrative,False
Grampian-2024-2025:p0121_000,-2.912813,1.4855926,FINANCIAL STATEMENTS,"Financial Statements’, requires that they should be adjusted and the basis for adjustment disclosed in a note to the financial statements. 24) Financial Instruments 24(a) Financial assets Business model The Board’s busi…",121,FINANCIAL STATEMENTS,Financial narrative,False
Grampian-2024-2025:p0121_001,-2.9668915,1.4450566,FINANCIAL STATEMENTS,although alternative treatment may be designated where receivables are held to collect principal and interest and/or for sale. (a) Financial assets at fair value through profit or loss This is the default basis for fina…,121,FINANCIAL STATEMENTS,Financial narrative,False
Grampian-2024-2025:p0122_000,-3.1124568,1.6096889,FINANCIAL STATEMENTS,Impairment of financial assets Provisions for impairment of financial assets are made on the basis of expected credit losses. The Board recognises a loss allowance for expected credit losses on financial assets and this…,122,FINANCIAL STATEMENTS,Financial narrative,False
Grampian-2024-2025:p0122_001,-2.9887042,1.4116684,FINANCIAL STATEMENTS,when the rights to receive cash flows from the asset have expired or have been transferred and the Board has transferred substantially all risks and rewards of ownership. (a) Financial assets at fair value through profi…,122,FINANCIAL STATEMENTS,Financial narrative,False
Grampian-2024-2025:p0122_002,-2.9509082,1.4418707,FINANCIAL STATEMENTS,of the asset. (c) Financial assets held at fair value through other comprehensive income Financial assets carried at fair value through other comprehensive income are initially recognised at fair value plus transaction…,122,FINANCIAL STATEMENTS,Financial narrative,False
Grampian-2024-2025:p0123_000,-2.5880642,2.1799047,FINANCIAL STATEMENTS,"24) (b) Financial Liabilities Classification The Board classifies its financial liabilities in the following categories: at fair value through profit or loss, and amortised cost. The Board classifies all financial liabi…",123,FINANCIAL STATEMENTS,Financial narrative,False
Grampian-2024-2025:p0123_001,-2.7241557,2.0749753,FINANCIAL STATEMENTS,"in current liabilities, except for maturities greater than 12 months after the Statement of Financial Position date. These are classified as non-current liabilities. The NHS Board’s financial liabilities held at amortis…",123,FINANCIAL STATEMENTS,Financial narrative,False
Grampian-2024-2025:p0124_000,-2.730316,1.8810868,FINANCIAL STATEMENTS,"25) Segmental reporting Operating segments are reported in a manner consistent with the internal reporting provided to the chief operating decision-maker, who is responsible for allocating resources and assessing perfor…",124,FINANCIAL STATEMENTS,Financial narrative,False
Grampian-2024-2025:p0124_001,-2.8061392,1.8662437,FINANCIAL STATEMENTS,the functional currency at the spot exchange rate on the date of the transaction. Where the Board has assets or liabilities denominated in a foreign currency at the Statement of Financial Position date:  monetary items…,124,FINANCIAL STATEMENTS,Financial narrative,False
Grampian-2024-2025:p0124_002,-2.944866,2.1748128,FINANCIAL STATEMENTS,on non-monetary assets and liabilities are recognised in the same manner as other gains and losses on these items. 28) Third party assets Assets belonging to third parties (such as money held on behalf of patients) are…,124,FINANCIAL STATEMENTS,Financial narrative,False
Grampian-2024-2025:p0125_000,-3.2287922,2.8383458,FINANCIAL STATEMENTS,"concerning the future. The resulting accounting estimates will, by definition, seldom equal the related actual results. The Board makes judgements in applying accounting policies. The estimates, assumptions and judgemen…",125,FINANCIAL STATEMENTS,Financial narrative,False
Grampian-2024-2025:p0125_001,-3.4963455,2.8843765,FINANCIAL STATEMENTS,"and receivable is as shown below: 2024/25 2023/24 £000’s £000’s Provision recognising individual claims 151,621 175,012 against the NHS Board at 31 March (*) Associated CNORIS receivable at 31 March -154,430 -173,829 Th…",125,FINANCIAL STATEMENTS,Financial narrative,False
Grampian-2024-2025:p0125_002,-3.7040684,2.8376708,FINANCIAL STATEMENTS,"liability to pay pensions for these staff depends on a number of complex judgements relating to the discount rates used, the rate at which salaries are projected to increase, changes in retirement ages, mortality rates…",125,FINANCIAL STATEMENTS,Financial narrative,False
Grampian-2024-2025:p0126_000,-3.6491592,2.8269794,FINANCIAL STATEMENTS,The effects on the net pension’s liability of changes in individual assumptions can be measured. The sensitivities regarding the principal assumptions used to measure the scheme liabilities are set out as follows: Appro…,126,FINANCIAL STATEMENTS,Financial narrative,False
Grampian-2024-2025:p0126_001,-3.5384614,2.463297,FINANCIAL STATEMENTS,"and if successful, the pay award is backdated to when their duties changed or 1 April 2023 at the earliest. There is a degree of uncertainty around the level of claims made and those which will be successful. To account…",126,FINANCIAL STATEMENTS,Financial narrative,False
Grampian-2024-2025:p0126_002,-3.8432384,1.0645264,FINANCIAL STATEMENTS,the accrual and provision set aside but have no impact on the Statement of Comprehensive Net Expenditure. Increase in Decrease in Sensitivities at 31 March 2025 Accruals Provision £000’s £000’s Successful claims 5% high…,126,FINANCIAL STATEMENTS,Financial narrative,False
Grampian-2024-2025:p0127_000,-3.7381163,0.96546215,FINANCIAL STATEMENTS,"Carrying value of land, buildings and dwellings is shown below and analysis is shown in note 7. 2024/25 2023/24 £000’s £000’s Land, Buildings & Dwellings 536,357 534,473 NHS Grampian commissions an independent valuation…",127,FINANCIAL STATEMENTS,Financial narrative,False
Grampian-2024-2025:table_p0128,13.297282,7.1317067,FINANCIAL STATEMENTS,Financial table on page 128 (Cash Flow) Contains 65 line items across 8 columns. Column headers: SUMMARYOFCOREREVENUERESOURCEOUTTURN | 20 | 24/25 | 2024/25 | | . Row labels: Netexpenditure; TotalNon-CoreExpenditure(seeb…,128,FINANCIAL STATEMENTS,Financial table,False
Grampian-2024-2025:table_p0129,13.325543,7.4720564,FINANCIAL STATEMENTS,Financial table on page 129 (Balance Sheet) Contains 24 line items across 15 columns. Column headers: | Balances | BalancesM | ovement | Balances | Balances. Row labels: INVENTORIES; BalanceSheet; NetDecrease. Key items…,129,FINANCIAL STATEMENTS,Financial table,False
Grampian-2024-2025:table_p0130,13.288985,7.613675,FINANCIAL STATEMENTS,Financial table on page 130 (Balance Sheet) Contains 24 line items across 14 columns. Column headers: | Balances | BalancesM | ovement | Balances | Balances. Row labels: INVENTORIES; BalanceSheet; NetDecrease. Key items…,130,FINANCIAL STATEMENTS,Financial table,False
Grampian-2024-2025:table_p0131,13.465634,6.994818,FINANCIAL STATEMENTS,Financial table on page 131 (Staff Costs) Contains 9 line items across 3 columns. Row labels: FINANCIALSTATEMENTS; Note3OPERATINGEXPENSES; 3aBOARDSTAFFCOSTS. Key items: 2024/25 | 2023/24; £’000 | £’000. Table (header-in…,131,FINANCIAL STATEMENTS,Financial table,False
Grampian-2024-2025:p0132_000,-1.3091146,3.7637064,FINANCIAL STATEMENTS,"3b. BOARD NON-STAFF OPERATING COSTS 2024/25 2023/24 Notes £’000 £’000 Independent Primary Care Services: General Medical Services 115,004 101,232 Pharmaceutical Services 34,064 33,601 General Dental Services 47,897 39,4…",132,FINANCIAL STATEMENTS,Financial table,False
Grampian-2024-2025:p0132_001,-0.14516477,4.2260747,FINANCIAL STATEMENTS,"and Employers Liability payments (1,135) 34,395 Utilities, rent and other property related costs 44,785 44,211 Purchase, hire, servicing and repair of equipment 28,184 27,663 Costs relating to the provision of training…",132,FINANCIAL STATEMENTS,Financial table,False
Grampian-2024-2025:p0132_002,-0.13422778,4.3352365,FINANCIAL STATEMENTS,"the cost of audits carried out on Catering Quality Management systems to ensure these are maintained at a level to be compliant with ISO 9001 2015; cleaning supplies; purchase, repair and laundry of linen; waste disposa…",132,FINANCIAL STATEMENTS,Financial narrative,False
Grampian-2024-2025:table_p0133,13.381813,7.127544,FINANCIAL STATEMENTS,Financial table on page 133 (Unknown) Contains 17 line items across 3 columns. Row labels: NHSGRAMPIAN; ANNUALREPORTANDACCOUNTSFORYEAR; FINANCIALSTATEMENTS; InformationandStatisticsDivision(ISD)athttp://w; Topics/Financ…,133,FINANCIAL STATEMENTS,Financial table,False
Grampian-2024-2025:table_p0134,13.313949,7.062045,FINANCIAL STATEMENTS,Financial table on page 134 (Unknown) Contains 19 line items across 3 columns. Row labels: FINANCIALSTATEMENTS; Note4OPERATINGINCOME; 4aBOARDOPERATINGINCOME. Key items: 2024/25 | 2023/24; £’000 | £’000. Table (header-in…,134,FINANCIAL STATEMENTS,Financial table,False
Grampian-2024-2025:table_p0135,13.529328,6.9109163,FINANCIAL STATEMENTS,Financial table on page 135 (Provisions) Contains 10 line items across 6 columns. Column headers: | AberdeenshireMentalHealth& | C | entrallyManaged | NhsgCapitalNonClinical | Operational. Row labels: AberdeenCity; £’00…,135,FINANCIAL STATEMENTS,Financial table,False
Grampian-2024-2025:table_p0136,13.459571,7.7503734,FINANCIAL STATEMENTS,Financial table on page 136 (Property) Contains 36 line items across 7 columns. Row labels: NHSGRAMPIAN; ANNUALREPORTANDACCOUNTS; FINANCIALSTATEMENTS; Note6INTANGIBLEASSETS; 2024/25. Key items: ANNUALREPORTANDACCOUNTS |…,136,FINANCIAL STATEMENTS,Financial table,False
Grampian-2024-2025:table_p0137,13.046902,7.706135,FINANCIAL STATEMENTS,Financial table on page 137 (Balance Sheet) Contains 37 line items across 13 columns. Column headers: | Land(includin | gunder( | excludingD | wellings | Transpo. Row labels: Costorvaluation; At1April2024; Additions-pur…,137,FINANCIAL STATEMENTS,Financial table,False
Grampian-2024-2025:table_p0138,13.138221,7.729902,FINANCIAL STATEMENTS,Financial table on page 138 (Balance Sheet) Contains 36 line items across 13 columns. Column headers: | Land(includin | gunder( | excludingD | wellings | Transpo. Row labels: Costorvaluation; At1April2023; Additions-pur…,138,FINANCIAL STATEMENTS,Financial table,False
Grampian-2024-2025:p0139_000,-3.773953,0.90136546,FINANCIAL STATEMENTS,"Note 7b. ASSETS HELD FOR SALE ASSETS HELD FOR SALE - CONSOLIDATED Property, Plant & Equipment Note £000 At 1 April 2024 340 Transfers (to) / from property, plant and equipment 115 Losses recognised on re-measurement of…",139,FINANCIAL STATEMENTS,Financial table,False
Grampian-2024-2025:p0139_001,-3.7554832,0.8791058,FINANCIAL STATEMENTS,"land and buildings which have been taken out of operational use and declared surplus as follows :- Net book value of surplus land valued at open market value at 31 March 3,150 2,730 Net book value of surplus buildings v…",139,FINANCIAL STATEMENTS,Financial narrative,False
Grampian-2024-2025:table_p0140,13.065283,7.661099,FINANCIAL STATEMENTS,"Financial table on page 140 (Property) Contains 29 line items across 6 columns. Row labels: Expenditure; Acquisitionofintangibleassets; Acquisitionofproperty,plantandequipment. Key items: 2024/2 | 5 | 2023/24; Note | £’…",140,FINANCIAL STATEMENTS,Financial table,False
Grampian-2024-2025:table_p0141,13.399721,6.933275,FINANCIAL STATEMENTS,Financial table on page 141 (Provisions) Contains 26 line items across 10 columns. Column headers: | N | HSGrampian | IntraGroup | | . Row labels: Receivablesduewithinoneyear; NHSScotlandBoards. Key items: NHSGrampian |…,141,FINANCIAL STATEMENTS,Financial table,False
Grampian-2024-2025:p0142_000,-2.7839954,2.804518,FINANCIAL STATEMENTS,"9. TRADE AND OTHER RECEIVABLES (Cont) 2024/25 2023/24 Movements on the provision for impairment of receivables are as follows: £’000 £’000 At 1 April 3,882 3,783 Provision for debtors impairment 0 99 Receivables written…",142,FINANCIAL STATEMENTS,Financial table,False
Grampian-2024-2025:p0142_001,-2.7653816,2.7798724,FINANCIAL STATEMENTS,"three months past their due date are not considered impaired. As at 31 March 2025, receivables with a carrying value of £6.1 million (2023-24: £7.2 million) were past their due date but not impaired. The ageing of recei…",142,FINANCIAL STATEMENTS,Financial narrative,False
Grampian-2024-2025:p0142_002,-2.711688,2.7770112,FINANCIAL STATEMENTS,"The credit quality of receivables that are neither past due nor impaired is assessed by reference to external credit ratings where available. Where no external credit rating is available, historical information about co…",142,FINANCIAL STATEMENTS,Financial table,False
