id,x,y,label,text,page,section,category,highlight
Grampian-2014-2015:table_ocr_p0054,4.037479,7.139505,INDEPENDENT AUDITOR'S REPORT,"TABLE_TYPE: financial_core_balance_sheet PAGE: 54 ROTATION: 270 11. (a) PROPERTY, PLANT AND EQUIPMENT (Purchased Assets) Cost or valuation As at ist April 2014 Additions Completions Transfers (to}/from non-current asset…",54,INDEPENDENT AUDITOR'S REPORT,Financial table,False
Grampian-2014-2015:table_ocr_p0055,3.9418235,7.1072984,INDEPENDENT AUDITOR'S REPORT,"TABLE_TYPE: financial_core_balance_sheet PAGE: 55 ROTATION: 270 11, (a) PROPERTY, PLANT AND EQUIPMENT (Purchased Assets) - continued PRIOR YEAR Cost or valuation As at 1st Apri! 2013 Additions Compietions Transfers (to)…",55,INDEPENDENT AUDITOR'S REPORT,Financial table,False
Grampian-2014-2015:table_ocr_p0056,4.2404118,7.0687904,INDEPENDENT AUDITOR'S REPORT,"TABLE_TYPE: scan_table_other PAGE: 56 ROTATION: 270 11. (b) PROPERTY, PLANT AND EQUIPMENT (Donated Assets) Cost or valuation As at 1st April 2014 Additions Revaluation impairment Charge Disposals As at 31st March 2015 D…",56,INDEPENDENT AUDITOR'S REPORT,Financial table,False
Grampian-2014-2015:table_ocr_p0057,4.3396997,7.0547876,INDEPENDENT AUDITOR'S REPORT,"TABLE_TYPE: scan_table_other PAGE: 57 ROTATION: 270 11. (b) PROPERTY, PLANT AND EQUIPMENT (Donated Assets) - continued PRIOR YEAR Cost or valuation As at 1st April 2013 Additions Revaluation Disposals As at 31st March 2…",57,INDEPENDENT AUDITOR'S REPORT,Financial table,False
Grampian-2014-2015:p0058_000,3.3795764,7.2480464,INDEPENDENT AUDITOR'S REPORT,"11.(¢) ASSETS HELD FORSALE Property, Plant & Equipment As at tst April 2014 Transfers from property, plant and equipment ila Disposals for non-current assets held for sale As at 31st March 2015 PRIOR YEAR As at 1st Apri…",58,INDEPENDENT AUDITOR'S REPORT,Financial table,False
Grampian-2014-2015:table_ocr_p0059,4.373046,7.2746267,INDEPENDENT AUDITOR'S REPORT,"TABLE_TYPE: scan_table_other PAGE: 59 ROTATION: 270 41. (d) PROPERTY, PLANT AND EQUIPMENT DISCLOSURES 2015 2014 £7000 £7000 Net book value of property, plant and equipment at 31 March Purchased ila 545,193 533,353 Donat…",59,INDEPENDENT AUDITOR'S REPORT,Financial table,False
Grampian-2014-2015:table_ocr_p0060,3.576194,5.754364,INDEPENDENT AUDITOR'S REPORT,TABLE_TYPE: scan_table_other PAGE: 60 ROTATION: 270 13. TRADE AND OTHER RECEIVABLES Receivables due within one year NHS Scotland Boards NHS Non-Scottish Bodies VAT recoverable Prepayments Accrued income Other Receivable…,60,INDEPENDENT AUDITOR'S REPORT,Financial table,False
Grampian-2014-2015:p0061_000,2.971583,5.711072,INDEPENDENT AUDITOR'S REPORT,13. TRADE AND OTHER RECEIVABLES (Continued) 2015 2014 Movements on the provision for impairment of receivables are as follows: £000 £000 At’ April 552 342 Provision for debtors impairment 15 212 Receivables written off…,61,INDEPENDENT AUDITOR'S REPORT,Financial table,False
Grampian-2014-2015:p0061_001,2.843688,5.634795,INDEPENDENT AUDITOR'S REPORT,"March 2015, receivables with a carrying value of £2.491 million (2014: £4.658 million) were past their due date but not impaired. The ageing of receivables which are past due but not impaired is as follows : 2015 2014 £…",61,INDEPENDENT AUDITOR'S REPORT,Financial narrative,False
Grampian-2014-2015:p0061_002,2.837113,5.6187415,INDEPENDENT AUDITOR'S REPORT,"are neither past due nor impaired is assessed by reference to external credit tatings where available. Where no external credit rating is available, historical information about counterparty default rates is used. Recei…",61,INDEPENDENT AUDITOR'S REPORT,Financial narrative,False
Grampian-2014-2015:table_ocr_p0062,4.024306,6.057676,INDEPENDENT AUDITOR'S REPORT,"TABLE_TYPE: scan_table_other PAGE: 62 ROTATION: 270 14, FINANCIAL ASSETS Stocks and Bonds * Other * TOTAL At 1 April Additions Disposals Impairment recognised in SOCNE Revaluation surplus transfered to equity At 31 Marc…",62,INDEPENDENT AUDITOR'S REPORT,Financial table,False
Grampian-2014-2015:table_ocr_p0063,3.9145505,5.963118,INDEPENDENT AUDITOR'S REPORT,TABLE_TYPE: financial_core_balance_sheet PAGE: 63 ROTATION: 270 15. CASH AND CASH EQUIVALENTS Goverment Banking Service account balance Cash at bank and in hand Cash investments and deposits Total cash and cash equivale…,63,INDEPENDENT AUDITOR'S REPORT,Financial table,False
Grampian-2014-2015:table_ocr_p0064,3.5208652,6.0718546,INDEPENDENT AUDITOR'S REPORT,"TABLE_TYPE: scan_table_other PAGE: 64 ROTATION: 270 16, TRADE AND OTHER PAYABLES Payables due within one year NHS Scotland Boards NHS Non-Scattish Bodies Amounts Payable to General Fund FHS Practitioners Trade Payables…",64,INDEPENDENT AUDITOR'S REPORT,Financial table,False
Grampian-2014-2015:table_ocr_p0065,3.3639154,5.532427,INDEPENDENT AUDITOR'S REPORT,TABLE_TYPE: scan_table_other PAGE: 65 ROTATION: 270 17. PROVISIONS At 1 April 2014 Arising during the year Utilised during the year Reversed unutilised At 31 March 2015 NHS GRAMPIAN Pensions and similar Clinical & Parti…,65,INDEPENDENT AUDITOR'S REPORT,Financial table,False
Grampian-2014-2015:p0066_000,1.8691975,4.4126196,INDEPENDENT AUDITOR'S REPORT,17. PROVISIONS - continued Pensions and similar obligations The Board meets the additional costs of benefits beyond the normal National Health Service Superannuation Scheme for Scotland benefits in respect of employees…,66,INDEPENDENT AUDITOR'S REPORT,Financial narrative,False
Grampian-2014-2015:p0066_001,1.4682117,5.026449,INDEPENDENT AUDITOR'S REPORT,the end of the financial year and other expenditure commitments resulting in a legal or constructive obligation. The posts are all of a fixed term nature and are involved primarily in the provision of research in conjun…,66,INDEPENDENT AUDITOR'S REPORT,Financial narrative,False
Grampian-2014-2015:p0066_002,1.3128723,5.1918745,INDEPENDENT AUDITOR'S REPORT,"As a result of participation in the CNORIS scheme, however, the Board is also required to create a separate related but distinct provision recognising the Board’s share of the total CNORIS liability of NHSScotland (the…",66,INDEPENDENT AUDITOR'S REPORT,Financial narrative,False
Grampian-2014-2015:p0066_003,1.3063928,5.175772,INDEPENDENT AUDITOR'S REPORT,mandatory for all NHS boards in Scotland. The scheme helps Boards manage the financial risks associated with large value settlements through a national risk pooling arrangements for legal claims in relation to clinical…,66,INDEPENDENT AUDITOR'S REPORT,Financial narrative,False
Grampian-2014-2015:table_ocr_p0067,3.9814003,6.4163227,INDEPENDENT AUDITOR'S REPORT,TABLE_TYPE: financial_core_balance_sheet PAGE: 67 ROTATION: 270 18. MOVEMENT ON WORKING CAPITAL BALANCES INVENTORIES Balance Sheet Net Decrease/{increase) TRADE AND OTHER RECEIVABLES Due within one year Que after more t…,67,INDEPENDENT AUDITOR'S REPORT,Financial table,False
Grampian-2014-2015:p0068_000,1.737415,4.8961864,INDEPENDENT AUDITOR'S REPORT,"19, CONTINGENT LIABILITIES AND ASSETS The following contingent liabilities have not been provided for in the Accounts, as explained below ; ; 2015 2014 CONTINGENT LIABILITIES £000 £000 Clinical and medical compensation…",68,INDEPENDENT AUDITOR'S REPORT,Financial narrative,False
Grampian-2014-2015:p0068_001,3.7135532,4.1663337,INDEPENDENT AUDITOR'S REPORT,"Capital Commitments which have not been provided for in the accounts : 2015 2014 Capital Commitments £7000 £7000 Contracted ARI Phase 2 Backlog Maintenance 2,116 10,985 Woodend Hospital Boiler replacement 822 0 ARI Mort…",68,INDEPENDENT AUDITOR'S REPORT,Financial narrative,False
Grampian-2014-2015:p0068_002,3.201774,4.1487737,INDEPENDENT AUDITOR'S REPORT,recent announcement by the Wood foundation of their intention to donate funding of £10m towards development of a multi story car park at the Foresterhill Health campus has been welcomed by NHS Grampian and the project i…,68,INDEPENDENT AUDITOR'S REPORT,Financial narrative,False
Grampian-2014-2015:table_ocr_p0069,3.7139196,7.432603,INDEPENDENT AUDITOR'S REPORT,"TABLE_TYPE: scan_table_other PAGE: 69 ROTATION: 270 21, COMMITMENTS UNDER LEASES 2015 £000 Operating Leases 2014 £°000 Total future minimum lease payments under operating leases are given in the table below for the each…",69,INDEPENDENT AUDITOR'S REPORT,Financial table,False
Grampian-2014-2015:table_ocr_p0070,3.83765,7.165651,INDEPENDENT AUDITOR'S REPORT,"TABLE_TYPE: financial_core_balance_sheet PAGE: 70 ROTATION: 270 22, COMMITMENTS UNDER SERVICE CONCESSION CONTRACTS - On Balance Sheet Service Concession agreements with HUB North of Scotland Ltd for occupancy of the Abe…",70,INDEPENDENT AUDITOR'S REPORT,Financial table,False
Grampian-2014-2015:p0071_000,1.8495822,4.4235883,INDEPENDENT AUDITOR'S REPORT,23. PENSION COSTS NHS Grampian participates in the National Health Service Superannuation Scheme for Scotland which is a notional defined benefit scheme where contributions are credited to the Exchequer and the balance…,71,INDEPENDENT AUDITOR'S REPORT,Financial narrative,False
Grampian-2014-2015:p0071_001,2.1043842,4.258838,INDEPENDENT AUDITOR'S REPORT,"(March 2013: £29.1 billion) with £4.1 billion to be met by employing authorities. Consequently the employers rate of contribution will increase from 13.5% to 14.6% on 1 April 2015. For 2014/15, normal employer contribut…",71,INDEPENDENT AUDITOR'S REPORT,Financial table,False
Grampian-2014-2015:p0071_002,1.5700448,4.0232577,INDEPENDENT AUDITOR'S REPORT,"Net Expenditure and the amounts paid directly. Changes to the scheme were implemented from 1 April 2008. Existing staff, and those joining the scheme up to 31 March 2008, will keep the benefit of the existing scheme but…",71,INDEPENDENT AUDITOR'S REPORT,Financial narrative,False
Grampian-2014-2015:p0071_003,1.5496523,4.0699377,INDEPENDENT AUDITOR'S REPORT,"of half the member's pension. On death in service, the scheme pays a lump-sum benefit of twice pensionable pay and also provides a service enhancement on computing the spouse’s pension. The enhancement depends on length…",71,INDEPENDENT AUDITOR'S REPORT,Financial narrative,False
Grampian-2014-2015:p0071_004,1.6879699,4.010309,INDEPENDENT AUDITOR'S REPORT,"which voluntary early retirement, with a reduced pension, may be taken is 55 years. New 2008 arrangements: The scheme provides benefits on a “final salary” basis at a normal retirement age of 65. Pension will have an ac…",71,INDEPENDENT AUDITOR'S REPORT,Financial narrative,False
Grampian-2014-2015:table_ocr_p0072,3.7998476,6.335176,INDEPENDENT AUDITOR'S REPORT,TABLE_TYPE: financial_core_balance_sheet PAGE: 72 ROTATION: 270 24. FINANCIAL INSTRUMENTS a FINANCIAL INSTRUMENTS BY CATEGORY FINANCIAL ASSETS At34 March 2015 Assets per balance sheet Investments Trade and other receiva…,72,INDEPENDENT AUDITOR'S REPORT,Financial table,False
Grampian-2014-2015:p0073_000,2.4897985,5.587736,INDEPENDENT AUDITOR'S REPORT,24. FINANCIAL INSTRUMENTS - continued b) FINANCIAL RISK FACTORS Exposure to Risk The NHS Board’s activities expose it to a variety of financial risks: Credit risk — the possibility that other parties might fall to pay a…,73,INDEPENDENT AUDITOR'S REPORT,Financial narrative,False
Grampian-2014-2015:p0073_001,2.4711108,5.659819,INDEPENDENT AUDITOR'S REPORT,"arises from cash and cash equivalents, deposits with banks and other institutions, as well as credit exposures to customers, including outstanding receivables and committed transactions. For banks and other institutions…",73,INDEPENDENT AUDITOR'S REPORT,Financial narrative,False
Grampian-2014-2015:p0073_002,3.06299,5.925644,INDEPENDENT AUDITOR'S REPORT,only for the purposes specified and up to the amounts specified in the Budget Act. The Act also specifies an overall cash authorisation to operate for the financial year. The NHS Board is not therefore exposed to signif…,73,INDEPENDENT AUDITOR'S REPORT,Financial table,False
Grampian-2014-2015:p0074_000,2.4199905,5.5406985,INDEPENDENT AUDITOR'S REPORT,24. FINANCIAL INSTRUMENTS - continued b) FINANCIAL RISK FACTORS - continued e Market Risk The NHS Board has no power to borrow or invest surplus funds. Financial assets and liabilities are generated by day-to-day operat…,74,INDEPENDENT AUDITOR'S REPORT,Financial narrative,False
Grampian-2014-2015:p0074_001,2.2666245,5.33834,INDEPENDENT AUDITOR'S REPORT,met by the supplier. NHS Grampian will be exposed to foreign exchange fluctuations only where unforeseen delays in project timescales arise which are not contractually the responsibility of the supplier. iii) Price Risk…,74,INDEPENDENT AUDITOR'S REPORT,Financial table,False
Grampian-2014-2015:p0074_002,2.8172426,4.172386,INDEPENDENT AUDITOR'S REPORT,"In certain circumstances, usually during period of long term care, NHS Grampian is responsible for the safekeeping and administration of patient's own funds during their stay in hospital. These funds are accounted for a…",74,INDEPENDENT AUDITOR'S REPORT,Financial narrative,False
Grampian-2014-2015:table_ocr_p0075,3.8838563,5.331719,INDEPENDENT AUDITOR'S REPORT,"TABLE_TYPE: exit_packages PAGE: 75 ROTATION: 270 27. EXIT PACKAGES CURRENT YEAR 2015 Exit package cost band <£10,000 £10,000 - £25,000 £25,000 - £50,000 £50,000 - £400,000 £100,000- £150,000 £150,000- £200,000 >£200,000…",75,INDEPENDENT AUDITOR'S REPORT,Financial table,False
Grampian-2014-2015:table_ocr_p0076,3.9796083,5.2582707,INDEPENDENT AUDITOR'S REPORT,"TABLE_TYPE: financial_core_balance_sheet PAGE: 76 ROTATION: 270 29a. RESTATED SOCNE Previous Adjustment Adjustment These Accounts 1 2 Accounts £’000 £000 £000 £7000 Clinical Services Costs Hospital and Community 771,599…",76,INDEPENDENT AUDITOR'S REPORT,Financial table,False
Grampian-2014-2015:p0077_000,3.2124088,2.125597,INDEPENDENT AUDITOR'S REPORT,"Gramplan Health Board DIRECTION BY THE SCOTTISH MINISTERS. 1. The Scottish Ministers, in pursuance of sections 86(1), (1B) and (3) of the National Health Services. (Scotland) Act 1978, hereby give the following directio…",77,INDEPENDENT AUDITOR'S REPORT,Financial narrative,False
