id,x,y,label,text,page,section,category,highlight
Grampian-2020-2021:p0032_001,7.912332,-0.3911728,PERFORMANCE REPORT,Elective Care services project (£1.6 million). Now known as the National Treatment and Diagnostic Centre – Grampian - Completion of Ligature reduction works in Dunnotar and Fyvie wards and continuation of the roll out o…,32,PERFORMANCE REPORT,Clinical performance,False
Grampian-2020-2021:p0032_002,7.9839044,-0.33231556,PERFORMANCE REPORT,new pressure relieving mattresses; Other areas of investment included: - £0.5 million on GP Sustainability Loans in line with the Scottish Government’s GP Premises protocol; - £0.6 million on replacement of water treatm…,32,PERFORMANCE REPORT,Clinical performance,False
Grampian-2020-2021:p0033_000,11.399161,-1.2176489,PERFORMANCE REPORT,7. Financial Performance and Position (cont) 7.2 Grampian Health Board performance against statutory financial targets - £0.5 m contribution towards the North of Scotland Integrated Mortuary project; - £1.8 million to c…,33,PERFORMANCE REPORT,Financial narrative,False
Grampian-2020-2021:p0033_001,11.549713,-1.2782243,PERFORMANCE REPORT,"the confidential routes that are available to report suspected fraud, bribery or corruption. A range of fraud awareness initiatives were progressed during the year including targeted training in relation to Sickness Abs…",33,PERFORMANCE REPORT,Clinical performance,False
Grampian-2020-2021:p0033_002,10.094917,1.1961071,PERFORMANCE REPORT,"result, there is insufficient information available to provide a robust and meaningful extrapolation of the available data covering the year to 31 December 2020. In the year to December 2019, the extrapolation of the sa…",33,PERFORMANCE REPORT,Clinical performance,False
Grampian-2020-2021:p0034_000,8.653797,-2.0316603,PERFORMANCE REPORT,10. Payment Policy NHS Grampian is committed to supporting the Scottish Government in helping businesses during the current economic situation by paying bills more quickly. The intention is to achieve payment of all und…,34,PERFORMANCE REPORT,Clinical performance,False
Grampian-2020-2021:p0034_001,8.459721,-2.2031567,PERFORMANCE REPORT,"the wider community very seriously. The challenge for the Board is to maintain the excellent progress achieved to date, taking forward work for all 9 “protected characteristics” which make up equality and diversity duri…",34,PERFORMANCE REPORT,Governance,False
Grampian-2020-2021:p0034_002,8.468809,-2.2124012,PERFORMANCE REPORT,has done in the last 2 years to make equality and diversity an integral part of the way we function as an organisation. NHS Grampian has also published a range of other non-Statutory Equality and Diversity Monitoring Re…,34,PERFORMANCE REPORT,Clinical performance,False
Grampian-2020-2021:p0035_000,8.348374,-2.3457236,PERFORMANCE REPORT,11 Social Matters (Cont) Human Trafficking A current serious social issue in Grampian is Human Trafficking. This has been covered in detail at every training session for the last 5 years. We use anonymised local example…,35,PERFORMANCE REPORT,Clinical performance,False
Grampian-2020-2021:p0035_001,8.096592,-2.6593451,PERFORMANCE REPORT,"the needs of New Syrian migrants, who have settled in Grampian. We have included the topic of social cohesion at every training session for the last 5 years. Consultation and involvement events with our local ethnic com…",35,PERFORMANCE REPORT,Clinical performance,False
Grampian-2020-2021:p0035_002,8.057927,-2.732173,PERFORMANCE REPORT,"we provide a wide range of information in the main local ethnic community language to participants and encourage them to register with their local GP. In 2020/21, we have put in a massive effort to ensure that accurate…",35,PERFORMANCE REPORT,Clinical performance,False
Grampian-2020-2021:p0036_000,11.556908,-1.687199,ACCOUNTABILITY REPORT,"12. Sustainability and the Environment The Climate Change (Scotland) Act 2009 set outs measures adopted by the Scottish Government to reduce emissions in Scotland by at least 80% by 2050. In 2015, an Order was introduce…",36,ACCOUNTABILITY REPORT,Governance,False
Grampian-2020-2021:p0037_000,10.97172,-0.3061135,ACCOUNTABILITY REPORT,1. Naming Convention NHS Grampian is the common name of Grampian Health Board. NHS Grampian Endowment Funds is the common name for the Grampian Health Board Endowment Funds. 2. Date of Issue The Accountable Officer auth…,37,ACCOUNTABILITY REPORT,Governance,False
Grampian-2020-2021:p0037_001,11.849999,-1.6700128,ACCOUNTABILITY REPORT,"each IJB is considered to be a Joint Venture and under IAS 28 – Investments in Associates and Joint arrangements, the basis of consolidation used is the equity method of accounting. The Annual Accounts and Notes have be…",37,ACCOUNTABILITY REPORT,Financial narrative,False
Grampian-2020-2021:p0037_002,11.539501,-1.8455476,ACCOUNTABILITY REPORT,"to 2021/22, the Auditor General appointed Gillian Woolman, Audit Director, Audit Scotland, to undertake the audit of Grampian Health Board. The original 5-year term of the appointment was extended by a further year on 9…",37,ACCOUNTABILITY REPORT,Governance,False
Grampian-2020-2021:p0038_000,10.767495,-0.7971764,ACCOUNTABILITY REPORT,"5. Appointment of Auditor (cont) The Trustees of NHS Grampian Endowment Funds appointed Azets as external auditor, for the financial year 2020/21. 6. Role of the Board Grampian Health Board was established in 1972 under…",38,ACCOUNTABILITY REPORT,Financial narrative,False
Grampian-2020-2021:p0038_001,10.710428,-0.31433147,ACCOUNTABILITY REPORT,experience of their local NHS system; f) promote integrated health and community planning by working closely with other local organisations; and g) provide a single focus of accountability for the performance of the loc…,38,ACCOUNTABILITY REPORT,Governance,False
Grampian-2020-2021:p0038_002,10.483603,-0.34668875,ACCOUNTABILITY REPORT,"any other matters relating to the health service as the trustees see fit. Under the terms of the Public Bodies (Joint Working) (Scotland) Act 2014 three Integration Joint Boards (IJBs), Moray, Aberdeen City and Aberdeen…",38,ACCOUNTABILITY REPORT,Governance,False
Grampian-2020-2021:p0039_000,10.149722,-1.6923417,ACCOUNTABILITY REPORT,7. Board Membership Board members are selected and appointed through the public appointment process on the basis of their current organisational roles and/or particular expertise which enables them to contribute to the…,39,ACCOUNTABILITY REPORT,Governance,False
Grampian-2020-2021:p0039_001,10.060022,-1.8524642,ACCOUNTABILITY REPORT,Davidson Mr Albert Donald Ms Joyce Duncan Mrs Luan Grugeon Councillor Ryan Houghton (from 25 May 2021) Miss Rachael Little Councillor Douglas Lumsden (to 19 March 2021) Councillor Shona Morrison Mr Roderick Murray (from…,39,ACCOUNTABILITY REPORT,Governance,False
Grampian-2020-2021:p0040_000,10.87425,-0.86187375,ACCOUNTABILITY REPORT,12. Board Members’ Interests The Register of Interests of Board Members may be inspected by members of the public on the NHS Grampian Website at the following link https://www.nhsgrampian.org/about- us/grampian-nhs-boar…,40,ACCOUNTABILITY REPORT,Governance,False
Grampian-2020-2021:p0040_001,11.807984,-1.9122928,ACCOUNTABILITY REPORT,"member of an IJB that required disclosure in the accounts under IAS 24. 13. Disclosure of Information to Auditor The directors who held office at the date of approval of this Directors’ Report confirm that, so far as th…",40,ACCOUNTABILITY REPORT,Financial narrative,False
Grampian-2020-2021:p0040_002,11.728069,-1.7942339,ACCOUNTABILITY REPORT,"2010 Sections 31 and 32 of the Public Services Reform (Scotland) Act 2010 impose duties on NHS Grampian to publish information on expenditure, economic sustainability and efficiency as soon as is reasonably practicable…",40,ACCOUNTABILITY REPORT,Financial narrative,False
Grampian-2020-2021:p0041_000,11.666595,-1.619403,ACCOUNTABILITY REPORT,"ii) STATEMENT OF THE CHIEF EXECUTIVE’S RESPONSIBILITIES AS THE ACCOUNTABLE OFFICER OF THE HEALTH BOARD Under Section 15 of the Public Finance and Accountability (Scotland) Act, 2000, The Principal Accountable Officer (P…",41,ACCOUNTABILITY REPORT,Financial narrative,False
Grampian-2020-2021:p0041_001,11.44632,-1.7832524,ACCOUNTABILITY REPORT,▪ State whether applicable accounting standards as set out in the Government Financial Reporting Manual have been followed and disclose and explain any material departures; and ▪ Prepare the accounts on a going concern…,41,ACCOUNTABILITY REPORT,Financial narrative,False
Grampian-2020-2021:p0042_000,11.5850725,-1.597918,ACCOUNTABILITY REPORT,"iii) STATEMENT OF HEALTH BOARD MEMBERS’ RESPONSIBILITIES IN RESPECT OF THE ACCOUNTS Under the National Health Service (Scotland) Act 1978, the Health Board is required to prepare accounts in accordance with the directio…",42,ACCOUNTABILITY REPORT,Financial narrative,False
Grampian-2020-2021:p0042_001,11.026475,-1.7909317,ACCOUNTABILITY REPORT,concern basis unless it is inappropriate to presume that the Health Board will continue to operate. The Health Board members are responsible for ensuring that proper accounting records are maintained which disclose with…,42,ACCOUNTABILITY REPORT,Financial narrative,False
Grampian-2020-2021:p0043_000,9.462859,-2.6168873,ACCOUNTABILITY REPORT,"iv) GOVERNANCE STATEMENT 1. Strategic Vision, Themes and Values The Grampian Clinical Strategy for 2016-2021 sets out our aspiration to improve population health and health equality. The Clinical Strategy is being revie…",43,ACCOUNTABILITY REPORT,Financial narrative,False
Grampian-2020-2021:p0043_001,10.495564,-1.686839,ACCOUNTABILITY REPORT,"Participation Committee (see page 43 below) has a key role ensuring that patients, carers and the general public are effectively informed about and involved in services and the strategic agenda in a variety of ways. 2.…",43,ACCOUNTABILITY REPORT,Financial narrative,False
Grampian-2020-2021:p0044_000,10.551114,-0.4216608,ACCOUNTABILITY REPORT,"In addition, as explained in the Directors’ Report on page 34, all Board members are Trustees of the NHS Grampian Endowment Funds and are accountable in law for the discharge of the key duties of a charity Trustee as de…",44,ACCOUNTABILITY REPORT,Financial narrative,False
Grampian-2020-2021:p0044_001,10.543098,-1.2715803,ACCOUNTABILITY REPORT,"care services to each IJB. The delegation of services is governed by an integration scheme agreed by both partners and Executive Director and Non-Executive members of Grampian Health Board are appointed, to represent th…",44,ACCOUNTABILITY REPORT,Financial narrative,False
Grampian-2020-2021:p0044_003,10.423171,-1.1358162,ACCOUNTABILITY REPORT,of control over each IJB is shared equally between Grampian Health Board and the relevant Local Authority. The Board’s performance management arrangements reflect those services delegated to the IJBs and the,44,ACCOUNTABILITY REPORT,Financial narrative,False
Grampian-2020-2021:p0044_004,10.208397,-1.755455,ACCOUNTABILITY REPORT,Chief Officers of each IJB attend each meeting of Grampian Health Board and each of the Board’s key Governance Committees as required. The Board operates within an assurance framework which delegates specific governance…,44,ACCOUNTABILITY REPORT,Financial narrative,False
Grampian-2020-2021:p0044_005,10.0847,-1.7428957,ACCOUNTABILITY REPORT,"has an important role in ensuring consistency of policy and equity of treatment of staff across the local NHS system, including remuneration issues, where they are not already covered by existing arrangements at nationa…",44,ACCOUNTABILITY REPORT,Financial narrative,False
Grampian-2020-2021:p0045_000,9.442465,-1.841195,ACCOUNTABILITY REPORT,Remuneration Committee The Remuneration Committee’s main duties are as follows: ➢ Ensuring that arrangements are in place to comply with NHS Grampian policy and Scottish Government direction and guidance for determining…,45,ACCOUNTABILITY REPORT,Financial narrative,False
Grampian-2020-2021:p0045_001,10.376315,-1.7566088,ACCOUNTABILITY REPORT,"other staff groups, e.g. discretionary points for medical consultants. Membership : Mr Jonathan Passmore (Chair to 13 September 2020), Ms Joyce Duncan (Chair from 14 September 2020), Mrs Rhona Atkinson, Mr Albert Donald…",45,ACCOUNTABILITY REPORT,Financial narrative,False
Grampian-2020-2021:p0045_002,10.314889,-1.6450948,ACCOUNTABILITY REPORT,"governance matters are observed. Membership : Mr Sandy Riddell (Chair), Councillor Isobel Davidson, Miss Rachael Little, Councillor Douglas Lumsden (to 19 March 2021) and Dr John Tomlinson. Performance Governance Commit…",45,ACCOUNTABILITY REPORT,Financial narrative,False
Grampian-2020-2021:p0046_000,10.675646,-0.961616,ACCOUNTABILITY REPORT,"Engagement and Participation Committee The Engagement and Participation Committee’s role is to provide strategic direction, quality assurance and monitoring of progress on all aspects of engagement and participation wit…",46,ACCOUNTABILITY REPORT,Financial narrative,False
Grampian-2020-2021:p0046_001,10.548078,-2.1987298,ACCOUNTABILITY REPORT,"Membership : Mrs Luan Grugeon (Chair), Mr Alan Gray, Professor Siladitya Bhattacharya, Miss Rachael Little, Councillor Douglas Lumsden (to 19 March 2021) and Dr John Tomlinson. 3. Scope of Responsibility As Accountable…",46,ACCOUNTABILITY REPORT,Financial narrative,False
Grampian-2020-2021:p0046_002,10.536952,-2.4397314,ACCOUNTABILITY REPORT,"me to discharge my responsibilities as Accountable Officer, the following governance arrangements and processes are embedded as part of our operating environment; as reflected in this statement these arrangements were a…",46,ACCOUNTABILITY REPORT,Financial narrative,False
Grampian-2020-2021:p0047_000,10.678603,-2.3763382,ACCOUNTABILITY REPORT,"- Scheme of Delegation, Standing Orders and Standing Financial Instructions approved by the Board are subject to regular review to assess whether they are relevant and fully reflective of both best practice and mandator…",47,ACCOUNTABILITY REPORT,Financial narrative,False
Grampian-2020-2021:p0047_001,10.356618,-2.17587,ACCOUNTABILITY REPORT,"from the chairs of the performance governance, engagement and participation, staff governance, clinical governance, audit committee and from the Chair of the Endowment Trustees concerning any significant matters on gove…",47,ACCOUNTABILITY REPORT,Financial narrative,False
Grampian-2020-2021:p0047_002,10.516898,-2.122227,ACCOUNTABILITY REPORT,and staff partnership forum with staff side representation embedded in all key management teams and a dedicated full time Employee Director who is a member of the Board; - Regular review of priorities for infrastructure…,47,ACCOUNTABILITY REPORT,Financial narrative,False
Grampian-2020-2021:p0048_001,10.647249,-1.7651322,ACCOUNTABILITY REPORT,through participation by the IJB Board members and the Chief Executives of each of the partner organisations in the regular meetings between the Chief Executives of all Public Sector organisations in Grampian and perfor…,48,ACCOUNTABILITY REPORT,Financial narrative,False
Grampian-2020-2021:p0048_002,9.850486,-2.5188217,ACCOUNTABILITY REPORT,review meetings with each IJB Chief Officer to further develop and drive improvement through integrated service delivery; - A patient feedback service to record and investigate complaints and policies to protect employe…,48,ACCOUNTABILITY REPORT,Financial narrative,False
Grampian-2020-2021:p0048_003,10.005566,-2.8063328,ACCOUNTABILITY REPORT,global pandemic and the guidance and direction provided by the Scottish Government Health and Social Care Directorate. The primary aim of the Board during the period of the COVID-19 -19 pandemic was to ensure all resour…,48,ACCOUNTABILITY REPORT,Financial narrative,False
Grampian-2020-2021:p0048_004,10.556878,-2.3238106,ACCOUNTABILITY REPORT,"interactions and work with Board members would be different in the coming weeks. - The Board required that the organisation continue to operate within an appropriate legal framework, acting in the best interests of the…",48,ACCOUNTABILITY REPORT,Financial narrative,False
Grampian-2020-2021:p0049_000,9.818527,-2.6003814,ACCOUNTABILITY REPORT,"4.1 Impact of COVID-19 on Board and Committee Governance (cont) - The Board needed to ensure it recognised the difficult decisions that would be made regarding provision of care, deployment of services and the reaction…",49,ACCOUNTABILITY REPORT,Financial narrative,False
Grampian-2020-2021:p0049_001,9.936222,-2.5399237,ACCOUNTABILITY REPORT,"from our non-executives in this capacity was important in both the COVID-19 response and recovery phases of our work. 4.1.1 Scottish Government guidance to NHS Boards On 25 March 2020, the interim NHS Scotland Director…",49,ACCOUNTABILITY REPORT,Financial narrative,False
Grampian-2020-2021:p0049_002,10.18027,-2.2509913,ACCOUNTABILITY REPORT,"Board’s should be mindful of the requirements in legislation and within existing Standing Orders. Later in the financial year, Board Chairs were encouraged to implement appropriate and proportionate governance arrangeme…",49,ACCOUNTABILITY REPORT,Financial narrative,False
Grampian-2020-2021:p0050_000,10.147553,-2.532904,ACCOUNTABILITY REPORT,4.1 Impact of COVID-19 on Board and Committee Governance (cont) 4.1.2 Changes made to the operation of the Board business (cont) The Public Bodies (Admissions to Meetings) Act 1960 requires NHS Board meetings to be held…,50,ACCOUNTABILITY REPORT,Financial narrative,False
Grampian-2020-2021:p0050_001,10.179925,-2.50544,ACCOUNTABILITY REPORT,"protect public health. In light of the preventative measures put in place across the country, including social distancing, the Board approved a resolution to not convene its Board meetings in public while the organisati…",50,ACCOUNTABILITY REPORT,Financial narrative,False
Grampian-2020-2021:p0050_002,10.2637825,-2.5457044,ACCOUNTABILITY REPORT,"present with others in such a place, e.g. by videoconferencing’ . The Board also functioned in accordance with its Standing Orders throughout the period other than for the time period for calling of meetings, quoracy an…",50,ACCOUNTABILITY REPORT,Financial narrative,False
Grampian-2020-2021:p0050_003,10.562566,-2.021798,ACCOUNTABILITY REPORT,"the Board unless there are present, and entitled to vote, at least six members including the Chairman, two Executive Members and two Non-Executive Members. If the Chairman and Vice Chair are not present, voting Board Me…",50,ACCOUNTABILITY REPORT,Financial narrative,False
Grampian-2020-2021:table_p0051,3.4894462,3.866714,ACCOUNTABILITY REPORT,Financial table on page 51 (Staff Costs) Contains 9 line items across 5 columns. Column headers: | ApriltoOctober2020 | OctobertoDecember2020 | JanuarytoJune2021 | JulytoDecember2021. Row labels: Boardmeeting; Boardsemi…,51,ACCOUNTABILITY REPORT,Financial table,False
Grampian-2020-2021:table_p0052,3.544767,3.905514,ACCOUNTABILITY REPORT,Financial table on page 52 (Unknown) Contains 10 line items across 5 columns. Column headers: Stakeholdersengagement | ApriltoOctober2020 | OctobertoDecember2020 | JanuarytoJune2021 | JulytoDecember2021. Row labels: MSP…,52,ACCOUNTABILITY REPORT,Financial table,False
Grampian-2020-2021:p0053_000,8.549981,-3.3456662,ACCOUNTABILITY REPORT,4.1 Impact of COVID-19 on Board and Committee Governance (cont) 4.4 Revised management arrangements implemented to respond to COVID-19 (cont) These plans set out in detail the arrangements implemented as part of our who…,53,ACCOUNTABILITY REPORT,Financial narrative,False
Grampian-2020-2021:p0054_000,10.488971,-3.404797,ACCOUNTABILITY REPORT,4.1 Impact of COVID-19 on Board and Committee Governance (cont) 4.4 Revised management arrangements implemented to respond to COVID-19 (cont) 4.4.2 Operation Snowdrop During Operation Snowdrop the following arrangements…,54,ACCOUNTABILITY REPORT,Financial narrative,False
Grampian-2020-2021:p0054_001,10.9821205,-2.7543046,ACCOUNTABILITY REPORT,"nature and extent of risks, and manage risks efficiently, effectively and economically. The system of internal control is designed to manage rather than eliminate the risk of failure to achieve the organisation’s aims a…",54,ACCOUNTABILITY REPORT,Financial narrative,False
Grampian-2020-2021:p0055_000,10.857557,-3.0579464,ACCOUNTABILITY REPORT,6. Risk Management Arrangements All NHS Scotland bodies are subject to the requirements of the SPFM and must operate a risk management strategy in accordance with relevant guidance issued by the Scottish Ministers. The…,55,ACCOUNTABILITY REPORT,Financial narrative,False
Grampian-2020-2021:p0055_001,10.927333,-3.1211789,ACCOUNTABILITY REPORT,"actions for risks that fall within their remit. In November 2020, the board implemented a revised risk management protocol aimed at providing guidance for the management of risk throughout the risk management lifecycle…",55,ACCOUNTABILITY REPORT,Financial narrative,False
Grampian-2020-2021:p0056_000,10.872088,-3.1842237,ACCOUNTABILITY REPORT,"6. Risk Management Arrangements (cont) - The supporting organisational arrangements for the identification, assessment and reporting of risks, - The steps to be taken to develop and implement mitigating action, and - Us…",56,ACCOUNTABILITY REPORT,Financial narrative,False
Grampian-2020-2021:p0056_001,10.925003,-3.2510817,ACCOUNTABILITY REPORT,"by email reminders o Flattened hierarchy - Implementation of a short, simplified and easily accessible training package covering the risk management lifecycle. 6.1 Performance, Assurance, Improvement and Risk (PAIR) pro…",56,ACCOUNTABILITY REPORT,Financial narrative,False
Grampian-2020-2021:p0057_000,10.775782,-3.2058167,ACCOUNTABILITY REPORT,6. Risk Management Arrangements (cont) Each of the SLT sub-groups produce assurance summaries on a two- monthly cycle for review and challenge by the SLT and thereafter to be presented at the relevant committee. The rep…,57,ACCOUNTABILITY REPORT,Financial narrative,False
Grampian-2020-2021:p0057_001,10.645841,-3.4699492,ACCOUNTABILITY REPORT,"of cross-system clinical risks and ensuring issues are appropriately classified, escalated and prioritised through system wide discussion and appropriately managed performance against National standards for example time…",57,ACCOUNTABILITY REPORT,Financial narrative,False
Grampian-2020-2021:p0057_002,10.234309,-3.1616468,ACCOUNTABILITY REPORT,of internal control and the key risks identified in the strategic risk register on page 15 above :- 7.1 Board Development and Governance 7.1.1 COVID-19 Pandemic Following the declaration of COVID-19 as a worldwide pande…,57,ACCOUNTABILITY REPORT,Financial narrative,False
Grampian-2020-2021:p0058_000,11.000012,-3.7038434,ACCOUNTABILITY REPORT,7. Internal Control Matters (cont) 7.1.2 Heightened Cyber Security and Fraud risks Throughout the COVID-19 response and recovery period the Board have been cognisant of the heightened risk of fraud and the increased num…,58,ACCOUNTABILITY REPORT,Financial narrative,False
Grampian-2020-2021:p0058_001,10.896388,-3.747052,ACCOUNTABILITY REPORT,"public sector, is distributed internally to members of the Board’s Security Group. ➢ The Audit Committee hosted a development session in January 2021 focused on the evolving nature of increased cyber security risk durin…",58,ACCOUNTABILITY REPORT,Financial narrative,False
Grampian-2020-2021:p0058_002,10.152292,-2.3275433,ACCOUNTABILITY REPORT,"recovery plans, these matters were delegated upwards to either the Deputy Director of Finance or the Assistant Director of Finance to ensure that key risk areas such as procurement without competition, payment in advanc…",58,ACCOUNTABILITY REPORT,Financial narrative,False
Grampian-2020-2021:p0059_000,10.334817,-2.7929292,ACCOUNTABILITY REPORT,7. Internal Control Matters (cont) 7.1.3 Other matters affecting Board Development and Governance (cont) ➢ Our programme of system leadership development ensures that staff across NHS Grampian are supported to develop t…,59,ACCOUNTABILITY REPORT,Financial narrative,False
Grampian-2020-2021:p0059_001,10.407361,-2.8200295,ACCOUNTABILITY REPORT,"Workforce and Sustainability PAIR subgroups and a reporting method is in place to ensure the Staff Governance Committee are also properly engaged in the process. ➢ Continuation of the action plan, under the guidance of…",59,ACCOUNTABILITY REPORT,Financial narrative,False
Grampian-2020-2021:p0059_002,9.9154415,-3.0642374,ACCOUNTABILITY REPORT,"easily visualise the progress of the theatre lists on a given day. ➢ Continued progress with the programme of ligature reduction works in all acute mental health admission wards, under the oversight of a dedicated progr…",59,ACCOUNTABILITY REPORT,Financial narrative,False
Grampian-2020-2021:p0059_003,9.869244,-3.0260446,ACCOUNTABILITY REPORT,"necessary to reconfigure the provision of Paediatric and Maternity Services at Dr Gray’s Hospital in Elgin (DGH). This involved aspects of the service, which required specialist intervention, transferring to the Aberdee…",59,ACCOUNTABILITY REPORT,Financial narrative,False
Grampian-2020-2021:p0060_000,9.827156,-3.0225163,ACCOUNTABILITY REPORT,"7. Internal Control Matters (cont) 7.2 Quality and Safety of Care ▪ As an additional source of assurance and recognising the heightening clinical safety concerns both locally and nationally, the Board agreed to commissi…",60,ACCOUNTABILITY REPORT,Financial narrative,False
Grampian-2020-2021:p0060_001,9.75696,-3.0519094,ACCOUNTABILITY REPORT,"be led by the Chief Executive of NHS Borders with the remit to “work with NHS Grampian, NHS Highland and stakeholders with an interest in local maternity services to describe the best obstetric model, that will provide…",60,ACCOUNTABILITY REPORT,Financial narrative,False
