id,x,y,label,text,page,section,category,highlight
Grampian-2024-2025:p0074_000,-1.4073137,7.0245323,ACCOUNTABILITY REPORT,A CORPORATE GOVERNANCE REPORT  Governance arrangements for our major capital projects now include the requirement for an independent external design review following recent learning from other large health sector proje…,74,ACCOUNTABILITY REPORT,Governance,False
Grampian-2024-2025:p0074_001,-0.753546,7.143198,ACCOUNTABILITY REPORT,"including IJB Chief Officers, established a Strategic Change Board (SCB) to support the coordination and delivery of strategic change activity across the system. The SCB brings together programmes of work that require c…",74,ACCOUNTABILITY REPORT,Governance,False
Grampian-2024-2025:p0074_002,-0.71715367,7.2453074,ACCOUNTABILITY REPORT,"a consistent and practical approach to how change is led, delivered and embedded across the system. The Route Map will be considered by the NHS Grampian Board in summer 2025. It is intended to support coordinated, long-…",74,ACCOUNTABILITY REPORT,Governance,False
Grampian-2024-2025:p0075_000,-0.8757547,7.4196057,ACCOUNTABILITY REPORT,"A CORPORATE GOVERNANCE REPORT The strategy will be achieved by developing systems, processes and digital solutions that support staff and citizens having secure access to the information they need, when and where they n…",75,ACCOUNTABILITY REPORT,Governance,False
Grampian-2024-2025:p0075_001,-0.8267173,7.345457,ACCOUNTABILITY REPORT,"early diagnostics and reporting. This resulted in a reduction in the time it takes to get 95% of people to treatment by 30 days, and identification of 12% more treatable cancers.  We evaluated whether we could replace…",75,ACCOUNTABILITY REPORT,Governance,False
Grampian-2024-2025:p0075_002,-1.3098271,8.286655,ACCOUNTABILITY REPORT,"care. This is a complex programme involving almost every health board in Scotland, multiple industry partners and universities. Live flights and simulations focused on a wide range of use cases including the delivery of…",75,ACCOUNTABILITY REPORT,Governance,False
Grampian-2024-2025:p0076_000,-1.168897,7.5926447,ACCOUNTABILITY REPORT,A CORPORATE GOVERNANCE REPORT The staffing report on Page 87 provides more detail on the various initiatives underway. 7.6 Compliance NHS Grampian has an established Compliance Group which is responsible for maintaining…,76,ACCOUNTABILITY REPORT,Governance,False
Grampian-2024-2025:p0076_001,-1.2432151,7.4869328,ACCOUNTABILITY REPORT,levels and report any exceptions and the associated actions planned. The group membership includes appointed representatives from both the functional and main operational areas of NHS Grampian. The Compliance Group meet…,76,ACCOUNTABILITY REPORT,Governance,False
Grampian-2024-2025:p0077_000,-1.5736077,7.0796742,ACCOUNTABILITY REPORT,A CORPORATE GOVERNANCE REPORT recognises the role of staff side and the advisory structure in supporting the work of Board sub-committees. 7.8 Collaborative Working  NHS Grampian’s internal audit programme for 2024/25…,77,ACCOUNTABILITY REPORT,Governance,False
Grampian-2024-2025:p0077_001,-0.9596196,6.6350365,ACCOUNTABILITY REPORT,"jointly by the three IJB Chief Officers.  The Audit and Risk Committee remain focused on the opportunities for closer working with the three Integration Joint Boards (IJB’s), in particular the potential to improve the…",77,ACCOUNTABILITY REPORT,Governance,False
Grampian-2024-2025:p0077_002,-0.409333,7.1024737,ACCOUNTABILITY REPORT,"decision making in all key areas. In addition, the Board continues to seek opportunities to enhance the system of internal control with a specific focus on the delivery of safe and effective patient care, achievement of…",77,ACCOUNTABILITY REPORT,Governance,False
Grampian-2024-2025:p0078_000,-0.8942308,6.6747055,ACCOUNTABILITY REPORT,"A CORPORATE GOVERNANCE REPORT  Reports from Health Improvement Scotland and other inspection agencies;  Transparent reporting and analysis of the Board’s financial performance through the Performance Assurance, Financ…",78,ACCOUNTABILITY REPORT,Financial narrative,False
Grampian-2024-2025:p0078_001,-0.969272,6.7193513,ACCOUNTABILITY REPORT,and senior managers that controls within their individual areas of responsibility are adequate and have been operating effectively throughout the year;  Assurance from the External Auditor of the NHS Grampian Charity F…,78,ACCOUNTABILITY REPORT,Governance,False
Grampian-2024-2025:p0078_002,-1.1143621,6.688133,ACCOUNTABILITY REPORT,"in place. 10. Significant Issues As Accountable Officer, I am required to record issues that are significant enough to warrant recording: Financial climate also present a significant issue whilst delivering on clinical…",78,ACCOUNTABILITY REPORT,Financial narrative,False
Grampian-2024-2025:p0079_000,0.2216969,7.392254,ACCOUNTABILITY REPORT,"A CORPORATE GOVERNANCE REPORT within the target agreed with the Scottish Government, in the 2025/26 financial year but is planning for the level of deficit to reduce over the following subsequent financial years. Specif…",79,ACCOUNTABILITY REPORT,Financial narrative,False
Grampian-2024-2025:p0079_001,0.42162818,7.6620097,ACCOUNTABILITY REPORT,"and standards, including some quality concerns raised by the appropriate regulatory bodies. The strategic risk register records a number of risks that fall outwith risk appetite and tolerance thresholds, each is being a…",79,ACCOUNTABILITY REPORT,Governance,False
Grampian-2024-2025:p0080_000,-2.915737,7.7857776,ACCOUNTABILITY REPORT,B REMUNERATION AND STAFF REPORT The following information has been subject to audit by the Board’s External Auditor who have reviewed the remuneration report for consistency with other information in the financial state…,80,ACCOUNTABILITY REPORT,Financial narrative,False
Grampian-2024-2025:p0080_001,-2.5401247,7.7737346,ACCOUNTABILITY REPORT,paid or payable by the Board in each financial year and a separate assessment of the estimated increase in the cumulative pension benefit that will be payable following retirement. Board Members’ Contracts of Employment…,80,ACCOUNTABILITY REPORT,Financial narrative,False
Grampian-2024-2025:p0080_002,-2.5224519,7.682778,ACCOUNTABILITY REPORT,conditions of being able to be offered overtime payments in line with paragraph 3.1 of the Agenda for Change Handbook during the COVID-19 outbreak. Assessment of Performance The performance assessment process for the Ex…,80,ACCOUNTABILITY REPORT,Governance,False
Grampian-2024-2025:p0081_000,-2.5962539,7.9025173,ACCOUNTABILITY REPORT,"B REMUNERATION AND STAFF REPORT For Non-Executive members, the process is also undertaken by the Chair and written evidence is submitted to the Cabinet Secretary for Health and Wellbeing. The progression of the Executiv…",81,ACCOUNTABILITY REPORT,Governance,False
Grampian-2024-2025:p0081_001,-2.8047862,8.01696,ACCOUNTABILITY REPORT,"of the Remuneration Committee, is included in the Governance Statement on Pages 55 to 56 above. Relationship between the highest paid Director and the workforce median remuneration The following table compares the bande…",81,ACCOUNTABILITY REPORT,Governance,False
Grampian-2024-2025:p0082_000,-2.876813,7.8649526,ACCOUNTABILITY REPORT,B REMUNERATION AND STAFF REPORT years relates to the relative increase in remuneration earned by those in the 75 th percentile compared to the Acute Medical Director in 2024/25. This relates mainly to pay award. The inc…,82,ACCOUNTABILITY REPORT,Governance,False
Grampian-2024-2025:table_p0083,14.086321,7.040517,ACCOUNTABILITY REPORT,Financial table on page 83 (Staff Costs) Contains 34 line items across 8 columns. Key items: SubTotal | ValueofPension; Performance | earnings | Benefits(tobe | Total; Salary(bandsof | RelatedBonus | BenefitsinKind | pa…,83,ACCOUNTABILITY REPORT,Financial table,False
Grampian-2024-2025:table_p0084,13.990277,7.134163,ACCOUNTABILITY REPORT,Financial table on page 84 (Staff Costs) Contains 26 line items across 8 columns. Row labels: thesingletotalfigureofremunerationrelatetoactualearningspayablein20. Key items: thesingletotalfigureofremunerationrelatetoact…,84,ACCOUNTABILITY REPORT,Financial table,False
Grampian-2024-2025:table_p0085,14.011753,7.0857825,ACCOUNTABILITY REPORT,Financial table on page 85 (Staff Costs) Contains 51 line items across 8 columns. Row labels: payablein2024/25. Key items: Totalaccrued | Realincreasein | Totalaccruedlump | Realincreasein; pensionat | pensionat | sumat…,85,ACCOUNTABILITY REPORT,Financial table,False
Grampian-2024-2025:p0086_000,-3.0024822,7.8583126,ACCOUNTABILITY REPORT,NHS GRAMPIAN ANNUAL REPORT AND ACCOUNTS FOR YEAR ENDED 31 MARCH 2025 ACCOUNTABILITY REPORT B REMUNERATION AND STAFF REPORT NHS GRAMPIAN REMUNERATION REPORT FOR THE YEAR ENDED 31 MARCH 2024 Publication of pension benefit…,86,ACCOUNTABILITY REPORT,Financial table,False
Grampian-2024-2025:p0086_001,-2.8405905,8.071213,ACCOUNTABILITY REPORT,"(bands of retirement) £5,000) below) £5,000) £000 £000 £000 £000 £000 £000 Remuneration of: Executive Members Chief Executive - Professor C aroline Hiscox (to 10/12/2023) a 100-105 0 0 100-105 0 100-105 Interim ChiefE x…",86,ACCOUNTABILITY REPORT,Governance,False
Grampian-2024-2025:p0086_002,-2.7164655,7.9861083,ACCOUNTABILITY REPORT,2530 Mr Mark Burrell (from 01/07/2023) dif 140-145 0 0 140-145 33 175-180 Councillor Tracy Colyer 5-10 0 0 5-10 NA 5-10 Ms Kim Cruttenden (to 30/06/2023) die 90-95 0 0 90-95 1 100-105 Mr Albert Donald 5-10 0 0 5-10 NA 5…,86,ACCOUNTABILITY REPORT,Governance,False
Grampian-2024-2025:p0086_003,-2.6660187,8.190275,ACCOUNTABILITY REPORT,Paul Allen (to 31/12/23) j 95-100 0 0 95-100 0 95-100 Acute Medical D irector and P ortfolio Lead (Surgery & Clinical Support) - Mr Paul Bachoo k 240245 0 0 240-245 0 240245 Chief Officer Moray UB and Portfolio Lead Mor…,86,ACCOUNTABILITY REPORT,Governance,False
Grampian-2024-2025:p0086_004,-2.9319615,8.082678,ACCOUNTABILITY REPORT,"Mitchelhill (from 19/02/2024) nip 105-110 0 0 105-110 79 185-190 Director of People and C ulture -MrTom Power 105-110 0 0 105-110 23 130-135 Director of Infrastructure, Sustainability and Support Services-Mr Alan Wilson…",86,ACCOUNTABILITY REPORT,Governance,False
Grampian-2024-2025:p0086_005,-2.842294,8.151367,ACCOUNTABILITY REPORT,resigned from the Board on 30/11/2023. The remuneration disclosure includes total earnings both in her parttime role as part ofNHS Grampian’s Health Promotion team and for her additional duties as an NHS Board member. d…,86,ACCOUNTABILITY REPORT,Governance,False
Grampian-2024-2025:p0086_006,-2.9082177,8.11686,ACCOUNTABILITY REPORT,role as an NHS Board member. His full year equivalent salaryis in the range £145k -£150k g) The remuneration disco sure for Mr Steven Lindsay includes total eamings from his role as Employee Director and for his additio…,86,ACCOUNTABILITY REPORT,Governance,False
Grampian-2024-2025:p0086_007,-3.0217397,8.228644,ACCOUNTABILITY REPORT,"his post on 31/03/2023 and returned to his post on 03/04/2023. 1) Mr Stuart Humphreys commenced interim responsibility for roles reporting to the Director of Strategy from 04/01/2024, whilst the Director o fStrategy und…",86,ACCOUNTABILITY REPORT,Governance,False
Grampian-2024-2025:p0086_008,-3.0227249,7.817698,ACCOUNTABILITY REPORT,as Portblio Lead received additional remuneration. The remuneration and pension benefit disclosed relates to their role as Chief Officer and this is also disclosed in the respective UB Annual Report and Accounts. q) Due…,86,ACCOUNTABILITY REPORT,Financial narrative,False
Grampian-2024-2025:table_p0087,13.892168,7.052883,ACCOUNTABILITY REPORT,Financial table on page 87 (Staff Costs) Contains 49 line items across 9 columns. Row labels: 2023/24. Key items: Totalaccrued | Realincreasein | Totalaccruedlump | Realincreasein; pensionat | pensionat | sumatpensionab…,87,ACCOUNTABILITY REPORT,Financial table,False
Grampian-2024-2025:p0088_000,-1.912878,8.541339,ACCOUNTABILITY REPORT,"B REMUNERATION AND STAFF REPORT 2. STAFF REPORT 1. The Workforce Our staff are at the centre of the organisation, their commitment is pivotal to all the services that are delivered across the region and we would like to…",88,ACCOUNTABILITY REPORT,Governance,False
Grampian-2024-2025:p0088_001,-1.7709048,8.126366,ACCOUNTABILITY REPORT,"than the majority of boards in Scotland. These rates are reported to Chief Executive Team and Staff Governance Committee (SGC) by profession, portfolio, directorate and overall organisational levels. Analysis is provide…",88,ACCOUNTABILITY REPORT,Governance,False
Grampian-2024-2025:p0088_002,-1.8022814,7.8135424,ACCOUNTABILITY REPORT,"and safe working environment, promoting the health and wellbeing of staff, patients and the wider community. Through the Staff Governance Committee, a cycle of reporting is in place relating to agreed objectives linked…",88,ACCOUNTABILITY REPORT,Governance,False
Grampian-2024-2025:p0089_000,-1.6656197,8.0267935,ACCOUNTABILITY REPORT,"B REMUNERATION AND STAFF REPORT We continue to use our NHS Grampian extant policies as well as working with the growing number of Once for Scotland Policies and their associated guidance, ensuring any new polices are sh…",89,ACCOUNTABILITY REPORT,Governance,False
Grampian-2024-2025:p0089_001,-1.7333754,7.910013,ACCOUNTABILITY REPORT,"concerns. In addition to our 17 active Speak-up Ambassadors (SuA's), we have a 15 hour per week Whistleblowing and Speak Up Manager role, the role involves ensuring the SuA's have the skills, confidence and support requ…",89,ACCOUNTABILITY REPORT,Governance,False
Grampian-2024-2025:p0089_002,-1.8902408,8.790238,ACCOUNTABILITY REPORT,"range of programmes and initiatives, some examples being: the Leading Empowered Organisations course, now for clinical and non- clinical staff; promote iMatter and the related team action plans; training a cross system…",89,ACCOUNTABILITY REPORT,Governance,False
Grampian-2024-2025:p0090_000,-1.7338743,8.689896,ACCOUNTABILITY REPORT,B REMUNERATION AND STAFF REPORT supportive policies and procedures. The implementation of the Agenda for Change non- pay reforms is likely to impact on our ability to progress to substantial assurance. It has implicatio…,90,ACCOUNTABILITY REPORT,Governance,False
Grampian-2024-2025:p0090_001,-1.6988591,8.704046,ACCOUNTABILITY REPORT,"the number of band 3 rotas for doctors in training, and increase the proportion of locums who are directly engaged. A numbers of initiatives have continued to be progressed to improve workforce supply. The North of Scot…",90,ACCOUNTABILITY REPORT,Governance,False
Grampian-2024-2025:table_p0091,13.937676,7.014039,ACCOUNTABILITY REPORT,Financial table on page 91 (Staff Costs) Contains 8 line items across 9 columns. Column headers: STAFFCOSTS | Notes | ExecutiveBoardMembers£000's | NonExecutiveBoardMembers£000's | PermanentStaff£000's | InwardSecondees…,91,ACCOUNTABILITY REPORT,Financial table,False
Grampian-2024-2025:table_p0092,13.903316,7.04815,ACCOUNTABILITY REPORT,"Financial table on page 92 (Staff Costs) Contains 14 line items across 2 columns. Row labels: £70,001to£80,000; £80,001to£90,000; £90,001to£100,000; £100,001to£110,000; £110,001to£120,000. Key items: £70,001to£80,000 |…",92,ACCOUNTABILITY REPORT,Financial table,False
Grampian-2024-2025:p0093_000,-1.7838172,8.3942375,ACCOUNTABILITY REPORT,"B REMUNERATION AND STAFF REPORT wellbeing information and services based on their individual circumstances, it includes - counselling (in house funded), Cognitive Behavioural Therapy (funded by NES), and Clinical Psycho…",93,ACCOUNTABILITY REPORT,Governance,False
Grampian-2024-2025:p0093_001,-1.7847208,8.746817,ACCOUNTABILITY REPORT,"safety colleagues to improve the value of risk assessment. NHS Grampian OHS continue to make improvements on learning from adverse events, audit and feedback from users of the service. The annual sickness absence rate f…",93,ACCOUNTABILITY REPORT,Governance,False
Grampian-2024-2025:p0093_002,-1.7453716,8.977138,ACCOUNTABILITY REPORT,applications for employment from disabled persons and actively seeks to provide an environment where they and any employees who become disabled can continue to contribute to the work of the Board. During 2024/25 NHS Gra…,93,ACCOUNTABILITY REPORT,Governance,False
Grampian-2024-2025:p0094_000,-1.8893658,8.948179,ACCOUNTABILITY REPORT,B REMUNERATION AND STAFF REPORT 7. Other employee matters such as diversity and equal treatment NHS Grampian fully complies with the requirements of the Equality Act (Specific Duties) (Scotland) Regulations 2012. More i…,94,ACCOUNTABILITY REPORT,Governance,False
Grampian-2024-2025:p0094_001,-2.2022235,8.5948715,ACCOUNTABILITY REPORT,pay policy. 8. Off-payroll engagements The use of locum agency medical and nursing staff throughout the year is disclosed in section 2 above. All other staff engaged by NHS Grampian to provide services during the year f…,94,ACCOUNTABILITY REPORT,Governance,False
Grampian-2024-2025:p0095_000,-2.465557,8.52545,ACCOUNTABILITY REPORT,"B REMUNERATION AND STAFF REPORT 10. Expenditure on consultancy Expenditure on external consultancy during 2024/25 was £185,315 (2023/24 £3,800). NHS Grampian has used 3 consultancy firm during 2024/25 (1 in 2023/24). Th…",95,ACCOUNTABILITY REPORT,Financial narrative,False
Grampian-2024-2025:p0095_001,-2.6508832,8.378242,ACCOUNTABILITY REPORT,employees who were relevant Full-time equivalent employee union officials during the period 1 April number 2024 to 31 March 2025 108 89.07 Percentage of time spent on facility time Percentage of time Number of represent…,95,ACCOUNTABILITY REPORT,Financial table,False
Grampian-2024-2025:p0096_000,-2.969994,3.3888452,ACCOUNTABILITY REPORT,"C PARLIAMENTARY ACCOUNTABILITY REPORT The following information has been subject to audit by the Board’s External Auditor. 1. Losses and Special Payments On occasion, the Board may be required to write off outstanding d…",96,ACCOUNTABILITY REPORT,Governance,False
Grampian-2024-2025:p0096_001,-3.0568771,3.2212403,ACCOUNTABILITY REPORT,"gratia payments Total Special 208 13,544 134 8,008 payments and losses In 2024/25, the Board was required to pay out 11 claims totalling £10.7 million, in respect of clinical negligence cases each in excess of £0.3 mill…",96,ACCOUNTABILITY REPORT,Governance,False
Grampian-2024-2025:p0097_000,-0.46255893,6.683042,ACCOUNTABILITY REPORT,C PARLIAMENTARY ACCOUNTABILITY REPORT 3. Contingent Liabilities Contingent liabilities are disclosed in note 14 and contractual obligations are disclosed in note 15. .....................................................…,97,ACCOUNTABILITY REPORT,Governance,False
Grampian-2024-2025:p0098_000,-2.9191072,5.897556,SCOTTISH PARLIAMENT,"General for Scotland and the Scottish Parliament Independent auditor’s report to the members of Grampian Health Board, the Auditor General for Scotland and the Scottish Parliament Reporting on the audit of the financial…",98,SCOTTISH PARLIAMENT,Financial narrative,False
Grampian-2024-2025:p0098_001,-2.949347,6.231753,SCOTTISH PARLIAMENT,Manual (the 2024/25 FReM). In our opinion the accompanying financial statements:  give a true and fair of the state of affairs of the board and its group as at 31 March 2025 and of the net expenditure for the year then…,98,SCOTTISH PARLIAMENT,Financial narrative,False
Grampian-2024-2025:p0099_000,-3.3384876,6.180791,SCOTTISH PARLIAMENT,General for Scotland and the Scottish Parliament requirements. Non-audit services prohibited by the Ethical Standard were not provided to the board. We believe that the audit evidence we have obtained is sufficient and…,99,SCOTTISH PARLIAMENT,Governance,False
Grampian-2024-2025:p0099_001,-3.249105,6.2971687,SCOTTISH PARLIAMENT,"provide assurance on the current or future financial sustainability of the board and its group. However, we report on the board’s arrangements for financial sustainability in a separate Annual Audit Report available fro…",99,SCOTTISH PARLIAMENT,Financial narrative,False
Grampian-2024-2025:p0099_002,-3.3974645,6.220166,SCOTTISH PARLIAMENT,"whether due to fraud or error. In preparing the financial statements, the Accountable Officer is responsible for assessing the ability of the board and its group to continue as a going concern, disclosing, as applicable…",99,SCOTTISH PARLIAMENT,Financial narrative,False
Grampian-2024-2025:p0100_000,-3.4146383,6.18937,SCOTTISH PARLIAMENT,General for Scotland and the Scottish Parliament a guarantee that an audit conducted in accordance with ISAs (UK) will always detect a material misstatement when it exists. Misstatements can arise from fraud or error an…,100,SCOTTISH PARLIAMENT,Governance,False
Grampian-2024-2025:p0100_001,-3.5276265,6.1306357,SCOTTISH PARLIAMENT,may be expected to have a fundamental effect on the operations of the board;  inquiring of the Accountable Officer concerning the board’s policies and procedures regarding compliance with the applicable legal and regul…,100,SCOTTISH PARLIAMENT,Governance,False
Grampian-2024-2025:p0100_002,-3.4425497,6.2089233,SCOTTISH PARLIAMENT,"or the override of internal control. The capability of the audit to detect fraud and other irregularities depends on factors such as the skilfulness of the perpetrator, the frequency and extent of manipulation, the degr…",100,SCOTTISH PARLIAMENT,Governance,False
Grampian-2024-2025:p0101_000,-3.2272892,6.3640513,SCOTTISH PARLIAMENT,General for Scotland and the Scottish Parliament Reporting on regularity of expenditure and income Opinion on regularity In our opinion in all material respects the expenditure and income in the financial statements wer…,101,SCOTTISH PARLIAMENT,Financial narrative,False
Grampian-2024-2025:p0101_001,-3.3850536,6.3364096,SCOTTISH PARLIAMENT,"Report described as audited. In our opinion, the audited parts of the Remuneration and Staff Report have been properly prepared in accordance with the National Health Service (Scotland) Act 1978 and directions made ther…",101,SCOTTISH PARLIAMENT,Governance,False
Grampian-2024-2025:p0101_002,-3.2850223,6.240242,SCOTTISH PARLIAMENT,"financial statements themselves. If, based on the work we have performed, we conclude that there is a material misstatement of this other information, we are required to report that fact. We have nothing to report in th…",101,SCOTTISH PARLIAMENT,Financial narrative,False
Grampian-2024-2025:p0102_000,-3.194083,6.31924,PERFORMANCE REPORT,"General for Scotland and the Scottish Parliament Opinions prescribed by the Auditor General for Scotland on the Performance Report and Governance Statement In our opinion, based on the work undertaken in the course of t…",102,PERFORMANCE REPORT,Governance,False
Grampian-2024-2025:p0102_001,-3.2363129,6.408738,PERFORMANCE REPORT,"by exception We are required by the Auditor General for Scotland to report to you if, in our opinion:  adequate accounting records have not been kept; or  the financial statements and the audited parts of the Remunera…",102,PERFORMANCE REPORT,Financial narrative,False
Grampian-2024-2025:table_p0103,13.436652,7.307082,FINANCIAL STATEMENTS,Financial table on page 103 (Income Statement) Contains 18 line items across 6 columns. Row labels: YEARTO3; NHS; Grampian; 2023/24; £’000. Key items: YEARTO3 | 1MARCH2 | 025; NHS | NHS; Grampian | Group | Grampian | Gr…,103,FINANCIAL STATEMENTS,Financial table,False
Grampian-2024-2025:table_p0104,13.187595,7.349213,FINANCIAL STATEMENTS,Financial table on page 104 (Balance Sheet) Contains 39 line items across 6 columns. Row labels: NHS; Grampian; 2023/24; £’000. Key items: NHS | NHS; Grampian | Group | Grampian | Group; 2023/24 | 2023/24 | 2024/25 | 20…,104,FINANCIAL STATEMENTS,Financial table,False
Grampian-2024-2025:table_p0105,13.484914,7.092781,FINANCIAL STATEMENTS,Financial table on page 105 (Cash Flow) Contains 37 line items across 6 columns. Row labels: NHS; Grampian; 2023/24; £’000. Key items: NHS | NHS; Grampian | Group | Grampian | Group; 2023/24 | 2023/24 | 2024/25 | 2024/2…,105,FINANCIAL STATEMENTS,Financial table,False
Grampian-2024-2025:table_p0106,13.269933,6.99329,FINANCIAL STATEMENTS,Financial table on page 106 (Income Statement) Contains 41 line items across 9 columns. Row labels: CONSOLIDATEDSTATEMENTOFCHANGESINTAXPAYERSEQUITYFORTHEYEARENDED31MARCH2025; NHSGRAMPIAN; Revaluation; NoteGeneralFundRes…,106,FINANCIAL STATEMENTS,Financial table,False
Grampian-2024-2025:p0107_000,-2.9877977,5.788655,FINANCIAL STATEMENTS,NOTES TO THE ACCOUNTS Note 1. ACCOUNTING POLICIES 1) Authority In accordance with the accounts direction issued by Scottish Ministers under section 19(4) of the Public Finance and Accountability (Scotland) Act 2000 appe…,107,FINANCIAL STATEMENTS,Financial narrative,False
Grampian-2024-2025:p0107_001,-2.9078631,5.7232776,FINANCIAL STATEMENTS,"degree of judgement or complexity, or areas where assumptions and estimates are significant to the financial statements are disclosed in section 29 below. Standards, amendments and interpretations effective in current y…",107,FINANCIAL STATEMENTS,Financial narrative,False
Grampian-2024-2025:p0107_002,-2.9713507,5.848153,FINANCIAL STATEMENTS,"the FReM, will be effective from 1 April 2025. IFRS 18 Presentation and Effective for periods starting on or after 1 disclosure in financial January 2027, this standard has not yet been statements endorsed by the UKEB o…",107,FINANCIAL STATEMENTS,Financial narrative,False
Grampian-2024-2025:p0108_000,-1.8369738,5.076051,FINANCIAL STATEMENTS,"2) Basis of Consolidation In accordance with IFRS 10 – Consolidated Financial Statements, the Annual Accounts consolidate the results of Grampian Health Board Endowment Fund (operating as NHS Grampian Charity) which wer…",108,FINANCIAL STATEMENTS,Financial narrative,False
