id,x,y,label,text,page,section,category,highlight
Grampian-2020-2021:p0060_002,9.776008,-2.7863734,ACCOUNTABILITY REPORT,"Scottish Government and local NHS Grampian level with regard to availability and supply of medicines, procurement and availability of other essential supplies and the availability of workforce. ➢ System wide processes w…",60,ACCOUNTABILITY REPORT,Financial narrative,False
Grampian-2020-2021:p0061_000,10.454513,-3.5104008,ACCOUNTABILITY REPORT,"7. Internal Control Matters (cont) 7.4 Infrastructure ➢ Enhanced monitoring arrangements were in place for our capital and infrastructure projects to address the impact of COVID-19 on design, programme and cost includin…",61,ACCOUNTABILITY REPORT,Financial narrative,False
Grampian-2020-2021:p0061_001,9.425897,-3.5440798,ACCOUNTABILITY REPORT,"our objective of reducing dependency on paper medical records. In addition to improving access and security of the records, enabling the conversion of medical records from paper into an electronic form significantly red…",61,ACCOUNTABILITY REPORT,Financial narrative,False
Grampian-2020-2021:p0061_002,9.2358265,-3.4948545,ACCOUNTABILITY REPORT,"patients at ARI and Aberdeen Maternity Hospital into electronic form. 7.6 Workforce ➢ Although the use of temporary agency staff has reduced considerably during the COVID-19 pandemic, Senior Management continue to close…",61,ACCOUNTABILITY REPORT,Financial narrative,False
Grampian-2020-2021:p0062_000,8.980702,-3.4950528,ACCOUNTABILITY REPORT,7. Internal Control Matters (cont) 7.6 Workforce (cont) ➢ The need to respond quickly to the recent COVID-19 pandemic has created an opportunity to accelerate recruitment efforts through a range of government sponsored…,62,ACCOUNTABILITY REPORT,Financial narrative,False
Grampian-2020-2021:p0062_001,10.95879,-3.721123,ACCOUNTABILITY REPORT,recruitment initiatives underway. 7.7 Compliance The Audit Committee received briefings during the year on the following key risk areas highlighted in recent audit reviews:- ➢ Ongoing action to address the requirements…,62,ACCOUNTABILITY REPORT,Financial narrative,False
Grampian-2020-2021:p0062_002,10.958199,-3.7154646,ACCOUNTABILITY REPORT,"existing cyber security policies and procedures, including access management controls, threat and vulnerability and patch management, to ensure that the arrangements for cyber security of medical devices, including role…",62,ACCOUNTABILITY REPORT,Financial narrative,False
Grampian-2020-2021:p0063_000,11.07904,-3.5417292,ACCOUNTABILITY REPORT,7. Internal Control Matters (cont) 7.7 Compliance (cont) ▪ A formal reporting process where designated service leads will be required to provide assurance regarding compliance with cyber security guidance within their d…,63,ACCOUNTABILITY REPORT,Financial narrative,False
Grampian-2020-2021:p0063_001,10.5829525,-3.5223927,ACCOUNTABILITY REPORT,"would occur where controls were absent or failed. Considering the content of the report in detail therefore, the Board have noted the various improvement actions agreed by the NSS Audit and Risk Committee to address the…",63,ACCOUNTABILITY REPORT,Financial narrative,False
Grampian-2020-2021:p0064_000,11.008762,-2.534798,ACCOUNTABILITY REPORT,7. Internal Control Matters (cont) 7.8 Involvement and Engagement (cont) ➢ The Board’s assurance framework recognises the role of staff side and the advisory structure in supporting the work of Board sub committees and…,64,ACCOUNTABILITY REPORT,Financial narrative,False
Grampian-2020-2021:p0064_001,11.099097,-2.595426,ACCOUNTABILITY REPORT,jointly by the three IJB Chief Officers. 8.0 Best Value I can confirm that Grampian Health Board is committed to ensuring that its activities are undertaken in a manner that will secure best value in the use of public f…,64,ACCOUNTABILITY REPORT,Financial narrative,False
Grampian-2020-2021:p0064_002,11.129948,-2.5896828,ACCOUNTABILITY REPORT,"reviewing the adequacy and effectiveness of the system of internal control. My review is informed by: - Executive and senior managers who are required to develop, implement and maintain adequate internal controls across…",64,ACCOUNTABILITY REPORT,Financial narrative,False
Grampian-2020-2021:p0065_000,11.381411,-2.2445571,ACCOUNTABILITY REPORT,"9. Review of Adequacy and Effectiveness (cont) - Transparent reporting and analysis of the Board’s financial performance through the Performance Governance Committee and System Leadership Team, including the extent to w…",65,ACCOUNTABILITY REPORT,Financial narrative,False
Grampian-2020-2021:p0065_001,11.441774,-2.3631213,ACCOUNTABILITY REPORT,Board accounts; - Written confirmation from executive and senior managers that controls within their individual areas of responsibility are adequate and have been operating effectively throughout the year; - Assurance f…,65,ACCOUNTABILITY REPORT,Financial narrative,False
Grampian-2020-2021:p0065_002,11.293783,-2.5567343,ACCOUNTABILITY REPORT,control by the Board and the Audit Committee and a plan to address weaknesses and ensure continuous improvement of the system is in place. 10. Disclosures Based on the evidence considered during my review of the effecti…,65,ACCOUNTABILITY REPORT,Governance,False
Grampian-2020-2021:p0066_000,9.332401,-1.6679583,ACCOUNTABILITY REPORT,"The tables on pages 64-66 in the Remuneration and Staff Report and the tables notes 2, 4 and 10 on pages 68, 69 and 71 have been subject to audit by the Board’s External Auditor. The other sections in the Remuneration a…",66,ACCOUNTABILITY REPORT,Governance,False
Grampian-2020-2021:p0066_001,9.336493,-1.7433047,ACCOUNTABILITY REPORT,"ministerial appointments on contracts of between two and four years. The terms and conditions of Executive and Senior Management Cohort and Non- Executive Members including annual remuneration, and any entitlement to se…",66,ACCOUNTABILITY REPORT,Governance,False
Grampian-2020-2021:p0066_002,9.456532,-1.8135148,ACCOUNTABILITY REPORT,Senior Management Cohort is in accordance with PCS (ESM) 2020/1. Performance management and appraisal arrangements follow the nationally prescribed format and are directly linked to the improved performance of Grampian…,66,ACCOUNTABILITY REPORT,Governance,False
Grampian-2020-2021:p0067_000,9.120075,-1.6881661,ACCOUNTABILITY REPORT,"Remuneration Committee The Remuneration Committee ensures that arrangements are in place to comply with NHS Grampian policy and Scottish Government direction and guidance for determining the employment, remuneration and…",67,ACCOUNTABILITY REPORT,Governance,False
Grampian-2020-2021:p0067_001,8.939335,-1.4391986,ACCOUNTABILITY REPORT,"below £80,000 received a 2.95% cost of living uplift in pay during 2020/21 and staff earning above that amount received a flat increase of £1,600. In addition all staff received an additional 1% backdated to 1 December…",67,ACCOUNTABILITY REPORT,Governance,False
Grampian-2020-2021:table_p0068,3.7296963,4.093865,ACCOUNTABILITY REPORT,Financial table on page 68 (Staff Costs) Contains 35 line items across 15 columns. Key items: SubTotal | ValueofPension | Totalaccrued | Totalaccruedlump; Performance | earnings | Benefits(tobe | Total; Notes | Salary(b…,68,ACCOUNTABILITY REPORT,Financial table,False
Grampian-2020-2021:table_p0069,3.675247,4.0759254,ACCOUNTABILITY REPORT,Financial table on page 69 (Staff Costs) Contains 33 line items across 15 columns. Key items: SubTotal | ValueofPension | Totalaccrued; Performance | earnings | Benefits(tobe | Total; Salary(bandsof | RelatedBonus | Ben…,69,ACCOUNTABILITY REPORT,Financial table,False
Grampian-2020-2021:p0070_000,8.651122,-2.7085774,ACCOUNTABILITY REPORT,"1. Staff Governance As part of our adherence to the NHS Scotland Staff Governance Standards, the organisation engages and consults employees or their representatives so their views are taken into account in decisions af…",70,ACCOUNTABILITY REPORT,Financial narrative,False
Grampian-2020-2021:p0070_001,8.70809,-3.4525404,ACCOUNTABILITY REPORT,Board would like to express their thanks and appreciation to all staff for their fantastic contribution and for their relentless support and professionalism during this most challenging of years. The care and compassion…,70,ACCOUNTABILITY REPORT,Governance,False
Grampian-2020-2021:p0070_002,8.807756,-2.9953458,ACCOUNTABILITY REPORT,"Professional staffing has reduced during the year, except where necessary in order to cover critical roles and ensure a safe and effective service. The effective deployment of the recent enhancement to our workforce and…",70,ACCOUNTABILITY REPORT,Governance,False
Grampian-2020-2021:p0070_003,8.868778,-2.362844,ACCOUNTABILITY REPORT,facilitate employment of student nurses and doctors early during the final stages of their training in order to enhance the available workforce. At the end of May 2020 NHS Grampian had successfully employed an additiona…,70,ACCOUNTABILITY REPORT,Governance,False
Grampian-2020-2021:table_p0071,3.7045197,3.9706829,ACCOUNTABILITY REPORT,Financial table on page 71 (Staff Costs) Contains 8 line items across 9 columns. Column headers: STAFFCOSTS | Notes | ExecutiveBoardMembers£000's | NonExecutiveBoardMembers£000's | PermanentStaff£000's | InwardSecondees…,71,ACCOUNTABILITY REPORT,Financial table,False
Grampian-2020-2021:table_p0072,3.6130464,3.915911,ACCOUNTABILITY REPORT,"Financial table on page 72 (Staff Costs) Contains 14 line items across 2 columns. Row labels: £70,001to£80,000; £80,001to£90,000; £90,001to£100,000; £100,001to£110,000; £110,001to£120,000. Key items: £70,001to£80,000 |…",72,ACCOUNTABILITY REPORT,Financial table,False
Grampian-2020-2021:p0073_000,8.4527235,-2.2183225,ACCOUNTABILITY REPORT,"6. Staff policies applied during the financial year relating to the employment of Disabled Persons As an equal opportunities employer, NHS Grampian welcomes applications for employment from disabled persons and actively…",73,ACCOUNTABILITY REPORT,Financial narrative,False
Grampian-2020-2021:p0073_001,8.581084,-1.9252751,ACCOUNTABILITY REPORT,"and that everything reasonably possible is done to meet their needs. This includes providing appropriate support and making reasonable adjustments, training, career development and promotion of disabled persons. 7. Othe…",73,ACCOUNTABILITY REPORT,Governance,False
Grampian-2020-2021:p0073_002,8.693928,-1.6824523,ACCOUNTABILITY REPORT,"representatives to cover all employee matters including health and safety, employee consultation, trade union relationships, employability and pay policy. 8. Expenditure on consultancy Expenditure on external consultanc…",73,ACCOUNTABILITY REPORT,Financial narrative,False
Grampian-2020-2021:p0074_000,8.742422,-1.899788,ACCOUNTABILITY REPORT,9. Off payroll engagements The use of locum agency medical and nursing staff throughout the year is disclosed in section 2 above. All other staff engaged by NHS Grampian to provide services during the year for a period…,74,ACCOUNTABILITY REPORT,Governance,False
Grampian-2020-2021:p0075_000,10.239146,2.636785,ACCOUNTABILITY REPORT,"1. Losses and Special Payments On occasion, the Board may be required to write off outstanding debt that is assessed as no longer recoverable, make an ex gratia payment or to pay compensation for a loss incurred by a th…",75,ACCOUNTABILITY REPORT,Governance,False
Grampian-2020-2021:p0075_001,10.306044,2.693066,ACCOUNTABILITY REPORT,"pay out 8 claims, £1.0 million, £0.67 million, £0.58 million, £0.5 million, £0.38 million, £0.28 million, £0.25 million and £0.25 million, in respect of clinical negligence cases in excess of £0.25 million (2019/20: 7 c…",75,ACCOUNTABILITY REPORT,Governance,False
Grampian-2020-2021:p0076_000,11.991136,-1.3987703,ACCOUNTABILITY REPORT,Reporting on the audit of the financial statements Opinion on financial statements I have audited the financial statements in the annual report and accounts of Grampian Health Board and its group for the year ended 31 M…,76,ACCOUNTABILITY REPORT,Financial narrative,False
Grampian-2020-2021:p0076_001,12.185976,-1.6561766,ACCOUNTABILITY REPORT,view in accordance with the National Health Service (Scotland) Act 1978 and directions made thereunder by the Scottish Ministers of the state of the affairs of the board and its group as at 31 March 2021 and of the net…,76,ACCOUNTABILITY REPORT,Governance,False
Grampian-2020-2021:p0076_002,12.229433,-1.5674707,ACCOUNTABILITY REPORT,the audit of the financial statements section of my report. I was appointed by the Auditor General on 18 July 2016. The period of total uninterrupted appointment is five years. I am independent of the board and its grou…,76,ACCOUNTABILITY REPORT,Financial narrative,False
Grampian-2020-2021:p0077_000,12.451598,-1.6975102,ACCOUNTABILITY REPORT,"I report in a separate Annual Audit Report, available from the Audit Scotland website , the most significant assessed risks of material misstatement that I identified and my judgement thereon. Responsibilities of the Ac…",77,ACCOUNTABILITY REPORT,Governance,False
Grampian-2020-2021:p0077_001,12.516979,-1.5353405,ACCOUNTABILITY REPORT,going concern and using the going concern basis of accounting unless deemed inappropriate. Auditor’s responsibilities for the audit of the financial statements My objectives are to obtain reasonable assurance about whet…,77,ACCOUNTABILITY REPORT,Financial narrative,False
Grampian-2020-2021:p0077_002,12.483558,-1.566857,ACCOUNTABILITY REPORT,"my responsibilities outlined above to detect material misstatements in respect of irregularities, including fraud. Procedures include: - obtaining an understanding of the applicable legal and regulatory framework and ho…",77,ACCOUNTABILITY REPORT,Governance,False
Grampian-2020-2021:p0078_000,12.307721,-1.7620865,ACCOUNTABILITY REPORT,Reporting on regularity of expenditure and income Opinion on regularity In my opinion in all material respects the expenditure and income in the financial statements were incurred or applied in accordance with any appli…,78,ACCOUNTABILITY REPORT,Financial narrative,False
Grampian-2020-2021:p0078_001,12.314175,-1.5320272,ACCOUNTABILITY REPORT,Remuneration and Staff Report has been properly prepared in accordance with the National Health Service (Scotland) Act 1978 and directions made thereunder by the Scottish Ministers. Statutory other information The Accou…,78,ACCOUNTABILITY REPORT,Governance,False
Grampian-2020-2021:p0078_002,12.330021,-1.7291284,ACCOUNTABILITY REPORT,"performed, I conclude that there is a material misstatement of this statutory other information, I am required to report that fact. I have nothing to report in this regard. My opinion on the financial statements does no…",78,ACCOUNTABILITY REPORT,Financial narrative,False
Grampian-2020-2021:p0079_000,12.345742,-1.6404661,FINANCIAL STATEMENTS,"In my opinion, based on the work undertaken in the course of the audit: - the information given in the Performance Report for the financial year for which the financial statements are prepared is consistent with the fin…",79,FINANCIAL STATEMENTS,Financial narrative,False
Grampian-2020-2021:p0079_001,12.416983,-1.7229877,FINANCIAL STATEMENTS,records have not been kept; or - the financial statements and the audited part of the Remuneration and Staff Report are not in agreement with the accounting records; or - I have not received all the information and expl…,79,FINANCIAL STATEMENTS,Financial narrative,False
Grampian-2020-2021:table_p0080,3.246415,4.217603,FINANCIAL STATEMENTS,Financial table on page 80 (Income Statement) Contains 18 line items across 9 columns. Key items: NHS | Endowment | IntraGroup | Aberdeen; Grampian | Funds | Adjustments | City; 2020/21 | 2020/21 | 2020/21 | 2020/21; £’…,80,FINANCIAL STATEMENTS,Financial table,False
Grampian-2020-2021:table_p0081,3.304588,4.2755003,FINANCIAL STATEMENTS,Financial table on page 81 (Income Statement) Contains 18 line items across 10 columns. Key items: NHSE | ndowmentI | ntraGroup | Aberdeen; Grampian | FundsA | djustments | CityA; 2019/20 | 2019/20 | 2019/20 | 2019/20;…,81,FINANCIAL STATEMENTS,Financial table,False
Grampian-2020-2021:table_p0082,3.0574927,4.4999795,FINANCIAL STATEMENTS,Financial table on page 82 (Property) Contains 40 line items across 10 columns. Key items: NHS | Endowment | IntraGroup | Aberdeen; Grampian | Funds | Adjustments | City; 2020/21 | 2020/21 | 2020/21 | 2020/21; £’000 | £…,82,FINANCIAL STATEMENTS,Financial table,False
Grampian-2020-2021:table_p0083,3.1855404,4.4209666,FINANCIAL STATEMENTS,Financial table on page 83 (Property) Contains 40 line items across 10 columns. Key items: NHS | Endowment | IntraGroup | Aberdeen; Grampian | FundsA | djustments | CityA; 2019/20 | 2019/20 | 2019/20 | 2019/20; £’000 |…,83,FINANCIAL STATEMENTS,Financial table,False
Grampian-2020-2021:table_p0084,2.9126246,3.8311443,FINANCIAL STATEMENTS,Financial table on page 84 (Property) Contains 37 line items across 11 columns. Row labels: CONSOLIDATEDCASHFLOWSTATEMENTFORTHEYEARENDED31M. Key items: CONSOLIDATEDCASHFLOWSTATEMENTFORTHEYEARENDED31M | ARCH2021; Endowme…,84,FINANCIAL STATEMENTS,Financial table,False
Grampian-2020-2021:table_p0085,2.8931987,3.9282668,FINANCIAL STATEMENTS,Financial table on page 85 (Cash Flow) Contains 36 line items across 12 columns. Row labels: CONSOLIDATEDCASHFLOWSTATEMENTFORTHEYEARENDED31M. Key items: CONSOLIDATEDCASHFLOWSTATEMENTFORTHEYEARENDED31M | ARCH2020; Endowm…,85,FINANCIAL STATEMENTS,Financial table,False
Grampian-2020-2021:table_p0086,2.906921,4.038322,FINANCIAL STATEMENTS,Financial table on page 86 (Property) Contains 19 line items across 14 columns. Row labels: Balanceat31March2019. Key items: Revaluation | Endowment | Revaluati | onF; Note | GeneralFund | ReserveTo | talReserves; £’000…,86,FINANCIAL STATEMENTS,Financial table,False
Grampian-2020-2021:p0087_000,12.063311,-1.2248387,FINANCIAL STATEMENTS,"1) Authority In accordance with the accounts direction issued by Scottish Ministers under the Public Finance and Accountability (Scotland) Act 2000 appended, these Accounts have been prepared in accordance with the Gove…",87,FINANCIAL STATEMENTS,Financial narrative,False
Grampian-2020-2021:p0087_001,12.393563,3.046167,FINANCIAL STATEMENTS,"are significant to the financial statements are disclosed in section 29 below. 1(a) Disclosure of new accounting standards There were no new standards, amendments and interpretations effective in 2020/21 for the first t…",87,FINANCIAL STATEMENTS,Financial narrative,False
Grampian-2020-2021:p0087_002,12.373881,3.1166873,FINANCIAL STATEMENTS,"provides enhanced disclosures to improve transparency of reporting on capital employed. Under IFRS 16, lessees are required to recognise assets and liabilities for leases with a term of more than 12 months, unless the u…",87,FINANCIAL STATEMENTS,Financial narrative,False
Grampian-2020-2021:p0088_000,12.328695,3.1174812,FINANCIAL STATEMENTS,"depreciation and interest to be charged on the right-of-use asset and lease liability, respectively. Cash repayments will also be recognised in the Statement of Cash Flows, as required by IAS 7. Impact of the new standa…",88,FINANCIAL STATEMENTS,Financial narrative,False
Grampian-2020-2021:p0088_001,12.2926855,3.0377944,FINANCIAL STATEMENTS,liability of £42.4 million. IFRS 16 – Impacts to the SoCNE £m 2021-22 anticipated depreciation 4.158 2021-22 interest expense expected 0.687 2021-22 IAS 17-basis rental payments expected (4.113) Net impact to SoCNE in t…,88,FINANCIAL STATEMENTS,Financial table,False
Grampian-2020-2021:p0088_002,10.845401,0.7322399,FINANCIAL STATEMENTS,which were established by the NHS (Scotland) Act 1978. The legal framework under which charities operate in Scotland is the Charities and Trustee Investment (Scotland) Act 2005. Under the 1978 Act Endowment Trustees are…,88,FINANCIAL STATEMENTS,Financial narrative,False
Grampian-2020-2021:p0089_000,10.461667,-0.03623812,FINANCIAL STATEMENTS,"Boards (IJBs); Moray, Aberdeen City and Aberdeenshire, established under the terms of the Public Bodies (Joint Working) (Scotland) Act 2014 and associated secondary legislation. In accordance with IFRS 11 –",89,FINANCIAL STATEMENTS,Financial narrative,False
Grampian-2020-2021:p0089_001,10.813444,0.15005557,FINANCIAL STATEMENTS,Joint Arrangements each IJB is considered to be a Joint Venture and the primary financial statements have been amended for the additional disclosure required to accurately reflect the interest of IJBs using the equity m…,89,FINANCIAL STATEMENTS,Financial narrative,False
Grampian-2020-2021:p0089_002,10.982853,2.4132264,FINANCIAL STATEMENTS,"be exchanged between knowledgeable, willing parties in an arms-length transaction. 6) Funding 6 (a) Grampian Health Board Most of the expenditure of the Health Board as Commissioner is met from funds advanced by the Sco…",89,FINANCIAL STATEMENTS,Financial narrative,False
Grampian-2020-2021:p0089_003,10.992415,2.347495,FINANCIAL STATEMENTS,"out-with the RRL is allocated to match actual expenditure incurred for the provision of specific pharmaceutical, dental or ophthalmic services identified by the Scottish Government. Non-discretionary expenditure is disc…",89,FINANCIAL STATEMENTS,Financial narrative,False
Grampian-2020-2021:p0090_000,11.322118,2.448142,FINANCIAL STATEMENTS,"been received, and is measured at the fair value of those goods and services. Expenditure is recognised in the Statement of Comprehensive Net Expenditure except where it results in the creation of a non-current asset su…",90,FINANCIAL STATEMENTS,Financial narrative,False
Grampian-2020-2021:p0090_001,11.686925,2.7044704,FINANCIAL STATEMENTS,"the classification of the original legacy or donation in line with the donor’s stated wishes. All expenditure, including grants, is accounted for on an accruals basis and is only incurred where this will further the cha…",90,FINANCIAL STATEMENTS,Financial narrative,False
Grampian-2020-2021:p0090_002,12.541863,3.6328344,FINANCIAL STATEMENTS,"Property, Plant and Equipment is capitalised where: it is held for use in delivering services or for administrative purposes; it is probable that future economic benefits will flow to, or service potential be provided t…",90,FINANCIAL STATEMENTS,Financial narrative,False
Grampian-2020-2021:p0091_000,12.027104,3.5202549,FINANCIAL STATEMENTS,"Valuation: All property, plant and equipment assets are measured initially at cost, representing the costs directly attributable to acquiring or constructing the asset and bringing it to the location and condition neces…",91,FINANCIAL STATEMENTS,Financial narrative,False
Grampian-2020-2021:p0091_001,11.9448805,3.6097407,FINANCIAL STATEMENTS,"agreed programme. All property assets are subject to a full professional valuation at least every 5 years, but more frequently should market forces dictate, and adjusted in intervening years to take account of movements…",91,FINANCIAL STATEMENTS,Financial narrative,False
Grampian-2020-2021:p0091_002,12.097953,3.6948378,FINANCIAL STATEMENTS,all other assets in the same category. These assets are also subject to impairment review. To meet the underlying objectives established by the Scottish Government the following accepted variations of the RICS Appraisal…,91,FINANCIAL STATEMENTS,Financial narrative,False
Grampian-2020-2021:p0092_000,11.977173,4.1544156,FINANCIAL STATEMENTS,For large complex backlog maintenance projects the nature of the work can vary significantly as the programme progresses and it is often difficult to accurately analyse work in progress between the aspects of the progra…,92,FINANCIAL STATEMENTS,Financial narrative,False
Grampian-2020-2021:p0092_001,12.046896,4.0277443,FINANCIAL STATEMENTS,"Impairment: Increases in asset values arising from revaluations are recognised in the revaluation reserve, except where, and to the extent that, they reverse impairment previously recognised in the Statement of Comprehe…",92,FINANCIAL STATEMENTS,Financial narrative,False
Grampian-2020-2021:p0092_002,12.359529,3.801577,FINANCIAL STATEMENTS,"in the Statement of Comprehensive Net Expenditure. 7(c) Depreciation Items of Property, Plant and Equipment are depreciated to their estimated residual value over their remaining useful economic lives in a manner consis…",92,FINANCIAL STATEMENTS,Financial narrative,False
Grampian-2020-2021:p0093_000,12.557587,3.9715633,FINANCIAL STATEMENTS,economic life determined by the Board’s appointed valuers. The following asset lives have been used: Useful Life Buildings Structure 20-90 Buildings Engineering 5-35 Moveable engineering plant and equipment and equipmen…,93,FINANCIAL STATEMENTS,Financial narrative,False
Grampian-2020-2021:p0094_000,12.535147,3.9675577,FINANCIAL STATEMENTS,"Software which is integral to the operation of hardware e.g. an operating system is capitalised as part of the relevant item of property, plant and equipment. Software which is not integral to the operation of hardware…",94,FINANCIAL STATEMENTS,Financial narrative,False
Grampian-2020-2021:p0094_001,12.089264,4.1441317,FINANCIAL STATEMENTS,"that it is capable of operating in the manner intended by management. Subsequently intangible assets that are not held for their service potential (i.e. assets held for sale), including operational assets which are surp…",94,FINANCIAL STATEMENTS,Financial narrative,False
Grampian-2020-2021:p0094_002,11.917668,4.2863765,FINANCIAL STATEMENTS,"and to the extent that, they reverse impairment previously recognised in the Statement of Comprehensive Net Expenditure, in which case they are recognised in income. Permanent decreases in asset values and impairments a…",94,FINANCIAL STATEMENTS,Financial narrative,False
