id,x,y,label,text,page,section,category,highlight
Shetland-2024-2025:p0002_000,-0.52842844,1.2230897,31 MARCH 2025,Table of Contents Annual Accounts and Notes for Year Ended 31 March 2025 ..................................... 1 Performance Overview Report ..............................................................................…,2,31 MARCH 2025,Financial narrative,False
Shetland-2024-2025:p0002_001,10.629276,8.42908,31 MARCH 2025,income .............................................. 71 Reporting on other requirements .......................................................................... 72 Use of my report ...................................…,2,31 MARCH 2025,Financial narrative,False
Shetland-2024-2025:p0003_000,-0.47870508,1.3363277,31 MARCH 2025,Note 2—Notes to the Cash Flow Statement ......................................................... 98 Note 3—Expenditure .......................................................................................... 101 Note…,3,31 MARCH 2025,Financial narrative,False
Shetland-2024-2025:p0004_000,10.631343,11.7959585,PERFORMANCE OVERVIEW REPORT,"Annual Accounts and Notes for Year Ended 31 March 2025 Performance Overview Report Section 1—Chief Executive’s Statement It has been a year marked by significant pressure on our health and care system, particularly with…",4,PERFORMANCE OVERVIEW REPORT,Financial narrative,False
Shetland-2024-2025:p0004_001,10.240746,11.190011,PERFORMANCE OVERVIEW REPORT,"a result of structural surveys , we were required to relocate a number of departments to facilitate the safe erection of scaffolding and enable the commencement of essential external repairs. This has not been an easy p…",4,PERFORMANCE OVERVIEW REPORT,Clinical performance,False
Shetland-2024-2025:p0004_002,10.531397,11.323129,PERFORMANCE OVERVIEW REPORT,these frameworks provide clarity on the steps we must take to secure a sustainable future for health and care services in Shetland. One notable success stemming from our financial planning was securing recurrent funding…,4,PERFORMANCE OVERVIEW REPORT,Financial narrative,False
Shetland-2024-2025:p0005_000,10.382257,11.810666,PERFORMANCE OVERVIEW REPORT,"longer, with easy access to person-centred, high-quality care as close to home as possible. Building on that intent, we have been developing the final piece of our strategic jigsaw: the NHS Shetland Workforce Plan. This…",5,PERFORMANCE OVERVIEW REPORT,Clinical performance,False
Shetland-2024-2025:p0005_001,10.317627,11.94733,PERFORMANCE OVERVIEW REPORT,"our commitment to listen and learn from the people we serve, this year we took NHS Shetland “on the road”. Our participation in the Cunningsburgh, Walls and Unst country shows gave us the chance to speak directly with m…",5,PERFORMANCE OVERVIEW REPORT,Clinical performance,False
Shetland-2024-2025:p0005_002,10.410223,11.926807,PERFORMANCE OVERVIEW REPORT,"the UK to receive the new Credential in Rural and Remote Health , further enhancing the capability of our Emergency Medicine provision. Director of Dentistry at NHS Shetland Antony Visocchi has been accepted onto the Pr…",5,PERFORMANCE OVERVIEW REPORT,Governance,False
Shetland-2024-2025:p0005_003,10.333062,11.969506,PERFORMANCE OVERVIEW REPORT,"environment for our staff. In February 2025 the Realistic Medicine educational symposium provided an excellent opportunity for staff to partake in workshops, share posters, and listen to talks focused on building our ap…",5,PERFORMANCE OVERVIEW REPORT,Clinical performance,False
Shetland-2024-2025:p0006_000,10.410614,11.685309,PERFORMANCE OVERVIEW REPORT,"the public who make our work possible. Together, we have laid strong foundations to ensure that NHS Shetland remains resilient, person-centred, and responsive to the needs of those we serve. Brian Chittick, Chief Execut…",6,PERFORMANCE OVERVIEW REPORT,Clinical performance,False
Shetland-2024-2025:p0007_000,10.043744,11.429907,PERFORMANCE OVERVIEW REPORT,"This overview will give the reader a summary of what an NHS (National Health Service) Board does. It will also describe the nature of NHS Shetland, our purpose, the key risks to the achievement of our objectives , and o…",7,PERFORMANCE OVERVIEW REPORT,Governance,False
Shetland-2024-2025:p0007_001,10.203005,11.726873,PERFORMANCE OVERVIEW REPORT,Board include: - improving and protecting the health of the local people; - providing an improved health service for local people; - focusing clearly on health outcomes and people’s experience of their local NHS system;…,7,PERFORMANCE OVERVIEW REPORT,Governance,False
Shetland-2024-2025:p0008_000,10.323619,11.61851,FIGURE 1—MAP OF SHETLAND,Figure 2—Diagram of NHS Shetland Summary Organisational Structure Figure 2 above outlines a summary of NHS Shetland’s organisational structure. The detailed organisational management structure for NHS Shetland is availa…,8,FIGURE 1—MAP OF SHETLAND,Strategy / narrative,False
Shetland-2024-2025:p0009_000,10.015524,12.15381,DIRECTLY PROVIDED HEALTHCARE,"services from partners. - Table 1 - NHS Shetland at a glance Directly Provided Healthcare Commissioned Healthcare Services Nine General Practitioner (GP) One GP practice with 822 registered practices with 22,110 registe…",9,DIRECTLY PROVIDED HEALTHCARE,Strategy / narrative,False
Shetland-2024-2025:p0009_001,9.917617,11.302924,DIRECTLY PROVIDED HEALTHCARE,Tertiary Specialist Services - Summary of NHS Shetland Priority Outcomes in 2024–25 The 2024–25 Annual Delivery Plan ( ADP ) was submitted to Scottish Government on 13 March 2024. Scottish Government formally approved t…,9,DIRECTLY PROVIDED HEALTHCARE,Strategy / narrative,False
Shetland-2024-2025:p0011_000,10.539479,10.787388,DIRECTLY PROVIDED HEALTHCARE,"closer, to minimise the need for travelling both on and off island for patients attending out-patients. The key new development to bring services closer to home in 2024–25 is the permanent part community funded MRI scan…",11,DIRECTLY PROVIDED HEALTHCARE,Strategy / narrative,False
Shetland-2024-2025:p0011_001,10.426657,10.6917305,DIRECTLY PROVIDED HEALTHCARE,"monitor risk throughout 2024–25, with an interim report going to a Board meeting in December 2024 and a further update in April 2025. The Board reviewed the Risk Management Summary Report for 2024–25 and work plan for 2…",11,DIRECTLY PROVIDED HEALTHCARE,Governance,False
Shetland-2024-2025:p0011_002,10.157643,11.212702,DIRECTLY PROVIDED HEALTHCARE,"Shetland faces unique challenges as a remote and rural factors healthcare provider that include workforce shortages, ageing infrastructure, and reliance on supplementary staff, compounded by external strategic factors s…",11,DIRECTLY PROVIDED HEALTHCARE,Strategy / narrative,False
Shetland-2024-2025:p0012_000,10.6685505,10.116227,RISK DESCRIPTION,3. Conduct annual risk assessments for climate-related vulnerabilities in healthcare facilities. SR06: Our Staff If low levels of compliance with mandatory Information Information Governance training then there is a ris…,12,RISK DESCRIPTION,Governance,False
Shetland-2024-2025:p0012_001,10.529999,10.473511,RISK DESCRIPTION,"disclosure. Failure Due to This could result in disruption to services caused by system Cyber Attack downtime, risk of delays in treatment, risk to public reputation and significant financial costs for a full system rec…",12,RISK DESCRIPTION,Financial narrative,False
Shetland-2024-2025:table_p0013,-0.35992453,0.4939412,RISK DESCRIPTION,"Financial table on page 13 (Unknown) Contains 17 line items across 2 columns. Column headers: Incon | trast,staffsickleavecontinuestoremainthelowestamongsttheterritorial. Row labels: board; Action; •. Key items: board |…",13,RISK DESCRIPTION,Financial table,False
Shetland-2024-2025:p0014_000,8.794349,7.1866617,SECTION 4—PERFORMANCE SUMMARY APPRAISAL,- Financial Performance The Scottish Government requires NHS Boards to meet three key financial targets: - A Revenue Resource limit (RRL) - a resource budget for ongoing activity; - A Capital Resource limit (CRL) - a re…,14,SECTION 4—PERFORMANCE SUMMARY APPRAISAL,Financial narrative,False
Shetland-2024-2025:table_p0015,-0.41341323,0.79618156,SECTION 4—PERFORMANCE SUMMARY APPRAISAL,Financial table on page 15 (Unknown) Contains 2 line items across 6 columns. Column headers: Compliance | NationalTarget | 2022–23 | 2023–24 | 2024–25 | Movement. Row labels: ×; ×. Key items: × | 18weeksfromGPreferralto…,15,SECTION 4—PERFORMANCE SUMMARY APPRAISAL,Financial table,False
Shetland-2024-2025:table_p0016,-0.4960674,0.7512689,COMPLIANCE NATIONAL TARGET,Financial table on page 16 (Unknown) Contains 9 line items across 6 columns. Column headers: Compliance | NationalTarget | 2022–23 | 2023–24 | 2024–25 | Movement. Row labels: ×; ×; ✓; ✓; ×. Key items: × | Thepercentageo…,16,COMPLIANCE NATIONAL TARGET,Financial table,False
Shetland-2024-2025:p0017_000,10.102237,11.6938305,SECTION 5—PERFORMANCE ANALYSIS REPORT,"- Objectives of NHS Shetland During 2024–25, NHS Shetland has continued to focus on our strategic intent to provide easy access to high quality, sustainable and person-centred care as close to home as possible and make…",17,SECTION 5—PERFORMANCE ANALYSIS REPORT,Clinical performance,False
Shetland-2024-2025:p0017_001,9.933752,11.369375,SECTION 5—PERFORMANCE ANALYSIS REPORT,Strategy . Some steps that have been taken as part of this strategy include: - Using feedback from patients and their families or carers to learn from incidents and adverse events to inform service quality reviews; - Wo…,17,SECTION 5—PERFORMANCE ANALYSIS REPORT,Clinical performance,False
Shetland-2024-2025:p0017_002,10.022459,11.386128,SECTION 5—PERFORMANCE ANALYSIS REPORT,improving Health and Social Care integration; o Cancer Action Plan; o Optimising the use of digital and data technologies in the design and delivery of health and care service for improved patient access; and o Climate…,17,SECTION 5—PERFORMANCE ANALYSIS REPORT,Clinical performance,False
Shetland-2024-2025:p0018_000,10.552749,11.913874,SECTION 5—PERFORMANCE ANALYSIS REPORT,- Sustainable Services - Organisational Issues The NHS Shetland Clinical and Care Strategy aims to meet this priority through: - Integration of services around the needs of local communities; - Making sure the care prov…,18,SECTION 5—PERFORMANCE ANALYSIS REPORT,Clinical performance,False
Shetland-2024-2025:p0018_001,10.5639,12.1082735,SECTION 5—PERFORMANCE ANALYSIS REPORT,"minor impact on services. Over the next two years, with completion in 2027, there will be more significant impact on services as extensive remedial work is required to be undertaken to preserve and maintain the hospital…",18,SECTION 5—PERFORMANCE ANALYSIS REPORT,Clinical performance,False
Shetland-2024-2025:p0018_002,10.683638,11.462077,SECTION 5—PERFORMANCE ANALYSIS REPORT,its delivery. In respect of service repatriation the opening of Helyer MRI suite was the principle new service change with 842 attendances. A walk through video was created to help support patients prepare for their vis…,18,SECTION 5—PERFORMANCE ANALYSIS REPORT,Clinical performance,False
Shetland-2024-2025:p0018_003,9.933446,11.08161,SECTION 5—PERFORMANCE ANALYSIS REPORT,"The IJB, Shetland Islands Council and NHS Shetland jointly agreed the joint strategic plan for 2025-2028 for working together to provide supportive and sustainable services.",18,SECTION 5—PERFORMANCE ANALYSIS REPORT,Clinical performance,False
Shetland-2024-2025:table_p0019,-0.49066147,0.6501324,SECTION 5—PERFORMANCE ANALYSIS REPORT,"Financial table on page 19 (Unknown) Contains 3 line items across 2 columns. Column headers: out,th | eIJBisrequiredtopaycarefulattentionto:. Row labels: •; •; •. Key items: • | TheNationalHealthandWellbeingOutcomes;; •…",19,SECTION 5—PERFORMANCE ANALYSIS REPORT,Financial table,False
Shetland-2024-2025:p0020_000,8.723245,7.481344,SECTION 5—PERFORMANCE ANALYSIS REPORT,"The Financial Plan for 2024–25 identified a recurring financial gap of £3.482 million, equivalent to 5.6% of the Board’s opening baseline resource allocation. However, only £0.593 million of recurring savings were achie…",20,SECTION 5—PERFORMANCE ANALYSIS REPORT,Financial narrative,False
Shetland-2024-2025:p0020_001,8.621426,7.6466336,SECTION 5—PERFORMANCE ANALYSIS REPORT,"were critical in managing in-year financial pressures and offsetting the shortfall in recurring savings. Non-recurring savings also helped mitigate the impact of cost pressures, particularly those arising from the use o…",20,SECTION 5—PERFORMANCE ANALYSIS REPORT,Financial table,False
Shetland-2024-2025:p0020_002,8.587559,7.5761147,SECTION 5—PERFORMANCE ANALYSIS REPORT,The Scottish Government approved this plan on 31 March 2025. The Board recognises its statutory financial obligation under section 85 of the National Health Services (Scotland) Act 1978 to achieve financial balance at t…,20,SECTION 5—PERFORMANCE ANALYSIS REPORT,Financial narrative,False
Shetland-2024-2025:p0021_000,9.29409,7.1746054,SECTION 5—PERFORMANCE ANALYSIS REPORT,Board’s Clinical and Care Strategy . Management will ensure it takes significant and appropriate management action to achieve financial balance at 2025–26 year-end. Regular updates will be given to the Board on performa…,21,SECTION 5—PERFORMANCE ANALYSIS REPORT,Financial narrative,False
Shetland-2024-2025:p0021_001,9.534371,6.811274,SECTION 5—PERFORMANCE ANALYSIS REPORT,"Bain Hospital, Medical Equipment 0.797 Non-Medical Equipment 0.118 MRI Scanner infrastructure 0.652 Property for staff accommodation 0.145 Donated Asset (MRI Scanner) 0.794 Right of Use (RoU) additions [1] 2.346 Gross A…",21,SECTION 5—PERFORMANCE ANALYSIS REPORT,Clinical performance,False
Shetland-2024-2025:p0022_000,8.745424,6.982694,SECTION 5—PERFORMANCE ANALYSIS REPORT,"shows net current liabilities. The total net current liabilities stood at £6.977m, an increase of £3.101m from the previous year’s figure of £3.876m. Despite the level of net current liabilities and the financial challe…",22,SECTION 5—PERFORMANCE ANALYSIS REPORT,Financial narrative,False
Shetland-2024-2025:p0022_001,8.919131,8.30561,SECTION 5—PERFORMANCE ANALYSIS REPORT,"working days, across all public bodies. The statistics below, which relate to all suppliers, are calculated using “invoice received” date, as opposed to invoice date. - In 2024–25 the average credit taken was 16 days (c…",22,SECTION 5—PERFORMANCE ANALYSIS REPORT,Clinical performance,False
Shetland-2024-2025:p0022_002,10.047473,12.689872,SECTION 5—PERFORMANCE ANALYSIS REPORT,"to build on its previous investment in the local Mental Health Service, although progress remains challenging. There are still ongoing difficulties in recruiting to all the substantive clinical staff posts within the se…",22,SECTION 5—PERFORMANCE ANALYSIS REPORT,Clinical performance,False
Shetland-2024-2025:p0023_000,9.911698,12.680792,SECTION 5—PERFORMANCE ANALYSIS REPORT,"referral While the service has been impacted by Covid-19, Figure 4 shows the performance- trend over the last five years has been significantly below the 90% access target, and unfortunately this has been the case over…",23,SECTION 5—PERFORMANCE ANALYSIS REPORT,Clinical performance,False
Shetland-2024-2025:p0023_001,10.03868,12.659022,SECTION 5—PERFORMANCE ANALYSIS REPORT,"to back years all patients were treated within 18-weeks across the year. The average waiting period in 2024–25 was 7.7 weeks, with the longest wait being 18 weeks. This comparable to then average waiting period in 2023–…",23,SECTION 5—PERFORMANCE ANALYSIS REPORT,Clinical performance,False
Shetland-2024-2025:p0024_000,9.8776,12.741473,DELAYED DISCHARGES,Delayed Discharges The number of patients delayed in hospital continues to be a focus of attention in pathway redesigns for a seamless transfer back to the most appropriate setting in the community. Figure 6—Delayed Dis…,24,DELAYED DISCHARGES,Strategy / narrative,False
Shetland-2024-2025:table_p0025,-0.31312442,0.5545689,DELAYED DISCHARGES,"Financial table on page 25 (Unknown) Contains 15 line items across 1 columns. Column headers: Ourpartnershipwork,withdedicatedSocialWorkinputtosupportthehospitalworking. Row labels: withtheIntermediateCareTeaminthecommu…",25,DELAYED DISCHARGES,Financial table,False
Shetland-2024-2025:p0026_000,9.737271,12.5023985,DELAYED DISCHARGES,"One of the initial impacts of the Covid-19 pandemic was a reduction in A&E attendance, in line with the rest of Scotland and the United Kingdom. As highlighted in Figure 9 below though activity is now back to pre-pandem…",26,DELAYED DISCHARGES,Strategy / narrative,False
Shetland-2024-2025:p0027_000,9.7761755,12.546261,DELAYED DISCHARGES,"hospital, compared to a Scottish average of 25.6%. In 2023–24, 19.8% of those who attended A&E were admitted to hospital, against a Scottish average of 24.6%. - Waiting Times Targets - Secondary Care Figure 10 below ill…",27,DELAYED DISCHARGES,Clinical performance,False
Shetland-2024-2025:p0027_001,9.899506,12.868776,DELAYED DISCHARGES,"appointment and / or treatment in Shetland Performance in meeting the 95% target of a first outpatient appointment within 12 weeks has been the primary issue in not meeting the 18-week access standard. As at March 2025,…",27,DELAYED DISCHARGES,Clinical performance,False
Shetland-2024-2025:table_p0028,-0.2012078,0.63818336,DELAYED DISCHARGES,"Financial table on page 28 (Unknown) Contains 15 line items across 1 columns. Column headers: Figure11—Waitinglessthan6weeksinrespectofoneormoreofthe8keydiagnostic. Row labels: tests; At31March2025,thenumberofpatientswa…",28,DELAYED DISCHARGES,Financial table,False
Shetland-2024-2025:p0029_000,9.898041,12.6237545,DELAYED DISCHARGES,"provided by NHS Grampian, which work to improve patient flow in this pathway for all the Health Boards they manage is continuing. However, regarding the 31-day cancer treatment target, figure 13 below shows NHS Shetland…",29,DELAYED DISCHARGES,Clinical performance,False
Shetland-2024-2025:p0029_001,9.757076,12.539652,DELAYED DISCHARGES,"will continue to experience risks in sustaining performance, particularly where individual visiting services have staffing issues. Work continues to make all pathways sustainable, as well as to address the additional re…",29,DELAYED DISCHARGES,Clinical performance,False
Shetland-2024-2025:p0030_000,9.774825,11.844362,ANALYSIS OF OTHER IMPORTANT NON-FINANCIAL INDICATORS,Primary Care The Scottish Government Health and Care Experience survey takes places every two years. The survey asks about people’s experiences of accessing and using General Practice care. The latest survey took place…,30,ANALYSIS OF OTHER IMPORTANT NON-FINANCIAL INDICATORS,Financial narrative,False
Shetland-2024-2025:p0030_001,9.736973,11.6419525,ANALYSIS OF OTHER IMPORTANT NON-FINANCIAL INDICATORS,a focus on sustainable multi-disciplinary team working. Public Health including Health Improvement and Tackling Health Inequalities Teams within the Public Health directorate continue to co-ordinate and deliver health p…,30,ANALYSIS OF OTHER IMPORTANT NON-FINANCIAL INDICATORS,Financial narrative,False
Shetland-2024-2025:p0030_002,9.561297,11.845677,ANALYSIS OF OTHER IMPORTANT NON-FINANCIAL INDICATORS,"reports on other local projects previously carried out to share local good practice. In respect of inequalities, the Board discussed and approved the Shetland Public Protection Committee Annual Report 2023–24, the Shetl…",30,ANALYSIS OF OTHER IMPORTANT NON-FINANCIAL INDICATORS,Financial narrative,False
Shetland-2024-2025:p0031_000,9.564826,12.026558,ANALYSIS OF OTHER IMPORTANT NON-FINANCIAL INDICATORS,"pneumococcal , shingles, baby and pre-school immunisations, human papilloma virus (HPV) teenage boosters and meningitis vaccinations in schools, bacille Calmette-Guerin (BCG) for high risk individuals, pertussis for pre…",31,ANALYSIS OF OTHER IMPORTANT NON-FINANCIAL INDICATORS,Financial narrative,False
Shetland-2024-2025:p0031_001,9.371956,11.769177,ANALYSIS OF OTHER IMPORTANT NON-FINANCIAL INDICATORS,the Health Improvement team continued its work throughout Shetland to improve the health and wellbeing of individuals or communities. The overall theme is to enable and encourage healthy choices. The focus of the teams…,31,ANALYSIS OF OTHER IMPORTANT NON-FINANCIAL INDICATORS,Financial narrative,False
Shetland-2024-2025:p0031_002,9.344266,11.705179,ANALYSIS OF OTHER IMPORTANT NON-FINANCIAL INDICATORS,"estates monitoring. Overall, the data demonstrates a high standard of infection prevention and control in NHS Shetland, with a strong audit programme demonstrating compliance to national standards. The positive Healthca…",31,ANALYSIS OF OTHER IMPORTANT NON-FINANCIAL INDICATORS,Financial narrative,False
Shetland-2024-2025:p0032_000,9.644419,11.233973,ANALYSIS OF OTHER IMPORTANT NON-FINANCIAL INDICATORS,annually to the Sustainable Scotland Network (SSN) on its progress. 2. Governance NHS Shetland has established a robust governance structure to oversee climate-related responsibilities: - Board-level oversight: The Boar…,32,ANALYSIS OF OTHER IMPORTANT NON-FINANCIAL INDICATORS,Financial narrative,False
Shetland-2024-2025:p0032_001,9.406821,11.409651,ANALYSIS OF OTHER IMPORTANT NON-FINANCIAL INDICATORS,strategy. - Use of Shetland Heat Energy and Power (SHEP) district heating. - Fleet transition to electric vehicles and active travel promotion. 4. Risk Management NHS Shetland uses the NHS Scotland Climate Change Adapta…,32,ANALYSIS OF OTHER IMPORTANT NON-FINANCIAL INDICATORS,Financial narrative,False
Shetland-2024-2025:p0033_000,9.793897,11.647945,ANALYSIS OF OTHER IMPORTANT NON-FINANCIAL INDICATORS,6. Risks and Opportunities Risks: - Delays in capital funding for hospital replacement. - Climate impacts on remote infrastructure and transport reliability. - Energy cost volatility. Opportunities: - Digital health red…,33,ANALYSIS OF OTHER IMPORTANT NON-FINANCIAL INDICATORS,Financial narrative,False
Shetland-2024-2025:p0033_001,10.037811,12.046489,ANALYSIS OF OTHER IMPORTANT NON-FINANCIAL INDICATORS,"expert physiotherapists offers a range of features, including a self-management programme, exercise routines and ongoing remote monitoring from qualified physiotherapists. - UNICEF UK Baby Friendly Initiative Reaccredit…",33,ANALYSIS OF OTHER IMPORTANT NON-FINANCIAL INDICATORS,Financial narrative,False
Shetland-2024-2025:p0033_002,10.062827,12.09814,ANALYSIS OF OTHER IMPORTANT NON-FINANCIAL INDICATORS,"Training Programme NHS Shetland Public Dental Service announced that dental nurses Miriam Moar and Ingrid Couper, were accepted on the NES Orthodontic Therapy Training Programme 2024/25. This innovative ‘on-Island’ mode…",33,ANALYSIS OF OTHER IMPORTANT NON-FINANCIAL INDICATORS,Financial narrative,False
Shetland-2024-2025:p0034_000,10.098316,11.846858,FIGURE 14—WALLS AGRICULTURAL SHOW PUBLIC ENGAGEMENT,"Training Programme – NHS Shetland. - Public Engagement at Agricultural Shows Figure 14—Walls Agricultural Show Public Engagement Colleagues from NHS Shetland and Scottish Ambulance Service attended the Cunningsburgh, Wa…",34,FIGURE 14—WALLS AGRICULTURAL SHOW PUBLIC ENGAGEMENT,Strategy / narrative,False
Shetland-2024-2025:p0035_000,9.917599,11.700831,FIGURE 14—WALLS AGRICULTURAL SHOW PUBLIC ENGAGEMENT,"outreach by the Methodist Church. Food for the Way hopes to provide social contact and therapeutic activities for individuals and their families affected by alcohol and drug use. As part of the project, two extra parkin…",35,FIGURE 14—WALLS AGRICULTURAL SHOW PUBLIC ENGAGEMENT,Strategy / narrative,False
Shetland-2024-2025:p0036_000,10.140689,8.874399,ACCOUNTABILITY REPORT,Corporate Governance Report Directors’ Report - Date of Issue The Accountable Officer authorised these audited accounts for issue on 26 June 2025 as that was the date the accounts were approved by the Board. - Appointme…,36,ACCOUNTABILITY REPORT,Financial narrative,False
Shetland-2024-2025:p0037_000,9.813515,8.979378,POSITION HELD,"Stakeholder Non-Executive Board Position Held Members Bruce McCulloch Employee Director Emma Macdonald Local Authority Representative Under the terms of the Scottish Health Plan, the Health Board is a board of governanc…",37,POSITION HELD,Governance,False
Shetland-2024-2025:p0037_001,9.73661,8.460462,POSITION HELD,"in this report. The names and positions of the Board Members are set out above. - Board Members’ and senior managers’ interests Details of any interests of Board members, senior managers and other senior staff in contra…",37,POSITION HELD,Governance,False
Shetland-2024-2025:p0037_002,9.976944,8.224883,POSITION HELD,has not provided a qualifying third-party indemnity provision for any of its Directors at any time during the financial year 2024–25 (nor were any provided in 2023– 24). - Remuneration for non-audit work Audit Scotland…,37,POSITION HELD,Financial narrative,False
Shetland-2024-2025:p0038_000,10.660719,9.761791,POSITION HELD,"Sections 31 and 32 of the Public Services Reform (Scotland) Act 2010 imposed duties on the Scottish Government, as well as listed Public Bodies, to publish information on expenditure and certain other matters as soon as…",38,POSITION HELD,Financial narrative,False
Shetland-2024-2025:p0038_001,10.7131405,9.315717,POSITION HELD,"recommendations for improvements to procedures and, in cases involving human error, highlighted the importance of ensuring staff training was effective and up-to-date. - Disclosure of Information to Auditor The Director…",38,POSITION HELD,Governance,False
