id,x,y,label,text,page,section,category,highlight
Shetland-2024-2025:p0039_000,11.24232,8.248127,THE STATEMENT OF ACCOUNTABLE OFFICER’S RESPONSIBILITIES,"Under Section 15 of the Public Finance and Accountability (Scotland) Act, 2000, The Principal Accountable Officer of the Scottish Government has appointed me as Accountable Officer of Shetland NHS Board. This designatio…",39,THE STATEMENT OF ACCOUNTABLE OFFICER’S RESPONSIBILITIES,Financial narrative,False
Shetland-2024-2025:p0039_001,11.40048,8.318252,THE STATEMENT OF ACCOUNTABLE OFFICER’S RESPONSIBILITIES,"been followed and disclosed and explain any material departures; - prepare the accounts on a going concern basis; I confirm that the Annual Report and Accounts as a whole are fair, balanced and reasonable and take perso…",39,THE STATEMENT OF ACCOUNTABLE OFFICER’S RESPONSIBILITIES,Financial narrative,False
Shetland-2024-2025:p0040_000,11.061212,8.206007,THE STATEMENT OF ACCOUNTABLE OFFICER’S RESPONSIBILITIES,"Under the National Health Service (Scotland) Act 1978, the Health Board is required to prepare accounts in accordance with the directions of Scottish Ministers which require that those accounts give a true and fair view…",40,THE STATEMENT OF ACCOUNTABLE OFFICER’S RESPONSIBILITIES,Financial narrative,False
Shetland-2024-2025:p0040_001,11.319727,8.274399,THE STATEMENT OF ACCOUNTABLE OFFICER’S RESPONSIBILITIES,"continue to operate. The Health Board Members are responsible for ensuring that proper accounting records are maintained which disclose, with reasonable accuracy at any time, the financial position of the Board and enab…",40,THE STATEMENT OF ACCOUNTABLE OFFICER’S RESPONSIBILITIES,Financial narrative,False
Shetland-2024-2025:p0041_000,10.251137,9.735767,GOVERNANCE STATEMENT,Scope of Responsibility As Accountable Officer I am responsible for maintaining an adequate and effective system of internal control that supports compliance with NHS Shetland’s policies and promotes achievement of NHS…,41,GOVERNANCE STATEMENT,Governance,False
Shetland-2024-2025:p0041_001,10.113717,9.720263,GOVERNANCE STATEMENT,"other than the annual Network and Information Systems Regulations 2018 audit. Purpose of the System of Internal Control The System of Internal Control is based on an ongoing process designed to identify, prioritise, and…",41,GOVERNANCE STATEMENT,Governance,False
Shetland-2024-2025:p0041_002,9.927934,10.627028,GOVERNANCE STATEMENT,Accounts. The SPFM is issued by the Scottish Ministers to provide guidance to the Scottish Government and other relevant bodies on the proper handling and reporting of public funds. The SPFM sets out the relevant statut…,41,GOVERNANCE STATEMENT,Financial narrative,False
Shetland-2024-2025:p0042_000,9.968829,10.537336,GOVERNANCE STATEMENT,The delivery of these objectives is normally set out in three key planning documents. One: NHS Shetland’s ADP sets out intended actions and the risks associated with delivering key national targets. It is signed off by…,42,GOVERNANCE STATEMENT,Governance,False
Shetland-2024-2025:p0042_002,9.666823,9.818493,GOVERNANCE STATEMENT,"strategic document of the IJB and acts as the strategic planning document for all health services including those directly managed and commissioned by the Health Board. The Board,",42,GOVERNANCE STATEMENT,Governance,False
Shetland-2024-2025:p0042_003,9.875899,11.124395,GOVERNANCE STATEMENT,SIC and IJB are jointly working to a shared vision and objectives for Health and Social care services and in-line with our joint plans updated this during March and April 2025 with the plan for 2025-28. Three: Discussio…,42,GOVERNANCE STATEMENT,Governance,False
Shetland-2024-2025:p0042_004,10.019657,10.429331,GOVERNANCE STATEMENT,"moving towards longer term, Shetland-focussed planning. Finally, NHS Shetland, together with its partners in the Shetland Partnership, works to deliver Shetland’s Local Outcome Improvement Plan. This describes the key a…",42,GOVERNANCE STATEMENT,Governance,False
Shetland-2024-2025:p0042_005,10.154592,9.333219,GOVERNANCE STATEMENT,"The Board’s governance framework includes the committees outlined on pages 41-47 of the Accountability Report, plus the Risk Management Group (RMG). The Board outlines the remit, role and responsibilities of these commi…",42,GOVERNANCE STATEMENT,Governance,False
Shetland-2024-2025:p0043_000,9.9827585,9.342572,CORPORATE GOVERNANCE,"At each normal public Board meeting the Board fulfils its performance management role by receiving and scrutinising reports on the Quality Strategy (including patient experience feedback), Service Performance (including…",43,CORPORATE GOVERNANCE,Governance,False
Shetland-2024-2025:p0044_000,9.822112,9.259163,CORPORATE GOVERNANCE,- Remuneration Committee; - General Medical Practitioners Committee; and - Reference Committee (for Primary Care contractors). The Board’s Corporate Governance handbook also refers to,44,CORPORATE GOVERNANCE,Governance,False
Shetland-2024-2025:p0044_001,9.909475,9.264567,CORPORATE GOVERNANCE,"the relationship with the IJB that came into its full duties on 20 November 2015. 2024–25 saw the loss of one Non-Executive Directors who has yet to be replaced, as outlined in the Board membership table above. Informat…",44,CORPORATE GOVERNANCE,Governance,False
Shetland-2024-2025:p0044_002,10.162381,9.310008,CORPORATE GOVERNANCE,Committee The Audit and Risk Committee now comprises four non-executive Board Members and was chaired in 2024–25 first by Colin Campbell and then on an interim basis by Joe Higgins before Gaynor Jones appointed permanen…,44,CORPORATE GOVERNANCE,Governance,False
Shetland-2024-2025:p0044_003,10.339212,9.375873,CORPORATE GOVERNANCE,"bodies and scrutinises the Annual Report and Annual Accounts in detail on behalf of the Board. The committee received four Internal Audit reports in 2024–25. These being Freedom of Information, Financial Savings Review,…",44,CORPORATE GOVERNANCE,Financial narrative,False
Shetland-2024-2025:p0045_000,9.9312315,8.636909,FREEDOM OF INFORMATION,"Recommendations Freedom of Information 1 Financial Savings Review 2 Supplementary Staffing 6 The committee agrees the Annual Internal Audit plan and receives the Chief Internal Auditors Annual Report. In 2024–25, that r…",45,FREEDOM OF INFORMATION,Financial narrative,False
Shetland-2024-2025:p0045_001,9.767504,8.216476,FREEDOM OF INFORMATION,"Security; - Business Continuity; and - Review and scrutiny of the Board’s ADP development. - Endowment Committee The Endowment Committee comprises all members of the Board, and the Chair is Lincoln Carroll. The committe…",45,FREEDOM OF INFORMATION,Governance,False
Shetland-2024-2025:table_p0046,-0.33099374,0.22786501,FREEDOM OF INFORMATION,Financial table on page 46 (Staff Costs) Contains 39 line items across 1 columns. Column headers: •StaffGovernanceCommittee. Row labels: ThemembershipoftheStaffGovernanceCommitteecomprisesfournon-executive; BoardMembers…,46,FREEDOM OF INFORMATION,Financial table,False
Shetland-2024-2025:p0047_000,10.246917,10.126734,AND HM (HIS MAJESTY’S) GOVERNMENT AND THE SPFM RISK MANAGEMENT - GOOD PRACTICE,"Internal Control: Standing Orders, Standing Financial Instructions, and approved Scheme of Delegation, is publicly available on the Board’s website. NHS Scotland bodies are subject to the requirements of the SPFM and mu…",47,AND HM (HIS MAJESTY’S) GOVERNMENT AND THE SPFM RISK MANAGEMENT - GOOD PRACTICE,Financial narrative,False
Shetland-2024-2025:p0047_001,10.2633295,10.074898,AND HM (HIS MAJESTY’S) GOVERNMENT AND THE SPFM RISK MANAGEMENT - GOOD PRACTICE,"and considered in-line with our risk register hierarchy as outlined below in figure 16. These are communicated to our Board and Governance Committees on a regular basis. Risk management is a dynamic process, with freque…",47,AND HM (HIS MAJESTY’S) GOVERNMENT AND THE SPFM RISK MANAGEMENT - GOOD PRACTICE,Governance,False
Shetland-2024-2025:p0048_000,10.146158,9.960833,FIGURE 18—DIAGRAM SHOWING RISK MANAGEMENT GOVERNANCE STRUCTURE,"Our risk management process uses a standard matrix, with red, amber, green status, and is utilised organisation-wide. The output from this review is included in the Risk Register. The strategic risks are reviewed on a r…",48,FIGURE 18—DIAGRAM SHOWING RISK MANAGEMENT GOVERNANCE STRUCTURE,Governance,False
Shetland-2024-2025:p0048_001,10.35094,9.574042,FIGURE 18—DIAGRAM SHOWING RISK MANAGEMENT GOVERNANCE STRUCTURE,"generally, the Board is committed to continuous development and improvement; developing systems in response to any relevant reviews; and developments in best practice. The Risk Management Summary Report 2024–25 was pres…",48,FIGURE 18—DIAGRAM SHOWING RISK MANAGEMENT GOVERNANCE STRUCTURE,Governance,False
Shetland-2024-2025:p0049_000,10.64339,9.74879,FIGURE 18—DIAGRAM SHOWING RISK MANAGEMENT GOVERNANCE STRUCTURE,"An adverse opinion would occur where controls were absent or failed. In 2024–25, the Practitioner Services service audit concluded that controls were suitably designed and operated effectively across all four payment st…",49,FIGURE 18—DIAGRAM SHOWING RISK MANAGEMENT GOVERNANCE STRUCTURE,Governance,False
Shetland-2024-2025:p0049_001,10.393784,9.870529,FIGURE 18—DIAGRAM SHOWING RISK MANAGEMENT GOVERNANCE STRUCTURE,"access reviews, timely removal of access, and completeness of user listings. These issues led to a qualified opinion. Management implemented redesigned controls during the year, including automation and expanded review…",49,FIGURE 18—DIAGRAM SHOWING RISK MANAGEMENT GOVERNANCE STRUCTURE,Governance,False
Shetland-2024-2025:p0049_002,10.542049,9.881508,FIGURE 18—DIAGRAM SHOWING RISK MANAGEMENT GOVERNANCE STRUCTURE,"service operated effectively throughout 2024–25, from 1 April 2024 to 31 March 2025. The previous years’ service audit concluded that the service operated effectively throughout 2023–24. - Whistleblowing The NHS Shetlan…",49,FIGURE 18—DIAGRAM SHOWING RISK MANAGEMENT GOVERNANCE STRUCTURE,Governance,False
Shetland-2024-2025:p0050_000,10.636188,10.023021,FIGURE 18—DIAGRAM SHOWING RISK MANAGEMENT GOVERNANCE STRUCTURE,"2025, 762 members of staff have a valid completion certificate. In addition staff have also completed eLearning modules in Procurement Fraud Awareness, and Competition and Markets Authority Bid Rigging in Public Procure…",50,FIGURE 18—DIAGRAM SHOWING RISK MANAGEMENT GOVERNANCE STRUCTURE,Governance,False
Shetland-2024-2025:p0050_001,10.794921,9.979278,FIGURE 18—DIAGRAM SHOWING RISK MANAGEMENT GOVERNANCE STRUCTURE,"Guardian, SIRO and Digital Lead. The Board approved the Information Governance Strategy 2022-2027 at its June 2022 meeting. There are clear links between the IG framework and the clinical governance framework, and the I…",50,FIGURE 18—DIAGRAM SHOWING RISK MANAGEMENT GOVERNANCE STRUCTURE,Governance,False
Shetland-2024-2025:p0050_002,10.755464,9.921587,FIGURE 18—DIAGRAM SHOWING RISK MANAGEMENT GOVERNANCE STRUCTURE,"These cases have all been closed as the ICO concluded that no further action was necessary. However, recommendations were made by the ICO for improvements to procedures and, in cases involving human error, it highlighte…",50,FIGURE 18—DIAGRAM SHOWING RISK MANAGEMENT GOVERNANCE STRUCTURE,Governance,False
Shetland-2024-2025:p0051_000,10.000713,9.656901,BEST VALUE,"The number of FoI requests in 2024–25 was 820, so in comparison to 2023–24 at 829 requests this is a slight drop of 9 requests, 1.1%. In respect of the Board’s obligation, 62% of requests were responded to on time, 75%…",51,BEST VALUE,Governance,False
Shetland-2024-2025:p0051_001,9.908947,9.4931965,BEST VALUE,"the SPFM. The Board incorporates the principles of best value within its planning, performance and delivery activities, ensuring that they are part of everyday business and integral to the Board’s decision making in all…",51,BEST VALUE,Governance,False
Shetland-2024-2025:p0052_000,10.557081,9.479743,REVIEW OF EFFECTIVENESS,I can confirm that the Board is compliant in all material respects with the aspects of the UK Corporate Governance Code as set out in the guidance issued by the SGHSCD to Chief Executives as being applicable to NHS Boar…,52,REVIEW OF EFFECTIVENESS,Governance,False
Shetland-2024-2025:p0052_001,10.539707,9.509013,REVIEW OF EFFECTIVENESS,adequacy and effectiveness of the Board's systems of internal control together with recommendations for improvement; - comments made by the External Auditor in their management letters and reports; and - the work of the…,52,REVIEW OF EFFECTIVENESS,Governance,False
Shetland-2024-2025:p0052_002,10.460973,9.299779,REVIEW OF EFFECTIVENESS,"Service Audit Reports received a clear opinion that relevant controls were properly in place throughout the year. As part of this process, the Directors and Committee Chairs have provided formal written Certificates of…",52,REVIEW OF EFFECTIVENESS,Governance,False
Shetland-2024-2025:p0053_000,10.291767,9.519521,SIGNIFICANT GOVERNANCE ISSUES,"the system of internal control by the Board, the Audit and Risk Committee, Staff Governance Committee, FPC, CGC, and RMG. Appropriate action is in place to address weaknesses and ensure continuous improvement of the sys…",53,SIGNIFICANT GOVERNANCE ISSUES,Governance,False
Shetland-2024-2025:p0054_000,9.427916,8.812972,REMUNERATION AND STAFF REPORT,"Remuneration Report - Board Members’ and Senior Employees’ Remuneration - Remuneration Committee membership (Unaudited) The members of the Remuneration Committee are the Chair and Vice-Chair of the Board, as well as the…",54,REMUNERATION AND STAFF REPORT,Governance,False
Shetland-2024-2025:p0054_001,9.320299,8.718541,REMUNERATION AND STAFF REPORT,"the Chief Executive the annual objectives for the other Executive Directors, as well as staff on the Senior Manager pay scale. The Committee considers performance against objectives, as well as the remuneration of these…",54,REMUNERATION AND STAFF REPORT,Governance,False
Shetland-2024-2025:table_p0055,0.03636866,-0.1340449,DIRECTOR’S GROSS,"Financial table on page 55 (Staff Costs) Contains 18 line items across 5 columns. Column headers: Director | Director’sGrossSalary(bandsof£5,000) | TotalEarningsinYear | PensionBenefits | TotalRemuneration. Row labels:…",55,DIRECTOR’S GROSS,Financial table,False
Shetland-2024-2025:p0056_000,8.916965,8.468487,DIRECTOR’S GROSS,"Pension Total Director Salary Earnings in Benefits Remuneration (bands of £5,000) Year Employee Director: 45-50 45-50 24 70-75 Bruce McCulloch [4] Total 429 Notes in respect of 2024–25 disclosure: 1. This Medical Direct…",56,DIRECTOR’S GROSS,Governance,False
Shetland-2024-2025:table_p0057,-0.19592819,-0.1932013,REAL INCREASE,"Financial table on page 57 (Unknown) Contains 7 line items across 6 columns. Column headers: Director | Accruedpensionatage60asat31March2025(bandsof£5,000)[1] | RealIncreaseinPensionatage60(bandsof£2,500)[1] | CETVat31M…",57,REAL INCREASE,Financial table,False
Shetland-2024-2025:table_p0058,-0.4171868,-0.09471012,REAL INCREASE,"Financial table on page 58 (Unknown) Contains 6 line items across 6 columns. Column headers: Director | Accruedpensionatage60asat31March2025(bandsof£5,000)[1] | RealIncreaseinPensionatage60(bandsof£2,500)[1] | CETVat31M…",58,REAL INCREASE,Financial table,False
Shetland-2024-2025:table_p0059,-0.024315981,-0.25087225,GROSS SALARY,"Financial table on page 59 (Staff Costs) Contains 13 line items across 5 columns. Column headers: Director | Director’sGrossSalary(bandsof£5,000) | TotalEarningsinYear | PensionBenefits | TotalRemuneration. Row labels:…",59,GROSS SALARY,Financial table,False
Shetland-2024-2025:table_p0060,0.0037810958,-0.2256276,GROSS SALARY,"Financial table on page 60 (Staff Costs) Contains 9 line items across 5 columns. Column headers: Director | Director’sGrossSalary(bandsof£5,000) | TotalEarningsinYear | PensionBenefits | TotalRemuneration. Row labels: C…",60,GROSS SALARY,Financial table,False
Shetland-2024-2025:p0061_000,8.805977,8.532554,GROSS SALARY,"6. This Employee Director’s salary includes £34k in respect of non-Board duties (Service Improvement Lead). 7. No other benefits in kind, to that in Note 2 above, were received in 2023–24. 8. No bonus payments were made…",61,GROSS SALARY,Governance,False
Shetland-2024-2025:table_p0062,-0.051774338,-0.26699233,GROSS SALARY,"Financial table on page 62 (Unknown) Contains 9 line items across 6 columns. Column headers: Director | Accruedpensionatage60asat31March2024(bandsof£5,000)[1] | RealIncreaseinPensionatage60(bandsof£2,500)[1] | CETVat31M…",62,GROSS SALARY,Financial table,False
Shetland-2024-2025:table_p0063,-0.08067082,-0.18905282,GROSS SALARY,"Financial table on page 63 (Staff Costs) Contains 4 line items across 6 columns. Column headers: Director | Accruedpensionatage60asat31March2024(bandsof£5,000)[1] | RealIncreaseinPensionatage60(bandsof£2,500)[1] | CETVa…",63,GROSS SALARY,Financial table,False
Shetland-2024-2025:table_p0064,-0.06599403,-0.2751637,GROSS SALARY,Financial table on page 64 (Staff Costs) Contains 14 line items across 4 columns. Row labels: Rangeofstaffremuneration; Highestearningdirector’sremuneration; Median(Totalpayandbenefits). Key items: 2025 | 2024 | Change;…,64,GROSS SALARY,Financial table,False
Shetland-2024-2025:table_p0065,-0.47417,-0.13887987,NUMBER OF STAFF,"Financial table on page 65 (Staff Costs) Contains 17 line items across 3 columns. Row labels: 2025; Number; 22; 4. Key items: 2025 | 2024; Number | Number; 22 | £70,001to£80,000 | 17; 4 | £80,001to£90,000 | 8. Table (he…",65,NUMBER OF STAFF,Financial table,False
Shetland-2024-2025:table_p0066,-0.1351317,-0.027717965,NUMBER OF STAFF,Financial table on page 66 (Staff Costs) Contains 9 line items across 7 columns. Column headers: | Salariesandwages | Socialsecuritycosts | NHSschemeemployers’costs | Inwardsecondees | Agencyandotherdirectlyengagedstaff…,66,NUMBER OF STAFF,Financial table,False
Shetland-2024-2025:p0067_000,8.548408,8.014518,WHOLE TIME EQUIVALENT,- Staff Numbers (Audited information except in respect of disabled staff): Whole Time Equivalent Executive Board Members 6 Non-Executive Members 2 Permanent staff 680 Inward Secondees [1] 0 Other Staff 0 Outward Seconde…,67,WHOLE TIME EQUIVALENT,Governance,False
Shetland-2024-2025:table_p0068,-0.08639953,0.0074902507,HEAD COUNT OF STAFF,Financial table on page 68 (Unknown) Contains 7 line items across 7 columns. Row labels: HeadCountofStaff; ExecutiveDirectors; Non-ExecutiveDirectorsandEmployeeDirector; SeniorEmployees. Key items: HeadCountofStaff | 20…,68,HEAD COUNT OF STAFF,Financial table,False
Shetland-2024-2025:p0069_000,9.089183,9.412818,THE TRADE UNION (FACILITY TIME PUBLICATION REQUIREMENTS) REGULATIONS 2017 CAME,- The Trade Union (Facility Time Publication Requirements) Regulations 2017 (Unaudited Information) The Trade Union (Facility Time Publication Requirements) Regulations 2017 came into force on 1 April 2017. The regulati…,69,THE TRADE UNION (FACILITY TIME PUBLICATION REQUIREMENTS) REGULATIONS 2017 CAME,Strategy / narrative,False
Shetland-2024-2025:p0070_000,9.112054,9.3876915,THE TRADE UNION (FACILITY TIME PUBLICATION REQUIREMENTS) REGULATIONS 2017 CAME,"- Percentage of pay bill spent on facility time £000s Total cost of facility time 5 Total pay bill 53,143 Percentage of the total pay bill spent on facility time 0.01% - Paid trade union activities Time spent on paid tr…",70,THE TRADE UNION (FACILITY TIME PUBLICATION REQUIREMENTS) REGULATIONS 2017 CAME,Strategy / narrative,False
Shetland-2024-2025:p0070_001,9.061032,9.571735,THE TRADE UNION (FACILITY TIME PUBLICATION REQUIREMENTS) REGULATIONS 2017 CAME,"a third-party payroll service provided by Liaison Financial Services Limited; or 3. Remunerated through the payroll of the Agency provider. - Staff Survey (Unaudited Information) NHS Shetland participates in iMatter , N…",70,THE TRADE UNION (FACILITY TIME PUBLICATION REQUIREMENTS) REGULATIONS 2017 CAME,Financial narrative,False
Shetland-2024-2025:p0071_000,9.295895,9.188606,THE TRADE UNION (FACILITY TIME PUBLICATION REQUIREMENTS) REGULATIONS 2017 CAME,the months ahead. This improvement plan is captured on a team ‘Storyboard’ which the team then uses to monitor progress prior to the next iMatter run. The process is completed annually. - Expenditure on Consultancy (Una…,71,THE TRADE UNION (FACILITY TIME PUBLICATION REQUIREMENTS) REGULATIONS 2017 CAME,Financial narrative,False
Shetland-2024-2025:p0071_001,9.204577,9.348965,THE TRADE UNION (FACILITY TIME PUBLICATION REQUIREMENTS) REGULATIONS 2017 CAME,"employability, and pay policy. Policies include eliminating Bullying and Harassment , Flexible Work Pattern , and Health and Safety . You can find further relevant documentation on NHS Shetland’s external website. - Par…",71,THE TRADE UNION (FACILITY TIME PUBLICATION REQUIREMENTS) REGULATIONS 2017 CAME,Clinical performance,False
Shetland-2024-2025:p0072_000,11.248783,8.240754,SCOTTISH PARLIAMENT,"Independent auditor’s report to the members of NHS Shetland, the Auditor General for Scotland and the Scottish Parliament Reporting on the audit of the financial statements Opinion on financial statements I have audited…",72,SCOTTISH PARLIAMENT,Financial narrative,False
Shetland-2024-2025:p0072_001,11.549834,8.6578045,SCOTTISH PARLIAMENT,accompanying financial statements: - give a true and fair view of the state of affairs of the board and its group as at 31 March 2025 and of the net expenditure for the year then ended; - have been properly prepared in…,72,SCOTTISH PARLIAMENT,Financial narrative,False
Shetland-2024-2025:p0072_002,11.672583,8.632138,SCOTTISH PARLIAMENT,"appointed by the Auditor General on 3 April 2024. My period of appointment is four years, covering 2023/24 to 2026/27. I am independent of the board and its group in accordance with the ethical requirements that are rel…",72,SCOTTISH PARLIAMENT,Financial narrative,False
Shetland-2024-2025:p0073_000,11.7577715,8.532257,SCOTTISH PARLIAMENT,"I have concluded that the use of the going concern basis of accounting in the preparation of the financial statements is appropriate. Based on the work I have performed, I have not identified any material uncertainties…",73,SCOTTISH PARLIAMENT,Financial narrative,False
Shetland-2024-2025:p0073_001,11.7564745,8.509135,SCOTTISH PARLIAMENT,Report the most significant assessed risks of material misstatement that I identified and my judgements thereon. Responsibilities of the Accountable Officer for the financial statements As explained more fully in the St…,73,SCOTTISH PARLIAMENT,Financial narrative,False
Shetland-2024-2025:p0073_002,11.769938,8.495401,SCOTTISH PARLIAMENT,"operations. Auditor’s responsibilities for the audit of the financial statements My objectives are to obtain reasonable assurance about whether the financial statements as a whole are free from material misstatement, wh…",73,SCOTTISH PARLIAMENT,Financial narrative,False
Shetland-2024-2025:p0074_000,11.911399,8.718697,SCOTTISH PARLIAMENT,"regulations. I design procedures in line with my responsibilities outlined above to detect material misstatements in respect of irregularities, including fraud. Procedures include: - using my understanding of the health…",74,SCOTTISH PARLIAMENT,Strategy / narrative,False
Shetland-2024-2025:p0074_001,11.998646,8.664559,SCOTTISH PARLIAMENT,"recognise non-compliance with laws and regulations. The extent to which my procedures are capable of detecting irregularities, including fraud, is affected by the inherent difficulty in detecting irregularities, the eff…",74,SCOTTISH PARLIAMENT,Strategy / narrative,False
Shetland-2024-2025:p0075_000,11.963525,8.571424,SCOTTISH PARLIAMENT,The Accountable Officer is responsible for ensuring the regularity of expenditure and income. In addition to my responsibilities in respect of irregularities explained in the audit of the financial statements section of…,75,SCOTTISH PARLIAMENT,Financial narrative,False
Shetland-2024-2025:p0075_001,11.948302,8.369262,SCOTTISH PARLIAMENT,report and accounts. The other information comprises the Performance Report and the Accountability Report excluding the audited parts of the Remuneration and Staff Report. My responsibility is to read all the other info…,75,SCOTTISH PARLIAMENT,Financial narrative,False
Shetland-2024-2025:p0075_002,11.810526,8.672571,SCOTTISH PARLIAMENT,do not express any form of assurance conclusion thereon except on the Performance Report and Governance Statement to the extent explicitly stated in the following opinions prescribed by the Auditor General for Scotland.…,75,SCOTTISH PARLIAMENT,Governance,False
Shetland-2024-2025:p0076_000,11.627355,8.410074,SCOTTISH PARLIAMENT,which the financial statements are prepared is consistent with the financial statements and that report has been prepared in accordance with the National Health Service (Scotland) Act 1978 and directions made thereunder…,76,SCOTTISH PARLIAMENT,Financial narrative,False
Shetland-2024-2025:p0076_001,11.58641,8.485049,SCOTTISH PARLIAMENT,"my responsibilities for the annual report and accounts, my conclusions on the wider scope responsibilities specified in the Code of Audit Practice are set out in my Annual Audit Report. Use of my report This report is m…",76,SCOTTISH PARLIAMENT,Financial narrative,False
Shetland-2024-2025:table_p0077,-0.6785313,0.49277842,31 MARCH 2025,"Financial table on page 77 (Income Statement) Contains 11 line items across 4 columns. Row labels: 2024; £000; 49,386; 3,439. Key items: 2024 | 2025; £000 | Note | £000; 49,386 | Staffcosts | 3a | 53,143; Otheroperating…",77,31 MARCH 2025,Financial table,False
