id,x,y,label,text,page,section,category,highlight
Shetland-2016-2017:p0049_001,7.8251314,6.67303,FINANCIAL STATEMENTS,scheme as at 31 March 2012. The consequence of this review was that the Employers contribution increased from 13.5% to 14.9% from 1 April 2015. Additional pension liabilities arising from early retirements are not funde…,49,FINANCIAL STATEMENTS,Financial narrative,False
Shetland-2016-2017:p0049_002,8.167041,6.472512,FINANCIAL STATEMENTS,"Central Legal Office according to the value of the claim and the probability of settlement. Claims assessed as ‘Category 3’ are deemed most likely and provided for in full, those in ‘Category 2’ as 50% of the claim and…",49,FINANCIAL STATEMENTS,Financial narrative,False
Shetland-2016-2017:p0049_003,8.389085,6.56769,FINANCIAL STATEMENTS,provision recognises the Board’s respective share of the total liability of NHSScotland as advised by the Scottish Government and based on information prepared by NHS Boards and the Central Legal Office. The movement in…,49,FINANCIAL STATEMENTS,Financial narrative,False
Shetland-2016-2017:p0050_000,9.66625,6.0283794,FINANCIAL STATEMENTS,"22. 23. 24. money is significant, the estimated cash flows are discounted using the discount rate prescribed by HM Treasury. Contingencies Contingent assets (that is, assets arising from past events whose existence will…",50,FINANCIAL STATEMENTS,Financial narrative,False
Shetland-2016-2017:p0050_001,9.832897,6.200232,FINANCIAL STATEMENTS,benefits will arise or for which the amount of the obligation cannot be measured with sufficient reliability. Corresponding Amounts Corresponding amounts are shown for the primary statements and notes to the financial s…,50,FINANCIAL STATEMENTS,Financial narrative,False
Shetland-2016-2017:p0050_002,9.949387,6.49703,FINANCIAL STATEMENTS,assets at fair value through profit or loss comprise derivatives. Assets in this category are classified as current assets. The Board does not trade in derivatives and does not apply hedge accounting. (b) Loans and rece…,50,FINANCIAL STATEMENTS,Financial narrative,False
Shetland-2016-2017:p0051_000,10.077241,6.263481,FINANCIAL STATEMENTS,"(a) Financial assets at fair value through profit or loss Financial assets carried at fair value through profit or loss is initially recognised at fair value, and transaction costs are expensed in the Statement of Compr…",51,FINANCIAL STATEMENTS,Financial narrative,False
Shetland-2016-2017:p0051_001,10.100801,6.3087645,FINANCIAL STATEMENTS,"that the debtor will enter bankruptcy or financial reorganisation, and default or delinquency in payments (more than 30 days overdue) are considered indicators that the loan and receivable is impaired. The amount of the…",51,FINANCIAL STATEMENTS,Financial narrative,False
Shetland-2016-2017:p0051_002,10.103819,6.3478327,FINANCIAL STATEMENTS,"assets classified as available for sale are recognised in equity in other reserves. When financial assets classified as available for sale are sold or impaired, the accumulated fair value adjustments recognised in equit…",51,FINANCIAL STATEMENTS,Financial narrative,False
Shetland-2016-2017:p0051_003,9.466169,6.260792,FINANCIAL STATEMENTS,"its cost is considered as an indicator that the securities are impaired. If any such evidence exists for available-for-sale financial assets, the cumulative loss - measured as the difference between the acquisition cost…",51,FINANCIAL STATEMENTS,Financial narrative,False
Shetland-2016-2017:p0052_000,8.952076,6.1144347,FINANCIAL STATEMENTS,25. 26. 27. 28. Financial liabilities at fair value through profit or loss comprise derivatives. Liabilities in this category are classified as current liabilities. NHS Shetland does not trade in derivatives and does no…,52,FINANCIAL STATEMENTS,Financial narrative,False
Shetland-2016-2017:p0052_001,9.41194,6.1406317,FINANCIAL STATEMENTS,"profit or loss is initially recognised at fair value, and transaction costs are expensed in the income statement. Financial liabilities carried at fair value through profit or loss is subsequently measured at fair value…",52,FINANCIAL STATEMENTS,Financial narrative,False
Shetland-2016-2017:p0052_002,9.165694,5.933939,FINANCIAL STATEMENTS,"the Government Banking Service, balances held in commercial banks and other short-term highly liquid investments with original maturities of three months or less, and bank overdrafts. Bank overdrafts are shown within bo…",52,FINANCIAL STATEMENTS,Financial narrative,False
Shetland-2016-2017:p0052_003,9.5616865,5.8747525,FINANCIAL STATEMENTS,"experience and other factors, including expectations of future events that are believed to be reasonable under the circumstances. The Board makes estimates and assumptions concerning the future. The resulting accounting…",52,FINANCIAL STATEMENTS,Financial narrative,False
Shetland-2016-2017:p0053_000,7.1234746,7.120398,FINANCIAL STATEMENTS,"future costs of former employees that have retired prematurely and potential negligence claims. For pensions, the future costs are estimated based on the - current costs to the Board of these pensions spread over the ex…",53,FINANCIAL STATEMENTS,Financial narrative,False
Shetland-2016-2017:p0053_001,6.7455506,6.704513,FINANCIAL STATEMENTS,"Impairments on property, plant & equipment charged to SOCNE Funding Of Donated Assets Profit on disposal of property, plant and equipment Investment in Integration Joint Board Total Expenditure Not Paid In Cash Interest…",53,FINANCIAL STATEMENTS,Financial table,False
Shetland-2016-2017:table_ocr_p0054,6.4349093,7.4555154,FINANCIAL STATEMENTS,"TABLE_TYPE: remuneration_disclosure PAGE: 54 ROTATION: 0 Note 5 — FAMILY HEALTH SERVICE EXPENDITURE 2016 Restated £’000 4,755 Primary Medical Services 5,932 Pharmaceutical Services 3,213 General Dental Services 441 Gene…",54,FINANCIAL STATEMENTS,Financial table,False
Shetland-2016-2017:p0055_000,6.993555,7.83774,FINANCIAL STATEMENTS,"SHETLAND NHS BOARD NOTES TO ACCOUNTS FOR YEAR ENDED 31 Note 8 - OPERATING INCOME 2016 Restated £'000 146 943 8,931 at the teas 10,020 389 397 64 525 120 310 0 0 102 1,057 11,538 671 Hospital and Community Health Service…",55,FINANCIAL STATEMENTS,Financial narrative,False
Shetland-2016-2017:p0055_001,7.82118,8.76443,FINANCIAL STATEMENTS,"1 400 401 286 286 362 76 EXPENDITURE Acquisition of Property, Plant and Equipment Donated Asset Additions Gross Capital Expenditure INCOME Net book value of disposal of Property, plant and equipment Value of disposal of…",55,FINANCIAL STATEMENTS,Financial table,False
Shetland-2016-2017:table_ocr_p0056,7.6778135,8.983969,OQ NON CORE CAPITAL RESOURCE LIMIT 0,TABLE_TYPE: statutory_targets PAGE: 56 ROTATION: 0 OQ Non Core Capital Resource Limit 0 0 Saving against Non Core Capital Resource Limit it) 286 Total Capital Expenditure 611 362 Total Capital Resource Limit 661 76 Savi…,56,OQ NON CORE CAPITAL RESOURCE LIMIT 0,Financial table,False
Shetland-2016-2017:table_ocr_p0057,7.5789685,9.056319,UNDER (EXCLUDING EQUIPMENT MACHINERY TECHNOLOGY ®& FITTINGS CONSTRUCTION,"TABLE_TYPE: scan_table_other PAGE: 57 ROTATION: 0 Note 11(a) — PROPERTY, PLANT AND EQUIPMENT (PURCHASED ASSETS) - CURRENT YEAR —- CONSOLIDATED AND BOARD Land (inc. Buildings Dwellings Transport Plant & Info. Furniture A…",57,UNDER (EXCLUDING EQUIPMENT MACHINERY TECHNOLOGY ®& FITTINGS CONSTRUCTION,Governance,False
Shetland-2016-2017:table_ocr_p0058,7.7860193,8.9805,AT 1ST APRIL 2015,"TABLE_TYPE: scan_table_other PAGE: 58 ROTATION: 0 Note 11(a) -— PROPERTY, PLANT AND EQUIPMENT (PURCHASED ASSETS) —- PRIOR YEAR — CONSOLIDATED AND BOARD Cost or valuation At 1st April 2015 Additions Transfers (to)/from n…",58,AT 1ST APRIL 2015,Governance,False
Shetland-2016-2017:table_ocr_p0059,7.7393727,9.076954,TRANSPORT PLANT & TOTAL,"TABLE_TYPE: scan_table_other PAGE: 59 ROTATION: 0 Note 11(b) - PROPERTY, PLANT AND EQUIPMENT (DONATED ASSETS) - CURRENT YEAR — CONSOLIDATED AND BOARD Transport Plant & Total Equipment Machinery £’000 £000 £'000 Cost or…",59,TRANSPORT PLANT & TOTAL,Governance,False
Shetland-2016-2017:table_ocr_p0060,7.8702774,9.05652,TRANSPORT PLANT & TOTAL,"TABLE_TYPE: scan_table_other PAGE: 60 ROTATION: 0 Note 11 (c) -ASSETS HELD FOR SALE - CURRENT YEAR - CONSOLIDATED AND BOARD , Property, Total Plant & Equipment Note £'000 £'000 At ist Apri] 2016 138 138 Transfers (to)/f…",60,TRANSPORT PLANT & TOTAL,Governance,False
Shetland-2016-2017:table_ocr_p0061,7.246122,7.4342384,FINANCIAL STATEMENTS,TABLE_TYPE: scan_table_other PAGE: 61 ROTATION: 0 NOTE 13 - TRADE AND OTHER RECEIVABLES Board and Cons Cons’ Board 2016 2017 2017 Restated £’000 £’000- £'000 Receivables due within one year NHS Scotland 246 Boards 135 1…,61,FINANCIAL STATEMENTS,Financial table,False
Shetland-2016-2017:p0062_000,8.07167,6.0524163,2016 2017 2017,"As of 31 March 2017, receivables with a carrying value of £99,696 (2016: £116,207) were impaired and provided for. The amount of the provision was £99,696 (2016: £116,207). The aging of these receivables is as follows:…",62,2016 2017 2017,Strategy / narrative,False
Shetland-2016-2017:p0062_001,8.223187,5.916854,2016 2017 2017,Board Cons’ Board 2016 2017 2017 £’000 £’000 £’000 159 Up to 3 months past due 119 119 22 3 to 6 months past due 4 4 15 Over 6 months past due 10 10 196 133 133 The receivables assessed as past due but not impaired were…,62,2016 2017 2017,Governance,False
Shetland-2016-2017:p0062_002,8.251828,5.9698925,2016 2017 2017,"nor impaired are shown by their credit risk below; Board Cons’ Board 2016 2017 2017 £000 £’000 £’000 1,311 Existing customers with no defaults in the past 1,137 1,137 1,311 Total neither past due or impaired 1,137 1,137…",62,2016 2017 2017,Governance,False
Shetland-2016-2017:table_ocr_p0063,7.0705233,8.510624,(6) US DOLLARS,"TABLE_TYPE: financial_core_cash_flow PAGE: 63 ROTATION: 0 Board 2016 £’000 1,311 Pounds (@) Euros (6) US Dollars 1,311 Cons 2017 £'000 1,137 All non-current receivables are due within one year (2015-16: one year) from t…",63,(6) US DOLLARS,Governance,False
Shetland-2016-2017:table_ocr_p0064,7.08686,7.586075,FINANCIAL STATEMENTS,TABLE_TYPE: scan_table_other PAGE: 64 ROTATION: 0 NOTE 16 - TRADE AND OTHER PAYABLES Board and Cons 2016 Restated £000 Payables due within one year: NHSScotland Boards Total NHSScotland Payables 993 993 5 NHS Non-Scotti…,64,FINANCIAL STATEMENTS,Financial table,False
Shetland-2016-2017:table_ocr_p0065,6.943511,6.8627524,PENSIONS AND CLINICAL PARTICIPATION OTHER 2017,TABLE_TYPE: scan_table_other PAGE: 65 ROTATION: 0 NOTE 17 — PROVISIONS — CURRENT YEAR —- CONSOLIDATED AND BOARD Pensions and Clinical Participation Other 2017 similar & in CNORIS Total obligations Medical £'000 £’000 £’…,65,PENSIONS AND CLINICAL PARTICIPATION OTHER 2017,Governance,False
Shetland-2016-2017:table_ocr_p0066,6.698403,7.1521645,PENSIONS AND CLINICAL PARTICIPATION OTHER 2016,TABLE_TYPE: scan_table_other PAGE: 66 ROTATION: 0 Analysis of expected timing of discounted flows to 31 March 2016 Pensions and Clinical Participation Other 2016 similar & in CNORIS obligations Medical £'000 £’000 £'000…,66,PENSIONS AND CLINICAL PARTICIPATION OTHER 2016,Clinical performance,False
Shetland-2016-2017:p0067_000,7.590219,6.388487,CLINICAL AND MEDICAL,Clinical and Medical The Board holds a provision to meet costs of all outstanding and potential clinical and medical negligence claims. All legal claims notified to the Board are processed by the Scottish NHS Central Le…,67,CLINICAL AND MEDICAL,Governance,False
Shetland-2016-2017:p0067_001,7.59992,6.477908,CLINICAL AND MEDICAL,the board is not required to hold or buy allowances in this scheme. CLINICAL NEGLIGENCE AND OTHER RISKSINDEMITY SCHEME (CNORIS) 2016 2017 £000 Note £’000 60 Provision recognising individual claims against the NHS 17 25…,67,CLINICAL AND MEDICAL,Governance,False
Shetland-2016-2017:p0067_002,7.6925793,6.4084816,CLINICAL AND MEDICAL,less than this are met directly from within boards’ own budgets. Participants e.g. NHS boards contribute to the CNORIS pool each financial year at a pre-agreed contribution rate based on the risks associated with their…,67,CLINICAL AND MEDICAL,Financial narrative,False
Shetland-2016-2017:p0067_003,7.5150127,6.4363885,CLINICAL AND MEDICAL,claim settles. The provision and associated receivable are shown in the first two lines above. The receivable has been netted off against the provision to reflect reimbursement from the scheme. As a result of participat…,67,CLINICAL AND MEDICAL,Clinical performance,False
Shetland-2016-2017:p0068_000,8.175989,6.4155807,FINANCIAL STATEMENTS,NOTE 18 —- MOVEMENT ON WORKING CAPITAL BALANCES 2016 2017 Net Opening Closing Net Movement Balances Balances Movement Restated £000 Note £000 £000 £'000 INVENTORIES 63 Balance Sheet 12 394 431 63 Net Decrease/ (Increase…,68,FINANCIAL STATEMENTS,Financial table,False
Shetland-2016-2017:p0068_001,8.195002,6.348376,FINANCIAL STATEMENTS,claimant is successful the settlement date is expected to be May 2018. 2016 2017 Value Value £'000 Nature £'000 25 Clinical and medical compensation payments 20 25 TOTAL CONTINGENT LIABILITIES 20 CONTINGENT ASSETS 0 Cli…,68,FINANCIAL STATEMENTS,Financial narrative,False
Shetland-2016-2017:p0069_000,9.271993,7.8025255,FINANCIAL STATEMENTS,"NOTE 21 - COMMITMENTS The Board has the following Capital Commitments which have not been included for in the financial statements: 2016 Total £'000 6) [¢) 211 333 349 104 997 Capital Commitments Property, Intangible pl…",69,FINANCIAL STATEMENTS,Financial narrative,False
Shetland-2016-2017:p0069_001,9.22791,7.8432784,FINANCIAL STATEMENTS,"Later than one year, not later than two years Later than two year, not later than five years Amounts charged to Operating Costs in the year were: Hire of equipment (including vehicles) Other operating leases Total Conti…",69,FINANCIAL STATEMENTS,Financial table,False
Shetland-2016-2017:p0070_000,7.7416887,7.1483316,FINANCIAL STATEMENTS,NOTE 23 —- COMMITMENTS UNDER PFI CONTRACTS None. NOTE 24 — PENSION COSTS NHS Shetland participates in the National Health Service Superannuation Scheme (Scotland). The scheme is an unfunded statutory public service pens…,70,FINANCIAL STATEMENTS,Financial narrative,False
Shetland-2016-2017:p0070_001,7.573279,6.9867363,FINANCIAL STATEMENTS,unfunded multi-employer defined benefit scheme. (ii) It is accepted that the scheme can be treated for accounting purposes as a defined contribution scheme in circumstances where the NHS Shetland is unable to identify i…,70,FINANCIAL STATEMENTS,Financial narrative,False
Shetland-2016-2017:p0070_002,7.477121,7.1133437,FINANCIAL STATEMENTS,"March 2016 were £739,2 million, to 31 March 2015 were £659.8 million per most recent published accounts for the NHS Superannuation Scheme, note3. NHS Shetland paid contributions of £2.8m (prior year £2.5m) in this perio…",70,FINANCIAL STATEMENTS,Financial narrative,False
Shetland-2016-2017:p0070_003,7.6705527,7.4166946,FINANCIAL STATEMENTS,£20k) arising from the early retirement of staff. Provisions amounting to £261k are included in the Balance Sheet and reflect the difference between the amounts charged to the Statement of Comprehensive Net Expenditure…,70,FINANCIAL STATEMENTS,Financial narrative,False
Shetland-2016-2017:table_ocr_p0071,6.6469555,7.493758,REMOVE ENDOWMENT EXPENDITURE,"TABLE_TYPE: financial_core_balance_sheet PAGE: 71 ROTATION: 0 NOTE 25 —- EXCEPTIONAL ITEMS AND PRIOR YEAR ADJUSTMENTS Adjustment 1 Adjustment 2 Adjustment 3 Adjustment 4 Adjustment 5 NOTE 26 - RESTATED SOCNE, BALANCE SH…",71,REMOVE ENDOWMENT EXPENDITURE,Financial table,False
Shetland-2016-2017:table_ocr_p0072,7.356118,8.861175,NET OPERATING COSTS,"TABLE_TYPE: financial_core_balance_sheet PAGE: 72 ROTATION: 0 Net Operating Costs 26b. RESTATED BALANCE SHEET Non-current assets Property, plant and equipment Intangible assets Financial assets: Available for sale finan…",72,NET OPERATING COSTS,Financial table,False
Shetland-2016-2017:p0073_000,7.0604324,8.64568,26C. RESTATED CASH FLOW STATEMENT,"26c. RESTATED CASH FLOW STATEMENT Previous Accounts £000 Cash flows from operating activities Net operating cost (55,767) Adjustments for non-cash transactions 1,183 Add back: interest payable recognised in net operatin…",73,26C. RESTATED CASH FLOW STATEMENT,Financial narrative,False
Shetland-2016-2017:p0073_001,6.972951,8.518184,26C. RESTATED CASH FLOW STATEMENT,"flows from financing activities Funding 54,986 Movement in general fund working capital 18 Cash drawn down 55,004 Capital element of payments in respect of finance (6) leases and on-balance sheet PFI contracts Interest…",73,26C. RESTATED CASH FLOW STATEMENT,Financial table,False
Shetland-2016-2017:p0074_000,7.2606626,8.516774,FINANCIAL STATEMENTS,NOTE 27 - FINANCIAL INSTRUMENTS (a) Financial Instruments by Category Financial Assets BOARD AND CONSOLIDATED Loans And Available Total Receivables for Sale Note £'000 £'000 £’000 At 3ist March 2017 Assets per balance s…,74,FINANCIAL STATEMENTS,Financial table,False
Shetland-2016-2017:p0074_001,8.5257435,6.1838007,FINANCIAL STATEMENTS,"Trade and other payables excluding statutory liabilities (VAT and income tax 16 6,309 6,309 and social security), deferred income and superannuation 6,309 6,309 BOARD AND CONSOLIDATED - PRIOR YEAR Other Total Financial…",74,FINANCIAL STATEMENTS,Financial narrative,False
Shetland-2016-2017:p0075_000,8.712965,5.8063397,FINANCIAL STATEMENTS,b. Liquidity risk - the possibility that the NHS Board might not have funds available to meet its commitments to make payments. c. Market risk - the possibility that financial loss might arise as a result of changes in…,75,FINANCIAL STATEMENTS,Financial narrative,False
Shetland-2016-2017:p0075_001,8.682119,6.04871,FINANCIAL STATEMENTS,"position, past experience and other factors, with individual credit limits being set in accordance with internal ratings in accordance with parameters set by the NHS Board. e The utilisation of credit limits is regularl…",75,FINANCIAL STATEMENTS,Financial narrative,False
Shetland-2016-2017:p0075_002,8.841083,5.8629985,FINANCIAL STATEMENTS,no powers to borrow or invest surplus funds. Financial assets and liabilities are generated by day-to-day operational activities and are not held to manage the risks facing the NHS Board in undertaking its activities. i…,75,FINANCIAL STATEMENTS,Financial narrative,False
Shetland-2016-2017:p0076_000,6.001829,5.651168,FINANCIAL STATEMENTS,NOTE 29 —- RELATED PARTY TRANSACTIONS The Board had various material transactions with other government departments and other central government bodies. The Board's primary material transactions were with Shetland Islan…,76,FINANCIAL STATEMENTS,Financial narrative,False
Shetland-2016-2017:p0076_001,4.6602426,5.775859,FINANCIAL STATEMENTS,"The IJB is a distinct legal entity from the NHS Shetland and Shetland Islands Council. The NHS Board and the local authority have delegated some of their functions to these IJBs,",76,FINANCIAL STATEMENTS,Financial narrative,False
Shetland-2016-2017:p0076_002,4.700024,5.859605,FINANCIAL STATEMENTS,"and the IJB is wholly responsible for carrying out those functions. The new arrangements for health and social care came fully into effect on 20 November 2015. In 2016/17 the Health Board incurred costs of £25,523k for",76,FINANCIAL STATEMENTS,Financial narrative,False
Shetland-2016-2017:p0076_003,4.738961,5.82104,FINANCIAL STATEMENTS,"its contribution to the IJB. Mr. K Massey, Mrs. M Williamson, Mrs. C Waddington and Mr. C Smith were members of the Board",76,FINANCIAL STATEMENTS,Financial narrative,False
Shetland-2016-2017:p0076_004,6.5443435,7.644464,FINANCIAL STATEMENTS,and members of the IJB during the year. NOTE 30 —- SEGMENT INFORMATION Segmental information as required under IFRS has been reported for each strategic objective. Net operating cost is as reported for each division. To…,76,FINANCIAL STATEMENTS,Financial table,False
Shetland-2016-2017:table_ocr_p0077,6.646429,7.658639,FINANCIAL STATEMENTS,TABLE_TYPE: exit_packages PAGE: 77 ROTATION: 0 NOTE 31 - THIRD PARTY ASSETS None. NOTE 32 - EXIT PACKAGES No exit packages agreed in 2016/17 or prior year. NOTE 33(a) - CONSOLIDATED STATEMENT OF COMPREHENSIVE NET EXPEND…,77,FINANCIAL STATEMENTS,Financial table,False
Shetland-2016-2017:table_ocr_p0078,7.3284264,8.833519,FINANCIAL STATEMENTS,"TABLE_TYPE: financial_core_balance_sheet PAGE: 78 ROTATION: 0 NOTE 33(b) —- CONSOLIDATED GROUP BALANCE SHEET Group 2016 Restated £’000 29,129 36 29,165 394 1,311 143 138 1,986 31,151 (326) (6,335) (6,661) 24,490 (829) (…",78,FINANCIAL STATEMENTS,Financial table,False
Shetland-2016-2017:table_ocr_p0079,6.956729,8.689651,FINANCIAL STATEMENTS,"TABLE_TYPE: financial_core_cash_flow PAGE: 79 ROTATION: 0 NOTE 33(c) -— CONSOLIDATED STATEMENT OF CASHFLOWS Board and cons > Board 2016 2017 Restated \ £'000 £'000 Cash flows from operating activities (55,813) Net opera…",79,FINANCIAL STATEMENTS,Financial table,False
Shetland-2016-2017:p0080_000,6.9714646,4.7294235,DIRECTION BY THE SCOTTISH MINISTERS,"SHETLAND NHS BOARD DIRECTION BY THE SCOTTISH MINISTERS 1, The Scottish Ministers, in pursuance of sections 86(1), (1B) and (3) of the National Health Services (Scotland) Act 1978, hereby give the following direction. 2.…",80,DIRECTION BY THE SCOTTISH MINISTERS,Governance,False
