id,x,y,label,text,page,section,category,highlight
Shetland-2024-2025:table_p0078,-1.9765295,0.68609685,FINANCIAL STATEMENTS,"Financial table on page 78 (Balance Sheet) Contains 19 line items across 6 columns. Column headers: Consolidated | Board | | | Consolidated | Board. Row labels: 2024; £000; 36,256; 1,326. Key items: 2024 | 2024 | 2025 |…",78,FINANCIAL STATEMENTS,Financial table,False
Shetland-2024-2025:table_p0079,-1.8556931,0.47159395,FINANCIAL STATEMENTS,"Financial table on page 79 (Provisions) Contains 15 line items across 6 columns. Column headers: Consolidated | Board | | | Consolidated | Board. Row labels: 2024; £000; (10,319); 35,693. Key items: 2024 | 2024 | 2025 |…",79,FINANCIAL STATEMENTS,Financial table,False
Shetland-2024-2025:table_p0080,-1.5023997,0.8313604,31 MARCH 2025,"Financial table on page 80 (Cash Flow) Contains 19 line items across 5 columns. Row labels: 2024; £000; (84,577); 3,095. Key items: 2024 | 2025 | 2025; £000 | Note | £000 | £000; (84,577) | Netexpenditure | SoCTE | (93,…",80,31 MARCH 2025,Financial table,False
Shetland-2024-2025:table_p0081,-1.3967716,0.7440243,31 MARCH 2025,"Financial table on page 81 (Cash Flow) Contains 14 line items across 5 columns. Row labels: 2024; £000; 85,724; (696). Key items: 2024 | 2025 | 2025; £000 | Note | £000 | £000; 85,724 | Cashdrawndown | 86,574; (696) | C…",81,31 MARCH 2025,Financial table,False
Shetland-2024-2025:table_p0082,-1.0311743,0.63557845,FINANCIAL STATEMENTS,Financial table on page 82 (Income Statement) Contains 10 line items across 7 columns. Column headers: | | GeneralFund | RevaluationReserve | Otherreserve—associatesandjointventures | FundsHeldonTrust. Row labels: Balan…,82,FINANCIAL STATEMENTS,Financial table,False
Shetland-2024-2025:table_p0083,-0.90384275,0.7239064,FINANCIAL STATEMENTS,Financial table on page 83 (Unknown) Contains 6 line items across 7 columns. Column headers: | | GeneralFund | RevaluationReserve | Otherreserve—associatesandjointventures | FundsHeldonTrust. Row labels: Balanceat1April…,83,FINANCIAL STATEMENTS,Financial table,False
Shetland-2024-2025:table_p0084,-0.94778764,0.66623664,FINANCIAL STATEMENTS,Financial table on page 84 (Income Statement) Contains 9 line items across 7 columns. Column headers: | | GeneralFund | RevaluationReserve | Otherreserve—associatesandjointventures | FundsHeldonTrust. Row labels: Impair…,84,FINANCIAL STATEMENTS,Financial table,False
Shetland-2024-2025:p0085_000,11.224035,7.98109,FINANCIAL STATEMENTS,"Note 1—Accounting Policies - Authority In accordance with the accounts direction issued by Scottish Ministers under section 19(4) of the Public Finance and Accountability (Scotland) Act 2000 appended, these accounts hav…",85,FINANCIAL STATEMENTS,Financial narrative,False
Shetland-2024-2025:p0085_001,11.136945,7.852766,FINANCIAL STATEMENTS,"revised Standards - Standards, amendments and interpretations effective in the current year There are no new standards, amendments or interpretations effective in the year 2024–25. - Standards, amendments and interpreta…",85,FINANCIAL STATEMENTS,Financial narrative,False
Shetland-2024-2025:p0086_000,10.172502,7.994615,IFRS 19 SUBSIDIARIES WITHOUT,"IFRS 19 Subsidiaries without Effective for periods starting on or after 1 January public accountability: 2027, this standard has not yet been endorsed disclosures by the UKEB or adopted by HM Treasury. Basis of Consolid…",86,IFRS 19 SUBSIDIARIES WITHOUT,Governance,False
Shetland-2024-2025:p0086_001,9.720013,7.9835916,IFRS 19 SUBSIDIARIES WITHOUT,Endowment Funds and the IJB which are both considered material to NHS Shetland. NHS Endowment Funds were established by the NHS (Scotland) Act 1978. The legal framework under which charities operate in Scotland is the C…,86,IFRS 19 SUBSIDIARIES WITHOUT,Strategy / narrative,False
Shetland-2024-2025:p0086_003,9.825202,7.979575,IFRS 19 SUBSIDIARIES WITHOUT,The IJB was formally constituted on 27 June 2015 under the Public Bodies (Joint Working) (Scotland) Act 2014. The basis of consolidation used is the equity method. Going Concern The going concern assumption remains appr…,86,IFRS 19 SUBSIDIARIES WITHOUT,Financial narrative,False
Shetland-2024-2025:p0087_000,9.13155,6.5138235,FINANCIAL STATEMENTS,"Accounting Convention The accounts are prepared on a historical cost basis, as modified by the revaluation of property at fair value as determined by the relevant accounting standards and the FReM. Funding Most of the e…",87,FINANCIAL STATEMENTS,Financial narrative,False
Shetland-2024-2025:p0087_001,9.182246,6.3294373,FINANCIAL STATEMENTS,"the sale contract. Non-discretionary funding out with the RRL is allocated to match actual expenditure incurred for the provision of specific pharmaceutical, dental or ophthalmic services identified by the Scottish Gove…",87,FINANCIAL STATEMENTS,Financial narrative,False
Shetland-2024-2025:p0087_002,9.596788,6.3995533,FINANCIAL STATEMENTS,"the accounts (capitalisation, valuation, depreciation, particulars concerning donated assets) is in accordance with the NHS Capital Accounting Manual. Title to properties included in the accounts is held by Scottish Min…",87,FINANCIAL STATEMENTS,Financial narrative,False
Shetland-2024-2025:p0088_000,9.671367,5.965676,FINANCIAL STATEMENTS,"All assets falling into the following categories are capitalised: 1. Property, plant and equipment assets which are capable of being used for a period which could exceed one year, and have a cost equal to or greater tha…",88,FINANCIAL STATEMENTS,Financial narrative,False
Shetland-2024-2025:p0088_001,9.788033,6.2133083,FINANCIAL STATEMENTS,directly attributable to acquiring or constructing the asset and bringing it to the location and condition necessary for it to be capable of operating in the manner intended by management. All assets are measured subseq…,88,FINANCIAL STATEMENTS,Financial narrative,False
Shetland-2024-2025:p0088_002,9.824237,6.3201127,FINANCIAL STATEMENTS,of the Scottish Government. The Board operates on a three-year programme of professional valuations with the latest full valuation of the estate taking place as at 31 March 2023. The next full valuation of the estate is…,88,FINANCIAL STATEMENTS,Financial narrative,False
Shetland-2024-2025:p0089_000,9.428852,5.8660064,FINANCIAL STATEMENTS,Assets under construction are valued at current cost. This is calculated by the expenditure incurred to which an appropriate index is applied to arrive at current value. These are also subject to impairment review. To m…,89,FINANCIAL STATEMENTS,Financial narrative,False
Shetland-2024-2025:p0089_001,9.473007,5.67678,FINANCIAL STATEMENTS,"part it replaces is de-recognised, regardless of whether or not it has been depreciated separately. - Revaluations and I mpairment Increases in asset values arising from revaluations are recognised in the revaluation re…",89,FINANCIAL STATEMENTS,Financial narrative,False
Shetland-2024-2025:p0089_002,9.814071,5.6031237,FINANCIAL STATEMENTS,"benefits. Depreciation is charged on each main class of tangible asset as follows: 1. Freehold land is considered to have an infinite life and is not depreciated. 2. Property, Plant and Equipment which has been reclassi…",89,FINANCIAL STATEMENTS,Financial narrative,False
Shetland-2024-2025:p0090_000,9.769133,5.6120667,ASSET CATEGORY,"4. Plant and Machinery, Transport Equipment, IT and Furniture and Fittings are depreciated over the estimated life of the asset. Depreciation is charged on a straight-line basis. The following asset lives have been used…",90,ASSET CATEGORY,Strategy / narrative,False
Shetland-2024-2025:p0090_001,9.68561,5.806135,ASSET CATEGORY,"to, or service potential will be provided to, the Board and where the cost of the asset can be measured reliably. Intangible assets that meet the recognition criteria are capitalised when they are capable of being used…",90,ASSET CATEGORY,Governance,False
Shetland-2024-2025:p0091_000,9.538858,5.664373,ASSET CATEGORY,"- Intangible assets are recognised initially at cost, comprising all directly attributable costs needed to create, produce and prepare the asset to the point that it is capable of operating in the manner intended by man…",91,ASSET CATEGORY,Strategy / narrative,False
Shetland-2024-2025:p0091_001,9.644545,5.839623,ASSET CATEGORY,"the Statement of Financial Position initially at the current full replacement cost of the asset. The accounting treatment, including the method of valuation, follows the rules in the NHS Capital Accounting Manual. There…",91,ASSET CATEGORY,Financial narrative,False
Shetland-2024-2025:p0092_000,9.826029,5.4980016,ASSET CATEGORY,"Contracts or parts of contract that are leases in substance are determined by evaluating whether they convey the right to control the use of an identified asset, as represented by rights both to obtain substantially all…",92,ASSET CATEGORY,Strategy / narrative,False
Shetland-2024-2025:p0092_001,9.867583,5.4329844,ASSET CATEGORY,"lease liability is measured at the present value of the payments for the remaining lease term (as defined above), net of irrecoverable value added tax, discounted either by the rate implicit in the lease, or, where this…",92,ASSET CATEGORY,Strategy / narrative,False
Shetland-2024-2025:p0092_002,9.850972,5.488811,ASSET CATEGORY,"value model. The cost model is considered to be a reasonable proxy except for leases of land and property without regular rent reviews. For these leases, the asset is carried at a revalued amount. In these accounts, rig…",92,ASSET CATEGORY,Financial narrative,False
Shetland-2024-2025:p0093_000,9.79854,5.435702,ASSET CATEGORY,against the liability. Rental payments for leases of low-value items or shorter than twelve months are expensed. - Estimates and judgements The Board determines the amounts to be recognised as the right-of-use asset and…,93,ASSET CATEGORY,Governance,False
Shetland-2024-2025:p0093_001,9.208892,5.6475625,ASSET CATEGORY,for impairment whenever events or changes in circumstances indicate that the carrying amount may not be recoverable. An impairment loss is recognised for the amount by which the asset’s carrying amount exceeds its recov…,93,ASSET CATEGORY,Strategy / narrative,False
Shetland-2024-2025:p0093_002,9.115225,6.055594,ASSET CATEGORY,"to the extent that they are identified as being reversed in subsequent revaluations. General Fund Receivables and Payables Where the Health Board has a positive net cash book balance at the year-end, a corresponding cre…",93,ASSET CATEGORY,Governance,False
Shetland-2024-2025:p0094_000,8.03772,7.428582,LOSSES AND SPECIAL PAYMENTS,"up to their present location, condition and degree of completion. There are no WIP at 31 March 2025. Losses and Special Payments Operating expenditure includes certain losses which would have been made good through insu…",94,LOSSES AND SPECIAL PAYMENTS,Financial narrative,False
Shetland-2024-2025:p0094_001,8.0537195,7.4137754,LOSSES AND SPECIAL PAYMENTS,an unfunded statutory pension scheme with benefits underwritten by the UK Government. The scheme is financed by payments from employers and those current employees who are members of the scheme and paying contributions…,94,LOSSES AND SPECIAL PAYMENTS,Strategy / narrative,False
Shetland-2024-2025:p0094_002,8.337796,7.1158605,LOSSES AND SPECIAL PAYMENTS,Government Actuary and this valuation determines the rate of contributions required. The most recent actuarial valuation is published by the Scottish Public Pensions Agency (SPPA) and is available on their website. Addi…,94,LOSSES AND SPECIAL PAYMENTS,Strategy / narrative,False
Shetland-2024-2025:p0095_000,8.476153,6.9997334,LOSSES AND SPECIAL PAYMENTS,NHS Shetland provide for all claims notified to the NHS Central Legal Office according to the value of the claim and the probability of settlement. Claims assessed as ‘Category 3’ are deemed most likely and provided for…,95,LOSSES AND SPECIAL PAYMENTS,Strategy / narrative,False
Shetland-2024-2025:p0095_001,8.45886,6.914154,LOSSES AND SPECIAL PAYMENTS,liability from participating in the scheme. The Participation in CNORIS provision recognises the Board’s respective share of the total liability of NHS Scotland as advised by the Scottish Government and based on informa…,95,LOSSES AND SPECIAL PAYMENTS,Governance,False
Shetland-2024-2025:p0095_002,9.134579,5.690171,LOSSES AND SPECIAL PAYMENTS,"the relevant expenditure category or included in the capitalised purchase cost of non-current assets. Where output tax is charged or input VAT is recoverable, the amounts are stated net of VAT. Provisions The Board prov…",95,LOSSES AND SPECIAL PAYMENTS,Financial narrative,False
Shetland-2024-2025:p0096_000,8.903449,5.666253,CORRESPONDING AMOUNTS,"Contingent liabilities are not recognised, but are disclosed in Note 14 , unless the probability of a transfer of economic benefits is remote. Contingent liabilities are defined as: - possible obligations arising from p…",96,CORRESPONDING AMOUNTS,Strategy / narrative,False
Shetland-2024-2025:p0096_001,8.786606,5.6526785,CORRESPONDING AMOUNTS,basis for adjustment disclosed in a note to the accounts. Financial Instruments - Financial assets - Business Model: The Board’s business model refers to how it manages its financial assets in order to generate cash flo…,96,CORRESPONDING AMOUNTS,Financial narrative,False
Shetland-2024-2025:p0096_002,8.903735,5.5822916,CORRESPONDING AMOUNTS,to collect principal and interest and/or for sale. a) Financial assets at fair value through profit or loss This is the default basis for financial assets. b) Financial assets held at amortised cost. A financial asset m…,96,CORRESPONDING AMOUNTS,Financial narrative,False
Shetland-2024-2025:p0097_000,9.012972,5.495784,CORRESPONDING AMOUNTS,ii. the contractual terms of the financial asset give rise to cash flows that are solely payments of principal and related interest. c) Financial assets at fair value through other comprehensive income A financial asset…,97,CORRESPONDING AMOUNTS,Financial narrative,False
Shetland-2024-2025:p0097_001,8.955485,5.54296,CORRESPONDING AMOUNTS,the carrying amount of the asset in the Statement of Financial Position. Lifetime expected credit losses are recognised and applied to financial assets by the Board where there has been a significant increase in credit…,97,CORRESPONDING AMOUNTS,Financial narrative,False
Shetland-2024-2025:p0097_002,8.953498,5.516244,CORRESPONDING AMOUNTS,"fair value through profit or loss are initially recognised at fair value, and transaction costs are expensed in the SoCNE . Financial assets carried at fair value through profit or loss are subsequently measured at fair…",97,CORRESPONDING AMOUNTS,Financial narrative,False
Shetland-2024-2025:p0098_000,8.658671,5.9846883,CORRESPONDING AMOUNTS,"- Financial Liabilities - Classification: The Board classifies its financial liabilities in the following categories: at fair value through profit or loss, and amortised cost. The Board classifies all financial liabilit…",98,CORRESPONDING AMOUNTS,Financial narrative,False
Shetland-2024-2025:p0098_001,8.68776,5.983194,CORRESPONDING AMOUNTS,"in current liabilities, except for maturities greater than 12 months after the Statement of Financial Position date. These are classified as non-current liabilities. The NHS Board’s financial liabilities held at amortis…",98,CORRESPONDING AMOUNTS,Financial narrative,False
Shetland-2024-2025:p0099_000,9.071083,6.883176,CORRESPONDING AMOUNTS,"Segmental reporting Operating segments are reported in a manner consistent with the internal reporting provided to the chief operating decision-maker, who is responsible for allocating resources and assessing performanc…",99,CORRESPONDING AMOUNTS,Financial narrative,False
Shetland-2024-2025:p0099_001,9.052607,7.285853,CORRESPONDING AMOUNTS,"services, funds held in these accounts should not be classed as commercial bank balances. Key sources of judgement and estimation uncertainty The Board makes subjective and complex judgements in applying its accounting…",99,CORRESPONDING AMOUNTS,Financial narrative,False
Shetland-2024-2025:p0100_000,9.457389,7.601828,THE TRUSTEES OF THE SHETLAND HEALTH,Judgements Area Description Sensitivities the Trustees of the Shetland Health Board Endowment Funds. In line with statutory guidance issued by the Integrated Resources Advisory Basis of Group IJBs are deemed to be joint…,100,THE TRUSTEES OF THE SHETLAND HEALTH,Governance,False
Shetland-2024-2025:p0100_001,9.674928,6.885287,THE TRUSTEES OF THE SHETLAND HEALTH,the NHS claim arising may cost claims Scotland Central Legal Office in order to NHS Shetland up to ( Note 13 ) quantify amounts provided. £0.025m in line with the CNORIS threshold ( Note 13b ). Depreciation for The Boar…,100,THE TRUSTEES OF THE SHETLAND HEALTH,Strategy / narrative,False
Shetland-2024-2025:p0101_000,8.6332,7.3138633,FINANCIAL STATEMENTS,"Note 2—Notes to the Cash Flow Statement Note 2a - SoRO for the Year Ended 31 March 2025 - Summary of Core Revenue Resource Out-turn 2025 Summary of Core Revenue Resource Out-turn Note £000 Net expenditure SoCNE 93,031 T…",101,FINANCIAL STATEMENTS,Financial table,False
Shetland-2024-2025:table_p0102,-1.6628838,1.217761,SUMMARY RESOURCE OUT-TURN,"Financial table on page 102 (Cash Flow) Contains 11 line items across 4 columns. Row labels: 2024; £000; 2,483; 34. Key items: 2024 | 2025; £000 | Note | £000; 2,483 | Depreciation | 7a | 2,420; 34 | Depreciationofdonat…",102,SUMMARY RESOURCE OUT-TURN,Financial table,False
Shetland-2024-2025:table_p0103,-1.6406782,0.9654115,SUMMARY RESOURCE OUT-TURN,Financial table on page 103 (Provisions) Contains 42 line items across 6 columns. Row labels: 2024; Net; movement; £000. Key items: 2024 | 2025; Net | Opening | Closing | Net; movement | balances | balances | Movement;…,103,SUMMARY RESOURCE OUT-TURN,Financial table,False
Shetland-2024-2025:table_p0104,-1.3838476,0.2308727,FINANCIAL STATEMENTS,"Financial table on page 104 (Income Statement) Contains 17 line items across 4 columns. Row labels: 2024; Total; £000; 1,002. Key items: 2024 | 2025 | 2025; Total | Board | Consolidated; £000 | £000 | £000; 1,002 | Gene…",104,FINANCIAL STATEMENTS,Financial table,False
Shetland-2024-2025:table_p0105,-1.5827905,0.29274088,FINANCIAL STATEMENTS,"Financial table on page 105 (Unknown) Contains 14 line items across 4 columns. Row labels: 2024; Total; £000; 9,476; 17. Key items: 2024 | 2025 | 2025; Total | Board | Consolidated; £000 | £000 | £000; 9,476 | Goodsands…",105,FINANCIAL STATEMENTS,Financial table,False
Shetland-2024-2025:table_p0106,-1.6685469,0.14978403,FINANCIAL STATEMENTS,"Financial table on page 106 (Income Statement) Contains 14 line items across 5 columns. Row labels: 2024; Total; £000; 86; 1,303. Key items: 2024 | 2025 | 2025; Total | Board | Consolidated; £000 | Note | £000 | £000; 8…",106,FINANCIAL STATEMENTS,Financial table,False
Shetland-2024-2025:table_p0107,-0.94717413,0.35565633,FINANCIAL STATEMENTS,Financial table on page 107 (Unknown) Contains 6 line items across 5 columns. Column headers: | | NetOperatingCosts | Totalassets | Totalliabilities. Row labels: DirectorateofAcuteandSpecialistServices; DirectorateofCom…,107,FINANCIAL STATEMENTS,Financial table,False
Shetland-2024-2025:table_p0108,-1.206972,0.4931758,FINANCIAL STATEMENTS,Financial table on page 108 (Property) Contains 11 line items across 4 columns. Row labels: CostorValuation:; At1April2024; At31March2025. Key items: ITSoftware | Total; Note | £000 | £000; At1April2024 | 97 | 97; At31M…,108,FINANCIAL STATEMENTS,Financial table,False
Shetland-2024-2025:table_p0109,-2.0896318,1.6576399,ASSETS UNDER,Financial table on page 109 (Property) Contains 12 line items across 10 columns. Column headers: | Land | Buildings | Dwellings | TransEquip | PlantandMachinery. Row labels: Costorvaluation; At1April2024; Additions—purc…,109,ASSETS UNDER,Financial table,False
Shetland-2024-2025:table_p0110,-1.947077,1.5302994,ASSETS UNDER,Financial table on page 110 (Unknown) Contains 11 line items across 10 columns. Column headers: | Land | Buildings | Dwellings | TransEquip | PlantandMachinery. Row labels: Providedduringtheyear—purchased; Provideddurin…,110,ASSETS UNDER,Financial table,False
Shetland-2024-2025:table_p0111,-1.9768364,1.5430284,ASSETS UNDER,Financial table on page 111 (Unknown) Contains 2 line items across 10 columns. Column headers: | Land | Buildings | Dwellings | TransEquip | PlantandMachinery. Row labels: Netbookvalueat31March2025. Key items: £000 | £0…,111,ASSETS UNDER,Financial table,False
Shetland-2024-2025:table_p0112,-2.039198,1.577213,ASSETS UNDER,Financial table on page 112 (Property) Contains 11 line items across 10 columns. Column headers: | Land | Buildings | Dwellings | TransEquip | PlantandMachinery. Row labels: Costorvaluation; At1April2023; Additions—purc…,112,ASSETS UNDER,Financial table,False
Shetland-2024-2025:table_p0113,-1.8723505,1.4689387,ASSETS UNDER,Financial table on page 113 (Unknown) Contains 11 line items across 10 columns. Column headers: | Land | Buildings | Dwellings | TransEquip | PlantandMachinery. Row labels: Providedduringtheyear—donated; Impairmentcharg…,113,ASSETS UNDER,Financial table,False
Shetland-2024-2025:table_p0114,-2.0628674,1.6146635,ASSETS UNDER,Financial table on page 114 (Unknown) Contains 2 line items across 10 columns. Column headers: | Land | Buildings | Dwellings | TransEquip | PlantandMachinery. Row labels: Netbookvalueat31March2024. Key items: £000 | £0…,114,ASSETS UNDER,Financial table,False
Shetland-2024-2025:table_p0115,-1.9035059,0.84586036,AT 1 APRIL 2024,"Financial table on page 115 (Property) Contains 8 line items across 6 columns. Column headers: Consolidated | Board | | | Consolidated | Board. Row labels: 2024; £000; 35,716; 540. Key items: 2024 | 2024 | 2025 | 2025;…",115,AT 1 APRIL 2024,Financial table,False
Shetland-2024-2025:p0116_000,9.758454,6.4407372,AT 1 APRIL 2024,"In the interim years between full valuations, indexation advice is sought from Gerald Eve. For the year ending 31 March 2025 index of 3% (after depreciation) has been applied to specialist buildings resulting in a net g…",116,AT 1 APRIL 2024,Governance,False
Shetland-2024-2025:p0116_001,9.943623,6.223213,AT 1 APRIL 2024,Standards UK (January 2020) and specifically the appropriate bases of valuation for IFRSs. It is provided within these Standards (and associated RICS Practice Statements) that: a) for those properties that are owner-occ…,116,AT 1 APRIL 2024,Governance,False
Shetland-2024-2025:p0116_002,9.696116,6.4290543,AT 1 APRIL 2024,"where few, if any, open market transactions involving a continuation of the existing use occur, then the basis of valuation is also Fair Value but the Depreciated Replacement Cost method of valuation is appropriate set…",116,AT 1 APRIL 2024,Financial table,False
Shetland-2024-2025:table_p0117,-1.8783528,0.83573776,AT 1 APRIL 2024,"Financial table on page 117 (Unknown) Contains 10 line items across 6 columns. Column headers: Consolidated | Board | | | Consolidated | Board. Row labels: 2024; £000; 500; 617; 3,196. Key items: 2024 | 2024 | 2025 | 20…",117,AT 1 APRIL 2024,Financial table,False
Shetland-2024-2025:table_p0118,-1.9429547,0.35219136,FINANCIAL STATEMENTS,Financial table on page 118 (Provisions) Contains 18 line items across 6 columns. Column headers: Consolidated | Board | | | Consolidated | Board. Row labels: 2024; £000; 4. Key items: 2024 | 2024 | 2025 | 2025; £000 |…,118,FINANCIAL STATEMENTS,Financial table,False
Shetland-2024-2025:table_p0119,-1.7763575,0.39758283,FINANCIAL STATEMENTS,"Financial table on page 119 (Unknown) Contains 11 line items across 6 columns. Column headers: Consolidated | Board | | | Consolidated | Board. Row labels: 2024; £000; 43; 2,302; 3,771. Key items: 2024 | 2024 | 2025 | 2…",119,FINANCIAL STATEMENTS,Financial table,False
Shetland-2024-2025:p0120_000,8.509992,6.595088,FINANCIAL STATEMENTS,The receivables assessed as individually impaired were mainly private companies and individuals and it was assessed that not all of the receivable balance may be recovered. Receivables that are less than three months pa…,120,FINANCIAL STATEMENTS,Financial narrative,False
Shetland-2024-2025:p0120_001,8.460277,6.4887977,FINANCIAL STATEMENTS,"individuals. There is no history of default from these customers recently. Concentration of credit risk is limited due to customer base being large and unrelated/government bodies. Due to this, management believe that t…",120,FINANCIAL STATEMENTS,Financial narrative,False
Shetland-2024-2025:table_p0121,-1.7150297,0.39923483,FINANCIAL STATEMENTS,"Financial table on page 121 (Unknown) Contains 10 line items across 5 columns. Row labels: Receivablesthatareneitherpastduenorimpairedareshownbytheircreditriskbelow:; Consolidated; 2024; £000; 3,771. Key items: Consolid…",121,FINANCIAL STATEMENTS,Financial table,False
Shetland-2024-2025:table_p0122,-1.8312008,0.50672406,FINANCIAL STATEMENTS,"Financial table on page 122 (Cash Flow) Contains 11 line items across 6 columns. Column headers: Consolidated | Board | | Note | Consolidated | Board. Row labels: 2024; £000; 1,507; 1,507; 1,437. Key items: 2024 | 2024…",122,FINANCIAL STATEMENTS,Financial table,False
Shetland-2024-2025:table_p0123,-1.7763056,0.35089362,FINANCIAL STATEMENTS,"Financial table on page 123 (Unknown) Contains 20 line items across 6 columns. Column headers: Consolidated | Board | | Note | Consolidated | Board. Row labels: 2024; £000; 1,866. Key items: 2024 | 2024 | 2025 | 2025; £…",123,FINANCIAL STATEMENTS,Financial table,False
