doc_id,report_year,period_end_date,report_year_source,run_date_utc,part,section_title,subsection_title,page_start,page_end,section_text,word_count
Shetland-2022-2023,2022-23,,pdf_cover,2026-02-26T08:04:59+00:00,Unknown,General Fund Receivables and Payables,Unknown,101,101,"the higher of an asset’s fair value less costs to sell, and value in use. Where an asset is not held for the purpose of generating cash flows, value in use is assumed to equal the cost of replacing the service potential provided by the asset, unless there has been a reduction in service potential. For the purposes of assessing impairment, assets are grouped at the lowest levels for which there are separately identifiable cash flows (cash-generating units). Non-financial assets that suffer an impairment are reviewed for possible reversal of the impairment. Impairment losses charged to the SoCNE are deducted from future operating costs to the extent that they are identified as being reversed in subsequent revaluations. General Fund Receivables and Payables Where the Health Board has a positive net cash book balance at the year-end, a corresponding creditor is created and the general fund debited with the same amount to indicate that this cash is repayable to the SGHSCD. Where the Health Board has a net overdrawn cash position at the year-end, a corresponding debtor is created and the general fund credited with the same amount to indicate that additional cash is to be drawn down from the SGHSCD. Inventories Inventories are valued at the lower of cost and net realisable value. Taking into account the high turnover of NHS inventories, the use of average purchase price is deemed to represent current cost. Work in progress (WIP) is valued at the cost of the direct materials plus the conversion costs and other costs incurred to bring the goods up to their present location, condition and degree of completion. There are no WIP at 31 March 2023. Losses and Special Payments Operating expenditure includes certain losses which would have been made good through insurance cover had the NHS not been bearing its own risks. Had the NHS provided insurance cover, the insurance premiums would have been included as normal revenue expenditure. Short-term Employee Benefits Salaries, wages and employment-related payments are recognised in the year in which the service is received from employees. The cost of annual leave and flexible working time entitlement earned but not taken by employees at the end of the year is recognised in the financial statements to the extent that employees are permitted to carry-forward leave into the following year. Pension Costs The Board participates in the NHS Superannuation Scheme for Scotland providing defined benefits, where contributions are credited to the Exchequer and are deemed to be invested in a portfolio of Government Securities. The scheme was revised on",423
Shetland-2022-2023,2022-23,,pdf_cover,2026-02-26T08:04:59+00:00,Unknown,1 April 2015 to extend the retirement age to the State Pension age and to calculate,Unknown,102,102,"1 April 2015 to extend the retirement age to the State Pension age and to calculate benefits on a career average re-valued earnings basis (CARE). The previous scheme was split in to two sections, 1995 and 2008, and any benefits earned by members prior to 1 April 2015 are protected and will be paid at the sections normal pension age using final pensionable pay when members leave or retire. Some members who were close to retirement when the NHS 2015 scheme launched will continue to earn benefits in their current section. This may affect members who were paying into the scheme on 1 April 2012 and were within 10 years of their normal retirement age. Some members who were close to retirement but did not qualify for full protection will remain in their current section beyond 1 April 2015 and join the 2015 scheme at a later date. The Board is unable to identify its share of the underlying notional assets and liabilities of the scheme on a consistent and reasonable basis and therefore accounts for the scheme as if it were a defined contribution scheme, as required by IAS 19 ‘Employee Benefits’. As a result, the amount charged to the Statement of Comprehensive Net Expenditure represents the Board’s employer contributions payable to the scheme in respect of the year. The contributions deducted from employees are reflected in the gross salaries charged and are similarly remitted to Exchequer. The pension cost is assessed every five years by the Government Actuary who determines the rate of contributions required. The most recent actuarial valuation is published by the Scottish Public Pensions Agency and is available on their website. Additional pension liabilities arising from early retirements are not funded by the scheme except where the retirement is due to ill-health. The full amount of the liability for the additional costs is charged to the Statement of Comprehensive Net Expenditure at the time the Board commits itself to the retirement, regardless of the method of payment. Clinical and Medical Negligence Costs Employing health bodies in Scotland are responsible for meeting medical negligence costs up to a threshold per claim. Costs above this threshold are reimbursed to Boards from a central fund held as part of CNORIS by the Scottish Government. NHS Shetland provide for all claims notified to the NHS Central Legal Office according to the value of the claim and the probability of settlement. Claims assessed as ‘Category 3’ are deemed most likely and provided for in full, those in ‘Category 2’ as 50% of the claim and those in ‘category 1’ as nil. The balance of the value of claims not provided for is disclosed as a contingent liability. This procedure is intended to estimate the amount considered to be the liability in respect of any claims outstanding and which will be recoverable from the CNORIS in the event of payment by an individual health body. The corresponding recovery in respect of amounts provided for is recorded as a debtor and that in respect of amounts disclosed as contingent liabilities are disclosed as contingent assets.",513
Shetland-2022-2023,2022-23,,pdf_cover,2026-02-26T08:04:59+00:00,Unknown,Related Party Transactions,Unknown,103,103,"NHS Shetland also provides for its liability from participating in the scheme. The Participation in CNORIS provision recognises the Board’s respective share of the total liability of NHS Scotland as advised by the Scottish Government and based on information prepared by NHS Boards and the Central Legal Office. The movement in the provisions between financial years is matched by a corresponding adjustment in AME provision and is classified as non-core expenditure. Related Party Transactions Material related party transactions are disclosed in Note 20 in line with the requirements of IAS 24. Transactions with other NHS bodies for the commissioning of health care are summarised in Note 4 . Value Added Tax (VAT) Most of the activities of the Board are outside the scope of VAT and, in general, output tax does not apply and input tax on purchases is not recoverable. Irrecoverable VAT is charged to the relevant expenditure category or included in the capitalised purchase cost of non-current assets. Where output tax is charged or input VAT is recoverable, the amounts are stated net of VAT. Provisions The Board provides for legal or constructive obligations that are of uncertain timing or amount at the reporting date on the basis of the best estimate of the expenditure required to settle the obligation. Where the effect of the time value of money is significant, the estimated cash flows are discounted using the discount rate prescribed by HM Treasury. Contingencies Contingent assets (that is, assets arising from past events whose existence will only be confirmed by one or more future events not wholly within the Board’s control) are not recognised as assets, but are disclosed in Note 14 where an inflow of economic benefits is probable. Contingent liabilities are not recognised, but are disclosed in Note 14 , unless the probability of a transfer of economic benefits is remote. Contingent liabilities are defined as: - possible obligations arising from past events whose existence will be confirmed only by the occurrence of one or more uncertain future events not wholly within the entity’s control; or - present obligations arising from past events but for which it is not probable that a transfer of economic benefits will arise or for which the amount of the obligation cannot be measured with sufficient reliability.",378
Shetland-2022-2023,2022-23,,pdf_cover,2026-02-26T08:04:59+00:00,Unknown,Corresponding Amounts,Unknown,104,108,"Corresponding Amounts Corresponding amounts are shown for the primary statements and notes to the financial statements. Where the corresponding amounts are not directly comparable with the amount to be shown in respect of the current financial year, IAS 1 ‘Presentation of financial statements’, requires that they should be adjusted and the basis for adjustment disclosed in a note to the financial statements. Financial Instruments - Financial assets - Business Model: The Board’s business model refers to how it manages its financial assets in order to generate cash flows and is determined at a level which reflects how groups of financial assets are managed to achieve a business objective, rather than assessment of individual instruments. - Classification: When the Board first recognises a financial asset, it classifies it based on its business model for managing the asset and the asset’s contractual flow characteristics. The Board classifies its financial assets in the following categories: at fair value through profit or loss, amortised cost, and fair value through other comprehensive income. The default basis for financial assets is to be held at fair value through profit or loss, although alternative treatment may be designated where receivables are held to collect principal and interest and/or for sale. a) Financial assets at fair value through profit or loss This is the default basis for financial assets. b) Financial assets held at amortised cost. A financial asset may be held at amortised cost where both of the following conditions are met: i. the financial asset is held within a business model where the objective is to collect contractual cash flows; and ii. the contractual terms of the financial asset give rise to cash flows that are solely payments of principal and related interest. c) Financial assets at fair value through other comprehensive income A financial asset may be held at fair value through other comprehensive income where both of the following conditions are met: i. the financial asset is held within a business model where the objective is to collect contractual cash flows and sell the asset; and ii. the contractual terms of the financial asset give rise to cash flows that are solely payments of principal and related interest.
- Impairment of financial assets: Provisions for impairment of financial assets are made on the basis of expected credit losses. The Board recognises a loss allowance for expected credit losses on financial assets and this is recognised in other comprehensive income, rather than reducing the carrying amount of the asset in the Statement of Financial Position. Lifetime expected credit losses are recognised and applied to financial assets by the Board where there has been a significant increase in credit risk since the asset’s initial recognition. Where the Board does not hold reasonable and supportable information to measure lifetime expected credit losses on an individual instrument basis, the losses are recognised on a collective basis which considers comprehensive credit risk information. - Recognition and measurement: Financial assets are recognised when the Board becomes party to the contractual provisions of the financial instrument. Financial assets are derecognised when the rights to receive cash flows from the asset have expired or have been transferred and the Board has transferred substantially all risks and rewards of ownership. a) Financial assets at fair value through profit or loss. Financial assets carried at fair value through profit or loss are initially recognised at fair value, and transaction costs are expensed in the Statement of Comprehensive Net Expenditure. Financial assets carried at fair value through profit or loss are subsequently measured at fair value. Gains or losses arising from changes in the fair value are presented in the Statement of Comprehensive Net Expenditure. b) Financial assets held at amortised cost. Loans and receivables are recognised initially at fair value and subsequently measured at amortised cost using the effective interest method. This is calculated by applying the effective interest rate to the gross carrying amount of the asset. c) Financial assets held at fair value through other comprehensive income - Financial Liabilities - Classification: The Board classifies its financial liabilities in the following categories: at fair value through profit or loss, and amortised cost. The Board classifies all financial liabilities as measured at amortised cost, unless: - these are measured at fair value on a portfolio basis in accordance with a documented risk management or investment strategy; - they contain embedded derivatives; and/or
- it eliminates or reduces ‘accounting mismatch’ that would otherwise arise from measurement or recognition on an amortised costs basis. a) Financial liabilities at fair value through profit or loss Financial liabilities at fair value through profit or loss comprise derivatives. Liabilities in this category are classified as current liabilities. The NHS Board does not trade in derivatives and does not apply hedge accounting. b) Financial liabilities held at amortised cost Financial liabilities held at amortised cost are disclosed in current liabilities, except for maturities greater than 12 months after the Statement of Financial Position date. These are classified as non-current liabilities. The NHS Board’s financial liabilities held at amortised cost comprise trade and other payables in the Statement of Financial Position. - Recognition and measurement: Financial liabilities are recognised when the NHS Board becomes party to the contractual provisions of the financial instrument. A financial liability is removed from the Statement of Financial Position when it is extinguished, that is when the obligation is discharged, cancelled or expired. a) Financial liabilities at fair value through profit or loss. Financial liabilities carried at fair value through profit or loss are initially recognised at fair value, and transaction costs are expensed in the income statement. Financial liabilities carried at fair value through profit or loss are subsequently measured at fair value. Gains or losses arising from changes in the fair value are presented in the Statement of Comprehensive Net Expenditure. b) Amortised costs Financial liabilities held at amortised cost are recognised initially at fair value and subsequently measured at amortised cost using the effective interest method. Segmental reporting Operating segments are reported in a manner consistent with the internal reporting provided to the chief operating decision-maker, who is responsible for allocating resources and assessing performance of the operating segments. This has been identified as the executive management team of the Board. Operating segments represent the Directorates of the Board which are in line with the internal management and reporting structure. Cash and cash equivalents Cash and cash equivalents includes cash in hand, deposits held at call with banks, cash balances held with the Government Banking Service, balances held in commercial banks and other short-term highly liquid investments with original
maturities of three months or less, and bank overdrafts. Bank overdrafts are shown within borrowings in current liabilities on the Statement of Financial Position. Where the Government Banking Service is using Royal Bank of Scotland Group to provide the banking services, funds held in these accounts should not be classed as commercial bank balances. Key sources of judgement and estimation uncertainty The Board makes subjective and complex judgements in applying its accounting policies and relies on a range of estimation techniques and assumptions concerning uncertain future events. It is recognised that sources of estimation uncertainty are likely to vary from year to year and the resulting accounting estimates will, by definition, seldom equal the related actual results. As such, key judgements and estimates are continually reviewed, based on historical experience and other factors, including changes to past assumptions and expectations of future events that are believed to be reasonable under the circumstances. The key judgements and estimations exercised in the application of the Board’s accounting policies which have the most significant effect on the carrying amounts in the financial statements are summarised below: Judgements Area Description Sensitivities Pensions The NHS pension is treated as a defined contribution scheme as its assets and liabilities are not separately identifiable. Basis of The Endowment funds is a subsidiary Consolidation due to control and is consolidated on a line by line basis. The Directors of NHS Shetland are also the Trustees of the Endowment funds. In line with statutory guidance issued by the Integrated Resources Advisory Group (IRAG) IJBs are deemed to be joint ventures. In accordance with IFRS 11 Joint Arrangements, the primary financial statements have been amended for the additional disclosure required to accurately reflect the Board’s 50% interest in IJBs using the equity method of accounting.
Estimates Area Description Sensitivities Accruals The Board has placed significant reliance on estimation and judgement based on best available evidence to quantify amounts accrued in the accounts. Provisions - The Board has provided for estimated There are no Clinical and costs relating to clinical and medical outstanding claims at Medical negligence and reliance has been 31 March 2023 but Negligence placed on details provided by the NHS each new claim claims Scotland Central Legal Office in order to arising will cost NHS (Note 13) quantify amounts provided. Shetland up to £0.025m in line with the CNORIS threshold (Note 13b). Non-current The Board commissioned a valuation of Depreciation for Assets – land and buildings as part of its three- 2022–23 was Valuation of year rolling program as at 31 March £0.944m (Note 7). land and 2023. The valuation report has been A 1% increase in buildings used to inform the measurement of valuation would (Note 7) assets in these financial statements. increase next year’s depreciation by £0.010m. Note 2—Notes to the Cash Flow Statement - 2a. Summary of Resource Out-turn (SoRo) for the Year Ended 31 March 2023 - Summary of Core Revenue Resource Out-turn 2023 Summary of Core Revenue Resource Out-turn Note £000 Net expenditure SoCNE 84,435 Total non-core expenditure (see below) (2,801) Family Health Services non-discretionary allocation (1,848) Endowment net expenditure (14) Associates and joint ventures accounted for on an equity (1,386) basis",1626
Shetland-2022-2023,2022-23,,pdf_cover,2026-02-26T08:04:59+00:00,Unknown,Core RRL,Unknown,109,109,"Total core expenditure 78,386 Core RRL 78,458 Saving against Core RRL 72 - Summary of Non-Core Revenue Resource Out-turn 2023 Summary of Non-Core Revenue Resource Out-turn Note £000 Depreciation/amortisation 7a 1,936 Right of Use (RoU) Asset Depreciation 17a 642 Annually Managed Expenditure (AME)—impairments 7a 4 AME—provisions 180 AME—depreciation of donated assets 39 Total Non-Core Expenditure 2,801 Non-Core RRL 2,801 Saving against Non-Core RRL 0 The Notes to the Accounts, numbered 1 to 21, form an integral part of these Accounts. - Summary Resource Out-turn Summary Resource Out-turn Resource Expenditure Saving/(Excess) £000 £000 £000 Core 78,458 78,386 72 Non-Core 2,801 2,801 0 Total 81,259 81,187 72 - 2b. Consolidated adjustments for non-cash transactions 2022 2023 £000 Note £000 Expenditure not paid in cash 1,661 Depreciation 7a 1,936 36 Depreciation of donated assets 7a 39",133
Shetland-2022-2023,2022-23,,pdf_cover,2026-02-26T08:04:59+00:00,Unknown,Right of Use (RoU) Remeasurement loss,Unknown,110,113,"2022 2023 £000 Note £000 Expenditure not paid in cash 0 Right of Use (RoU) Remeasurement loss 642 138 Impairments of PPE charged to SoCNE 3 (1,073) Associates and joint ventures accounted for on an SoCNE 1,386 equity basis (2) Retrospective restatement of opening balance of 0 funds held on trust 760 Total expenditure not paid in cash CFS 4,006 - 2c. Consolidated movements in working capital 2022 2023 Net Opening Closing Net movement Note balances balances Movement £000 £000 £000 £000 Inventories (53) SoFP 8 528 641 (113) Trade and other Receivables Due within one year 9 2,385 5,563 476 Net 2,385 5,563 (3,178) (increase)/decrease Trade and other Payables Due within than one 12 16,518 12,881 year Due after more than 0 1,277 one year Less: General Fund 12 (190) (176) creditor included in above
2022 2023 Net Opening Closing Net movement Note balances balances Movement £000 £000 £000 £000 Less: lease creditors 0 (1,277) included in above 2,347 Net decrease/ 16,328 12,705 (3,623) (increase) Provisions Statement of 13a 2,047 2,101 Financial Position 0 Net decrease/ 2,047 2,101 54 (increase) 2,770 Net movement CFS (6,860) (decrease)/ increase
Note 3—Expenditure - 3a. Staff costs 2022 2023 2023 Total Board Consolidated £000 Note £000 £000 12,491 Medical and Dental 12,855 12,855 14,695 Nursing 15,780 15,780 21,641 Other Staff 21,361 21,361 48,827 Total SoCNE 49,996 49,996 - 3b. Other operating expenditures 2022 2023 2023 Total Board Consolidated £000 £000 £000 Independent Primary Care Services: 1,222 General Medical Services [1] 1,292 1,292 1,127 Pharmaceutical Services 1,196 1,196 552 General Dental Services [2] 526 526 420 General Ophthalmic Services 428 428 3,321 Total 3.442 3.442 Drugs and medical supplies: 4,448 Prescribed drugs Primary Care 4,751 4,751 2,250 Prescribed drugs Secondary Care 2,831 2,831 809 PPE and testing kits 119 119 2,176 Medical Supplies 1,846 1,846 9,683 Total 9,547 9,547 Other health care expenditure 40,410 Contribution to IJBs 38,903 38,903
2022 2023 2023 Total Board Consolidated £000 £000 £000 9,452 Goods and services from other NHS 9,647 9,647 Scotland bodies 11 Goods and services from other UK NHS 23 23 bodies 464 Goods and services from private 906 906 providers 36 Goods and services from voluntary 0 0 organisations 1,586 Resource Transfer 1,618 1,618 14,624 Other operating expenditure 11,170 11,170 78 External Auditor – statutory audit fee 95 95 14 External Auditor - other services – share 0 0 of IJB audit fee 65 Endowment Fund expenditure 0 65 66,740 Total 62,362 62,427 79,744 Total Other Operating Expenditure 75,351 75,416 [1] This figure represents the costs of the independent GP practices only. The total cost of services in 2022–23, including Board run practices, is £6,364 (2021–22, £7,171k). [2] This figure represents the costs of the independent dental practices only. The total cost of services in 2022–23, including Board run practices, is £3,359k (2021– 22, £2,914k).",470
Shetland-2022-2023,2022-23,,pdf_cover,2026-02-26T08:04:59+00:00,Unknown,Note 4—Operating Income,Unknown,114,114,"Note 4—Operating Income 2022 2023 2023 Total Board Consolidated £000 Note £000 £000 67 Income from Scottish 71 71 Government 1,130 Income from other NHS 1,090 1,090 Scotland bodies 133 Income from NHS non-Scottish 145 145 bodies 37,167 Income for services 39,955 39,955 commissioned by IJB 99 Patient charges for primary care 129 129 455 Donations [1] 0 0 88 Contributions in respect of 319 319 clinical and medical negligence claims Non NHS: 9 Overseas patients (non- 5 5 reciprocal) 228 Endowment Fund Income 0 51 2,014 Other 598 598 41,390 Total Income SoCNE 42,312 42,363 [1] Donations represent Covid-19 Lateral Flow Devices (LFD) received at no cost from the UK Government. There was no such donation in 2022–23.",119
Shetland-2022-2023,2022-23,,pdf_cover,2026-02-26T08:04:59+00:00,Unknown,Note 5—Segmental Analysis,Unknown,115,115,"Note 5—Segmental Analysis - 5a. Segmental Analysis 2023 Net Operating Total Total Costs assets liabilities 24,782 13,811 (4,772) Directorate of Acute and £000 Specialist Services 28,970 16,145 (5,578) Directorate of £000 Community Health & Social Care 12,893 7,185 (2,483) Off-island Clinical £000 Services 2,516 1,402 (485) Public Health £000 15,274 8,512 (2,941) Support Services £000 84,435 47,056 (16,259) 2023 £000 - 5b. Segmental Analysis Previous Year, 2022 Net Operating Total Total Costs assets liabilities 21,337 9,058 (4,527) Directorate of Acute and £000 Specialist Services 32,998 14,009 (7,001) Directorate of £000 Community Health & Social Care 12,367 5,250 (2,624) Off-island Clinical £000 Services 3,005 1,279 (637) Public Health £000 17,637 7,487 (3,741) Support Services £000 87,344 37,080 (18,530) 2022 £000",119
