doc_id,report_year,period_end_date,report_year_source,run_date_utc,part,section_title,subsection_title,page_start,page_end,section_text,word_count
Shetland-2022-2023,2022-23,,pdf_cover,2026-02-26T08:04:59+00:00,Unknown,Sustainability and Environmental Reporting,Unknown,34,39,"by Healthcare Improvement Scotland team. Sustainability and Environmental Reporting The Climate Change (Scotland) Act 2009 originally set out measures adopted by the Scottish Government to reduce emissions in Scotland by at least 80% by 2050. The Climate Change (Emissions Reductions Targets) (Scotland) Act 2019 amended this longer-term target to net-zero by 2045, five years in advance of the rest of the UK. In 2020 ‘The Climate Change (Scotland) Amendment order came into force to reflect this and now requires NHS Boards to report on their progress in delivering their emissions reduction targets. All designated Major Players (of which NHS Shetland is one) are required to submit an annual report to the Sustainable Scotland Network detailing compliance with the climate change duties imposed by the Act and the Amendment order. The information returned by the Board is compiled into a national analysis report, published annually and superseding the prior requirement for public bodies to publish individual sustainability reports. Further information on the Scottish Government’s approach can be found in the Climate Change Plan 2018-2032 while national reports can be found on the Sustainable Scotland Network website . In meeting our obligation NHS Shetland engaged with specialist consultants to develop a NHS Shetland Net Zero Route map to achieve the current Scottish Government targets. The route map by the Board sets out the Board’s: - baseline impact assessment of the Board on the environmental at 4,163 tCO2e; - identifies actions to take to meet our mandatory sustainability targets; - that roughly 48% of these emissions are associated with patient transport; and - replacement of Gilbert Bain Hospital, that accounts for roughly 30% of emissions , is a key factor in achieving our targets. NHS Shetland is using the NHS Scotland Climate Change Adaptation Assessment Tool to assess the risks and produce an Adaptation Action Plan. This created our Climate Change Risk Assessment submission to Scottish Government. The Board is committed to sustainability and to reducing its impact on the environment as originally laid down in the Scottish Health Technical Memorandum 07–02 and the recent amendments to this that change the baseline to 2018 and shorten the timeframe to complete the targets. In line with this, the Board has taken the following actions: - Continued to implement our Sustainability and Environmental Management Policy with sustainable development action plan ; - NHS Shetland have a nominated Green Champion, Board Chair Gary Robinson; - Working in partnership with ZetTrans on progressing local sustainable transport strategy for Shetland in consultation with the community;
target for 20% reduction in patient travel emissions by 2030 when accessing health services through: o reducing patients travel flights off-island via repatriation schemes; o increasing the number of appointments using e-technology or telephone to deliver consultations; o use of GP portals in a number of practices to reduce need to visit practices; and lastly o also aided by the modernisation of Loganair airplanes to ATR-72 that now emit 25.6% less CO2, as advised by the airline. - Gilbert Bain and Montfield accommodation, Lerwick Health Centre and Breiwick House continue to use the Shetland Heat Energy and Power (SHEP) district heating system, minimising carbon dioxide emissions from heat energy; - Significantly increased the number of electric vehicles in the Board fleet and by the time these accounts are signed 100% of the cars in our fleet can run of electric power and 33% of our light commercial vehicles. This alongside staff travel off island also benefiting from the modernisation of Loganair airplanes to ATR-72 will also have met nationally set target for 20% reduction in staff travel emissions by 2030; - Staff have access to a car salary sacrifice scheme to allow them to upgrade their personal vehicles to lower emission or zero emission vehicles which should assist in lowering our grey fleet impact on the environment; - The Board also has a fleet of 12 electric bicycles located across Shetland that promote the principles of active travel for staff business travel; and - Being developing our local submission to access Scottish Central Government Energy Efficiency Grant scheme to address accelerating our local investment in renewable heat technologies and energy efficiency across all our buildings. The removal of kerosene from our local energy sources being a significant primary next step on our journey to net zero. In respect of the Board’s target to net zero emissions in our pooled fleet our plan is to have 93% of vehicles able to run on electricity by 31 March 2024 and 100% by 31 December 2025. At the 31 March 2023, 41% of vehicles able to run on electricity. The delivery of vehicles ordered in 2022–23 will take this total up to 75% before 22 June 2023. Supply issues for small electric commercial vehicles in 2022 that met best value is causing a delayed our transition plans. NHS Shetland have an established Environmental and Sustainability Group, Waste Group. Transport Group and Energy Group with identified leads. An Energy Policy is being developed collaboratively in conjunction with the NHS North Energy Group that involves five other Health Boards.
Shetland during 2022–23 Re-establishing and improving services - Managed Clinical Networks In April 2022, two Managed Clinical Networks (MCNs) were launched, following the appointment of a fixed-term MCN Co-ordinator based in the Public Health Directorate. MCNs are structured networks that provide opportunities for collaborative working across different healthcare settings, professions, and with wider stakeholders around shared interests and common goals of improving care. Participants work together to share knowledge, develop, and implement pathways and improve services. The new MCNs are “Frailty” and “Respiratory”, and will build on the work of NHS Shetland’s Falls and Coronary Heart Disease MCNs and link with the existing Palliative Care MCN. - Re-establishing the Cardiac Rehabilitation Service Figure 15—Photo showing Cardiac Rehabilitation Service-users at Clickimin Leisure Centre In June 2022, the Cardiac Rehabilitation (CR) Service was re-established after being suspended during the Covid-19 pandemic. CR helps people living with heart disease to regain and maintain a good quality of life, addressing not just the medical toll of their illness, but also the mental and emotional burden. The CR service had been comprehensively reviewed pre-pandemic, and the re- designed service is now exceptionally wide-ranging and ensures better access for all. The picture above shows patients and their families receiving a weekly health education session at the Clickimin Leisure Centre. - Young people’s mental health and wellbeing at heart of Mind Your Head service Joint funding from the Shetland Islands Council and NHS Shetland helped local mental health charity Mind Your Head’s create the Well Youth initiative offers one to one support through an assigned wellness practitioner.
supporting someone struggling with their own mental health and wellbeing. - New Repatriation of Services in 2022–23 The medical imaging service started two new projects that maximised the skills and equipment available in Shetland. Margarita Nesbit, Consultant Sonographer, has led with healthcare professionals based in Shetland and Aberdeen the expansion of specialist diagnostic tests not previously available locally. This work stream has developed local pathways and ultrasound clinics for musculoskeletal conditions and Thyroid specialist and interventional services. A total of 288 patient attendances occurred in 2022–23 for this new service. In March 2023, the local Medical Imaging and Clinical Physiology team performed the first CT Coronary Angiogram in Shetland with support and input from a visiting Radiologist from NHS Grampian. As a result of investment support from Scottish Government in 2021, we replaced the CT scanner, enabling the local Medical Imaging Team to offer a wider range of CT based diagnostic tests in Shetland. The patient benefits include improved access and reduced need to travel out with Shetland for most common cardiac investigations. It has taken 18 months to develop these new pathways, but it is another great example of collaborative working across various teams with input from specialists in Aberdeen. Initial Agreement Project In August 2022, NHS Shetland embarked on the Initial Agreement (IA) phase of the business case process to seek Scottish Government funding to re-develop or refurbish the Gilbert Bain Hospital and potential associated hub facilities. This was building on the work done for the Clinical Strategy and the Strategic Assessment. On 25 August, the first of seven stakeholder workshops was held to support the development of the IA. The workshop confirmed a number of goals requiring a “Need for Change”, including an increased capacity to address health inequalities, a greater ability to meet current and future demand, and an aim to make infrastructure compliant with sustainability and patient dignity requirements. - Excellence in Care Awards 2022 On 2 December 2022, staff presented 11 projects to their colleagues, the Board, and the media for the annual Celebration Excellence in Care awards . The event shone the spotlight on different parts of the health care service, with a focus on how different parts of the health service navigated challenges arising from the pandemic and the subsequent re-mobilization of services. A diverse panel of judges chose winners in five categories: practice education, innovation in practice, person-centred care, prevention, and the impact of partnership working. Panel Chair, Deputy Chief Nursing Officer Anne Armstrong, said those presenting and the teams they represent “demonstrated a very high calibre of improvement work which deserves to be shared nationally to spread new ways of working and good practice. The
really shone through was the focus on putting the patient and their families at the centre of care and how that had such a positive impact on the quality of the patients’ experience and the quality of their care”. - Celebrating Success In May 2022, consultant anaesthetist Dr Catriona Barr won the Outstanding Role Model Award at the NES Annual Conference for her work supporting school pupils to access work experience in healthcare settings. Six participants secured places on courses leading to medical degrees, while others decided on different careers in healthcare. In July 2022, Hazel Cooper, who has worked for NHS Shetland for 32 years, first in Dental Services and late in the Theatre Department, qualified to become the first Operating Department Practitioner (ODP) in Shetland. ODPs work within operating theatres while patients are undergoing surgery and they train in a number of areas including anaesthetics, surgery, and post-anaesthetic recovery. Advanced Nurse Practitioner Jane Astles and Chief Midwife Jacquie Whitaker were two of the first practitioners in Scotland complete a PgCert in Advanced Forensic Practice. Their skills will mean more responsive care for people who have experienced rape or sexual assault in Shetland, as they will be able to provide forensic examinations. In response to their achievement, Chief Medical Officer for Scotland Professor Sir Gregor Smith wrote to Jane and Jacquie to congratulate them. - “Developing the Young Workforce” Shetland event Figure 16—Photo of Facilities team members at their event-stand In March 2023, “Developing the Young Workforce” Shetland and the Anderson High School held a Local Opportunities and Apprenticeships Event designed to bring together local businesses, organisations, education and training institutions who can provide courses, training, employment and volunteering opportunities.
- New benches outside the Servery Figure 17—Photo of staff members resting on new benches outside the Servery In May 2022 as part of our staff wellbeing actions, NHS Shetland was delighted to take delivery of the superb benches below, which were installed just outside the servery. - Voar Redd Up—Montfield Community Garden Project Figure 18—Photo of staff member clearing garden area around Montfield Board Headquarters In May 2022, as part of the annual Shetland-wide clean-up event, the Voar Redd Up , NHS Shetland staff collected rubbish and gardened around Montfield Board Headquarters. This was the first step of the Montfield Community Garden Project, which aims to make more use of the green areas around Montfield for staff and the community.",1948
Shetland-2022-2023,2022-23,,pdf_cover,2026-02-26T08:04:59+00:00,Unknown,Artist Stuart Pearson Wright painted a beautiful portrait of Shetland knitter Harriet,Unknown,40,40,"- MRI fundraiser Harriet Middleton’s portrait revealed Artist Stuart Pearson Wright painted a beautiful portrait of Shetland knitter Harriet Middleton for the BBC’s Extraordinary Portrait television programme, to honour her exceptional contribution to the NHS Shetland Endowment Fund’s MRI Scanner Appeal. Harriet and her team of knitters raised over £100k for the appeal, which benefited from huge local support, and donations from well-wishers around the world. The portrait was unveiled in its new home at Shetland Museum in February 2023. - Visit by then-Cabinet Secretary for Health and Social Care Humza Yousaf and Deputy Chief Medical Officer Professor Graham Ellis Figure 19—Photo collage of then-Cabinet Secretary for Health and Social Care, and current First Minister for Scotland, Humza Yousaf and Deputy Chief Medical Officer Professor Graham Ellis meeting with staff members",131
Shetland-2022-2023,2022-23,,pdf_cover,2026-02-26T08:04:59+00:00,Unknown,23 June 2023,Unknown,41,41,"Minister for Scotland, Humza Yousaf and Deputy Chief Medical Officer Professor Graham Ellis visited NHS Shetland. Mr. Yousaf and Professor Ellis visited a variety of locations and met with many members of staff and management to talk about the present and future of NHS Shetland. Events after the end of the reporting year None. Section 6—Approval and signing of the Performance Report Signed by Michael Dickson, Chief Executive as Accountable Officer 23 June 2023",74
Shetland-2022-2023,2022-23,,pdf_cover,2026-02-26T08:04:59+00:00,Unknown,The Accountability Report,Unknown,42,42,"Corporate Governance Report Directors’ Report - Date of Issue The Accountable Officer authorised these audited financial statements for issue on 23 June 2023 following approval by the Board on 22 June 2023. - Appointment of auditor The Public Finance and Accountability (Scotland) Act 2000 places personal responsibility on the Auditor General for Scotland to decide who will audit each Scottish health body. For the financial years 2022–23 to 2027–28, the Auditor General appointed Audit Scotland to audit NHS Shetland. - Board membership Executive Board Members Position Held Michael Dickson Chief Executive Kirsty Brightwell Medical Director Kathleen Carolan Director of Nursing and Acute Services Colin Marsland Director of Finance Lorraine Hall Director of Human Resources and Support Services Susan Laidlaw Director of Public Health Non-Executive Board Members Position Held Gary Robinson Chair Natasha Cornick Vice Chair Malcolm Bell [until 30 April 2022] Jane Haswell Lincoln Carroll Colin Campbell Joseph Higgins [from 8 December 2022] Emma Macdonald [from 4 July 2022] Kathy Hubbard",161
Shetland-2022-2023,2022-23,,pdf_cover,2026-02-26T08:04:59+00:00,Unknown,Position Held,Unknown,43,44,"Stakeholder Non-Executive Board Position Held Members Amanda McDermott Chair, Area Clinical Forum Ian Sandilands [until 5 June 2022] Employee Director Bruce McCulloch [from 6 June 2022] Employee Director Under the terms of the Scottish Health Plan, the Health Board is a board of governance, and its membership will be conditioned by the functions of the Board. Members of Health Boards are selected on the basis of their position or the particular expertise that enables them to contribute to the functions and decision-making process at a strategic level and reflects the partnership approach which is essential to improving health and healthcare. The Health Board has collective responsibility for the performance of the local NHS system as a whole, the partnership approach, which is essential to improving health and health care. The Board Members’ responsibilities in relation to the financial statements are set out in a statement following this report. The terms “Board Members” and “Directors” are interchangeable in this report. The names and positions of the Board Members are set out above. The Chief Executive has resigned from his post since 31 March 2023 with his leaving date yet to be confirmed. A recruitment process to appoint his replacement commenced in April 2023. - Board Members’ and senior managers’ interests Details of any interests of board members, senior managers and other senior staff in contracts or potential contractors with the Health Board as required by IAS 24 are disclosed in note 20 . A register of interests, which includes details of company directorships or other significant interests held by Board members that may conflict with their management responsibilities, is available for inspection at the Board’s Headquarters, Montfield, Burgh Road, Lerwick, ZE1 0LA or on the Board's website . All Directors appointed by the Cabinet Secretary (shown in the remuneration report ) are also Trustees of the NHS Shetland Endowment Fund, which are consolidated into these accounts. Directors’ third party indemnity provisions The Board has not provided a qualifying third party indemnity provision for any of its Directors at any time during the financial year 2022–23 (nor were any provided in 2021– 22). - Remuneration for non-audit work Audit Scotland did not undertake any non-audit work for the Board in 2022–23 (nor in 2021–22).
The value of land owned by the Board is included at current market value, with details provided in Note 7.a . - Public Services Reform (Scotland) Act 2010 Sections 31 and 32 of the Public Services Reform (Scotland) Act 2010 imposed duties on the Scottish Government, as well as listed Public Bodies, to publish information on expenditure and certain other matters as soon as is reasonably practicable after the end of each financial year. NHS Shetland has met the requirements of the Public Services Reform (Scotland) Act 2010. You can find the relevant documentation on NHS Shetland’s external website. - Personal data related incidents reported to the Information Commissioner During 2022–23 there were five cases reported to the Information Commissioner’s Office (ICO). In comparison, during 2021–22 there were seven cases reported to the ICO. The Board continued its education programme to increase organisational awareness of, and response to, the requirements of the Data Protection Act 2018. The ICO concluded that no further action was necessary in all 12 cases. They made recommendations for improvements to procedures and, in cases involving human error, highlighted the importance of ensuring staff training was effective and up-to-date. - Disclosure of Information to Auditor The Directors who held office at the date of approval of this Directors’ Report confirm that, so far as they are each aware, there is no relevant audit information of which the Board’s auditor is unaware; and each Director has taken all the steps that he/she ought reasonably to have taken as a Director to make himself/herself aware of any relevant audit information and to establish that the Board’s auditor is aware of that information. - Financial instruments Information regarding the Financial Risk Management Objectives and policies of the Board and the exposure of the Board to price risk, credit risk, liquidity risk and cash flow risk is disclosed in Note 19 .",684
Shetland-2022-2023,2022-23,,pdf_cover,2026-02-26T08:04:59+00:00,Unknown,The Statement of Accountable Officer’s Responsibilities,Unknown,45,46,"Under Section 15 of the Public Finance and Accountability (Scotland) Act, 2000, The Principal Accountable Officer of the Scottish Government has appointed me as Accountable Officer of Shetland NHS Board. This designation carries with it responsibility for: - the propriety and regularity of financial transactions under my control; - the economical, efficient and effective use of resources placed at the Board’s disposal; and - safeguarding the assets of the Board. In preparing the Annual Report and Accounts, I am required to comply with the requirements of the Government’s Financial Reporting Manual and in particular to: - observe the accounts direction issued by the Scottish Ministers including the relevant accounting and disclosure requirements and apply suitable accounting policies on a consistent basis; - make judgements and estimates on a reasonable basis; - state whether applicable accounting standards as set out in the FReM have been followed and disclose and explain any material departures; - prepare the financial statements on a going concern basis; I confirm that the Annual Report and Accounts as a whole are fair, balanced and reasonable and take personal responsibility for the Annual Report and Accounts and the judgements required for determining that it is fair, balanced and understandable. I am responsible for ensuring proper records are maintained and that the financial statements are prepared under the principles and in the format directed by Scottish Ministers. To the best of my knowledge and belief, I have properly discharged my responsibilities as Accountable Officer as intimated in the Departmental Accountable Officers letter of November 2019.
Under the National Health Service (Scotland) Act 1978, the Health Board is required to prepare financial statements in accordance with the directions of Scottish Ministers which require that those financial statements give a true and fair view of the state of affairs of the Health Board as at 31 March 2023 and of its operating costs for the year then ended. In preparing these financial statements the Directors are required to: - apply on a consistent basis the accounting policies and standards approved for the NHS Scotland by Scottish Ministers; - make judgements and estimates that are reasonable and prudent; - state, where applicable, accounting standards as set out in the Financial Reporting Manual have not been followed where the effect of the departure is material; and - prepare the financial statements on the going concern basis unless it is inappropriate to presume that the Board will continue to operate. The Health Board Members are responsible for ensuring that proper accounting records are maintained which disclose, with reasonable accuracy at any time, the financial position of the Board and enable them to ensure that the financial statements comply with the National Health Service (Scotland) Act 1978 and the requirements of the Scottish Ministers. They are also responsible for safeguarding the assets of the Board and hence taking reasonable steps for the prevention of fraud and other irregularities. The NHS Board Members confirm they have discharged the above responsibilities during the financial year and in preparing the financial statements.",504
