doc_id,report_year,period_end_date,report_year_source,run_date_utc,part,section_title,subsection_title,page_start,page_end,section_text,word_count
Shetland-2022-2023,2022-23,,pdf_cover,2026-02-26T08:04:59+00:00,Unknown,Unknown,Unknown,1,3,"NHS Shetland Annual Report and Accounts for the Year Ended 31 March 2023
Table of Contents Annual Accounts and Notes for Year Ended 31 March 2023 ..................................... 1 Performance Overview Report ............................................................................... 1 Section 5 Performance Analysis Report ................................................................... 14 Analysis of Financial Performance........................................................................ 16 Analysis of the Clinical Key Performance Statistics .............................................. 20 Analysis of other important Non-Financial Indicators ............................................ 27 Highlights of some other significant events and achievements at NHS Shetland during 2022–23 ..................................................................................................... 33 The Accountability Report ........................................................................................ 39 Corporate Governance Report ............................................................................. 39 The Statement of Accountable Officer’s Responsibilities ...................................... 42 The Statement of Board Members’ Responsibilities ............................................. 43 Governance Statement ......................................................................................... 44 Remuneration and Staff Report ............................................................................ 56 Staff Report .......................................................................................................... 68 Independent auditor’s report to the members of NHS Shetland, the Auditor General for Scotland and the Scottish Parliament ................................................................. 75 Reporting on the audit of the financial statements ................................................ 75 Reporting on regularity of expenditure and income .............................................. 77 Reporting on other requirements .......................................................................... 78 NHS Shetland Statements and Summaries ............................................................. 80 Statement of Consolidated Comprehensive Net Expenditure (SoCNE) for the Year Ended 31 March 2023 .......................................................................................... 80 Consolidated Statement of Financial Position as at 31 March 2023 ..................... 81 Consolidated Statement of Cash Flows (CFS) for the Year Ended 31 March 2023 .............................................................................................................................. 83 Consolidated Statement of Changes in Taxpayers’ Equity for the Year Ended 31 March 2023 ...................................................................................................... 85 Consolidated Statement of Changes in Taxpayers’ Equity—Prior Year, Ended 31 March 2022 ...................................................................................................... 86 Note 1—Accounting Policies ................................................................................ 88 Basis of Consolidation .......................................................................................... 89
Note 2—Notes to the Cash Flow Statement ....................................................... 105 Note 3—Expenditure .......................................................................................... 109 Note 4—Operating Income ................................................................................. 111 Note 5—Segmental Analysis .............................................................................. 112 Note 6—Intangible Assets .................................................................................. 113 Note 7a—Property, Plant and Equipment—Consolidated and Board ................. 114 Note 7b—Assets Held for Sale—Consolidated and Board ................................. 120 Note 7c—Property, Plant and Equipment Disclosures ........................................ 120 Note 8—Inventories and Work in Progress ......................................................... 122 Note 9—Trade and Other Receivables ............................................................... 123 Note 10—Investments ........................................................................................ 126 Note 11—Cash and Cash Equivalents ............................................................... 127 Note 12—Trade and Other Payables.................................................................. 128 Note 13—Provisions ........................................................................................... 130 Note 14—Contingent Liabilities .......................................................................... 134 Note 15—Events after the end of the reporting year .......................................... 134 Note 16—Commitments ..................................................................................... 135 Note 17—Leases Assets .................................................................................... 135 Note 18—Pension Costs .................................................................................... 137 Pension Scheme Declaration ............................................................................. 137 Note 19—Financial Instruments ......................................................................... 140 Note 20—Related Party Transactions ................................................................ 147 Note 21—Consolidation of Subsidiaries and Disclosure of Interest in Associates and Joint Ventures .............................................................................................. 149 Glossary of commonly abbreviated terms and acronyms, as well as local terms, in the report ................................................................................................................ 162 Direction by the Scottish Ministers ......................................................................... 164",427
Shetland-2022-2023,2022-23,,pdf_cover,2026-02-26T08:04:59+00:00,Unknown,Performance Overview Report,Unknown,4,7,"Annual Accounts and Notes for Year Ended 31 March 2023 Performance Overview Report Section 1—Chief Executive’s Statement NHS Shetland rose to the challenges presented in 2022–23 and continued to deliver for the population of Shetland, always adapting to a fundamentally changed environment by seeking opportunities to build on our ongoing commitment to integration. Our need to maintain our overall positive performance has been a challenge, but we have successfully managed to meet the increased demands on NHS services against a backdrop of further Covid-19 outbreaks, repeated cycles of vaccinations for flu and Covid-19, and financial pressures. The shared commitment to our community underpins all that we do and speaks to the values of the NHS and it is fitting that we recognise these as the NHS celebrates its 75th Birthday in 2023. NHS Shetland staff embody the founding principles of the service and I would like to thank them for their hard work and commitment for their achievements and successes not just in 2022–23 but in every one of the 75 years the NHS has been in existence. Without it I am certain Shetland would be a lesser place and the public can be confident of the ongoing commitment to the NHS and the exciting developments we expect to see in the coming year. There have been a number of critical events that have affected the whole of Shetland, including a complete loss of connectivity, unexpected snow, and communities cut off without power. Throughout these events the NHS rallied alongside partners to ensure those needing essential care received it, even if it was medication delivered by a tractor battling through snow. It is important to recognise that Covid-19 has not gone away and following the welcome return of the Shetland tradition of Up Helly Aa, NHS Shetland experienced an increase of staff sickness. This impacted services across our system and once again staff rallied in support of one another to maintain essential services. Throughout the year the Communications team continued in their efforts to ensure the community was informed and advised as required as developments occurred. As a Board we remained committed to maintaining and expanding services using a clear local delivery plan focused on 2022–23 activities but with indicative plans for the following two years. However, NHS Shetland acknowledges that due to the ongoing pressures prevalent in mainland NHS Boards, many Shetland patients still face a significant wait, which we are working with regional and national partners to resolve. The NHS Shetland Dental service has continued to experience high demand and capacity challenges across providers remain a frustration for Shetland residents. NHS Shetland continues to work hard to increase this capacity and is engaging with Scottish Government about how to increase dental workforce and facilities in Shetland, as well as how to address national shortages in the workforce.
in the last year. These will continue until the Shetland based MRI scanner is in situ. The year saw strong performances from departments across NHS Shetland, particularly Adult Mental Health, Children and Adolescent Mental Health Services, and those patients waiting for key diagnostics tests. Whilst our Accident and Emergency four-hour performance against the target dipped marginally this year, all cases are reviewed and extended waits are often down to clinical need, such as waiting for off-island transfer. Services were also re-established or brought on-island for the first time in 2022–23. As mentioned in the “Highlights” portion of these accounts, in summer 2022, the Cardiac Rehabilitation Service, which helps people living with heart disease to regain and maintain a good quality of life, re-started after being suspended during the Covid-19 pandemic. Meanwhile, two Managed Clinical Networks were launched: structured networks that provide opportunities for collaborative working across different healthcare settings, professions, and with wider stakeholders around shared interests and common goals of improving care. Progress has been made in the development of the business case for a replacement of the Gilbert Bain Hospital through 2022–23. However, we acknowledge progress will be slowed by the recent negative performance of the UK economy. In February 2023, Stuart Pearson Wright’s portrait of MRI fundraiser Harriet Middleton was unveiled in its new home at Shetland Museum. The portrait was created for the BBC’s Extraordinary Portraits television programme, which aired in 2021, and will now join the museum’s portrait collection. Harriet and her team of knitters raised over £100k for the MRI Scanner appeal—a phenomenal effort and hugely appreciated by NHS Shetland, the NHS Shetland Endowment Fund which ran the appeal, and the wider community. NHS Shetland has also worked hard in 2022–23 to prioritize staff wellbeing, through existing policy frameworks and other initiatives which have been promoted to all staff in the organisation’s monthly newsletter. These initiatives have ranged from free bike checks to encourage cycling to work, regularly signposting colleagues to national webinars on topics such menopause in the workplace and using greenspace for health and wellbeing, and publicising resources on how staff can cope with the cost of living crisis that hit hard during the year. At the close of 2022–23, NHS Shetland achieved a year-end balanced financial position, as is required of all NHS Boards in Scotland. It’s important to acknowledge this was in part achieved through additional support from the Scottish Government, and the Board is cognisant of the financial challenges that lie ahead. We, like other Boards, needed to engage higher-cost locums over the past year to sustain critical services and are embarking on a multi-year programme of development to utilise new roles and seek to “grow our own”. We do recognise that locum staff are an essential and much-appreciated part of our team. However, we must find ways to move to a more efficient model of care and demonstrate the fine judgment and courage needed to make the difficult decisions this entails.
community within the bounds of funds available, and it is right the public expect us to deliver against this. As I sign off this annual account I must also reflect that this document marks the end of my tenure as Chief Executive at NHS Shetland. As I prepare to pass the baton on to another Chief Executive I would like to offer my thanks to the wonderful staff, dedicated partners and astonishing community. NHS Shetland can be rightly proud of what we have delivered and take confidence in the leaders across the organisation, supported by a strong Executive Management Team who have all risen time and again to meet the multitude of challenges we have faced. Across NHS Shetland there are dedicated staff, supervisors and managers who work tirelessly to provide the care we do. It has been a privilege to lead this committed team with the support of the community and I would like to thank the whole of Shetland for their ongoing support. Michael Dickson, Chief Executive, NHS (National Health Service) Shetland
This overview will give the reader a summary of what an NHS Board does. It will also describe the nature of NHS Shetland, our purpose, the key risks to the achievement of our objectives , and our performance during 2022–23. - NHS Board Purpose Shetland Health Board (“the Board”) was established under the National Health Service (Scotland) Act 1978 with responsibility for providing health care services for the residents of Shetland. NHS Shetland is the operating name of Shetland Health Board. An NHS Board governs its own local health system. The Board is responsible for improving the health of its local population and delivering the healthcare that population requires. The overall purpose of the Board is to provide strategic leadership and direction, and to ensure the efficient, effective and accountable governance of the local NHS system. Specific roles of the Board include: - improving and protecting the health of the local people; - providing an improved health service for local people; - focusing clearly on health outcomes and people’s experience of their local NHS system; - promoting integrated health and community planning by working closely with other local organisations; and - providing a single focus of accountability for the performance of the local NHS system. The work of the Board includes: - strategy development—to develop an Operational Plan for the area; - implementation of the Operational Plan; - resource allocation to address local priorities; and - performance management of the local NHS System. - The nature of NHS Shetland NHS Shetland is domiciled in Scotland and our headquarters are based at: Upper Montfield, 24 Burgh Road, Lerwick, Shetland, ZE1 0LA. NHS Shetland and SIC cover the same area and have the same boundaries and work jointly through our Health and Social Care Partnership . The map in Figure 1 below shows the Shetland Islands, which has a population of around 23,000 people, distributed across 16 of the 100 islands. These islands cover a land mass of 567 square miles. They are surrounded by the North Sea and have a coastline 1,679 miles long.",1479
Shetland-2022-2023,2022-23,,pdf_cover,2026-02-26T08:04:59+00:00,Unknown,Figure 1—Map of Shetland,Unknown,8,8,"Figure 2 below outlines a summary structure of NHS Shetland’s organisational structure. The detailed organisational management structure for NHS Shetland is available on our website, along with the organisational governance structure . Figure 2—Diagram of NHS Shetland Summary Organisational Structure NHS Shetland provides health care services from 19 sites across Shetland, including 10 Health Centres , Breiwick House, and Acute and Specialist Services from the Gilbert Bain Hospital, which is a remote and rural district general hospital in Lerwick. Table 1",81
Shetland-2022-2023,2022-23,,pdf_cover,2026-02-26T08:04:59+00:00,Unknown,Directly Provided Healthcare,Unknown,9,10,"services from partners. - Table 1—NHS Shetland at a glance Directly Provided Healthcare Commissioned Healthcare Services 8 General Practitioner (GP) Practices 2 GP Practices with 3,551 registered with 19,417 registered patients patients Community Healthcare Service 3 Ophthalmic Practices Dental Services from 5 locations 1 Independent Contractor NHS Dental Practice Gilbert Bain Hospital during 2022–2023 5 Pharmacy Contractors Acute and Specialist Services: NHS Grampian— Acute and Maternity - 10,651 in-patient bed-days Services - 2,029 day cases Golden Jubilee —Orthopaedic Services - 34,532 outpatients (6,430 new) NHS Lothian —Acute Services - 100 births NHS Greater Glasgow and Clyde—Acute Services - 8,415 A&E Attendances Child and Adolescent Mental Health NHS Tayside—Specialist Mental Health Service (CAMHS), Breiwick House Services for Adults , and Young People NHS Grampian —Mental Health Services Adult Community Mental Health Service Public Health Tertiary Specialist Services - Summary of NHS Shetland Priority Outcomes in 2022–23 The 2022–23 Annual Delivery Plan was submitted to Scottish Government on 31 July 2022. It was formally approved by the Scottish Government on 22 September 2022. This was NHS Shetland’s strategy to address NHS Scotland overall priorities to recover from Covid-19, stabilize and then renew services. The Board though will continue working in partnership to prioritise preventative work, with community planning partners, to reduce the burden of preventable poor health locally. In respect of living with Covid-19, the local population’s response to Covid-19 vaccination continued to be emphatic—Shetland had the third highest up take rate in the 2022 Covid-19 Winter booster vaccination rates in Scotland. There were 2,195 Covid-19 positive test confirmed. NHS Shetland engaged with the public on two key strategic issues. Public Health conducted a population health survey aiming to understand more about the health and wellbeing of our local communities. Public Health also launched a new website to aid in improve the health and wellbeing of individuals or communities.
series of professional workshops was completed to inform the initial phase in our planning process on a potential healthcare campus to deliver services in the future aligned to our clinical strategy priorities. As highlighted in the performance analysis, re-mobilisation and re-design brought services closer, to minimise the need for travelling off island for 2,321 patients attending out-patients plus a further 267 patients who accessed the visiting mobile MRI scanner . A permanent public funded MRI scanner at the Gilbert Bain Hospital came one step closer when the procurement process for this was completed and contract awarded to preferred supplier in March 2023. The opening date for the service will be in 2024. - Section 3—Risk and Uncertainty The Board approved our new Risk Management Strategy on 26 April 2022 that sets out the principles and approaches to risk management which are to be followed throughout NHS Shetland. Every risk is assigned to a specific Governance Committee. The Board and the Governance Committees have continued to monitor risk throughout 2022–23, with interim report to Board meeting in December 2022 and reviewed the Risk Management Summary Report for 2022–23 and work plan for 2023–24 at our April 2023 Board meeting. - Top Underlying Risks in NHS Shetland 2022–23 Strategic Risk Register The top risks in NHS Shetland 2022–23 Corporate Risk Register, excluding finance, are summarised in Table 2 below. The principal recurring themes amongst these risks are: - Workforce SR08; - Cyber security SR17; and - National Standard SR13: Key Performance Targets ( Table 5 and Performance Analysis Report ). The Strategic Risk Register SR02 , in respect of the Board’s financial performance, is reviewed in Section 4 within the Finance Performance review . Covid-19 pandemic SR16 also remained as a high risk during 2022–23 that did impact local services during the year. The World Health Organisation though has now advised that: “COVID-19 is now an established and on-going health issue which no longer constitutes a public health emergency of international concern”. - Table 2—Top Risks in NHS Shetland 2022–23 Corporate Risk Register Theme Risk Description SR08: Workforce Then there will be a negative impact on the service delivery, - If we fail to existing staff and patients care. Resulting in: attract and recruit - reduction in services delivered; to vacancies or - increase workload of existing staff causing negative impact retain essential on staff well-being which may cause increased absences;",706
