doc_id,report_year,period_end_date,report_year_source,run_date_utc,part,section_title,subsection_title,page_start,page_end,section_text,word_count
Shetland-2022-2023,2022-23,,pdf_cover,2026-02-26T08:04:59+00:00,Unknown,The Trade Union (Facility Time Publication Requirements) Regulations 2017 came,Unknown,75,77,"- Exit packages (Audited Information) None in 2022–23 or prior year. - The Trade Union (Facility Time Publication Requirements) Regulations 2017 (Unaudited Information) The Trade Union (Facility Time Publication Requirements) Regulations 2017 came into force on 1 April 2017. The regulations place a legislative requirement on relevant public sector employers to collate and publish, on an annual basis, a range of data on the amount and cost of facility time within their organisation. The data is required to be published on a website maintained by or on behalf of the employer before 31 July each year. - Relevant Union Officials Number of employees who were Full time equivalent employee relevant union officials during the number year 1 April 2022 to 31 March 2023 14 1 - Percentage of time spent of facility time Percentage of time Number of representatives 1–50 % 14 - Percentage of pay bill spent on facility time £000s Total cost of facility time 5 Total pay bill 47,643 Percentage of the total pay bill spent on facility time 0.01% - Paid trade union activities Time spent on paid trade union activities as a 2% percentage of total paid facility time hours - Staff Turnover Percentage (Unaudited Information) Period Staff turnover percentage 2022–23 19% 2021–22 8%
The significant increase in 2022–23 was due to the number of Covid-19 temporary contracts ending during the year. Staff turnover is calculated as follows and has remained reasonably consistent year- on-year: - Total number of leavers in year/ Average number of staff in year (headcount) x 100 - Off-Payroll Engagement (Unaudited Information) The use of locum agency medical and nursing staff throughout the year is disclosed in the staff costs table above. These staff are either: 1. Remunerated through NHS Shetland’s payroll when deemed ‘employed for tax purposes’ or under IR35 legislation; 2. Remunerated through a third-party payroll service provided by Liaison Financial Services Limited; or 3. Remunerated through the payroll of the Agency provider. - Staff Survey (Unaudited Information) NHS Shetland participates in iMatter , NHS Scotland’s Staff Experience continuous improvement tool. iMatter is designed to help individuals, teams, Directorates, and Boards understand and improve staff experience. This is a term used to describe the extent to which employees feel motivated, supported, and cared for at work. It is reflected in levels of engagement, motivation and productivity. The process is based on a staff engagement questionnaire which all staff are asked to respond to, which then generates a Team Report containing the results. The Line Manager discusses the report with the team and agree what the team's main strength is along with up to three improvement actions that are specific for them for the months ahead. This improvement plan is captured on a team ‘Storyboard’ which the team then uses to monitor progress prior to the next iMatter run. The process is completed annually. - Expenditure on Consultancy (Unaudited Information) There was one consultancy firm engaged during 2022–23. CGI was appointed through Crown Commercial Service contract RM6100, at a cost of £73k, to support the Board in developing a financial sustainability plan for 2023–24 and beyond. - Other Employee Matters (Unaudited Information) The Board has policies and procedures in place for other employee matters such as other diversity issues and equal treatment in employment and occupation; employment issues including employee consultation and/or participation; health and safety at work; trade union relationships; and human capital management such as career management and employability, and pay policy. Policies include ‘Eliminating
Bullying and Harassment’, ‘Work Life Balance’ and ‘Health and Safety’. You can find the relevant documentation on NHS Shetland’s external website . - Parliamentary Accountability Report (Audited Information) There are no disclosures applicable, as NHS Shetland is not aware of any attempted fraud or irregular activities during 2022–23 or prior year that incurred a loss and only one payment was made within our delegated limits in respect of a medical negligence claim for £0.3m. The Board as required has provided for CNORIS (Clinical Negligence and Other Risks Indemnity Scheme) claims notified to it and which will be settled at a future date; details of these provisions can be found in Note 13 . Approval and signing of the Accountability Report Signed by Michael Dickson, Chief Executive as Accountable Officer 23 June 2023",709
Shetland-2022-2023,2022-23,,pdf_cover,2026-02-26T08:04:59+00:00,Unknown,The Trade Union (Facility Time Publication Requirements) Regulations 2017 came,I have audited the financial statements in the annual report and accounts of NHS,78,78,"Independent auditor’s report to the members of NHS Shetland, the Auditor General for Scotland and the Scottish Parliament Reporting on the audit of the financial statements Opinion on financial statements I have audited the financial statements in the annual report and accounts of NHS Shetland and its group for the year ended 31 March 2023 under the National Health Service (Scotland) Act 1978. The financial statements comprise the Statement of Consolidated Comprehensive Net Expenditure, the Consolidated Statement of Financial Position, the Consolidated Statement of Cash Flows, the Consolidated Statement of Changes in Taxpayers’ Equity and notes to the financial statements, including significant accounting policies. The financial reporting framework that has been applied in their preparation is applicable law and UK adopted international accounting standards, as interpreted and adapted by the 2022/23 Government Financial Reporting Manual (the 2022/23 FReM). In my opinion the accompanying financial statements: - give a true and fair view of the state of the affairs of the board and its group as at 31 March 2023 and of the net expenditure for the year then ended; - have been properly prepared in accordance with UK adopted international accounting standards, as interpreted and adapted by the 2022/23 FReM; and - have been prepared in accordance with the requirements of the National Health Service (Scotland) Act 1978 and directions made thereunder by the Scottish Ministers. Basis for opinion I conducted my audit in accordance with applicable law and International Standards on Auditing (UK) (ISAs (UK)), as required by the Code of Audit Practice approved by the Auditor General for Scotland. My responsibilities under those standards are further described in the auditor’s responsibilities for the audit of the financial statements section of my report. I was appointed by the Auditor General on 2 December 2022. My period of appointment is five years, covering 2022–23 to 2026/27. I am independent of the board and its group in accordance with the ethical requirements that are relevant to my audit of the financial statements in the UK including the Financial Reporting Council’s Ethical Standard, and I have fulfilled my other ethical responsibilities in accordance with these requirements. Non-audit services prohibited by the Ethical Standard were not provided to the board. I believe that the audit evidence I have obtained is sufficient and appropriate to provide a basis for my opinion.",387
Shetland-2022-2023,2022-23,,pdf_cover,2026-02-26T08:04:59+00:00,Unknown,The Trade Union (Facility Time Publication Requirements) Regulations 2017 came,I have concluded that the use of the going concern basis of accounting in the,79,80,"I have concluded that the use of the going concern basis of accounting in the preparation of the financial statements is appropriate. Based on the work I have performed, I have not identified any material uncertainties relating to events or conditions that, individually or collectively, may cast significant doubt on the ability of the board and its group to continue to adopt the going concern basis of accounting for a period of at least twelve months from when the financial statements are authorised for issue. These conclusions are not intended to, nor do they, provide assurance on the current or future financial sustainability of the board and its group. However, I report on the board’s arrangements for financial sustainability in a separate Annual Audit Report available from the Audit Scotland website . Risk of material misstatement I report in my Annual Audit Report the most significant assessed risks of material misstatement that I identified and my judgement thereon. Responsibil i ties of the Accountable Officer for the financial statements As explained more fully in the Statement of the Accountable Officer’s Responsibilities, the Accountable Officer is responsible for the preparation of financial statements that give a true and fair view in accordance with the financial reporting framework, and for such internal control as the Accountable Officer determines is necessary to enable the preparation of financial statements that are free from material misstatement, whether due to fraud or error. In preparing the financial statements, the Accountable Officer is responsible for assessing the ability of the board and its group to continue as a going concern, disclosing, as applicable, matters related to going concern and using the going concern basis of accounting unless there is an intention to discontinue the board’s operations. Auditor’s responsibilities for the audit of the financial statements My objectives are to obtain reasonable assurance about whether the financial statements as a whole are free from material misstatement, whether due to fraud or error, and to issue an auditor’s report that includes my opinion. Reasonable assurance is a high level of assurance, but is not a guarantee that an audit conducted in accordance with ISAs (UK) will always detect a material misstatement when it exists. Misstatements can arise from fraud or error and are considered material if, individually or in the aggregate, they could reasonably be expected to influence the decisions of users taken on the basis of these financial statements. Irregularities, including fraud, are instances of non-compliance with laws and regulations. I design procedures in line with my responsibilities outlined above to detect material misstatements in respect of irregularities, including fraud. Procedures include:
Health Service (Scotland) Act 1978 and directions made thereunder by the Scottish Ministers are significant in the context of the board - inquiring of the Accountable Officer as to other laws or regulations that may be expected to have a fundamental effect on the operations of the board; - inquiring of the Accountable Officer concerning the board’s policies and procedures regarding compliance with the applicable legal and regulatory framework; - discussions among my audit team on the susceptibility of the financial statements to material misstatement, including how fraud might occur; and - considering whether the audit team collectively has the appropriate competence and capabilities to identify or recognise non-compliance with laws and regulations. The extent to which my procedures are capable of detecting irregularities, including fraud, is affected by the inherent difficulty in detecting irregularities, the effectiveness of the board’s controls, and the nature, timing and extent of the audit procedures performed. Irregularities that result from fraud are inherently more difficult to detect than irregularities that result from error as fraud may involve collusion, intentional omissions, misrepresentations, or the override of internal control. The capability of the audit to detect fraud and other irregularities depends on factors such as the skilfulness of the perpetrator, the frequency and extent of manipulation, the degree of collusion involved, the relative size of individual amounts manipulated, and the seniority of those individuals involved. A further description of the auditor’s responsibilities for the audit of the financial statements is located on the Financial Reporting Council's website . This description forms part of my auditor’s report. Reporting on regularity of expenditure and income Opinion on regularity In my opinion in all material respects the expenditure and income in the financial statements were incurred or applied in accordance with any applicable enactments and guidance issued by the Scottish Ministers. Responsibilities for regularity The Accountable Officer is responsible for ensuring the regularity of expenditure and income. In addition to my responsibilities in respect of irregularities explained in the audit of the financial statements section of my report, I am responsible for expressing an opinion on the regularity of expenditure and income in accordance with the Public Finance and Accountability (Scotland) Act 2000.",798
Shetland-2022-2023,2022-23,,pdf_cover,2026-02-26T08:04:59+00:00,Unknown,the Remuneration and Staff Report,I have audited the parts of the Remuneration and Staff Report described as audited.,81,81,"Opinion prescribed by the Auditor General for Scotland on the audited parts of the Remuneration and Staff Report I have audited the parts of the Remuneration and Staff Report described as audited. In my opinion, the audited parts of the Remuneration and Staff Report have been properly prepared in accordance with the National Health Service (Scotland) Act 1978 and directions made thereunder by the Scottish Ministers. Other information The Accountable Officer is responsible for the other information in the annual report and accounts. The other information comprises the Performance Overview Report, Performance Analysis Report and the Accountability Report excluding the audited parts of the Remuneration and Staff Report. My responsibility is to read all the other information and, in doing so, consider whether the other information is materially inconsistent with the financial statements or my knowledge obtained in the course of the audit or otherwise appears to be materially misstated. If I identify such material inconsistencies or apparent material misstatements, I am required to determine whether this gives rise to a material misstatement in the financial statements themselves. If, based on the work I have performed, I conclude that there is a material misstatement of this other information, I am required to report that fact. I have nothing to report in this regard. My opinion on the financial statements does not cover the other information and I do not express any form of assurance conclusion thereon except on the Performance Overview Report, Performance Analysis Report and Governance Statement to the extent explicitly stated in the following opinions prescribed by the Auditor General for Scotland. Opinions prescribed by the Auditor General for Scotland on the Performance Overview Report, Performance Analysis Report and Governance Statement In my opinion, based on the work undertaken in the course of the audit: - the information given in the Performance Overview Report and Performance Analysis Report for the financial year for which the financial statements are prepared is consistent with the financial statements and that report has been prepared in accordance with the National Health Service (Scotland) Act 1978 and directions made thereunder by the Scottish Ministers; and - the information given in the Governance Statement for the financial year for which the financial statements are prepared is consistent with the financial statements and that report has been prepared in accordance with the National Health Service (Scotland) Act 1978 and directions made thereunder by the Scottish Ministers.",401
Shetland-2022-2023,2022-23,,pdf_cover,2026-02-26T08:04:59+00:00,Unknown,the Remuneration and Staff Report,"I am required by the Auditor General for Scotland to report to you if, in my opinion:",82,82,"I am required by the Auditor General for Scotland to report to you if, in my opinion: - adequate accounting records have not been kept; or - the financial statements and the audited parts of the Remuneration and Staff Report are not in agreement with the accounting records; or - I have not received all the information and explanations I require for my audit; or - there has been a failure to achieve a prescribed financial objective. I have nothing to report in respect of these matters. Conclusions on wider scope responsibilities In addition to my responsibilities for the annual report and accounts, my conclusions on the wider scope responsibilities specified in the Code of Audit Practice are set out in my Annual Audit Report. Use of my report This report is made solely to the parties to whom it is addressed in accordance with the Public Finance and Accountability (Scotland) Act 2000 and for no other purpose. In accordance with paragraph 108 of the Code of Audit Practice, I do not undertake to have responsibilities to members or officers, in their individual capacities, or to third parties. Brian Howarth Audit Scotland 8 Nelson Mandela Place Glasgow G2 1BT 23 June 2023",202
Shetland-2022-2023,2022-23,,pdf_cover,2026-02-26T08:04:59+00:00,Unknown,Statement of Consolidated Comprehensive Net Expenditure,Unknown,83,83,"NHS Shetland Statements and Summaries Statement of Consolidated Comprehensive Net Expenditure (SoCNE) for the Year Ended 31 March 2023 2022 2023 £000 Note £000 48,827 Staff costs 3a 49,996 Other operating expenditure 3b 3,321 Independent Primary Care Services 3,442 9,683 Drugs and medical supplies 9,547 66,740 Other health care expenditure 62,427 128,571 Gross expenditure for the year 125,412 (41,390) Less: operating income 4 (42,363) (1,073) Associates and joint ventures 1,386 accounted for on an equity basis 86,108 Net expenditure for the year 84,435 - Other Comprehensive Net Expenditure (will not be reclassified subsequently to the SoCNE) 2022 2023 £000 £000 16 Net loss on revaluation of investments 42 (1,188) Net gain on revaluation of property (1,764) (1,172) Other comprehensive expenditure (1,722) 84,936 Comprehensive net expenditure 82,713 The Notes to the Accounts, numbered 1 to 21, form an integral part of these Accounts.",142
Shetland-2022-2023,2022-23,,pdf_cover,2026-02-26T08:04:59+00:00,Unknown,Consolidated Statement of Financial Position as at 31 March 2023,Unknown,84,85,"Consolidated Statement of Financial Position as at 31 March 2023 Consolidated Board Consolidated Board 2022 2022 2023 2023 £000 £000 Note £000 £000 33,990 33,990 Property, plant and 7a 35,306 35,306 equipment 0 0 Right of Use assets 17a 1,428 1,428 Financial assets: 1,480 0 Available for sale 10 1,437 0 financial assets 2,158 0 Investments in 772 0 associates and joint ventures 37,628 33,990 Total non-current 38,943 36,734 assets Current Assets: 528 528 Inventories 8 641 641 Financial assets: 2,385 2,372 Trade and other 9 5,563 5,553 receivables 1,806 190 Cash and cash 11 1,759 176 equivalents 0 0 Asset held for sale 7b 150 150 4,719 3,090 Total current assets 8,113 6,520 42,347 37,080 Total assets 47,056 43,254 Financial liabilities: Provisions (618) (618) 13a (562) (562) (16,518) (16,483) Trade and other 12 (12,881) (12,869) payables
Consolidated Board Consolidated Board 2022 2022 2023 2023 £000 £000 Note £000 £000 (17,136) (17,101) Total current (13,443) (13,431) liabilities 25,211 19,979 Non-current assets 33,613 29,823 plus / less net current assets / liabilities Non-current liabilities (1,429) (1,429) Provisions 13a (1,539) (1,539) 0 0 Trade and other 12 (1,277) (1,277) payables (1,429) (1,429) Total non-current (2,816) (2,816) liabilities 23,782 18,550 Assets less 30,797 27,007 liabilities Taxpayers' Equity 5,874 5,874 General fund 13,002 13,002 12,676 12,676 Revaluation reserve 14,005 14,005 2,158 0 Other reserves - 772 0 associates and joint ventures 3,074 0 Fund held on Trust 3,018 0 23,782 18,550 Total taxpayers' 30,797 27,007 equity The Notes to the Accounts, numbered 1 to 21, form an integral part of these Accounts. The financial statements on pages 80–87 were approved by the Board on 22 June 2023 and signed on their behalf by:",279
Shetland-2022-2023,2022-23,,pdf_cover,2026-02-26T08:04:59+00:00,Unknown,31 March 2023,Unknown,86,87,"Consolidated Statement of Cash Flows (CFS) for the Year Ended 31 March 2023 2022 2023 2023 £000 Note £000 £000 Cash flows from operating activities (86,108) SoCTE (84,435) (Summary of Resource Net expenditure Out-turn) 760 Adjustments for non-cash transactions 2b 4,006 32 Investment income 39 2,770 Movements in working capital 2b (6,860) (82,546) Net cash outflow from operating 21c (87,250) activities Cash flows from investing activities (3,205) Purchase of property, plant and (1,680) equipment (274) Investment additions 10 (134) 275 Receipts from sale of investments 97 (32) Interest received (39) (3,236) Net cash outflow used in investing 21c (1,756) activities Cash flows from financing activities 85,965 Funding SoCTE 89,728 68 Movement in general fund working SoCTE (14) capital 86,033 Cash drawn down 89,714 0 IFRS 16 – 2022–23 cash lease (755) payment 86,033 Net Financing 21c 88,959
2022 2023 2023 £000 Note £000 £000 251 Net Increase in cash and cash (47) equivalents in the year 1,555 Cash and cash equivalents at the 1,806 beginning of the year 1,806 Cash and cash equivalents at the 1,759 end of the year Reconciliation of net cash flow to movement in net debt/cash 251 Increase in cash in year 11 (47) 1,555 Net debt / cash at 1 April 1,806 1,806 Net debt / cash at 31 March 1,759 The Notes to the Accounts, numbered 1 to 21, form an integral part of these Accounts.",232
Shetland-2022-2023,2022-23,,pdf_cover,2026-02-26T08:04:59+00:00,Unknown,Consolidated Statement of Changes in Taxpayers’ Equity for the,Unknown,88,90,"Consolidated Statement of Changes in Taxpayers’ Equity for the Year Ended 31 March 2023 General Revaluation Other Funds Total Fund Reserve reserve - Held Reserves associates on and joint Trust ventures Note £000 £000 £000 £000 £000 Balance at 5,874 12,676 2,158 3,074 23,782 1 April 2022 Changes in taxpayers' equity for 2022–23 Net gain on 0 1,764 0 0 1,764 revaluation of property Net loss on 0 0 0 (42) (42) revaluation of investments Impairment of 0 (3) 0 0 (3) equipment Impairment 0 3 0 0 3 taken to operating costs Transfer 435 (435) 0 0 0 between reserves Net operating CFS (83,035) 0 (1,386) (14) (84,435) cost for the year Total (82,600) 1,329 (1,386) (56) (82,713) recognised income and expense for 2022–23 Funding: Note
General Revaluation Other Funds Total Fund Reserve reserve - Held Reserves associates on and joint Trust ventures Note £000 £000 £000 £000 £000 Drawn down CFS 89,714 0 0 0 89,714 Movement in CFS 14 0 0 0 14 General Fund creditor Balance at SoFP 13,002 14,005 772 3,018 30,797 31 March 2023 Consolidated Statement of Changes in Taxpayers’ Equity—Prior Year, Ended 31 March 2022 General Revaluation Other Funds Total Fund Reserve reserve - Held Reserves associates on and joint Trust ventures Note £000 £000 £000 £000 £000 Balance at 6,860 11,881 1,085 2,927 22,753 1 April 2021 Changes in taxpayers' equity for 2021–22 Net gain on 0 1,188 0 0 1,188 revaluation of property Net loss on 0 0 0 (16) (16) revaluation of investments Impairment of 0 (138) 0 0 (138) equipment
General Revaluation Other Funds Total Fund Reserve reserve - Held Reserves associates on and joint Trust ventures Note £000 £000 £000 £000 £000 Impairment 0 138 0 0 138 taken to operating costs Transfer 393 (393) 0 0 0 between reserves Net operating CFS (87,344) 0 1,073 163 (86,108) cost for the year Total (86,951) 795 1,073 147 (84,936) recognised income and expense for 2021–22 Funding: Note Drawn down CFS 86,033 0 0 0 86,033 Movement in CFS (68) 0 0 0 (68) General Fund creditor Balance at SoFP 5,874 12,676 2,158 3,074 23,782 31 March 2022 The Notes to the Accounts, numbered 1 to 21, form an integral part of these Accounts.",374
