doc_id,report_year,period_end_date,report_year_source,run_date_utc,part,section_title,subsection_title,page_start,page_end,section_text,word_count
Grampian-2020-2021,2020-2021,,filename,2026-02-25T18:47:36+00:00,Unknown,ACCOUNTABILITY REPORT (cont),Unknown,66,66,"The tables on pages 64-66 in the Remuneration and Staff Report and the tables notes 2, 4 and 10 on pages 68, 69 and 71 have been subject to audit by the Board’s External Auditor. The other sections in the Remuneration and Staff Report are reviewed by the External Auditor to ensure they are consistent with the financial statements. i) THE REMUNERATION REPORT Remuneration of Executive and Non-Executive Members The total remuneration disclosed on pages 65 to 66 includes all amounts paid or payable by the Board in each financial year and a separate assessment of the estimated increase in the cumulative pension benefit that will be payable following retirement. Board Members’ Contracts of Employment The Executive Board members of Grampian Health Board are employed on permanent contracts of employment which require a minimum of three months notice. The Non- Executive members are ministerial appointments on contracts of between two and four years. The terms and conditions of Executive and Senior Management Cohort and Non- Executive Members including annual remuneration, and any entitlement to severance pay, is determined by the Scottish Government under Ministerial Direction and in accordance with PCS(ESM) 2020/1. On 27 March 2020, Scottish Government issued a variation order, effective until further notice, to advise if deemed helpful for the provision of clinical or other services necessary to the continued operation of NHS Scotland, that Executive and Senior Managers up to Director Level would be able to be offered overtime payments in line with para 3.1 of the Agenda for Change Handbook, during the COVID-19 outbreak. For staff at Director level and above this was at the discretion of the local Remuneration Committee. Assessment of Performance The performance assessment process for the Executive and Senior Management Cohort is in accordance with PCS (ESM) 2020/1. Performance management and appraisal arrangements follow the nationally prescribed format and are directly linked to the improved performance of Grampian Health Board in the delivery of its objectives. Written evidence relating to the performance ratings for Executive members following review by the Chief Executive and Chair is made available to the Remuneration Committee for approval. For the Chief Executive, the process is undertaken by the Chair. For Non-Executive members, the process is also undertaken by the Chair and written evidence is submitted to the Cabinet Secretary for Health and Wellbeing. The progression of the Executive and Senior Management Cohort through the pay range is subject to, as a minimum, the fully acceptable performance of the individual. A National Performance Management Committee as detailed in PCS (ESM) 2020/1 ensures, on behalf of the Scottish Government, the effective and consistent application of pay and performance management arrangements for NHS Scotland Executives subject to Ministerial Direction.",449
Grampian-2020-2021,2020-2021,,filename,2026-02-25T18:47:36+00:00,Unknown,ACCOUNTABILITY REPORT (cont),Unknown,67,67,"Remuneration Committee The Remuneration Committee ensures that arrangements are in place to comply with NHS Grampian policy and Scottish Government direction and guidance for determining the employment, remuneration and terms and conditions of employment and for approving the personal objectives of all Executive Directors and Senior Managers. Further information including membership of the Remuneration Committee, is included in the Governance Statement on page 42 above. Relationship between the highest paid Director and the workforce median remuneration The following table compares the banded remuneration of the highest paid Director against the median salary for the workforce in each year. The remuneration figures used for this calculation represent the annualised whole time equivalent salary figures. 2020-21 2020-21 2019-20 Range of Staff Remuneration (£000’s) 19-374 18-461 Highest Earning Director’s Total 205-210 200–205 Remuneration (£000s) Median Total Remuneration (£) 32,145 31,384 Ratio 6.49 6.52 All staff earning below £80,000 received a 2.95% cost of living uplift in pay during 2020/21 and staff earning above that amount received a flat increase of £1,600. In addition all staff received an additional 1% backdated to 1 December 2020 as a payment to account in relation to the 2021/22 pay settlement and a one off supplementary COVID-19 payment of £500 at the direction of the Scottish Government. This is the main reason for the increase in median pay. The ratio of 6.49 has reduced slightly over the prior year. This is due to the increase in the median pay as explained above.",244
Grampian-2020-2021,2020-2021,,filename,2026-02-25T18:47:36+00:00,Unknown,Sub Total,A SENIOR EMPLOYEES,68,68,"NHS GRAMPIAN REMUNERATION REPORT FOR THE YEAR ENDED 31 MARCH 2021 Publication of pension benefits is required in accordance with the Financial Reporting Manual (FReM) and the Companies Act (2006). This calculation aims to bring public bodies in line with other industries in disclosing an assessed cumulative pension benefit for a standard 20 year period, which is the estimated life span following retirement. The other figures shown as part of the single total figure of remuneration relate to actual earnings payable in 2020/21. Sub Total Value of Pension Total accrued Total accrued lump Performance Total Real increase in Real increase in earnings Benefits (to be pension at sum at pensionable Cash Equivalent Cash Equivalent Salary (bands of Related Bonus Remuneration pension at lump sum at Real increase in Notes paid in Benefits in Kind paid over 20 pensionable age at age at 31 March Transfer Value Transfer Value £5,000) (bands of (bands of pensionable age pensionable age CETV in year (see 2020/21 years following 31 March 2021 2021 (bands of (CETV) at 31/3/20 (CETV) at 31/3/21 £5,000) £5,000) (bands of £2,500) (bands of £2,500) below (bands of retirement) (bands of £5,000) £5,000) ) £5,000) £000 £000 £000 £000 £000 £000 £000 £000 £000 £000 £000 £000 £000 Remuneration of: Executive Members Professor Amanda Croft b 110-115 0 0.0 110-115 146 255-260 55-60 5-7.5 175-180 20-22.5 1,110 1,291 159 Professor Nick Fluck 205-210 0 0.0 205-210 0 205-210 55-60 0 175-180 0 1,301 1,331 30 Mr Alan Gray 140-145 0 6.0 150-155 39 185-190 25-30 2.5-5 0 0 372 421 49 Professor Caroline Hiscox a/i 130-135 0 0.0 130-135 93 225-230 30-35 5-7.5 60-65 7.5-10 431 516 86 Mrs Susan Webb c/i 155-160 0 0.0 155-160 45 200-205 50-55 2.5-5 110-115 2.5-5 894 968 74 Non Executive Members Chair - Professor Lynda Lynch 40-45 0 0 40-45 N/A 40-45 N/A N/A N/A N/A N/A N/A N/A Vice Chair - Mrs Rhona Atkinson f 25-30 0 0 25-30 N/A 25-30 N/A N/A N/A N/A N/A N/A N/A Mrs Amy Anderson f 15-20 0 0 15-20 N/A 15-20 N/A N/A N/A N/A N/A N/A N/A Professor Siladitya Bhattacharya 5-10 0 0 5-10 N/A 5-10 N/A N/A N/A N/A N/A N/A N/A Ms Kim Cruttenden d 95-100 0 0 95-100 31 125-130 20-25 0-2.5 35-40 0-2.5 287 317 30 Councillor Isobel Davidson 5-10 0 0 5-10 N/A 5-10 N/A N/A N/A N/A N/A N/A N/A Mr Albert Donald 5-10 0 0 5-10 N/A 5-10 N/A N/A N/A N/A N/A N/A N/A Ms Joyce Duncan f 15-20 0 0 15-20 N/A 15-20 N/A N/A N/A N/A N/A N/A N/A Mrs Luan Grugeon f 25-30 0 0 25-30 N/A 25-30 N/A N/A N/A N/A N/A N/A N/A Miss Rachael Little e/f 60-65 0 0 60-65 19 80-85 10-15 0-2.5 0 0 129 143 14 Councillor Douglas Lumsden (to 19 March 2021) 5-10 0 0 5-10 N/A 5-10 N/A N/A N/A N/A N/A N/A N/A Councillor Shona Morrison 5-10 0 0 5-10 N/A 5-10 N/A N/A N/A N/A N/A N/A N/A Mr Jonathan Passmore f 15-20 0 0 15-20 N/A 15-20 N/A N/A N/A N/A N/A N/A N/A Mr Sandy Riddell f 15-20 0 0 15-20 N/A 15-20 N/A N/A N/A N/A N/A N/A N/A Mr Dennis Robertson f 20-25 0 0 20-25 N/A 20-25 N/A N/A N/A N/A N/A N/A N/A Mr John Tomlinson f 15-20 0 0 15-20 N/A 15-20 N/A N/A N/A N/A N/A N/A N/A SENIOR EMPLOYEES Dr June Brown (from 2 November 2020) g 35-40 0 0 35-40 39 75-80 25-30 2.5-5 65-70 7.5-10 387 476 90 Dr Adam Coldwells i 135-140 0 0.2 135-140 46 185-190 50-55 2.5-5 110-115 0-2.5 875 939 64 Mr Tom Power (from 1 July 2020) h 70-75 0 0 70-75 35 105-110 10-15 2.5-5 134 171 37 NOTES : a) Professor Caroline Hiscox was appointed as Chief Executive and accountable officer for NHS Grampian on 2 November 2020. Prior to this, Professor Hiscox was the Executive Nurse Director. b) Professor Croft was Chief Executive and accountable officer of NHS Grampian until 1 November 2020 and formally retired from NHS Grampian service on 31 December 2020. Her full year equivalent salary was in the range £145k-£150k c) Mrs Susan Webb was Director of Public Health for both NHS Grampian and NHS Shetland. Both roles were performed as an employee of NHS Grampian and 17% of Mrs Webb's salary was recharged to NHS Shetland under a Service Level Agreement between the two Boards.The remuneration disclosed above represents the 83% of cost met by NHS Grampian during 2020/21. The disclosed pension figures relate to service accrued in both NHS Grampian and NHS Shetland roles and includes additional years purchased at her own personal cost. d) The remuneration disclosure for Ms Kim Cruttenden includes total earnings both in her role as a Senior Clinical Pharmacist with NHS Grampian and for her additional duties as an NHS Board member. e) Miss Rachael Little worked in a full time capacity as Employee Director of NHS Grampian. f) Non Executive Board Members who were members of the Integration Joint Boards and who assumed additional responsibilities during the year received additional remuneration. g) Dr June Brown was appointed Interim Nurse Director with effect from 2 November 2020. Her full year equivalent salary was in the range £95k-£100k h) Mr Tom Power was appointed as Director of People and Culture on 1 July 2020. His full year equivalent salary was in the range £90k-£95k i) Executive Board members and Senior Managers received overtime during the COVID pandemic in line with Scottish Government Direction, where this was deemed helpful for the provision of clinical or other services necessary to the continued operation of NHS Scotland and subject to the scrutiny and agreement of the NHS Grampian Remuneration Committee. 65",963
Grampian-2020-2021,2020-2021,,filename,2026-02-25T18:47:36+00:00,Unknown,Sub Total,A SENIOR EMPLOYEES,69,69,"NHS GRAMPIAN REMUNERATION REPORT FOR THE YEAR ENDED 31 MARCH 2020 Publication of pension benefits is required in accordance with the Financial Reporting Manual (FReM) and the Companies Act (2006). This calculation aims to bring public bodies in line with other industries in disclosing an assessed cumulative pension benefit for a standard 20 year period, which is the estimated life span following retirement. The other figures shown as part of the single total figure of remuneration relate to actual earnings payable in 2019/20. Sub Total Value of Pension Total accrued Performance Real increase in Total accrued lump Real increase in earnings Benefits (to be Total pension at Cash Equivalent Cash Equivalent Salary (bands of Related Bonus pension at sum at pensionable lump sum at Real increase in paid in Benefits in Kind paid over 20 Remuneration pensionable age at Transfer Value Transfer Value £5,000) (bands of pensionable age age at 31 March 2020 pensionable age CETV in year Notes 2019/20 years following (bands of £5,000) 31 March 2020 (CETV) at 31/3/19 (CETV) at 31/3/20 £5,000) (bands of £2,500) (bands of £5,000) (bands of £2,500) (see (bands of retirement) (bands of £5,000) below) £5,000) £000 £000 £000 £000 £000 £000 £000 £000 £000 £000 £000 £000 £000 Remuneration of: Executive Members Professor Amanda Croft a 150-155 0 0.0 150-155 115 265-270 50-55 5-7.5 150-155 15-17.5 963 1,105 128 Professor Nick Fluck 200-205 0 0.0 200-205 0 200-205 55-60 0 175-180 0 1,265 1,294 29 Mr Alan Gray b 125-130 0 5.4 130-135 36 165-170 25-30 2.5-5 0 0 321 370 49 Dr Caroline Hiscox c 100-105 0 0.0 100-105 37 135-140 25-30 0-2.5 50-55 0-2.5 390 429 39 Mrs Susan Webb d 80-85 0 0.0 80-85 36 115-120 45-50 2.5-5 105-110 0-2.5 826 890 64 Non Executive Members Chair - Professor Lynda Lynch 35-40 0 0 35-40 N/A 35-40 N/A N/A N/A N/A N/A N/A N/A Vice Chair - Mrs Rhona Atkinson g 30-35 0 0 30-35 N/A 30-35 N/A N/A N/A N/A N/A N/A N/A Mrs Amy Anderson g 15-20 0 0 15-20 N/A 15-20 N/A N/A N/A N/A N/A N/A N/A Professor Siladitya Bhattacharya (from 1 July 2019) h 5-10 0 0 5-10 N/A 5-10 N/A N/A N/A N/A N/A N/A N/A Ms Kim Cruttenden e 90-95 0 0 90-95 23 110-115 15-20 0-2.5 35-40 0-2.5 262 285 23 Councillor Isobel Davidson 5-10 0 0 5-10 N/A 5-10 N/A N/A N/A N/A N/A N/A N/A Mr Albert Donald (from 1 February 2020) i 0-5 0 0 0-5 N/A 0-5 N/A N/A N/A N/A N/A N/A N/A Ms Joyce Duncan g 15-20 0 0 15-20 N/A 15-20 N/A N/A N/A N/A N/A N/A N/A Mrs Luan Grugeon g 25-30 0 0 25-30 N/A 25-30 N/A N/A N/A N/A N/A N/A N/A Miss Rachael Little f/g 60-65 0 0 60-65 16 75-80 10-15 0-2.5 0 0 117 128 11 Councillor Douglas Lumsden 5-10 0 0 5-10 N/A 5-10 N/A N/A N/A N/A N/A N/A N/A Councillor Shona Morrison 5-10 0 0 5-10 N/A 5-10 N/A N/A N/A N/A N/A N/A N/A Mr Jonathan Passmore g 25-30 0 0 25-30 N/A 25-30 N/A N/A N/A N/A N/A N/A N/A Mr Sandy Riddell g 15-20 0 0 15-20 N/A 15-20 N/A N/A N/A N/A N/A N/A N/A Mr Dennis Robertson g 15-20 0 0 15-20 N/A 15-20 N/A N/A N/A N/A N/A N/A N/A Mr John Tomlinson g 15-20 0 0 15-20 N/A 15-20 N/A N/A N/A N/A N/A N/A N/A SENIOR EMPLOYEES Dr Adam Coldwells (from 28 October 2020) j 55-60 0 0 55-60 19 75-80 45-50 2.5-5 105-110 0-2.5 810 871 61 NOTES : a) Professor Amanda Croft was the accountable officer for NHS Grampian throughout 2019/20. First as Interim Chief Executive and then following her permanent appointment as Chief Executive from 12th April 2019. b) During the period 1 April 2019 to 30 June 2019 Mr Alan Gray was Director of Finance for both NHS Grampian and NHS Tayside. Both roles were performed as an employee of NHS Grampian and 45% of Mr Grays salary for the period 1 April 2019 to 30 June 2019 was recharged to NHS Tayside.The remuneration disclosed above represents the 55% of cost met by NHS Grampian for the period 1 April 2019 to 30 June 2019 and 100% of cost from 1 July 2019 when Mr Gray reverted to a full time role as Director of Finance for NHS Grampian.The disclosed pension figures relate to service accrued in both his NHS Grampian and NHS Tayside roles and includes additional years purchased at his own personal cost. c) Dr Caroline Hiscox was appointed Executive Nurse Director on 24 September 2019. Prior to this, Dr Hiscox was seconded in to the role on an acting basis. d) Mrs Susan Webb was Director of Public Health for both NHS Grampian and NHS Shetland. Both roles were performed as an employee of NHS Grampian and 26% of Mrs Webb's salary was recharged to NHS Shetland under a Service Level Agreement between the two Boards.The remuneration disclosed above represents the 74% of cost met by NHS Grampian during 2019/20. The disclosed pension figures relate to service accrued in both NHS Grampian and NHS Shetland roles and includes additional years purchased at her own personal cost. e) The remuneration disclosure for Ms Kim Cruttenden includes total earnings both in her role as a Senior Clinical Pharmacist with NHS Grampian and for her additional duties as an NHS Board member. f) Miss Rachael Little worked in a full time capacity as Employee Director of NHS Grampian. g) Non Executive Board Members who were members of the Integration Joint Boards and who assumed additional responsibilities during the year received additional remuneration. h) Professor Siladitya Bhattacharya was appointed to the Board on 1 July 2019. His full year equivalent salary was in the range £5k-£10k. i) Mr Albert Donald was appointed to the Board on 1 February 2020. His full year equivalent salary was in the range £5k-£10k j) Dr Adam Coldwells was seconded to the post of Director of Strategy and Deputy Chief Executive on 28 October 2019.The earnings figure disclosed above relates to the period 28 October 2019 to 31 March 2020. The full year equivalent salary is in the range £130k - £135k. 66",1044
Grampian-2020-2021,2020-2021,,filename,2026-02-25T18:47:36+00:00,Unknown,ACCOUNTABILITY REPORT (cont),Unknown,70,70,"1. Staff Governance As part of our adherence to the NHS Scotland Staff Governance Standards, the organisation engages and consults employees or their representatives so their views are taken into account in decisions affecting their interests through the Grampian Partnership process. In addition to a full time Employee Director, NHS Grampian has invested in five full time partnership representatives released from their substantive roles, who represent the interests of all staff. NHS Grampian provides employees with information on matters of concern to them as employees through a range of communication methods including the local intranet, Team Brief, global e-mails and the Upfront Newspaper. We continue to prioritise learning and development activities aimed at not only core competencies but also to target key skill gaps as we redesign our clinical service delivery and to support leadership development in our workforce. 2. The Workforce The Board would like to express their thanks and appreciation to all staff for their fantastic contribution and for their relentless support and professionalism during this most challenging of years. The care and compassion shown to patients and to colleagues has been exemplary and the flexibility of approach has been essential in managing the impact of COVID-19, redesigning how the public access health and social care and implementing a range of public protection measures; for example Humanitarian Assistance, Test and Protect and the vaccination programme which has been the largest immunisation programme undertaken since the establishment of the NHS. Our response has been enabled by whole system co- ordination and collaboration. The Board operates, in partnership, a robust vacancy management, recruitment and redeployment process to ensure staff are deployed to the areas of greatest need. The use of agency medical, nursing and Allied Health Professional staffing has reduced during the year, except where necessary in order to cover critical roles and ensure a safe and effective service. The effective deployment of the recent enhancement to our workforce and to reduce the use of very expensive and often less effective temporary locum and agency staffing has been a key area of focus for the Board during 2020/21. Recruitment efforts continued throughout the year, in partnership with our Trade Unions and Professional Organisations, building on well-developed links with the education sector and with other North of Scotland NHS Boards to attract and retain suitably skilled professionals to Grampian. The need to respond quickly to the recent COVID-19 pandemic however created an opportunity to accelerate recruitment efforts through a range of government sponsored initiatives aimed at fast tracking recruitment of clinical staff returning to the health service and also to facilitate employment of student nurses and doctors early during the final stages of their training in order to enhance the available workforce. At the end of May 2020 NHS Grampian had successfully employed an additional 111 returning professionals through the fast track scheme, 746 Medical, Nursing and Midwifery students, 96 junior doctors and 29 fourth year nursing students to enhance our clinical workforce. A further 176 domestic and portering staff and 72 Health and Community Social Work assistants were also recruited",510
Grampian-2020-2021,2020-2021,,filename,2026-02-25T18:47:36+00:00,Unknown,ACCOUNTABILITY REPORT (cont),Unknown,71,71,"The following table summarises total staff costs and numbers for 2020/21 and the prior year: Non Executive Executive Board Board Permanent Inward Other Outward 2020/21 2019/20 STAFF COSTS Members Members Staff Secondees Staff Secondees Total Total Notes £000's £000's £000's £000's £000's £000's £000's £000's Salaries and wages c 752 413 620,843 0 0 0 622,008 540,952 Taxation & Social Security costs 98 39 58,843 0 0 0 58,980 52,848 NHS scheme employers' costs a 97 26 102,424 0 0 0 102,547 93,203 Secondees c 0 0 0 493 0 (40,614) (40,121) (39,834) Agency staff 0 0 0 0 19,483 0 19,483 33,326 TOTAL 947 478 782,110 493 19,483 (40,614) 762,897 680,495 Compensation for loss of office 0 0 6 0 0 0 6 51 TOTAL STAFF COSTS b 947 478 782,116 493 19,483 (40,614) 762,903 680,546 Included in the total Staff Costs above were costs of staff engaged directly on capital projects, charged to capital expenditure of: 217 186 Average Average STAFF NUMBERS W.T.E W.T.E Whole time equivalent (WTE) 5 0 14,110 0 0 0 14,115 13,294 Included in the total staff numbers above were staff engaged directly on capital projects, charged to capital expenditure of: 4 3 Included in the total staff numbers above were staff with a disability : 49 47 Notes : a) Reconciliation of total staff costs to Note 3 Operating Expenditure : Total employee expenditure disclosed in Note 3 operating Expenditure 803,300 724,089 Deduct outward secondees (40,614) (43,729) Add salaries charged to capital expenditure 217 186 Total staff costs disclosed above 762,903 680,546 b) Total employee expenditure increased by £79 million mainly due to the impact of additional temporary staffing (student nurses, junior medical staff, Domestics, Porters and additional overtime) during the COVID pandemic (£31.3 million), the annual pay uplift (£29.7 million), an increase in the level of untaken annual leave (£13.1 million) and the COVID 19 supplementary payment to all Health service staff (£3.9m). Expenditure on temporary agency staff reduced by £14million. 3. Staff Composition 2020/21 2019/20 Male Female Total Male Female Total Executive Directors 2 3 5 2 3 5 Non-Executive Members and Employee Director 7 9 16 7 9 16 Senior Employees 14 9 23 13 13 26 Other 3,340 14,285 17,625 2,879 12,732 15,611 Total Headcount 3,363 14,306 17,669 2,901 12,757 15,658",382
Grampian-2020-2021,2020-2021,,filename,2026-02-25T18:47:36+00:00,Unknown,ACCOUNTABILITY REPORT (cont),Unknown,72,72,"4. HIGHER PAID EMPLOYEES REMUNERATION HIGHER PAID EMPLOYEES REMUNERATION Employees whose remuneration fell within the following ranges: 2020/21 2019/20 No. No. Clinicians £ 70,001 to £80,000 166 151 £ 80,001 to £90,000 109 83 £ 90,001 to £100,000 80 74 £100,001 to £110,000 68 62 £110,001 to £120,000 73 63 £120,001 to £130,000 67 65 £130,001 to £140,000 56 66 £140,001 to £150,000 37 45 £150,001 to £160,000 49 29 £160,001 to £170,000 30 27 £170,001 to £180,000 31 23 £180,001 to £190,000 16 14 £190,001 to £200,000 6 5 £200,001 and above 27 23 Other £ 70,001 to £ 80,000 38 35 £ 80,001 to £ 90,000 24 18 £ 90,001 to £100,000 14 9 £100,001 to £110,000 11 7 £110,001 to £120,000 7 1 £120,001 to £130,000 2 1 £130,001 to £140,000 2 0 £140,001 to £150,000 0 1 £150,001 to £160,000 1 1 £160,001 to £170,000 0 0 £170,001 to £180,000 1 0 £180,001 to £190,000 1 0 £190,001 to £200,000 0 0 £200,001 and above 0 0 Note : Remuneration is calculated as gross pay plus benefits in kind and includes compensation for loss of office under agreed voluntary severence arrangements. 5. Sickness absence NHS Grampian proactively manages staff who are absent in the workplace due to sickness. Staff are encouraged to return to work as soon as possible which may include adjustment programmes longer than 4 weeks when clinically justified. With an aging workforce, people take longer to recover from accidents and injuries and it’s paramount that they be supported to return to work as soon as possible. All evidence and research shows that it is better to have somebody at work in staged recovery, rather than off sick for extended periods. This has contributed to the achievement of the overall annual sickness absence rates of 3.7% (2019/20 4.8%). To help ensure that staff have the right access to advice on health related matters, the Board have recently commenced a pilot for a new Occupational Health Wellbeing Hub which ensure that staff seeking assistance receive",340
