doc_id,report_year,period_end_date,report_year_source,run_date_utc,part,section_title,subsection_title,page_start,page_end,section_text,word_count
Grampian-2020-2021,2020-2021,,filename,2026-02-25T18:47:36+00:00,Unknown,PERFORMANCE REPORT (cont),Unknown,36,36,"12. Sustainability and the Environment The Climate Change (Scotland) Act 2009 set outs measures adopted by the Scottish Government to reduce emissions in Scotland by at least 80% by 2050. In 2015, an Order was introduced requiring all designated Major Players (of which Grampian Health Board is one) to submit an annual report to the Sustainable Scotland Network detailing compliance with the climate change duties imposed by the Act. The information returned by the Board is compiled into a national analysis report, published annually and superseding the prior requirement for public bodies to publish individual sustainability reports. Further information on the Scottish Government’s approach can be found in the Climate Change Plan 2018-2032 while national reports can be found at the following resource: https://sustainablescotlandnetwork.org/reports 13. Events after the end of the reporting period No events occurred after the end of the financial year and before the date of publication that will have a material impact on the content of these accounts as presented. ................................................................. Professor Caroline Hiscox Chief Executive 25 August 2021 Grampian Health Board",175
Grampian-2020-2021,2020-2021,,filename,2026-02-25T18:47:36+00:00,Unknown,ACCOUNTABILITY REPORT,Unknown,37,37,"1. Naming Convention NHS Grampian is the common name of Grampian Health Board. NHS Grampian Endowment Funds is the common name for the Grampian Health Board Endowment Funds. 2. Date of Issue The Accountable Officer authorised these financial statements for issue on 24 August 2021. 3. Going Concern After making enquiries, the Board has a reasonable expectation that the organisation has adequate resources to continue in operational existence for the foreseeable future. Accordingly the Board continues to adopt the going concern basis in preparing the financial statements. Further details regarding the adoption of the going concern basis are included in Note 1 of the accounts on page 86. 4. Accounting Convention In accordance with IFRS 10 – Consolidated Financial Statements, the Annual Accounts consolidate the results of the Grampian Health Board Endowment Funds (operating as NHS Grampian Endowment Funds). Any intra-group transactions between the Board and the Endowment Fund have been eliminated on consolidation. The Annual Accounts also consolidate the Board’s interest in the three Integration Joint Boards (IJBs); Moray, Aberdeen City and Aberdeenshire, established under the terms of the Public Bodies (Joint Working) (Scotland) Act 2014. In accordance with IFRS 11 – Joint Arrangements, each IJB is considered to be a Joint Venture and under IAS 28 – Investments in Associates and Joint arrangements, the basis of consolidation used is the equity method of accounting. The Annual Accounts and Notes have been prepared under the historical cost convention as modified by the revaluation of property, plant and equipment, and available for sale financial assets. The accounts have been prepared under a direction issued by the Scottish Ministers, which is reproduced on page 130 of these accounts. The statement of the accounting policies, which have been adopted, is shown at Note 1 to the Accounts on page 84. 5. Appointment of Auditor The Public Finance and Accountability (Scotland) Act 2000, places personal responsibility on the Auditor General for Scotland to decide who is to undertake the audit of each health body in Scotland. For the financial years 2016/17 to 2021/22, the Auditor General appointed Gillian Woolman, Audit Director, Audit Scotland, to undertake the audit of Grampian Health Board. The original 5-year term of the appointment was extended by a further year on 9 June 2020. The general duties of the auditor of health bodies, including their statutory duties, are set out in the Code of Audit Practice issued by Audit Scotland and approved by the Auditor General which can be accessed on the Audit Scotland website at the following link: https://www.audit-scotland.gov.uk",421
Grampian-2020-2021,2020-2021,,filename,2026-02-25T18:47:36+00:00,Unknown,ACCOUNTABILITY REPORT (cont),Unknown,38,38,"5. Appointment of Auditor (cont) The Trustees of NHS Grampian Endowment Funds appointed Azets as external auditor, for the financial year 2020/21. 6. Role of the Board Grampian Health Board was established in 1972 under the National Health Services (Scotland) Act 1972 and is responsible for commissioning services for the residents of Grampian, a total population of over half a million people. NHS Boards working in partnership with Integration Joint Boards, form a local health system, with governing boards responsible for improving the health of their local populations and delivering the healthcare they require. The role of the Board is to: a) deliver patient centred, safe and effective health care to the population of Grampian; b) improve and protect the health of local people; c) improve health services for local people; d) reduce health inequalities; e) focus clearly on health outcomes and people’s experience of their local NHS system; f) promote integrated health and community planning by working closely with other local organisations; and g) provide a single focus of accountability for the performance of the local NHS system. All Board members are also trustees of the NHS Grampian Endowment Funds, a registered charity established by the NHS (Scotland) Act 1978 and subject to the legal framework of the Charities and Trustee Investment (Scotland) Act 2005. The charitable purpose of NHS Grampian Endowment Funds is to enhance healthcare and patient welfare in Grampian, through: a) improvement of the physical and mental health of the Grampian Health Board’s population and our staff; b) prevention, diagnosis and treatment of illness; c) provision of services and facilities in connection with the above; and d) research into any matters relating to the causation, prevention, diagnosis or treatment of illness, or any other matters relating to the health service as the trustees see fit. Under the terms of the Public Bodies (Joint Working) (Scotland) Act 2014 three Integration Joint Boards (IJBs), Moray, Aberdeen City and Aberdeenshire, are established in Grampian with full delegation of functions and resources to enable integration of primary and community health and social care services. Executive and Non-Executive members of Grampian Health Board are appointed to represent the Board as voting members on each IJB. The voting membership, and therefore the exercise of control over each IJB, is shared equally between Grampian Health Board and the relevant Local Authority.",388
Grampian-2020-2021,2020-2021,,filename,2026-02-25T18:47:36+00:00,Unknown,ACCOUNTABILITY REPORT (cont),Unknown,39,39,"7. Board Membership Board members are selected and appointed through the public appointment process on the basis of their current organisational roles and/or particular expertise which enables them to contribute to the decision-making process at a strategic level. The Board has collective responsibility for the performance of NHS Grampian as a whole, working in partnership to improve health and healthcare services. The following served as members of the Board during the year and up to the date of issue: Chair: Professor Lynda Lynch Vice Chair: Mrs Rhona Atkinson Mrs Rhona Atkinson stepped down as Vice Chair on 30 April 2021 but remains a non- executive member of the Board. Dr John Tomlinson, a non-executive member of the Board since 1 February 2019, was appointed Vice Chair on 3 June 2021. Non-Executive Members: Mrs Amy Anderson Professor Siladitya Bhattacharya Ms Kim Cruttenden Councillor Isobel Davidson Mr Albert Donald Ms Joyce Duncan Mrs Luan Grugeon Councillor Ryan Houghton (from 25 May 2021) Miss Rachael Little Councillor Douglas Lumsden (to 19 March 2021) Councillor Shona Morrison Mr Roderick Murray (from 15 April 2021) Mr Jonathan Passmore (to 14 April 2021) Mr Sandy Riddell Mr Dennis Robertson Dr John Tomlinson Executive Members: Professor Amanda Croft Chief Executive (to 1 November 2020) Professor Nick Fluck Medical Director Mr Alan Gray Director of Finance Professor Caroline Hiscox Chief Executive (from 2 November 2020) Executive Nurse Director (to 1 November 2020) Mrs Susan Webb Director of Public Health Dr June Brown was appointed to the Board as Executive Nurse Director on 1 July 2021. Prior to this Dr Brown was Interim Nurse Director from 2 November 2020.",270
Grampian-2020-2021,2020-2021,,filename,2026-02-25T18:47:36+00:00,Unknown,ACCOUNTABILITY REPORT (cont),Unknown,40,40,"12. Board Members’ Interests The Register of Interests of Board Members may be inspected by members of the public on the NHS Grampian Website at the following link https://www.nhsgrampian.org/about- us/grampian-nhs-board/ or by contacting the Assistant Board Secretary on 01224 558600. The Board Members have declared in the register of interests any potential business or other relationship, which they felt could influence, or could be seen to influence, the exercise of their judgement. For 2020/21 there were no interests, other than those discharged as a Trustee of NHS Grampian Endowment Funds or as a member of an IJB that required disclosure in the accounts under IAS 24. 13. Disclosure of Information to Auditor The directors who held office at the date of approval of this Directors’ Report confirm that, so far as they are each aware, there is no relevant audit information of which the Board’s auditor is unaware; and each director has taken all the steps that he/she ought reasonably to have taken as a director to make himself/herself aware of any relevant audit information and to establish that the Board’s auditor is aware of that information. 14. Remuneration for Non Audit Work Audit Scotland, the Board’s external auditor, received no fees for non-audit work during 2020/21 (2019/20 £0). PricewaterhouseCoopers LLP who provide an Internal Audit Service to NHS Grampian received no fees for non-audit work during 2020/21 (2019/20 £18k). 15. Public Services Reform (Scotland) Act 2010 Sections 31 and 32 of the Public Services Reform (Scotland) Act 2010 impose duties on NHS Grampian to publish information on expenditure, economic sustainability and efficiency as soon as is reasonably practicable after the end of each financial year. The information required to comply with these disclosure requirements is not an integral part of the Annual Accounts and is displayed on the NHS Grampian website at the following link https://www.nhsgrampian.org/about-us/annual-accounts/ 16. Personal Data Related Incidents NHS Grampian formally reported personal data related incidents to the Information Commissioners Office (ICO) on twenty five occasions during 2020/21 (2019/20 twelve). Of these, eight did not meet the threshold for notification, but NHS Grampian notified the Information Commissioner voluntarily for their awareness. Two notifications were made and subsequently withdrawn. All of these incidents, and those relating to prior years, are now closed. Recommendations were made and acted upon but no enforcement action or penalties were applied by the ICO. 17. Financial Instruments Information in respect of the financial risk management objectives and policies of the Board and the exposure of the Board to price risk, credit risk, liquidity risk and cash flow risk is",427
Grampian-2020-2021,2020-2021,,filename,2026-02-25T18:47:36+00:00,Unknown,ACCOUNTABILITY REPORT (cont),S RESPONSIBILITIES AS THE ACCOUNTABLE OFFICER OF THE HEALTH BOARD,41,41,"ii) STATEMENT OF THE CHIEF EXECUTIVE’S RESPONSIBILITIES AS THE ACCOUNTABLE OFFICER OF THE HEALTH BOARD Under Section 15 of the Public Finance and Accountability (Scotland) Act, 2000, The Principal Accountable Officer (PAO) of the Scottish Government has appointed me as Accountable Officer of Grampian Health Board. This designation carries with it, responsibility for: ▪ The propriety and regularity of financial transactions under my control; ▪ The economical, efficient and effective use of resources placed at the Board’s disposal; and ▪ Safeguarding the assets of the Board. In preparing the Accounts I am required to comply with the requirements of the Government Financial Reporting Manual and in particular to: ▪ Observe the accounts direction issued by the Scottish Ministers including the relevant accounting and disclosure requirements and apply suitable accounting policies on a consistent basis; ▪ Make judgements and estimates on a reasonable basis; ▪ State whether applicable accounting standards as set out in the Government Financial Reporting Manual have been followed and disclose and explain any material departures; and ▪ Prepare the accounts on a going concern basis. I confirm that the Annual Report and Accounts as a whole are fair, balanced and reasonable and take personal responsibility for the Annual Report and Accounts and the judgements required for determining that it is fair, balanced and understandable. I am responsible for ensuring proper records are maintained and that the Accounts are prepared under the principles and in the format directed by Scottish Ministers. To the best of my knowledge and belief, I have properly discharged my responsibilities as Accountable Officer as intimated in the Departmental Accountable Officer’s letter to me of 30 October 2020.",274
Grampian-2020-2021,2020-2021,,filename,2026-02-25T18:47:36+00:00,Unknown,ACCOUNTABILITY REPORT (cont),Unknown,42,42,"iii) STATEMENT OF HEALTH BOARD MEMBERS’ RESPONSIBILITIES IN RESPECT OF THE ACCOUNTS Under the National Health Service (Scotland) Act 1978, the Health Board is required to prepare accounts in accordance with the directions of Scottish Ministers which require that those accounts give a true and fair view of the state of affairs of the Health Board as at 31 March 2021 and of its operating costs for the year then ended. In preparing these accounts the Directors are required to: ▪ Apply on a consistent basis the accounting policies and standards approved for NHS Scotland by Scottish Ministers; ▪ Make judgements and estimates that are reasonable and prudent; ▪ State where applicable accounting standards as set out in the Government Financial Reporting Manual have not been followed where the effect of the departure is material; and ▪ Prepare the accounts on a going concern basis unless it is inappropriate to presume that the Health Board will continue to operate. The Health Board members are responsible for ensuring that proper accounting records are maintained which disclose with reasonable accuracy at any time the financial position of the Board and enable them to ensure that the accounts comply with the National Health Service (Scotland) Act 1978 and the requirements of the Scottish Ministers. They are also responsible for safeguarding the assets of the Health Board and hence taking reasonable steps for the prevention of fraud and other irregularities. The Health Board members confirm they have discharged the above responsibilities during the financial year and in preparing the accounts.",256
Grampian-2020-2021,2020-2021,,filename,2026-02-25T18:47:36+00:00,Unknown,ACCOUNTABILITY REPORT (cont),Unknown,43,43,"iv) GOVERNANCE STATEMENT 1. Strategic Vision, Themes and Values The Grampian Clinical Strategy for 2016-2021 sets out our aspiration to improve population health and health equality. The Clinical Strategy is being reviewed during 2021/22 alongside the development of the Board re-mobilisation plan in line with the Scottish Government phased response to living with COVID-19 and this is covered in more detail on page 19 above. The Board are committed to working with our partners and staff to improve the health of the people of Grampian and the clinical strategy will be developed in line with our strategic vision and values which are detailed below: The Board works closely with a range of key stakeholders, including the general public, our staff, independent primary care practitioners, local authorities, third sector or charitable organisations and community planning partners to deliver our objectives. The Board’s Engagement and Participation Committee (see page 43 below) has a key role ensuring that patients, carers and the general public are effectively informed about and involved in services and the strategic agenda in a variety of ways. 2. Assurance Framework The Grampian NHS Board is a board of governance which meets regularly throughout the year and has adopted a schedule of matters reserved for its decision. The overall role of the Board is to implement efficient, effective and accountable governance and to provide strategic leadership and direction for the system as a whole. The main functions of the Board comprise: ➢ strategy development and implementation; ➢ resource allocation; ➢ implementation of the Annual Operational Plan; and",257
Grampian-2020-2021,2020-2021,,filename,2026-02-25T18:47:36+00:00,Unknown,ACCOUNTABILITY REPORT (cont),Unknown,44,44,"In addition, as explained in the Directors’ Report on page 34, all Board members are Trustees of the NHS Grampian Endowment Funds and are accountable in law for the discharge of the key duties of a charity Trustee as described in Section 66 of the Charities and Trustee Investment (“Scotland”) Act 2005. The Directors report on page 34 also explains the establishment of the three Integration Joint Boards (IJBs), in Moray, Aberdeen City and Aberdeenshire. Under the terms of the Public Bodies (Joint Working) (Scotland) Act 2014 the Health Board and Local Authority delegate the responsibility for the strategic planning and delivery of adult health and social care services to each IJB. The delegation of services is governed by an integration scheme agreed by both partners and Executive Director and Non-Executive members of Grampian Health Board are appointed, to represent the Board, as voting members on each IJB. The voting membership, and therefore the exercise of control over each IJB is shared equally between Grampian Health Board and the relevant Local Authority. The Board’s performance management arrangements reflect those services delegated to the IJBs and the Chief Officers of each IJB attend each meeting of Grampian Health Board and each of the Board’s key Governance Committees as required. The Board operates within an assurance framework which delegates specific governance functions to key sub committees as follows: Clinical Governance Committee The Clinical Governance Committee’s role is to oversee quality and clinical governance for the Board and ensure that quality standards are being set, met and continuously improved in appropriate areas of clinical activity and that effective arrangements for supporting, monitoring and reporting on quality and clinical governance are in place and working effectively across NHS Grampian. Membership : Ms Joyce Duncan (Chair to 13 September 2020), Dr John Tomlinson (Chair from 14 September 2020), Mrs Amy Anderson, Professor Siladitya Bhattacharya, Mrs Kim Cruttenden, Councillor Shona Morrison, Mr Dennis Robertson and a public representative. Staff Governance Committee The Staff Governance Committee has an important role in ensuring consistency of policy and equity of treatment of staff across the local NHS system, including remuneration issues, where they are not already covered by existing arrangements at national level. The Committee also oversees the implementation of the Staff Governance Standard which requires all NHS Boards to demonstrate that staff are well informed; appropriately trained; involved in decisions that affect them; treated fairly and consistently; and provided with a continuously improving and safe working environment. The Standard also places requirements on staff to ensure a balanced commitment to these matters. The Committee meets four times per year. Membership : Mr Jonathan Passmore (Chair to 13 September 2020), Ms Joyce Duncan (Chair from 14 September 2020), Mrs Rhona Atkinson, Mr Albert Donald (from 13 August 2020), Miss Rachael Little, Professor Lynda Lynch and Mr Sandy Riddell. There is Executive Director and Staff Side representation at each meeting.",480
Grampian-2020-2021,2020-2021,,filename,2026-02-25T18:47:36+00:00,Unknown,ACCOUNTABILITY REPORT (cont),Unknown,45,45,"Remuneration Committee The Remuneration Committee’s main duties are as follows: ➢ Ensuring that arrangements are in place to comply with NHS Grampian policy and Scottish Government direction and guidance for determining the employment, remuneration and terms and conditions of employment for Executive Directors and Senior Managers. ➢ Approving the Personal Objectives of all Executive Directors and Senior Managers in the context of relevant Regional/National policy, the Strategic Themes and Corporate Objectives of NHS Grampian. ➢ Receiving formal reports on the operation of remuneration arrangements and the outcomes of the annual assessment of performance for each of the Executive Directors and Senior Managers. ➢ Ensuring that arrangements are in place to determine the remuneration, terms and conditions and performance assessment for other staff employed under the executive and senior management cohort pay systems. ➢ When appropriate, in accordance with procedures, approving remuneration arrangements for other staff groups, e.g. discretionary points for medical consultants. Membership : Mr Jonathan Passmore (Chair to 13 September 2020), Ms Joyce Duncan (Chair from 14 September 2020), Mrs Rhona Atkinson, Mr Albert Donald (from 13 August 2020), Miss Rachael Little, Professor Lynda Lynch and Mr Sandy Riddell. There is Executive Director and Staff Side representation at each meeting. Audit Committee The Audit Committee’s main duties include: ➢ The review of internal and external audit arrangements; ➢ The regular review of findings and associated management action arising from internal and external audit activity; ➢ Approve changes to accounting policies, and review the Health Board Annual Report and Accounts prior to their adoption by the full Board; ➢ The review and monitoring of adherence to the Board’s Standing Orders and Standing Financial Instructions; and ➢ Ensuring that effective internal control systems are maintained and corporate governance matters are observed. Membership : Mr Sandy Riddell (Chair), Councillor Isobel Davidson, Miss Rachael Little, Councillor Douglas Lumsden (to 19 March 2021) and Dr John Tomlinson. Performance Governance Committee The Performance Governance Committee (PGC) monitors and supports performance management arrangements across NHS Grampian and promotes a culture of continuous, system wide performance improvement. Membership: Mrs Rhona Atkinson (Chair), Professor Lynda Lynch, Mrs Joyce Duncan, Mrs Luan Grugeon, Miss Rachael Little and Councillor Shona Morrison.",361
