doc_id,page,proposed_subsection,toc_subsection,reason,top_lines_snippet
Grampian-2020-2021,35,A current serious social issue in Grampian is Human Trafficking. This has been covered in,,allow_list_reject(score=0.312),"11 Social Matters (Cont) Human Trafficking A current serious social issue in Grampian is Human Trafficking. This has been covered in detail at every training session for the last 5 years. We use anonymised local examples to explain the different types of trafficking and we emphasise to staff that this is serious problem. Often, it is NHS staff who have the first opportunity to recognise that someone has been trafficked. A number of people have been rescued from the misery of Human Trafficking in 2020/21 due to staff being alert to the signs of Human Trafficking and taking immediate action Demographic Changes and Social cohesion Grampian is one of the most attractive areas in Scotland for inward migration. The changing demography of Grampian is covered in all of our training sessions. Over the last 4 years, special emphasis has been given to meeting the needs of New Syrian migrants, who have settled in Grampian. We have included the topic of social cohesion at every training session for the last 5 years. Consultation and involvement events with our local ethnic communities Since 2008, NHS Grampian has carried out at least 5 involvement and consultation events with our local ethnic communities every year. These have been carried out on a joint basis with the Grampian Regional Equality Council. On average, over 170 members of our local ethnic communities have attended. The events are advertised and presented in over 14 different local ethnic community languages. Our research has shown that over 95% of our local ethnic community members are non-English speaking when they first arrive in Grampian. Due to COVID-19, the involvement and consultation events in 2020/21 have gone online, but have still continued. This work is also outreach, we provide a wide range of information in the main local ethnic community language to participants and encourage them to register with their local GP. In 2020/21, we have put in a massive effort to ensure that accurate and authoritative local information has been available on COVID-19 precautions and vaccination arrangements. This information has been made widely available in our main local ethnic community languages for non-English speaking people. It has also been made widely available in many different formats to assist our local disability communities. More information on the above is available on the NHS Grampian website at this link: https://www.nhsgrampian.org/about-us/equality-and-diversity/"
Grampian-2020-2021,51,A summary of the Board governance arrangements that have been implemented since April,iii) Statement of Health Board Members’ Responsibilities in respect of the Accounts,allow_list_reject(score=0.351),4.1 Impact of COVID-19 on Board and Committee Governance (cont) 4.1.2 Changes made to the operation of the Board business (cont) A summary of the Board governance arrangements that have been implemented since April 2020 is set out below: April to October to January to July to October 2020 December 2020 June 2021 December 2021 Board meeting Met monthly Alternate Alternate Alternate months months months Board seminar - Alternate Alternate Alternate months months months Staff Governance Once per Pre-COVID-19 One meeting Pre-COVID-19 month cycle cycle Remuneration As required Pre-COVID-19 As required Pre-COVID-19 Committee cycle cycle Clinical Governance Once per Pre-COVID-19 One meeting Pre-COVID-19 month cycle cycle Performance Once per Pre-COVID-19 One meeting Pre-COVID-19 Governance month cycle cycle Audit Committee As required Pre-COVID-19 Three Pre-COVID-19 cycle meetings cycle Engagement and Key matters Pre-COVID-19 Committee met Pre-COVID-19 Participation discussed at cycle to consider cycle Committee Performance RMP 3 Governance Spiritual Care Pre-COVID-19 - Pre-COVID-19 - cycle cycle Pre-COVID-19 all board sub committees met at least quarterly.
Grampian-2020-2021,68,A SENIOR EMPLOYEES,b) Remuneration and Staff Report,allow_list_reject(score=0.432),"NHS GRAMPIAN REMUNERATION REPORT FOR THE YEAR ENDED 31 MARCH 2021 Publication of pension benefits is required in accordance with the Financial Reporting Manual (FReM) and the Companies Act (2006). This calculation aims to bring public bodies in line with other industries in disclosing an assessed cumulative pension benefit for a standard 20 year period, which is the estimated life span following retirement. The other figures shown as part of the single total figure of remuneration relate to actual earnings payable in 2020/21. Sub Total Value of Pension Total accrued Total accrued lump Performance Total Real increase in Real increase in earnings Benefits (to be pension at sum at pensionable Cash Equivalent Cash Equivalent Salary (bands of Related Bonus Remuneration pension at lump sum at Real increase in Notes paid in Benefits in Kind paid over 20 pensionable age at age at 31 March Transfer Value Transfer Value £5,000) (bands of (bands of pensionable age pensionable age CETV in year (see 2020/21 years following 31 March 2021 2021 (bands of (CETV) at 31/3/20 (CETV) at 31/3/21 £5,000) £5,000) (bands of £2,500) (bands of £2,500) below (bands of retirement) (bands of £5,000) £5,000) ) £5,000) £000 £000 £000 £000 £000 £000 £000 £000 £000 £000 £000 £000 £000 Remuneration of: Executive Members Professor Amanda Croft b 110-115 0 0.0 110-115 146 255-260 55-60 5-7.5 175-180 20-22.5 1,110 1,291 159 Professor Nick Fluck 205-210 0 0.0 205-210 0 205-210 55-60 0 175-180 0 1,301 1,331 30 Mr Alan Gray 140-145 0 6.0 150-155 39 185-190 25-30 2.5-5 0 0 372 421 49 Professor Caroline Hiscox a/i 130-135 0 0.0 130-135 93 225-230 30-35 5-7.5 60-65 7.5-10 431 516 86 Mrs Susan Webb c/i 155-160 0 0.0 155-160 45 200-205 50-55 2.5-5 110-115 2.5-5 894 968 74 Non Executive Members Chair - Professor Lynda Lynch 40-45 0 0 40-45 N/A 40-45 N/A N/A N/A N/A N/A N/A N/A Vice Chair - Mrs Rhona Atkinson f 25-30 0 0 25-30 N/A 25-30 N/A N/A N/A N/A N/A N/A N/A Mrs Amy Anderson f 15-20 0 0 15-20 N/A 15-20 N/A N/A N/A N/A N/A N/A N/A Professor Siladitya Bhattacharya 5-10 0 0 5-10 N/A 5-10 N/A N/A N/A N/A N/A N/A N/A Ms Kim Cruttenden d 95-100 0 0 95-100 31 125-130 20-25 0-2.5 35-40 0-2.5 287 317 30 Councillor Isobel Davidson 5-10 0 0 5-10 N/A 5-10 N/A N/A N/A N/A N/A N/A N/A Mr Albert Donald 5-10 0 0 5-10 N/A 5-10 N/A N/A N/A N/A N/A N/A N/A Ms Joyce Duncan f 15-20 0 0 15-20 N/A 15-20 N/A N/A N/A N/A N/A N/A N/A Mrs Luan Grugeon f 25-30 0 0 25-30 N/A 25-30 N/A N/A N/A N/A N/A N/A N/A Miss Rachael Little e/f 60-65 0 0 60-65 19 80-85 10-15 0-2.5 0 0 129 143 14 Councillor Douglas Lumsden (to 19 March 2021) 5-10 0 0 5-10 N/A 5-10 N/A N/A N/A N/A N/A N/A N/A Councillor Shona Morrison 5-10 0 0 5-10 N/A 5-10 N/A N/A N/A N/A N/A N/A N/A Mr Jonathan Passmore f 15-20 0 0 15-20 N/A 15-20 N/A N/A N/A N/A N/A N/A N/A Mr Sandy Riddell f 15-20 0 0 15-20 N/A 15-20 N/A N/A N/A N/A N/A N/A N/A Mr Dennis Robertson f 20-25 0 0 20-25 N/A 20-25 N/A N/A N/A N/A N/A N/A N/A Mr John Tomlinson f 15-20 0 0 15-20 N/A 15-20 N/A N/A N/A N/A N/A N/A N/A SENIOR EMPLOYEES Dr June Brown (from 2 November 2020) g 35-40 0 0 35-40 39 75-80 25-30 2.5-5 65-70 7.5-10 387 476 90 Dr Adam Coldwells i 135-140 0 0.2 135-140 46 185-190 50-55 2.5-5 110-115 0-2.5 875 939 64 Mr Tom Power (from 1 July 2020) h 70-75 0 0 70-75 35 105-110 10-15 2.5-5 134 171 37 NOTES : a) Professor Caroline Hiscox was appointed as Chief Executive and accountable officer for NHS Grampian on 2 November 2020. Prior to this, Professor Hiscox was the Executive Nurse Director. b) Professor Croft was Chief Executive and accountable officer of NHS Grampian until 1 November 2020 and formally retired from NHS Grampian service on 31 December 2020. Her full year equivalent salary was in the range £145k-£150k c) Mrs Susan Webb was Director of Public Health for both NHS Grampian and NHS Shetland. Both roles were performed as an employee of NHS Grampian and 17% of Mrs Webb's salary was recharged to NHS Shetland under a Service Level Agreement between the two Boards.The remuneration disclosed above represents the 83% of cost met by NHS Grampian during 2020/21. The disclosed pension figures relate to service accrued in both NHS Grampian and NHS Shetland roles and includes additional years purchased at her own personal cost. d) The remuneration disclosure for Ms Kim Cruttenden includes total earnings both in her role as a Senior Clinical Pharmacist with NHS Grampian and for her additional duties as an NHS Board member. e) Miss Rachael Little worked in a full time capacity as Employee Director of NHS Grampian. f) Non Executive Board Members who were members of the Integration Joint Boards and who assumed additional responsibilities during the year received additional remuneration. g) Dr June Brown was appointed Interim Nurse Director with effect from 2 November 2020. Her full year equivalent salary was in the range £95k-£100k h) Mr Tom Power was appointed as Director of People and Culture on 1 July 2020. His full year equivalent salary was in the range £90k-£95k i) Executive Board members and Senior Managers received overtime during the COVID pandemic in line with Scottish Government Direction, where this was deemed helpful for the provision of clinical or other services necessary to the continued operation of NHS Scotland and subject to the scrutiny and agreement of the NHS Grampian Remuneration Committee. 65"
Grampian-2020-2021,69,A SENIOR EMPLOYEES,i) Remuneration Report,allow_list_reject(score=0.432),"NHS GRAMPIAN REMUNERATION REPORT FOR THE YEAR ENDED 31 MARCH 2020 Publication of pension benefits is required in accordance with the Financial Reporting Manual (FReM) and the Companies Act (2006). This calculation aims to bring public bodies in line with other industries in disclosing an assessed cumulative pension benefit for a standard 20 year period, which is the estimated life span following retirement. The other figures shown as part of the single total figure of remuneration relate to actual earnings payable in 2019/20. Sub Total Value of Pension Total accrued Performance Real increase in Total accrued lump Real increase in earnings Benefits (to be Total pension at Cash Equivalent Cash Equivalent Salary (bands of Related Bonus pension at sum at pensionable lump sum at Real increase in paid in Benefits in Kind paid over 20 Remuneration pensionable age at Transfer Value Transfer Value £5,000) (bands of pensionable age age at 31 March 2020 pensionable age CETV in year Notes 2019/20 years following (bands of £5,000) 31 March 2020 (CETV) at 31/3/19 (CETV) at 31/3/20 £5,000) (bands of £2,500) (bands of £5,000) (bands of £2,500) (see (bands of retirement) (bands of £5,000) below) £5,000) £000 £000 £000 £000 £000 £000 £000 £000 £000 £000 £000 £000 £000 Remuneration of: Executive Members Professor Amanda Croft a 150-155 0 0.0 150-155 115 265-270 50-55 5-7.5 150-155 15-17.5 963 1,105 128 Professor Nick Fluck 200-205 0 0.0 200-205 0 200-205 55-60 0 175-180 0 1,265 1,294 29 Mr Alan Gray b 125-130 0 5.4 130-135 36 165-170 25-30 2.5-5 0 0 321 370 49 Dr Caroline Hiscox c 100-105 0 0.0 100-105 37 135-140 25-30 0-2.5 50-55 0-2.5 390 429 39 Mrs Susan Webb d 80-85 0 0.0 80-85 36 115-120 45-50 2.5-5 105-110 0-2.5 826 890 64 Non Executive Members Chair - Professor Lynda Lynch 35-40 0 0 35-40 N/A 35-40 N/A N/A N/A N/A N/A N/A N/A Vice Chair - Mrs Rhona Atkinson g 30-35 0 0 30-35 N/A 30-35 N/A N/A N/A N/A N/A N/A N/A Mrs Amy Anderson g 15-20 0 0 15-20 N/A 15-20 N/A N/A N/A N/A N/A N/A N/A Professor Siladitya Bhattacharya (from 1 July 2019) h 5-10 0 0 5-10 N/A 5-10 N/A N/A N/A N/A N/A N/A N/A Ms Kim Cruttenden e 90-95 0 0 90-95 23 110-115 15-20 0-2.5 35-40 0-2.5 262 285 23 Councillor Isobel Davidson 5-10 0 0 5-10 N/A 5-10 N/A N/A N/A N/A N/A N/A N/A Mr Albert Donald (from 1 February 2020) i 0-5 0 0 0-5 N/A 0-5 N/A N/A N/A N/A N/A N/A N/A Ms Joyce Duncan g 15-20 0 0 15-20 N/A 15-20 N/A N/A N/A N/A N/A N/A N/A Mrs Luan Grugeon g 25-30 0 0 25-30 N/A 25-30 N/A N/A N/A N/A N/A N/A N/A Miss Rachael Little f/g 60-65 0 0 60-65 16 75-80 10-15 0-2.5 0 0 117 128 11 Councillor Douglas Lumsden 5-10 0 0 5-10 N/A 5-10 N/A N/A N/A N/A N/A N/A N/A Councillor Shona Morrison 5-10 0 0 5-10 N/A 5-10 N/A N/A N/A N/A N/A N/A N/A Mr Jonathan Passmore g 25-30 0 0 25-30 N/A 25-30 N/A N/A N/A N/A N/A N/A N/A Mr Sandy Riddell g 15-20 0 0 15-20 N/A 15-20 N/A N/A N/A N/A N/A N/A N/A Mr Dennis Robertson g 15-20 0 0 15-20 N/A 15-20 N/A N/A N/A N/A N/A N/A N/A Mr John Tomlinson g 15-20 0 0 15-20 N/A 15-20 N/A N/A N/A N/A N/A N/A N/A SENIOR EMPLOYEES Dr Adam Coldwells (from 28 October 2020) j 55-60 0 0 55-60 19 75-80 45-50 2.5-5 105-110 0-2.5 810 871 61 NOTES : a) Professor Amanda Croft was the accountable officer for NHS Grampian throughout 2019/20. First as Interim Chief Executive and then following her permanent appointment as Chief Executive from 12th April 2019. b) During the period 1 April 2019 to 30 June 2019 Mr Alan Gray was Director of Finance for both NHS Grampian and NHS Tayside. Both roles were performed as an employee of NHS Grampian and 45% of Mr Grays salary for the period 1 April 2019 to 30 June 2019 was recharged to NHS Tayside.The remuneration disclosed above represents the 55% of cost met by NHS Grampian for the period 1 April 2019 to 30 June 2019 and 100% of cost from 1 July 2019 when Mr Gray reverted to a full time role as Director of Finance for NHS Grampian.The disclosed pension figures relate to service accrued in both his NHS Grampian and NHS Tayside roles and includes additional years purchased at his own personal cost. c) Dr Caroline Hiscox was appointed Executive Nurse Director on 24 September 2019. Prior to this, Dr Hiscox was seconded in to the role on an acting basis. d) Mrs Susan Webb was Director of Public Health for both NHS Grampian and NHS Shetland. Both roles were performed as an employee of NHS Grampian and 26% of Mrs Webb's salary was recharged to NHS Shetland under a Service Level Agreement between the two Boards.The remuneration disclosed above represents the 74% of cost met by NHS Grampian during 2019/20. The disclosed pension figures relate to service accrued in both NHS Grampian and NHS Shetland roles and includes additional years purchased at her own personal cost. e) The remuneration disclosure for Ms Kim Cruttenden includes total earnings both in her role as a Senior Clinical Pharmacist with NHS Grampian and for her additional duties as an NHS Board member. f) Miss Rachael Little worked in a full time capacity as Employee Director of NHS Grampian. g) Non Executive Board Members who were members of the Integration Joint Boards and who assumed additional responsibilities during the year received additional remuneration. h) Professor Siladitya Bhattacharya was appointed to the Board on 1 July 2019. His full year equivalent salary was in the range £5k-£10k. i) Mr Albert Donald was appointed to the Board on 1 February 2020. His full year equivalent salary was in the range £5k-£10k j) Dr Adam Coldwells was seconded to the post of Director of Strategy and Deputy Chief Executive on 28 October 2019.The earnings figure disclosed above relates to the period 28 October 2019 to 31 March 2020. The full year equivalent salary is in the range £130k - £135k. 66"
Grampian-2020-2021,76,I have audited the financial statements in the annual report and accounts of Grampian,,allow_list_reject(score=0.374),"Reporting on the audit of the financial statements Opinion on financial statements I have audited the financial statements in the annual report and accounts of Grampian Health Board and its group for the year ended 31 March 2021 under the National Health Service (Scotland) Act 1978. The financial statements comprise the Consolidated Statement of Comprehensive Net Expenditure, the Consolidated Statement of Financial Position, the Consolidated Cash Flow Statement, the Consolidated Statement of Changes in Taxpayers’ Equity and notes to the financial statements, including a summary of significant accounting policies. The financial reporting framework that has been applied in their preparation is applicable law and International Financial Reporting Standards (IFRSs) as adopted by the European Union, and as interpreted and adapted by the 2020/21 Government Financial Reporting Manual (the 2020/21 FReM). In my opinion the accompanying financial statements: - give a true and fair view in accordance with the National Health Service (Scotland) Act 1978 and directions made thereunder by the Scottish Ministers of the state of the affairs of the board and its group as at 31 March 2021 and of the net expenditure for the year then ended; - have been properly prepared in accordance with IFRSs as adopted by the European Union, as interpreted and adapted by the 2020/21 FReM; and - have been prepared in accordance with the requirements of the National Health Service (Scotland) Act 1978 and directions made thereunder by the Scottish Ministers. Basis for opinion I conducted my audit in accordance with applicable law and International Standards on Auditing (UK) (ISAs (UK)), as required by the Code of Audit Practice approved by the Auditor General for Scotland. My responsibilities under those standards are further described in the auditor’s responsibilities for the audit of the financial statements section of my report. I was appointed by the Auditor General on 18 July 2016. The period of total uninterrupted appointment is five years. I am independent of the board and its group in accordance with the ethical requirements that are relevant to my audit of the financial statements in the UK including the Financial Reporting Council’s Ethical Standard, and I have fulfilled my other ethical responsibilities in accordance with these requirements. Non- audit services prohibited by the Ethical Standard were not provided to the board. I believe that the audit evidence I have obtained is sufficient and appropriate to provide a basis for my opinion. Conclusions relating to going concern basis of accounting I have concluded that the use of the going concern basis of accounting in the preparation of the financial statements is appropriate. Based on the work I have performed, I have not identified any material uncertainties relating to events or conditions that, individually or collectively, may cast significant doubt on the body’s ability to continue to adopt the going concern basis of accounting for a"
Grampian-2020-2021,77,"I report in a separate Annual Audit Report, available from the Audit Scotland website ,",,allow_list_reject(score=0.325),"I report in a separate Annual Audit Report, available from the Audit Scotland website , the most significant assessed risks of material misstatement that I identified and my judgement thereon. Responsibilities of the Accountable Officer for the financial statements As explained more fully in the Statement of the Chief Executive’s Responsibilities, as the Accountable Officer, the Accountable Officer is responsible for the preparation of financial statements that give a true and fair view in accordance with the financial reporting framework, and for such internal control as the Accountable Officer determines is necessary to enable the preparation of financial statements that are free from material misstatement, whether due to fraud or error. In preparing the financial statements, the Accountable Officer is responsible for assessing the ability of the board and its group to continue as a going concern, disclosing, as applicable, matters related to going concern and using the going concern basis of accounting unless deemed inappropriate. Auditor’s responsibilities for the audit of the financial statements My objectives are to obtain reasonable assurance about whether the financial statements as a whole are free from material misstatement, whether due to fraud or error, and to issue an auditor’s report that includes my opinion. Reasonable assurance is a high level of assurance, but is not a guarantee that an audit conducted in accordance with ISAs (UK) will always detect a material misstatement when it exists. Misstatements can arise from fraud or error and are considered material if, individually or in the aggregate, they could reasonably be expected to influence the economic decisions of users taken on the basis of these financial statements. Irregularities, including fraud, are instances of non-compliance with laws and regulations. I design procedures in line with my responsibilities outlined above to detect material misstatements in respect of irregularities, including fraud. Procedures include: - obtaining an understanding of the applicable legal and regulatory framework and how the board is complying with that framework; - identifying which laws and regulations are significant in the context of the board; - assessing the susceptibility of the financial statements to material misstatement, including how fraud might occur; and - considering whether the audit team collectively has the appropriate competence and capabilities to identify or recognise non-compliance with laws and regulations. The extent to which my procedures are capable of detecting irregularities, including fraud, is affected by the inherent difficulty in detecting irregularities, the effectiveness of the board’s controls, and the nature, timing and extent of the audit procedures performed. Irregularities that result from fraud are inherently more difficult to detect than irregularities that result from error as fraud may involve collusion, intentional omissions, misrepresentations, or the override of internal control. The capability of the audit to detect fraud and other irregularities depends on factors such as the skilfulness of the perpetrator, the frequency and extent of manipulation, the degree of collusion involved, the relative size"
Grampian-2020-2021,78,A further description of the auditor’s responsibilities for the audit of the financial statements,,allow_list_reject(score=0.536),"Reporting on regularity of expenditure and income Opinion on regularity In my opinion in all material respects the expenditure and income in the financial statements were incurred or applied in accordance with any applicable enactments and guidance issued by the Scottish Ministers. Responsibilities for regularity The Accountable Officer is responsible for ensuring the regularity of expenditure and income. In addition to my responsibilities to detect material misstatements in the financial statements in respect of irregularities, I am responsible for expressing an opinion on the regularity of expenditure and income in accordance with the Public Finance and Accountability (Scotland) Act 2000. Reporting on other requirements Opinion prescribed by the Auditor General for Scotland on audited part of the Remuneration and Staff Report I have audited the parts of the Remuneration and Staff Report described as audited. In my opinion, the audited part of the Remuneration and Staff Report has been properly prepared in accordance with the National Health Service (Scotland) Act 1978 and directions made thereunder by the Scottish Ministers. Statutory other information The Accountable Officer is responsible for the statutory other information in the annual report and accounts. The statutory other information comprises the Performance Report and the Accountability Report excluding the audited part of the Remuneration and Staff Report. My responsibility is to read all the statutory other information and, in doing so, consider whether the statutory other information is materially inconsistent with the financial statements or my knowledge obtained in the audit or otherwise appears to be materially misstated. If I identify such material inconsistencies or apparent material misstatements, I am required to determine whether this gives rise to a material misstatement in the financial statements themselves. If, based on the work I have performed, I conclude that there is a material misstatement of this statutory other information, I am required to report that fact. I have nothing to report in this regard. My opinion on the financial statements does not cover the statutory other information and I do not express any form of assurance conclusion thereon except on the Performance Report and Governance Statement to the extent explicitly stated in the following opinions prescribed by the Auditor General for Scotland."
