doc_id,report_year,period_end_date,report_year_source,run_date_utc,part,section_title,subsection_title,page_start,page_end,section_text,word_count
Grampian-2024-2025,2024-2025,,filename,2026-03-12T08:05:34+00:00,Unknown,FINANCIAL STATEMENTS,Unknown,120,120,"As a participant in the CNORIS scheme the Board is also liable to meet the cost of contributions to the scheme in future years and is required, additionally, to provide for the Board’s share of the total CNORIS liability of NHS Scotland as advised by the Scottish Government and based on information prepared by NHS Boards and the Central Legal Office. The movement in the provisions between financial years is matched by a corresponding adjustment in AME provision and is classified as non-core expenditure. 19) Related Party Transactions Material related party transactions are disclosed in note 22 in line with the requirements of IAS 24. Transactions with other NHS bodies for the commissioning of health care are summarised in Note 3. 20) Value Added Tax Most of the activities of the Board are outside the scope of VAT and, in general, output tax does not apply and input tax on purchases is not recoverable. Irrecoverable VAT is charged to the relevant expenditure category or included in the capitalised purchase cost of property, plant and equipment. Where output tax is charged or input VAT is recoverable, the amounts are stated net of VAT. 21) Provisions The Board provides for legal or constructive obligations that are of uncertain timing or amount at the Statement of Financial Position date on the basis of the best estimate of the expenditure required to settle the obligation. Where the effect of the time value of money is significant, the estimated cash flows are discounted using the discount rate prescribed by HM Treasury. 22) Contingencies Contingent assets (that is, assets arising from past events whose existence will only be confirmed by one or more future events not wholly within the Board’s control) are not recognised as assets, but are disclosed in note 14 where an inflow of economic benefits is probable. Contingent liabilities are not recognised, but are disclosed in note 14, unless the probability of a transfer of economic benefits is remote. Contingent liabilities are defined as:  possible obligations arising from past events whose existence will be confirmed only by the occurrence of one or more uncertain future events not wholly within the entity’s control; or  present obligations arising from past events but for which it is not probable that a transfer of economic benefits will arise or for which the amount of the obligation cannot be measured with sufficient reliability. 23) Corresponding Amounts Corresponding amounts are shown for the primary statements and notes to the financial statements. Where the corresponding amounts are not directly comparable with the",424
Grampian-2024-2025,2024-2025,,filename,2026-03-12T08:05:34+00:00,Unknown,FINANCIAL STATEMENTS,Unknown,121,121,"Financial Statements’, requires that they should be adjusted and the basis for adjustment disclosed in a note to the financial statements. 24) Financial Instruments 24(a) Financial assets Business model The Board’s business model refers to how it manages its financial assets in order to generate cash flows and is determined at a level which reflects how groups of financial assets are managed to achieve a business objective, rather than assessment of individual instruments. Classification When the Board first recognises a financial asset, it classifies it based on its business model for managing the asset and the asset’s contractual flow characteristics. The Board classifies its financial assets in the following categories: at fair value through profit or loss, amortised cost, and fair value through other comprehensive income. The default basis for financial assets is to be held at fair value through profit or loss, although alternative treatment may be designated where receivables are held to collect principal and interest and/or for sale. (a) Financial assets at fair value through profit or loss This is the default basis for financial assets . (b) Financial assets held at amortised cost A financial asset may be held at amortised cost where both of the following conditions are met: i. the financial asset is held within a business model where the objective is to collect contractual cash flows; and ii. the contractual terms of the financial asset give rise to cash flows that are solely payments of principal and related interest. (c) Financial assets at fair value through other comprehensive income A financial asset may be held at fair value through other comprehensive income where both of the following conditions are met: i. the financial asset is held within a business model where the objective is to collect contractual cash flows and sell the asset; and ii. the contractual terms of the financial asset give rise to cash flows that are solely payments of principal and related interest.",323
Grampian-2024-2025,2024-2025,,filename,2026-03-12T08:05:34+00:00,Unknown,FINANCIAL STATEMENTS,Unknown,122,122,"Impairment of financial assets Provisions for impairment of financial assets are made on the basis of expected credit losses. The Board recognises a loss allowance for expected credit losses on financial assets and this is recognised in other comprehensive income, rather than reducing the carrying amount of the asset in the Statement of Financial Position. Lifetime expected credit losses are recognised and applied to financial assets by the Board where there has been a significant increase in credit risk since the asset’s initial recognition. Where the Board does not hold reasonable and supportable information to measure lifetime expected credit losses on an individual instrument basis, the losses are recognised on a collective basis which considers comprehensive credit risk information. Recognition and measurement Financial assets are recognised when the Board becomes party to the contractual provisions of the financial instrument. Financial assets are derecognised when the rights to receive cash flows from the asset have expired or have been transferred and the Board has transferred substantially all risks and rewards of ownership. (a) Financial assets at fair value through profit or loss Financial assets carried at fair value through profit or loss are initially recognised at fair value, and transaction costs are expensed in the Statement of Comprehensive Net Expenditure. Financial assets carried at fair value through profit or loss are subsequently measured at fair value. Gains or losses arising from changes in the fair value are presented in the Statement of Comprehensive Net Expenditure . (b) Financial assets held at amortised cost Loans and receivables are recognised initially at fair value and subsequently measured at amortised cost using the effective interest method. This is calculated by applying the effective interest rate to the gross carrying amount of the asset. (c) Financial assets held at fair value through other comprehensive income Financial assets carried at fair value through other comprehensive income are initially recognised at fair value plus transaction costs that are directly attributable to the acquisition or issue of the financial asset. Financial assets carried at fair value through other comprehensive income are subsequently measured at fair value. Gains or losses arising from changes in the fair value are recognised in the Statement of Comprehensive Net Expenditure until the financial asset is derecognised or reclassified. (IFRS 9 - 5.7.10)",379
Grampian-2024-2025,2024-2025,,filename,2026-03-12T08:05:34+00:00,Unknown,FINANCIAL STATEMENTS,Unknown,123,123,"24) (b) Financial Liabilities Classification The Board classifies its financial liabilities in the following categories: at fair value through profit or loss, and amortised cost. The Board classifies all financial liabilities as measured at amortised cost, unless: i. these are measured at fair value on a portfolio basis in accordance with a documented risk management or investment strategy; ii. they contain embedded derivatives; and/or iii. it eliminates or reduces ‘accounting mismatch’ that would otherwise arise from measurement or recognition on an amortised costs basis. (a) Financial liabilities at fair value through profit or loss Financial liabilities at fair value through profit or loss comprise derivatives. Liabilities in this category are classified as current liabilities. The NHS Board does not trade in derivatives and does not apply hedge accounting. (b) Financial liabilities held at amortised cost Financial liabilities held at amortised cost are disclosed in current liabilities, except for maturities greater than 12 months after the Statement of Financial Position date. These are classified as non-current liabilities. The NHS Board’s financial liabilities held at amortised cost comprise trade and other payables in the Statement of Financial Position. Recognition and measurement Financial liabilities are recognised when the NHS Board becomes party to the contractual provisions of the financial instrument. A financial liability is removed from the Statement of Financial Position when it is extinguished, that is when the obligation is discharged, cancelled or expired. (a) Financial liabilities at fair value through profit or loss Financial liabilities carried at fair value through profit or loss are initially recognised at fair value, and transaction costs are expensed in the income statement. Financial liabilities carried at fair value through profit or loss are subsequently measured at fair value. Gains or losses arising from changes in the fair value are presented in the Statement of Comprehensive Net Expenditure. (b) Amortised costs Financial liabilities held at amortised cost are recognised initially at fair value and subsequently measured at amortised cost using the effective interest method.",328
Grampian-2024-2025,2024-2025,,filename,2026-03-12T08:05:34+00:00,Unknown,FINANCIAL STATEMENTS,Unknown,124,124,"25) Segmental reporting Operating segments are reported in a manner consistent with the internal reporting provided to the chief operating decision-maker, who is responsible for allocating resources and assessing performance of the operating segments. This has been identified as the senior management of the Board. Operating segments are unlikely to directly relate to the analysis of expenditure shown in Note 3. 26) Cash and cash equivalents Cash and cash equivalents includes cash in hand, deposits held on call with banks, cash balances held with the Government Banking Service and other short-term highly liquid investments with original maturities of three months or less, and bank overdrafts. Bank overdrafts are shown within borrowings in current liabilities on the balance sheet. 27) Foreign exchange The functional and presentational currencies of the Board are sterling. A transaction which is denominated in a foreign currency is translated into the functional currency at the spot exchange rate on the date of the transaction. Where the Board has assets or liabilities denominated in a foreign currency at the Statement of Financial Position date:  monetary items (other than financial instruments measured at ‘fair value through profit or loss) are translated at the spot exchange rate on 31 March;  non-monetary assets and liabilities measured at historical cost are translated using the spot exchange rate at the date of the transaction; and  non-monetary assets and liabilities measured at fair value are translated using the spot exchange rate at the date the fair value was determined. Exchange gains or losses on monetary items (arising on settlement of the transaction or on re-translation at the balance sheet date) are recognised in income or expenditure in the period in which they arise. Exchange gains or losses on non-monetary assets and liabilities are recognised in the same manner as other gains and losses on these items. 28) Third party assets Assets belonging to third parties (such as money held on behalf of patients) are not recognised in the accounts since the Board has no beneficial interest in them. However, they are disclosed in note 21 in accordance with the requirements of HM Treasury’s Financial Reporting Manual. 29) Key sources of judgement, estimation and uncertainty Estimates and judgements are continually evaluated and are based on historical experience and other factors, including expectations of future events that are believed to be reasonable under the circumstances. The Board makes estimates and assumptions",398
Grampian-2024-2025,2024-2025,,filename,2026-03-12T08:05:34+00:00,Unknown,FINANCIAL STATEMENTS,Unknown,125,125,"concerning the future. The resulting accounting estimates will, by definition, seldom equal the related actual results. The Board makes judgements in applying accounting policies. The estimates, assumptions and judgements that have a significant risk of causing a material adjustment to the carrying amounts of assets and liabilities within the financial statements within the next financial year are addressed below. Clinical and Medical Negligence Provision: The clinical and medical negligence provision is calculated using information received from the Central Legal Office regarding claims they have received relating to NHS Grampian. The provision covers all claims classified as category 3 and 50% of the value of claims in category 2 which have been assessed as having a probability of settlement. The share of the NHS Scotland CNORIS liability is estimated based on actual settlement trends in prior years. The carrying value of both the provision and receivable is as shown below: 2024/25 2023/24 £000’s £000’s Provision recognising individual claims 151,621 175,012 against the NHS Board at 31 March (*) Associated CNORIS receivable at 31 March -154,430 -173,829 The element of claims in Categories 1 and 2 not covered by the provision is recorded as a contingent liability under Note 14. The sensitivities regarding the categorisation of claims is set out as follows: Increase in Decrease in Sensitivities at 31 March 2025 Provision Contingent Liability £000’s £000’s 5% increase in claims needing 2,600 -2,600 to be fully provided for Further detail on the Clinical and Medical Negligence Provision is detailed in section 18 above. Pension Provision: The pension provision is calculated using information received from the Scottish Public Pension Agency (SPPA) relating to former NHS Grampian employees for whom NHS Grampian have an ongoing pension liability. Estimation of the liability to pay pensions for these staff depends on a number of complex judgements relating to the discount rates used, the rate at which salaries are projected to increase, changes in retirement ages, mortality rates and expected returns on pension fund assets. Reliance is placed on significant details provided by the actuary of the Pension Fund to establish the value of this liability. The carrying value of the Pension Provisions is as shown below: 2024/25 2023/24 £000’s £000’s Provisions included on the Statement of 6,100 5,660 Financial Position",374
Grampian-2024-2025,2024-2025,,filename,2026-03-12T08:05:34+00:00,Unknown,FINANCIAL STATEMENTS,Unknown,126,126,"The effects on the net pension’s liability of changes in individual assumptions can be measured. The sensitivities regarding the principal assumptions used to measure the scheme liabilities are set out as follows: Approximate % Approximate increase to monetary Sensitivities at 31 March 2025 Employer amount Liability £000’s 0.5% decrease in real discount 5% 285 rate 0.5% increase in pension 0% 24 discount rate Band 5/6 Regrade: NHS Scotland implemented Agenda for Change (AfC) in 2004. It aimed to modernise pay structures and harmonise terms and conditions across various roles ensuing fairness and consistency in pay and career progression. The Cabinet Secretary has agreed a nursing review starting from 1 April 2024 as there is an expectation that that some Band 5 nurses are now working beyond their pay grade. Staff may self-refer for a review of their role to a job evaluation panel and if successful, the pay award is backdated to when their duties changed or 1 April 2023 at the earliest. There is a degree of uncertainty around the level of claims made and those which will be successful. To account for this relevant costs have been accrued for a proportion of those who have completed the evaluation process, and expected to be successful, but are pending consideration by review panel. A pay provision has been created for those who have engaged with but not completed the application process as at the 31 st March 2025, with the remainder which have not been provided for is covered under Contingent Liabilities in Note 14. The estimated success rate used for the accrual has been based on the actual proportion of successful applications to date. Any movement in this estimate would result in a movement between the accrual and provision set aside but have no impact on the Statement of Comprehensive Net Expenditure. Increase in Decrease in Sensitivities at 31 March 2025 Accruals Provision £000’s £000’s Successful claims 5% higher 138 -138 than estimated Fair Value of Land & Buildings: Aberdeen Royal Infirmary and 20% of all other property was fully revalued and all remaining land and buildings subject to a desktop valuation on the basis of local market related indices at 31 March 2025, and the impact of any impairment in value on operating costs agreed. Such indices, including zero indexation factors, were applied following consultation and advice from the Board’s Property Advisor. The basis of property valuation",399
Grampian-2024-2025,2024-2025,,filename,2026-03-12T08:05:34+00:00,Unknown,FINANCIAL STATEMENTS,NOTE 7,127,127,"Carrying value of land, buildings and dwellings is shown below and analysis is shown in note 7. 2024/25 2023/24 £000’s £000’s Land, Buildings & Dwellings 536,357 534,473 NHS Grampian commissions an independent valuation of all of its owned and Hub Contract held Land and Building Assets on an annual basis. The valuation is undertaken by the Valuation Office Agency, sponsored by HMRC. Instructions reflect valuation should include VAT, recognising the cessation of these PFI procurement would not be recoverable now in the event of replacing the asset. It is estimated that a change in value of 10% would be expected to have a £53.6 million impact to the value of these assets. Contingent Liabilities: Land and Building Material disputed claims, following assessment under the relevant contract, have been received by the Board from the contractor appointed to deliver a key infrastructure projects at the balance sheet a dispute has not crystallised. This has been treated as a contingent liability.",159
Grampian-2024-2025,2024-2025,,filename,2026-03-12T08:05:34+00:00,Unknown,FINANCIAL STATEMENTS,NOTE 2. A. SUMMARY OF CORE REVENUE RESOURCE OUTTURN,128,128,"Note 2A. SUMMARY OF CORE REVENUE RESOURCE OUTTURN SUMMARY OF CORE REVENUE RESOURCE OUTTURN 2024/25 2024/25 2023/24 2023/24 £’000 £’000 £’000 £’000 Net expenditure 1,686,776 1,583,114 Total Non-Core Expenditure (see below) (40,219) (48,416) FHS Non Discretionary Allocation (82,295) (76,258) Endowment Net Operating Costs (26) 546 Joint Ventures accounted for on an equity basis (5,204) (18,451) Total Core Expenditure 1,559,032 1,440,535 Core Revenue Resource Limit 1,559,285 1,440,632 Saving/(excess) against Core Revenue Resource Limit 253 97 SUMMARY OF NON CORE REVENUE RESOURCE OUTTURN Capital grants to/(from) other bodies 16 22 Depreciation/Amortisation 29,212 26,050 Annually Managed Expenditure - Impairments (7,886) 13,221 Annually Managed Expenditure - Creation of Provisions 11,852 2,290 Annually Managed Expenditure - Depreciation of Donated Assets 1,370 1,401 Annually Managed Expenditure - pension valuation (11) (28) Annually Managed Expenditure - Fair Value Adjustments (53) 680 Donated Assets Income (411) (1,248) IFRS PFI expenditure 1,001 1,014 Right of Use (RoU) Asset Depreciation 5,306 4,932 Annually Managed Expenditure - Right of Use (RoU) Peppercorn Leases Depreciation (177) 82 Total Non Core Expenditure 40,219 48,416 Non-Core Revenue Resource Limit 40,219 48,416 Saving/(excess) against Non Core Revenue Resource Limit 0 0 Saving/(exce SUMMARY RESOURCE OUTTURN Resource Expenditure Saving/(excess) Resource Expenditure ss) £'000 £'000 £'000 £'000 £'000 £'000 Core 1,559,285 1,559,032 253 1,440,632 1,440,535 97 Non-Core 40,219 40,219 0 48,416 48,416 0 Total 1,599,504 1,599,251 253 1,489,048 1,488,951 97 Note 2B. NOTES TO THE CASHFLOW STATEMENT Consolidated adjustments for non-cash transactions NHS NHS Grampian Grampian NHS Charity Intra Group NHS Charity Intra Group Grampian Funds Adjustments Group Grampian Funds Adjustments Group 2024/25 2024/25 2024/25 2024/25 2023/24 2023/24 2023/24 2023/24 Note £’000 £’000 £’000 £’000 £’000 £’000 £’000 £’000 Expenditure not paid in cash Depreciation 7a 27,552 27,552 26,471 26,471 Amortisation 6 641 641 511 511 Depreciation of donated assets 7a 1,370 1,370 1,401 1,401 Depreciation of Right of Use (RoU) Assets 5,472 5,472 5,127 5,127 Right of Use (RoU) Remeasurement (gain)/loss 1,958 1,958 0 0 Right of Use asset peppercorn leases 17a (343) (343) 0 0 PFI Remeasurement (Gain)/Loss (164) (164) (120) (120) Impairments on PPE charged to SoCNE 2,097 2,097 13,940 13,940 Reversal of impairments on PPE charged to SoCNE (12,041) (12,041) (729) (729) Loss on remeasurement of non-current assets held for sale 7b 100 100 10 10 Funding Of Donated Assets * 4/7a (411) (411) (1,248) (1,248) Loss / (profit) on disposal of property, plant and equipment 561 561 192 192 GP Loans Fair Value Adjustment (52) (52) 680 680 Joint Ventures accounted for on an equity basis 0 5,204 5,204 0 18,451 18,451 Transfer of Assets from Other NHS 0 0 0 0 Total expenditure not paid in cash 26,740 0 5,204 31,944 46,235 0 18,451 64,686 Notes : * Donations to fund specific capital projects are initially treated as operating income disclosed in note 4 and offset against operating expenditure in the SOCNE. Because these donations are used to meet the cost of capital, and not normal operating expenditure, the value of the donations are also included in note 2, in order to ensure that these costs are properly recognised within the cash flow statement. 2b. Interest payable recognised in operating expenditure 2024/25 2023/24 £’000 £’000 PFI Finance lease charges allocated in the year 18b 2,647 2,720 Lease Interest 17b 1,129 1,175 3,776 3,895",542
Grampian-2024-2025,2024-2025,,filename,2026-03-12T08:05:34+00:00,Unknown,FINANCIAL STATEMENTS,NOTE 2. C. CONSOLIDATED MOVEMENT IN WORKING CAPITAL BALANCES,129,129,"NHS GRAMPIAN ANNUAL REPORT AND ACCOUNTS FOR YEAR ENDED 31 MARCH 2025 FINANCIAL STATEMENTS Note 2C. CONSOLIDATED MOVEMENT IN WORKING CAPITAL BALANCES NHS GRAMPIAN NHS GRAMPIAN CHARITY FUNDS INTRA GROUP ADJUSTMENTS CONSOLIDATED TOTAL Opening Closing Net Opening Closing Net Opening Closing Net Opening Closing Net Balances Balances Movement Balances Balances Movement Balances Balances Movement Balances Balances Movement 2024/25 2024/25 2024/25 2024/25 2024/25 2024/25 2024/25 2024/25 2024/25 2024/25 2024/25 2024/25 £’000 £’000 £’000 £’000 £’000 £’000 £’000 £’000 £’000 £’000 £’000 £’000 INVENTORIES Balance Sheet 9,356 8,168 9,356 8,168 Net Decrease 1,188 0 0 1,188 TRADE AND OTHER RECEIVABLES Due within one year 131,618 62,788 812 1,268 (529) (601) 131,901 63,455 Due after more than one year 94,672 140,657 94,672 140,657 Less: Property, Plant & Equipment (Capital) included in above (253) (442) (253) (442) 226,037 203,003 812 1,268 (529) (601) 226,320 203,670 Net (Increase)/Decrease 23,034 (456) 72 22,650 TRADE AND OTHER PAYABLES Due within one year 174,163 209,560 944 796 (529) (601) 174,578 209,755 Due after more than one year 62,041 61,031 62,041 61,031 Less: Property, Plant & Equipment (Capital) included in above (7,899) (18,363) (7,899) (18,363) Less: Intangible Assets (Capital) included in above 0 0 0 0 Less: General Fund Creditor included in above (5,302) (10,088) (5,302) (10,088) Less: Lease and PFI Creditors included in above (66,248) (65,713) (66,248) (65,713) 156,755 176,427 944 796 (529) (601) 157,170 176,622 Net Increase/(Decrease) 19,672 (148) (72) 19,452 PROVISIONS Balance Sheet 247,662 235,893 4,544 5,065 0 0 252,206 240,958 Net Increase (11,769) 521 0 (11,248) NET MOVEMENT (Decrease)/Increase 32,125 (83) 0 32,042 128",259
