doc_id,report_year,period_end_date,report_year_source,run_date_utc,part,section_title,subsection_title,page_start,page_end,section_text,word_count
Shetland-2023-2024,2023-24,,pdf_cover,2026-02-25T10:52:44+00:00,Unknown,Unscheduled Care,Unknown,26,30,"For the first time since the statistic was introduced in 2022–23, NHS Shetland did not meet the target of discharging, or admitting to a ward, 95.0% of patients attending A&E within four hours. Over the course of the year, only 91.8% of attendances met the standard. Unfortunately, in 2023–24 that position has not reversed, as only 86.6% of attendances met the standard. The 95.0% target was not met in any month during 2023–24, and only three months reached 90.0% or better. In 2023–24, NHS Western Isles was the only Board to meet the 95.0% target. The Scottish average achievement rate was 69.0%. Figure 8 - A&E Discharged within 4 hours One of the initial impacts of the Covid-19 pandemic was a reduction in A&E attendance, in line with the rest of Scotland and the United Kingdom. However, as highlighted in Figure 9 below, in 2023–24 that activity is now back to pre-pandemic levels. A&E attendance activity increased 4.9% in 2023–24 compared to 2022–23, and activity in 2023–24 is now 6.0% above 2018–19 levels, the last full year where activity was unaffected by Covid-19. Part of the overall activity at A&E comes from tourists, visiting commercial shipping vessels, and air ambulance transfers from North Sea platforms. This accounted for 921 attendances in 2023–24, 11.2% of overall activity. In comparison, in 2022–23 there were 844 such attendances, 10.8% of overall activity. In respect of those that attended A&E in 2023–24, only 19.8% were admitted to hospital, compared to a Scottish average of 24.6%. In 2022–23, 21.8% of those who attended A&E were admitted to hospital, against a Scottish average of 24.4%.
- Waiting Times Targets - Secondary Care Figure 10 below illustrates the Board has not achieved the 18-week access standard from GP referral to outpatient appointment and/or treatment in Shetland over the last five years, averaging around 84.7% against the 90% performance standard. In 2023–24, no Board in Scotland met this target and, at 82.3%, Shetland had the best performance out of all 14 territorial boards. In 2022–23, no Board in Scotland met this target, and Shetland had the second best performance out of all Boards, at 87.1%. Sustainably reducing delayed discharges is not driven by a desire to reduce delay- figures through rapid discharge, which could result in inappropriate residential care placements. Rather our strategy-driver locally is to get people back to the most appropriate community setting in line with our second key organisational objective: “provide quality, effective and safe services, delivered in the most appropriate setting for the patient.” Figure 10 - 18-week access standard from GP referral to outpatient appointment and / or treatment in Shetland
the best performance at 87.6%. This compares negatively to the prior year, 2022–23, when this target was met twice, with July 2022 at 91.2% being the best performance. Our lowest month for achievement in 2023–24 was February 2024, at 71.0%. In comparison to 2022–23, September 2022 at 79.8% was the lowest. Performance in meeting the 95% target of a first outpatient appointment within 12 weeks has been the primary issue in not meeting the 18-week access standard. The struggle to meet the 12-week access target to first outpatient appointment has meant NHS Shetland has also been unable to meet the Referral to Treatment Target (RTT) in a number of specialities. This is largely due to our reliance on visiting services, and has in turn influenced our overall performance against the RTT. In 2023–24, only 73.6% of new outpatient appointments met the standard. This performance is down on the 2022–23 achievement rate of 77.5%. In both years, Shetland had the second highest achievement rate in comparison to other territorial Boards. At year-end, the Board’s performance against the 12-week target for outpatients in 2023–24 deteriorated in relation to 2022–23, with 592 outpatient appointments waiting longer than 12 weeks at 31 March 2024, compared to 405 at 31 March 2023. In 2023–24, Ear Nose and Throat cases accounted for the greatest proportion of those waiting, with 32.9% of these delays, 195 cases. This compares to only 17.3% of delays, 70 cases, from Ear Nose and Throat appointments in 2022–23. In 2022–23, Orthopaedics accounted for most of the delays at 24.2%, 98 cases. However, in 2023–2, Orthopaedics accounted for only 16.6% of delays, with 98 cases. For new outpatient cases, 267 patients had been waiting longer than 26 weeks for their first appointment as at 31 March 2024, an increase of 110.2% from the 127 patients waiting over 26 weeks at 31 March 2023. Figure 11 - Waiting less than 6 weeks in respect of one or more of the 8 key diagnostic tests
standard for patients to wait less than six weeks for one or more of the eight key diagnostic tests, at 92.1%. It only failed to meet this target during the pandemic. At 31 March 2024, the number of patients waiting longer than six weeks stood at 34, a slight increase on 32 at 31 March 2023. However, the total number of diagnostic tests undertaken increased by 41.3%, from 3,736 in 2022–23 to 5,278 in 2023–24. The cancer targets require 95% of patients to start cancer treatment within 62-days of referral with suspected cancer, and for patients diagnosed with cancer to receive their first treatment within 31-days of the “decision to treat”. Figure 12 - Cancer: 62-day standard from referral to start of treatment for newly diagnosed primary cancers Figure 12 above shows the Board’s joint cancer pathways with NHS Grampian did not maintain 100% compliance with the 62-day treatment target in any year over the last six years. In 2023–24, performance was still significantly below the target as 15 patients’ treatment-time wait exceeded the 62-days target. This is a slight improvement in comparison to 2022–23, when 22 patients’ treatment-time wait exceeded the target. A principal factor behind the non-compliance was access to diagnostic services provided by NHS Grampian, which is working to improve patient flow in this pathway for all the Health Boards they manage. However, regarding the 31-day cancer treatment target, Figure 13 below shows NHS Shetland’s joint pathway with NHS Grampian has consistently maintained full compliance over the last six years. The 31-day performance standard over the last four years has seen every patient’s treatment plans meet the standard with 100% achievement rate.
for newly diagnosed primary cancers NHS Shetland is actively participating in the Detecting Cancer Early Programme. The Board continues to actively manage its general waiting times and cancer targets, and is working closely with NHS Grampian to reduce delays and improve access. While overall the Board continues to have some of the best access-target performance across Scotland, we recognise we will continue to experience risks in sustaining performance, particularly where individual visiting services have staffing issues. Work continues to make all pathways sustainable, as well as to address the additional requirement to work through the backlog. The Board’s access performance is publicly available throughout the year. The most up-to-date selected statistics and summary information can be found on NHS Scotland’s NHS Performs website , while the Public Health Scotland website publishes all national performance measures in more detail. Public Health Scotland also publishes 100 open data sets which give access to statistics and reference data for information and re-use, under Open Government Licence. Analysis of other important Non-Financial Indicators Primary Care The Scottish Government Health and Care Experience survey takes places every two years. The survey asks about people’s experiences of accessing and using General Practice care. The latest survey took place in November 2023, and the results are available on the Public Health Scotland website . In Shetland 3,599 survey forms were issued with 1,063 responses. This response rate at 29.5% was higher than the Scottish average of 20.4%. The overall feedback in responses was generally positive. An extract from the website",1296
Shetland-2023-2024,2023-24,,pdf_cover,2026-02-25T10:52:44+00:00,Unknown,Figure 14—Extract from Health and Care Experience Report published by Public,Unknown,31,37,"these include a positive result of 73% on doctor appointment three or more days in advance. Only four questions in the latest survey had a positive value under 50%. Figure 14—Extract from Health and Care Experience Report published by Public Health Scotland showing “Most positive and negative experience ratings” related to GP Services NHS Shetland is directly responsible for operating nine out of ten local practices. There are currently a number of vacancies in these practices, resulting in the use of temporary staff. The independent practices are also facing recruitment challenges . Primary Care Improvement funding from the Scottish Government initiative is supporting the redesign of local services to improve access and quality of service provision across the isles. In line with the new GP contract, the purpose of this initiative is to create a focus on sustainable multi-disciplinary team working. Public Health including Health Improvement and Tackling Health Inequalities Teams within the Public Health directorate continue to co-ordinate and deliver health
population screening, behaviour change and preventative services, strategic planning, business continuity planning and resilience work, and collaborative working with community planning partnership and other partners. In terms of healthcare public health, we led the development of three Managed Clinical Networks (on frailty, cardiovascular, and respiratory) with a strong focus on prevention and adhering to the principles of Realistic Medicine. - Good Mental Health for All Good Mental Health for All is a multi-agency project that aims to develop a refreshed mental health and wellbeing strategy for Shetland. During 2023, as its first phase, the project undertook an engagement exercise and published an evidence base. The next phase will be to use this evidence to develop an outcomes-based Good Mental Health for All Strategy, with a priority focus on higher prevalence areas, early intervention, health inequalities, and mental health throughout the course of life. - Vaccination and Immunisation Vaccination is one of the most effective public health interventions to prevent ill health and premature mortality. The Public Health and Vaccination Teams are responsible for the co-ordination of multiple population vaccination programmes. The following programmes were delivered during 2023–24: Spring Covid-19, Autumn/Winter flu and Covid-19 , pneumococcal, shingles, baby and pre-school immunisations, human papilloma virus (HPV) teenage boosters and meningitis vaccinations in schools, bacille Calmette-Guerin (BCG) for high risk individuals, pertussis for pregnant women, HPV, mpox, and hepatitis vaccination in the sexual health clinic, and occupational vaccinations. Uptake of Covid-19 vaccination during the Autumn/Winter programme was 62.8% (56.6% for Scotland) among all eligible groups. Flu vaccination uptake for adults was 59.1% (53.7% for Scotland). NHS Shetland commenced a rolling audit of pre-school vaccination uptake in order to ensure accurate recording and proactively offer catch up vaccinations, including measles, mumps and rubella (MMR) vaccinations. Further work was also undertaken to look at inequalities in screening, including close working with the Learning Disabilities Team and exploring health literacy. - Health Improvement Programmes During 2023–24, the Health Improvement team launched the new Healthy Shetland website , and continued its work throughout Shetland to improve the health and wellbeing of individuals or communities. A key theme is enabling and encouraging healthy choices, as well as addressing underlying determinants of health such as poverty, housing, working conditions, educational opportunities, and life and work skills. During 2023, staff undertook a review of services through the ‘trauma-informed lens’ to support trauma-informed practice. There has been further work publicising and producing bespoke reports from our population health survey , which will form the
Your Way service, Counterweight and HENRY programmes, along with awareness- raising campaigns and community activities. Further information on Public Health activity is available through the Public Health Annual report 2022–23 , including details on our actions to tackle inequalities locally. The report also focuses on climate change, which cuts across all our areas of work, both within the Health Board and working with partners, including on a Shetland Climate Change Strategy , and raising awareness of the health impacts of climate change. In respect of inequalities, the Board discussed and approved the Shetland Public Protection Committee Annual Report 2022–23 , the Shetland Children’s Partnership Plan 2023–26 and Shetland’s fifth Annual Child Poverty Action Report . Health inequalities worsened considerably during the pandemic and continue to do so, as highlighted in the Population Health Survey . Money Worries sessions were delivered locally in partnership with Citizens Advice Bureau . Work continues with our partners on the Annual Child Poverty Action Report , and reducing inequalities and inequity in the population. Infection Control Healthcare Associated Infection (HAI) reports are presented at each Board meeting . Work to prevent HAI, including Staphylococcus aureus bacteraemia, Clostridium difficile (C.diff), and E Coli Bacteraemias continues, with local surveillance and monitoring of every individual case both in hospital and in the community. Regular reports to the Board also include audit-compliance performance data, highlighting trends in hand hygiene, cleaning, and estates monitoring. Overall, the data demonstrates a high standard of infection prevention and control in NHS Shetland, with a strong audit programme demonstrating compliance to national standards. The positive Healthcare Environment Inspectorate inspection reports across the years reflect this diligence. In 2023–24, however, no external audit was undertaken by HIS . Sustainability and Environmental Reporting The Climate Change (Scotland) Act 2009 originally set out measures the Scottish Government would adopt to reduce emissions in Scotland by at least 80% by 2050. The Climate Change (Emissions Reductions Targets) (Scotland) Act 2019 amended this longer-term target to net-zero by 2045, five years in advance of the rest of the UK. In 2020, “The Climate Change (Scotland) Amendment order” came into force to reflect this, and it now requires NHS Boards to report on progress in delivering emissions reduction targets. All designated Major Players (of which NHS Shetland is one) are required to submit an annual report to the Sustainable Scotland Network, detailing compliance with the climate change duties imposed by the Act and the Amendment order. The information returned by the Board is compiled into a national analysis report, published annually, superseding the prior requirement for public bodies to publish individual sustainability
Change Plan 2018–2032 , while national reports can be found on the Sustainable Scotland Network website . In meeting our sustainability obligation, NHS Shetland engaged with specialist consultants to develop an NHS Shetland Net Zero Route map to achieve the current Scottish Government targets. The Board’s route map: - sets out NHS Shetland’s baseline impact-assessment on the environment at 4,163 tonnes of carbon dioxide equivalent (tCO2e); - identifies actions to take to meet its mandatory sustainability targets; - notes roughly 48% of emissions are associated with patient transport; and - explains the replacement of the Gilbert Bain Hospital, which accounts for roughly 30% of emissions, is a key factor in achieving its targets. Although the Scottish Government announced a pause in major capital expenditure, the Board believes this to be merely a delay and there is still commitment to a new facility. NHS Shetland is using the NHS Scotland Climate Change Adaptation Assessment Tool to assess the risks and produce an Adaptation Action Plan. This created our Climate Change Risk Assessment submission to Scottish Government. The Board is committed to sustainability and reducing its impact on the environment, as originally laid down in the Scottish Health Technical Memorandum 07–02 and the recent amendments to this that change the baseline to 2018 and shorten the timeframe to complete the targets. In line with this, the Board has taken the following actions: - Continued to implement our Sustainability and Environmental Management Policy with a sustainable development action plan; - Nominated a Green Champion, Board Chair Gary Robinson; - Working in partnership with ZetTrans on progressing a local sustainable transport strategy for Shetland in consultation with the community ; - Reducing our local residents’ carbon footprint by more than the nationally-set target of reducing patient travel emissions when accessing health services by 20% 2030, through: - reducing patients’ flights off-island via repatriation schemes ; - increasing the use of e-technology or telephone to deliver consultations; - using GP portals in several practices to reduce the need to visit physically; and - the modernisation of Loganair airplanes to ATR-72 models, which the airline has advised now emit 25.6% less CO2. - Continued the use of the Shetland Heat Energy and Power (SHEP) district heating system at Gilbert Bain and Montfield accommodation, Lerwick Health Centre, and Breiwick House, minimising CO2 emissions from heat energy; - Significantly increased the number of electric vehicles in the Board fleet , with 100% of fleet cars, and 69% of light commercial vehicles, electric powered, which, alongside staff travel off-island also benefiting from the modernisation of
travel emissions by 2030; - Given staff access to a car salary-sacrifice scheme, allowing them to upgrade their personal vehicles to lower-emission or zero-emission models, helping lowering our grey fleet impact on the environment; - Given staff access to an Eco Energy salary sacrifice scheme , allowing them to upgrade their home-heating systems to sustainable options, helping reduce energy consumption and its impact on the environment; - Maintained a fleet of 12 electric bicycles located across Shetland, promoting the principles of active travel for staff business-travel; - Promoted a cycle-to-work salary sacrifice scheme; and - Entered an unsuccessful local submission to access the Scottish Central Government Energy Efficiency Grant scheme , to address local investment in renewable heat technologies and energy efficiency across all our buildings. At 31 March 2024, 91% of NHS Shetland’s permanent fleet vehicles run on electricity. The Board aims to reach 100% by 31 December 2025. NHS Shetland has an established Environmental and Sustainability Group, Waste Group, Transport Group, and Energy Group, with identified leads. It is also developing an Energy Policy collaboratively with the NHS North Energy Group, which involves five other Health Boards. Highlights of some other significant events and achievements at NHS Shetland during 2023–24 - Excellence in Care Awards 2023–24 An annual presentation and celebration of some of the best improvement work undertaken by NHS Shetland teams during the past year was held on Friday 8 March 2024 . Staff presented eleven projects to their colleagues, the Board, and the judging panel for the annual celebrating Excellence in Care Awards, 2023–24. A diverse panel of judges chose winners in five categories: prevention, person-centred care, innovation in practice, practice education, and the impact of partnership working. Chair of the judging panel Anne Armstrong, Deputy Chief Nursing Officer for Scotland, said those presenting and the teams that they represented “demonstrated a very high calibre of improvement work which deserves to be shared nationally to spread new ways of working and good practice. The panel wanted to convey to everybody that what was presented was outstanding. What really shone through was the focus on putting the patient and their families at the centre of care and how that had such a positive impact on the quality of the patient’s experience and the quality of their care.” - Staff Nurse Lois Gaffney wins RCN Scotland Student Nurse of the Year Award Staff Nurse Lois Gaffney won Student Nurse 2022 at the RCN Scotland Nurse of the Year Awards held in Edinburgh in June 2023. Lois Gaffney won the prestigious Student
take up nursing as a career in a remote and rural setting. - Supporting parents and carers of children with Autism CAMHS has successfully started a programme that supports parents and carers of children and young people aged 5-18 who have a diagnosis of an Autism Spectrum Condition (ASC), or who are on the ASC pathway for assessment. The Cygnet group, which is a parental support programme created by leading children’s charity Barnardo’s , was piloted over a two-month period, with the last session taking place in June. Due to the positive feedback and high demand, a second group started the programme in September 2023. Figure 15 - participants in the Cygnet group programme - Da Sletts Path Shelter The Health Improvement Team led a project to install a shelter of four brightly coloured upturned boats , based on the ‘Shetland Maid’ boat-type , along the Sletts. They provide a scenic resting stop on the path behind Lerwick Health Centre for patients, staff, and the public to use. Figure 16 - Board Chair Gary Robinson with Health improvement Practitioner Kathleen Anderson inside Da Sletts Path Shelter
The Living Well Hub is designed to build on local initiatives, combining what is already working, making connections within and across health, community and social care, joining up good practice, and strengthening common sense, empowerment and trust. The expansion of the initiative saw a third hub open in June 2023, in Bressay . - Dental Students Outreach Clinics For the first time, NHS Shetland Dental Service welcomed visiting students from the University of Dundee Dental School . As part of undergraduate training, all dental students must undertake care at outreach centres, to increase their experience and provide treatment in a setting other than the dental school. This initiative not only provides treatment for the community, but also introduces dental students to Shetland , potentially enticing them to return in future to take up jobs and improve dental service provision. Events after the end of the reporting year None. Section 6—Approval and signing of the Performance Report Signed by Brian Chittick, Chief Executive as Accountable Officer 25 June 2024",2211
Shetland-2023-2024,2023-24,,pdf_cover,2026-02-25T10:52:44+00:00,Unknown,The Accountability Report,Unknown,38,38,"Corporate Governance Report Directors’ Report - Date of Issue The Accountable Officer authorised these audited accounts for issue on 25 June 2024 as that was the date the accounts were approved by the Board. - Appointment of auditor The Public Finance and Accountability (Scotland) Act 2000 places personal responsibility on the Auditor General for Scotland to decide who will audit each Scottish health body. For the financial years 2022–23 to 2027–28, the Auditor General appointed Audit Scotland to audit NHS Shetland. - Board membership Board membership Executive Board Members Position Held Brian Chittick [from 1 July 2023] Chief Executive Michael Dickson [until 30 June 2023] Chief Executive Kirsty Brightwell Medical Director Kathleen Carolan Director of Nursing and Acute Services Colin Marsland Director of Finance Director of Human Resources and Lorraine Hall Support Services Susan Laidlaw Director of Public Health Non-Executive Board Members Position Held Gary Robinson Chair Natasha Cornick Vice Chair Jane Haswell [until 5 May 2023] Lincoln Carroll Colin Campbell Joseph Higgins Whistleblowing Champion Kathy Hubbard Gaynor Jones [from 6 November 2023]",173
