doc_id,report_year,period_end_date,report_year_source,run_date_utc,part,section_title,subsection_title,page_start,page_end,section_text,word_count
Shetland-2023-2024,2023-24,,pdf_cover,2026-02-25T10:52:44+00:00,Unknown,Unknown,Unknown,1,3,"NHS Shetland Annual Report and Accounts for the Year Ended 31 March 2024
Table of Contents Annual Accounts and Notes for Year Ended 31 March 2024 ..................................... 1 Performance Overview Report ............................................................................... 1 Analysis of Financial Performance........................................................................ 15 Analysis of the Clinical Key Performance Statistics .............................................. 20 Analysis of other important Non-Financial Indicators ............................................ 27 Highlights of some other significant events and achievements at NHS Shetland during 2023–24 ..................................................................................................... 32 The Accountability Report ........................................................................................ 35 Corporate Governance Report ............................................................................. 35 The Statement of Accountable Officer’s Responsibilities ...................................... 38 The Statement of Board Members’ Responsibilities ............................................. 39 Governance Statement ......................................................................................... 40 Remuneration and Staff Report ............................................................................ 52 Staff Report .......................................................................................................... 62 Independent auditor’s report to the members of NHS Shetland, the Auditor General for Scotland and the Scottish Parliament ................................................................. 70 Reporting on the audit of the financial statements ................................................ 70 NHS Shetland Statements and Summaries ............................................................. 75 Statement of Consolidated Comprehensive Net Expenditure (SoCNE) for the Year Ended 31 March 2024 .......................................................................................... 75 Consolidated Statement of Financial Position as at 31 March 2024 ..................... 76 Consolidated Statement of Cash Flows (CFS) for the Year Ended 31 March 2024 .............................................................................................................................. 78 Consolidated Statement of Changes in Taxpayers’ Equity for the Year Ended 31 March 2024 ...................................................................................................... 80 Consolidated Statement of Changes in Taxpayers’ Equity—Prior Year, Ended 31 March 2023 ...................................................................................................... 81 Note 1—Accounting Policies ................................................................................ 83 Basis of Consolidation .......................................................................................... 84 Note 2—Notes to the Cash Flow Statement ......................................................... 99 Note 3—Expenditure .......................................................................................... 102 Note 4—Operating Income ................................................................................. 104
Note 5—Segmental Analysis .............................................................................. 105 Note 6—Intangible Assets .................................................................................. 106 Note 7a—Property, Plant and Equipment—Consolidated and Board ................. 107 Note 7b—Assets Held for Sale—Consolidated and Board ................................. 113 Note 7c—Property, Plant and Equipment Disclosures ........................................ 113 Note 8—Inventories and Work in Progress ......................................................... 115 Note 9—Trade and Other Receivables ............................................................... 116 Note 10—Investments ........................................................................................ 120 Note 11—Cash and Cash Equivalents ............................................................... 120 Note 12—Trade and Other Payables.................................................................. 121 Note 13—Provisions ........................................................................................... 123 Note 14—Contingent Liabilities .......................................................................... 127 Note 15—Events after the end of the reporting year .......................................... 127 Note 16—Commitments ..................................................................................... 128 Note 17—Leases Assets .................................................................................... 128 Note 18—Pension Costs .................................................................................... 129 Pension Scheme Declaration ............................................................................. 129 Note 19—Financial Instruments ......................................................................... 133 Note 20—Related Party Transactions ................................................................ 140 Note 21—Consolidation of Subsidiaries and Disclosure of Interest in Associates and Joint Ventures .............................................................................................. 142 Glossary of commonly abbreviated terms and acronyms, as well as local terms, in the report ................................................................................................................ 155 Direction by the Scottish Ministers ......................................................................... 158",405
Shetland-2023-2024,2023-24,,pdf_cover,2026-02-25T10:52:44+00:00,Unknown,Performance Overview Report,Unknown,4,6,"Annual Accounts and Notes for Year Ended 31 March 2024 Performance Overview Report Section 1 - Chief Executive’s Statement It gives me great pleasure to compose the Chief Executive’s statement on the Annual Accounts for the first time since assuming the role in July 2023. Despite 2023–24 being another challenging year, the organisation has made significant progress in establishing the conditions to become a sustainable health and care system. This progress is on top of the organisation’s response to the ever-increasing challenges, which includes increased demand on our services and on the resource required to meet this demand. The biggest challenge we face is attracting and keeping a sustainable workforce with the appropriate skill sets to deliver the wide range of services NHS Shetland provides, both in the acute setting and within the community. When I embarked on my new role leading NHS Shetland I set out my Chief Executive Priorities, which are to focus on eight key areas: - Strategic Planning - Workforce - Valuing Staff - Culture - Sustainability - Quality and safe service provision - Technology and Digital Strategy - Partnership Working On reflection, it is important to note the organisation has progressed well within these eight key priority areas. The Board has spent the last nine months redefining its vision and strategic intent and this work has culminated in the approval of a new five-year Strategic Delivery Plan : - Our Vision Everyone in Shetland can live well for longer, and easily access the support they need from us. - Strategic Intent To provide easy access to high quality, sustainable and person-centred care as close to home as possible and make a meaningful difference to the building blocks of good health in our communities. The Board has also approved a Digital Strategy , and a Financial Recovery and Sustainability plan. These strategies are interlinked and are concurrently being operationalised into delivery plans. The missing piece of the jigsaw from a strategy perspective is a workforce plan, which will be working upon in 2024–25 to address the
of these strategies help with sustaining our system over the next five to ten years. Despite challenges, NHS Shetland managed to sustain good performance when benchmarked across NHS Scotland. Data from the hospital continues to show good integrated working across the Health and Social Care Partnership, which is improving the patient journey through our system. We have seen an improvement in delayed discharge instances, longer cases and bed days. Optimising the discharge process is allowing shorter stays in hospital, minimising risks to patients, while good communication, discharge planning and post-discharge support is maintaining low rates of emergency readmission. Having remobilised elective services post-pandemic, local rates of activity have been maintained. Whilst operational pressures in partner boards have impacted on access to some investigations and treatments for our patients, where we are able to deliver these locally the Board is continuing to perform well, for example against the 31-day cancer target. Access to diagnostics has again remained above the national target, with more than 90% of people meeting the six-week target for eight key diagnostic tests. This is a really important step in being able to get the right treatment at the right time. Mental Health services continue to see high levels of referrals, and CAMHS (Child and Adolescent Mental Health Service) and alcohol and drug treatment access times continue to meet targets, which is really positive for these groups who we know can really benefit from timely access to specialist support. While we have not met the Psychological Therapies waiting times target, access has improved year on year, as there has been more stability in the Psychological Therapies Team. The team is looking at options to work more closely with our regional colleagues to make the service stronger still and give better outcomes for our patients. Our organisation has refocused on recruitment and retention and in particular the “grow your own” ethos across all roles. We have linked up strategically with employment partner Developing the Young Workforce , which has helped us to expand our employer exposure and recruitment footprint within Shetland. We had over 20 services and related roles highlighted at a careers event in October, and we also had a presence at the apprentice event in February as we look to develop apprentice opportunities across NHS Shetland. Some of our teams have also visited schools, highlighting employment opportunities within our organisation. Over the last year, we have tried to listen and understand about what matters to staff, both inside and outside of the working environment, to provide insight into how we can better retain our staff. We have heard about the challenges regarding accommodation and childcare. I have also tried to be a better communicator, for example with the Chief Executive Monthly Organisational Brief meetings for all staff, to ensure everyone is kept abreast of organisational developments, as well as the Keep Calm and Have a Yarn sessions to hear directly from staff regarding the challenges they are facing. Our evolution to becoming a truly listening and learning organisation is underway, demonstrated by our adoption of the staff-led safe space called “Spaces for Listening”, as well as a change in our culture regarding reflecting our learning back into the
by the successful completion by two cohorts of the Leading Empowered Organisations course, as well as good representation on some of the national leadership development pathways. We have been successful in our application to be a demonstrator site in the Primary Care Phased Improvement Plan. This is an 18-month quality improvement project being undertaken in collaboration with the Scottish Government and Healthcare Improvement Scotland (HIS) to improve community access to pharmacy and primary care services across Shetland, and it links well with our locality-based approach to providing health and care. From a capital investment perspective, we have had to pause the activity within our Programme Initial Agreement project, which had been considering the requirements of our health and care campus for the foreseeable future. The focus will now turn to ensuring we can sustain our real estate for the next 10 to 15 years. On a more positive note, we remain on track to deliver a functioning MRI (magnetic resonance imaging) scanner by the end of summer 2024. As we look ahead to 2024–25, we will continue to deliver against our key strategies to ensure our community can live healthier for longer, working with our partners and stakeholders to ensure NHS Shetland remains in the heart of our community, and that community remains at the heart of NHS Shetland. Finally, I would like to focus on our staff who have worked tirelessly to support those for whom they care. To see how committed they are to supporting our community despite the challenges they face is humbling. On behalf of the Board, I would like to express my gratitude and appreciation to all our staff, partners, and stakeholders who have worked fantastically well to ensure the provision of high-quality health and social care to people in Shetland. Brian Chittick, Chief Executive, NHS Shetland",1173
Shetland-2023-2024,2023-24,,pdf_cover,2026-02-25T10:52:44+00:00,Unknown,Section 2 - Overview,Unknown,7,7,"This overview will give the reader a summary of what an NHS Board does. It will also describe the nature of NHS Shetland, our purpose, the key risks to the achievement of our objectives , and our performance during 2023–24. - NHS Board Purpose Shetland Health Board (“the Board”) was established under the National Health Service (Scotland) Act 1978 with responsibility for providing health care services for the residents of Shetland. NHS Shetland is the operating name of Shetland Health Board. An NHS Board governs its own local health system. The Board is responsible for improving the health of its local population and delivering the healthcare that population requires. The overall purpose of the Board is to provide strategic leadership and direction, and to ensure the efficient, effective and accountable governance of the local NHS system. Specific roles of the Board include: - improving and protecting the health of the local people; - providing an improved health service for local people; - focusing clearly on health outcomes and people’s experience of their local NHS system; - promoting integrated health and community planning by working closely with other local organisations; and - providing a single focus of accountability for the performance of the local NHS system. The work of the Board includes: - strategy development - to develop an Operational Plan for the area; - implementation of the Operational Plan; - resource allocation to address local priorities; and - performance management of the local NHS system. - The nature of NHS Shetland NHS Shetland is domiciled in Scotland and our headquarters location is Upper Montfield, 24 Burgh Road, Lerwick, Shetland, ZE1 0LA. NHS Shetland and Shetland Islands Council (SIC) cover the same area and have the same boundaries, working jointly through our Health and Social Care Partnership . The map in Figure 1 below shows the Shetland Islands, which has a population of around 23,000 people, distributed across 16 of the 100 islands. These islands cover a land mass of 567 square miles. The North Sea surrounds the Isles that have a coastline 1,679 miles long.",345
Shetland-2023-2024,2023-24,,pdf_cover,2026-02-25T10:52:44+00:00,Unknown,Figure 1—Map of Shetland,Unknown,8,8,"Figure 2 below outlines a summary of NHS Shetland’s organisational structure. The detailed organisational management structure for NHS Shetland is available on our website, along with the organisational governance structure . Figure 2 - Diagram of NHS Shetland Summary Organisational Structure NHS Shetland provides health care services from 21 sites across Shetland, including ten Health Centres , Breiwick House, and Acute and Specialist Services from the Gilbert",67
Shetland-2023-2024,2023-24,,pdf_cover,2026-02-25T10:52:44+00:00,Unknown,Directly Provided Healthcare,Unknown,9,11,"services from partners. - Table 1 - NHS Shetland at a glance Directly Provided Healthcare Commissioned Healthcare Services 1 GP Practice with 823 registered patients 9 General Practitioner (GP) Practices with 22,028 registered patients Community Healthcare Service 2 Ophthalmic Practices Dental Services from 5 locations 1 Independent Contractor NHS Dental Practice Gilbert Bain Hospital during 2023–2024 5 Pharmacy Contractors Acute and Specialist Services: NHS Grampian - Acute and Maternity - 9,271 in-patient bed-days Services - 2,149 day cases Golden Jubilee - Orthopaedic Services - 46,185 outpatients (10,951 new) NHS Lothian - Acute Services - 46 births NHS Greater Glasgow and Clyde - Acute Services - 8,232 A&E (Accident and Emergency) attendances CAMHS , Breiwick House NHS Tayside - Specialist Mental Health Services for Adults , and Young People Adult Community Mental Health NHS Grampian - Mental Health Services Service Public Health Tertiary Specialist Services - Summary of NHS Shetland Priority Outcomes in 2023–24 The 2023–2024 Annual Delivery Plan (ADP) was submitted to Scottish Government in June 20203. Scottish Government formally approved the plan on 2 August 2023. This was NHS Shetland’s strategy to address the “recovery and renewal” phase of the Remobilisation, Recovery and Redesign Framework for NHS Scotland. The ADP is centred on 10 recovery drivers, which have been developed by the NHS Scotland team and will form part of the planning guidance for the coming years, working towards sustainable delivery of healthcare that also improves population health and reduces health inequalities. The Board will also continue working in partnership with community planning partners to prioritise preventative work to reduce the burden of preventable poor health locally. NHS Shetland engaged with the public on the key strategic issues through our Programme Initial Agreement (PIA) work in September 2023. The PIA sets out a deliverable, whole-system service and infrastructure change plan for the next 20–30 years, and brings together the ambitions of our Clinical and Care Strategy with a new
localities and communities across Shetland. Amongst the feedback in the PIA consultation, travel to Aberdeen was highlighted as a challenge, together with the provision of accommodation in Aberdeen. As highlighted in the performance analysis, remobilisation and redesign brought services closer, to minimise the need for travelling off island for 2,229 patients attending out-patients, plus a further 312 patients who accessed the visiting mobile MRI scanner . These are areas the Board is already seeking to address. The permanent community funded MRI scanner at the Gilbert Bain Hospital came one-step closer when the building that will house the permanent MRI scanner arrived on 28 February 2024. The MRI Scanner arrived in May 2024, with the opening date for the service planned for summer 2024. Almost half of the comments from the PIA engagement highlighted areas to celebrate, including highlighting the service in Primary Care which was seen to have great staff and short waiting times. The Ask my GP and Video Conferencing services were seen as very good, offering the right support quickly and saving on travel time. A number of people highlighted the excellent service offered by the NHS, the hospital and staff in general. Figure 3 - PIA Consultation Feedback – Areas to be Celebrated - Section 3 - Risk and Uncertainty The Board’s risk management strategy sets out the principles and approaches to risk management, which are to follow throughout NHS Shetland. Every risk is assigned to a specific Governance Committee.
2023–24, with an interim report going to a Board meeting in December 2023 and a further update in April 2024. The Board reviewed the Risk Management Summary Report for 2023–24 and work plan for 2024–25 at its April 2024 Board meeting. - Top Underlying Risks in NHS Shetland 2023–24 Strategic Risk Register The top risks in NHS Shetland 2023–24 Strategic Risk Register , excluding finance, are summarised in Table 2 below. The principal recurring themes amongst these risks are: - Workforce, SR08; - Cyber security, SR17; and - National Standard, SR13: Key Performance Targets ( Table 4 and Performance Analysis Report ). The Strategic Risk Register SR02 , in respect of the Board’s financial performance, is reviewed in Section 4 within the Finance Performance review . - Table 2—Top Risks in NHS Shetland 2023–24 Strategic Risk Register Theme Risk Description SR08: Workforce Then there will be a negative impact on the service delivery, - If we fail to existing staff and patients care. Resulting in: attract and recruit - reduction in services delivered; to vacancies or - increased workload of existing staff causing negative retain essential impact on staff well-being which may cause increased skills and absences; knowledge within - increased risk of poor patient experience and outcomes; the organisation and - increased reliance on agency or temporary staff causing increased cost that creates a short to medium term financial sustainability issue. Mitigation: Review and redesign the current workforce model. Looking at alternative delivery models and new ways of working. Staff recruitment website , review of our recruitment process and attempt to attract staff from overseas in-line with the rest of Scotland. SR17: Cyber – IT If a sole actor or orchestrated cyber-attack occurs, NHS Shetland (Information could experience system downtime and/or loss of data and/or Technology) data disclosure. Failure Due to This could result in disruption to services caused by system Cyber Attack downtime, risk of delays in treatment, risk to public reputation and significant financial costs for a full system recovery. Potential loss of internet cable to access system has occurred. Mitigation: Multiple layers of technical controls in place including anti-malware, firewalls, intrusion detection, access logging,",921
Shetland-2023-2024,2023-24,,pdf_cover,2026-02-25T10:52:44+00:00,Unknown,Risk Description,Unknown,12,12,"encryption, web filtering, advanced threat protection, software patching. Cyber awareness communications, staff training to highlight security issues and national fraud concern warnings and our Information Governance Strategy . SR13: Access to If there are significant gaps due to recruitment, retention or services funding there may be a negative impact on service delivery, existing staff and patient care, resulting in us failing to provide services due to sickness absence or failure to meet key national targets or access to local services . Mitigation: Waiting Times Group has governance in place to monitor national Treatment Time Guarantee breaches and react to identify remedial action to address issues. Board has oversight via performance scorecard reporting to Finance and Performance Committee and Board. - Workforce is a recurring theme behind the top risks NHS Shetland’s workforce is a common theme in the Strategic Risk register. It is essential to have the right staff in the right place to meet peaks in demand, as well as to ensure continual sustainable service provision, which relates to the fifth key objective of NHS Shetland . The most significant risk to the delivery of quality patient-centred services, as well as the sustainable recurring financial balance of NHS Shetland, is the recruitment and retention of staff. Audit Scotland previously identified in NHS Scotland workforce reviews that NHS Shetland has the highest staff turnover rate at almost twice the Scottish average. In 2023–24 although staff turnover was down on the 2022–23 high of 19%, it remains relatively high at 15%. In contrast, staff sick leave continues to remains the lowest amongst the territorial boards, although it is above the Scottish Government target 4% absence rate. Actions to address this key issue: - Change of service models such as increasing the number of Advanced Nurse Practitioners and expanding digital innovation and modernising practice websites to support self-care; Host remote and rural GP recruitment hub, GP Joy for bank GP staff across seven Boards. The use of staff outside the NHS standard terms and conditions on higher cost engagement has in part been mitigated by GP Joy as a direct engagement model via third party partner TempRE and engaging staff on flexible contracts or via staff bank has helped to mitigate these costs. - Continued work with Promote Shetland , Shetland Islands of Opportunity to highlight our unique opportunities, NHS Shetland’s own website innovations with staff testimonials in addition to the standard NHS recruitment website ; and",405
