doc_id,report_year,period_end_date,report_year_source,run_date_utc,part,section_title,subsection_title,page_start,page_end,section_text,word_count
Grampian-2015-2016,2015-2016,,filename,2026-03-13T08:43:09+00:00,Unknown,ACCOUNTABILITY REPORT,Unknown,18,18,"iv) GOVERNANCE STATEMENT (cont) Performance Governance Committee The Performance Governance Committee (PGC) monitors and supports performance management arrangements across NHS Grampian and promotes a culture of continuous, system wide performance improvement. Membership: Professor Stephen Logan (Chair), Mrs Rhona Atkinson, Mr Raymond Bisset, Councillor Stewart Cree, Mrs Sharon Duncan and Mrs Christine Lester. Patient Focus and Public Involvement Committee The Patient Focus and Public Involvement Committee meet four times per year. The Committee ensures that the public is appropriately involved in the decision making process of NHS Grampian. Membership : Mrs Christine Lester (Chair), Mr Jonathan Passmore, Councillor Martin Kitts-Hayes (from 19 August 2015) and Councillor Anne Robertson (to 8 June 2015). There is also Executive Director and extensive staff, clinical, management and public representation attendance at meetings. Endowment Committee The Endowment Committee oversees the management of the NHS Grampian Endowment Funds, which had assets at 31 March 2016 valued at £41.3 million (31 March 2015 valued at £44.7 million). Membership : Mr Raymond Bisset (Chair), Councillor Stewart Cree, Mrs Sharon Duncan, Mr Alan Gray, Professor Mike Greaves and Mrs Laura Gray. 3. Scope of Responsibility As Accountable Officer, I am responsible for maintaining an adequate and effective system of internal control that supports compliance with the organisation’s policies and promotes achievement of the organisation’s aims and objectives, including those set by Scottish Ministers. Also, I am responsible for safeguarding the public funds and assets assigned to the organisation. I confirm that Grampian Health Board is compliant with the aspects of the Scottish Public Finance Manual (SPFM) 1 which are set out within the guidance issued to Chief Executives and more generally to all board members by the Scottish Government Health Directorates as being applicable to NHS Boards. In terms of enabling me to discharge my responsibilities as Accountable Officer, the following governance arrangements and processes have been in place throughout the financial year:  A Board which meets regularly to discharge its governance responsibilities, set the strategic direction for the organisation and approve decisions in line with the Scheme of Delegation. The Board comprises the Executive Directors and Non-Executive members. The Board activity is open to public scrutiny with minutes of meetings publicly available;  The Board receives regular reports on Healthcare Associated Infection and reducing infection as well as ensuring that health and safety, cleanliness and good clinical practice are high priorities for NHS Grampian;  Scheme of Delegation, Standing Orders and Standing Financial Instructions approved by the Board and subject to regular review to assess whether they are relevant and fully reflective of both best practice and mandatory requirements;  Implementation of organisation wide risk management arrangements in line with the Board’s Risk Management Policy;  Consideration by the Board of regular reports from the chairs of the performance governance, patient focus and public involvement, staff governance, clinical governance, endowment and audit committees concerning any significant matters on governance, risk and internal controls;  A focus on best value and commitment to ensuring that resources are used efficiently, effectively and economically taking into consideration equal opportunities and sustainable development requirements;",512
Grampian-2015-2016,2015-2016,,filename,2026-03-13T08:43:09+00:00,Unknown,ACCOUNTABILITY REPORT,Unknown,19,19,"iv) GOVERNANCE STATEMENT (cont)  Regular review of performance against key national targets by the Performance Governance Committee;  Clear allocation of responsibilities for ensuring that we continue to review and develop our organisational arrangements and services in line with national standards and guidance;  Allocation of responsibilities for the implementation of improvement actions to lead directors and sector management across our clinical and non-clinical activities;  Consultation on service change proposals is undertaken with stakeholders and used to inform decision making;  A patient feedback service and policies to protect employees who raise concerns in relation to suspected wrongdoing such as clinical malpractice, fraud and health and safety breaches; and  An annual general meeting of all Trustees of the NHS Grampian Endowment Funds to approve the accounts and review investment policy and strategy. 4. Purpose of the System of Internal Control The system of internal control is based on an ongoing process designed to identify, prioritise and manage the principal risks facing the organisation. The system aims to evaluate the nature and extent of risks, and manage risks efficiently, effectively and economically. The system of internal control is designed to manage rather than eliminate the risk of failure to achieve the organisation’s aims and objectives. As such, it can only provide reasonable and not absolute assurance. The process within the organisation accords with guidance from Scottish Ministers in the SPFM and supplementary NHS guidance, and has been in place for the year up to the date of approval of the annual report and accounts. 5. Risk and Control Framework All NHS Scotland bodies are subject to the requirements of the SPFM and must operate a risk management strategy in accordance with relevant guidance issued by the Scottish Ministers. The general principles for a successful risk management strategy are set out in the SPFM. The following arrangements and processes have been in place throughout the year:  The risk management plan sets out the importance of risk management to the delivery of our objectives, the responsibilities of staff across NHS Grampian, the supporting organisational arrangements for the identification, assessment and reporting of risks and the steps to be taken to develop and implement mitigating action.  Risk management reporting includes evidence of the effectiveness of risk management arrangements and to ensure that lessons learned are fed back appropriately into the process.  We have implemented an assurance framework which is used by each of the core governance committees to identify and seek assurance regarding mitigating actions for risks that fall within their remit.  Regular reviews of the corporate risk register by the Performance Governance Committee and Executive Leadership Team and an annual review by the Board.  Risk Registers are in place at the Strategic Corporate and Sector level which set out the steps being taken to manage risks linked to delivery of corporate objectives, performance targets and key strategic projects.  Regular comprehensive and organisation wide review of our risks and ongoing development of the risk management arrangements at an operational level.  Risks associated with information that we are responsible for are subject to regular review and independent audit as part of our overall governance and risk management arrangements.",533
Grampian-2015-2016,2015-2016,,filename,2026-03-13T08:43:09+00:00,Unknown,ACCOUNTABILITY REPORT,Unknown,20,20,"iv) GOVERNANCE STATEMENT (cont)  We have an IT web enabled system to facilitate the electronic recording, assessment and mitigation reporting of risks in line with our risk management plan.  Commitment to the continuation of our programme of raising risk awareness amongst all staff on an ongoing basis. The organisation is committed to a process of continuous development and improvement, developing systems to address the key risks faced by the Board and in response to any relevant reviews and developments in best practice. In the period covering the year to 31 March 2016 and up to the signing of the accounts, the organisation has implemented the following actions to further enhance the Board’s governance arrangements and the overall system of internal control:  Close monitoring of progress against all high risk actions arising from internal audit reports, which are not closed by the due implementation date, and to report any measures necessary to progress these actions to the Audit Committee. These actions in 2015/16 included development of formal reporting arrangements to monitor performance against the 40 day statutory response period for data subject access requests, development of formal monitoring and reporting arrangements to ensure the regulatory compliance of Scottish Dental Access Initiative grant funded practices, implementation of arrangements to ensure that all communication on compliance matters is authorised by a Senior manager prior to submission to the SGHSCD, improvements to our processes for the management of correspondence with patients when their appointments change and a review of management processes for the consultation and implementation of key policy updates.  A number of improvements to our internal controls for management of locum medical staff have been implemented during the year following an investigation into a high value suspected fraudulent claim for locum medical services.  A review of controls within the transport and logistics service is in progress following a number of issues identified in our warehousing and vehicle management arrangements.  Enhanced physical arrangements for the storage of patient records were implemented during the year, following a serious flooding incident. Also the processes for the management and disposal of printouts on wards relating to patient records were improved, following two instances where records were not disposed of securely. In December 2014, three reports were issued by external bodies 2 which highlighted a number of areas  where the Board was required to take action to improve Board governance and management arrangements within Aberdeen Royal Infirmary. In response to the three reports the Board approved a comprehensive improvement programme in April 2015. As Chief Executive I have direct responsibility to the Board for implementation of the agreed actions within the improvement plan. Throughout the year monthly meetings were held with the Scottish Government Health and Social Care Directorate to report on progress being made with the implementation of the agreed recommendations.  In support of the Board’s improvement agenda our external auditor Deloitte LLP, were commissioned to carry out an independent high level review of our clinical governance arrangements. The report highlighted several areas of good practice such as Board level leadership as well as a number of areas for improvement including refinement of our organisational structure supporting clinical governance activity, greater clarity of roles and responsibilities for those involved, more consistency in reporting arrangements across sectors and the requirement for more emphasis on the assurance of patient experience and clinical effectiveness in reports. The report was shared with all Board members and, after consideration by the Audit Committee, was passed to the Clinical Governance Committee who will oversee the development and implementation of an action plan to meet the key recommendations.  NHS Board Executive and Non-Executive members have participated in development sessions during the year, as required, consistent with the Board’s commitment to continuous improvement and assessment of our performance. Actions arising from these sessions are being progressed by the Board on an ongoing basis.",647
Grampian-2015-2016,2015-2016,,filename,2026-03-13T08:43:09+00:00,Unknown,ACCOUNTABILITY REPORT,Unknown,21,21,"iv) GOVERNANCE STATEMENT (cont)  All three Integration Joint Boards (IJBs) were formally established on 6 February 2016 with full delegation of functions and resources on 1 April 2016. The Board’s internal audit programme for 2015/16 included a review of the governance and financial assurance arrangements concerning establishment of the IJBs. The scope of this review was agreed jointly by all Local Authority partners and the findings were shared with the transitional leadership groups as part of the financial due diligence arrangements undertaken by the Chief Officers prior to implementation. Best Value I can confirm that Grampian Health Board is committed to ensuring that its activities are undertaken in a manner that will secure best value in the use of public funds in line with the arrangements set out in the Scottish Public Finance Manual. The Board incorporates the principles of best value within its planning, performance and delivery activities ensuring that it is part of everyday business and integral to the Board’s decision making in all key areas. In addition, the Board continues to seek opportunities to enhance the system of internal control with a specific focus on the delivery of safe and effective patient care, achievement of priority access targets and demonstrating best value and the efficient use of resources. Review of Adequacy and Effectiveness As Accountable Officer, I am responsible for reviewing the adequacy and effectiveness of the system of internal control. My review is informed by:  Executive and senior managers who are required to develop, implement and maintain adequate internal controls across their areas of responsibility;  The work of the internal auditor, who submit to the Audit Committee regular reports which include their independent and objective opinion on the effectiveness of risk management, internal control and governance processes;  Management letters and other reports issued by external audit;  Financial plans, service plans and related organisational performance and risk management reports presented to the Board and relevant governance committees;  Reports relating to the recent reviews carried out by Health Improvement Scotland and other inspection agencies; and  Transparent assumptions regarding the timing of investment to deliver a significant reduction in high risk backlog maintenance in clinical areas agreed by the Scottish Government Health and Social Care Directorates as part of our Asset Management Plan. In addition to the above, the processes that have been applied to assist me in reviewing the effectiveness of the system of internal control include:  Annual statements of assurance from each of the core governance committees of the Board, including the Endowment Committee with respect to the governance arrangements that exist for the NHS Grampian Endowment Funds charity which is consolidated with the main Board accounts;  Written confirmation from executive and senior managers that controls within their individual areas of responsibility are adequate and have been operating effectively throughout the year;  Independent consideration of the governance statement and its disclosures by Internal Audit and the Audit Committee;  Consideration and approval of the annual accounts, including the Governance Statement by the Board; and  During the year, minutes of the meetings of the core governance committees were provided to all Board members.",526
Grampian-2015-2016,2015-2016,,filename,2026-03-13T08:43:09+00:00,Unknown,ACCOUNTABILITY REPORT,I) HAVE BEEN ADVISED ON THE IMPLICATIONS OF THE RESULT OF MY REVIEW OF THE EFFECTIVENESS OF THE SYSTEM OF,22,22,"iv) GOVERNANCE STATEMENT (cont) I have been advised on the implications of the result of my review of the effectiveness of the system of internal control by the Board and the Audit Committee and a plan to address weaknesses and ensure continuous improvement of the system is in place. Disclosures I can confirm that we have appropriate action in place to address the recommendations made by Health Improvement Scotland, as referred to above, in relation to Board governance and the management arrangements within Aberdeen Royal Infirmary. Based on the evidence considered during my review of the effectiveness of the internal control environment operating within NHS Grampian, I am not aware of any outstanding significant control weaknesses or other failures to achieve the standards set out in the guidance on governance, risk management and control. b) REMUNERATION AND STAFF REPORT i) THE REMUNERATION REPORT Remuneration of Executive and Non-Executive Members The total remuneration disclosed on pages 20 and 21 includes all amounts paid or payable by the Board in each financial year and a separate assessment of the estimated increase in the cumulative pension benefit that will be payable following retirement. Board Members Contracts of Employment The Executive Board members of Grampian Health Board are employed on permanent contracts of employment. The Non-Executive members are ministerial appointments on contracts of between two and four years. The annual remuneration of Executive and Senior Management Cohort and Non-Executive Members is determined by the Scottish Government under Ministerial Direction and in accordance with PCS (ESM) 2013/1, PCS (ESM) 2012/1, PCS (ESM) 2013/2, PCS (ESM) 2013/3, PCS (ESM) 2015/1 and PCS (ESM) 2015/2. Assessment of Performance The performance assessment process for the Executive and Senior Management Cohort is in accordance with PCS (ESM) 2013/1. Performance management and appraisal arrangements follow the nationally prescribed format and are directly linked to the improved performance of Grampian Health Board in the delivery of its objectives. Written evidence relating to the performance ratings for Executive members following review by the Chief Executive is made available to the Remuneration Committee for approval. For the Chief Executive, the process is undertaken by the Chairman. For Non-Executive members, the process is also undertaken by the Chairman and written evidence is submitted to the Cabinet Secretary for Health and Wellbeing. The progression of the Executive and Senior Management Cohort through the pay range is subject to, as a minimum, the fully acceptable performance of the individual. A National Performance Management Committee has been established as detailed in HDL(2006)54 to ensure, on behalf of the Scottish Government, the effective and consistent application of pay and performance management arrangements for NHS Scotland Executives subject to Ministerial Direction. Relationship between the highest paid Director and the workforce median remuneration The following table compares the banded remuneration of the highest paid Director against the median salary for the workforce in each year. The remuneration figures used for this calculation represent the annualised whole time equivalent salary figures. 2015-16 2014-15 Highest Earning Director’s Total 175-180 Highest Earning Director’s Total 175–180 Remuneration (£000s) Remuneration (£000s) Median Total Remuneration (£) 28,462 Median Total Remuneration (£) 28,180 Ratio 6.23 Ratio 6.24",520
Grampian-2015-2016,2015-2016,,filename,2026-03-13T08:43:09+00:00,Unknown,SUB TOTAL,Unknown,23,23,"GRAMPIAN HEALTH BOARD REMUNERATION REPORT FOR THE YEAR ENDED 31 MARCH 2016 Publication of pension benefits is required in accordance with the Financial Reporting Manual (FReM) and the Companies Act (2006). This calculation aims to bring public bodies in line with other industries in disclosing an assessed cumulative pension benefit for a standard 20 year period, which is the estimated life span following retirement. The other figures shown as part of the single total figure of remuneration relate to actual earnings payable in 2015/16. Sub Total Value of Pension Total accrued Total accrued lump Performance Total Real increase in Real increase in earnings Benefits (to be pension at sum at pensionable Cash Equivalent Cash Equivalent Salary (bands of Related Bonus Remuneration pension at lump sum at Real increase in paid in Benefits in Kind paid over 20 pensionable age at age at 31 March Transfer Value Transfer Value £5,000) (bands of (bands of pensionable age pensionable age CETV in year 2015/16 years following 31 March 2016 2016 (bands of (CETV) at 31/3/15 (CETV) at 31/3/16 £5,000) £5,000) (bands of £2,500) (bands of £2,500) (bands of retirement) (bands of £5,000) £5,000) Note £5,000) £000 £000 £000 £000 £000 £000 £000 Remuneration of: Executive Members Mr Malcolm Wright a 165-170 0 1.2 165-170 166 330-335 75-80 7.5-10 230-235 22.5-25 1,507 1,752 207 Dr Nicholas Fluck 175-180 0 0.3 175-180 75 250-255 50-55 2.5-5 160-165 12.5-15 882 968 78 Mr Alan Gray 120-125 0 3.2 125-130 26 150-155 5-10 0-2.5 0 0 84 111 27 Ms Amanda Croft (from 1/9/15) 50-55 0 0.0 50-55 33 85-90 30-35 2.5-5 90-95 7.5-10 485 558 61 Non Executive Members Chair - Prof Stephen Logan 30-35 0 0 30-35 N/A 30-35 N/A N/A N/A N/A N/A N/A N/A Vice Chair - Mrs Christine Lester d 20-25 0 0 20-25 N/A 20-25 N/A N/A N/A N/A N/A N/A N/A Mr David Anderson d 15-20 0 0 15-20 N/A 15-20 N/A N/A N/A N/A N/A N/A N/A Mrs Rhona Atkinson 5-10 0 0 5-10 N/A 5-10 N/A N/A N/A N/A N/A N/A N/A Mr Raymond Bisset d 20-25 0 0 20-25 N/A 20-25 N/A N/A N/A N/A N/A N/A N/A Councillor Stewart Cree 5-10 0 0 5-10 N/A 5-10 N/A N/A N/A N/A N/A N/A N/A Councillor Barney Crockett 5-10 0 0 5-10 N/A 5-10 N/A N/A N/A N/A N/A N/A N/A Mrs Sharon Duncan b/d 70-75 0 0 70-75 51 120-125 30-35 2.5-3 90-95 7.5-10 550 624 62 Professor Mike Greaves d 15-20 0 0 15-20 N/A 15-20 N/A N/A N/A N/A N/A N/A N/A Councillor Martin Kitts-Hayes 5-10 0 0 5-10 N/A 5-10 N/A N/A N/A N/A N/A N/A N/A Dr Lynda Lynch d 15-20 0 0 15-20 N/A 15-20 N/A N/A N/A N/A N/A N/A N/A Mr Terry Mackie d 15-20 0 0 15-20 N/A 15-20 N/A N/A N/A N/A N/A N/A N/A Dr Helen Moffat c 55-60 0 0 55-60 12 65-70 10-15 0-2.5 25-30 0 154 164 10 Mr Jonathan Passmore d 20-25 0 0 20-25 N/A 20-25 N/A N/A N/A N/A N/A N/A N/A Councillor Anne Robertson 0-5 0 0 0-5 N/A 0-5 N/A N/A N/A N/A N/A N/A N/A Mr Eric Sinclair d 15-20 0 0 15-20 N/A 15-20 N/A N/A N/A N/A N/A N/A N/A a) The remuneration disclosure for Mr Malcolm Wright reflects his earnings as an employee of NHS Education for Scotland while seconded to NHS Grampian as interim Chief Executive for the three months April to June 2015 and for the nine months July 2015 to March 2016 as an employee of NHS Grampian following his permanent appointment to the role. b) Mrs Sharon Duncan worked in a full time capacity as Employee Director of NHS Grampian. c) The remuneration disclosure for Dr Helen Moffat includes total earnings both in her part time role as a Clinical Psychologist with NHS Grampian and for her additional duties as an NHS Board member. d) Non Executive Board Members who were members of Transitional Leadership Groups for the Health and Social Care Partnerships and who assume additional responsibilities during the year received additional remuneration. 20",684
