doc_id,report_year,period_end_date,report_year_source,run_date_utc,part,section_title,subsection_title,page_start,page_end,section_text,word_count
Grampian-2015-2016,2015-2016,,filename,2026-03-13T08:43:09+00:00,Unknown,CHARITABLE ENDOWMENT FUNDS,Unknown,33,33,"GRAMPIAN HEALTH BOARD CONSOLIDATED STATEMENT OF CHANGES IN TAXPAYERS EQUITY FOR THE YEAR ENDED 31 MARCH 2016 NHS GRAMPIAN CHARITABLE ENDOWMENT FUNDS Individual Consolidated General Revaluation Total Board Endowment Revaluation Funds Held Total Note Fund Reserve Reserves Funds Reserve on Trust Reserves £’000 £’000 £’000 £’000 £’000 £’000 £’000 Balance at 31 March 2015 337,256 109,601 446,857 35,213 9,496 44,709 491,566 Changes in taxpayers' equity for 2015-16 Net loss on revaluation/indexation of property, plant and equipment and 11/12 assets held for sale 0 (23,851) (23,851) 0 0 0 (23,851) Net loss on revaluation of financial assets 0 0 0 0 (2,296) (2,296) (2,296) Impairment of property, plant and equipment 11 0 (6,238) (6,238) 0 0 0 (6,238) Revaluation & impairments taken to operating costs 3 0 6,238 6,238 0 0 0 6,238 Transfers between reserves 3,916 (3,916) 0 0 0 0 0 Net operating cost for the year (1,008,171) 0 (1,008,171) 0 (1,114) (1,114) (1,009,285) Total recognised income and expense for 2015-16 (1,004,255) (27,767) (1,032,022) 0 (3,410) (3,410) (1,035,432) Funding: Drawn down 994,653 0 994,653 0 0 0 994,653 Movement in General Fund Creditor (101) 0 (101) 0 0 0 (101) Balance at 31 March 2016 327,553 81,834 409,387 35,213 6,086 41,299 450,686 CONSOLIDATED STATEMENT OF CHANGES IN TAXPAYERS EQUITY FOR THE YEAR ENDED 31 MARCH 2015 Individual Consolidated General Revaluation Endowment Revaluation Funds Held Total Note Fund Reserve Total Reserves Funds Reserve on Trust Reserves £’000 £’000 £’000 £’000 £’000 £’000 £’000 Balance at 31 March 2014 357,648 91,238 448,886 35,298 7,296 42,594 491,480 Changes in taxpayers' equity for 2014-15 Net gain on revaluation/indexation of property, plant and equipment 11 0 21,872 21,872 0 0 0 21,872 Net gain on revaluation of financial assets 0 0 0 385 2,200 2,585 2,585 Impairment of property, plant and equipment 11 0 (6,442) (6,442) 0 0 0 (6,442) Revaluation & impairments taken to operating costs 3 0 6,442 6,442 0 0 0 6,442 Transfers between reserves 3,509 (3,509) 0 0 0 0 0 Net operating cost for the year (956,349) 0 (956,349) (470) 0 (470) (956,819) Total recognised income and expense for 2014-15 (952,840) 18,363 (934,477) (85) 2,200 2,115 (932,362) Funding: Drawn down 932,047 0 932,047 0 0 0 932,047 Movement in General Fund Debtor 401 0 401 0 0 0 401 Balance at 31 March 2015 337,256 109,601 446,857 35,213 9,496 44,709 491,566 30",393
Grampian-2015-2016,2015-2016,,filename,2026-03-13T08:43:09+00:00,Unknown,CHARITABLE ENDOWMENT FUNDS,NOTE 1. ACCOUNTING POLICIES,34,34,"Authority In accordance with the accounts direction issued by Scottish Ministers under the Public Finance and Accountability (Scotland) Act 2000 appended, these Accounts have been prepared in accordance with the Government Financial Reporting Manual (FReM) issued by HM Treasury, which follows International Financial Reporting Standards as adopted by the European Union (IFRS as adopted by the EU), IFRIC Interpretations and the Companies Act 2006 to the extent that they are meaningful and appropriate to the public sector. They have been applied consistently in dealing with items considered material in relation to the accounts. The preparation of financial statements in conformity with IFRS requires the use of certain critical accounting estimates. It also requires management to exercise its judgement in the process of applying the accounting policies. The areas involving a higher degree of judgement or complexity, or areas where assumptions and estimates are significant to the financial statements are disclosed on pages 42 and 43 below. The following new standards, amendments and interpretations became effective in 2015/16 for the first time: IFRS 13 - Fair Value Measurement; IAS 36 – Impairment of assets on recoverable amounts disclosure (amendment); and Charity SORP (FRS102) – application of FRS 102 to charities. The impact on the financial statements as a result of the above is expected to be minimal. The new charity SORP introduces revised disclosure and presentational requirements that will require to be incorporated in the accounts of the Charity but this will not affect preparation of the group accounts. There were no new standards, amendments or interpretations early adopted this year. The following standards have been issued but are not yet effective: . IFRS 14 – Regulatory Deferral Accounts “Annual improvements 2012-2014 cycle” (new); IFRS 15 – Revenue from Contracts with Customers (IAS 18 replacement – revenue recognition); IFRS 9 – Financial instruments (new); IFRS 16 – Leases (IAS 17 replacement); IAS 1 – Disclosure Initiative (amendment); IAS 27 – Separate Financial Statements (amendment); IAS 16 and IAS 41 – Bearer Plants (amendment); IAS 16 and IAS 38 – Classification of acceptable methods of depreciation and amortisation; IFRS 11 – Accounting for acquisitions of interests in Joint operations (amendment); IFRS 10 and IAS 28 –Sale or contribution of Assets between an investor and its associates (amendment); and IFRS 10, IFRS 12, IAS 28 – Investment entities: applying the consolidation exception (amendment). IFRS 16 will be effective from financial year 2020/21 and will require most leased buildings, plant and equipment to be included as an asset with a corresponding liability on the Balance Sheet. Otherwise the impact on the financial statements as a result of the above is expected to be minimal. Basis of Consolidation In accordance with IAS 27 – Consolidated and Separate Financial Statements, the Annual Accounts consolidate the results of Grampian Health Board Endowment Fund (operating as NHS Grampian Endowment Funds) which were established by the NHS (Scotland) Act 1978. The legal framework under which charities operate in Scotland is the Charities and Trustee Investment (Scotland) Act 2005. Under the 1978 Act Endowment Trustees are also members of the NHS Board, who are appointed by Scottish Ministers.",518
Grampian-2015-2016,2015-2016,,filename,2026-03-13T08:43:09+00:00,Unknown,CHARITABLE ENDOWMENT FUNDS,NOTE 1. ACCOUNTING POLICIES,35,35,"NHS Grampian Endowment Funds is a Registered Charity with the Office of the Charity Regulator of Scotland (OSCR) and is required to prepare and submit audited financial statements to OSCR on an annual basis. The accounts of the charity have been prepared in accordance with applicable UK accounting standards, the Statement of Recommended Practice - “Accounting and Reporting by Charities” (SORP 2015) effective 1 January 2015 and comply with the Charities and Trustee Investment (Scotland) Act 2005 and the Charities Accounts (Scotland) Regulations 2006. The accounting policies have been aligned to the policies of the Board for the purposes of consolidation. The basis of consolidation used is Merger Accounting. The intra-group transactions between the Board and the Endowment Fund eliminated on consolidation are reflected on the face of the principal financial statements listed below:  Consolidated Statement of Comprehensive Net Expenditure;  Consolidated Statement of Financial Position (Balance Sheet);  Consolidated Statement of Cash Flows; and  Consolidated Statement of Changes in Taxpayers Equity. Prior Year Adjustments There have been no changes to accounting policies during the year and therefore no adjustments to prior year figures are required to be reflected in the accounts. Going Concern The accounts are prepared on a going concern basis, which provides that the Board members have a reasonable expectation that the entity will continue in operational existence for the foreseeable future. Accounting Convention The Accounts are prepared on a historical cost basis, as modified by the revaluation of property, plant and equipment and available for sale financial assets. Fair value is defined as the amount for which an asset could be exchanged between knowledgeable, willing parties in an arms length transaction. Funding NHS Grampian Board Most of the expenditure of the Health Board as Commissioner is met from funds advanced by the Scottish Government within an approved revenue resource limit (RRL) . Cash drawn down to fund expenditure within this approved revenue resource limit is credited to the general fund. All other income receivable by the board that is not classed as funding is recognised in the year in which it is receivable. Where income is received for a specific activity which is to be delivered in the following financial year, that income is deferred. Income from the sale of non-current assets is recognised only when all material conditions of sale have been met, and is measured as the sums due under the sale contract. Non discretionary funding outwith the RRL is allocated to match actual expenditure incurred for the provision of specific pharmaceutical, dental or ophthalmic services identified by the Scottish Government. Non discretionary expenditure is disclosed in the accounts and deducted from operating costs charged against the RRL in the Statement of Resource Outturn. Funding for the acquisition of capital assets received from the Scottish Government is credited to the general fund when cash is drawn down. Expenditure on goods and services is recognised when, and to the extent that they have been received, and is measured at the fair value of those goods and services. Expenditure is recognised in the Statement of Comprehensive Net Expenditure except where it results in the creation of a non-",524
Grampian-2015-2016,2015-2016,,filename,2026-03-13T08:43:09+00:00,Unknown,CHARITABLE ENDOWMENT FUNDS,NOTE 1. ACCOUNTING POLICIES,36,36,"NHS Grampian Endowment Funds All incoming resources are recognised once the NHS Grampian Endowment Funds has received its entitlement to the resources, it is probable that the resources will be received and the monetary value of incoming resources can be measured with sufficient reliability. Legacies and donations to the NHS Grampian Endowment Funds are accounted for as incoming resources upon confirmation of legal entitlement and classified as restricted or unrestricted based on the donors stated wishes. Income from investment of charitable endowment funds is earmarked as restricted or unrestricted based on the classification of the original legacy or donation in line with the donor’s stated wishes. All expenditure, including grants, is accounted for on an accruals basis and is only incurred where this will further the charitable objects of the NHS Grampian Endowment Funds. All expenditure is recognised once there is a legal or constructive obligation committing the fund to the expenditure. A liability for grants relating to the funding of salaries is recognised when the Trustees have granted approval. Where this relates to NHS Grampian employees, these balances will be eliminated on consolidation. Property, plant and equipment The treatment of capital assets e.g. Property, Plant and Equipment in the accounts (capitalisation, valuation, depreciation, particulars concerning donated assets) is in accordance with the NHS Scotland Capital Accounting Manual. Title to properties included in the accounts is held by the Scottish Ministers. Recognition Property, Plant and Equipment is capitalised where: it is held for use in delivering services or for administrative purposes; it is probable that future economic benefits will flow to, or service potential be provided to, the Board; it is expected to be used for more than one financial year; and the cost of the item can be measured reliably. All assets falling into the following categories are capitalised: 1) Property, plant and equipment assets which are capable of being used for a period which could exceed one year, and have a cost equal to or greater than £5,000. 2) In cases where a new hospital would face an exceptional write off of items of equipment costing individually less than £5,000, the Board has the option to capitalise initial revenue equipment costs with a standard life of 10 years. 3) Assets of lesser value may be capitalised where they form part of a group of similar assets purchased at approximately the same time and cost over £20,000 in total, or where they are part of the initial costs of equipping a new development and total over £20,000. Measurement Valuation: All property, plant and equipment assets are measured initially at cost, representing the costs directly attributable to acquiring or constructing the asset and bringing it to the location and condition necessary for it to be capable of operating in the manner intended by management. All assets that are not held for their service potential (i.e. investment properties and assets held for sale), including operational assets which are surplus to requirements where there are no restrictions on disposal which would prevent access to the market, are measured subsequently at fair value as follows:  Specialised NHS land, buildings, equipment, installations and fittings are stated at depreciated replacement cost, as a proxy for fair value as specified in the FReM;",538
Grampian-2015-2016,2015-2016,,filename,2026-03-13T08:43:09+00:00,Unknown,CHARITABLE ENDOWMENT FUNDS,NOTE 1. ACCOUNTING POLICIES,37,37," Non specialised land and buildings, such as offices, are stated at fair value. Valuations of all land and building assets are reassessed by valuers under an agreed programme. All property assets are subject to a full professional valuation at least every 5 years, but more frequently should market forces dictate, and adjusted in intervening years to take account of movements in prices since the latest valuation. The valuations are carried out in accordance with the Royal Institute of Chartered Surveyors (RICS) Appraisal and Valuation Manual insofar as these terms are consistent with the agreed requirements of the Scottish Government;  Non specialised equipment, installations and fittings are stated at fair value. Boards value such assets using the most appropriate valuation methodology available (for example, appropriate indices). A depreciated historical cost basis is a proxy for fair value in respect of such assets which have short useful lives or low values (or both); and  Assets under construction are valued at current cost. This is calculated by the expenditure incurred to which an appropriate index is applied to arrive at current value. These are also subject to impairment review. To meet the underlying objectives established by the Scottish Government the following accepted variations of the RICS Appraisal and Valuation Manual have been required: Specialised operational assets are valued on a modified replacement cost basis to take account of modern substitute building materials and locality factors only. Operational assets which are in use delivering front line services or back office functions, and surplus assets with restrictions on their disposal, are valued at current value in existing use. Assets have been assessed as surplus where there is no clear plan to bring the asset back into future use as an operational asset. Subsequent expenditure: Subsequent expenditure is capitalised into an asset’s carrying value when it is probable the future economic benefits associated with the item will flow to the Board and the cost can be measured reliably. Where subsequent expenditure does not meet these criteria the expenditure is charged to the Statement of Comprehensive Net Expenditure. If part of an asset is replaced, then the part it replaces is de-recognised, regardless of whether or not it has been depreciated separately. Revaluations and Impairment: Increases in asset values arising from revaluations are recognised in the revaluation reserve, except where, and to the extent that, they reverse impairment previously recognised in the Statement of Comprehensive Net Expenditure, in which case they are recognised as income. Movements on revaluation are considered for individual asset components rather than groups or land/buildings together. Upward movements in value will be taken to the revaluation reserve and included in comprehensive net expenditure. Downward movements in value will be set against any credit balance held in the revaluation reserve until the credit is exhausted and thereafter to net operating costs. Gains and losses on revaluation are reported in the Statement of Comprehensive Net Expenditure. Depreciation Items of Property, Plant and Equipment are depreciated to their estimated residual value over their remaining useful economic lives in a manner consistent with the consumption of economic or service delivery benefits. Depreciation is charged on each main class of tangible asset as follows: 1) Freehold land is considered to have an infinite life and is not depreciated. 2) Assets in the course of construction and residual interests in off-balance sheet PFI contract assets are not depreciated until the asset is brought into use or reverts to the Board, respectively. 3) Property, Plant and Equipment which has been reclassified as ‘Held for Sale’ and non",590
Grampian-2015-2016,2015-2016,,filename,2026-03-13T08:43:09+00:00,Unknown,CHARITABLE ENDOWMENT FUNDS,NOTE 1. ACCOUNTING POLICIES,38,38,"4) Buildings, installations and fittings are depreciated on current value over the estimated remaining life of the asset, as advised by the appointed valuer. They are assessed in the context of the maximum useful lives for building elements. 5) Equipment is depreciated over the estimated life of the asset. 6) Property, plant and equipment held under finance leases are depreciated over the shorter of the lease term and the estimated useful life. Depreciation is charged on a straight line basis. The following asset lives have been used: Useful Life 20-75 Buildings Structure 5-35 Buildings Engineering Moveable engineering plant and equipment and equipment and 10 long life medical equipment 5-10 Furniture and medium life medical equipment 7-10 Vehicles and soft furnishings 2-5 Office, information technology, short life medical and other equipment Intangible Assets Recognition Intangible assets are non-monetary assets without physical substance which are capable of being sold separately from the rest of the Board’s business or which arise from contractual or other legal rights. They are recognised only where it is probable that future economic benefits will flow to, or service potential be provided to, the Board and where the cost of the asset can be measured reliably. Intangible assets that meet the recognition criteria are capitalised when they are capable of being used in the Board’s activities for more than one year and they have a cost of at least £5,000. The main classes of intangible assets recognised are:  Internally generated intangible assets; and  Internally generated publishing titles, customer lists and similar items are not capitalised as intangible assets. Expenditure on research is not capitalised. Software: Software which is integral to the operation of hardware e.g. an operating system is capitalised as part of the relevant item of property, plant and equipment. Software which is not integral to the operation of hardware e.g. application software, is capitalised as an intangible asset. Software licences : Purchased computer software licences are capitalised as intangible fixed assets where expenditure of at least £5,000 is incurred and the life of the licence exceeds one year. Websites: Websites are capitalised only when it is probable that future economic benefits will flow to, or service potential be provided to, the Board; where the cost of the asset can be measured reliably, and where the cost is at least £5,000.",386
Grampian-2015-2016,2015-2016,,filename,2026-03-13T08:43:09+00:00,Unknown,CHARITABLE ENDOWMENT FUNDS,NOTE 1. ACCOUNTING POLICIES,39,39,"Measurement Valuation: Intangible assets are recognised initially at cost, comprising all directly attributable costs needed to create, produce and prepare the asset to the point that it is capable of operating in the manner intended by management. Subsequently intangible assets that are not held for their service potential (i.e. assets held for sale), including operational assets which are surplus to requirements where there are no restrictions on disposal which would prevent access to the market, are measured at fair value. Where an active (homogeneous) market exists, intangible assets are carried at fair value. Where no active market exists, the intangible asset is revalued, using indices or some suitable model, to the lower of depreciated replacement cost and value in use where the asset is income generating. Where there is no value in use, the intangible asset is valued using depreciated replacement cost. These measures are a proxy for fair value. Revaluation and impairment: Increases in asset values arising from revaluations are recognised in the revaluation reserve, except where, and to the extent that, they reverse impairment previously recognised in the Statement of Comprehensive Net Expenditure, in which case they are recognised in income. Upward movements in value will be taken to the revaluation reserve and included in comprehensive net expenditure. Downward movements in value will be set against any credit balance held in the revaluation reserve until the credit is exhausted and thereafter to net operating costs. Intangible assets held for sale are reclassified to ‘non-current assets held for sale’ measured at the lower of their carrying amount or ‘fair value less costs to sell’. Operational assets which are in use delivering front line services or back office functions, and surplus assets with restrictions on their disposal, are valued at current value in existing use. Assets have been assessed as surplus where there is no clear plan to bring the asset back into future use as an operational asset. Amortisation Intangible assets are amortised to their estimated residual value over their remaining useful economic lives in a manner consistent with the consumption of economic or service delivery benefits. Amortisation is charged to the Statement of Comprehensive Net Expenditure on each main class of intangible asset as follows: 1) Software: amortised over expected useful life; 2) Software licences: amortised over the shorter term of the licence and their useful economic lives; 3) Other intangible assets: amortised over their expected useful life; and 4) Intangible assets which have been reclassified as ‘Held for Sale’ cease to be amortised upon the reclassification. Amortisation is charged on a straight line basis. The following asset lives have been used: Useful Life Information technology 2-5",439
