doc_id,report_year,period_end_date,report_year_source,run_date_utc,part,section_title,subsection_title,page_start,page_end,section_text,word_count
Grampian-2015-2016,2015-2016,,filename,2026-03-13T08:43:09+00:00,Unknown,NON EXECUTIVE,Unknown,47,47,"GRAMPIAN HEALTH BOARD 2. (a) STAFF COSTS 2016 2015 Executive Board Non Executive Permanent Inward Other Outward Members Board Members Staff Secondees Staff Secondees Total Total £’000 £’000 £'000 £000s £’000 £’000 £’000 £’000 STAFF COSTS Salaries and wages 520 293 444,159 0 0 (856) 444,116 430,664 Social security costs 64 23 34,538 0 0 0 34,625 32,363 NHS scheme employers' costs 71 8 56,985 0 0 0 57,064 50,076 Inward secondees 0 0 0 643 0 0 643 486 Agency staff 0 0 0 0 19,009 0 19,009 10,697 655 324 535,682 643 19,009 (856) 555,457 524,286 Compensation for loss of office or early retirement 0 0 163 0 0 0 163 734 TOTAL 655 324 535,845 643 19,009 (856) 555,620 525,020 2016 2015 £’000 £’000 Included in the total Staff Costs above were costs of staff engaged directly on capital projects, charged to capital expenditure of: 273 261 Note : Staff pension benefits are provided through the NHS Superannuation Scheme for Scotland. Details of the scheme are given in note 23 to the accounts . 2. (b) HIGHER PAID EMPLOYEES REMUNERATION Other employees whose remuneration fell within the following ranges: 2016 2015 No. No. Clinicians £ 50,001 to £60,000 275 284 £ 60,001 to £70,000 152 132 £ 70,001 to £80,000 83 88 £ 80,001 to £90,000 72 85 £ 90,001 to £100,000 64 67 £100,001 to £110,000 67 76 £110,001 to £120,000 60 59 £120,001 to £130,000 54 45 £130,001 to £140,000 42 49 £140,001 to £150,000 37 26 £150,001 to £160,000 30 26 £160,001 to £170,000 29 22 £170,001 to £180,000 16 5 £180,001 to £190,000 2 7 £190,001 to £200,000 8 4 £200,001 and above 8 7 Other £ 50,001 to £ 60,000 44 44 £ 60,001 to £ 70,000 30 40 £ 70,001 to £ 80,000 29 22 £ 80,001 to £ 90,000 9 8 £ 90,001 to £100,000 4 2 £100,001 to £110,000 2 0 £110,001 to £120,000 2 3 £120,001 to £130,000 1 0 £130,001 to £140,000 1 2 £140,001 to £150,000 0 0 £150,001 to £160,000 0 0 £160,001 to £170,000 0 0 £170,001 to £180,000 0 0 £180,001 to £190,000 0 0 £190,001 to £200,000 0 0 £200,001 and above 1 0 Note : Remuneration is calculated as gross pay plus benefits in kind and includes compensation for loss of office under agreed voluntary severence arrangements. 44",397
Grampian-2015-2016,2015-2016,,filename,2026-03-13T08:43:09+00:00,Unknown,EXPENDITURE NOT PAID IN CASH,Unknown,48,48,"Expenditure Not Paid In Cash Depreciation 11a 25,277 25,780 Amortisation 10 632 738 Depreciation Donated Assets 11b 851 679 Impairments on PPE charged to SOCNE 11 6,238 6,442 Funding Of Donated Assets 11b (3,751) (2,950) Profit on disposal of property, plant and equipment (2,001) (312) Total Expenditure Not Paid In Cash 27,246 30,377 Interest Payable PFI Finance lease charges allocated in the year 22 1,827 1,605 Total Interest Payable 1,827 1,605 Statutory Audit Grampian Health Board External auditor's remuneration and expenses 273 270 During the year the Board purchased the following non-audit services from its auditor, Deloitte LLP : Review of Cinical Governance Arrangements 9 0 Taxation liability re out of hours services 9 0 Risk analysis re property investments 6 0 Annual audit of NHS Grampian Endowment Funds 8 7 32 7 4. HOSPITAL AND COMMUNITY HEALTH SERVICES 2016 2015 £’000 £’000 BY PROVIDER Treatment in Board area of NHSScotland Patients 785,870 740,599 Other NHSScotland Bodies 13,604 13,474 Health Bodies outside Scotland 1,763 697 Primary care bodies 40 39 Private sector 7,886 6,680 Community Care Resource Transfer 35,384 34,146 Contributions to Voluntary Bodies and Charities 5,315 5,365 Total NHSScotland Patients 849,862 801,000 Treatment of UK residents based outside Scotland 1,002 1,169 Total Hospital & Community Health Service 850,864 802,169 5. FAMILY HEALTH SERVICE EXPENDITURE Unified Non Budget Discretionary Total Total 2016 2016 2016 2015 £’000 £’000 £’000 £’000 Primary Medical Services 87,285 - 87,285 85,483 Pharmaceutical Services 101,287 16,274 117,561 113,646 General Dental Services 7,861 28,665 36,526 35,333 General Ophthalmic Services 107 10,149 10,256 10,165 Total 196,540 55,088 251,628 244,627 6. ADMINISTRATION COSTS 2016 2015 £’000 £’000 Board members' remuneration Note 2 (a) 979 1,370 Administration of Board Meetings and Committees 128 177 Corporate Governance and Statutory Reporting 577 628 Health Planning, Commissioning and Performance Reporting 923 1,136 Treasury Management and Financial Planning 445 441 Public Relations 703 672 Total Administration Costs 3,755 4,424",315
Grampian-2015-2016,2015-2016,,filename,2026-03-13T08:43:09+00:00,Unknown,COMPENSATION PAYMENTS - CLINICAL *,Unknown,49,49,"£’000 £’000 Compensation payments - Clinical * 7,064 6,039 Compensation payments - Other * (4) 617 Pension enhancement & redundancy 324 648 Patients' Travel Attending Hospitals 146 161 Patients' Travel Highlands and Islands scheme 15 15 Health Promotion 3,613 3,256 Public Health 2,979 2,765 Public Health Medicine Trainees 151 141 Emergency Planning 143 130 Other 3,657 3,567 Total Other Non Clinical Services 18,088 17,339 Note : * Expenditure on clinical and other compensation payments reflects the net impact of claims arising during the year and reversal of provisions made in prior years andno longer required, based on the most recent advice from the Central Legal Office. 7. (b) OTHER NON CLINICAL SERVICES - CHARITABLE ENDOWMENT FUNDS 2015/16 2014/15 Unrestricted Restricted Total Unrestricted Restricted Total £’000 £’000 £’000 £’000 £’000 £’000 Patient & Staff Education and Welfare 676 924 1,600 193 792 985 Clinical Research 30 835 865 2 824 826 Purchase of New Equipment 366 536 902 487 660 1,147 Infrastructure Improvements 416 2,300 2,716 970 118 1,088 Investment management 30 138 168 31 109 140 Total Charitable Endowment Funds 1,518 4,733 6,251 1,683 2,503 4,186 8. (a) OPERATING INCOME - NHS GRAMPIAN 2016 2015 £’000 £’000 Hospital and Community Health Services Income NHSScotland Bodies Boards 16,271 16,241 NHS Non-Scottish Bodies 1,098 1,169 Non NHS Private Patients 727 852 Compensation Income 1,568 1,221 Total Hospital and Community Health Services Income 19,664 19,483 Family Health Service Income Unified 1,637 1,759 Non Discretionary General Dental Services 6,482 6,263 Total Family Health Services Income 8,119 8,022 Other Operating Income NHS Scotland Bodies 55,975 53,977 Contributions in respect of clinical and medical negligence claims 4,972 6,841 Profit on disposal of property, plant and equipment 2,001 312 Dontated Asset Additions 3,751 2,950 Other 21,682 20,625 Total Other Operating Income 88,381 84,705 Total Income 116,164 112,210 Of the above, the amount derived from NHS bodies was 73,344 71,387 8. (b) OPERATING INCOME - CHARITABLE ENDOWMENT FUNDS 2015/16 2014/15 Unrestricted Restricted Total Unrestricted Restricted Total Total Income £’000 £’000 £’000 £’000 £’000 £’000 Donations 85 1,977 2,062 79 1,497 1,576 Legacies 0 1,405 1,405 2 579 581 Investment Income 326 1,344 1,670 356 1,203 1,559",358
Grampian-2015-2016,2015-2016,,filename,2026-03-13T08:43:09+00:00,Unknown,9. ANALYSIS OF CAPITAL EXPENDITURE,Unknown,50,50,"Note £’000 £’000 EXPENDITURE Acquisition of Intangible Assets 10 160 131 Acquisition of property, plant and equipment 11 10,564 22,386 Donated Asset Additions 11b 3,751 2,950 Investments in Hub Co. 921 0 Gross Capital Expenditure 15,396 25,467 INCOME Net book value of disposal of property, plant and equipment 34 94 Value of disposal of Non-Current Assets held for sale 11c 358 223 Hub repayment of Investment 4 9 Donated Asset Income 3,751 2,950 Gross Capital Income 4,147 3,276 Net Capital Expenditure 11,249 22,191 SUMMARY OF CAPITAL RESOURCE OUTTURN Core Capital Resource Limit 11,249 12,755 Non Core Capital Resource Limit 0 9,436 Total Capital Resource Limit 11,249 22,191 Saving/(excess) against Total Capital Resource Limit 0 0",115
Grampian-2015-2016,2015-2016,,filename,2026-03-13T08:43:09+00:00,Unknown,9. ANALYSIS OF CAPITAL EXPENDITURE,Unknown,51,51,"2015/16 Information Software technology - Licences software Websites Total £’000 £’000 £’000 £’000 Cost or Valuation: As at 1 April 2015 2,094 2,058 5 4,157 Additions 110 50 0 160 Disposals 0 (11) 0 (11) As at 31 March 2016 2,204 2,097 5 4,306 Amortisation As at 1 April 2015 962 1,467 5 2,434 Provided during the year 401 231 0 632 Disposals 0 (11) 0 (11) As at 31 March 2016 1,363 1,687 5 3,055 Net Book Value at 1 April 2015 1,132 591 0 1,723 Net Book Value at 31 March 2016 841 410 0 1,251 PRIOR YEAR Information Software technology - Licences software Websites Total £’000 £’000 £’000 £’000 Cost or Valuation: As at 1 April 2014 2,070 1,951 5 4,026 Additions 24 107 0 131 As at 31 March 2015 2,094 2,058 5 4,157 Amortisation As at 1 April 2014 514 1,177 5 1,696 Provided during the year 448 290 0 738 As at 31 March 2015 962 1,467 5 2,434 Net Book Value at 1 April 2014 1,556 774 0 2,330 Net Book Value at 31 March 2015 1,132 591 0 1,723",187
Grampian-2015-2016,2015-2016,,filename,2026-03-13T08:43:09+00:00,Unknown,9. ANALYSIS OF CAPITAL EXPENDITURE,Unknown,52,52,"GRAMPIAN HEALTH BOARD 11. (a) PROPERTY, PLANT AND EQUIPMENT (Purchased Assets) Land (including Buildings under (excluding Transport Plant & Information Furniture & Assets Under buildings) dwellings) Dwellings Equipment Machinery Technology Fittings Construction Total £’000 £’000 £’000 £’000 £’000 £’000 £’000 £’000 £’000 Cost or valuation As at 1 April 2015 36,840 445,010 6,335 2,838 123,409 27,186 4,989 9,052 655,659 Additions * 93 (1,576) 0 50 5,195 816 7 5,979 10,564 Completions 0 8,108 0 0 0 0 0 (8,108) 0 Transfers to assets held for sale (4,460) 0 0 0 0 0 0 0 (4,460) Revaluation (816) (40,393) (515) 0 0 0 0 0 (41,724) Impairment Charge (982) (4,800) (42) 0 0 0 0 0 (5,824) Disposals 0 0 0 (206) (1,677) (869) (22) 0 (2,774) As at 31 March 2016 30,675 406,349 5,778 2,682 126,927 27,133 4,974 6,923 611,441 Depreciation As at 1 April 2015 0 6,557 59 2,411 76,739 21,336 3,364 0 110,466 Provided during the year 0 13,748 244 138 8,837 2,065 245 0 25,277 Revaluation 0 (18,123) (303) 0 0 0 0 0 (18,426) Disposals 0 0 0 (201) (1,648) (869) (22) 0 (2,740) As at 31 March 2016 0 2,182 0 2,348 83,928 22,532 3,587 0 114,577 Net Book Value at 1 April 2015 36,840 438,453 6,276 427 46,670 5,850 1,625 9,052 545,193 Net Book Value at 31 March 2016 30,675 404,167 5,778 334 42,999 4,601 1,387 6,923 496,864 Open Market Value of Land in Land and 3,030 Dwellings Included Above Asset financing: Owned 30,675 373,382 5,778 334 42,999 4,601 1,387 6,923 466,079 Finance leased 0 6,221 0 0 0 0 0 0 6,221 On-balance sheet HUB contracts 0 24,564 0 0 0 0 0 0 24,564 Net Book Value at 31 March 2016 30,675 404,167 5,778 334 42,999 4,601 1,387 6,923 496,864 Note : *The credit figure shown as buildings additions reflects expenditure held as under construction in the prior year which on completion of the scheme has resulted in a net transfer of expenditure to revenue operating costs in 2015/16. 49",338
Grampian-2015-2016,2015-2016,,filename,2026-03-13T08:43:09+00:00,Unknown,9. ANALYSIS OF CAPITAL EXPENDITURE,Unknown,53,53,"GRAMPIAN HEALTH BOARD 11. (a) PROPERTY, PLANT AND EQUIPMENT (Purchased Assets) - continued PRIOR YEAR Land (including Buildings under (excluding Transport Plant & Information Furniture & Assets Under buildings) dwellings) Dwellings Equipment Machinery Technology Fittings Construction Total £’000 £’000 £’000 £’000 £’000 £’000 £’000 £’000 £’000 Cost or valuation As at 1 April 2014 37,664 410,447 6,087 2,934 116,754 26,669 4,941 22,784 628,280 Additions 0 8,372 0 0 7,195 493 48 6,278 22,386 Completions 0 18,386 0 0 1,600 24 0 (20,010) 0 Transfers to assets held for sale (358) 0 0 0 0 0 0 0 (358) Revaluation (466) 13,637 248 0 0 0 0 0 13,419 Impairment Charge 0 (5,832) 0 0 0 0 0 0 (5,832) Disposals 0 0 0 (96) (2,140) 0 0 0 (2,236) As at 31 March 2015 36,840 445,010 6,335 2,838 123,409 27,186 4,989 9,052 655,659 Depreciation As at 1 April 2014 0 1,617 0 2,316 69,266 18,606 3,122 0 94,927 Provided during the year 0 12,869 229 160 9,550 2,730 242 0 25,780 Revaluation 0 (7,929) (170) 0 0 0 0 0 (8,099) Disposals 0 0 0 (65) (2,077) 0 0 0 (2,142) As at 31 March 2015 0 6,557 59 2,411 76,739 21,336 3,364 0 110,466 Net Book Value at 1 April 2014 37,664 408,830 6,087 618 47,488 8,063 1,819 22,784 533,353 Net Book Value at 31 March 2015 36,840 438,453 6,276 427 46,670 5,850 1,625 9,052 545,193 Open Market Value of Land in Land and 6,210 Dwellings Included Above Asset financing: Owned 36,840 407,270 6,276 427 46,670 5,850 1,625 9,052 514,010 Finance leased 0 6,493 0 0 0 0 0 0 6,493 On-balance sheet HUB contracts 0 24,690 0 0 0 0 0 0 24,690 Net Book Value at 31 March 2015 36,840 438,453 6,276 427 46,670 5,850 1,625 9,052 545,193 50",302
Grampian-2015-2016,2015-2016,,filename,2026-03-13T08:43:09+00:00,Unknown,9. ANALYSIS OF CAPITAL EXPENDITURE,Unknown,54,54,"GRAMPIAN HEALTH BOARD 11. (b) PROPERTY, PLANT AND EQUIPMENT (Donated Assets) Buildings Assets (excluding Transport Plant & Information Furniture Under dwellings) Equipment Machinery Technology & Fittings Construction Total £’000 £’000 £’000 £’000 £’000 £’000 £’000 Cost or valuation As at 1 April 2015 12,536 205 4,925 818 89 0 18,573 Additions 490 0 1,874 0 0 1,387 3,751 Revaluation (1,017) 0 0 0 0 0 (1,017) Impairment Charge (414) 0 0 0 0 0 (414) Disposals 0 0 (8) 0 0 0 (8) As at 31 March 2016 11,595 205 6,791 818 89 1,387 20,885 Depreciation As at 1 April 2015 101 152 3,871 146 31 0 4,301 Provided during the year 364 17 383 81 6 0 851 Revaluation (464) 0 0 0 0 0 (464) Disposals 0 0 (8) 0 0 0 (8) As at 31 March 2016 1 169 4,246 227 37 0 4,680 Net Book Value at 1 April 2015 12,435 53 1,054 672 58 0 14,272 Net Book Value at 31 March 2016 11,594 36 2,545 591 52 1,387 16,205 Asset financing: Owned 11,594 36 2,545 591 52 1,387 16,205 Net Book Value at 31 March 2016 11,594 36 2,545 591 52 1,387 16,205 51",200
Grampian-2015-2016,2015-2016,,filename,2026-03-13T08:43:09+00:00,Unknown,9. ANALYSIS OF CAPITAL EXPENDITURE,Unknown,55,55,"GRAMPIAN HEALTH BOARD 11. (b) PROPERTY, PLANT AND EQUIPMENT (Donated Assets) - continued PRIOR YEAR Buildings (excluding Transport Plant & Information Furniture dwellings) Equipment Machinery Technology & Fittings Total £’000 £’000 £’000 £’000 £’000 £’000 Cost or valuation As at 1 April 2014 11,239 192 4,708 146 27 16,312 Additions 1,826 13 377 672 62 2,950 Revaluation 81 0 0 0 0 81 Impairment Charge (610) 0 0 0 0 (610) Disposals 0 0 (160) 0 0 (160) As at 31 March 2015 12,536 205 4,925 818 89 18,573 Depreciation As at 1 April 2014 2 135 3,793 99 26 4,055 Provided during the year 372 17 238 47 5 679 Revaluation (273) 0 0 0 0 (273) Disposals 0 0 (160) 0 0 (160) As at 31 March 2015 101 152 3,871 146 31 4,301 Net Book Value at 1 April 2014 11,237 57 915 47 1 12,257 Net Book Value at 31 March 2015 12,435 53 1,054 672 58 14,272 Asset financing: Owned 12,435 53 1,054 672 58 14,272 Net Book Value at 31 March 2015 12,435 53 1,054 672 58 14,272 52",185
Grampian-2015-2016,2015-2016,,filename,2026-03-13T08:43:09+00:00,Unknown,AS AT 1 APRIL 2015,Unknown,56,56,"Hospital (0.05m) and the residential property at 431 North Deeside Road (£0.175m).The Royal Cornhill Hospital sale agreement is in two equal tranches, the first tranche was received on 21 April 2016 and the second is due on 21 April 2017. The Maud and Deeside Road properties are expected to be complete by the third quarter of 2016/17. Property, Plant & Equipment £'000 As at 1 April 2015 358 Transfers from property, plant and equipment 11a 4,460 Disposals for non-current assets held for sale (358) As at 31 March 2016 4,460 PRIOR YEAR As at 1 April 2014 223 Transfers from property, plant and equipment 11a 358 Loss recognised on remeasurement of non-current assets held for sale * (223) As at 31 March 2015 358 11. (d) PROPERTY, PLANT AND EQUIPMENT DISCLOSURES 2016 2015 £’000 £’000 Net book value of property, plant and equipment at 31 March Purchased 11a 496,864 545,193 Donated 11b 16,205 14,272 Total 513,069 559,465 Property, plant and equipment includes land and buildings which have been taken out of operational use and declared surplus as follows :- Net book value of surplus land valued at open market value at 31 March 3,030 6,210 Net book value of surplus buildings valued at open market value at 31 March 716 0 Property, plant and equipment includes assets held under Finance Leases and Service Concession arrangements as follows :- Net book value Finance Leases 6,221 6,493 Hub Contracts 24,564 24,690 30,785 31,183 Depreciation Finance leases 0 0 Hub Contracts 486 417 486 417 12. INVENTORIES 2016 2015 £’000 £’000",258
Grampian-2015-2016,2015-2016,,filename,2026-03-13T08:43:09+00:00,Unknown,INTRA GROUP,Unknown,57,57,"GRAMPIAN HEALTH BOARD 13. TRADE AND OTHER RECEIVABLES Charitable Charitable NHS Endowment Intra Group NHS Endowment Intra Group Grampian Funds Adjustments Group Grampian Funds Adjustments Group 2016 2016 2016 2016 2015 2015 2015 2015 £’000 £’000 £’000 £’000 £’000 £’000 £’000 £’000 Receivables due within one year NHS Scotland Boards 7,197 0 0 7,197 8,034 0 0 8,034 NHS Non-Scottish Bodies 913 0 0 913 1,071 0 0 1,071 VAT recoverable 1,314 0 0 1,314 955 0 0 955 Prepayments 6,389 0 0 6,389 4,242 0 0 4,242 Accrued income 4,255 77 0 4,332 3,656 0 0 3,656 Other Receivables 14,617 17 (2,783) 11,851 12,139 91 (1,013) 11,217 Reimbursement of provisions 4,792 0 0 4,792 6,074 0 0 6,074 Other Public Sector Bodies 2,270 0 0 2,270 1,830 0 0 1,830 Total Receivables due within one year 41,747 94 (2,783) 39,058 38,001 91 (1,013) 37,079 Receivables due after more than one year Accrued income 1,550 0 0 1,550 1,567 0 0 1,567 Reimbursement of Provisions 15,002 0 0 15,002 14,002 0 0 14,002 Total Receivables due after more than one year 16,552 0 0 16,552 15,569 0 0 15,569 TOTAL RECEIVABLES 58,299 94 (2,783) 55,610 53,570 91 (1,013) 52,648 The total receivables figure above includes a provision for bad debts of : 658 0 0 658 562 0 0 562 WGA Classification NHSScotland 7,197 0 0 7,197 8,034 0 0 8,034 Central Government Bodies 1,459 0 0 1,459 1,037 0 0 1,037 Whole of Government Bodies 2,118 0 0 2,118 1,748 0 0 1,748 Balances with NHS Bodies in England and Wales 913 0 0 913 1,071 0 0 1,071 Balances with bodies external to Government 46,612 94 (2,783) 43,923 41,680 91 (1,013) 40,758 Total 58,299 94 (2,783) 55,610 53,570 91 (1,013) 52,648 54",294
Grampian-2015-2016,2015-2016,,filename,2026-03-13T08:43:09+00:00,Unknown,AT 1 APRIL,Unknown,58,58,"2016 2015 Movements on the provision for impairment of receivables are as follows: £’000 £’000 At 1 April 562 552 Provision for debtors impairment 100 15 Receivables written off during the year as uncollectable (4) (5) At 31 March 658 562 As of 31 March 2016, receivables with a carrying value of £0.658 million (2015: £0.552 million) were impaired and provided for. The aging of these receivables is as follows: 2016 2015 £’000 £’000 Over 6 months past due 658 562 The receivables assessed as individually impaired were mainly English and Welsh Health Bodies, private individuals (including overseas visitors) and companies which are in unexpected difficult economic situations and it was assessed that not all of the receivable balance may be recovered. Receivables that are less than three months past their due date are not considered impaired. As at 31 March 2016, receivables with a carrying value of £ 2.736 million (2014/15: £3.283 million) were past their due date but not impaired. The ageing of receivables which are past due but not impaired is as follows : 2016 2015 £’000 £’000 Up to 3 months past due 1,159 1,874 3 to 6 months past due 1,109 783 Over 6 months past due 468 626 2,736 3,283 The receivables assessed as past due, but not impaired were mainly English and Welsh Health Bodies,NHS Scotland Health Boards, Local Authorities and Universities and there is no history of default from these customers recently. Concentration of credit risk is limited due to customer base being large and unrelated/government bodies. Due to this, management believe that there is no future credit risk provision required in excess of the normal provision for doubtful receivables. The credit quality of receivables that are neither past due nor impaired is assessed by reference to external credit ratings where available. Where no external credit rating is available, historical information about counterparty default rates is used. Receivables that are neither past due nor impaired are shown by their credit risk below : 2016 2015 £’000 £’000 Existing customers with no defaults in the past 2,736 3,283 The maximum exposure to credit risk is the fair value of each class of receivable. The NHS Board does not hold any collateral as security. 2016 2015 £’000 £’000 The carrying amount of receivables are denominated in Pounds Sterling: 55,610 52,648 All non-current receivables are due within two years (2014/15: two years) from the balance sheet date. The carrying amount of short term receivables approximates their fair value. The fair value of long term other receivables is £16.552 million (2014/15: £15.569 million)",427
Grampian-2015-2016,2015-2016,,filename,2026-03-13T08:43:09+00:00,Unknown,AT 1 APRIL,Unknown,59,59,"GRAMPIAN HEALTH BOARD 14. FINANCIAL ASSETS Charitable Charitable NHS Endowment NHS Endowment Grampian Funds Group Grampian Funds Group 2016 2016 2016 2015 2015 2015 £’000 £’000 £’000 £’000 £’000 £’000 Stocks and Bonds ** 0 39,972 39,972 0 42,960 42,960 Other * 1,217 0 1,217 300 0 300 TOTAL 1,217 39,972 41,189 300 42,960 43,260 At 1 April 300 42,960 43,260 309 40,037 40,346 Additions 921 10,100 11,021 0 4,846 4,846 Disposals (4) (10,792) (10,796) (9) (4,576) (4,585) Revaluation (deficit)/surplus transfered to equity 0 (2,296) (2,296) 0 2,653 2,653 At 31 March 1,217 39,972 41,189 300 42,960 43,260 Current 0 0 0 0 0 0 Non-current 1,217 39,972 41,189 300 42,960 43,260 At 31 March 1,217 39,972 41,189 300 42,960 43,260 Note: * Other financial assets comprise an investment of £1k in equity share capital with TMRI Ltd and a further small shareholding in HUB North of Scotland Ltd both unlisted investments denominated in UK pounds; £295k in the form of non equity long term loans repayable in full with interest over 25 years to Hub North of Scotland Ltd as part of the financing arrangements for the Aberdeen Health and Care Village, Forres and Woodside Health Centres and an additional working capital loan of £921k to Hub North of Scotland Ltd repayable in full during 2016/17 on completion of financial close for the Inverurie and Foresterhill Health Centre projects. The carrying value of other investments is cost less impairment as there is no active market for either the equity investments or the loan. **Stocks and Bonds relate to the Charitable Endowment Funds which are invested in a portfolio of bonds and equity investments, managed by the Funds appointed Investment managers Standard Life Wealth Ltd., in line with a medium risk strategy to deliver a balance between income and capital growth. The carrying value of Stocks and Bonds is market value. 56",312
Grampian-2015-2016,2015-2016,,filename,2026-03-13T08:43:09+00:00,Unknown,CHARITABLE ENDOWMENT FUNDS,Unknown,60,60,"GRAMPIAN HEALTH BOARD 15. CASH AND CASH EQUIVALENTS NHS GRAMPIAN CHARITABLE ENDOWMENT FUNDS INTRA GROUP ADJUSTMENTS CONSOLIDATED At Cash At At Cash At At Cash At At Cash At 01/04/15 Flow 31/03/16 01/04/15 Flow 31/03/16 01/04/15 Flow 31/03/16 01/04/15 Flow 31/03/16 £’000 £’000 £’000 £’000 £’000 £’000 £’000 £’000 £’000 £’000 £’000 £’000 Government Banking Service account balance 133 176 309 2,314 848 3,162 0 46 46 2,447 1,070 3,517 Cash at bank and in hand 107 (75) 32 1 (1) 0 0 0 0 108 (76) 32 Cash investments and deposits 0 0 0 1,492 674 2,166 0 0 0 1,492 674 2,166 Total cash and cash equivalents - balance sheet 240 101 341 3,807 1,521 5,328 0 46 46 4,047 1,668 5,715 CASH AND CASH EQUIVALENTS - PRIOR YEAR At Cash At At Cash At At Cash At At Cash At 01/04/14 Flow 31/03/15 01/04/14 Flow 31/03/15 01/04/14 Flow 31/03/15 01/04/14 Flow 31/03/15 £’000 £’000 £’000 £’000 £’000 £’000 £’000 £’000 £’000 £’000 £’000 £’000 Government Banking Service account balance 535 (402) 133 1,877 437 2,314 0 0 0 2,412 35 2,447 Cash at bank and in hand 106 1 107 439 (438) 1 0 0 0 545 (437) 108 Cash investments and deposits 0 0 0 1,515 (23) 1,492 0 0 0 1,515 (23) 1,492 Total cash and cash equivalents - balance sheet 641 (401) 240 3,831 (24) 3,807 0 0 0 4,472 (425) 4,047 Cash at bank is with major UK banks. The credit risk associated with cash at bank is therefore considered to be low. 57",261
