doc_id,report_year,period_end_date,report_year_source,run_date_utc,part,section_title,subsection_title,page_start,page_end,section_text,word_count
Grampian-2013-2014,2013-2014,,filename,2026-03-13T08:31:15+00:00,Unknown,STRATEGIC REPORT,Unknown,16,16,"STRATEGIC REPORT (continued) An in-year surplus of £35,000 was recorded for the year against a target of breakeven resulting in a small over- achievement against target. Total efficiency savings of £22.412 million were achieved against a requirement of £22.314 million. Recurring savings amounted to £21.775 million and non-recurring of £0.637 million. Counter Fraud Services During the year, NHS Scotland Counter Fraud Services performed work to give an indication of the possible level of Family Health Services income not generated due to incorrect claims by patients for exemption from NHS charges. Counter Fraud Services extrapolation of the sample results for Grampian indicates that the level of income from prescription, dental and ophthalmic charges in the year to 31 December 2013 could have potentially increased by £0.4 million (2012: £0.4 million) due to incorrect claims. Infrastructure and Non Current Assets The Board delivered a programme of infrastructure investment totalling £58.4 million during 2013/14. This overall programme was resourced using a combination of capital funding, revenue estates maintenance budgets, donated income and the proceeds from asset disposals. Major achievements during the year include: * The second phase of the new Radiotherapy Centre at Foresterhill was completed during the winter of 2013; « The programme of work to upgrade Dr Gray's Hospital in Elgin was completed enabling the re-organisation of patient flows in line with the long term direction for the hospital; e The Aberdeen Health and Community Care Village became operational, as planned, in December 2013; © Development of additional theatre capacity at ARI and at Woodend Hospital with both facilities expected to be fully operational in the first quarter of 2014/15; ¢ Investment of £12m in a range of infrastructure improvements across our estate in line with our agreed programme to reduce high and significant risk backlog maintenance; and e Investment, during the year of £6.8m in replacement of essential plant, |T and medical equipment, partly enabled by additional funding of £1.2 million allocated for this purpose by the Scottish Government Health and Social Care Directorates. Property Valuation Grampian Health Board carried out a formal revaluation of all owned land and buildings at 31 March 2014 which resulted in a net increase in the carrying value of these assets of £15.446 million. This increase in value was deemed to be mainly temporary in nature as a consequence of the recent increase in property market valuations and the revaluation reserve has been increased by £26,156 million to compensate. The balance of £10.710 million represents a permanent diminution in value mainly as a consequence of the reclassification of Health Centres and other office accommodation as non specialised NHS facilities and has been charged to Operating Costs. The Scottish Government Health Directorates have provided additional non recurring funding to compensate for this charge. Future Financial Plans NHS Grampian is fully committed to deliver efficiency benefits and for 2014/15 has set a 3% efficiency target of £23.2m in line with the expectations set by Scottish Government. For the years 2015/16 and beyond, the Board will refresh the Grampian clinical services strategy through engagement with the North of Scotland planning network, local! clinical staff, patients and the wider community including scenario planning around the provision of tertiary, acute and primary care services. The Board's financial plans and requirement for recurring efficiencies is reflected within the redesign proposals set out within the Healthfit 2020 Vision. The Board are also evaluating a number of opportunities to develop relationships with the commercial and business sector within the North East including commercialisation opportunities, maximising the utilisation of our infrastructure and joint venture arrangements based on the exploitation of innovation developed by our clinical staff. 13",604
Grampian-2013-2014,2013-2014,,filename,2026-03-13T08:31:15+00:00,Unknown,STRATEGIC REPORT,Unknown,17,17,"STRATEGIC REPORT (continued) Staff Governance A new workforce vision has been developed in partnership with our staff, sponsored by the Staff Governance Committee and supported by the Grampian Area Partnership Forum (GAPF). Workforce 2020 received Board approval in June 2013. Sectors and departments are now working on their local workforce 2020 strategies to support the overall vision of the Board. During the year the Board also continued to implement, in partnership, a robust vacancy management and redeployment process to ensure staff were deployed to the areas of greatest need. A new emphasis has been placed on attracting and retaining staff, striving to become the ‘Employer of Choice’ in the local area. The Safe Affordable Workforce project has been integrated into the Workforce Planning process. The HR Service Centre continues to manage and deliver the payroll service for NHS Shetland and NHS Orkney, together with its responsibilities to NHS Grampian. The Service Level Agreement for NHS Orkney provided assistance across the full range of Workforce services. Further work was carried out on the challenging Health and Safety agenda which saw relationships with the Health and Safety Executive strengthened further. Following successful completion of the 2010/11 HEAT target (Health, Improvement, Efficiency, Access to Services and Treatment) regarding progress to implementing the Knowledge and Skills Framework across NHS Grampian, progress has been less good in the following two years and the Staff Governance Committee continues to monitor the situation, having asked for continued improvement. In addition, the short term attendance management pilot (AMS) has been extended more widely across the organisation through a partnership approach and has delivered a short term absence rate which has been consistently below the national average and has contributed to the achievement of the overall annual sickness absence rate of 4.6% (4.41% in 2012/13), which is one of the lowest in Scotland (Scottish average 4.75%), Grampian Health Board had 14,024 employees, 11,585 female and 2,439 male, at 31 March 2014 (31 March 2013: 13,859 employees, 11,417 female and 2,442 male). Of this 58 (29 female and 29 male) were senior Managers other than Directors at 31 March 14 (31 March 2013: 70 Senior Managers, 35 female and 35 male). 4 of the 5 Executive Board Directors were male in both years. Social Community and Human Rights The Board promotes equality and celebrates diversity both in the services provided and within the organisation taking our duty to promote equality and diversity in the wider community very seriously. The challenge for the Board is to maintain the excellent progress achieved to date, taking forward work for all 9 “protected characteristics” which make up equality and diversity. These “protected characteristics’, as defined by the Equality Act 2010 are: race, disability, age, sex (male or female), sexual orientation, gender reassignment, pregnancy and maternity, marriage and civil partnership and religion or belief. The Board has also embraced the requirements of the Equality Act (Specific Duties) (Scotland) Regulations 2012. An example of work to ensure compliance is the NHS Grampian Equality Outcomes 2013-2017, which sets ambitious objectives for each of the 9 “protected characteristics” over the next four years. These objectives are currently being implemented by means of Annual Equality Action Plans. Work is also at an advanced stage to produce the new NHS Grampian Equality, Diversity and Human Rights Policy, as required by the new Partnership Information Network guidance. Performance against Key Non Financial Targets Key Performance Indicators Grampian Health Board has a performance framework through which a culture of continuous performance improvement is supported and delivery of our Healthfit 2020 is progressed. Our Vision, proudly working together to improve our health, is supported by a set of strategic themes and objectives with key measures and targets against which progress is monitored. Measures and targets include the key performance indicators used by the Scottish Government Health and Social Care Directorates to hold Boards to account. These are known as the HEAT measures and standards as they relate to: Health Improvement; Efficiency and Governance; Access to Services; and Treatment Appropriate to Individuals.",668
Grampian-2013-2014,2013-2014,,filename,2026-03-13T08:31:15+00:00,Unknown,STRATEGIC REPORT,Unknown,18,18,"STRATEGIC REPORT (continued) Planned performance against the HEAT indicators is a feature of the Board's Local Delivery Plan which represents the annual performance agreement between the Board and the Scottish Government. This performance is reviewed in public each year at an Annual Review meeting. The outcome of the Annual Review is captured in a formal letter to the Board, which then forms the basis of the Board's Annual Report. A full performance report is made available to the public in advance of the Annual Review. The following gives some information on the Board’s performance against key Local Delivery Plan (HEAT) targets as well as other national and local targets. Health Improvement e The Board has performed well in the delivery of national lifestyle targets in 2013/14. Full year data is not yet available but indications are that targets have been delivered in full and in many cases exceeded. This includes over 6,000 interventions to address alcohol consumption, encouraging a healthy weight in children through the child healthy weight intervention programme and undertaking over 1,700 cardiovascular health checks. The target for successful smoking cessation has once more been greatly exceeded with over 12,000 successful quits since April 2011. Despite this overall positive position, NHS Grampian is not complacent as performance does vary between population groups. We continue to focus on reducing inequalities in health and in 2013/14 a Public Health and Well Being Compendium was produced to : e improve common understanding about health trends, variation and projections; e monitor the gap in health status between the most and least advantaged; and e drive up performance of public health service delivery. Efficiency and Governance ¢ As detailed on page 12 of this report the Board met its three key financial targets in 2013/14. ¢ There has been continued focus on increasing the efficiency and quality of service provision through modernisation and improvement. Considerable progress has been made with our Planned and Unscheduled Care priority programmes: o The new Emergency Care Centre opened in late 2012 and introduced new ways of working including a clinical decision support service. This received over 1200 calls in the first 7 months of operation. Outcome data shows that 23% of cases/cails resulted in a planned assessment in hospital and 20% of cases/calls were able to receive care closer to home or in the community. The continued roll out of “Know Who To Turn To” is providing information to people about how and where their unscheduled care needs can be met. At the end on March 2014 95% of people were treated or discharged within the 4 hour target and work continues to deliver the 98% standard by September 2014. We are facing short term challenges with workforce recruitment and the Board have committed to the resolution of this issue as a matter of priority. We continue to work within the service to achieve the required staffing levels and to meeting the 4 hours standard in full. o The overall aim of the Planned Care Programme is to transform planned care activities within Grampian with the aim of improving performance against measures such as referral rates, outpatient Did Not Attends (DNAs) and increasing support to patients and carers to manage their own conditions. The programme is working with clinical teams to develop a patient centred approach to patient pathway development. Improvement in the quality of estate is also important and during 2013/14 the Aberdeen Health Village opened, replacing older facilities at Woolmanhill and elsewhere no longer fit for purpose. Access to Services ¢ For most of the 2013/14 year the Board delivered the 90% within 18 week referral to treatment access time standard. On a small number of occasions performance dipped below 90%, particularly over the winter period. Focus during 2013/14 has been on working towards delivery of the 12 week Treatment Time Guarantee in full and on a sustainable basis. Progress was made during 2013/14 with the building of 4 additional theatres and the employment of additional staffing. These become fully operational in early 2014/15. In the meantime breaches have continued to be reported to Scottish Government who have worked closely with the Board throughout the year. Patients have fully engaged in decisions about where and when their care is provided in accordance with local policy; and",711
Grampian-2013-2014,2013-2014,,filename,2026-03-13T08:31:15+00:00,Unknown,STRATEGIC REPORT,Unknown,19,19,"STRATEGIC REPORT (continued) e Delivery of the 95% target for the proportion of urgent cancer referrals treated within 62 days of referral has been a significant challenge and performance has been below target at 89-92% throughout 2013/14. Additional diagnostic and theatre capacity has been secured and the position is improving. The maximum 31 days ‘decision to treat’ to treatment was met during 2013/14. Treatment Appropriate to Individuals e The Board receives regular reports on all aspects of Healthcare Associated Infection, and reducing infection as well as ensuring cleanliness and good clinical practice are high priorities for the Board. The number of staphylococcus aureus bacteraemia cases has continued to fall with some in year fluctuation. The rate of Clostridium Difficile infections in the over 65s has fallen at a rate ahead of plan. e A key tenet of the Board’s Healthfit 2020 vision is around ensuring care is provided in the right place by the right person at the right time. One of the measures of this is the number of delayed discharges in hospital. The national target is that no-one should be delayed more than 14 days by April 2015. Over the 2013/14 winter period the number of delayed discharges in Grampian grew significantly, especially in Aberdeen City. The Board is working with local authority and third sector partners to improve patient flow from hospital to community or home based care. Sustainability and the Environment Overview The Scottish Government have set all NHS Boards a target of a 3% year on year reduction in fossil fuel CO, emissions across the whole asset base. NHS Grampian has incorporated these new targets in the Property & Asset Management Plan 2014 — 2023 which was approved by the Board on 4 April 2014. NHS Grampian This includes identification of site specific migration from fossil fuel to non-carbon alternatives, introduction of on-site renewables, new technologies and energy conservation measures. The CO, Comparison Chart on the right highlights the position up to and including 2013/14 against an estimation of projected emissions/ costs if no action were taken (known as Business As Usual or BAU). Actual CO, emissions remain above target but this could be due to the Energy Centre not yet running at maximum efficiency. Work is ongoing to improve the situation with new energy saving te} Hepat rian erate MENS fe ect Be enh pat 2005/06 2006/07 2007/08 2008/69 2009/10 2010/11 2011/12 2012/13 2013/14 2014/15 Annual CO2 Comparison Chart 2013-14 Ey sean Socata fala A BB - [=—e4u —w—Target Planned ——Actual initiatives being rolled out with the aim of improving our performance in this area. Key Environmental Performance Improvement delivery areas: Building Energy Management System (BEMS) was reviewed and controls are managed according to NHS Encode 1. standards, standardizing time and temperature settings for windows, doors, heating, cooling and lighting. 2. Introduce site specific consumption and emission monitoring and reporting arrangements. 3. Ensure all future building designs comply with the Simplified Building Energy Model (SBEM) calculation and carbon management criteria specifically the Building Research Establishment Environmental Assessment Method (BREEAM) Healthcare — excellent rating for new build and very good rating for refurbishment. 4. Develop proposals for a Board-wide sustainable investment strategy to map out site specific migration from fossil fuel to non-carbon alternatives and additional energy conservation measures sufficient to meet future HEAT targets and the requirements of the Climate Change Act (CCA). 5. Operating and optimising performance of the new Energy Centre at the Foresterhill Campus completed in February 2012. The design incorporates Combined Heat and Power, Biomass steam plant and conventional energy sources. Across a full year the revised design is expected to contribute estimated savings of 9,570 tonnes of CO2 per annum, ensuring a reduction of a 15% on the first full year use in 2012/13. There are however ongoing issues with getting the plant to run at full efficiency as full electric and heat load of design is not yet fully available. 16",653
Grampian-2013-2014,2013-2014,,filename,2026-03-13T08:31:15+00:00,Unknown,STRATEGIC REPORT,Unknown,20,20,"STRATEGIC REPORT (continued) 6. Working with the CEF Scotland (Carbon Energy Fund) programme to identify and fund major energy efficiency schemes at three sites. Foresterhill Campus to ensure full efficiency of Energy Centre, Royal Cornhill Hospital which may complement or supercede the grant funding mentioned in item below and also at Dr Gray’s Hospital. 7. An application for grant funding to install a Biomass Facility at Royal Cornhill Hospital has been approved with estimated savings of 2772 tonnes of CO, per annum. However this scheme has been put on hold until the full CEF Scotland programme has been agreed. 8. Assessing and developing solutions across all sites to meet the Scottish Government's Zero Waste Plan, as became law and regulated from January 2014. We have identified a need for a specialist Waste Manager with the aim of being in post Q2-Q3 2014. Chief Executive Grampian Health Board Rg Cocoten VA, bad i | iE ’ Siena ] Mr Richard Carey 24 June 2014 17",164
Grampian-2013-2014,2013-2014,,filename,2026-03-13T08:31:15+00:00,Unknown,STATEMENT OF THE CHIEF EXECUTIVE’S RESPONSIBILITIES AS THE ACCOUNTABLE OFFICER OF THE,STATEMENT OF THE CHIEF EXECUTIVE'S RESPONSIBILITIES AS THE ACCOUNTABLE OFFICER OF THE HEALTH BOARD,21,21,"STATEMENT OF THE CHIEF EXECUTIVE’S RESPONSIBILITIES AS THE ACCOUNTABLE OFFICER OF THE HEALTH BOARD Under Section 15 of the Public Finance and Accountability (Scotland) Act, 2000, The Principal Accountable Officer (PAO) of the Scottish Government has appointed me as Accountable Officer of Grampian Health Board. This designation carries with it, responsibility for: = The propriety and regularity of financial transactions under my control; « The economical, efficient and effective use of resources placed at the Board’s disposal; and « Safeguarding the assets of the Board. In preparing the Accounts | am required to comply with the requirements of the Government Financial Reporting Manual and in particular to: = Observe the accounts direction issued by the Scottish Ministers including the relevant accounting and disclosure requirements and apply suitable accounting policies on a consistent basis; "" Make judgements and estimates on a reasonable basis; = State whether applicable accounting standards as set out in the Government Financial Reporting Manual have been followed and disclose and explain any material departures; and = Prepare the accounts on a going concern basis. | am responsible for ensuring proper records are maintained and that the Accounts are prepared under the principles and in the format directed by Scottish Ministers. To the best of my knowledge and belief, | have properly discharged my responsibilities as Accountable Officer as intimated in the Departmental Accountable Officers letter to me of 13 January 2006 and amended by the Scottish Public Finance Manual Guidance Note 2009-05 dated July 2009. — ! \ WA t/ - be Mr Richard Carey eee Chief Executive Grampian Health Board 24 June 2014",267
Grampian-2013-2014,2013-2014,,filename,2026-03-13T08:31:15+00:00,Unknown,STATEMENT OF THE CHIEF EXECUTIVE’S RESPONSIBILITIES AS THE ACCOUNTABLE OFFICER OF THE,STATEMENT OF HEALTH BOARD MEMBERS’ RESPONSIBILITIES IN RESPECT OF THE ACCOUNTS,22,22,"STATEMENT OF HEALTH BOARD MEMBERS’ RESPONSIBILITIES IN RESPECT OF THE ACCOUNTS Under the National Health Service (Scotland) Act 1978, the Health Board is required to prepare accounts in accordance with the directions of Scottish Ministers which require that those accounts give a true and fair view of the state of affairs of the Health Board as at 31 March 2014 and of its operating costs for the year then ended. In preparing these accounts the Directors are required to: » Apply on a consistent basis the accounting policies and standards approved for NHS Scotland by Scottish Ministers. « Make judgements and estimates that are reasonable and prudent; » State where applicable accounting standards as set out in the Government Financial Reporting Manual have not been followed where the effect of the departure is material, and « Prepare the accounts on a going concern basis unless it is inappropriate to presume that the Health Board will continue to operate. The Health Board members are responsible for ensuring that proper accounting records are maintained which disclose with reasonable accuracy at any time the financial position of the Board and enable them to ensure that the accounts comply with the National Health Service (Scotland) Act 1978 and the requirements of the Scottish Ministers. They are also responsible for safeguarding the assets of the Health Board and hence taking reasonable steps for the prevention of fraud and other irregularities. The Health Board members confirm they have discharged the above responsibilities during the financial year and in preparing the accounts. Councillor Bill Howatson Chairman Grampian Health Board veveatanenteneesenee Aor A Mr Alan Gray Director of Finance Grampian Health Board 24 June 2014",277
