doc_id,page,proposed_subsection,toc_subsection,reason,top_lines_snippet
Grampian-2019-2020,77,Note 1. ACCOUNTING POLICIES (cont),i) Director’s Report,allow_list_reject(score=0.196),"Effective from 2016/17 the Board has also disclosed its interest in the three Integration Joint Boards (IJBs); Moray, Aberdeen City and Aberdeenshire, established under the terms of the Public Bodies (Joint Working) (Scotland) Act 2014 and associated secondary legislation. In accordance with IFRS 11 – Joint Arrangements each IJB is considered to be a Joint Venture and the primary financial statements have been amended for the additional disclosure required to accurately reflect the interest of IJBs using the equity method of accounting in accordance with IAS 28 – Investments in Associates and Joint arrangements. 3) Retrospective Restatements There are no adjustments to prior year figures required to be reflected in the accounts. 4) Going Concern The accounts are prepared on a going concern basis, which provides that the Board members have a reasonable expectation that the entity will continue in operational existence for the foreseeable future. 5) Accounting Convention The Accounts are prepared on a historical cost basis, as modified by the revaluation of property, plant and equipment and available for sale financial assets and liabilities. Fair value is defined as the amount for which an asset could be exchanged between knowledgeable, willing parties in an arms-length transaction. 6) Funding 6 (a) Grampian Health Board Most of the expenditure of the Health Board as Commissioner is met from funds advanced by the Scottish Government within an approved revenue resource limit (RRL) . Cash drawn down to fund expenditure within this approved revenue resource limit is credited to the general fund. All other income receivable by the board that is not classed as funding is recognised when the transfer of goods or services (the performance obligation) is satisfied. Where income is received for goods or services that will not be delivered in the current financial year, that income is deferred. Income from the sale of non-current assets is recognised only when all material conditions of sale have been met, and is measured as the sums due under the sale contract. Non-discretionary funding out-with the RRL is allocated to match actual expenditure incurred for the provision of specific pharmaceutical, dental or ophthalmic services identified by the Scottish Government. Non-discretionary expenditure is disclosed in the accounts and deducted from operating costs charged against the RRL in the Statement of Resource Outturn. Funding for the acquisition of capital assets received from the Scottish Government is credited to the general fund when cash is drawn down."
Grampian-2019-2020,78,Note 1. ACCOUNTING POLICIES (cont),i) Director’s Report,allow_list_reject(score=0.196),"Expenditure on goods and services is recognised when, and to the extent that they have been received, and is measured at the fair value of those goods and services. Expenditure is recognised in the Statement of Comprehensive Net Expenditure except where it results in the creation of a non-current asset such as property, plant and equipment in which case it is recognised in the Balance Sheet. 6(b) NHS Grampian Endowment Funds All incoming resources are recognised once the NHS Grampian Endowment Funds has received its entitlement to the resources, it is probable that the resources will be received and the monetary value of incoming resources can be measured with sufficient reliability. Legacies and donations to the NHS Grampian Endowment Funds are accounted for as incoming resources upon confirmation of legal entitlement and classified as restricted or unrestricted based on the donors stated wishes. Income from investment of charitable endowment funds is earmarked as restricted or unrestricted based on the classification of the original legacy or donation in line with the donor’s stated wishes. All expenditure, including grants, is accounted for on an accruals basis and is only incurred where this will further the charitable objects of the NHS Grampian Endowment Funds. All expenditure is recognised once there is a legal or constructive obligation committing the fund to the expenditure. A liability for grants relating to the funding of salaries is recognised when the Trustees have granted approval. Where this relates to NHS Grampian employees, these balances will be eliminated on consolidation. 7) Property, plant and equipment The treatment of capital assets e.g. Property, Plant and Equipment in the accounts (capitalisation, valuation, depreciation, particulars concerning donated assets) is in accordance with the NHS Scotland Capital Accounting Manual. Title to properties included in the accounts is held by the Scottish Ministers. 7(a) Recognition Property, Plant and Equipment is capitalised where: it is held for use in delivering services or for administrative purposes; it is probable that future economic benefits will flow to, or service potential be provided to, the Board; it is expected to be used for more than one financial year; and the cost of the item can be measured reliably. All assets falling into the following categories are capitalised: 1) Property, plant and equipment assets which are capable of being used for a period which could exceed one year, and have a cost equal to or greater than £5,000. 2) In cases where a new hospital would face an exceptional write off of items of equipment costing individually less than £5,000, the Board has the option to capitalise initial revenue equipment costs with a standard life of 10 years. 3) Assets of lesser value may be capitalised where they form part of a group of similar assets purchased at approximately the same time and cost over £20,000 in total, or where they are part of the initial costs of equipping a new development"
Grampian-2019-2020,79,Note 1. ACCOUNTING POLICIES (cont),i) Director’s Report,allow_list_reject(score=0.196),"7(b) Measurement Valuation: All property, plant and equipment assets are measured initially at cost, representing the costs directly attributable to acquiring or constructing the asset and bringing it to the location and condition necessary for it to be capable of operating in the manner intended by management. All assets that are not held for their service potential (i.e. investment properties and assets held for sale), including operational assets which are surplus to requirements where there are no restrictions on disposal which would prevent access to the market, are measured subsequently at fair value as follows: Specialised NHS land, buildings, equipment, installations and fittings are stated at depreciated replacement cost, as a proxy for fair value as specified in the FReM. Non-specialised land and buildings, such as offices, are stated at fair value. Valuations of all land and building assets are reassessed by valuers under an agreed programme. All property assets are subject to a full professional valuation at least every 5 years, but more frequently should market forces dictate, and adjusted in intervening years to take account of movements in prices since the latest valuation. The valuations are carried out in accordance with the Royal Institute of Chartered Surveyors (RICS) Appraisal and Valuation Manual insofar as these terms are consistent with the agreed requirements of the Scottish Government; Non-specialised equipment, installations and fittings are stated at fair value. Boards value such assets using the most appropriate valuation methodology available (for example, appropriate indices). A depreciated historical cost basis is a proxy for fair value in respect of such assets which have short useful lives or low values (or both); and Assets under construction are held at cost until operational. Thereafter they are valued as above in accordance with all other assets in the same category. These assets are also subject to impairment review. To meet the underlying objectives established by the Scottish Government the following accepted variations of the RICS Appraisal and Valuation Manual have been required: Specialised operational assets are valued on a modified replacement cost basis to take account of modern substitute building materials and locality factors only. Operational assets which are in use delivering front line services or back office functions, and surplus assets with restrictions on their disposal, are valued at current value in existing use. Assets have been assessed as surplus where there is no clear plan to bring the asset back into future use as an operational asset. Subsequent expenditure: Expenditure is capitalised into an asset’s carrying value when it is probable the future economic benefits associated with the item will flow to the Board and the cost can be measured reliably. Where subsequent expenditure does not meet these criteria, the expenditure is charged to the Statement of Comprehensive Net Expenditure. If part of an"
Grampian-2019-2020,80,Note 1. ACCOUNTING POLICIES (cont),i) Director’s Report,allow_list_reject(score=0.196),"For large complex backlog maintenance projects the nature of the work can vary significantly as the programme progresses and it is often difficult to accurately analyse work in progress between the aspects of the programme that will deliver future economic benefit, i.e. the capital expenditure, from the aspects of the programme that are ongoing maintenance activities i.e. the revenue expenditure. In these circumstances, all expenditure is charged and carried initially as an Asset Under Construction in the Board’s ledger. On completion of each significant stage of the project, the final out turn expenditure is analysed between revenue and capital based on the completed scope. Revenue expenditure is charged to the Statement of Comprehensive Net Expenditure and the capitalised expenditure is then subject to an impairment review based on an interim valuation of the completed work by the Board’s independent valuation advisors. Revaluations and Impairment: Increases in asset values arising from revaluations are recognised in the revaluation reserve, except where, and to the extent that, they reverse impairment previously recognised in the Statement of Comprehensive Net Expenditure, in which case they are recognised as income. Movements on revaluation are considered for individual assets rather than groups or land/buildings together. Permanent decreases in asset values and impairments are charged gross to the Statement of Comprehensive Net Expenditure. Any related balance on the revaluation reserve is transferred to the general fund. Upward movements in value will be taken to the revaluation reserve and included in comprehensive net expenditure. Temporary decreases in asset value or impairments are charged to the revaluation reserve to the extent there is an available balance for the asset concerned, and thereafter to the Statement of Comprehensive Net Expenditure. Gains and losses on revaluation are reported in the Statement of Comprehensive Net Expenditure. 7(c) Depreciation Items of Property, Plant and Equipment are depreciated to their estimated residual value over their remaining useful economic lives in a manner consistent with the consumption of economic or service delivery benefits. Depreciation is charged on each main class of tangible asset as follows: 1) Freehold land is considered to have an infinite life and is not depreciated. 2) Property, Plant and Equipment which has been reclassified as ‘Held for Sale’ and non-operational assets which have been declared surplus cease to be depreciated upon the reclassification. 3) Buildings, installations and fittings are depreciated on current value over the estimated remaining life of the asset, as advised by the appointed valuer. They are assessed in the context of the maximum useful lives for building elements. 4) Equipment is depreciated over the estimated life of the asset. 5) Property, plant and equipment held under finance leases are depreciated over"
Grampian-2019-2020,81,Note 1. ACCOUNTING POLICIES (cont),i) Director’s Report,allow_list_reject(score=0.196),"Depreciation is charged on a straight-line basis using an assessment of the remaining useful economic life determined by the Board’s appointed valuers. The following asset lives have been used: Useful Life Buildings Structure 20-90 Buildings Engineering 5-35 Moveable engineering plant and equipment and equipment and long- life medical equipment 10 Furniture and medium-life medical 5-10 equipment Vehicles and soft furnishings 7-10 Office, information technology, short- life medical and other equipment 2-5 8) Intangible Assets 8(a) Recognition Intangible assets are non-monetary assets without physical substance which are capable of being sold separately from the rest of the Board’s business or which arise from contractual or other legal rights. They are recognised only where it is probable that future economic benefits will flow to, or service potential be provided to, the Board and where the cost of the asset can be measured reliably. Intangible assets that meet the recognition criteria are capitalised when they are capable of being used in the Board’s activities for more than one year and they have a cost of at least £5,000. The main classes of intangible assets recognised are: Internally generated intangible assets : Internally generated publishing titles, customer lists and similar items are not capitalised as intangible assets. Expenditure on research is not capitalised."
Grampian-2019-2020,82,Note 1. ACCOUNTING POLICIES (cont),i) Director’s Report,allow_list_reject(score=0.196),"Software: Software which is integral to the operation of hardware e.g. an operating system is capitalised as part of the relevant item of property, plant and equipment. Software which is not integral to the operation of hardware e.g. application software, is capitalised as an intangible asset. Software licences : Purchased computer software licences are capitalised as intangible fixed assets where expenditure of at least £5,000 is incurred and the life of the licence exceeds one year. Websites: Websites are capitalised only when it is probable that future economic benefits will flow to, or service potential be provided to, the Board; where the cost of the asset can be measured reliably, and where the cost is at least £5,000. 8(b) Measurement Valuation: Intangible assets are recognised initially at cost, comprising all directly attributable costs needed to create, produce and prepare the asset to the point that it is capable of operating in the manner intended by management. Subsequently intangible assets that are not held for their service potential (i.e. assets held for sale), including operational assets which are surplus to requirements where there are no restrictions on disposal which would prevent access to the market, are measured at fair value. Where an active (homogeneous) market exists, intangible assets are carried at fair value. Where no active market exists, the intangible asset is revalued, using indices or some suitable model, to the lower of depreciated replacement cost and value in use where the asset is income generating. Where there is no value in use, the intangible asset is valued using depreciated replacement cost. These measures are a proxy for fair value. Revaluation and impairment: Increases in asset values arising from revaluations are recognised in the revaluation reserve, except where, and to the extent that, they reverse impairment previously recognised in the Statement of Comprehensive Net Expenditure, in which case they are recognised in income. Permanent decreases in asset values and impairments are charged gross to the Statement of Comprehensive Net Expenditure. Any related balance on the revaluation reserve is transferred to the general fund. Upward movements in value will be taken to the revaluation reserve and included in comprehensive net expenditure. Temporary decreases in asset value or impairments are charged to the revaluation reserve to the extent there is an available balance for the asset"
Grampian-2019-2020,83,Note 1. ACCOUNTING POLICIES (cont),i) Director’s Report,allow_list_reject(score=0.196),"Intangible assets held for sale are reclassified to ‘non-current assets held for sale’ measured at the lower of their carrying amount or ‘fair value less costs to sell’. Operational assets which are in use delivering front line services or back office functions, and surplus assets with restrictions on their disposal, are valued at current value in existing use. Assets have been assessed as surplus where there is no clear plan to bring the asset back into future use as an operational asset. 8 (c) Amortisation Intangible assets are amortised to their estimated residual value over their remaining useful economic lives in a manner consistent with the consumption of economic or service delivery benefits. Amortisation is charged to the Statement of Comprehensive Net Expenditure on each main class of intangible asset as follows: 1) Software: amortised over expected useful life; 2) Software licences: amortised over the shorter term of the licence and their useful economic lives; 3) Other intangible assets: amortised over their expected useful life; and 4) Intangible assets which have been reclassified as ‘Held for Sale’ cease to be amortised upon the reclassification. Amortisation is charged on a straight-line basis. The following asset lives have been used: Useful Life Information technology 2-5 9) Non-current assets held for sale Non-current assets intended for disposal are reclassified as ‘Held for Sale’ once all of the following criteria are met: - The asset is available for immediate sale in its present condition subject only to terms which are usual and customary for such sales; and - The sale must be highly probable i.e. : ➢ management are committed to a plan to sell the asset; ➢ an active programme has begun to find a buyer and complete the sale; ➢ the asset is being actively marketed at a reasonable price; ➢ the sale is expected to be completed within 12 months of the date of classification as ‘Held for Sale’; and ➢ the actions needed to complete the plan indicate it is unlikely that the plan will be dropped or significant changes made to it. Following reclassification, the assets are measured at the lower of their existing carrying amount and their ‘fair value less costs to sell’. Depreciation ceases to be charged and the assets are not revalued, except where the ‘fair value less costs to sell’ falls below the carrying amount. Assets are de-recognised when all material sale contract conditions have"
Grampian-2019-2020,84,Note 1. ACCOUNTING POLICIES (cont),i) Director’s Report,allow_list_reject(score=0.196),"Property, plant and equipment which is to be scrapped or demolished does not qualify for recognition as ‘Held for Sale’ and instead is retained as an operational asset and the asset’s economic life is adjusted. The asset is de-recognised when scrapping or demolition occurs. 10) Donated Assets Charitable donations and legacies for the benefit of health services in Grampian are generally either made to the NHS Grampian Endowment Funds, a separate legal organisation and registered charity or to one of the many independent healthcare related charitable organisations that exist within Grampian e.g. Hospital Friends groups. Where these charitable organisations, including the NHS Grampian Endowment Funds, or from time to time an individual philanthropic donor, provides grant funding to support the purchase or construction of a physical asset, then NHS Grampian will recognise the grant funding as income within the Statement of Comprehensive Net Expenditure (SOCNE). NHS Grampian will ensure that all donations are utilised in line with any specific conditions attached by the donor. The resulting asset will be capitalised on the Statement of Financial position (SOFP) initially at the current full replacement cost. The accounting treatment, including the method of valuation, follows the rules in the NHS Capital Accounting Manual, as set out above. 11) Sale of property, plant and equipment, intangible assets and non-current assets held for sale Disposal of non-current assets is accounted for as a reduction to the value of assets equal to the net book value of the assets disposed. When set against any sales proceeds, the resulting gain or loss on disposal will be recorded in the Statement of Comprehensive Net Expenditure. Non-current assets held for sale will include assets transferred from other categories and will reflect any resultant changes in valuation. 12) Leasing 12(a) Finance leases Where substantially all risks and rewards of ownership of a leased asset are borne by the Board, the asset is recorded as Property, Plant and Equipment and a corresponding liability is recorded. Assets held under finance leases are valued at their fair values and are depreciated over the remaining period of the lease. The asset and liability are recognised at the inception of the lease, and are de-recognised when the liability is discharged, cancelled or expires. The minimum lease payments (annual rental less operating costs e.g. maintenance and contingent rental) are apportioned between the repayment of the outstanding liability and a finance charge. The annual finance charge is allocated to each period during the lease term so as to produce a constant periodic rate of interest on the remaining balance of the liability using either the implicit interest rate or another relevant basis of estimation such as the sum of the digits method. Finance charges are recorded as interest payable in the Statement of Comprehensive Net Expenditure. Contingent rental and operating costs are charged as expenses in the periods in which they are incurred."
Grampian-2019-2020,85,Note 1. ACCOUNTING POLICIES (cont),i) Director’s Report,allow_list_reject(score=0.196),"12(b) Operating leases Other leases are regarded as operating leases and the rentals are charged to expenditure on a straight-line basis over the term of the lease. Operating lease incentives received are added to the lease rentals and charged to expenditure over the life of the lease. 12(c) Leases of land and buildings Where a lease is for land and buildings, the land component is separated from the building component and the classification for each is assessed separately. Leased land is treated as an operating lease unless title to the land is expected to transfer. 12(d) HUB Schemes Transactions financed as revenue transactions through the Scottish Government’s HUB initiative are accounted for in accordance with the HM Treasury application of IFRIC 12, Service Concession Arrangements as outlined in the FReM. Schemes which do not fall within the application of IFRIC 12 are deemed to be off-balance sheet. Transactions which meet the IFRIC 12 definition of a service concession, as interpreted in HM Treasury’s FReM, are accounted for as ‘on-balance sheet’ by the Board. The underlying assets are recognised as Property, Plant and Equipment and Intangible Assets at their fair value. An equivalent liability is recognised in accordance with IAS 17. Where it is not possible to separate the finance element from the service element of unitary payment streams this has been estimated from information provided by the operator and the fair values of the underlying assets. Assets are subsequently revalued in accordance with the treatment specified for their applicable asset categories. The annual contract payments are apportioned between the repayment of the liability, a finance cost and the charges for services. The finance cost is calculated using the implicit interest rate for the scheme. The service charge and the finance cost interest element are charged in the Statement of Comprehensive Net Expenditure. 13) Impairment of non-financial assets Assets that are subject to depreciation and amortisation are reviewed for impairment whenever events or changes in circumstances indicate that the carrying amount may not be recoverable. An impairment loss is recognised for the amount by which the asset’s carrying amount exceeds its recoverable amount. The recoverable amount is the higher of an asset’s fair value less costs to sell and value in use. Where an asset is not held for the purpose of generating cash flows, value in use is assumed to equal the cost of replacing the service potential provided by the asset, unless there has been a reduction in service potential. For the purposes of assessing impairment, assets are grouped at the lowest levels for which there are separately identifiable cash flows (cash-generating units). Non- financial assets that suffer impairment are reviewed for possible reversal of the impairment. Impairment losses charged to the Statement of Comprehensive Net Expenditure are deducted from future operating costs to the extent that they are identified as being reversed in subsequent revaluations."
