question,answer,contexts,ground_truth,ground_truths,query_id,doc_id,difficulty,answer_type,expected_pages,generation_status
What resource budget ceiling was set for NHS Grampian's core ongoing activities in 2020/21?,The three annual financial targets set for each Health Board by the SGHSCD are: ➢ Revenue Resource Limit (RRL)– a resource budget for ongoing activity; ➢ Capital Resource Limit (CRL) – a resource budget for net capital investment; and ➢ Cas,"['7. Financial Performance and Position (cont) 7.2 Grampian Health Board performance against statutory financial targets The results of each of the partner organisations, although consolidated with the main Board accounts for group accounting purposes, do not form part of the statutory financial target set for NHS Boards by the (SGHSCD) and are therefore not taken in to account when considering the Board’s in year financial performance. The three annual financial targets set for each Health Board by the SGHSCD are: ➢ Revenue Resource Limit (RRL)– a resource budget for ongoing activity; ➢ Capital Resource Limit (CRL) – a resource budget for net capital investment; and ➢ Cash Requirement – a financing requirement to fund the cash consequences of ongoing activity and net capital investment. Health Boards are required to contain their net expenditure within these limits, and report on any variation. Grampian Health Board has successfully achieved all three financial targets for the year reporting an outturn against these set limits as follows: Statutory Financial Targets Limit as set by Actual Variance Under SGHSCD Outturn £000’s £000’s £000’s Core Revenue Resource Limit 1,278,771 1,278,002 769 Non-Core Revenue Resource Limit 32,340 32,340 - Total 1,311,111 1,310,342 769 Core Capital Resource Limit 42,246 42,246 - Non-Core Capital Resource Limit 1,070 1,070 -', '7. Financial Performance and Position (cont) 7.2.1 Efficiency Savings Efficiency savings of £6.7 million were achieved against a target of £12.2 million for NHS Grampian services, mainly from the reduction in the use of agency medical and nursing staff compared to 2019/20. Recurring savings amounted to £6.05 million and non-recurring of £0.65 million. The gap of £5.5 million was covered non-recurringly by the Scottish Government through their COVID-19 supplementary funding allocation, recognising that the focus of budget managers was not in the delivery of savings during the period of the Board being on an emergency footing. 7.2 Grampian Health Board performance against statutory financial targets 7.2.2 Financial impact of the COVID-19 Pandemic It is important to recognise that, although there were additional direct costs incurred as a result of specific initiatives, the Board’s COVID-19 recovery and remobilisation response was a whole system effort delivered under emergency provisions with the majority of our core services reconfigured to manage the impact. Accordingly many of the variations in cost between 2020/21 and 2019/20 reflect the indirect impact of the COVID-19 pandemic on staffing, activity and service levels. The Board received a specific supplementary allocation of £48.6 million during the year from the Scottish Government to cover the additional direct costs associated with the', 'Board has successfully achieved all three financial targets for the year reporting an outturn against these set limits as follows: Statutory Financial Targets Limit as set by Actual Variance Under SGHSCD Outturn £000’s £000’s £000’s Core Revenue Resource Limit 1,278,771 1,278,002 769 Non-Core Revenue Resource Limit 32,340 32,340 - Total 1,311,111 1,310,342 769 Core Capital Resource Limit 42,246 42,246 - Non-Core Capital Resource Limit 1,070 1,070 - Total 43,316 43,316 - Cash Requirement 1,298,124 1,298,124 - Memorandum for In Year Out-turn £000 Core Revenue Resource Variance Surplus in 2020/21 769 Financial flexibility : funding banked with Scottish Government 0 Underlying Surplus against Core Revenue Resource Limit 769 0% The Board is reporting an underspend of £0.769m against a target of breakeven on the revenue resource limit for 2020/21. Due to the impact of the COVID-19 pandemic, the Scottish Government paused the Annual Operating and financial planning process. Recognising the exceptional nature of 2020-21 and the impact on delivery of financial plans, additional non- repayable funding was provided to support in-year financial balance across all NHS Boards. NHS Grampian received £47.3m. The flexibility allowed within the previously agreed three-year financial planning and performance cycle, allowed NHS Grampian to bank £1m from the reported surplus in 2019/20, with the Scottish Government, for', 'the wider community very seriously. The challenge for the Board is to maintain the excellent progress achieved to date, taking forward work for all 9 “protected characteristics” which make up equality and diversity during the challenging times caused by the COVID-19 pandemic. These “protected characteristics”, as defined by the Equality Act 2010 are: race, disability, age, sex (male or female), sexual orientation, gender reassignment, pregnancy and maternity, marriage and civil partnership and religion or belief. The Board has also embraced the requirements of the Equality Act (Specific Duties) (Scotland) Regulations 2012 and published reports including the following key updates on progress in 20/21: - An NHS Grampian Equality Outcomes Report 2021-2025, detailing what NHS Grampian wishes to achieve in the sphere of each of the 9 “protected characteristics” over the next 4 years. - An NHS Grampian “Mainstreaming” Report detailing what NHS Grampian has done in the last 2 years to make equality and diversity an integral part of the way we function as an organisation. NHS Grampian has also published a range of other non-Statutory Equality and Diversity Monitoring Reports on a wide range of topics. During 2020/21, over 1,500 NHS Grampian staff received Equality and Diversity Training by TEAMS at a level appropriate to their role in the', '8. Financial Performance and Position (cont) 7.1.1 Grampian Health Board Endowment Funds (cont) Total expenditure for the year was £3.177 million (2019/20 £4.721 million), £2.788 million relating to grants for charitable activities (2019/20 £4.340 million), £0.187 million on staffing and support costs (2019/20 £0.189 million) and £0.202 on investment management fees (2019/20 £0.192 million). During the year, payments totalling £2.031 million (2019/20: £1.845 million) were made to Grampian Health Board to enable a range of research and other activities for the benefit of patients and £0.099 million (2019/20: £0.152 million) was received from Grampian Health Board mainly relating to income from research activities. Other charities and local community groups also benefitted from grants during the year to support a range of activities to improve the health and wellbeing of the people of Grampian. The full range of charitable activities of the Grampian Health Board Endowment Funds, including a copy of the 2020/21 annual report and accounts can be viewed at www.nhsgcharities.com .']","£1,278,771 (£000)","['£1,278,771 (£000)']",Q_2021_FIN_01,Grampian-2020-2021,MOD,number,[28],skipped
How much did NHS Grampian actually spend against its core resource budget in 2020/21?,7,"['7. Financial Performance and Position (cont) 7.2 Grampian Health Board performance against statutory financial targets The results of each of the partner organisations, although consolidated with the main Board accounts for group accounting purposes, do not form part of the statutory financial target set for NHS Boards by the (SGHSCD) and are therefore not taken in to account when considering the Board’s in year financial performance. The three annual financial targets set for each Health Board by the SGHSCD are: ➢ Revenue Resource Limit (RRL)– a resource budget for ongoing activity; ➢ Capital Resource Limit (CRL) – a resource budget for net capital investment; and ➢ Cash Requirement – a financing requirement to fund the cash consequences of ongoing activity and net capital investment. Health Boards are required to contain their net expenditure within these limits, and report on any variation. Grampian Health Board has successfully achieved all three financial targets for the year reporting an outturn against these set limits as follows: Statutory Financial Targets Limit as set by Actual Variance Under SGHSCD Outturn £000’s £000’s £000’s Core Revenue Resource Limit 1,278,771 1,278,002 769 Non-Core Revenue Resource Limit 32,340 32,340 - Total 1,311,111 1,310,342 769 Core Capital Resource Limit 42,246 42,246 - Non-Core Capital Resource Limit 1,070 1,070 -', '7. Financial Performance and Position (cont) 7.2.1 Efficiency Savings Efficiency savings of £6.7 million were achieved against a target of £12.2 million for NHS Grampian services, mainly from the reduction in the use of agency medical and nursing staff compared to 2019/20. Recurring savings amounted to £6.05 million and non-recurring of £0.65 million. The gap of £5.5 million was covered non-recurringly by the Scottish Government through their COVID-19 supplementary funding allocation, recognising that the focus of budget managers was not in the delivery of savings during the period of the Board being on an emergency footing. 7.2 Grampian Health Board performance against statutory financial targets 7.2.2 Financial impact of the COVID-19 Pandemic It is important to recognise that, although there were additional direct costs incurred as a result of specific initiatives, the Board’s COVID-19 recovery and remobilisation response was a whole system effort delivered under emergency provisions with the majority of our core services reconfigured to manage the impact. Accordingly many of the variations in cost between 2020/21 and 2019/20 reflect the indirect impact of the COVID-19 pandemic on staffing, activity and service levels. The Board received a specific supplementary allocation of £48.6 million during the year from the Scottish Government to cover the additional direct costs associated with the', 'Board has successfully achieved all three financial targets for the year reporting an outturn against these set limits as follows: Statutory Financial Targets Limit as set by Actual Variance Under SGHSCD Outturn £000’s £000’s £000’s Core Revenue Resource Limit 1,278,771 1,278,002 769 Non-Core Revenue Resource Limit 32,340 32,340 - Total 1,311,111 1,310,342 769 Core Capital Resource Limit 42,246 42,246 - Non-Core Capital Resource Limit 1,070 1,070 - Total 43,316 43,316 - Cash Requirement 1,298,124 1,298,124 - Memorandum for In Year Out-turn £000 Core Revenue Resource Variance Surplus in 2020/21 769 Financial flexibility : funding banked with Scottish Government 0 Underlying Surplus against Core Revenue Resource Limit 769 0% The Board is reporting an underspend of £0.769m against a target of breakeven on the revenue resource limit for 2020/21. Due to the impact of the COVID-19 pandemic, the Scottish Government paused the Annual Operating and financial planning process. Recognising the exceptional nature of 2020-21 and the impact on delivery of financial plans, additional non- repayable funding was provided to support in-year financial balance across all NHS Boards. NHS Grampian received £47.3m. The flexibility allowed within the previously agreed three-year financial planning and performance cycle, allowed NHS Grampian to bank £1m from the reported surplus in 2019/20, with the Scottish Government, for', '4. Non-Financial Performance NHS Grampian has a performance framework through which a culture of continuous performance improvement is supported. Our vision, proudly working together to improve our health, is supported by a set of strategic themes: - Improving health and reducing inequalities; - Delivering high quality care in the right place; - Involving our patients, public, staff and partners; and - Developing and empowering our staff. The core values of the Board are caring, listening and improving. These values are embedded in everything we do in making the vision a reality. During 2020/21 the Board has successfully met its financial targets while continually striving to meet the challenges presented by the global pandemic (COVID-19) and to deliver safe and effective services within available resources and following national guidance. Performance against the key national clinical treatment targets have clearly been impacted by the changes made in support of the COVID-19 response. Within this section of the annual report and accounts we have summarised the impact COVID-19 has had on the organisation and the corresponding position in relation to our operational activity and performance. 4.1 Responding to COVID-19 Following the publication on 3 March 2020 of a coronavirus action plan by the governments of the UK and the subsequent declaration of a', 'OVERVIEW 1. Purpose This Overview aims to provide the reader with sufficient information to understand the purpose of the NHS Grampian Board, the key risks to the achievement of its objectives and how it has performed during the year. Should you wish to find out more detailed information we have provided this in the rest of the Performance Report, the Accountability Report and the financial statements. NHS Grampian publishes a wide range of information on its services and activities on its website which you can find at: https://www.nhsgrampian.org/ 2. Statement from the Chief Executive Looking back on 2020/21, it is difficult not to view the year just past as being anything other than exceptional in terms of its impact on our staff, the NHS and the population as a whole. Since taking up the role as Chief Executive at the beginning of November and in my previous role as the Director of Nursing, Midwifery and Allied Health Professionals I have been very proud of the outstanding response from our staff, partners and the public in addressing the challenges that COVID-19 has presented, often in the most difficult of circumstances. The impact of COVID-19 has been enduring and through both Operation Rainbow and Operation Snowdrop exceptional steps have been required to']","£1,278,002 (£000)","['£1,278,002 (£000)']",Q_2021_FIN_02,Grampian-2020-2021,MOD,number,[28],skipped
By how much did NHS Grampian's actual core expenditure differ from its revenue resource limit in 2020/21?,"1,278,771","['7. Financial Performance and Position (cont) 7.2 Grampian Health Board performance against statutory financial targets The results of each of the partner organisations, although consolidated with the main Board accounts for group accounting purposes, do not form part of the statutory financial target set for NHS Boards by the (SGHSCD) and are therefore not taken in to account when considering the Board’s in year financial performance. The three annual financial targets set for each Health Board by the SGHSCD are: ➢ Revenue Resource Limit (RRL)– a resource budget for ongoing activity; ➢ Capital Resource Limit (CRL) – a resource budget for net capital investment; and ➢ Cash Requirement – a financing requirement to fund the cash consequences of ongoing activity and net capital investment. Health Boards are required to contain their net expenditure within these limits, and report on any variation. Grampian Health Board has successfully achieved all three financial targets for the year reporting an outturn against these set limits as follows: Statutory Financial Targets Limit as set by Actual Variance Under SGHSCD Outturn £000’s £000’s £000’s Core Revenue Resource Limit 1,278,771 1,278,002 769 Non-Core Revenue Resource Limit 32,340 32,340 - Total 1,311,111 1,310,342 769 Core Capital Resource Limit 42,246 42,246 - Non-Core Capital Resource Limit 1,070 1,070 -', 'Board has successfully achieved all three financial targets for the year reporting an outturn against these set limits as follows: Statutory Financial Targets Limit as set by Actual Variance Under SGHSCD Outturn £000’s £000’s £000’s Core Revenue Resource Limit 1,278,771 1,278,002 769 Non-Core Revenue Resource Limit 32,340 32,340 - Total 1,311,111 1,310,342 769 Core Capital Resource Limit 42,246 42,246 - Non-Core Capital Resource Limit 1,070 1,070 - Total 43,316 43,316 - Cash Requirement 1,298,124 1,298,124 - Memorandum for In Year Out-turn £000 Core Revenue Resource Variance Surplus in 2020/21 769 Financial flexibility : funding banked with Scottish Government 0 Underlying Surplus against Core Revenue Resource Limit 769 0% The Board is reporting an underspend of £0.769m against a target of breakeven on the revenue resource limit for 2020/21. Due to the impact of the COVID-19 pandemic, the Scottish Government paused the Annual Operating and financial planning process. Recognising the exceptional nature of 2020-21 and the impact on delivery of financial plans, additional non- repayable funding was provided to support in-year financial balance across all NHS Boards. NHS Grampian received £47.3m. The flexibility allowed within the previously agreed three-year financial planning and performance cycle, allowed NHS Grampian to bank £1m from the reported surplus in 2019/20, with the Scottish Government, for', 'be exchanged between knowledgeable, willing parties in an arms-length transaction. 6) Funding 6 (a) Grampian Health Board Most of the expenditure of the Health Board as Commissioner is met from funds advanced by the Scottish Government within an approved revenue resource limit (RRL) . Cash drawn down to fund expenditure within this approved revenue resource limit is credited to the general fund. All other income receivable by the board that is not classed as funding is recognised when the transfer of goods or services (the performance obligation) is satisfied. Where income is received for goods or services that will not be delivered in the current financial year, that income is deferred. Income from the sale of non-current assets is recognised only when all material conditions of sale have been met, and is measured as the sums due under the sale contract. Non-discretionary funding out-with the RRL is allocated to match actual expenditure incurred for the provision of specific pharmaceutical, dental or ophthalmic services identified by the Scottish Government. Non-discretionary expenditure is disclosed in the accounts and deducted from operating costs charged against the RRL in the Statement of Resource Outturn. Funding for the acquisition of capital assets received from the Scottish Government is credited to the general fund when cash', 'out-with the RRL is allocated to match actual expenditure incurred for the provision of specific pharmaceutical, dental or ophthalmic services identified by the Scottish Government. Non-discretionary expenditure is disclosed in the accounts and deducted from operating costs charged against the RRL in the Statement of Resource Outturn. Funding for the acquisition of capital assets received from the Scottish Government is credited to the general fund when cash is drawn down.', 'Joint Arrangements each IJB is considered to be a Joint Venture and the primary financial statements have been amended for the additional disclosure required to accurately reflect the interest of IJBs using the equity method of accounting in accordance with IAS 28 – Investments in Associates and Joint arrangements. 3) Retrospective Restatements There are no adjustments to prior year figures required to be reflected in the accounts. 4) Going Concern The accounts are prepared on a going concern basis, which provides that the Board members have a reasonable expectation that the entity will continue in operational existence for the foreseeable future. 5) Accounting Convention The Accounts are prepared on a historical cost basis, as modified by the revaluation of property, plant and equipment and available for sale financial assets and liabilities. Fair value is defined as the amount for which an asset could be exchanged between knowledgeable, willing parties in an arms-length transaction. 6) Funding 6 (a) Grampian Health Board Most of the expenditure of the Health Board as Commissioner is met from funds advanced by the Scottish Government within an approved revenue resource limit (RRL) . Cash drawn down to fund expenditure within this approved revenue resource limit is credited to the general fund. All other income receivable by']",£769 (£000) surplus,['£769 (£000) surplus'],Q_2021_FIN_03,Grampian-2020-2021,MOD,number,[28],skipped
"Did NHS Grampian overspend or underspend its Core Revenue Resource Limit in 2020/21, and by how much?",,"['Board has successfully achieved all three financial targets for the year reporting an outturn against these set limits as follows: Statutory Financial Targets Limit as set by Actual Variance Under SGHSCD Outturn £000’s £000’s £000’s Core Revenue Resource Limit 1,278,771 1,278,002 769 Non-Core Revenue Resource Limit 32,340 32,340 - Total 1,311,111 1,310,342 769 Core Capital Resource Limit 42,246 42,246 - Non-Core Capital Resource Limit 1,070 1,070 - Total 43,316 43,316 - Cash Requirement 1,298,124 1,298,124 - Memorandum for In Year Out-turn £000 Core Revenue Resource Variance Surplus in 2020/21 769 Financial flexibility : funding banked with Scottish Government 0 Underlying Surplus against Core Revenue Resource Limit 769 0% The Board is reporting an underspend of £0.769m against a target of breakeven on the revenue resource limit for 2020/21. Due to the impact of the COVID-19 pandemic, the Scottish Government paused the Annual Operating and financial planning process. Recognising the exceptional nature of 2020-21 and the impact on delivery of financial plans, additional non- repayable funding was provided to support in-year financial balance across all NHS Boards. NHS Grampian received £47.3m. The flexibility allowed within the previously agreed three-year financial planning and performance cycle, allowed NHS Grampian to bank £1m from the reported surplus in 2019/20, with the Scottish Government, for', '7. Financial Performance and Position (cont) 7.2 Grampian Health Board performance against statutory financial targets The results of each of the partner organisations, although consolidated with the main Board accounts for group accounting purposes, do not form part of the statutory financial target set for NHS Boards by the (SGHSCD) and are therefore not taken in to account when considering the Board’s in year financial performance. The three annual financial targets set for each Health Board by the SGHSCD are: ➢ Revenue Resource Limit (RRL)– a resource budget for ongoing activity; ➢ Capital Resource Limit (CRL) – a resource budget for net capital investment; and ➢ Cash Requirement – a financing requirement to fund the cash consequences of ongoing activity and net capital investment. Health Boards are required to contain their net expenditure within these limits, and report on any variation. Grampian Health Board has successfully achieved all three financial targets for the year reporting an outturn against these set limits as follows: Statutory Financial Targets Limit as set by Actual Variance Under SGHSCD Outturn £000’s £000’s £000’s Core Revenue Resource Limit 1,278,771 1,278,002 769 Non-Core Revenue Resource Limit 32,340 32,340 - Total 1,311,111 1,310,342 769 Core Capital Resource Limit 42,246 42,246 - Non-Core Capital Resource Limit 1,070 1,070 -', 'be exchanged between knowledgeable, willing parties in an arms-length transaction. 6) Funding 6 (a) Grampian Health Board Most of the expenditure of the Health Board as Commissioner is met from funds advanced by the Scottish Government within an approved revenue resource limit (RRL) . Cash drawn down to fund expenditure within this approved revenue resource limit is credited to the general fund. All other income receivable by the board that is not classed as funding is recognised when the transfer of goods or services (the performance obligation) is satisfied. Where income is received for goods or services that will not be delivered in the current financial year, that income is deferred. Income from the sale of non-current assets is recognised only when all material conditions of sale have been met, and is measured as the sums due under the sale contract. Non-discretionary funding out-with the RRL is allocated to match actual expenditure incurred for the provision of specific pharmaceutical, dental or ophthalmic services identified by the Scottish Government. Non-discretionary expenditure is disclosed in the accounts and deducted from operating costs charged against the RRL in the Statement of Resource Outturn. Funding for the acquisition of capital assets received from the Scottish Government is credited to the general fund when cash', 'in force until 1 April 2024. The Scheme is an unfunded multi-employer defined benefit scheme where the share of the assets and liabilities applicable to each employer is not identified. NHS Grampian will therefore account for its pension costs on a defined contribution basis as permitted by International Accounting Standard 19. Details of the most recent scheme accounts published by the Scottish Public Pensions Agency (SPPA) can be accessed at the following link . NHS Grampian has no liability for other employers obligations to the multi-employer scheme and as the scheme is unfunded there can be no deficit or surplus to distribute on the wind-up of the scheme or withdrawal from the scheme. For 2020/21, normal employer contributions of £102.5 million were payable to the SPPA (2019/20 £93.2 million) at the rate of 20.9% of pensionable salaries (2019/20 20.9%). The total contributions made to the scheme, across all employers, for 2019/20 were £1,159.6 million (2018/19 £791.8 million per most recent published accounts for the NHS Superannuation Scheme). NHS Grampian’s share of the total employer contributions in 2019/20 was 8% (2018/19 8%). During 2020/21 NHS Grampian incurred no additional costs arising from the early retirement of staff (2019/20 nil). Provisions amounting to £8.2 million (2019/20 £8.2 million) are included in the', 'OVERVIEW 1. Purpose This Overview aims to provide the reader with sufficient information to understand the purpose of the NHS Grampian Board, the key risks to the achievement of its objectives and how it has performed during the year. Should you wish to find out more detailed information we have provided this in the rest of the Performance Report, the Accountability Report and the financial statements. NHS Grampian publishes a wide range of information on its services and activities on its website which you can find at: https://www.nhsgrampian.org/ 2. Statement from the Chief Executive Looking back on 2020/21, it is difficult not to view the year just past as being anything other than exceptional in terms of its impact on our staff, the NHS and the population as a whole. Since taking up the role as Chief Executive at the beginning of November and in my previous role as the Director of Nursing, Midwifery and Allied Health Professionals I have been very proud of the outstanding response from our staff, partners and the public in addressing the challenges that COVID-19 has presented, often in the most difficult of circumstances. The impact of COVID-19 has been enduring and through both Operation Rainbow and Operation Snowdrop exceptional steps have been required to']","Underspend of £769,000","['Underspend of £769,000']",Q_2021_FIN_P1,Grampian-2020-2021,MOD,number,[28],skipped
What was the approved cash financing requirement for NHS Grampian in 2020/21?,The three annual financial targets set for each Health Board by the SGHSCD are: ➢ Revenue Resource Limit (RRL)– a resource budget for ongoing activity; ➢ Capital Resource Limit (CRL) – a resource budget for net capital investment; and ➢ Cas,"['7. Financial Performance and Position (cont) 7.2 Grampian Health Board performance against statutory financial targets The results of each of the partner organisations, although consolidated with the main Board accounts for group accounting purposes, do not form part of the statutory financial target set for NHS Boards by the (SGHSCD) and are therefore not taken in to account when considering the Board’s in year financial performance. The three annual financial targets set for each Health Board by the SGHSCD are: ➢ Revenue Resource Limit (RRL)– a resource budget for ongoing activity; ➢ Capital Resource Limit (CRL) – a resource budget for net capital investment; and ➢ Cash Requirement – a financing requirement to fund the cash consequences of ongoing activity and net capital investment. Health Boards are required to contain their net expenditure within these limits, and report on any variation. Grampian Health Board has successfully achieved all three financial targets for the year reporting an outturn against these set limits as follows: Statutory Financial Targets Limit as set by Actual Variance Under SGHSCD Outturn £000’s £000’s £000’s Core Revenue Resource Limit 1,278,771 1,278,002 769 Non-Core Revenue Resource Limit 32,340 32,340 - Total 1,311,111 1,310,342 769 Core Capital Resource Limit 42,246 42,246 - Non-Core Capital Resource Limit 1,070 1,070 -', 'the wider community very seriously. The challenge for the Board is to maintain the excellent progress achieved to date, taking forward work for all 9 “protected characteristics” which make up equality and diversity during the challenging times caused by the COVID-19 pandemic. These “protected characteristics”, as defined by the Equality Act 2010 are: race, disability, age, sex (male or female), sexual orientation, gender reassignment, pregnancy and maternity, marriage and civil partnership and religion or belief. The Board has also embraced the requirements of the Equality Act (Specific Duties) (Scotland) Regulations 2012 and published reports including the following key updates on progress in 20/21: - An NHS Grampian Equality Outcomes Report 2021-2025, detailing what NHS Grampian wishes to achieve in the sphere of each of the 9 “protected characteristics” over the next 4 years. - An NHS Grampian “Mainstreaming” Report detailing what NHS Grampian has done in the last 2 years to make equality and diversity an integral part of the way we function as an organisation. NHS Grampian has also published a range of other non-Statutory Equality and Diversity Monitoring Reports on a wide range of topics. During 2020/21, over 1,500 NHS Grampian staff received Equality and Diversity Training by TEAMS at a level appropriate to their role in the', 'Board has successfully achieved all three financial targets for the year reporting an outturn against these set limits as follows: Statutory Financial Targets Limit as set by Actual Variance Under SGHSCD Outturn £000’s £000’s £000’s Core Revenue Resource Limit 1,278,771 1,278,002 769 Non-Core Revenue Resource Limit 32,340 32,340 - Total 1,311,111 1,310,342 769 Core Capital Resource Limit 42,246 42,246 - Non-Core Capital Resource Limit 1,070 1,070 - Total 43,316 43,316 - Cash Requirement 1,298,124 1,298,124 - Memorandum for In Year Out-turn £000 Core Revenue Resource Variance Surplus in 2020/21 769 Financial flexibility : funding banked with Scottish Government 0 Underlying Surplus against Core Revenue Resource Limit 769 0% The Board is reporting an underspend of £0.769m against a target of breakeven on the revenue resource limit for 2020/21. Due to the impact of the COVID-19 pandemic, the Scottish Government paused the Annual Operating and financial planning process. Recognising the exceptional nature of 2020-21 and the impact on delivery of financial plans, additional non- repayable funding was provided to support in-year financial balance across all NHS Boards. NHS Grampian received £47.3m. The flexibility allowed within the previously agreed three-year financial planning and performance cycle, allowed NHS Grampian to bank £1m from the reported surplus in 2019/20, with the Scottish Government, for', '9. Off payroll engagements The use of locum agency medical and nursing staff throughout the year is disclosed in section 2 above. All other staff engaged by NHS Grampian to provide services during the year for a period of longer than six months were remunerated through either NHS Grampian’s payroll or where those staff were seconded from a partner organisation e.g. a university or a local authority, they were remunerated through the payroll of that partner organisation. All Board members deemed to have significant financial responsibility during the year were remunerated through NHS Grampian’s payroll. 10. Exit packages There was one exit package agreed in the year. There were no compulsory redundancies. 2020/21 2019/20 Exit Package cost band Total number of Total number of exit packages by exit packages by cost band cost band £0 - £10,000 1 0 £50,000 - £100,000 0 1 Total Resource Cost (£’000) 6 51 11. Trade Union (Facility Time Publication Requirements) Regulations 2017 The Trade Union (Facility Time Publication Requirements) Regulations 2017 requirement relevant public sector employers to publish, a range of data on the amount and cost of facility time. The following information relating to NHS Grampian is also published on the NHS Grampian website at https://www.nhsgrampian.org/about-us/annual-accounts/', 'be exchanged between knowledgeable, willing parties in an arms-length transaction. 6) Funding 6 (a) Grampian Health Board Most of the expenditure of the Health Board as Commissioner is met from funds advanced by the Scottish Government within an approved revenue resource limit (RRL) . Cash drawn down to fund expenditure within this approved revenue resource limit is credited to the general fund. All other income receivable by the board that is not classed as funding is recognised when the transfer of goods or services (the performance obligation) is satisfied. Where income is received for goods or services that will not be delivered in the current financial year, that income is deferred. Income from the sale of non-current assets is recognised only when all material conditions of sale have been met, and is measured as the sums due under the sale contract. Non-discretionary funding out-with the RRL is allocated to match actual expenditure incurred for the provision of specific pharmaceutical, dental or ophthalmic services identified by the Scottish Government. Non-discretionary expenditure is disclosed in the accounts and deducted from operating costs charged against the RRL in the Statement of Resource Outturn. Funding for the acquisition of capital assets received from the Scottish Government is credited to the general fund when cash']","£1,298,124 (£000)","['£1,298,124 (£000)']",Q_2021_FIN_04,Grampian-2020-2021,MOD,number,[28],skipped
What was the Total Revenue Resource Limit for 2020/21?,000,"['Board has successfully achieved all three financial targets for the year reporting an outturn against these set limits as follows: Statutory Financial Targets Limit as set by Actual Variance Under SGHSCD Outturn £000’s £000’s £000’s Core Revenue Resource Limit 1,278,771 1,278,002 769 Non-Core Revenue Resource Limit 32,340 32,340 - Total 1,311,111 1,310,342 769 Core Capital Resource Limit 42,246 42,246 - Non-Core Capital Resource Limit 1,070 1,070 - Total 43,316 43,316 - Cash Requirement 1,298,124 1,298,124 - Memorandum for In Year Out-turn £000 Core Revenue Resource Variance Surplus in 2020/21 769 Financial flexibility : funding banked with Scottish Government 0 Underlying Surplus against Core Revenue Resource Limit 769 0% The Board is reporting an underspend of £0.769m against a target of breakeven on the revenue resource limit for 2020/21. Due to the impact of the COVID-19 pandemic, the Scottish Government paused the Annual Operating and financial planning process. Recognising the exceptional nature of 2020-21 and the impact on delivery of financial plans, additional non- repayable funding was provided to support in-year financial balance across all NHS Boards. NHS Grampian received £47.3m. The flexibility allowed within the previously agreed three-year financial planning and performance cycle, allowed NHS Grampian to bank £1m from the reported surplus in 2019/20, with the Scottish Government, for', '7. Financial Performance and Position (cont) 7.2 Grampian Health Board performance against statutory financial targets The results of each of the partner organisations, although consolidated with the main Board accounts for group accounting purposes, do not form part of the statutory financial target set for NHS Boards by the (SGHSCD) and are therefore not taken in to account when considering the Board’s in year financial performance. The three annual financial targets set for each Health Board by the SGHSCD are: ➢ Revenue Resource Limit (RRL)– a resource budget for ongoing activity; ➢ Capital Resource Limit (CRL) – a resource budget for net capital investment; and ➢ Cash Requirement – a financing requirement to fund the cash consequences of ongoing activity and net capital investment. Health Boards are required to contain their net expenditure within these limits, and report on any variation. Grampian Health Board has successfully achieved all three financial targets for the year reporting an outturn against these set limits as follows: Statutory Financial Targets Limit as set by Actual Variance Under SGHSCD Outturn £000’s £000’s £000’s Core Revenue Resource Limit 1,278,771 1,278,002 769 Non-Core Revenue Resource Limit 32,340 32,340 - Total 1,311,111 1,310,342 769 Core Capital Resource Limit 42,246 42,246 - Non-Core Capital Resource Limit 1,070 1,070 -', 'be exchanged between knowledgeable, willing parties in an arms-length transaction. 6) Funding 6 (a) Grampian Health Board Most of the expenditure of the Health Board as Commissioner is met from funds advanced by the Scottish Government within an approved revenue resource limit (RRL) . Cash drawn down to fund expenditure within this approved revenue resource limit is credited to the general fund. All other income receivable by the board that is not classed as funding is recognised when the transfer of goods or services (the performance obligation) is satisfied. Where income is received for goods or services that will not be delivered in the current financial year, that income is deferred. Income from the sale of non-current assets is recognised only when all material conditions of sale have been met, and is measured as the sums due under the sale contract. Non-discretionary funding out-with the RRL is allocated to match actual expenditure incurred for the provision of specific pharmaceutical, dental or ophthalmic services identified by the Scottish Government. Non-discretionary expenditure is disclosed in the accounts and deducted from operating costs charged against the RRL in the Statement of Resource Outturn. Funding for the acquisition of capital assets received from the Scottish Government is credited to the general fund when cash', ""7. Financial Performance and Position (cont) 7.1.1 Grampian Health Board Endowment Funds (cont) The total Funds available to the charity at 31 March 2021 were £45.441 million summarised as follows:- The Funds of the Charity £000's Restricted Funds 2,034, 4% General Funds (Unrestricted) 14,956, 33% 24,077, 53% Revaluation Reserve (unrestricted) 4,374, 10% Designated Hospital Funds (unrestricted) Total income for the year was £3.525 million (2019/20: £3.531 million) analysed as follows:- NHS Grampian Endowment Funds Income analysis 1,534 1,533 1,314 £000's 1,080 918 677 DONATIONS LEGACIES INVESTMENT 2020/21 2019/20 Although total income received in 2020/21 was consistent with the prior year, the pandemic had a significant impact on the profile of income available to the charity. Donations of £0.6m were received from our local communities specifically for COVID-19 response and recovery and a further £0.2m was received from NHS Charities together, following a national fundraising campaign. This additional source masked a drop in income from other donations, bequests and dividends on investments reflecting a shift in public sentiment towards support for COVID-19 response and many companies holding back on dividend payments to"", 'Joint Arrangements each IJB is considered to be a Joint Venture and the primary financial statements have been amended for the additional disclosure required to accurately reflect the interest of IJBs using the equity method of accounting in accordance with IAS 28 – Investments in Associates and Joint arrangements. 3) Retrospective Restatements There are no adjustments to prior year figures required to be reflected in the accounts. 4) Going Concern The accounts are prepared on a going concern basis, which provides that the Board members have a reasonable expectation that the entity will continue in operational existence for the foreseeable future. 5) Accounting Convention The Accounts are prepared on a historical cost basis, as modified by the revaluation of property, plant and equipment and available for sale financial assets and liabilities. Fair value is defined as the amount for which an asset could be exchanged between knowledgeable, willing parties in an arms-length transaction. 6) Funding 6 (a) Grampian Health Board Most of the expenditure of the Health Board as Commissioner is met from funds advanced by the Scottish Government within an approved revenue resource limit (RRL) . Cash drawn down to fund expenditure within this approved revenue resource limit is credited to the general fund. All other income receivable by']","£1,311,111 (£000)","['£1,311,111 (£000)']",Q_2021_FIN_05,Grampian-2020-2021,LEX,number,[28],skipped
What was the Core Capital Resource Limit for 2020/21?,Board has successfully achieved all three financial targets for the year reporting an outturn against these set limits as follows: Statutory Financial Targets Limit as set by Actual Variance Under SGHSCD Outturn £000’s £000’s £000’s Core Re,"['Board has successfully achieved all three financial targets for the year reporting an outturn against these set limits as follows: Statutory Financial Targets Limit as set by Actual Variance Under SGHSCD Outturn £000’s £000’s £000’s Core Revenue Resource Limit 1,278,771 1,278,002 769 Non-Core Revenue Resource Limit 32,340 32,340 - Total 1,311,111 1,310,342 769 Core Capital Resource Limit 42,246 42,246 - Non-Core Capital Resource Limit 1,070 1,070 - Total 43,316 43,316 - Cash Requirement 1,298,124 1,298,124 - Memorandum for In Year Out-turn £000 Core Revenue Resource Variance Surplus in 2020/21 769 Financial flexibility : funding banked with Scottish Government 0 Underlying Surplus against Core Revenue Resource Limit 769 0% The Board is reporting an underspend of £0.769m against a target of breakeven on the revenue resource limit for 2020/21. Due to the impact of the COVID-19 pandemic, the Scottish Government paused the Annual Operating and financial planning process. Recognising the exceptional nature of 2020-21 and the impact on delivery of financial plans, additional non- repayable funding was provided to support in-year financial balance across all NHS Boards. NHS Grampian received £47.3m. The flexibility allowed within the previously agreed three-year financial planning and performance cycle, allowed NHS Grampian to bank £1m from the reported surplus in 2019/20, with the Scottish Government, for', '7. Financial Performance and Position (cont) 7.2 Grampian Health Board performance against statutory financial targets The results of each of the partner organisations, although consolidated with the main Board accounts for group accounting purposes, do not form part of the statutory financial target set for NHS Boards by the (SGHSCD) and are therefore not taken in to account when considering the Board’s in year financial performance. The three annual financial targets set for each Health Board by the SGHSCD are: ➢ Revenue Resource Limit (RRL)– a resource budget for ongoing activity; ➢ Capital Resource Limit (CRL) – a resource budget for net capital investment; and ➢ Cash Requirement – a financing requirement to fund the cash consequences of ongoing activity and net capital investment. Health Boards are required to contain their net expenditure within these limits, and report on any variation. Grampian Health Board has successfully achieved all three financial targets for the year reporting an outturn against these set limits as follows: Statutory Financial Targets Limit as set by Actual Variance Under SGHSCD Outturn £000’s £000’s £000’s Core Revenue Resource Limit 1,278,771 1,278,002 769 Non-Core Revenue Resource Limit 32,340 32,340 - Total 1,311,111 1,310,342 769 Core Capital Resource Limit 42,246 42,246 - Non-Core Capital Resource Limit 1,070 1,070 -', ""Financial table on page 105 (Income Statement) Contains 26 line items across 4 columns. Row labels: NOTE2ASUMMARYOFCOREREVENUERESOURCEOUTTUR; SUMMARYOFCOREREVENUERESOURCEOUTTURN; Netexpenditure; TotalNonCoreExpenditure(seebelow). Key items: NOTE2ASUMMARYOFCOREREVENUERESOURCEOUTTUR | N; SUMMARYOFCOREREVENUERESOURCEOUTTURN | 2020/21 | 2020/21; £’000 | £’000; Netexpenditure | 1,353,248; TotalNonCoreExpenditure(seebelow) | (32,340).\n\nTable (header-injected facts):\n\n- SUMMARYOFCOREREVENUERESOURCEOUTTURN > 2 : 2020/21\n- SUMMARYOFCOREREVENUERESOURCEOUTTURN > 3 : 2020/21\n- Netexpenditure > 3 : 1,353,248\n- TotalNonCoreExpenditure(seebelow) > 3 : (32,340)\n- FHSNonDiscretionaryAllocation > 3 : (65,425)\n- DonatedAssetsIncome > 3 : 1,051\n- EndowmentNetOperatingCosts > 3 : 348\n- JointVenturesaccountedforonanequitybasis > 3 : 21,120\n- TotalCoreExpenditure > 3 : 1,278,002\n- CoreRevenueResourceLimit > 3 : 1,278,771\n- Saving/(excess)againstCoreRevenueResourceLimit > 3 : 769\n- Depreciation/Amortisation > 2 : 24,215\n- AnnuallyManagedExpenditure-Impairments > 2 : 1,262\n- AnnuallyManagedExpenditure-CreationofProvisions > 2 : 66\n- AnnuallyManagedExpenditure-DepreciationofDonatedAssets > 2 : 1,566\n- AdditionalSGHSCDnon-corefunding > 2 : 5,231\n- TotalNonCoreExpenditure > 3 : 32,340\n- NonCoreRevenueResourceLimit > 3 : 32,340\n- Saving/(excess)againstNonCoreRevenueResourceLimit > 3 : 0\n- SUMMARYRESOURCEOUTTURN > 1 N : Resource\n- SUMMARYRESOURCEOUTTURN > 2 : Expenditure\n- SUMMARYRESOURCEOUTTURN > 3 : Saving/(excess)\n- Core > 1 N : 1,278,771\n- Core > 2 : 1,278,002\n- Core > 3 : 769\n- NonCore > 1 N : 32,340\n- NonCore > 2 : 32,340\n- NonCore > 3 : 0\n- Total > 1 N : 1,311,111\n- Total > 2 : 1,310,342\n- Total > 3 : 769\n- Column headers: Row label > 1 N : 1 N\n- Column headers: Row label > 2 : 2\n- Column headers: Row label > 3 : 3\n\nTable (markdown):\n\n| 0 | 1 | 2 | 3 |\n| --- | --- | --- | --- |\n| NOTE2ASUMMARYOFCOREREVENUERESOURCEOUTTUR | N |  |  |\n| SUMMARYOFCOREREVENUERESOURCEOUTTURN |  | 2020/21 | 2020/21 |\n|  |  | £’000 | £’000 |\n| Netexpenditure |  |  | 1,353,248 |\n| TotalNonCoreExpenditure(seebelow) |  |  | (32,340) |\n| FHSNonDiscretionaryAllocation |  |  | (65,425) |\n| DonatedAssetsIncome |  |  | 1,051 |\n| EndowmentNetOperatingCosts |  |  | 348 |\n| JointVenturesaccountedforonanequitybasis |  |  | 21,120 |\n| TotalCoreExpenditure |  |  | 1,278,002 |\n| CoreRevenueResourceLimit |  |  | 1,278,771 |\n| Saving/(excess)againstCoreRevenueResourceLimit |  |  | 769 |\n| SUMMARYOFNONCOREREVENUERESOURCEOUTTURN |  |  |  |\n| Depreciation/Amortisation |  | 24,215 |  |\n| AnnuallyManagedExpenditure-Impairments |  | 1,262 |  |\n| AnnuallyManagedExpenditure-CreationofProvisions |  | 66 |  |\n| AnnuallyManagedExpenditure-DepreciationofDonatedAssets |  | 1,566 |  |\n| AdditionalSGHSCDnon-corefunding |  | 5,231 |  |\n| TotalNonCoreExpenditure |  |  | 32,340 |\n| NonCoreRevenueResourceLimit |  |  | 32,340 |\n| Saving/(excess)againstNonCoreRevenueResourceLimit |  |  | 0 |\n| SUMMARYRESOURCEOUTTURN | Resource | Expenditure | Saving/(excess) |\n|  | £'000 | £'000 | £'000 |\n| Core | 1,278,771 | 1,278,002 | 769 |\n| NonCore | 32,340 | 32,340 | 0 |\n| Total | 1,311,111 | 1,310,342 | 769 |\nColumn headers: Row label | 1 N | 2 | 3\nRow map:\n- SUMMARYOFCOREREVENUERESOURCEOUTTURN -> col_2=2020/21 ; col_3=2020/21\n- Core -> col_1=1,278,771 ; col_2=1,278,002 ; col_3=769\n- NonCore -> col_1=32,340 ; col_2=32,340 ; col_3=0\n- Total -> col_1=1,311,111 ; col_2=1,310,342 ; col_3=769"", 'be exchanged between knowledgeable, willing parties in an arms-length transaction. 6) Funding 6 (a) Grampian Health Board Most of the expenditure of the Health Board as Commissioner is met from funds advanced by the Scottish Government within an approved revenue resource limit (RRL) . Cash drawn down to fund expenditure within this approved revenue resource limit is credited to the general fund. All other income receivable by the board that is not classed as funding is recognised when the transfer of goods or services (the performance obligation) is satisfied. Where income is received for goods or services that will not be delivered in the current financial year, that income is deferred. Income from the sale of non-current assets is recognised only when all material conditions of sale have been met, and is measured as the sums due under the sale contract. Non-discretionary funding out-with the RRL is allocated to match actual expenditure incurred for the provision of specific pharmaceutical, dental or ophthalmic services identified by the Scottish Government. Non-discretionary expenditure is disclosed in the accounts and deducted from operating costs charged against the RRL in the Statement of Resource Outturn. Funding for the acquisition of capital assets received from the Scottish Government is credited to the general fund when cash', 'Joint Arrangements each IJB is considered to be a Joint Venture and the primary financial statements have been amended for the additional disclosure required to accurately reflect the interest of IJBs using the equity method of accounting in accordance with IAS 28 – Investments in Associates and Joint arrangements. 3) Retrospective Restatements There are no adjustments to prior year figures required to be reflected in the accounts. 4) Going Concern The accounts are prepared on a going concern basis, which provides that the Board members have a reasonable expectation that the entity will continue in operational existence for the foreseeable future. 5) Accounting Convention The Accounts are prepared on a historical cost basis, as modified by the revaluation of property, plant and equipment and available for sale financial assets and liabilities. Fair value is defined as the amount for which an asset could be exchanged between knowledgeable, willing parties in an arms-length transaction. 6) Funding 6 (a) Grampian Health Board Most of the expenditure of the Health Board as Commissioner is met from funds advanced by the Scottish Government within an approved revenue resource limit (RRL) . Cash drawn down to fund expenditure within this approved revenue resource limit is credited to the general fund. All other income receivable by']","£42,246 (£000)","['£42,246 (£000)']",Q_2021_FIN_06,Grampian-2020-2021,LEX,number,[28],skipped
What was the underlying surplus against the Core Revenue Resource Limit in 2020/21?,,"['Board has successfully achieved all three financial targets for the year reporting an outturn against these set limits as follows: Statutory Financial Targets Limit as set by Actual Variance Under SGHSCD Outturn £000’s £000’s £000’s Core Revenue Resource Limit 1,278,771 1,278,002 769 Non-Core Revenue Resource Limit 32,340 32,340 - Total 1,311,111 1,310,342 769 Core Capital Resource Limit 42,246 42,246 - Non-Core Capital Resource Limit 1,070 1,070 - Total 43,316 43,316 - Cash Requirement 1,298,124 1,298,124 - Memorandum for In Year Out-turn £000 Core Revenue Resource Variance Surplus in 2020/21 769 Financial flexibility : funding banked with Scottish Government 0 Underlying Surplus against Core Revenue Resource Limit 769 0% The Board is reporting an underspend of £0.769m against a target of breakeven on the revenue resource limit for 2020/21. Due to the impact of the COVID-19 pandemic, the Scottish Government paused the Annual Operating and financial planning process. Recognising the exceptional nature of 2020-21 and the impact on delivery of financial plans, additional non- repayable funding was provided to support in-year financial balance across all NHS Boards. NHS Grampian received £47.3m. The flexibility allowed within the previously agreed three-year financial planning and performance cycle, allowed NHS Grampian to bank £1m from the reported surplus in 2019/20, with the Scottish Government, for', '7. Financial Performance and Position (cont) 7.2 Grampian Health Board performance against statutory financial targets The results of each of the partner organisations, although consolidated with the main Board accounts for group accounting purposes, do not form part of the statutory financial target set for NHS Boards by the (SGHSCD) and are therefore not taken in to account when considering the Board’s in year financial performance. The three annual financial targets set for each Health Board by the SGHSCD are: ➢ Revenue Resource Limit (RRL)– a resource budget for ongoing activity; ➢ Capital Resource Limit (CRL) – a resource budget for net capital investment; and ➢ Cash Requirement – a financing requirement to fund the cash consequences of ongoing activity and net capital investment. Health Boards are required to contain their net expenditure within these limits, and report on any variation. Grampian Health Board has successfully achieved all three financial targets for the year reporting an outturn against these set limits as follows: Statutory Financial Targets Limit as set by Actual Variance Under SGHSCD Outturn £000’s £000’s £000’s Core Revenue Resource Limit 1,278,771 1,278,002 769 Non-Core Revenue Resource Limit 32,340 32,340 - Total 1,311,111 1,310,342 769 Core Capital Resource Limit 42,246 42,246 - Non-Core Capital Resource Limit 1,070 1,070 -', 'Moray IJB reported a surplus for the year of £6.155 million (2019/20: deficit of £0.070m) increasing the retained reserves carried forward to £6.342 million (2019/20 £0.187 million). This reflects: An increase in general reserves to £1.597 million (2019/20 nil) made possible due to - an underspend against the revenue budget arising from the impact of the COVID-19 pandemic on mainstream services which were operating on mainly an emergency basis throughout the year, An increase in earmarked reserves of £4.557 million to £4.744 million (2019/20 - £0.187 million) due to the allocation', 'Aberdeen City IJB reported an overall surplus of £15.634 million for the year (2019/20: £2.976 million deficit), increasing the retained reserves carried forward to £18.236 million (2019/20 £2.602 million). This reflects: An increase in the general risk fund of £1.229 million to £2.5 million (2019/20 £1.271 - million) made possible due to an underspend against the revenue budget arising from the impact of the COVID-19 pandemic on mainstream services which were operating on mainly an emergency basis throughout the year, An increase in earmarked reserves of £14.404 million to £15.735 million (2019/20 - £1.331 million) due to the allocation', 'be exchanged between knowledgeable, willing parties in an arms-length transaction. 6) Funding 6 (a) Grampian Health Board Most of the expenditure of the Health Board as Commissioner is met from funds advanced by the Scottish Government within an approved revenue resource limit (RRL) . Cash drawn down to fund expenditure within this approved revenue resource limit is credited to the general fund. All other income receivable by the board that is not classed as funding is recognised when the transfer of goods or services (the performance obligation) is satisfied. Where income is received for goods or services that will not be delivered in the current financial year, that income is deferred. Income from the sale of non-current assets is recognised only when all material conditions of sale have been met, and is measured as the sums due under the sale contract. Non-discretionary funding out-with the RRL is allocated to match actual expenditure incurred for the provision of specific pharmaceutical, dental or ophthalmic services identified by the Scottish Government. Non-discretionary expenditure is disclosed in the accounts and deducted from operating costs charged against the RRL in the Statement of Resource Outturn. Funding for the acquisition of capital assets received from the Scottish Government is credited to the general fund when cash']","£769 (£000), 0%","['£769 (£000), 0%']",Q_2021_FIN_07,Grampian-2020-2021,LEX,number,[28],skipped
How did NHS Grampian's total cash financing requirement compare to the limit set by the Scottish Government in 2020/21?,7,"['7. Financial Performance and Position (cont) 7.2 Grampian Health Board performance against statutory financial targets The results of each of the partner organisations, although consolidated with the main Board accounts for group accounting purposes, do not form part of the statutory financial target set for NHS Boards by the (SGHSCD) and are therefore not taken in to account when considering the Board’s in year financial performance. The three annual financial targets set for each Health Board by the SGHSCD are: ➢ Revenue Resource Limit (RRL)– a resource budget for ongoing activity; ➢ Capital Resource Limit (CRL) – a resource budget for net capital investment; and ➢ Cash Requirement – a financing requirement to fund the cash consequences of ongoing activity and net capital investment. Health Boards are required to contain their net expenditure within these limits, and report on any variation. Grampian Health Board has successfully achieved all three financial targets for the year reporting an outturn against these set limits as follows: Statutory Financial Targets Limit as set by Actual Variance Under SGHSCD Outturn £000’s £000’s £000’s Core Revenue Resource Limit 1,278,771 1,278,002 769 Non-Core Revenue Resource Limit 32,340 32,340 - Total 1,311,111 1,310,342 769 Core Capital Resource Limit 42,246 42,246 - Non-Core Capital Resource Limit 1,070 1,070 -', 'Board has successfully achieved all three financial targets for the year reporting an outturn against these set limits as follows: Statutory Financial Targets Limit as set by Actual Variance Under SGHSCD Outturn £000’s £000’s £000’s Core Revenue Resource Limit 1,278,771 1,278,002 769 Non-Core Revenue Resource Limit 32,340 32,340 - Total 1,311,111 1,310,342 769 Core Capital Resource Limit 42,246 42,246 - Non-Core Capital Resource Limit 1,070 1,070 - Total 43,316 43,316 - Cash Requirement 1,298,124 1,298,124 - Memorandum for In Year Out-turn £000 Core Revenue Resource Variance Surplus in 2020/21 769 Financial flexibility : funding banked with Scottish Government 0 Underlying Surplus against Core Revenue Resource Limit 769 0% The Board is reporting an underspend of £0.769m against a target of breakeven on the revenue resource limit for 2020/21. Due to the impact of the COVID-19 pandemic, the Scottish Government paused the Annual Operating and financial planning process. Recognising the exceptional nature of 2020-21 and the impact on delivery of financial plans, additional non- repayable funding was provided to support in-year financial balance across all NHS Boards. NHS Grampian received £47.3m. The flexibility allowed within the previously agreed three-year financial planning and performance cycle, allowed NHS Grampian to bank £1m from the reported surplus in 2019/20, with the Scottish Government, for', 'be exchanged between knowledgeable, willing parties in an arms-length transaction. 6) Funding 6 (a) Grampian Health Board Most of the expenditure of the Health Board as Commissioner is met from funds advanced by the Scottish Government within an approved revenue resource limit (RRL) . Cash drawn down to fund expenditure within this approved revenue resource limit is credited to the general fund. All other income receivable by the board that is not classed as funding is recognised when the transfer of goods or services (the performance obligation) is satisfied. Where income is received for goods or services that will not be delivered in the current financial year, that income is deferred. Income from the sale of non-current assets is recognised only when all material conditions of sale have been met, and is measured as the sums due under the sale contract. Non-discretionary funding out-with the RRL is allocated to match actual expenditure incurred for the provision of specific pharmaceutical, dental or ophthalmic services identified by the Scottish Government. Non-discretionary expenditure is disclosed in the accounts and deducted from operating costs charged against the RRL in the Statement of Resource Outturn. Funding for the acquisition of capital assets received from the Scottish Government is credited to the general fund when cash', 'in force until 1 April 2024. The Scheme is an unfunded multi-employer defined benefit scheme where the share of the assets and liabilities applicable to each employer is not identified. NHS Grampian will therefore account for its pension costs on a defined contribution basis as permitted by International Accounting Standard 19. Details of the most recent scheme accounts published by the Scottish Public Pensions Agency (SPPA) can be accessed at the following link . NHS Grampian has no liability for other employers obligations to the multi-employer scheme and as the scheme is unfunded there can be no deficit or surplus to distribute on the wind-up of the scheme or withdrawal from the scheme. For 2020/21, normal employer contributions of £102.5 million were payable to the SPPA (2019/20 £93.2 million) at the rate of 20.9% of pensionable salaries (2019/20 20.9%). The total contributions made to the scheme, across all employers, for 2019/20 were £1,159.6 million (2018/19 £791.8 million per most recent published accounts for the NHS Superannuation Scheme). NHS Grampian’s share of the total employer contributions in 2019/20 was 8% (2018/19 8%). During 2020/21 NHS Grampian incurred no additional costs arising from the early retirement of staff (2019/20 nil). Provisions amounting to £8.2 million (2019/20 £8.2 million) are included in the', 'Joint Arrangements each IJB is considered to be a Joint Venture and the primary financial statements have been amended for the additional disclosure required to accurately reflect the interest of IJBs using the equity method of accounting in accordance with IAS 28 – Investments in Associates and Joint arrangements. 3) Retrospective Restatements There are no adjustments to prior year figures required to be reflected in the accounts. 4) Going Concern The accounts are prepared on a going concern basis, which provides that the Board members have a reasonable expectation that the entity will continue in operational existence for the foreseeable future. 5) Accounting Convention The Accounts are prepared on a historical cost basis, as modified by the revaluation of property, plant and equipment and available for sale financial assets and liabilities. Fair value is defined as the amount for which an asset could be exchanged between knowledgeable, willing parties in an arms-length transaction. 6) Funding 6 (a) Grampian Health Board Most of the expenditure of the Health Board as Commissioner is met from funds advanced by the Scottish Government within an approved revenue resource limit (RRL) . Cash drawn down to fund expenditure within this approved revenue resource limit is credited to the general fund. All other income receivable by']","NHS Grampian met the Cash Requirement exactly at £1,298,124 with no variance","['NHS Grampian met the Cash Requirement exactly at £1,298,124 with no variance']",Q_2021_FIN_P2,Grampian-2020-2021,STR,text,[28],skipped
How much in efficiency savings did NHS Grampian deliver during 2020/21?,7,"['7. Financial Performance and Position (cont) 7.2.1 Efficiency Savings Efficiency savings of £6.7 million were achieved against a target of £12.2 million for NHS Grampian services, mainly from the reduction in the use of agency medical and nursing staff compared to 2019/20. Recurring savings amounted to £6.05 million and non-recurring of £0.65 million. The gap of £5.5 million was covered non-recurringly by the Scottish Government through their COVID-19 supplementary funding allocation, recognising that the focus of budget managers was not in the delivery of savings during the period of the Board being on an emergency footing. 7.2 Grampian Health Board performance against statutory financial targets 7.2.2 Financial impact of the COVID-19 Pandemic It is important to recognise that, although there were additional direct costs incurred as a result of specific initiatives, the Board’s COVID-19 recovery and remobilisation response was a whole system effort delivered under emergency provisions with the majority of our core services reconfigured to manage the impact. Accordingly many of the variations in cost between 2020/21 and 2019/20 reflect the indirect impact of the COVID-19 pandemic on staffing, activity and service levels. The Board received a specific supplementary allocation of £48.6 million during the year from the Scottish Government to cover the additional direct costs associated with the', 'delivered under emergency provisions with the majority of our core services reconfigured to manage the impact. Accordingly many of the variations in cost between 2020/21 and 2019/20 reflect the indirect impact of the COVID-19 pandemic on staffing, activity and service levels. The Board received a specific supplementary allocation of £48.6 million during the year from the Scottish Government to cover the additional direct costs associated with the COVID-19 response and remobilisation. The main areas incurring additional costs were in additional temporary staffing (student nurses, junior medical staff, Domestics, Porters and additional overtime), costs of additional bed capacity (ITU and Medical beds), loss of income (catering, retail) and spend on IT equipment. In the last quarter of the year significant costs were incurred on the COVID-19 vaccination programme, the Regional Testing Hub and Contact Tracing staffing costs. As explained above, the Scottish Government through this allocation, also funded £5.5 million of unmet efficiency savings targets and local savings of £6.7 million were made available to cover part of these additional costs, mainly resulting from reduced levels of elective surgical and outpatient activity over the year. In addition, the Integration Joint Boards received funding of £46.3 million to meet costs relating to health and social care services. 7.2.3 Expenditure Analysis Net expenditure', 'this allocation, also funded £5.5 million of unmet efficiency savings targets and local savings of £6.7 million were made available to cover part of these additional costs, mainly resulting from reduced levels of elective surgical and outpatient activity over the year. In addition, the Integration Joint Boards received funding of £46.3 million to meet costs relating to health and social care services. 7.2.3 Expenditure Analysis Net expenditure for the year was £1,375 million (2019/20 £1,194 million), an increase of £181 million over the prior year. The Consolidated Statement of Comprehensive Net Expenditure can be found on page 77, a more detailed analysis of Expenditure in note 3 on page 105 and a more detailed analysis of income in note 4 on page 106. Staff Costs increased by £79.2 million, mainly due to the impact of additional temporary staffing (student nurses, junior medical staff, Domestics, Porters and additional overtime) during the COVID-19 pandemic (£31.3 million), the annual pay uplift (£29.7 million), an increase in the level of untaken annual leave (£13.1 million) and the COVID-19 19', '2010 Sections 31 and 32 of the Public Services Reform (Scotland) Act 2010 impose duties on NHS Grampian to publish information on expenditure, economic sustainability and efficiency as soon as is reasonably practicable after the end of each financial year. The information required to comply with these disclosure requirements is not an integral part of the Annual Accounts and is displayed on the NHS Grampian website at the following link https://www.nhsgrampian.org/about-us/annual-accounts/ 16. Personal Data Related Incidents NHS Grampian formally reported personal data related incidents to the Information Commissioners Office (ICO) on twenty five occasions during 2020/21 (2019/20 twelve). Of these, eight did not meet the threshold for notification, but NHS Grampian notified the Information Commissioner voluntarily for their awareness. Two notifications were made and subsequently withdrawn. All of these incidents, and those relating to prior years, are now closed. Recommendations were made and acted upon but no enforcement action or penalties were applied by the ICO. 17. Financial Instruments Information in respect of the financial risk management objectives and policies of the Board and the exposure of the Board to price risk, credit risk, liquidity risk and cash flow risk is', 'OVERVIEW 1. Purpose This Overview aims to provide the reader with sufficient information to understand the purpose of the NHS Grampian Board, the key risks to the achievement of its objectives and how it has performed during the year. Should you wish to find out more detailed information we have provided this in the rest of the Performance Report, the Accountability Report and the financial statements. NHS Grampian publishes a wide range of information on its services and activities on its website which you can find at: https://www.nhsgrampian.org/ 2. Statement from the Chief Executive Looking back on 2020/21, it is difficult not to view the year just past as being anything other than exceptional in terms of its impact on our staff, the NHS and the population as a whole. Since taking up the role as Chief Executive at the beginning of November and in my previous role as the Director of Nursing, Midwifery and Allied Health Professionals I have been very proud of the outstanding response from our staff, partners and the public in addressing the challenges that COVID-19 has presented, often in the most difficult of circumstances. The impact of COVID-19 has been enduring and through both Operation Rainbow and Operation Snowdrop exceptional steps have been required to']",£6.7 million,['£6.7 million'],Q_2021_SAV_01,Grampian-2020-2021,MOD,number,[29],skipped
What cost-saving objective was NHS Grampian required to achieve in 2020/21?,"1,500","['the wider community very seriously. The challenge for the Board is to maintain the excellent progress achieved to date, taking forward work for all 9 “protected characteristics” which make up equality and diversity during the challenging times caused by the COVID-19 pandemic. These “protected characteristics”, as defined by the Equality Act 2010 are: race, disability, age, sex (male or female), sexual orientation, gender reassignment, pregnancy and maternity, marriage and civil partnership and religion or belief. The Board has also embraced the requirements of the Equality Act (Specific Duties) (Scotland) Regulations 2012 and published reports including the following key updates on progress in 20/21: - An NHS Grampian Equality Outcomes Report 2021-2025, detailing what NHS Grampian wishes to achieve in the sphere of each of the 9 “protected characteristics” over the next 4 years. - An NHS Grampian “Mainstreaming” Report detailing what NHS Grampian has done in the last 2 years to make equality and diversity an integral part of the way we function as an organisation. NHS Grampian has also published a range of other non-Statutory Equality and Diversity Monitoring Reports on a wide range of topics. During 2020/21, over 1,500 NHS Grampian staff received Equality and Diversity Training by TEAMS at a level appropriate to their role in the', '10. Payment Policy NHS Grampian is committed to supporting the Scottish Government in helping businesses during the current economic situation by paying bills more quickly. The intention is to achieve payment of all undisputed invoices within 10 working days, across all public bodies and NHS Grampian is actively working towards achievement of this accelerated payment target. In 2020/21, the average credit taken was 9 days (2019/20: 9 days). In 2020/21 97% of invoices by value (2019/20 97%) and 96% of invoices by volume (2019/20 96%) were paid within 30 days. In 2020/21 92% of invoices by value (2019/20 93%) and 91% of invoices by volume (2019/20 89%) were paid within 10 days. 11. Social Matters NHS Grampian promotes equality and celebrates diversity both in the services we provide and within our organisation. We also take our duty to promote equality and diversity in the wider community very seriously. The challenge for the Board is to maintain the excellent progress achieved to date, taking forward work for all 9 “protected characteristics” which make up equality and diversity during the challenging times caused by the COVID-19 pandemic. These “protected characteristics”, as defined by the Equality Act 2010 are: race, disability, age, sex (male or female), sexual orientation, gender reassignment, pregnancy and maternity,', 'as at 31 March 2016, work on the cost cap valuation was suspended by the UK Government following the decision by the Court of Appeal (McCloud (Judiciary scheme)/Sargeant (Firefighters’ Scheme) cases) that the transitional protections provided as part of the 2015 reforms unlawfully discriminated on the grounds of age. Following consultation and an announcement in February 2021 on proposals to remedy the discrimination, the UK Government confirmed that the cost control element of the 2016 valuations could be completed. The UK Government has also asked the Government Actuary to review whether, and to what extent, the cost control mechanism is meeting its original objectives. The 2020 actuarial valuations will take the report’s findings into account. The interim report is complete (restricted) and is currently being finalised with a consultation. Alongside these announcements, the UK Government confirmed that current employer contribution rates would stay in force until 1 April 2024. The Scheme is an unfunded multi-employer defined benefit scheme where the share of the assets and liabilities applicable to each employer is not identified. NHS Grampian will therefore account for its pension costs on a defined contribution basis as permitted by International Accounting Standard 19. Details of the most recent scheme accounts published by the Scottish Public Pensions Agency (SPPA) can', 'representatives to cover all employee matters including health and safety, employee consultation, trade union relationships, employability and pay policy. 8. Expenditure on consultancy Expenditure on external consultancy during 2020/21 was £7,835 (2019/20 £50,654) NHS Grampian has used a total of 2 consultancy organisations during 2020/21 (2 in 2019/20). These suppliers provided consultancy services in a number of areas including, capital projects, construction and building infrastructure development, IT system implementation, property matters and infection control issues. Consultancy services are used for the provision of specialist expertise which is not available from NHS Grampian’s own staff and therefore represent a value for money alternative to the direct employment of specialist staff.', '5. Risk and Uncertainty During 2020/21 the Board and the NHS more widely faced an unprecedented challenge which required significant changes to be implemented in order to respond to COVID-19 and to establish a range of new services and public protection measures – Personal Protective Equipment, Test and Protect and Vaccinations being the most significant. The challenge for the Board was to manage our risks in a way that ensured the continued delivery of critical and protected clinical services and delivered the key operational objectives set out above. As required by the Scottish Government the Board developed and approved two initial COVID-19 response plans (March 2020) and three separate remobilisation plans (May 2020, July 2020 and February 2021). These plans were developed following consultation and engagement with clinical services, staff, Integration Joint Boards and other key partners as part of a whole system response. The extract below is taken from the Remobilisation Plan 3 (February 2021). Each of these plans set out an assessment of the key priorities, challenges and risks facing NHS Grampian and how these will be mitigated. Moving forward the Board will continue to build on the relationships we have with key partners to embed the many transformational changes and initiatives introduced to our core services as']",£12.2 million,['£12.2 million'],Q_2021_SAV_02,Grampian-2020-2021,MOD,number,[29],skipped
What proportion of 2020/21 savings were recurring in nature?,"Financial Performance and Position (cont) 7.2.1 Efficiency Savings Efficiency savings of £6.7 million were achieved against a target of £12.2 million for NHS Grampian services, mainly from the reduction in the use of agency medical and nurs","['7. Financial Performance and Position (cont) 7.2.1 Efficiency Savings Efficiency savings of £6.7 million were achieved against a target of £12.2 million for NHS Grampian services, mainly from the reduction in the use of agency medical and nursing staff compared to 2019/20. Recurring savings amounted to £6.05 million and non-recurring of £0.65 million. The gap of £5.5 million was covered non-recurringly by the Scottish Government through their COVID-19 supplementary funding allocation, recognising that the focus of budget managers was not in the delivery of savings during the period of the Board being on an emergency footing. 7.2 Grampian Health Board performance against statutory financial targets 7.2.2 Financial impact of the COVID-19 Pandemic It is important to recognise that, although there were additional direct costs incurred as a result of specific initiatives, the Board’s COVID-19 recovery and remobilisation response was a whole system effort delivered under emergency provisions with the majority of our core services reconfigured to manage the impact. Accordingly many of the variations in cost between 2020/21 and 2019/20 reflect the indirect impact of the COVID-19 pandemic on staffing, activity and service levels. The Board received a specific supplementary allocation of £48.6 million during the year from the Scottish Government to cover the additional direct costs associated with the', 'Aberdeenshire IJB reported a surplus for the year of £20.449 million (2019/20: deficit of £1.288m) increasing the retained reserves carried forward to £20.566 million (2019/20 £0.117 million). This reflects: An increase in general reserves to £4.597 million (2019/20 nil) due to a number of - factors which emerged since the beginning of April 2020. These included underspends on some social care services due to them being paused or operating at reduced capacity, continued savings on community hospital costs due to reduced capacity and savings on travel, transport and training related expenditure. An increase in earmarked reserves of £15.852 million to £15.969 million (2019/20 - £0.117 million), due to the allocation', 'delivered under emergency provisions with the majority of our core services reconfigured to manage the impact. Accordingly many of the variations in cost between 2020/21 and 2019/20 reflect the indirect impact of the COVID-19 pandemic on staffing, activity and service levels. The Board received a specific supplementary allocation of £48.6 million during the year from the Scottish Government to cover the additional direct costs associated with the COVID-19 response and remobilisation. The main areas incurring additional costs were in additional temporary staffing (student nurses, junior medical staff, Domestics, Porters and additional overtime), costs of additional bed capacity (ITU and Medical beds), loss of income (catering, retail) and spend on IT equipment. In the last quarter of the year significant costs were incurred on the COVID-19 vaccination programme, the Regional Testing Hub and Contact Tracing staffing costs. As explained above, the Scottish Government through this allocation, also funded £5.5 million of unmet efficiency savings targets and local savings of £6.7 million were made available to cover part of these additional costs, mainly resulting from reduced levels of elective surgical and outpatient activity over the year. In addition, the Integration Joint Boards received funding of £46.3 million to meet costs relating to health and social care services. 7.2.3 Expenditure Analysis Net expenditure', 'Board has successfully achieved all three financial targets for the year reporting an outturn against these set limits as follows: Statutory Financial Targets Limit as set by Actual Variance Under SGHSCD Outturn £000’s £000’s £000’s Core Revenue Resource Limit 1,278,771 1,278,002 769 Non-Core Revenue Resource Limit 32,340 32,340 - Total 1,311,111 1,310,342 769 Core Capital Resource Limit 42,246 42,246 - Non-Core Capital Resource Limit 1,070 1,070 - Total 43,316 43,316 - Cash Requirement 1,298,124 1,298,124 - Memorandum for In Year Out-turn £000 Core Revenue Resource Variance Surplus in 2020/21 769 Financial flexibility : funding banked with Scottish Government 0 Underlying Surplus against Core Revenue Resource Limit 769 0% The Board is reporting an underspend of £0.769m against a target of breakeven on the revenue resource limit for 2020/21. Due to the impact of the COVID-19 pandemic, the Scottish Government paused the Annual Operating and financial planning process. Recognising the exceptional nature of 2020-21 and the impact on delivery of financial plans, additional non- repayable funding was provided to support in-year financial balance across all NHS Boards. NHS Grampian received £47.3m. The flexibility allowed within the previously agreed three-year financial planning and performance cycle, allowed NHS Grampian to bank £1m from the reported surplus in 2019/20, with the Scottish Government, for', 'this allocation, also funded £5.5 million of unmet efficiency savings targets and local savings of £6.7 million were made available to cover part of these additional costs, mainly resulting from reduced levels of elective surgical and outpatient activity over the year. In addition, the Integration Joint Boards received funding of £46.3 million to meet costs relating to health and social care services. 7.2.3 Expenditure Analysis Net expenditure for the year was £1,375 million (2019/20 £1,194 million), an increase of £181 million over the prior year. The Consolidated Statement of Comprehensive Net Expenditure can be found on page 77, a more detailed analysis of Expenditure in note 3 on page 105 and a more detailed analysis of income in note 4 on page 106. Staff Costs increased by £79.2 million, mainly due to the impact of additional temporary staffing (student nurses, junior medical staff, Domestics, Porters and additional overtime) during the COVID-19 pandemic (£31.3 million), the annual pay uplift (£29.7 million), an increase in the level of untaken annual leave (£13.1 million) and the COVID-19 19']",£6.05 million,['£6.05 million'],Q_2021_SAV_03,Grampian-2020-2021,MOD,number,[29],skipped
How much of the 2020/21 efficiency savings were non-recurring?,7,"['7. Financial Performance and Position (cont) 7.2.1 Efficiency Savings Efficiency savings of £6.7 million were achieved against a target of £12.2 million for NHS Grampian services, mainly from the reduction in the use of agency medical and nursing staff compared to 2019/20. Recurring savings amounted to £6.05 million and non-recurring of £0.65 million. The gap of £5.5 million was covered non-recurringly by the Scottish Government through their COVID-19 supplementary funding allocation, recognising that the focus of budget managers was not in the delivery of savings during the period of the Board being on an emergency footing. 7.2 Grampian Health Board performance against statutory financial targets 7.2.2 Financial impact of the COVID-19 Pandemic It is important to recognise that, although there were additional direct costs incurred as a result of specific initiatives, the Board’s COVID-19 recovery and remobilisation response was a whole system effort delivered under emergency provisions with the majority of our core services reconfigured to manage the impact. Accordingly many of the variations in cost between 2020/21 and 2019/20 reflect the indirect impact of the COVID-19 pandemic on staffing, activity and service levels. The Board received a specific supplementary allocation of £48.6 million during the year from the Scottish Government to cover the additional direct costs associated with the', 'delivered under emergency provisions with the majority of our core services reconfigured to manage the impact. Accordingly many of the variations in cost between 2020/21 and 2019/20 reflect the indirect impact of the COVID-19 pandemic on staffing, activity and service levels. The Board received a specific supplementary allocation of £48.6 million during the year from the Scottish Government to cover the additional direct costs associated with the COVID-19 response and remobilisation. The main areas incurring additional costs were in additional temporary staffing (student nurses, junior medical staff, Domestics, Porters and additional overtime), costs of additional bed capacity (ITU and Medical beds), loss of income (catering, retail) and spend on IT equipment. In the last quarter of the year significant costs were incurred on the COVID-19 vaccination programme, the Regional Testing Hub and Contact Tracing staffing costs. As explained above, the Scottish Government through this allocation, also funded £5.5 million of unmet efficiency savings targets and local savings of £6.7 million were made available to cover part of these additional costs, mainly resulting from reduced levels of elective surgical and outpatient activity over the year. In addition, the Integration Joint Boards received funding of £46.3 million to meet costs relating to health and social care services. 7.2.3 Expenditure Analysis Net expenditure', 'this allocation, also funded £5.5 million of unmet efficiency savings targets and local savings of £6.7 million were made available to cover part of these additional costs, mainly resulting from reduced levels of elective surgical and outpatient activity over the year. In addition, the Integration Joint Boards received funding of £46.3 million to meet costs relating to health and social care services. 7.2.3 Expenditure Analysis Net expenditure for the year was £1,375 million (2019/20 £1,194 million), an increase of £181 million over the prior year. The Consolidated Statement of Comprehensive Net Expenditure can be found on page 77, a more detailed analysis of Expenditure in note 3 on page 105 and a more detailed analysis of income in note 4 on page 106. Staff Costs increased by £79.2 million, mainly due to the impact of additional temporary staffing (student nurses, junior medical staff, Domestics, Porters and additional overtime) during the COVID-19 pandemic (£31.3 million), the annual pay uplift (£29.7 million), an increase in the level of untaken annual leave (£13.1 million) and the COVID-19 19', 'Aberdeenshire IJB reported a surplus for the year of £20.449 million (2019/20: deficit of £1.288m) increasing the retained reserves carried forward to £20.566 million (2019/20 £0.117 million). This reflects: An increase in general reserves to £4.597 million (2019/20 nil) due to a number of - factors which emerged since the beginning of April 2020. These included underspends on some social care services due to them being paused or operating at reduced capacity, continued savings on community hospital costs due to reduced capacity and savings on travel, transport and training related expenditure. An increase in earmarked reserves of £15.852 million to £15.969 million (2019/20 - £0.117 million), due to the allocation', 'would occur where controls were absent or failed. Considering the content of the report in detail therefore, the Board have noted the various improvement actions agreed by the NSS Audit and Risk Committee to address the qualification on the Practitioner Services audit opinion. The NSS Audit Committee have agreed a management action plan intended to address the findings and this will be tested by the NSS service auditors in the first quarter of 2021/22. ▪ The Board have also considered the additional sources of assurance covering the expenditure on primary care services in the 2020/21 accounts including :- - The national agreement to protect much of the income received by primary care practitioners during the COVID-19 pandemic, - The positive outcome from a subsequent, additional internal audit review commissioned by NSS in to ad hoc COVID-19 related payments. - the positive feedback from a briefing hosted by the Chair of the NSS Audit and Risk Committee on 3 June 2021, attended by Directors of Finance and their External Auditors. 7.8 Involvement and Engagement ➢ Through liaison with the North East Partnership Steering Group (NEPSG), the Board continue to progress agreement on a consistent vision and values aimed at ensuring a consistent message in all communication between clinical staff,']",£0.65 million,['£0.65 million'],Q_2021_SAV_04,Grampian-2020-2021,LEX,number,[29],skipped
"How large was the gap between efficiency savings delivered and the target in 2020/21, and how was it covered?","Financial Performance and Position (cont) 7.2.1 Efficiency Savings Efficiency savings of £6.7 million were achieved against a target of £12.2 million for NHS Grampian services, mainly from the reduction in the use of agency medical and nurs","['7. Financial Performance and Position (cont) 7.2.1 Efficiency Savings Efficiency savings of £6.7 million were achieved against a target of £12.2 million for NHS Grampian services, mainly from the reduction in the use of agency medical and nursing staff compared to 2019/20. Recurring savings amounted to £6.05 million and non-recurring of £0.65 million. The gap of £5.5 million was covered non-recurringly by the Scottish Government through their COVID-19 supplementary funding allocation, recognising that the focus of budget managers was not in the delivery of savings during the period of the Board being on an emergency footing. 7.2 Grampian Health Board performance against statutory financial targets 7.2.2 Financial impact of the COVID-19 Pandemic It is important to recognise that, although there were additional direct costs incurred as a result of specific initiatives, the Board’s COVID-19 recovery and remobilisation response was a whole system effort delivered under emergency provisions with the majority of our core services reconfigured to manage the impact. Accordingly many of the variations in cost between 2020/21 and 2019/20 reflect the indirect impact of the COVID-19 pandemic on staffing, activity and service levels. The Board received a specific supplementary allocation of £48.6 million during the year from the Scottish Government to cover the additional direct costs associated with the', 'delivered under emergency provisions with the majority of our core services reconfigured to manage the impact. Accordingly many of the variations in cost between 2020/21 and 2019/20 reflect the indirect impact of the COVID-19 pandemic on staffing, activity and service levels. The Board received a specific supplementary allocation of £48.6 million during the year from the Scottish Government to cover the additional direct costs associated with the COVID-19 response and remobilisation. The main areas incurring additional costs were in additional temporary staffing (student nurses, junior medical staff, Domestics, Porters and additional overtime), costs of additional bed capacity (ITU and Medical beds), loss of income (catering, retail) and spend on IT equipment. In the last quarter of the year significant costs were incurred on the COVID-19 vaccination programme, the Regional Testing Hub and Contact Tracing staffing costs. As explained above, the Scottish Government through this allocation, also funded £5.5 million of unmet efficiency savings targets and local savings of £6.7 million were made available to cover part of these additional costs, mainly resulting from reduced levels of elective surgical and outpatient activity over the year. In addition, the Integration Joint Boards received funding of £46.3 million to meet costs relating to health and social care services. 7.2.3 Expenditure Analysis Net expenditure', 'this allocation, also funded £5.5 million of unmet efficiency savings targets and local savings of £6.7 million were made available to cover part of these additional costs, mainly resulting from reduced levels of elective surgical and outpatient activity over the year. In addition, the Integration Joint Boards received funding of £46.3 million to meet costs relating to health and social care services. 7.2.3 Expenditure Analysis Net expenditure for the year was £1,375 million (2019/20 £1,194 million), an increase of £181 million over the prior year. The Consolidated Statement of Comprehensive Net Expenditure can be found on page 77, a more detailed analysis of Expenditure in note 3 on page 105 and a more detailed analysis of income in note 4 on page 106. Staff Costs increased by £79.2 million, mainly due to the impact of additional temporary staffing (student nurses, junior medical staff, Domestics, Porters and additional overtime) during the COVID-19 pandemic (£31.3 million), the annual pay uplift (£29.7 million), an increase in the level of untaken annual leave (£13.1 million) and the COVID-19 19', '5. Risk and Uncertainty During 2020/21 the Board and the NHS more widely faced an unprecedented challenge which required significant changes to be implemented in order to respond to COVID-19 and to establish a range of new services and public protection measures – Personal Protective Equipment, Test and Protect and Vaccinations being the most significant. The challenge for the Board was to manage our risks in a way that ensured the continued delivery of critical and protected clinical services and delivered the key operational objectives set out above. As required by the Scottish Government the Board developed and approved two initial COVID-19 response plans (March 2020) and three separate remobilisation plans (May 2020, July 2020 and February 2021). These plans were developed following consultation and engagement with clinical services, staff, Integration Joint Boards and other key partners as part of a whole system response. The extract below is taken from the Remobilisation Plan 3 (February 2021). Each of these plans set out an assessment of the key priorities, challenges and risks facing NHS Grampian and how these will be mitigated. Moving forward the Board will continue to build on the relationships we have with key partners to embed the many transformational changes and initiatives introduced to our core services as', 'Board has successfully achieved all three financial targets for the year reporting an outturn against these set limits as follows: Statutory Financial Targets Limit as set by Actual Variance Under SGHSCD Outturn £000’s £000’s £000’s Core Revenue Resource Limit 1,278,771 1,278,002 769 Non-Core Revenue Resource Limit 32,340 32,340 - Total 1,311,111 1,310,342 769 Core Capital Resource Limit 42,246 42,246 - Non-Core Capital Resource Limit 1,070 1,070 - Total 43,316 43,316 - Cash Requirement 1,298,124 1,298,124 - Memorandum for In Year Out-turn £000 Core Revenue Resource Variance Surplus in 2020/21 769 Financial flexibility : funding banked with Scottish Government 0 Underlying Surplus against Core Revenue Resource Limit 769 0% The Board is reporting an underspend of £0.769m against a target of breakeven on the revenue resource limit for 2020/21. Due to the impact of the COVID-19 pandemic, the Scottish Government paused the Annual Operating and financial planning process. Recognising the exceptional nature of 2020-21 and the impact on delivery of financial plans, additional non- repayable funding was provided to support in-year financial balance across all NHS Boards. NHS Grampian received £47.3m. The flexibility allowed within the previously agreed three-year financial planning and performance cycle, allowed NHS Grampian to bank £1m from the reported surplus in 2019/20, with the Scottish Government, for']",Gap of £5.5 million covered non-recurringly by Scottish Government COVID-19 supplementary funding,['Gap of £5.5 million covered non-recurringly by Scottish Government COVID-19 supplementary funding'],Q_2021_SAV_P1,Grampian-2020-2021,STR,text,[29],skipped
How much COVID-19 supplementary resource allocation did NHS Grampian receive from the Scottish Government in 2020/21?,7,"['7. Financial Performance and Position (cont) 7.2.1 Efficiency Savings Efficiency savings of £6.7 million were achieved against a target of £12.2 million for NHS Grampian services, mainly from the reduction in the use of agency medical and nursing staff compared to 2019/20. Recurring savings amounted to £6.05 million and non-recurring of £0.65 million. The gap of £5.5 million was covered non-recurringly by the Scottish Government through their COVID-19 supplementary funding allocation, recognising that the focus of budget managers was not in the delivery of savings during the period of the Board being on an emergency footing. 7.2 Grampian Health Board performance against statutory financial targets 7.2.2 Financial impact of the COVID-19 Pandemic It is important to recognise that, although there were additional direct costs incurred as a result of specific initiatives, the Board’s COVID-19 recovery and remobilisation response was a whole system effort delivered under emergency provisions with the majority of our core services reconfigured to manage the impact. Accordingly many of the variations in cost between 2020/21 and 2019/20 reflect the indirect impact of the COVID-19 pandemic on staffing, activity and service levels. The Board received a specific supplementary allocation of £48.6 million during the year from the Scottish Government to cover the additional direct costs associated with the', 'delivered under emergency provisions with the majority of our core services reconfigured to manage the impact. Accordingly many of the variations in cost between 2020/21 and 2019/20 reflect the indirect impact of the COVID-19 pandemic on staffing, activity and service levels. The Board received a specific supplementary allocation of £48.6 million during the year from the Scottish Government to cover the additional direct costs associated with the COVID-19 response and remobilisation. The main areas incurring additional costs were in additional temporary staffing (student nurses, junior medical staff, Domestics, Porters and additional overtime), costs of additional bed capacity (ITU and Medical beds), loss of income (catering, retail) and spend on IT equipment. In the last quarter of the year significant costs were incurred on the COVID-19 vaccination programme, the Regional Testing Hub and Contact Tracing staffing costs. As explained above, the Scottish Government through this allocation, also funded £5.5 million of unmet efficiency savings targets and local savings of £6.7 million were made available to cover part of these additional costs, mainly resulting from reduced levels of elective surgical and outpatient activity over the year. In addition, the Integration Joint Boards received funding of £46.3 million to meet costs relating to health and social care services. 7.2.3 Expenditure Analysis Net expenditure', 'Board has successfully achieved all three financial targets for the year reporting an outturn against these set limits as follows: Statutory Financial Targets Limit as set by Actual Variance Under SGHSCD Outturn £000’s £000’s £000’s Core Revenue Resource Limit 1,278,771 1,278,002 769 Non-Core Revenue Resource Limit 32,340 32,340 - Total 1,311,111 1,310,342 769 Core Capital Resource Limit 42,246 42,246 - Non-Core Capital Resource Limit 1,070 1,070 - Total 43,316 43,316 - Cash Requirement 1,298,124 1,298,124 - Memorandum for In Year Out-turn £000 Core Revenue Resource Variance Surplus in 2020/21 769 Financial flexibility : funding banked with Scottish Government 0 Underlying Surplus against Core Revenue Resource Limit 769 0% The Board is reporting an underspend of £0.769m against a target of breakeven on the revenue resource limit for 2020/21. Due to the impact of the COVID-19 pandemic, the Scottish Government paused the Annual Operating and financial planning process. Recognising the exceptional nature of 2020-21 and the impact on delivery of financial plans, additional non- repayable funding was provided to support in-year financial balance across all NHS Boards. NHS Grampian received £47.3m. The flexibility allowed within the previously agreed three-year financial planning and performance cycle, allowed NHS Grampian to bank £1m from the reported surplus in 2019/20, with the Scottish Government, for', '5. Risk and Uncertainty During 2020/21 the Board and the NHS more widely faced an unprecedented challenge which required significant changes to be implemented in order to respond to COVID-19 and to establish a range of new services and public protection measures – Personal Protective Equipment, Test and Protect and Vaccinations being the most significant. The challenge for the Board was to manage our risks in a way that ensured the continued delivery of critical and protected clinical services and delivered the key operational objectives set out above. As required by the Scottish Government the Board developed and approved two initial COVID-19 response plans (March 2020) and three separate remobilisation plans (May 2020, July 2020 and February 2021). These plans were developed following consultation and engagement with clinical services, staff, Integration Joint Boards and other key partners as part of a whole system response. The extract below is taken from the Remobilisation Plan 3 (February 2021). Each of these plans set out an assessment of the key priorities, challenges and risks facing NHS Grampian and how these will be mitigated. Moving forward the Board will continue to build on the relationships we have with key partners to embed the many transformational changes and initiatives introduced to our core services as', 'below £80,000 received a 2.95% cost of living uplift in pay during 2020/21 and staff earning above that amount received a flat increase of £1,600. In addition all staff received an additional 1% backdated to 1 December 2020 as a payment to account in relation to the 2021/22 pay settlement and a one off supplementary COVID-19 payment of £500 at the direction of the Scottish Government. This is the main reason for the increase in median pay. The ratio of 6.49 has reduced slightly over the prior year. This is due to the increase in the median pay as explained above.']",£48.6 million,['£48.6 million'],Q_2021_COV_01,Grampian-2020-2021,MOD,number,[29],skipped
What ceiling did the Scottish Government place on NHS Grampian's core operational spending for 2021/22?,000,"['and report on any variation. Grampian Health Board has successfully achieved all three financial targets for the year reporting an outturn against these set limits as follows: Statutory Financial Targets Limit as set by Actual Variance Under SGHSCD Outturn £000’s £000’s £000’s Core Revenue Resource Limit 1,358,066 1,357,936 130 Non-Core Revenue Resource Limit 28,485 28,485 - Total 1,386,551 1,386,421 130 Core Capital Resource Limit 64,166 64,166 - Non-Core Capital Resource Limit 1,002 1,002 - Total 65,168 65,168 - Cash Requirement 1,434,610 1,434,610 - Memorandum for In Year Out-turn £000 Core Revenue Resource Variance Surplus in 2021/22 130 Financial flexibility : funding banked with Scottish Government 0 Underlying Surplus against Core Revenue Resource Limit 130 0% The Board is reporting an underspend of £0.130m against a target of breakeven on the revenue resource limit for 2021/22. A one year financial plan was submitted to Scottish Government by NHS Grampian on 21 March 2021. Due to the impact of the COVID-19 pandemic, the Scottish Government paused the three year Annual Operating and financial planning process. Recognising the exceptional nature of 2021-22 and the impact on delivery of financial plans, additional non-repayable funding was provided to support in-year financial balance across all NHS Boards. NHS Grampian received £68.8m (2020/21 £47.3m).', '1. Financial Performance and Position (cont) 1.2 Grampian Health Board performance against statutory financial targets (cont) The Core Revenue Resource Limit for 2021/22 was also adjusted to include the £0.769m surplus carried forward from 2020/21 and £1 million banked with the Scottish Government under agreed financial flexibility arrangements in 2019/20. 1.2.1 Efficiency Savings Efficiency savings of £2.2 million were achieved against a target of £2.6 million for NHS Grampian services, mainly from the successful recruitment in to medical and nursing vacancies that were previously filled using temporary agency staff in the first half of the year, the transfer of some agency staff on to a direct engagement contractual model, the increased use of biosimilar drugs and savings across a number of non-clinical areas. Recurring savings amounted to £1.0 million and non-recurring of £1.1 million. The gap of £0.4 million was covered non-recurringly by the Scottish Government through their COVID- 19 supplementary funding allocation, recognising that the focus of budget managers was not in the delivery of savings during the period of the Board being on an emergency footing. 1.2.2 Financial impact of the COVID-19 Pandemic Due to the ongoing impact of the pandemic the Board remained on an emergency footing throughout 2021/22. In considering the variations in cost of services', '6. Non-Financial Performance Summary (cont) The core values of the Board are caring, listening and improving. These values are embedded in everything we do in making the vision a reality. The continued impact of the COVID-19 pandemic and the wider system pressures on the NHS, our partner organisations and the public was significant this year and although the Board has successfully met its financial targets for 2021/22, performance against the key national clinical treatment targets has clearly been impacted by the changes made to ensure the delivery of safe and effective services throughout the year as part of our COVID-19 response. All clinical services are now open and accepting referrals. The length of wait for treatment in some services is impacted by the historical backlog that built up during the COVID response period and also by enhanced infection control measures that remain in place. Recognising the current operational and workforce challenges alongside growing financial pressures, the Scottish Government have clarified the areas of activity to be prioritised during the coming year as a phased reduction in waiting times with no outpatient waiting longer than one year by March 2023 and no-one waiting longer than one year for in- patient/day case treatment by September 2024. A proposed plan to achieve reduction', 'governance arrangements in place during the year to manage the COVID-19 response and remobilisation were developed in line with guidance from the Scottish Government and are explained in more detail in section 4 above. In terms of the overall internal control environment the ongoing impact of the pandemic meant that the shift towards home working, in particular for key back office functions, was sustained throughout 2021/22. Although, the change to remote working had required the redesign of some internal controls, for example where a physical signature would previously have been required, these revised arrangements were sustained during 2021/22 and the operation of all key controls was maintained throughout and on an ongoing basis. In December 2021, the Audit Committee received a report from the Director of Finance, on the actions taken to ensure that lessons learned during the NHS Grampian response to COVID-19 had been embedded in the remobilisation plan for the organisation. The report also outlined the response to the key actions and high level lessons included in a recent Scottish Government report regarding lessons learned during COVID-19.', '5. Risk and Uncertainty During 2021/22 the Board and the NHS more widely faced the unprecedented challenge of continuing to respond to COVID-19, to roll out the largest scale mass vaccination programme in a generation and to provide access to a full range of services, within the capacity available. The challenge for the Board was to manage our risks in a way that ensured the continued delivery of critical and protected clinical services and fulfilled the key operational objectives set out above and reflected in our remobilisation plan. As required by the Scottish Government, the Board developed two further remobilisation plans – Remobilisation Plan (v3) and (v4) which were approved at respective Board meetings in June 2021 and December 2021. These plans were developed following consultation and engagement with clinical services, staff, Integration Joint Boards and other key partners as part of a whole system response. Both remobilisation plans set out an assessment of the key priorities, challenges and risks facing NHS Grampian and how these will be mitigated. Moving forward the Board will continue to build on the relationships we have with key partners to embed the many transformational changes and initiatives introduced to our core services as part of our COVID-19 response and remobilisation efforts. The Integration Joint']","£1,358,066 (£000)","['£1,358,066 (£000)']",Q_2022_FIN_01,Grampian-2021-2022,STR,number,[21],skipped
How much did NHS Grampian actually spend against its core resource budget in 2021/22?,1,"['1. Financial Performance and Position (cont) 1.2 Grampian Health Board performance against statutory financial targets The results of each of the partner organisations, although consolidated with the main Board accounts for group accounting purposes, do not form part of the statutory financial target set for NHS Boards by the Scottish Government Health and Social Care Directorates (SGHSCD) and are, therefore, not taken in to account when considering the Board’s in year financial performance. The three annual financial targets set for each Health Board by the SGHSCD are: ➢ Revenue Resource Limit (RRL)– a resource budget for ongoing activity; ➢ Capital Resource Limit (CRL) – a resource budget for net capital investment; and ➢ Cash Requirement – a financing requirement to fund the cash consequences of ongoing activity and net capital investment. Health Boards are required to contain their net expenditure within these limits, and report on any variation. Grampian Health Board has successfully achieved all three financial targets for the year reporting an outturn against these set limits as follows: Statutory Financial Targets Limit as set by Actual Variance Under SGHSCD Outturn £000’s £000’s £000’s Core Revenue Resource Limit 1,358,066 1,357,936 130 Non-Core Revenue Resource Limit 28,485 28,485 - Total 1,386,551 1,386,421 130 Core Capital Resource Limit 64,166 64,166 -', 'and report on any variation. Grampian Health Board has successfully achieved all three financial targets for the year reporting an outturn against these set limits as follows: Statutory Financial Targets Limit as set by Actual Variance Under SGHSCD Outturn £000’s £000’s £000’s Core Revenue Resource Limit 1,358,066 1,357,936 130 Non-Core Revenue Resource Limit 28,485 28,485 - Total 1,386,551 1,386,421 130 Core Capital Resource Limit 64,166 64,166 - Non-Core Capital Resource Limit 1,002 1,002 - Total 65,168 65,168 - Cash Requirement 1,434,610 1,434,610 - Memorandum for In Year Out-turn £000 Core Revenue Resource Variance Surplus in 2021/22 130 Financial flexibility : funding banked with Scottish Government 0 Underlying Surplus against Core Revenue Resource Limit 130 0% The Board is reporting an underspend of £0.130m against a target of breakeven on the revenue resource limit for 2021/22. A one year financial plan was submitted to Scottish Government by NHS Grampian on 21 March 2021. Due to the impact of the COVID-19 pandemic, the Scottish Government paused the three year Annual Operating and financial planning process. Recognising the exceptional nature of 2021-22 and the impact on delivery of financial plans, additional non-repayable funding was provided to support in-year financial balance across all NHS Boards. NHS Grampian received £68.8m (2020/21 £47.3m).', '1. Financial Performance and Position (cont) 1.2 Grampian Health Board performance against statutory financial targets (cont) The Core Revenue Resource Limit for 2021/22 was also adjusted to include the £0.769m surplus carried forward from 2020/21 and £1 million banked with the Scottish Government under agreed financial flexibility arrangements in 2019/20. 1.2.1 Efficiency Savings Efficiency savings of £2.2 million were achieved against a target of £2.6 million for NHS Grampian services, mainly from the successful recruitment in to medical and nursing vacancies that were previously filled using temporary agency staff in the first half of the year, the transfer of some agency staff on to a direct engagement contractual model, the increased use of biosimilar drugs and savings across a number of non-clinical areas. Recurring savings amounted to £1.0 million and non-recurring of £1.1 million. The gap of £0.4 million was covered non-recurringly by the Scottish Government through their COVID- 19 supplementary funding allocation, recognising that the focus of budget managers was not in the delivery of savings during the period of the Board being on an emergency footing. 1.2.2 Financial impact of the COVID-19 Pandemic Due to the ongoing impact of the pandemic the Board remained on an emergency footing throughout 2021/22. In considering the variations in cost of services', 'which underpins redesign services. The most and supports transformation significant challenge is the capacity across NHS Grampian meaning within services and our eHealth that we may be unable to deliver team to support change at the pace Digital against the Digital Work Plan which would make a difference for Change priorities set against the Digital staff and patients. The Board is Health & Care Strategy and refreshing its wider strategy and Remobilisation Plan’s Failure to consideration will be given to how achieve organisational objectives. we resource our transformation This could lead to reputational programme, including our digital impact across NHS Grampian and work plan. potential failure to meet agreed deliverables. The risks around the continuity of the Test and Protect programme As staff are on temporary have been discussed with SG contracts there is a possibility that colleagues and joint working Test & protect capacity within the program may continues to clarify the decrease over the next 6 months requirements for the service and and limit our ability to respond. need to provide certainty of funding to secure the necessary capacity to operate without disruption. 6. Non-Financial Performance Summary NHS Grampian has a performance framework through which a culture of continuous improvement is supported. Our vision, proudly working together to', 'a) OVERVIEW 1. Purpose This Overview aims to provide the reader with sufficient information to understand the purpose of the NHS Grampian Board, the key risks to the achievement of its objectives and how it has performed during the year. Should you wish to find out more detailed information we have provided this in the rest of the Performance Report, the Accountability Report and the financial statements. NHS Grampian publishes a wide range of information on its services and activities on its website which you can find at: https://www.nhsgrampian.org/ 2. Statement from the Chief Executive Looking back on 2021/22 and my first full year as the Chief Executive, I am proud of the response we have had from our colleagues, partners and the public during an exceptional period of uncertainty and challenge for us all. I am extremely grateful for everything that people in communities across Grampian have done and continue to do to support NHS Grampian and all those providing care services on our behalf. We are also thankful for the patience, kind messages and thanks shown, which has lifted our colleagues during a very busy and difficult time. However, I know the impact this year has had – and continues to have - on everyone, and my focus']","£1,357,936 (£000)","['£1,357,936 (£000)']",Q_2022_FIN_02,Grampian-2021-2022,MOD,number,[21],skipped
What was the variance surplus against the Core Revenue Resource Limit in 2021/22?,£0.769m,"['and report on any variation. Grampian Health Board has successfully achieved all three financial targets for the year reporting an outturn against these set limits as follows: Statutory Financial Targets Limit as set by Actual Variance Under SGHSCD Outturn £000’s £000’s £000’s Core Revenue Resource Limit 1,358,066 1,357,936 130 Non-Core Revenue Resource Limit 28,485 28,485 - Total 1,386,551 1,386,421 130 Core Capital Resource Limit 64,166 64,166 - Non-Core Capital Resource Limit 1,002 1,002 - Total 65,168 65,168 - Cash Requirement 1,434,610 1,434,610 - Memorandum for In Year Out-turn £000 Core Revenue Resource Variance Surplus in 2021/22 130 Financial flexibility : funding banked with Scottish Government 0 Underlying Surplus against Core Revenue Resource Limit 130 0% The Board is reporting an underspend of £0.130m against a target of breakeven on the revenue resource limit for 2021/22. A one year financial plan was submitted to Scottish Government by NHS Grampian on 21 March 2021. Due to the impact of the COVID-19 pandemic, the Scottish Government paused the three year Annual Operating and financial planning process. Recognising the exceptional nature of 2021-22 and the impact on delivery of financial plans, additional non-repayable funding was provided to support in-year financial balance across all NHS Boards. NHS Grampian received £68.8m (2020/21 £47.3m).', '1. Financial Performance and Position (cont) 1.2 Grampian Health Board performance against statutory financial targets The results of each of the partner organisations, although consolidated with the main Board accounts for group accounting purposes, do not form part of the statutory financial target set for NHS Boards by the Scottish Government Health and Social Care Directorates (SGHSCD) and are, therefore, not taken in to account when considering the Board’s in year financial performance. The three annual financial targets set for each Health Board by the SGHSCD are: ➢ Revenue Resource Limit (RRL)– a resource budget for ongoing activity; ➢ Capital Resource Limit (CRL) – a resource budget for net capital investment; and ➢ Cash Requirement – a financing requirement to fund the cash consequences of ongoing activity and net capital investment. Health Boards are required to contain their net expenditure within these limits, and report on any variation. Grampian Health Board has successfully achieved all three financial targets for the year reporting an outturn against these set limits as follows: Statutory Financial Targets Limit as set by Actual Variance Under SGHSCD Outturn £000’s £000’s £000’s Core Revenue Resource Limit 1,358,066 1,357,936 130 Non-Core Revenue Resource Limit 28,485 28,485 - Total 1,386,551 1,386,421 130 Core Capital Resource Limit 64,166 64,166 -', '1. Financial Performance and Position (cont) 1.2 Grampian Health Board performance against statutory financial targets (cont) The Core Revenue Resource Limit for 2021/22 was also adjusted to include the £0.769m surplus carried forward from 2020/21 and £1 million banked with the Scottish Government under agreed financial flexibility arrangements in 2019/20. 1.2.1 Efficiency Savings Efficiency savings of £2.2 million were achieved against a target of £2.6 million for NHS Grampian services, mainly from the successful recruitment in to medical and nursing vacancies that were previously filled using temporary agency staff in the first half of the year, the transfer of some agency staff on to a direct engagement contractual model, the increased use of biosimilar drugs and savings across a number of non-clinical areas. Recurring savings amounted to £1.0 million and non-recurring of £1.1 million. The gap of £0.4 million was covered non-recurringly by the Scottish Government through their COVID- 19 supplementary funding allocation, recognising that the focus of budget managers was not in the delivery of savings during the period of the Board being on an emergency footing. 1.2.2 Financial impact of the COVID-19 Pandemic Due to the ongoing impact of the pandemic the Board remained on an emergency footing throughout 2021/22. In considering the variations in cost of services', ""Financial table on page 113 (Income Statement) Contains 27 line items across 4 columns. Row labels: NOTE2ASUMMARYOFCOREREVENUERESOURCEOUTTURN; SUMMARYOFCOREREVENUERESOURCEOUTTURN; Netexpenditure; TotalNon-CoreExpenditure(seebelow). Key items: SUMMARYOFCOREREVENUERESOURCEOUTTURN | 2021/22 | 2021/22; £’000 | £’000; Netexpenditure | 1,415,770; TotalNon-CoreExpenditure(seebelow) | (28,485).\n\nTable (header-injected facts):\n\n- SUMMARYOFCOREREVENUERESOURCEOUTTURN > 2 : 2021/22\n- SUMMARYOFCOREREVENUERESOURCEOUTTURN > 3 : 2021/22\n- Netexpenditure > 3 : 1,415,770\n- TotalNon-CoreExpenditure(seebelow) > 3 : (28,485)\n- FHSNonDiscretionaryAllocation > 3 : (66,318)\n- EndowmentNetOperatingCosts > 3 : 803\n- JointVenturesaccountedforonanequitybasis > 3 : 36,166\n- TotalCoreExpenditure > 3 : 1,357,936\n- CoreRevenueResourceLimit > 3 : 1,358,066\n- Saving/(excess)againstCoreRevenueResourceLimit > 3 : 130\n- Capitalgrantsto/(from)otherbodies > 2 : (333)\n- Depreciation/Amortisation > 2 : 25,364\n- AnnuallyManagedExpenditure-Impairments > 2 : 403\n- AnnuallyManagedExpenditure-CreationofProvisions > 2 : 2,100\n- AnnuallyManagedExpenditure-DepreciationofDonatedAssets > 2 : 1,547\n- AnnuallyManagedExpenditure-FairValueAdjustments > 2 : 91\n- DonatedAssetsIncome > 2 : (687)\n- TotalNonCoreExpenditure > 3 : 28,485\n- Non-CoreRevenueResourceLimit > 3 : 28,485\n- Saving/(excess)againstNonCoreRevenueResourceLimit > 3 : 0\n- SUMMARYRESOURCEOUTTURN > 1 : Resource\n- SUMMARYRESOURCEOUTTURN > 2 : Expenditure\n- SUMMARYRESOURCEOUTTURN > 3 : Saving/(excess)\n- Core > 1 : 1,358,066\n- Core > 2 : 1,357,936\n- Core > 3 : 130\n- Non-Core > 1 : 28,485\n- Non-Core > 2 : 28,485\n- Non-Core > 3 : 0\n- Total > 1 : 1,386,551\n- Total > 2 : 1,386,421\n- Total > 3 : 130\n- Column headers: Row label > 1 : 1\n- Column headers: Row label > 2 : 2\n- Column headers: Row label > 3 : 3\n\nTable (markdown):\n\n| 0 | 1 | 2 | 3 |\n| --- | --- | --- | --- |\n| NOTE2ASUMMARYOFCOREREVENUERESOURCEOUTTURN |  |  |  |\n| SUMMARYOFCOREREVENUERESOURCEOUTTURN |  | 2021/22 | 2021/22 |\n|  |  | £’000 | £’000 |\n| Netexpenditure |  |  | 1,415,770 |\n| TotalNon-CoreExpenditure(seebelow) |  |  | (28,485) |\n| FHSNonDiscretionaryAllocation |  |  | (66,318) |\n| EndowmentNetOperatingCosts |  |  | 803 |\n| JointVenturesaccountedforonanequitybasis |  |  | 36,166 |\n| TotalCoreExpenditure |  |  | 1,357,936 |\n| CoreRevenueResourceLimit |  |  | 1,358,066 |\n| Saving/(excess)againstCoreRevenueResourceLimit |  |  | 130 |\n| SUMMARYOFNONCOREREVENUERESOURCEOUTTURN |  |  |  |\n| Capitalgrantsto/(from)otherbodies |  | (333) |  |\n| Depreciation/Amortisation |  | 25,364 |  |\n| AnnuallyManagedExpenditure-Impairments |  | 403 |  |\n| AnnuallyManagedExpenditure-CreationofProvisions |  | 2,100 |  |\n| AnnuallyManagedExpenditure-DepreciationofDonatedAssets |  | 1,547 |  |\n| AnnuallyManagedExpenditure-FairValueAdjustments |  | 91 |  |\n| DonatedAssetsIncome |  | (687) |  |\n| TotalNonCoreExpenditure |  |  | 28,485 |\n| Non-CoreRevenueResourceLimit |  |  | 28,485 |\n| Saving/(excess)againstNonCoreRevenueResourceLimit |  |  | 0 |\n| SUMMARYRESOURCEOUTTURN | Resource | Expenditure | Saving/(excess) |\n|  | £'000 | £'000 | £'000 |\n| Core | 1,358,066 | 1,357,936 | 130 |\n| Non-Core | 28,485 | 28,485 | 0 |\n| Total | 1,386,551 | 1,386,421 | 130 |\nColumn headers: Row label | 1 | 2 | 3\nRow map:\n- SUMMARYOFCOREREVENUERESOURCEOUTTURN -> col_2=2021/22 ; col_3=2021/22\n- Core -> col_1=1,358,066 ; col_2=1,357,936 ; col_3=130\n- Non-Core -> col_1=28,485 ; col_2=28,485 ; col_3=0\n- Total -> col_1=1,386,551 ; col_2=1,386,421 ; col_3=130"", 'be exchanged between knowledgeable, willing parties in an arms-length transaction. 6) Funding 6 (a) Grampian Health Board Most of the expenditure of the Health Board as Commissioner is met from funds advanced by the Scottish Government within an approved revenue resource limit (RRL) . Cash drawn down to fund expenditure within this approved revenue resource limit is credited to the general fund. All other income receivable by the board that is not classed as funding is recognised when the transfer of goods or services (the performance obligation) is satisfied. Where income is received for goods or services that will not be delivered in the current financial year, that income is deferred. Income from the sale of non-current assets is recognised only when all material conditions of sale have been met, and is measured as the sums due under the sale contract. Non-discretionary funding out-with the RRL is allocated to match actual expenditure incurred for the provision of specific pharmaceutical, dental or ophthalmic services identified by the Scottish Government. Non-discretionary expenditure is disclosed in the accounts and deducted from operating costs charged against the RRL in the Statement of Resource Outturn. Funding for the acquisition of capital assets received from the Scottish Government is credited to the general fund when cash']",£130 (£000),['£130 (£000)'],Q_2022_FIN_03,Grampian-2021-2022,LEX,number,[21],skipped
What was the Cash Requirement limit for NHS Grampian in 2021/22?,Grampian Health Board has successfully achieved all three financial targets for the year reporting an outturn against these set limits as follows: Statutory Financial Targets Limit as set by Actual Variance Under SGHSCD Outturn £000’s £000’,"['and report on any variation. Grampian Health Board has successfully achieved all three financial targets for the year reporting an outturn against these set limits as follows: Statutory Financial Targets Limit as set by Actual Variance Under SGHSCD Outturn £000’s £000’s £000’s Core Revenue Resource Limit 1,358,066 1,357,936 130 Non-Core Revenue Resource Limit 28,485 28,485 - Total 1,386,551 1,386,421 130 Core Capital Resource Limit 64,166 64,166 - Non-Core Capital Resource Limit 1,002 1,002 - Total 65,168 65,168 - Cash Requirement 1,434,610 1,434,610 - Memorandum for In Year Out-turn £000 Core Revenue Resource Variance Surplus in 2021/22 130 Financial flexibility : funding banked with Scottish Government 0 Underlying Surplus against Core Revenue Resource Limit 130 0% The Board is reporting an underspend of £0.130m against a target of breakeven on the revenue resource limit for 2021/22. A one year financial plan was submitted to Scottish Government by NHS Grampian on 21 March 2021. Due to the impact of the COVID-19 pandemic, the Scottish Government paused the three year Annual Operating and financial planning process. Recognising the exceptional nature of 2021-22 and the impact on delivery of financial plans, additional non-repayable funding was provided to support in-year financial balance across all NHS Boards. NHS Grampian received £68.8m (2020/21 £47.3m).', '1. Financial Performance and Position (cont) 1.2 Grampian Health Board performance against statutory financial targets The results of each of the partner organisations, although consolidated with the main Board accounts for group accounting purposes, do not form part of the statutory financial target set for NHS Boards by the Scottish Government Health and Social Care Directorates (SGHSCD) and are, therefore, not taken in to account when considering the Board’s in year financial performance. The three annual financial targets set for each Health Board by the SGHSCD are: ➢ Revenue Resource Limit (RRL)– a resource budget for ongoing activity; ➢ Capital Resource Limit (CRL) – a resource budget for net capital investment; and ➢ Cash Requirement – a financing requirement to fund the cash consequences of ongoing activity and net capital investment. Health Boards are required to contain their net expenditure within these limits, and report on any variation. Grampian Health Board has successfully achieved all three financial targets for the year reporting an outturn against these set limits as follows: Statutory Financial Targets Limit as set by Actual Variance Under SGHSCD Outturn £000’s £000’s £000’s Core Revenue Resource Limit 1,358,066 1,357,936 130 Non-Core Revenue Resource Limit 28,485 28,485 - Total 1,386,551 1,386,421 130 Core Capital Resource Limit 64,166 64,166 -', '1. Financial Performance and Position (cont) 1.2 Grampian Health Board performance against statutory financial targets (cont) The Core Revenue Resource Limit for 2021/22 was also adjusted to include the £0.769m surplus carried forward from 2020/21 and £1 million banked with the Scottish Government under agreed financial flexibility arrangements in 2019/20. 1.2.1 Efficiency Savings Efficiency savings of £2.2 million were achieved against a target of £2.6 million for NHS Grampian services, mainly from the successful recruitment in to medical and nursing vacancies that were previously filled using temporary agency staff in the first half of the year, the transfer of some agency staff on to a direct engagement contractual model, the increased use of biosimilar drugs and savings across a number of non-clinical areas. Recurring savings amounted to £1.0 million and non-recurring of £1.1 million. The gap of £0.4 million was covered non-recurringly by the Scottish Government through their COVID- 19 supplementary funding allocation, recognising that the focus of budget managers was not in the delivery of savings during the period of the Board being on an emergency footing. 1.2.2 Financial impact of the COVID-19 Pandemic Due to the ongoing impact of the pandemic the Board remained on an emergency footing throughout 2021/22. In considering the variations in cost of services', '4. Social Matters (cont) o Promotions o Disciplinary action o Information on the Gender balance for qualifying non-Executive Health Board posts. - An NHS Grampian Equality Outcomes Report 2021-2025 This details what NHS Grampian wishes to achieve in the sphere of each of the 9 “protected characteristics” over the next 4 years. - An NHS Grampian “Mainstreaming” Report This details what NHS Grampian has done in the last 2 years to make equality and diversity an integral part of the way we function as an organisation. The involvement and consultation requirements for each report were met in full. All four reports are available on the NHS Grampian website, to facilitate public scrutiny, as required by law. NHS Grampian has also published a range of other non-Statutory Equality and Diversity Monitoring Reports on a wide range of topics. Equality and Diversity Staff Training During 2021/22, over 2,000 NHS Grampian staff received Equality and Diversity Training by TEAMS at a level appropriate to their role in the organisation. All training is recorded and feeds into the Personal Development Plans of staff. Over the last three years, over 7,000 NHS Grampian staff have now received this training. All of the Seminars include a section on Human Trafficking. The Seminars are independently evaluated by', '11. Trade Union (Facility Time Publication Requirements) Regulations 2017 The Trade Union (Facility Time Publication Requirements) Regulations 2017 requirement relevant public sector employers to publish, a range of data on the amount and cost of facility time. The following information relating to NHS Grampian is also published on the NHS Grampian website at https://www.nhsgrampian.org/about-us/annual-accounts/ 112 (99.74 WTE) employees were relevant union officials during 2021/22 Percentage of time spent on facility time Percentage of time Number of Employees 0% 71 1-50% 31 51-99% 1 100% 9 £ million Total Cost of Facility Time during 2021/22 0.471 Total cost of Paybill 2021/22 772.371 Percentage of total pay bill spent on facility time 0.06% Percentage of total facility time spent in Trade Union Activities 3.20%']","£1,434,610 (£000)","['£1,434,610 (£000)']",Q_2022_FIN_04,Grampian-2021-2022,LEX,number,[21],skipped
What was the Total Revenue Resource Limit for 2021/22?,000,"['and report on any variation. Grampian Health Board has successfully achieved all three financial targets for the year reporting an outturn against these set limits as follows: Statutory Financial Targets Limit as set by Actual Variance Under SGHSCD Outturn £000’s £000’s £000’s Core Revenue Resource Limit 1,358,066 1,357,936 130 Non-Core Revenue Resource Limit 28,485 28,485 - Total 1,386,551 1,386,421 130 Core Capital Resource Limit 64,166 64,166 - Non-Core Capital Resource Limit 1,002 1,002 - Total 65,168 65,168 - Cash Requirement 1,434,610 1,434,610 - Memorandum for In Year Out-turn £000 Core Revenue Resource Variance Surplus in 2021/22 130 Financial flexibility : funding banked with Scottish Government 0 Underlying Surplus against Core Revenue Resource Limit 130 0% The Board is reporting an underspend of £0.130m against a target of breakeven on the revenue resource limit for 2021/22. A one year financial plan was submitted to Scottish Government by NHS Grampian on 21 March 2021. Due to the impact of the COVID-19 pandemic, the Scottish Government paused the three year Annual Operating and financial planning process. Recognising the exceptional nature of 2021-22 and the impact on delivery of financial plans, additional non-repayable funding was provided to support in-year financial balance across all NHS Boards. NHS Grampian received £68.8m (2020/21 £47.3m).', '1. Financial Performance and Position (cont) 1.2 Grampian Health Board performance against statutory financial targets The results of each of the partner organisations, although consolidated with the main Board accounts for group accounting purposes, do not form part of the statutory financial target set for NHS Boards by the Scottish Government Health and Social Care Directorates (SGHSCD) and are, therefore, not taken in to account when considering the Board’s in year financial performance. The three annual financial targets set for each Health Board by the SGHSCD are: ➢ Revenue Resource Limit (RRL)– a resource budget for ongoing activity; ➢ Capital Resource Limit (CRL) – a resource budget for net capital investment; and ➢ Cash Requirement – a financing requirement to fund the cash consequences of ongoing activity and net capital investment. Health Boards are required to contain their net expenditure within these limits, and report on any variation. Grampian Health Board has successfully achieved all three financial targets for the year reporting an outturn against these set limits as follows: Statutory Financial Targets Limit as set by Actual Variance Under SGHSCD Outturn £000’s £000’s £000’s Core Revenue Resource Limit 1,358,066 1,357,936 130 Non-Core Revenue Resource Limit 28,485 28,485 - Total 1,386,551 1,386,421 130 Core Capital Resource Limit 64,166 64,166 -', '1. Financial Performance and Position (cont) 1.2 Grampian Health Board performance against statutory financial targets (cont) The Core Revenue Resource Limit for 2021/22 was also adjusted to include the £0.769m surplus carried forward from 2020/21 and £1 million banked with the Scottish Government under agreed financial flexibility arrangements in 2019/20. 1.2.1 Efficiency Savings Efficiency savings of £2.2 million were achieved against a target of £2.6 million for NHS Grampian services, mainly from the successful recruitment in to medical and nursing vacancies that were previously filled using temporary agency staff in the first half of the year, the transfer of some agency staff on to a direct engagement contractual model, the increased use of biosimilar drugs and savings across a number of non-clinical areas. Recurring savings amounted to £1.0 million and non-recurring of £1.1 million. The gap of £0.4 million was covered non-recurringly by the Scottish Government through their COVID- 19 supplementary funding allocation, recognising that the focus of budget managers was not in the delivery of savings during the period of the Board being on an emergency footing. 1.2.2 Financial impact of the COVID-19 Pandemic Due to the ongoing impact of the pandemic the Board remained on an emergency footing throughout 2021/22. In considering the variations in cost of services', ""Financial table on page 113 (Income Statement) Contains 27 line items across 4 columns. Row labels: NOTE2ASUMMARYOFCOREREVENUERESOURCEOUTTURN; SUMMARYOFCOREREVENUERESOURCEOUTTURN; Netexpenditure; TotalNon-CoreExpenditure(seebelow). Key items: SUMMARYOFCOREREVENUERESOURCEOUTTURN | 2021/22 | 2021/22; £’000 | £’000; Netexpenditure | 1,415,770; TotalNon-CoreExpenditure(seebelow) | (28,485).\n\nTable (header-injected facts):\n\n- SUMMARYOFCOREREVENUERESOURCEOUTTURN > 2 : 2021/22\n- SUMMARYOFCOREREVENUERESOURCEOUTTURN > 3 : 2021/22\n- Netexpenditure > 3 : 1,415,770\n- TotalNon-CoreExpenditure(seebelow) > 3 : (28,485)\n- FHSNonDiscretionaryAllocation > 3 : (66,318)\n- EndowmentNetOperatingCosts > 3 : 803\n- JointVenturesaccountedforonanequitybasis > 3 : 36,166\n- TotalCoreExpenditure > 3 : 1,357,936\n- CoreRevenueResourceLimit > 3 : 1,358,066\n- Saving/(excess)againstCoreRevenueResourceLimit > 3 : 130\n- Capitalgrantsto/(from)otherbodies > 2 : (333)\n- Depreciation/Amortisation > 2 : 25,364\n- AnnuallyManagedExpenditure-Impairments > 2 : 403\n- AnnuallyManagedExpenditure-CreationofProvisions > 2 : 2,100\n- AnnuallyManagedExpenditure-DepreciationofDonatedAssets > 2 : 1,547\n- AnnuallyManagedExpenditure-FairValueAdjustments > 2 : 91\n- DonatedAssetsIncome > 2 : (687)\n- TotalNonCoreExpenditure > 3 : 28,485\n- Non-CoreRevenueResourceLimit > 3 : 28,485\n- Saving/(excess)againstNonCoreRevenueResourceLimit > 3 : 0\n- SUMMARYRESOURCEOUTTURN > 1 : Resource\n- SUMMARYRESOURCEOUTTURN > 2 : Expenditure\n- SUMMARYRESOURCEOUTTURN > 3 : Saving/(excess)\n- Core > 1 : 1,358,066\n- Core > 2 : 1,357,936\n- Core > 3 : 130\n- Non-Core > 1 : 28,485\n- Non-Core > 2 : 28,485\n- Non-Core > 3 : 0\n- Total > 1 : 1,386,551\n- Total > 2 : 1,386,421\n- Total > 3 : 130\n- Column headers: Row label > 1 : 1\n- Column headers: Row label > 2 : 2\n- Column headers: Row label > 3 : 3\n\nTable (markdown):\n\n| 0 | 1 | 2 | 3 |\n| --- | --- | --- | --- |\n| NOTE2ASUMMARYOFCOREREVENUERESOURCEOUTTURN |  |  |  |\n| SUMMARYOFCOREREVENUERESOURCEOUTTURN |  | 2021/22 | 2021/22 |\n|  |  | £’000 | £’000 |\n| Netexpenditure |  |  | 1,415,770 |\n| TotalNon-CoreExpenditure(seebelow) |  |  | (28,485) |\n| FHSNonDiscretionaryAllocation |  |  | (66,318) |\n| EndowmentNetOperatingCosts |  |  | 803 |\n| JointVenturesaccountedforonanequitybasis |  |  | 36,166 |\n| TotalCoreExpenditure |  |  | 1,357,936 |\n| CoreRevenueResourceLimit |  |  | 1,358,066 |\n| Saving/(excess)againstCoreRevenueResourceLimit |  |  | 130 |\n| SUMMARYOFNONCOREREVENUERESOURCEOUTTURN |  |  |  |\n| Capitalgrantsto/(from)otherbodies |  | (333) |  |\n| Depreciation/Amortisation |  | 25,364 |  |\n| AnnuallyManagedExpenditure-Impairments |  | 403 |  |\n| AnnuallyManagedExpenditure-CreationofProvisions |  | 2,100 |  |\n| AnnuallyManagedExpenditure-DepreciationofDonatedAssets |  | 1,547 |  |\n| AnnuallyManagedExpenditure-FairValueAdjustments |  | 91 |  |\n| DonatedAssetsIncome |  | (687) |  |\n| TotalNonCoreExpenditure |  |  | 28,485 |\n| Non-CoreRevenueResourceLimit |  |  | 28,485 |\n| Saving/(excess)againstNonCoreRevenueResourceLimit |  |  | 0 |\n| SUMMARYRESOURCEOUTTURN | Resource | Expenditure | Saving/(excess) |\n|  | £'000 | £'000 | £'000 |\n| Core | 1,358,066 | 1,357,936 | 130 |\n| Non-Core | 28,485 | 28,485 | 0 |\n| Total | 1,386,551 | 1,386,421 | 130 |\nColumn headers: Row label | 1 | 2 | 3\nRow map:\n- SUMMARYOFCOREREVENUERESOURCEOUTTURN -> col_2=2021/22 ; col_3=2021/22\n- Core -> col_1=1,358,066 ; col_2=1,357,936 ; col_3=130\n- Non-Core -> col_1=28,485 ; col_2=28,485 ; col_3=0\n- Total -> col_1=1,386,551 ; col_2=1,386,421 ; col_3=130"", 'be exchanged between knowledgeable, willing parties in an arms-length transaction. 6) Funding 6 (a) Grampian Health Board Most of the expenditure of the Health Board as Commissioner is met from funds advanced by the Scottish Government within an approved revenue resource limit (RRL) . Cash drawn down to fund expenditure within this approved revenue resource limit is credited to the general fund. All other income receivable by the board that is not classed as funding is recognised when the transfer of goods or services (the performance obligation) is satisfied. Where income is received for goods or services that will not be delivered in the current financial year, that income is deferred. Income from the sale of non-current assets is recognised only when all material conditions of sale have been met, and is measured as the sums due under the sale contract. Non-discretionary funding out-with the RRL is allocated to match actual expenditure incurred for the provision of specific pharmaceutical, dental or ophthalmic services identified by the Scottish Government. Non-discretionary expenditure is disclosed in the accounts and deducted from operating costs charged against the RRL in the Statement of Resource Outturn. Funding for the acquisition of capital assets received from the Scottish Government is credited to the general fund when cash']","£1,386,551 (£000)","['£1,386,551 (£000)']",Q_2022_FIN_05,Grampian-2021-2022,LEX,number,[21],skipped
What was the Core Capital Resource Limit for 2021/22?,Grampian Health Board has successfully achieved all three financial targets for the year reporting an outturn against these set limits as follows: Statutory Financial Targets Limit as set by Actual Variance Under SGHSCD Outturn £000’s £000’,"['and report on any variation. Grampian Health Board has successfully achieved all three financial targets for the year reporting an outturn against these set limits as follows: Statutory Financial Targets Limit as set by Actual Variance Under SGHSCD Outturn £000’s £000’s £000’s Core Revenue Resource Limit 1,358,066 1,357,936 130 Non-Core Revenue Resource Limit 28,485 28,485 - Total 1,386,551 1,386,421 130 Core Capital Resource Limit 64,166 64,166 - Non-Core Capital Resource Limit 1,002 1,002 - Total 65,168 65,168 - Cash Requirement 1,434,610 1,434,610 - Memorandum for In Year Out-turn £000 Core Revenue Resource Variance Surplus in 2021/22 130 Financial flexibility : funding banked with Scottish Government 0 Underlying Surplus against Core Revenue Resource Limit 130 0% The Board is reporting an underspend of £0.130m against a target of breakeven on the revenue resource limit for 2021/22. A one year financial plan was submitted to Scottish Government by NHS Grampian on 21 March 2021. Due to the impact of the COVID-19 pandemic, the Scottish Government paused the three year Annual Operating and financial planning process. Recognising the exceptional nature of 2021-22 and the impact on delivery of financial plans, additional non-repayable funding was provided to support in-year financial balance across all NHS Boards. NHS Grampian received £68.8m (2020/21 £47.3m).', '1. Financial Performance and Position (cont) 1.2 Grampian Health Board performance against statutory financial targets The results of each of the partner organisations, although consolidated with the main Board accounts for group accounting purposes, do not form part of the statutory financial target set for NHS Boards by the Scottish Government Health and Social Care Directorates (SGHSCD) and are, therefore, not taken in to account when considering the Board’s in year financial performance. The three annual financial targets set for each Health Board by the SGHSCD are: ➢ Revenue Resource Limit (RRL)– a resource budget for ongoing activity; ➢ Capital Resource Limit (CRL) – a resource budget for net capital investment; and ➢ Cash Requirement – a financing requirement to fund the cash consequences of ongoing activity and net capital investment. Health Boards are required to contain their net expenditure within these limits, and report on any variation. Grampian Health Board has successfully achieved all three financial targets for the year reporting an outturn against these set limits as follows: Statutory Financial Targets Limit as set by Actual Variance Under SGHSCD Outturn £000’s £000’s £000’s Core Revenue Resource Limit 1,358,066 1,357,936 130 Non-Core Revenue Resource Limit 28,485 28,485 - Total 1,386,551 1,386,421 130 Core Capital Resource Limit 64,166 64,166 -', '1. Financial Performance and Position (cont) 1.2 Grampian Health Board performance against statutory financial targets (cont) The Core Revenue Resource Limit for 2021/22 was also adjusted to include the £0.769m surplus carried forward from 2020/21 and £1 million banked with the Scottish Government under agreed financial flexibility arrangements in 2019/20. 1.2.1 Efficiency Savings Efficiency savings of £2.2 million were achieved against a target of £2.6 million for NHS Grampian services, mainly from the successful recruitment in to medical and nursing vacancies that were previously filled using temporary agency staff in the first half of the year, the transfer of some agency staff on to a direct engagement contractual model, the increased use of biosimilar drugs and savings across a number of non-clinical areas. Recurring savings amounted to £1.0 million and non-recurring of £1.1 million. The gap of £0.4 million was covered non-recurringly by the Scottish Government through their COVID- 19 supplementary funding allocation, recognising that the focus of budget managers was not in the delivery of savings during the period of the Board being on an emergency footing. 1.2.2 Financial impact of the COVID-19 Pandemic Due to the ongoing impact of the pandemic the Board remained on an emergency footing throughout 2021/22. In considering the variations in cost of services', ""Financial table on page 113 (Income Statement) Contains 27 line items across 4 columns. Row labels: NOTE2ASUMMARYOFCOREREVENUERESOURCEOUTTURN; SUMMARYOFCOREREVENUERESOURCEOUTTURN; Netexpenditure; TotalNon-CoreExpenditure(seebelow). Key items: SUMMARYOFCOREREVENUERESOURCEOUTTURN | 2021/22 | 2021/22; £’000 | £’000; Netexpenditure | 1,415,770; TotalNon-CoreExpenditure(seebelow) | (28,485).\n\nTable (header-injected facts):\n\n- SUMMARYOFCOREREVENUERESOURCEOUTTURN > 2 : 2021/22\n- SUMMARYOFCOREREVENUERESOURCEOUTTURN > 3 : 2021/22\n- Netexpenditure > 3 : 1,415,770\n- TotalNon-CoreExpenditure(seebelow) > 3 : (28,485)\n- FHSNonDiscretionaryAllocation > 3 : (66,318)\n- EndowmentNetOperatingCosts > 3 : 803\n- JointVenturesaccountedforonanequitybasis > 3 : 36,166\n- TotalCoreExpenditure > 3 : 1,357,936\n- CoreRevenueResourceLimit > 3 : 1,358,066\n- Saving/(excess)againstCoreRevenueResourceLimit > 3 : 130\n- Capitalgrantsto/(from)otherbodies > 2 : (333)\n- Depreciation/Amortisation > 2 : 25,364\n- AnnuallyManagedExpenditure-Impairments > 2 : 403\n- AnnuallyManagedExpenditure-CreationofProvisions > 2 : 2,100\n- AnnuallyManagedExpenditure-DepreciationofDonatedAssets > 2 : 1,547\n- AnnuallyManagedExpenditure-FairValueAdjustments > 2 : 91\n- DonatedAssetsIncome > 2 : (687)\n- TotalNonCoreExpenditure > 3 : 28,485\n- Non-CoreRevenueResourceLimit > 3 : 28,485\n- Saving/(excess)againstNonCoreRevenueResourceLimit > 3 : 0\n- SUMMARYRESOURCEOUTTURN > 1 : Resource\n- SUMMARYRESOURCEOUTTURN > 2 : Expenditure\n- SUMMARYRESOURCEOUTTURN > 3 : Saving/(excess)\n- Core > 1 : 1,358,066\n- Core > 2 : 1,357,936\n- Core > 3 : 130\n- Non-Core > 1 : 28,485\n- Non-Core > 2 : 28,485\n- Non-Core > 3 : 0\n- Total > 1 : 1,386,551\n- Total > 2 : 1,386,421\n- Total > 3 : 130\n- Column headers: Row label > 1 : 1\n- Column headers: Row label > 2 : 2\n- Column headers: Row label > 3 : 3\n\nTable (markdown):\n\n| 0 | 1 | 2 | 3 |\n| --- | --- | --- | --- |\n| NOTE2ASUMMARYOFCOREREVENUERESOURCEOUTTURN |  |  |  |\n| SUMMARYOFCOREREVENUERESOURCEOUTTURN |  | 2021/22 | 2021/22 |\n|  |  | £’000 | £’000 |\n| Netexpenditure |  |  | 1,415,770 |\n| TotalNon-CoreExpenditure(seebelow) |  |  | (28,485) |\n| FHSNonDiscretionaryAllocation |  |  | (66,318) |\n| EndowmentNetOperatingCosts |  |  | 803 |\n| JointVenturesaccountedforonanequitybasis |  |  | 36,166 |\n| TotalCoreExpenditure |  |  | 1,357,936 |\n| CoreRevenueResourceLimit |  |  | 1,358,066 |\n| Saving/(excess)againstCoreRevenueResourceLimit |  |  | 130 |\n| SUMMARYOFNONCOREREVENUERESOURCEOUTTURN |  |  |  |\n| Capitalgrantsto/(from)otherbodies |  | (333) |  |\n| Depreciation/Amortisation |  | 25,364 |  |\n| AnnuallyManagedExpenditure-Impairments |  | 403 |  |\n| AnnuallyManagedExpenditure-CreationofProvisions |  | 2,100 |  |\n| AnnuallyManagedExpenditure-DepreciationofDonatedAssets |  | 1,547 |  |\n| AnnuallyManagedExpenditure-FairValueAdjustments |  | 91 |  |\n| DonatedAssetsIncome |  | (687) |  |\n| TotalNonCoreExpenditure |  |  | 28,485 |\n| Non-CoreRevenueResourceLimit |  |  | 28,485 |\n| Saving/(excess)againstNonCoreRevenueResourceLimit |  |  | 0 |\n| SUMMARYRESOURCEOUTTURN | Resource | Expenditure | Saving/(excess) |\n|  | £'000 | £'000 | £'000 |\n| Core | 1,358,066 | 1,357,936 | 130 |\n| Non-Core | 28,485 | 28,485 | 0 |\n| Total | 1,386,551 | 1,386,421 | 130 |\nColumn headers: Row label | 1 | 2 | 3\nRow map:\n- SUMMARYOFCOREREVENUERESOURCEOUTTURN -> col_2=2021/22 ; col_3=2021/22\n- Core -> col_1=1,358,066 ; col_2=1,357,936 ; col_3=130\n- Non-Core -> col_1=28,485 ; col_2=28,485 ; col_3=0\n- Total -> col_1=1,386,551 ; col_2=1,386,421 ; col_3=130"", 'be exchanged between knowledgeable, willing parties in an arms-length transaction. 6) Funding 6 (a) Grampian Health Board Most of the expenditure of the Health Board as Commissioner is met from funds advanced by the Scottish Government within an approved revenue resource limit (RRL) . Cash drawn down to fund expenditure within this approved revenue resource limit is credited to the general fund. All other income receivable by the board that is not classed as funding is recognised when the transfer of goods or services (the performance obligation) is satisfied. Where income is received for goods or services that will not be delivered in the current financial year, that income is deferred. Income from the sale of non-current assets is recognised only when all material conditions of sale have been met, and is measured as the sums due under the sale contract. Non-discretionary funding out-with the RRL is allocated to match actual expenditure incurred for the provision of specific pharmaceutical, dental or ophthalmic services identified by the Scottish Government. Non-discretionary expenditure is disclosed in the accounts and deducted from operating costs charged against the RRL in the Statement of Resource Outturn. Funding for the acquisition of capital assets received from the Scottish Government is credited to the general fund when cash']","£64,166 (£000)","['£64,166 (£000)']",Q_2022_FIN_06,Grampian-2021-2022,LEX,number,[21],skipped
"After stripping out the one-off brokerage element, what did the underlying resource position look like against the core budget in 2021/22?",Grampian Health Board has successfully achieved all three financial targets for the year reporting an outturn against these set limits as follows: Statutory Financial Targets Limit as set by Actual Variance Under SGHSCD Outturn £000’s £000’,"['and report on any variation. Grampian Health Board has successfully achieved all three financial targets for the year reporting an outturn against these set limits as follows: Statutory Financial Targets Limit as set by Actual Variance Under SGHSCD Outturn £000’s £000’s £000’s Core Revenue Resource Limit 1,358,066 1,357,936 130 Non-Core Revenue Resource Limit 28,485 28,485 - Total 1,386,551 1,386,421 130 Core Capital Resource Limit 64,166 64,166 - Non-Core Capital Resource Limit 1,002 1,002 - Total 65,168 65,168 - Cash Requirement 1,434,610 1,434,610 - Memorandum for In Year Out-turn £000 Core Revenue Resource Variance Surplus in 2021/22 130 Financial flexibility : funding banked with Scottish Government 0 Underlying Surplus against Core Revenue Resource Limit 130 0% The Board is reporting an underspend of £0.130m against a target of breakeven on the revenue resource limit for 2021/22. A one year financial plan was submitted to Scottish Government by NHS Grampian on 21 March 2021. Due to the impact of the COVID-19 pandemic, the Scottish Government paused the three year Annual Operating and financial planning process. Recognising the exceptional nature of 2021-22 and the impact on delivery of financial plans, additional non-repayable funding was provided to support in-year financial balance across all NHS Boards. NHS Grampian received £68.8m (2020/21 £47.3m).', '1. Financial Performance and Position (cont) 1.2 Grampian Health Board performance against statutory financial targets The results of each of the partner organisations, although consolidated with the main Board accounts for group accounting purposes, do not form part of the statutory financial target set for NHS Boards by the Scottish Government Health and Social Care Directorates (SGHSCD) and are, therefore, not taken in to account when considering the Board’s in year financial performance. The three annual financial targets set for each Health Board by the SGHSCD are: ➢ Revenue Resource Limit (RRL)– a resource budget for ongoing activity; ➢ Capital Resource Limit (CRL) – a resource budget for net capital investment; and ➢ Cash Requirement – a financing requirement to fund the cash consequences of ongoing activity and net capital investment. Health Boards are required to contain their net expenditure within these limits, and report on any variation. Grampian Health Board has successfully achieved all three financial targets for the year reporting an outturn against these set limits as follows: Statutory Financial Targets Limit as set by Actual Variance Under SGHSCD Outturn £000’s £000’s £000’s Core Revenue Resource Limit 1,358,066 1,357,936 130 Non-Core Revenue Resource Limit 28,485 28,485 - Total 1,386,551 1,386,421 130 Core Capital Resource Limit 64,166 64,166 -', ""Financial table on page 113 (Income Statement) Contains 27 line items across 4 columns. Row labels: NOTE2ASUMMARYOFCOREREVENUERESOURCEOUTTURN; SUMMARYOFCOREREVENUERESOURCEOUTTURN; Netexpenditure; TotalNon-CoreExpenditure(seebelow). Key items: SUMMARYOFCOREREVENUERESOURCEOUTTURN | 2021/22 | 2021/22; £’000 | £’000; Netexpenditure | 1,415,770; TotalNon-CoreExpenditure(seebelow) | (28,485).\n\nTable (header-injected facts):\n\n- SUMMARYOFCOREREVENUERESOURCEOUTTURN > 2 : 2021/22\n- SUMMARYOFCOREREVENUERESOURCEOUTTURN > 3 : 2021/22\n- Netexpenditure > 3 : 1,415,770\n- TotalNon-CoreExpenditure(seebelow) > 3 : (28,485)\n- FHSNonDiscretionaryAllocation > 3 : (66,318)\n- EndowmentNetOperatingCosts > 3 : 803\n- JointVenturesaccountedforonanequitybasis > 3 : 36,166\n- TotalCoreExpenditure > 3 : 1,357,936\n- CoreRevenueResourceLimit > 3 : 1,358,066\n- Saving/(excess)againstCoreRevenueResourceLimit > 3 : 130\n- Capitalgrantsto/(from)otherbodies > 2 : (333)\n- Depreciation/Amortisation > 2 : 25,364\n- AnnuallyManagedExpenditure-Impairments > 2 : 403\n- AnnuallyManagedExpenditure-CreationofProvisions > 2 : 2,100\n- AnnuallyManagedExpenditure-DepreciationofDonatedAssets > 2 : 1,547\n- AnnuallyManagedExpenditure-FairValueAdjustments > 2 : 91\n- DonatedAssetsIncome > 2 : (687)\n- TotalNonCoreExpenditure > 3 : 28,485\n- Non-CoreRevenueResourceLimit > 3 : 28,485\n- Saving/(excess)againstNonCoreRevenueResourceLimit > 3 : 0\n- SUMMARYRESOURCEOUTTURN > 1 : Resource\n- SUMMARYRESOURCEOUTTURN > 2 : Expenditure\n- SUMMARYRESOURCEOUTTURN > 3 : Saving/(excess)\n- Core > 1 : 1,358,066\n- Core > 2 : 1,357,936\n- Core > 3 : 130\n- Non-Core > 1 : 28,485\n- Non-Core > 2 : 28,485\n- Non-Core > 3 : 0\n- Total > 1 : 1,386,551\n- Total > 2 : 1,386,421\n- Total > 3 : 130\n- Column headers: Row label > 1 : 1\n- Column headers: Row label > 2 : 2\n- Column headers: Row label > 3 : 3\n\nTable (markdown):\n\n| 0 | 1 | 2 | 3 |\n| --- | --- | --- | --- |\n| NOTE2ASUMMARYOFCOREREVENUERESOURCEOUTTURN |  |  |  |\n| SUMMARYOFCOREREVENUERESOURCEOUTTURN |  | 2021/22 | 2021/22 |\n|  |  | £’000 | £’000 |\n| Netexpenditure |  |  | 1,415,770 |\n| TotalNon-CoreExpenditure(seebelow) |  |  | (28,485) |\n| FHSNonDiscretionaryAllocation |  |  | (66,318) |\n| EndowmentNetOperatingCosts |  |  | 803 |\n| JointVenturesaccountedforonanequitybasis |  |  | 36,166 |\n| TotalCoreExpenditure |  |  | 1,357,936 |\n| CoreRevenueResourceLimit |  |  | 1,358,066 |\n| Saving/(excess)againstCoreRevenueResourceLimit |  |  | 130 |\n| SUMMARYOFNONCOREREVENUERESOURCEOUTTURN |  |  |  |\n| Capitalgrantsto/(from)otherbodies |  | (333) |  |\n| Depreciation/Amortisation |  | 25,364 |  |\n| AnnuallyManagedExpenditure-Impairments |  | 403 |  |\n| AnnuallyManagedExpenditure-CreationofProvisions |  | 2,100 |  |\n| AnnuallyManagedExpenditure-DepreciationofDonatedAssets |  | 1,547 |  |\n| AnnuallyManagedExpenditure-FairValueAdjustments |  | 91 |  |\n| DonatedAssetsIncome |  | (687) |  |\n| TotalNonCoreExpenditure |  |  | 28,485 |\n| Non-CoreRevenueResourceLimit |  |  | 28,485 |\n| Saving/(excess)againstNonCoreRevenueResourceLimit |  |  | 0 |\n| SUMMARYRESOURCEOUTTURN | Resource | Expenditure | Saving/(excess) |\n|  | £'000 | £'000 | £'000 |\n| Core | 1,358,066 | 1,357,936 | 130 |\n| Non-Core | 28,485 | 28,485 | 0 |\n| Total | 1,386,551 | 1,386,421 | 130 |\nColumn headers: Row label | 1 | 2 | 3\nRow map:\n- SUMMARYOFCOREREVENUERESOURCEOUTTURN -> col_2=2021/22 ; col_3=2021/22\n- Core -> col_1=1,358,066 ; col_2=1,357,936 ; col_3=130\n- Non-Core -> col_1=28,485 ; col_2=28,485 ; col_3=0\n- Total -> col_1=1,386,551 ; col_2=1,386,421 ; col_3=130"", '1. Financial Performance and Position (cont) 1.2 Grampian Health Board performance against statutory financial targets (cont) The Core Revenue Resource Limit for 2021/22 was also adjusted to include the £0.769m surplus carried forward from 2020/21 and £1 million banked with the Scottish Government under agreed financial flexibility arrangements in 2019/20. 1.2.1 Efficiency Savings Efficiency savings of £2.2 million were achieved against a target of £2.6 million for NHS Grampian services, mainly from the successful recruitment in to medical and nursing vacancies that were previously filled using temporary agency staff in the first half of the year, the transfer of some agency staff on to a direct engagement contractual model, the increased use of biosimilar drugs and savings across a number of non-clinical areas. Recurring savings amounted to £1.0 million and non-recurring of £1.1 million. The gap of £0.4 million was covered non-recurringly by the Scottish Government through their COVID- 19 supplementary funding allocation, recognising that the focus of budget managers was not in the delivery of savings during the period of the Board being on an emergency footing. 1.2.2 Financial impact of the COVID-19 Pandemic Due to the ongoing impact of the pandemic the Board remained on an emergency footing throughout 2021/22. In considering the variations in cost of services', 'period from 1 April 2021 is 20.9% of pensionable pay. The employee rate applied is variable and is anticipated to provide a yield of 9.6% of pensionable pay. While a valuation was carried out as at 31 March 2016, work on the cost cap valuation was suspended by the UK Government following the decision by the Court of Appeal (McCloud (Judiciary scheme)/Sargeant (Firefighters’ Scheme) cases) that the transitional protections provided as part of the 2015 reforms unlawfully discriminated on the grounds of age. Following consultation and an announcement in February 2021 on proposals to remedy the discrimination, the UK Government confirmed that the cost control element of the 2016 valuations could be completed. The UK Government has also asked the Government Actuary to review whether, and to what extent, the cost control mechanism is meeting its original objectives. The 2020 actuarial valuations will take the report’s findings into account. The interim report is complete (restricted) and is currently being finalised with a consultation. Alongside these announcements, the UK Government confirmed that current employer contribution rates would stay in force until 1 April 2024. NHS Grampian’s level of participation in the scheme is 8% based on the proportion of employer contributions paid in 2020-21. The new NHS Pension Scheme (Scotland) 2015']","£130 (£000), 0%","['£130 (£000), 0%']",Q_2022_FIN_07,Grampian-2021-2022,STR,number,[21],skipped
How much non-repayable support did the Scottish Government provide to maintain NHS Grampian's financial balance in 2021/22?,000,"['and report on any variation. Grampian Health Board has successfully achieved all three financial targets for the year reporting an outturn against these set limits as follows: Statutory Financial Targets Limit as set by Actual Variance Under SGHSCD Outturn £000’s £000’s £000’s Core Revenue Resource Limit 1,358,066 1,357,936 130 Non-Core Revenue Resource Limit 28,485 28,485 - Total 1,386,551 1,386,421 130 Core Capital Resource Limit 64,166 64,166 - Non-Core Capital Resource Limit 1,002 1,002 - Total 65,168 65,168 - Cash Requirement 1,434,610 1,434,610 - Memorandum for In Year Out-turn £000 Core Revenue Resource Variance Surplus in 2021/22 130 Financial flexibility : funding banked with Scottish Government 0 Underlying Surplus against Core Revenue Resource Limit 130 0% The Board is reporting an underspend of £0.130m against a target of breakeven on the revenue resource limit for 2021/22. A one year financial plan was submitted to Scottish Government by NHS Grampian on 21 March 2021. Due to the impact of the COVID-19 pandemic, the Scottish Government paused the three year Annual Operating and financial planning process. Recognising the exceptional nature of 2021-22 and the impact on delivery of financial plans, additional non-repayable funding was provided to support in-year financial balance across all NHS Boards. NHS Grampian received £68.8m (2020/21 £47.3m).', 'paid within 30 days. In 2021/22 85% of invoices by value (2020/21 92%) and 75% of invoices by volume (2020/21 91%) were paid within 10 days. The small drop in payment performance compared to the prior year, reflects a reduction in available capacity to support the purchase to pay process during the year, partly due to illness and partly the impact of wider system pressures on support teams. 4. Social Matters NHS Grampian promotes equality and celebrates diversity both in the services we provide and within our organisation. We also take our duty to promote equality and diversity in the wider community very seriously. The challenge for the Board is to maintain the excellent progress achieved to date, taking forward work for all 9 “protected characteristics” which make up equality and diversity during the challenging times caused by the COVID-19 pandemic. The “protected characteristics”, as defined by the Equality Act 2010 are: race, disability, age, sex (male or female), sexual orientation, gender reassignment, pregnancy and maternity, marriage and civil partnership and religion or belief. The Board has also embraced the requirements of the Equality Act (Specific Duties) (Scotland) Regulations 2012, as amended, and published reports including the following key updates on progress in 2021/22: - An NHS Grampian Equal Pay', '5. Performance against Key National Treatment Targets (cont) 5.2 Impact of COVID-19 (cont) 5.2.3 Mental Health (cont) Source: Tableau (Access to Hospital Services – mental health) Child Adolescent Mental Health Services Prior to COVID-19, the service had implemented a service redesign and relocated to a purpose Source: Tableau (CAMHS monthly reports) designed and integrated new facility in Aberdeen. As a result of the changes made and the ability to offer access to support virtually, the service has been able to maintain timely access during the year with performance above the 90% national standard, with the exception of April 2021. The service are implementing plans to utilise the additional funding that has been made available by Scottish Government. Psychological Therapies At an early stage in the COVID-19 response, the Board implemented a psychosocial hub to provide access and support to staff and the public given the impact of COVID-19 and the lockdown measures that have been in place. The hub was in place throughout 2021/22 and positive feedback has been received from those accessing the service.', '2. Fraud Bribery and Corruption (cont) In the year to December 2019, the extrapolation of the sample results for Grampian indicated that the level of income from dental and ophthalmic charges could potentially have been £0.3 million higher due to incorrect claims. CFS anticipate that the production of the annual extrapolation calculation will resume in 2022 . 3. Payment Policy NHS Grampian is committed to supporting the Scottish Government in helping businesses during the current economic situation by paying bills more quickly. The intention is to achieve payment of all undisputed invoices within 10 working days, across all public bodies and NHS Grampian is actively working towards achievement of this accelerated payment target. In 2021/22, the average credit taken was 14 days (2020/21: 9 days). In 2021/22 91% of invoices by value (2020/21 97%) and 85% of invoices by volume (2020/21 96%) were paid within 30 days. In 2021/22 85% of invoices by value (2020/21 92%) and 75% of invoices by volume (2020/21 91%) were paid within 10 days. The small drop in payment performance compared to the prior year, reflects a reduction in available capacity to support the purchase to pay process during the year, partly due to illness and partly the impact of wider system pressures on support', '12. Personal Data Related Incidents NHS Grampian formally reported personal data related incidents to the Information Commissioners Office (ICO) on 26 occasions during 2021/22 (2020/21 25). Of these, 14 did not meet the threshold for notification, but NHS Grampian notified the Information Commissioner voluntarily for their awareness. Three notifications were made and subsequently withdrawn. Recommendations were made and considered, but no enforcement action or penalties were applied by the ICO. Two incidents remain open. 13. Financial Instruments Information in respect of the financial risk management objectives and policies of the Board and the exposure of the Board to price risk, credit risk, liquidity risk and cash flow risk is disclosed in Note 19 on page 136. ii) STATEMENT OF THE CHIEF EXECUTIVE’S RESPONSIBILITIES AS THE ACCOUNTABLE OFFICER OF THE HEALTH BOARD Under Section 15 of the Public Finance and Accountability (Scotland) Act 2000 the Principal Accountable Officer (PAO) of the Scottish Government has appointed me as Accountable Officer of Grampian Health Board. This designation carries with it, responsibility for: ▪ The propriety and regularity of financial transactions under my control; ▪ The economical, efficient and effective use of resources placed at the Board’s disposal; and ▪ Safeguarding the assets of the Board. In preparing the Accounts I am required to']",£68.8 million COVID-19 supplementary allocation,['£68.8 million COVID-19 supplementary allocation'],Q_2022_FIN_P1,Grampian-2021-2022,MOD,number,[22],skipped
How much in efficiency savings did NHS Grampian deliver in 2021/22?,1,"['1. Financial Performance and Position (cont) 1.2 Grampian Health Board performance against statutory financial targets (cont) The Core Revenue Resource Limit for 2021/22 was also adjusted to include the £0.769m surplus carried forward from 2020/21 and £1 million banked with the Scottish Government under agreed financial flexibility arrangements in 2019/20. 1.2.1 Efficiency Savings Efficiency savings of £2.2 million were achieved against a target of £2.6 million for NHS Grampian services, mainly from the successful recruitment in to medical and nursing vacancies that were previously filled using temporary agency staff in the first half of the year, the transfer of some agency staff on to a direct engagement contractual model, the increased use of biosimilar drugs and savings across a number of non-clinical areas. Recurring savings amounted to £1.0 million and non-recurring of £1.1 million. The gap of £0.4 million was covered non-recurringly by the Scottish Government through their COVID- 19 supplementary funding allocation, recognising that the focus of budget managers was not in the delivery of savings during the period of the Board being on an emergency footing. 1.2.2 Financial impact of the COVID-19 Pandemic Due to the ongoing impact of the pandemic the Board remained on an emergency footing throughout 2021/22. In considering the variations in cost of services', 'member of an IJB that required disclosure in the accounts under IAS 24. 9. Disclosure of Information to Auditor The directors who held office at the date of approval of this Directors’ Report confirm that, so far as they are each aware, there is no relevant audit information of which the Board’s auditor is unaware; and each director has taken all the steps that he/she ought reasonably to have taken as a director to make himself/herself aware of any relevant audit information and to establish that the Board’s auditor is aware of that information. 10. Remuneration for Non-Audit Work Audit Scotland, the Board’s external auditor, received no fees for non-audit work during 2021/22 (2020/21 £0). PricewaterhouseCoopers LLP who provide an Internal Audit Service to NHS Grampian received no fees for non-audit work during 2021/22 (2020/21 £0). 11. Public Services Reform (Scotland) Act 2010 Sections 31 and 32 of the Public Services Reform (Scotland) Act 2010 impose duties on NHS Grampian to publish information on expenditure, economic sustainability and efficiency as soon as is reasonably practicable after the end of each financial year. The information required to comply with these disclosure requirements is not an integral part of the Annual Accounts and is displayed on the NHS Grampian website at the', 'Sections 31 and 32 of the Public Services Reform (Scotland) Act 2010 impose duties on NHS Grampian to publish information on expenditure, economic sustainability and efficiency as soon as is reasonably practicable after the end of each financial year. The information required to comply with these disclosure requirements is not an integral part of the Annual Accounts and is displayed on the NHS Grampian website at the following link', 'which underpins redesign services. The most and supports transformation significant challenge is the capacity across NHS Grampian meaning within services and our eHealth that we may be unable to deliver team to support change at the pace Digital against the Digital Work Plan which would make a difference for Change priorities set against the Digital staff and patients. The Board is Health & Care Strategy and refreshing its wider strategy and Remobilisation Plan’s Failure to consideration will be given to how achieve organisational objectives. we resource our transformation This could lead to reputational programme, including our digital impact across NHS Grampian and work plan. potential failure to meet agreed deliverables. The risks around the continuity of the Test and Protect programme As staff are on temporary have been discussed with SG contracts there is a possibility that colleagues and joint working Test & protect capacity within the program may continues to clarify the decrease over the next 6 months requirements for the service and and limit our ability to respond. need to provide certainty of funding to secure the necessary capacity to operate without disruption. 6. Non-Financial Performance Summary NHS Grampian has a performance framework through which a culture of continuous improvement is supported. Our vision, proudly working together to', ""1. Financial Performance and Position (cont) 1.1 Consolidated accounts (cont) 1.1.1 Grampian Health Board Endowment Funds (cont) The charity had no direct investments in Russian Companies during the year. The charity’s investment strategy targets investments to deliver sustainable long-term capital growth and consistent income generation, and this has been maintained during 2021/22. In line with the trend experienced by many other charities due to the economic impact of the COVID-19 pandemic on local communities, income from donations and legacies continued to fall during the year. The reduced level of planned care and impact of restrictions on visiting and flow through hospitals and other health facilities also contributed to the reduction in donations received. Total income for the year was £2.799 million* (2020/21: restated £3.778 million* †* ) analysed as follows:- NHS Grampian Endowment Funds Income analysis 1,509 1,314 £000's 930 734 622 600 401 12 255 200 OTHER DONATIONS COVID DONATIONS NHS CHARITIES LEGACIES INVESTMENT TOGETHER 2021/22 2020/21 Restated With the attention of clinical staff focused on addressing the system pressures arising from the ongoing impact of the COVID-19 pandemic, the charity also experienced a reduction in expenditure during the year due to a drop in the number of grant applications received for general and other specific purposes. The net""]",£2.2 million,['£2.2 million'],Q_2022_SAV_01,Grampian-2021-2022,MOD,number,[22],skipped
What cost-saving objective was NHS Grampian required to achieve in 2021/22?,"2,000","['4. Social Matters (cont) o Promotions o Disciplinary action o Information on the Gender balance for qualifying non-Executive Health Board posts. - An NHS Grampian Equality Outcomes Report 2021-2025 This details what NHS Grampian wishes to achieve in the sphere of each of the 9 “protected characteristics” over the next 4 years. - An NHS Grampian “Mainstreaming” Report This details what NHS Grampian has done in the last 2 years to make equality and diversity an integral part of the way we function as an organisation. The involvement and consultation requirements for each report were met in full. All four reports are available on the NHS Grampian website, to facilitate public scrutiny, as required by law. NHS Grampian has also published a range of other non-Statutory Equality and Diversity Monitoring Reports on a wide range of topics. Equality and Diversity Staff Training During 2021/22, over 2,000 NHS Grampian staff received Equality and Diversity Training by TEAMS at a level appropriate to their role in the organisation. All training is recorded and feeds into the Personal Development Plans of staff. Over the last three years, over 7,000 NHS Grampian staff have now received this training. All of the Seminars include a section on Human Trafficking. The Seminars are independently evaluated by', 'services. Within NHS Grampian the three main phases of our response comprised Operation Rainbow (April to May 2020), Operation Snowdrop (January to March 2021) and Operation Iris (December to March 2022). Operation Iris was our response to the Omicron Variant and the winter pressures that have been experienced during the most recent winter period. The key organisational objectives whilst in this operational phase were as follows: - Objective A: Keep staff safe & help them to maximise wellbeing - Objective B: Responding to demand on the health & care system - Objective C : Protecting critical services & reducing harm 5.2 Impact of COVID-19 The response to COVID-19 has had a profound and significant impact on our ability to provide services during 2021/22. In the paragraphs below we have set out the impact on the following key aspects of the NHS services: - Hospital occupancy - Planned care - Mental Health - Unscheduled care 5.2.1 Hospital Occupancy The activity levels in all the hospital sites has fluctuated significantly during the year reflecting the whole system pressures that have been experienced. Similar to 2020/21, NHS Boards have required to change and adapt their health and social care systems to ensure that they had the required capacity to meet predicted demand for', '2. Fraud Bribery and Corruption (cont) In the year to December 2019, the extrapolation of the sample results for Grampian indicated that the level of income from dental and ophthalmic charges could potentially have been £0.3 million higher due to incorrect claims. CFS anticipate that the production of the annual extrapolation calculation will resume in 2022 . 3. Payment Policy NHS Grampian is committed to supporting the Scottish Government in helping businesses during the current economic situation by paying bills more quickly. The intention is to achieve payment of all undisputed invoices within 10 working days, across all public bodies and NHS Grampian is actively working towards achievement of this accelerated payment target. In 2021/22, the average credit taken was 14 days (2020/21: 9 days). In 2021/22 91% of invoices by value (2020/21 97%) and 85% of invoices by volume (2020/21 96%) were paid within 30 days. In 2021/22 85% of invoices by value (2020/21 92%) and 75% of invoices by volume (2020/21 91%) were paid within 10 days. The small drop in payment performance compared to the prior year, reflects a reduction in available capacity to support the purchase to pay process during the year, partly due to illness and partly the impact of wider system pressures on support', 'period from 1 April 2021 is 20.9% of pensionable pay. The employee rate applied is variable and is anticipated to provide a yield of 9.6% of pensionable pay. While a valuation was carried out as at 31 March 2016, work on the cost cap valuation was suspended by the UK Government following the decision by the Court of Appeal (McCloud (Judiciary scheme)/Sargeant (Firefighters’ Scheme) cases) that the transitional protections provided as part of the 2015 reforms unlawfully discriminated on the grounds of age. Following consultation and an announcement in February 2021 on proposals to remedy the discrimination, the UK Government confirmed that the cost control element of the 2016 valuations could be completed. The UK Government has also asked the Government Actuary to review whether, and to what extent, the cost control mechanism is meeting its original objectives. The 2020 actuarial valuations will take the report’s findings into account. The interim report is complete (restricted) and is currently being finalised with a consultation. Alongside these announcements, the UK Government confirmed that current employer contribution rates would stay in force until 1 April 2024. NHS Grampian’s level of participation in the scheme is 8% based on the proportion of employer contributions paid in 2020-21. The new NHS Pension Scheme (Scotland) 2015', 'detailed surge plan which was developed to address predicted unscheduled care activity and the impact of the new COVID-19 variants. Throughout the period of the pandemic response we have developed a number of escalation models and systems to respond to the surges in COVID-19 activity. We adapted this learning into the development of a whole system escalation response model (Grampian Operational Pressure and Escalation System – G-OPES) to manage the expected range of service pressures during the 2021/22 winter period. These adaptions included planning for increases in all unscheduled care activity as well the specific surges in COVID-19, respiratory syncytial virus (RSV) or other infectious disease. It also accounted for the staffing and resource pressures that would be required to support the delivery of critical services at the specified protected level. The Grampian Operational Pressures and Escalation system which was coproduced with the involvement of key partners such as Scottish Ambulance Service (SAS) has three main components that are supported by our already established system visualisation tools: - System Pressure Levels defined by key objective metrics - this set out a four level pressure measure for each of our operational portfolios and critical services with an overall system status. This was automated in our central reporting tool (Tableau) and the']",£2.6 million,['£2.6 million'],Q_2022_SAV_02,Grampian-2021-2022,MOD,number,[22],skipped
What proportion of the 2021/22 savings were classified as recurring?,"1.2.1 Efficiency Savings Efficiency savings of £2.2 million were achieved against a target of £2.6 million for NHS Grampian services, mainly from the successful recruitment in to medical and nursing vacancies that were previously filled usi","['1. Financial Performance and Position (cont) 1.2 Grampian Health Board performance against statutory financial targets (cont) The Core Revenue Resource Limit for 2021/22 was also adjusted to include the £0.769m surplus carried forward from 2020/21 and £1 million banked with the Scottish Government under agreed financial flexibility arrangements in 2019/20. 1.2.1 Efficiency Savings Efficiency savings of £2.2 million were achieved against a target of £2.6 million for NHS Grampian services, mainly from the successful recruitment in to medical and nursing vacancies that were previously filled using temporary agency staff in the first half of the year, the transfer of some agency staff on to a direct engagement contractual model, the increased use of biosimilar drugs and savings across a number of non-clinical areas. Recurring savings amounted to £1.0 million and non-recurring of £1.1 million. The gap of £0.4 million was covered non-recurringly by the Scottish Government through their COVID- 19 supplementary funding allocation, recognising that the focus of budget managers was not in the delivery of savings during the period of the Board being on an emergency footing. 1.2.2 Financial impact of the COVID-19 Pandemic Due to the ongoing impact of the pandemic the Board remained on an emergency footing throughout 2021/22. In considering the variations in cost of services', 'period from 1 April 2021 is 20.9% of pensionable pay. The employee rate applied is variable and is anticipated to provide a yield of 9.6% of pensionable pay. While a valuation was carried out as at 31 March 2016, work on the cost cap valuation was suspended by the UK Government following the decision by the Court of Appeal (McCloud (Judiciary scheme)/Sargeant (Firefighters’ Scheme) cases) that the transitional protections provided as part of the 2015 reforms unlawfully discriminated on the grounds of age. Following consultation and an announcement in February 2021 on proposals to remedy the discrimination, the UK Government confirmed that the cost control element of the 2016 valuations could be completed. The UK Government has also asked the Government Actuary to review whether, and to what extent, the cost control mechanism is meeting its original objectives. The 2020 actuarial valuations will take the report’s findings into account. The interim report is complete (restricted) and is currently being finalised with a consultation. Alongside these announcements, the UK Government confirmed that current employer contribution rates would stay in force until 1 April 2024. NHS Grampian’s level of participation in the scheme is 8% based on the proportion of employer contributions paid in 2020-21. The new NHS Pension Scheme (Scotland) 2015', 'the Scottish Government through their COVID- 19 supplementary funding allocation, recognising that the focus of budget managers was not in the delivery of savings during the period of the Board being on an emergency footing. 1.2.2 Financial impact of the COVID-19 Pandemic Due to the ongoing impact of the pandemic the Board remained on an emergency footing throughout 2021/22. In considering the variations in cost of services between years it’s important to recognise, therefore, the efforts to manage the COVID-19 recovery and remobilisation response required a reconfiguration in service provision across the whole system, and as in the prior year, this remained the case during 2021/22. Although additional direct costs were incurred as a result of specific initiatives such as the vaccination programme and the need for winter surge capacity many of the variations in operating costs between years reflect both the direct and indirect impact of the COVID-19 pandemic on staffing, activity and service levels and do not reflect the cost trends arising from normal operations. The Board received a specific supplementary allocation of £68.8 million during the year from the Scottish Government to cover the additional direct costs associated with the COVID-19 response and remobilisation. The main areas incurring additional costs were in additional Personal Protective equipment, vaccinations', 'are significant to the financial statements are disclosed in section 29 below. 1(a) Disclosure of new accounting standards There were no new standards, amendments and interpretations effective in 2021/22 for the first time 1(b) Standards, amendments and interpretations early adopted this year There were no new standards, amendments or interpretations early adopted this year. 1(c) Standards issued but not yet effective The following standards have been issued but are not yet effective: - IFRS 16 – Leases (IAS 17 replacement); IFRS 16 Leases supersedes IAS 17 Leases and is being applied by HM Treasury in the Government Financial Reporting Manual (FReM) from 1 April 2022. IFRS 16 introduces a single lessee accounting model that results in a more faithful representation of a lessee’s assets and liabilities, and provides enhanced disclosures to improve transparency of reporting on capital employed. Under IFRS 16, lessees are required to recognise assets and liabilities for leases with a term of more than 12 months, unless the underlying asset is of low value. While no standard definition of ‘low value’ has been mandated, NHS Scotland have elected to utilise the capitalisation threshold of £5,000 to determine the assets to be disclosed. NHS Grampian expects that its existing finance leases will continue to be classified as leases.', 'Movements on the provision for impairment of receivables are as follows: £’000 £’000 At 1 April 2,645 2,270 Provision for debtors impairment (156) 457 Receivables written off during the year as uncollectable 0 (82) At 31 March 2,489 2,645 As of 31 March 2022, receivables with a carrying value of £2.489m (2020-21: £2.645m) were impaired and provided for. The ageing of these receivables is as follows: 2021/22 2020/21 £’000 £’000 Up to 6 months past due 523 376 Over 6 months past due 1,966 2,269 The impaired value of £2.489 million (2021 £2.65 million) includes £1.06 million (2021 £1.06 million) related to NHS Injury Cost Recovery Scheme. The remaining £1.4 million (2021 £1.6 million) reflects the impairment of trade receivables calculated using an expected credit loss model in line with IFRS 9. Receivables that are less than three months past their due date are not considered impaired. As at 31 March 2022, receivables with a carrying value of £5.1 million (2020-21: £6.1 million) were past their due date but not impaired. The ageing of receivables which are past due but not impaired is as follows: 2021/22 2020/21 £’000 £’000 Up to 3 months past due 3,170 4,620 3 to 6 months past due 860 638 Over 6 months past due']",£1.0 million,['£1.0 million'],Q_2022_SAV_03,Grampian-2021-2022,MOD,number,[22],skipped
How much of the 2021/22 efficiency savings were non-recurring?,1,"['1. Financial Performance and Position (cont) 1.2 Grampian Health Board performance against statutory financial targets (cont) The Core Revenue Resource Limit for 2021/22 was also adjusted to include the £0.769m surplus carried forward from 2020/21 and £1 million banked with the Scottish Government under agreed financial flexibility arrangements in 2019/20. 1.2.1 Efficiency Savings Efficiency savings of £2.2 million were achieved against a target of £2.6 million for NHS Grampian services, mainly from the successful recruitment in to medical and nursing vacancies that were previously filled using temporary agency staff in the first half of the year, the transfer of some agency staff on to a direct engagement contractual model, the increased use of biosimilar drugs and savings across a number of non-clinical areas. Recurring savings amounted to £1.0 million and non-recurring of £1.1 million. The gap of £0.4 million was covered non-recurringly by the Scottish Government through their COVID- 19 supplementary funding allocation, recognising that the focus of budget managers was not in the delivery of savings during the period of the Board being on an emergency footing. 1.2.2 Financial impact of the COVID-19 Pandemic Due to the ongoing impact of the pandemic the Board remained on an emergency footing throughout 2021/22. In considering the variations in cost of services', 'the Scottish Government through their COVID- 19 supplementary funding allocation, recognising that the focus of budget managers was not in the delivery of savings during the period of the Board being on an emergency footing. 1.2.2 Financial impact of the COVID-19 Pandemic Due to the ongoing impact of the pandemic the Board remained on an emergency footing throughout 2021/22. In considering the variations in cost of services between years it’s important to recognise, therefore, the efforts to manage the COVID-19 recovery and remobilisation response required a reconfiguration in service provision across the whole system, and as in the prior year, this remained the case during 2021/22. Although additional direct costs were incurred as a result of specific initiatives such as the vaccination programme and the need for winter surge capacity many of the variations in operating costs between years reflect both the direct and indirect impact of the COVID-19 pandemic on staffing, activity and service levels and do not reflect the cost trends arising from normal operations. The Board received a specific supplementary allocation of £68.8 million during the year from the Scottish Government to cover the additional direct costs associated with the COVID-19 response and remobilisation. The main areas incurring additional costs were in additional Personal Protective equipment, vaccinations', 'member of an IJB that required disclosure in the accounts under IAS 24. 9. Disclosure of Information to Auditor The directors who held office at the date of approval of this Directors’ Report confirm that, so far as they are each aware, there is no relevant audit information of which the Board’s auditor is unaware; and each director has taken all the steps that he/she ought reasonably to have taken as a director to make himself/herself aware of any relevant audit information and to establish that the Board’s auditor is aware of that information. 10. Remuneration for Non-Audit Work Audit Scotland, the Board’s external auditor, received no fees for non-audit work during 2021/22 (2020/21 £0). PricewaterhouseCoopers LLP who provide an Internal Audit Service to NHS Grampian received no fees for non-audit work during 2021/22 (2020/21 £0). 11. Public Services Reform (Scotland) Act 2010 Sections 31 and 32 of the Public Services Reform (Scotland) Act 2010 impose duties on NHS Grampian to publish information on expenditure, economic sustainability and efficiency as soon as is reasonably practicable after the end of each financial year. The information required to comply with these disclosure requirements is not an integral part of the Annual Accounts and is displayed on the NHS Grampian website at the', '5. Risk and Uncertainty During 2021/22 the Board and the NHS more widely faced the unprecedented challenge of continuing to respond to COVID-19, to roll out the largest scale mass vaccination programme in a generation and to provide access to a full range of services, within the capacity available. The challenge for the Board was to manage our risks in a way that ensured the continued delivery of critical and protected clinical services and fulfilled the key operational objectives set out above and reflected in our remobilisation plan. As required by the Scottish Government, the Board developed two further remobilisation plans – Remobilisation Plan (v3) and (v4) which were approved at respective Board meetings in June 2021 and December 2021. These plans were developed following consultation and engagement with clinical services, staff, Integration Joint Boards and other key partners as part of a whole system response. Both remobilisation plans set out an assessment of the key priorities, challenges and risks facing NHS Grampian and how these will be mitigated. Moving forward the Board will continue to build on the relationships we have with key partners to embed the many transformational changes and initiatives introduced to our core services as part of our COVID-19 response and remobilisation efforts. The Integration Joint', '8. Expenditure on consultancy Expenditure on external consultancy during 2021/22 was £24,636 (2020/21 £7,835). NHS Grampian has used a total of 2 consultancy organisations during 2021/22 (2 in 2020/21). External consultants are used to provide services in a number of areas including capital projects, construction and building infrastructure development, IT system implementation, property matters and infection control issues. Consultancy services are used for the provision of specialist expertise which is not available from NHS Grampian’s own staff and therefore represent a value for money alternative to the direct employment of specialist staff. 9. Off-payroll engagements The use of locum agency medical and nursing staff throughout the year is disclosed in section 2 above. All other staff engaged by NHS Grampian to provide services during the year for a period of longer than six months were remunerated through either NHS Grampian’s payroll or where those staff were seconded from a partner organisation e.g. a university or a local authority, they were remunerated through the payroll of that partner organisation. All Board members deemed to have significant financial responsibility during the year were remunerated through NHS Grampian’s payroll. 10. Exit packages There were no exit packages agreed during the year. There were no compulsory redundancies. 2021/22 2020/21 Exit Package cost band Total']",£1.1 million,['£1.1 million'],Q_2022_SAV_04,Grampian-2021-2022,LEX,number,[22],skipped
How was the savings delivery gap of £0.4 million covered in 2021/22?,1,"['1. Financial Performance and Position (cont) 1.2 Grampian Health Board performance against statutory financial targets (cont) The Core Revenue Resource Limit for 2021/22 was also adjusted to include the £0.769m surplus carried forward from 2020/21 and £1 million banked with the Scottish Government under agreed financial flexibility arrangements in 2019/20. 1.2.1 Efficiency Savings Efficiency savings of £2.2 million were achieved against a target of £2.6 million for NHS Grampian services, mainly from the successful recruitment in to medical and nursing vacancies that were previously filled using temporary agency staff in the first half of the year, the transfer of some agency staff on to a direct engagement contractual model, the increased use of biosimilar drugs and savings across a number of non-clinical areas. Recurring savings amounted to £1.0 million and non-recurring of £1.1 million. The gap of £0.4 million was covered non-recurringly by the Scottish Government through their COVID- 19 supplementary funding allocation, recognising that the focus of budget managers was not in the delivery of savings during the period of the Board being on an emergency footing. 1.2.2 Financial impact of the COVID-19 Pandemic Due to the ongoing impact of the pandemic the Board remained on an emergency footing throughout 2021/22. In considering the variations in cost of services', 'the Scottish Government through their COVID- 19 supplementary funding allocation, recognising that the focus of budget managers was not in the delivery of savings during the period of the Board being on an emergency footing. 1.2.2 Financial impact of the COVID-19 Pandemic Due to the ongoing impact of the pandemic the Board remained on an emergency footing throughout 2021/22. In considering the variations in cost of services between years it’s important to recognise, therefore, the efforts to manage the COVID-19 recovery and remobilisation response required a reconfiguration in service provision across the whole system, and as in the prior year, this remained the case during 2021/22. Although additional direct costs were incurred as a result of specific initiatives such as the vaccination programme and the need for winter surge capacity many of the variations in operating costs between years reflect both the direct and indirect impact of the COVID-19 pandemic on staffing, activity and service levels and do not reflect the cost trends arising from normal operations. The Board received a specific supplementary allocation of £68.8 million during the year from the Scottish Government to cover the additional direct costs associated with the COVID-19 response and remobilisation. The main areas incurring additional costs were in additional Personal Protective equipment, vaccinations', 'The IJB’s have agreed that any amounts from this allocation that were not utilised in 2021/22 will be carried forward and used to support system wide COVID-19 recovery and remobilisation efforts for this purpose in 2022/23. 1.2.3 Expenditure Analysis Net expenditure for the year was £1,453 million (2020/21 £1,375 million), an increase of £78 million over the prior year. The Consolidated Statement of Comprehensive Net Expenditure can be found on page 87, a more detailed analysis of Expenditure in note 3 on page 115 and a more detailed analysis of income in note 4 on page 116.', 'whole system response. Both remobilisation plans set out an assessment of the key priorities, challenges and risks facing NHS Grampian and how these will be mitigated. Moving forward the Board will continue to build on the relationships we have with key partners to embed the many transformational changes and initiatives introduced to our core services as part of our COVID-19 response and remobilisation efforts. The Integration Joint Boards (IJBs) in particular, provide a focus for effective engagement and delivery of our clinical strategy through a sustainable shift in the balance of care to community-based services. The risk plan submitted in the most recent remobilisation plan (December 2021) is set out on pages 8 to 10 below. The ongoing review and development of the Board’s strategic Risk Register is a dynamic process subject to ongoing review and development and the most recent version supporting NHS Grampian’s new Strategy – Plan for the Future 2022-2028 was approved by the Board on 2 June 2022. This can be accessed at the following link https://www.nhsgrampian.org/about-us/planforthefuture/how-we-will-do-it/who-will-support-our- journey/strategic_risk/ The Board’s risk management processes are covered in more detail in the Governance Statement on pages 57 to 60. NHS Grampian Risk Plan included with RMP4 Title Risk Mitigating action The NHS Grampian Vaccinations Because there is a', '1. Financial Performance and Position (cont) 1.2 Grampian Health Board performance against statutory financial targets (cont) 1.2.7 Infrastructure and Non-Current Assets The Board delivered a programme of infrastructure investment totalling £78.914 million during 2021/22. This overall programme was resourced using a combination of capital funding from the SGHSCD (£64.166 million, see note 7d), income from donations (£0.687 million), financial transactions funding from the Scottish Government for a GP sustainability Loan (£0.315 million) , various revenue funding sources (£12.577 million) and net proceeds from asset disposals (£1.169 million). Major investments during the year include: - Ongoing construction costs of the Baird Family Hospital and Anchor Centre (£42.5 million). - Ongoing design and development costs in support of the National Treatment Centre– Grampian (£0.5m). - £10.4m on Backlog Maintenance and Compliance with Statutory Standards. Including: o £3.5m to complete the Ligature Reduction programme at Royal Cornhill Hospital; o £1.3m to complete the upgrade of ward 7 at Dr Grays Hospital; o £0.1m to complete improvements to the Birthing Unit at Dr Grays Hospital; o £0.7m to complete the programme of COVID-19 related improvements to primary care premises ; o £1m on carbon reduction and greenspace initiatives; and o £3.8 m on other backlog maintenance and statutory compliance schemes across a range of']",Covered non-recurringly by the Scottish Government through COVID-19 supplementary funding,['Covered non-recurringly by the Scottish Government through COVID-19 supplementary funding'],Q_2022_SAV_P1,Grampian-2021-2022,MOD,text,[22],skipped
What was the overall financial outcome for Aberdeen City's integrated health and social care partnership in 2021/22?,5,"['A new operating model aimed at strengthening integration between hospital and community based services was introduced in shadow form in April 2021 and subsequently endorsed by the Board in August 2021. Services are delivered based on a portfolio management structure covering Family services, Surgical and Clinical Support Services, Medical and Unscheduled Care, Mental Health and wellbeing, Public Health and services in Moray. The portfolio arrangements also include, a range of Primary and Community Care services delegated to the three Integration Joint Boards (IJBs) covering Aberdeen City, Aberdeenshire and Moray. All our direct clinical services are supported by corporate functions such as Facilities, E- Health, Finance and Human Resources. The IJBs are legally constituted cross-sector bodies providing a focus for NHS Grampian to work in partnership with other agencies, including Local Authorities and Primary Healthcare contractors, in the provision of integrated services to the local communities. Executive Director and Non-Executive members of the NHS Grampian Board are members of the Integration Joint Boards which provide the strategic direction for the integration of adult health and social care.', 'experience of their local NHS system; f) promote integrated health and community planning by working closely with other local organisations; and g) provide a single focus of accountability for the performance of the local NHS system. All Board members are also trustees of the NHS Grampian Endowment Funds, a registered charity established by the NHS (Scotland) Act 1978 and subject to the legal framework of the Charities and Trustee Investment (Scotland) Act 2005. The charitable purpose of NHS Grampian Endowment Funds is to enhance healthcare and patient welfare in Grampian, through: a) improvement of the physical and mental health of the Grampian Health Board’s population and our staff; b) prevention, diagnosis and treatment of illness; c) provision of services and facilities in connection with the above; and d) research into any matters relating to the causation, prevention, diagnosis or treatment of illness, or any other matters relating to the health service as the trustees see fit. Under the terms of the Public Bodies (Joint Working) (Scotland) Act 2014, three Integration Joint Boards (IJBs), Moray, Aberdeen City and Aberdeenshire, are established in Grampian with full delegation of functions and resources to enable integration of primary and community health and social care services. Executive and Non-Executive members of Grampian Health Board are', ""Financial table on page 90 (Property) Contains 40 line items across 10 columns. Key items: NHS | Endowment | IntraGroup | Aberdeen; Grampian | Funds | Adjustments | City; 2021/22 | 2021/22 | 2021/22 | 2021/22; £’000 | £’000 | £'000 | £'000.\n\nTable (header-injected facts):\n\n- Property,plantandequipment > 1 : 7c\n- Property,plantandequipment > 2 2021/22 NHS Grampian : 652,356\n- Property,plantandequipment > 3 Charitable Endowment 2021/22 Funds £’000 : 0\n- Property,plantandequipment > 4 IntraGroup Adjustments 2021/22 £’000 : 0\n- Property,plantandequipment > 5 2021/22 Aberdeen City £'000 : 0\n- Property,plantandequipment > 6 Aberdeenshire 2021/22 £'000 : 0\n- Property,plantandequipment > 7 2021/22 Moray £'000 : 0\n- Property,plantandequipment > 8 2021/22 Group £’000 : 652,356\n- Property,plantandequipment > 9 2020/21 Group £’000 : 585,027\n- Intangibleassets > 1 : 6\n- Intangibleassets > 2 2021/22 NHS Grampian : 2,212\n- Intangibleassets > 3 Charitable Endowment 2021/22 Funds £’000 : 0\n- Intangibleassets > 4 IntraGroup Adjustments 2021/22 £’000 : 0\n- Intangibleassets > 5 2021/22 Aberdeen City £'000 : 0\n- Intangibleassets > 6 Aberdeenshire 2021/22 £'000 : 0\n- Intangibleassets > 7 2021/22 Moray £'000 : 0\n- Intangibleassets > 8 2021/22 Group £’000 : 2,212\n- Intangibleassets > 9 2020/21 Group £’000 : 2,470\n- Financialassets > 1 : 10\n- Financialassets > 2 2021/22 NHS Grampian : 862\n- Financialassets > 3 Charitable Endowment 2021/22 Funds £’000 : 53,220\n- Financialassets > 4 IntraGroup Adjustments 2021/22 £’000 : 0\n- Financialassets > 5 2021/22 Aberdeen City £'000 : 0\n- Financialassets > 6 Aberdeenshire 2021/22 £'000 : 0\n- Financialassets > 7 2021/22 Moray £'000 : 0\n- Financialassets > 8 2021/22 Group £’000 : 54,082\n- Financialassets > 9 2020/21 Group £’000 : 50,797\n- Investmentsinjointventures > 2 2021/22 NHS Grampian : 0\n- Investmentsinjointventures > 3 Charitable Endowment 2021/22 Funds £’000 : 0\n- Investmentsinjointventures > 4 IntraGroup Adjustments 2021/22 £’000 : 0\n- Investmentsinjointventures > 5 2021/22 Aberdeen City £'000 : 25,696\n- Investmentsinjointventures > 6 Aberdeenshire 2021/22 £'000 : 24,532\n- Investmentsinjointventures > 7 2021/22 Moray £'000 : 8,511\n- Investmentsinjointventures > 8 2021/22 Group £’000 : 58,739\n- Investmentsinjointventures > 9 2020/21 Group £’000 : 22,573\n- Tradeandotherreceivables > 1 : 9\n- Tradeandotherreceivables > 2 2021/22 NHS Grampian : 62,938\n- Tradeandotherreceivables > 3 Charitable Endowment 2021/22 Funds £’000 : 0\n- Tradeandotherreceivables > 4 IntraGroup Adjustments 2021/22 £’000 : 0\n- Tradeandotherreceivables > 5 2021/22 Aberdeen City £'000 : 0\n- Tradeandotherreceivables > 6 Aberdeenshire 2021/22 £'000 : 0\n- Tradeandotherreceivables > 7 2021/22 Moray £'000 : 0\n- Tradeandotherreceivables > 8 2021/22 Group £’000 : 62,938\n- Tradeandotherreceivables > 9 2020/21 Group £’000 : 50,737\n- Totalnon-currentassets > 2 2021/22 NHS Grampian : 718,368\n- Totalnon-currentassets > 3 Charitable Endowment 2021/22 Funds £’000 : 53,220\n- Totalnon-currentassets > 4 IntraGroup Adjustments 2021/22 £’000 : 0\n- Totalnon-currentassets > 5 2021/22 Aberdeen City £'000 : 25,696\n- Totalnon-currentassets > 6 Aberdeenshire 2021/22 £'000 : 24,532\n- Totalnon-currentassets > 7 2021/22 Moray £'000 : 8,511\n- Totalnon-currentassets > 8 2021/22 Group £’000 : 830,327\n- Totalnon-currentassets > 9 2020/21 Group £’000 : 711,604\n- Inventories > 1 : 8\n- Inventories > 2 2021/22 NHS Grampian : 7,590\n- Inventories > 3 Charitable Endowment 2021/22 Funds £’000 : 0\n- Inventories > 4 IntraGroup Adjustments 2021/22 £’000 : 0\n- Inventories > 5 2021/22 Aberdeen City £'000 : 0\n- Inventories > 6 Aberdeenshire 2021/22 £'000 : 0\n- Inventories > 7 2021/22 Moray £'000 : 0\n- Inventories > 8 2021/22 Group £’000 : 7,590\n- Inventories > 9 2020/21 Group £’000 : 6,664\n- Tradeandotherreceivables > 1 : 9\n- Tradeandotherreceivables > 2 2021/22 NHS Grampian : 81,227\n- Tradeandotherreceivables > 3 Charitable Endowment 2021/22 Funds £’000 : 126\n- Tradeandotherreceivables > 4 IntraGroup Adjustments 2021/22 £’000 : (734)\n- Tradeandotherreceivables > 5 2021/22 Aberdeen City £'000 : 0\n- Tradeandotherreceivables > 6 Aberdeenshire 2021/22 £'000 : 0\n- Tradeandotherreceivables > 7 2021/22 Moray £'000 : 0\n- Tradeandotherreceivables > 8 2021/22 Group £’000 : 80,619\n- Tradeandotherreceivables > 9 2020/21 Group £’000 : 84,627\n- Cashandcashequivalents > 1 : 11\n- Cashandcashequivalents > 2 2021/22 NHS Grampian : 8,198\n- Cashandcashequivalents > 3 Charitable Endowment 2021/22 Funds £’000 : 1,979\n- Cashandcashequivalents > 4 IntraGroup Adjustments 2021/22 £’000 : 0\n- Cashandcashequivalents > 5 2021/22 Aberdeen City £'000 : 0\n- Cashandcashequivalents > 6 Aberdeenshire 2021/22 £'000 : 0\n- Cashandcashequivalents > 7 2021/22 Moray £'000 : 0\n- Cashandcashequivalents > 8 2021/22 Group £’000 : 10,177\n- Cashandcashequivalents > 9 2020/21 Group £’000 : 2,551\n- Assetsclassifiedasheldforsale > 1 : 7b\n- Assetsclassifiedasheldforsale > 2 2021/22 NHS Grampian : 0\n- Assetsclassifiedasheldforsale > 3 Charitable Endowment 2021/22 Funds £’000 : 0\n- Assetsclassifiedasheldforsale > 4 IntraGroup Adjustments 2021/22 £’000 : 0\n- Assetsclassifiedasheldforsale > 5 2021/22 Aberdeen City £'000 : 0\n- Assetsclassifiedasheldforsale > 6 Aberdeenshire 2021/22 £'000 : 0\n- Assetsclassifiedasheldforsale > 7 2021/22 Moray £'000 : 0\n- Assetsclassifiedasheldforsale > 8 2021/22 Group £’000 : 0\n- Assetsclassifiedasheldforsale > 9 2020/21 Group £’000 : 977\n- Totalcurrentassets > 2 2021/22 NHS Grampian : 97,015\n- Totalcurrentassets > 3 Charitable Endowment 2021/22 Funds £’000 : 2,105\n- Totalcurrentassets > 4 IntraGroup Adjustments 2021/22 £’000 : (734)\n- Totalcurrentassets > 5 2021/22 Aberdeen City £'000 : 0\n- Totalcurrentassets > 6 Aberdeenshire 2021/22 £'000 : 0\n- Totalcurrentassets > 7 2021/22 Moray £'000 : 0\n- Totalcurrentassets > 8 2021/22 Group £’000 : 98,386\n- Totalcurrentassets > 9 2020/21 Group £’000 : 94,819\n- Totalassets > 2 2021/22 NHS Grampian : 815,383\n- Totalassets > 3 Charitable Endowment 2021/22 Funds £’000 : 55,325\n- Totalassets > 4 IntraGroup Adjustments 2021/22 £’000 : (734)\n- Totalassets > 5 2021/22 Aberdeen City £'000 : 25,696\n- Totalassets > 6 Aberdeenshire 2021/22 £'000 : 24,532\n- Totalassets > 7 2021/22 Moray £'000 : 8,511\n- Totalassets > 8 2021/22 Group £’000 : 928,713\n- Totalassets > 9 2020/21 Group £’000 : 806,423\n- Provisions > 1 : 13\n- Provisions > 2 2021/22 NHS Grampian : (60,477)\n- Provisions > 3 Charitable Endowment 2021/22 Funds £’000 : (4,194)\n- Provisions > 4 IntraGroup Adjustments 2021/22 £’000 : 0\n- Provisions > 5 2021/22 Aberdeen City £'000 : 0\n- Provisions > 6 Aberdeenshire 2021/22 £'000 : 0\n- Provisions > 7 2021/22 Moray £'000 : 0\n- Provisions > 8 2021/22 Group £’000 : (64,671)\n- Provisions > 9 2020/21 Group £’000 : (66,830)\n- Tradeandotherpayables > 1 : 12\n- Tradeandotherpayables > 2 2021/22 NHS Grampian : (251,054)\n- Tradeandotherpayables > 3 Charitable Endowment 2021/22 Funds £’000 : (1,002)\n- Tradeandotherpayables > 4 IntraGroup Adjustments 2021/22 £’000 : 734\n- Tradeandotherpayables > 5 2021/22 Aberdeen City £'000 : 0\n- Tradeandotherpayables > 6 Aberdeenshire 2021/22 £'000 : 0\n- Tradeandotherpayables > 7 2021/22 Moray £'000 : 0\n- Tradeandotherpayables > 8 2021/22 Group £’000 : (251,322)\n- Tradeandotherpayables > 9 2020/21 Group £’000 : (181,453)\n- Totalcurrentliabilities > 2 2021/22 NHS Grampian : (311,531)\n- Totalcurrentliabilities > 3 Charitable Endowment 2021/22 Funds £’000 : (5,196)\n- Totalcurrentliabilities > 4 IntraGroup Adjustments 2021/22 £’000 : 734\n- Totalcurrentliabilities > 5 2021/22 Aberdeen City £'000 : 0\n- Totalcurrentliabilities > 6 Aberdeenshire 2021/22 £'000 : 0\n- Totalcurrentliabilities > 7 2021/22 Moray £'000 : 0\n- Totalcurrentliabilities > 8 2021/22 Group £’000 : (315,993)\n- Totalcurrentliabilities > 9 2020/21 Group £’000 : (248,283)\n- Non-currentassets(less)netcurrentliabilities > 2 2021/22 NHS Grampian : 503,852\n- Non-currentassets(less)netcurrentliabilities > 3 Charitable Endowment 2021/22 Funds £’000 : 50,129\n- Non-currentassets(less)netcurrentliabilities > 4 IntraGroup Adjustments 2021/22 £’000 : 0\n- Non-currentassets(less)netcurrentliabilities > 5 2021/22 Aberdeen City £'000 : 25,696\n- Non-currentassets(less)netcurrentliabilities > 6 Aberdeenshire 2021/22 £'000 : 24,532\n- Non-currentassets(less)netcurrentliabilities > 7 2021/22 Moray £'000 : 8,511\n- Non-currentassets(less)netcurrentliabilities > 8 2021/22 Group £’000 : 612,720\n- Non-currentassets(less)netcurrentliabilities > 9 2020/21 Group £’000 : 558,140\n- Provisions > 1 : 13\n- Provisions > 2 2021/22 NHS Grampian : (110,138)\n- Provisions > 3 Charitable Endowment 2021/22 Funds £’000 : (821)\n- Provisions > 4 IntraGroup Adjustments 2021/22 £’000 : 0\n- Provisions > 5 2021/22 Aberdeen City £'000 : 0\n- Provisions > 6 Aberdeenshire 2021/22 £'000 : 0\n- Provisions > 7 2021/22 Moray £'000 : 0\n- Provisions > 8 2021/22 Group £’000 : (110,959)\n- Provisions > 9 2020/21 Group £’000 : (98,031)\n- Column headers: Row label > 1 : 1\n- Column headers: Row label > 2 2021/22 NHS Grampian : 2 2021/22 NHS Grampian\n- Column headers: Row label > 3 Charitable Endowment 2021/22 Funds £’000 : 3 Charitable Endowment 2021/22 Funds £’000\n- Column headers: Row label > 4 IntraGroup Adjustments 2021/22 £’000 : 4 IntraGroup Adjustments 2021/22 £’000\n- Column headers: Row label > 5 2021/22 Aberdeen City £'000 : 5 2021/22 Aberdeen City £'000\n- Column headers: Row label > 6 Aberdeenshire 2021/22 £'000 : 6 Aberdeenshire 2021/22 £'000\n- Column headers: Row label > 7 2021/22 Moray £'000 : 7 2021/22 Moray £'000\n- Column headers: Row label > 8 2021/22 Group £’000 : 8 2021/22 Group £’000\n- Column headers: Row label > 9 2020/21 Group £’000 : 9 2020/21 Group £’000\n\nTable (markdown):\n\n| 0 | 1 | 2 | 3 | 4 | 5 | 6 | 7 | 8 | 9 |\n| --- | --- | --- | --- | --- | --- | --- | --- | --- | --- |\n|  |  |  | Charitable |  |  |  |  |  |  |\n|  |  | NHS | Endowment | IntraGroup | Aberdeen |  |  |  |  |\n|  |  | Grampian | Funds | Adjustments | City | Aberdeenshire | Moray | Group | Group |\n|  |  | 2021/22 | 2021/22 | 2021/22 | 2021/22 | 2021/22 | 2021/22 | 2021/22 | 2020/21 |\n|  |  |  | £’000 | £’000 | £'000 | £'000 | £'000 | £’000 | £’000 |\n| Non-currentassets: |  |  |  |  |  |  |  |  |  |\n| Property,plantandequipment | 7c | 652,356 | 0 | 0 | 0 | 0 | 0 | 652,356 | 585,027 |\n| Intangibleassets | 6 | 2,212 | 0 | 0 | 0 | 0 | 0 | 2,212 | 2,470 |\n| Financialassets: |  |  |  |  |  |  |  |  |  |\n| Financialassets | 10 | 862 | 53,220 | 0 | 0 | 0 | 0 | 54,082 | 50,797 |\n| Investmentsinjointventures |  | 0 | 0 | 0 | 25,696 | 24,532 | 8,511 | 58,739 | 22,573 |\n| Tradeandotherreceivables | 9 | 62,938 | 0 | 0 | 0 | 0 | 0 | 62,938 | 50,737 |\n| Totalnon-currentassets |  | 718,368 | 53,220 | 0 | 25,696 | 24,532 | 8,511 | 830,327 | 711,604 |\n| CurrentAssets: |  |  |  |  |  |  |  |  |  |\n| Inventories | 8 | 7,590 | 0 | 0 | 0 | 0 | 0 | 7,590 | 6,664 |\n| Financialassets: |  |  |  |  |  |  |  |  |  |\n| Tradeandotherreceivables | 9 | 81,227 | 126 | (734) | 0 | 0 | 0 | 80,619 | 84,627 |\n| Cashandcashequivalents | 11 | 8,198 | 1,979 | 0 | 0 | 0 | 0 | 10,177 | 2,551 |\n| Assetsclassifiedasheldforsale | 7b | 0 | 0 | 0 | 0 | 0 | 0 | 0 | 977 |\n| Totalcurrentassets |  | 97,015 | 2,105 | (734) | 0 | 0 | 0 | 98,386 | 94,819 |\n| Totalassets |  | 815,383 | 55,325 | (734) | 25,696 | 24,532 | 8,511 | 928,713 | 806,423 |\n| Currentliabilities |  |  |  |  |  |  |  |  |  |\n| Provisions | 13 | (60,477) | (4,194) | 0 | 0 | 0 | 0 | (64,671) | (66,830) |\n| Financialliabilities: |  |  |  |  |  |  |  |  |  |\n| Tradeandotherpayables | 12 | (251,054) | (1,002) | 734 | 0 | 0 | 0 | (251,322) | (181,453) |\n| Totalcurrentliabilities |  | (311,531) | (5,196) | 734 | 0 | 0 | 0 | (315,993) | (248,283) |\n| Non-currentassets(less)netcurrentliabilities |  | 503,852 | 50,129 | 0 | 25,696 | 24,532 | 8,511 | 612,720 | 558,140 |\n| Non-currentliabilities |  |  |  |  |  |  |  |  |  |\n| Provisions | 13 | (110,138) | (821) | 0 | 0 | 0 | 0 | (110,959) | (98,031) |\n| Financialliabilities: |  |  |  |  |  |  |  |  |  |\nColumn headers: Row label | 1 | 2 2021/22 NHS Grampian | 3 Charitable Endowment 2021/22 Funds £’000 | 4 IntraGroup Adjustments 2021/22 £’000 | 5 2021/22 Aberdeen City £'000 | 6 Aberdeenshire 2021/22 £'000 | 7 2021/22 Moray £'000 | 8 2021/22 Group £’000 | 9 2020/21 Group £’000\nRow map:\n- Property,plantandequipment -> col_1=7c ; col_2=652,356 ; col_3=0 ; col_4=0 ; col_5=0 ; col_6=0 ; col_7=0 ; col_8=652,356 ; col_9=585,027\n- Intangibleassets -> col_1=6 ; col_2=2,212 ; col_3=0 ; col_4=0 ; col_5=0 ; col_6=0 ; col_7=0 ; col_8=2,212 ; col_9=2,470\n- Financialassets -> col_1=10 ; col_2=862 ; col_3=53,220 ; col_4=0 ; col_5=0 ; col_6=0 ; col_7=0 ; col_8=54,082 ; col_9=50,797\n- Investmentsinjointventures -> col_2=0 ; col_3=0 ; col_4=0 ; col_5=25,696 ; col_6=24,532 ; col_7=8,511 ; col_8=58,739 ; col_9=22,573\n- Tradeandotherreceivables -> col_1=9 ; col_2=62,938 ; col_3=0 ; col_4=0 ; col_5=0 ; col_6=0 ; col_7=0 ; col_8=62,938 ; col_9=50,737\n- Totalnon-currentassets -> col_2=718,368 ; col_3=53,220 ; col_4=0 ; col_5=25,696 ; col_6=24,532 ; col_7=8,511 ; col_8=830,327 ; col_9=711,604\n- Inventories -> col_1=8 ; col_2=7,590 ; col_3=0 ; col_4=0 ; col_5=0 ; col_6=0 ; col_7=0 ; col_8=7,590 ; col_9=6,664\n- Tradeandotherreceivables -> col_1=9 ; col_2=81,227 ; col_3=126 ; col_4=(734) ; col_5=0 ; col_6=0 ; col_7=0 ; col_8=80,619 ; col_9=84,627\n- Cashandcashequivalents -> col_1=11 ; col_2=8,198 ; col_3=1,979 ; col_4=0 ; col_5=0 ; col_6=0 ; col_7=0 ; col_8=10,177 ; col_9=2,551\n- Assetsclassifiedasheldforsale -> col_1=7b ; col_2=0 ; col_3=0 ; col_4=0 ; col_5=0 ; col_6=0 ; col_7=0 ; col_8=0 ; col_9=977\n- Totalcurrentassets -> col_2=97,015 ; col_3=2,105 ; col_4=(734) ; col_5=0 ; col_6=0 ; col_7=0 ; col_8=98,386 ; col_9=94,819\n- Totalassets -> col_2=815,383 ; col_3=55,325 ; col_4=(734) ; col_5=25,696 ; col_6=24,532 ; col_7=8,511 ; col_8=928,713 ; col_9=806,423\n- Provisions -> col_1=13 ; col_2=(60,477) ; col_3=(4,194) ; col_4=0 ; col_5=0 ; col_6=0 ; col_7=0 ; col_8=(64,671) ; col_9=(66,830)\n- Tradeandotherpayables -> col_1=12 ; col_2=(251,054) ; col_3=(1,002) ; col_4=734 ; col_5=0 ; col_6=0 ; col_7=0 ; col_8=(251,322) ; col_9=(181,453)\n- Totalcurrentliabilities -> col_2=(311,531) ; col_3=(5,196) ; col_4=734 ; col_5=0 ; col_6=0 ; col_7=0 ; col_8=(315,993) ; col_9=(248,283)\n- Non-currentassets(less)netcurrentliabilities -> col_2=503,852 ; col_3=50,129 ; col_4=0 ; col_5=25,696 ; col_6=24,532 ; col_7=8,511 ; col_8=612,720 ; col_9=558,140\n- Provisions -> col_1=13 ; col_2=(110,138) ; col_3=(821) ; col_4=0 ; col_5=0 ; col_6=0 ; col_7=0 ; col_8=(110,959) ; col_9=(98,031)"", ""Financial table on page 88 (Income Statement) Contains 18 line items across 9 columns. Key items: NHS | Endowment | IntraGroup | Aberdeen; Grampian | Funds | Adjustments | City; 2021/22 | 2021/22 | 2021/22 | 2021/22; £’000 | £’000 | £’000 | £'000.\n\nTable (header-injected facts):\n\n- 3aStaffCosts > 1 2021/22 NHS Grampian £’000 : 849,820\n- 3aStaffCosts > 2 Charitable Endowment 2021/22 Funds £’000 : 0\n- 3aStaffCosts > 3 IntraGroup Adjustments 2021/22 £’000 : 0\n- 3aStaffCosts > 4 2021/22 Aberdeen City £'000 : 0\n- 3aStaffCosts > 5 Aberdeenshire 2021/22 £'000 : 0\n- 3aStaffCosts > 6 2021/22 Moray £'000 : 0\n- 3aStaffCosts > 7 2021/22 Group £’000 : 849,820\n- 3aStaffCosts > 8 2020/21 Group £’000 : 803,300\n- IndependentPrimaryCareServices > 1 2021/22 NHS Grampian £’000 : 166,179\n- IndependentPrimaryCareServices > 2 Charitable Endowment 2021/22 Funds £’000 : 0\n- IndependentPrimaryCareServices > 3 IntraGroup Adjustments 2021/22 £’000 : 0\n- IndependentPrimaryCareServices > 4 2021/22 Aberdeen City £'000 : 0\n- IndependentPrimaryCareServices > 5 Aberdeenshire 2021/22 £'000 : 0\n- IndependentPrimaryCareServices > 6 2021/22 Moray £'000 : 0\n- IndependentPrimaryCareServices > 7 2021/22 Group £’000 : 166,179\n- IndependentPrimaryCareServices > 8 2020/21 Group £’000 : 165,461\n- DrugsandMedicalSupplies > 1 2021/22 NHS Grampian £’000 : 257,501\n- DrugsandMedicalSupplies > 2 Charitable Endowment 2021/22 Funds £’000 : 0\n- DrugsandMedicalSupplies > 3 IntraGroup Adjustments 2021/22 £’000 : 0\n- DrugsandMedicalSupplies > 4 2021/22 Aberdeen City £'000 : 0\n- DrugsandMedicalSupplies > 5 Aberdeenshire 2021/22 £'000 : 0\n- DrugsandMedicalSupplies > 6 2021/22 Moray £'000 : 0\n- DrugsandMedicalSupplies > 7 2021/22 Group £’000 : 257,501\n- DrugsandMedicalSupplies > 8 2020/21 Group £’000 : 241,508\n- OtherHealthCareexpenditure > 1 2021/22 NHS Grampian £’000 : 999,132\n- OtherHealthCareexpenditure > 2 Charitable Endowment 2021/22 Funds £’000 : 2,249\n- OtherHealthCareexpenditure > 3 IntraGroup Adjustments 2021/22 £’000 : (2,110)\n- OtherHealthCareexpenditure > 4 2021/22 Aberdeen City £'000 : 0\n- OtherHealthCareexpenditure > 5 Aberdeenshire 2021/22 £'000 : 0\n- OtherHealthCareexpenditure > 6 2021/22 Moray £'000 : 0\n- OtherHealthCareexpenditure > 7 2021/22 Group £’000 : 999,271\n- OtherHealthCareexpenditure > 8 2020/21 Group £’000 : 934,031\n- Grossexpenditurefortheyear > 1 2021/22 NHS Grampian £’000 : 2,272,632\n- Grossexpenditurefortheyear > 2 Charitable Endowment 2021/22 Funds £’000 : 2,249\n- Grossexpenditurefortheyear > 3 IntraGroup Adjustments 2021/22 £’000 : (2,110)\n- Grossexpenditurefortheyear > 4 2021/22 Aberdeen City £'000 : 0\n- Grossexpenditurefortheyear > 5 Aberdeenshire 2021/22 £'000 : 0\n- Grossexpenditurefortheyear > 6 2021/22 Moray £'000 : 0\n- Grossexpenditurefortheyear > 7 2021/22 Group £’000 : 2,272,771\n- Grossexpenditurefortheyear > 8 2020/21 Group £’000 : 2,144,300\n- Less:OperatingIncome4 > 1 2021/22 NHS Grampian £’000 : (819,893)\n- Less:OperatingIncome4 > 2 Charitable Endowment 2021/22 Funds £’000 : (3,052)\n- Less:OperatingIncome4 > 3 IntraGroup Adjustments 2021/22 £’000 : 2,110\n- Less:OperatingIncome4 > 4 2021/22 Aberdeen City £'000 : 0\n- Less:OperatingIncome4 > 5 Aberdeenshire 2021/22 £'000 : 0\n- Less:OperatingIncome4 > 6 2021/22 Moray £'000 : 0\n- Less:OperatingIncome4 > 7 2021/22 Group £’000 : (820,835)\n- Less:OperatingIncome4 > 8 2020/21 Group £’000 : (769,932)\n- JointVenturesaccountedforonanequitybasis > 1 2021/22 NHS Grampian £’000 : 0\n- JointVenturesaccountedforonanequitybasis > 2 Charitable Endowment 2021/22 Funds £’000 : 0\n- JointVenturesaccountedforonanequitybasis > 3 IntraGroup Adjustments 2021/22 £’000 : 0\n- JointVenturesaccountedforonanequitybasis > 4 2021/22 Aberdeen City £'000 : (16,578)\n- JointVenturesaccountedforonanequitybasis > 5 Aberdeenshire 2021/22 £'000 : (14,248)\n- JointVenturesaccountedforonanequitybasis > 6 2021/22 Moray £'000 : (5,340)\n- JointVenturesaccountedforonanequitybasis > 7 2021/22 Group £’000 : (36,166)\n- JointVenturesaccountedforonanequitybasis > 8 2020/21 Group £’000 : (21,120)\n- Netexpenditurefortheyear > 1 2021/22 NHS Grampian £’000 : 1,452,739\n- Netexpenditurefortheyear > 2 Charitable Endowment 2021/22 Funds £’000 : (803)\n- Netexpenditurefortheyear > 3 IntraGroup Adjustments 2021/22 £’000 : 0\n- Netexpenditurefortheyear > 4 2021/22 Aberdeen City £'000 : (16,578)\n- Netexpenditurefortheyear > 5 Aberdeenshire 2021/22 £'000 : (14,248)\n- Netexpenditurefortheyear > 6 2021/22 Moray £'000 : (5,340)\n- Netexpenditurefortheyear > 7 2021/22 Group £’000 : 1,415,770\n- Netexpenditurefortheyear > 8 2020/21 Group £’000 : 1,353,248\n- NetLoss/(gain)onrevaluationofPropertyPlantandEquipment > 1 2021/22 NHS Grampian £’000 : (28,544)\n- NetLoss/(gain)onrevaluationofPropertyPlantandEquipment > 2 Charitable Endowment 2021/22 Funds £’000 : 0\n- NetLoss/(gain)onrevaluationofPropertyPlantandEquipment > 3 IntraGroup Adjustments 2021/22 £’000 : 0\n- NetLoss/(gain)onrevaluationofPropertyPlantandEquipment > 4 2021/22 Aberdeen City £'000 : 0\n- NetLoss/(gain)onrevaluationofPropertyPlantandEquipment > 5 Aberdeenshire 2021/22 £'000 : 0\n- NetLoss/(gain)onrevaluationofPropertyPlantandEquipment > 6 2021/22 Moray £'000 : 0\n- NetLoss/(gain)onrevaluationofPropertyPlantandEquipment > 7 2021/22 Group £’000 : (28,544)\n- NetLoss/(gain)onrevaluationofPropertyPlantandEquipment > 8 2020/21 Group £’000 : 9,106\n- NetLoss/(gain)onrevaluationoffinancialassets > 1 2021/22 NHS Grampian £’000 : 0\n- NetLoss/(gain)onrevaluationoffinancialassets > 2 Charitable Endowment 2021/22 Funds £’000 : (3,064)\n- NetLoss/(gain)onrevaluationoffinancialassets > 3 IntraGroup Adjustments 2021/22 £’000 : 0\n- NetLoss/(gain)onrevaluationoffinancialassets > 4 2021/22 Aberdeen City £'000 : 0\n- NetLoss/(gain)onrevaluationoffinancialassets > 5 Aberdeenshire 2021/22 £'000 : 0\n- NetLoss/(gain)onrevaluationoffinancialassets > 6 2021/22 Moray £'000 : 0\n- NetLoss/(gain)onrevaluationoffinancialassets > 7 2021/22 Group £’000 : (3,064)\n- NetLoss/(gain)onrevaluationoffinancialassets > 8 2020/21 Group £’000 : (8,325)\n- TotalComprehensiveNetExpenditure/(Income) > 1 2021/22 NHS Grampian £’000 : 1,424,195\n- TotalComprehensiveNetExpenditure/(Income) > 2 Charitable Endowment 2021/22 Funds £’000 : (3,867)\n- TotalComprehensiveNetExpenditure/(Income) > 3 IntraGroup Adjustments 2021/22 £’000 : 0\n- TotalComprehensiveNetExpenditure/(Income) > 4 2021/22 Aberdeen City £'000 : (16,578)\n- TotalComprehensiveNetExpenditure/(Income) > 5 Aberdeenshire 2021/22 £'000 : (14,248)\n- TotalComprehensiveNetExpenditure/(Income) > 6 2021/22 Moray £'000 : (5,340)\n- TotalComprehensiveNetExpenditure/(Income) > 7 2021/22 Group £’000 : 1,384,162\n- TotalComprehensiveNetExpenditure/(Income) > 8 2020/21 Group £’000 : 1,354,029\n- Column headers: Row label > 1 2021/22 NHS Grampian £’000 : 1 2021/22 NHS Grampian £’000\n- Column headers: Row label > 2 Charitable Endowment 2021/22 Funds £’000 : 2 Charitable Endowment 2021/22 Funds £’000\n- Column headers: Row label > 3 IntraGroup Adjustments 2021/22 £’000 : 3 IntraGroup Adjustments 2021/22 £’000\n- Column headers: Row label > 4 2021/22 Aberdeen City £'000 : 4 2021/22 Aberdeen City £'000\n- Column headers: Row label > 5 Aberdeenshire 2021/22 £'000 : 5 Aberdeenshire 2021/22 £'000\n- Column headers: Row label > 6 2021/22 Moray £'000 : 6 2021/22 Moray £'000\n- Column headers: Row label > 7 2021/22 Group £’000 : 7 2021/22 Group £’000\n- Column headers: Row label > 8 2020/21 Group £’000 : 8 2020/21 Group £’000\n\nTable (markdown):\n\n| 0 | 1 | 2 | 3 | 4 | 5 | 6 | 7 | 8 |\n| --- | --- | --- | --- | --- | --- | --- | --- | --- |\n|  |  | Charitable |  |  |  |  |  |  |\n|  | NHS | Endowment | IntraGroup | Aberdeen |  |  |  |  |\n|  | Grampian | Funds | Adjustments | City | Aberdeenshire | Moray | Group | Group |\n|  | 2021/22 | 2021/22 | 2021/22 | 2021/22 | 2021/22 | 2021/22 | 2021/22 | 2020/21 |\n|  | £’000 | £’000 | £’000 | £'000 | £'000 | £'000 | £’000 | £’000 |\n| 3aStaffCosts | 849,820 | 0 | 0 | 0 | 0 | 0 | 849,820 | 803,300 |\n| 3bOtherOperatingExpenditure |  |  |  |  |  |  |  |  |\n| IndependentPrimaryCareServices | 166,179 | 0 | 0 | 0 | 0 | 0 | 166,179 | 165,461 |\n| DrugsandMedicalSupplies | 257,501 | 0 | 0 | 0 | 0 | 0 | 257,501 | 241,508 |\n| OtherHealthCareexpenditure | 999,132 | 2,249 | (2,110) | 0 | 0 | 0 | 999,271 | 934,031 |\n| Grossexpenditurefortheyear | 2,272,632 | 2,249 | (2,110) | 0 | 0 | 0 | 2,272,771 | 2,144,300 |\n| Less:OperatingIncome4 | (819,893) | (3,052) | 2,110 | 0 | 0 | 0 | (820,835) | (769,932) |\n| JointVenturesaccountedforonanequitybasis | 0 | 0 | 0 | (16,578) | (14,248) | (5,340) | (36,166) | (21,120) |\n| Netexpenditurefortheyear | 1,452,739 | (803) | 0 | (16,578) | (14,248) | (5,340) | 1,415,770 | 1,353,248 |\n| OTHERCOMPREHENSIVENETEXPENDITURE(MEMORANDUM) |  |  |  |  |  |  |  |  |\n| NetLoss/(gain)onrevaluationofPropertyPlantandEquipment | (28,544) | 0 | 0 | 0 | 0 | 0 | (28,544) | 9,106 |\n| NetLoss/(gain)onrevaluationoffinancialassets | 0 | (3,064) | 0 | 0 | 0 | 0 | (3,064) | (8,325) |\n| TotalComprehensiveNetExpenditure/(Income) | 1,424,195 | (3,867) | 0 | (16,578) | (14,248) | (5,340) | 1,384,162 | 1,354,029 |\nColumn headers: Row label | 1 2021/22 NHS Grampian £’000 | 2 Charitable Endowment 2021/22 Funds £’000 | 3 IntraGroup Adjustments 2021/22 £’000 | 4 2021/22 Aberdeen City £'000 | 5 Aberdeenshire 2021/22 £'000 | 6 2021/22 Moray £'000 | 7 2021/22 Group £’000 | 8 2020/21 Group £’000\nRow map:\n- 3aStaffCosts -> col_1=849,820 ; col_2=0 ; col_3=0 ; col_4=0 ; col_5=0 ; col_6=0 ; col_7=849,820 ; col_8=803,300\n- IndependentPrimaryCareServices -> col_1=166,179 ; col_2=0 ; col_3=0 ; col_4=0 ; col_5=0 ; col_6=0 ; col_7=166,179 ; col_8=165,461\n- DrugsandMedicalSupplies -> col_1=257,501 ; col_2=0 ; col_3=0 ; col_4=0 ; col_5=0 ; col_6=0 ; col_7=257,501 ; col_8=241,508\n- OtherHealthCareexpenditure -> col_1=999,132 ; col_2=2,249 ; col_3=(2,110) ; col_4=0 ; col_5=0 ; col_6=0 ; col_7=999,271 ; col_8=934,031\n- Grossexpenditurefortheyear -> col_1=2,272,632 ; col_2=2,249 ; col_3=(2,110) ; col_4=0 ; col_5=0 ; col_6=0 ; col_7=2,272,771 ; col_8=2,144,300\n- Less:OperatingIncome4 -> col_1=(819,893) ; col_2=(3,052) ; col_3=2,110 ; col_4=0 ; col_5=0 ; col_6=0 ; col_7=(820,835) ; col_8=(769,932)\n- JointVenturesaccountedforonanequitybasis -> col_1=0 ; col_2=0 ; col_3=0 ; col_4=(16,578) ; col_5=(14,248) ; col_6=(5,340) ; col_7=(36,166) ; col_8=(21,120)\n- Netexpenditurefortheyear -> col_1=1,452,739 ; col_2=(803) ; col_3=0 ; col_4=(16,578) ; col_5=(14,248) ; col_6=(5,340) ; col_7=1,415,770 ; col_8=1,353,248\n- NetLoss/(gain)onrevaluationofPropertyPlantandEquipment -> col_1=(28,544) ; col_2=0 ; col_3=0 ; col_4=0 ; col_5=0 ; col_6=0 ; col_7=(28,544) ; col_8=9,106\n- NetLoss/(gain)onrevaluationoffinancialassets -> col_1=0 ; col_2=(3,064) ; col_3=0 ; col_4=0 ; col_5=0 ; col_6=0 ; col_7=(3,064) ; col_8=(8,325)\n- TotalComprehensiveNetExpenditure/(Income) -> col_1=1,424,195 ; col_2=(3,867) ; col_3=0 ; col_4=(16,578) ; col_5=(14,248) ; col_6=(5,340) ; col_7=1,384,162 ; col_8=1,354,029"", '5. Appointment of Auditor (cont) The Trustees of NHS Grampian Endowment Funds appointed Azets as external auditor, for the financial year 2021/22. 6. Role of the Board Grampian Health Board was established in 1972 under the National Health Services (Scotland) Act 1972 and is responsible for commissioning services for the residents of Grampian, a total population of over half a million people. NHS Boards working in partnership with Integration Joint Boards, form a local health system, with governing boards responsible for improving the health of their local populations and delivering the healthcare they require. The role of the Board is to: a) deliver patient centred, safe and effective health care to the population of Grampian; b) improve and protect the health of local people; c) improve health services for local people; d) reduce health inequalities; e) focus clearly on health outcomes and people’s experience of their local NHS system; f) promote integrated health and community planning by working closely with other local organisations; and g) provide a single focus of accountability for the performance of the local NHS system. All Board members are also trustees of the NHS Grampian Endowment Funds, a registered charity established by the NHS (Scotland) Act 1978 and subject to the legal framework of the Charities']",£33.156 million,['£33.156 million'],Q_2022_IJB_01,Grampian-2021-2022,STR,number,[19],skipped
What were Aberdeen City IJB's retained reserves at year end 2021/22?,"Aberdeen City IJB reported an overall surplus of £33.156 million for the year (2020/21: £15.634 million), increasing the retained reserves carried forward to £51.392 million (2020/21 £18.236 million).","['Aberdeen City IJB reported an overall surplus of £33.156 million for the year (2020/21: £15.634 million), increasing the retained reserves carried forward to £51.392 million (2020/21 £18.236 million). This reflects: A general risk fund of £2.5 million (2020/21 £2.5 million) towards the impact of - unexpected events or emergencies; and Earmarked reserves of £48.892m (2020/21 £15.735 million) due to the allocation of -', 'following transactions with each IJB in 2021/22: ➢ Aberdeen City – Income £265.0m, expenditure £291.0m and a retained creditor balance of £40.4m. (2020/21 income £261.2 million, expenditure £273.0 million and a retained creditor balance of £14.4 million). ➢ Aberdeenshire – Income £243.4 million, expenditure £269.9 million and a retained creditor balance of £41.1 million. (2020/21 Income £242.8 million, expenditure £257.3 million and a retained creditor balance of £17.5 million). ➢ Moray – Income £104.7 million, expenditure £114.2 million and a retained creditor balance of £15.7 million. (2020/21 Income £100.8 million, expenditure £106.8 million and a retained creditor balance of £6.2 million). NHS Grampian Endowment Funds All members of the NHS Grampian Board also function as Trustees of the NHS Grampian Endowment Fund. The total NHS Grampian Endowment Fund balance at 31 March 2022 was £49.308 million (2020/21 £45.441 million). During the year payments totalling £1.993 million (2020/21 £2.031 million) were made to NHS Grampian by the NHS Grampian Endowment Fund to enable a range of research and other activities including infrastructure improvement for the benefit of patients and staff. The NHS Grampian Endowment Fund received £0.118 million (2020/21 £0.099 million) from NHS Grampian mainly from income for research activities.', 'Moray IJB reported a surplus for the year of £10.679 million (2020/21: £6.155m) increasing the retained reserves carried forward to £17.021 million (2020/21 £6.342 million). This reflects: General reserves of £1.257 million (2020/21 £1.597m) towards the impact of - unexpected events or emergencies; and Earmarked reserves of £15.764 million (2020/21 £4.744 million) due to the allocation -', 'Aberdeenshire IJB reported a surplus for the year of £28.496 million (2020/21: £20.449m) increasing the retained reserves carried forward to £49.062 million (2020/21 £20.566 million). This reflects: General reserves of £7.908 million (2020/21 £4.597m) towards the impact of - unexpected events or emergencies; and Earmarked reserves of £41.154 million (2020/21 £15.969 million), due to the - allocation', 'The increase in IJB retained reserves relates partly to an underspend from some core services continuing to operate at reduced capacity throughout the pandemic and partly due to the allocation']",£51.392 million,['£51.392 million'],Q_2022_IJB_02,Grampian-2021-2022,LEX,number,[19],skipped
What was the resource budget ceiling set for NHS Grampian's core ongoing activities in 2022/23?,The Scottish Government require NHS Boards to meet three key financial targets: Revenue Resource Limit (RRL) a resource budget for ongoing activity; Capital Resource Limit (CRL) a resource budget for net capital investment; and Cash Require,"['PERFORMANCE REPORT B PERFORMANCE ANALYSIS 3.2 Grampian Health Board performance against statutory financial targets The results of each of the partner organisations, although consolidated with the main Board accounts for group accounting purposes, do not form part of the statutory financial target set for NHS Boards by the Scottish Government Health and Social Care Directorates (SGHSCD) and are, therefore, not taken in to account when considering the rmance. NHS Boards have the ability to manage small under/overspends (within 1% of resource) within an overall breakeven position across a three year period (2022-25). The Scottish Government require NHS Boards to meet three key financial targets: Revenue Resource Limit (RRL) a resource budget for ongoing activity; Capital Resource Limit (CRL) a resource budget for net capital investment; and Cash Requirement a financing requirement to fund the cash consequences of ongoing activity and net capital investment. Health Boards are required to contain their net expenditure within these limits, and report on any variation. Grampian Health Board has successfully achieved all three financial targets for the year reporting an outturn against these set limits as follows: Statutory Financial Targets Limit as set Actual Variance by SGHSCD Outturn (Deficit)/Sur plus Core Revenue Resource Limit 1,292,491 1,291,879 612 Non-Core Revenue Resource Limit 46,200 46,200 - Total', 'Health Boards are required to contain their net expenditure within these limits, and report on any variation. Grampian Health Board has successfully achieved all three financial targets for the year reporting an outturn against these set limits as follows: Statutory Financial Targets Limit as set Actual Variance by SGHSCD Outturn (Deficit)/Sur plus Core Revenue Resource Limit 1,292,491 1,291,879 612 Non-Core Revenue Resource Limit 46,200 46,200 - Total Revenue Resource Limit 1,338,691 1,338,079 612 Core Capital Resource Limit 104,268 104,268 - Non-Core Capital Resource Limit 1,068 1,068 - Total Capital Resource Limit 105,336 105,336 - Cash Requirement 1,546,903 1,546,903 - Memorandum for In Year Out-turn £000', 'million) were made to NHS Grampian by the NHS Grampian Endowment Fund to enable a range of research and other activities including infrastructure improvement for the benefit of patients and staff. The NHS Grampian Endowment Fund received £0.219 million (2021/22 £0.118 million) from NHS Grampian mainly from income for research activities. Chest, Heart & Stroke Scotland Mrs A Anderson, Non Executive Board Member was also made Chair of Chest, Heart & Stroke Scotland during 2022/23. NHS Grampian had the following transactions in 2022/23; income £0, expenditure £202,020.', 'PERFORMANCE REPORT B PERFORMANCE ANALYSIS Financial flexibility: funding banked with/(provided by) 0 Scottish Government Underlying Surplus against Core Revenue Resource Limit 612 0% Further details on non-core elements of expenditure, typically comprising items of a technical accounting nature, can be found in the Summary of Resource Outturn. The Board is reporting an underspend of £0.612 million against a target of breakeven on the revenue resource limit for 2022/23. A one year financial plan was submitted to Scottish Government by NHS Grampian on 21 March 2022. Due to the impact of the COVID-19 pandemic, the normal Scottish Government three year Annual Operating and financial planning process was amended. NHS Boards were required to submit three year financial plans to the Scottish Government in August 2022 covering the period April 2022 - March 2025. Subsequently there has been a return of formal three year financial planning from 2023-24 with an updated financial plan submitted to the Scottish Government in March 2023 covering the period 2023 - 2026. The Board has also updated the five year Medium Term Financial Strategy. The Core Revenue Resource Limit for 2022/23 was also adjusted to include the £0.131 million surplus carried forward from 2021/22. 3.2.1 Efficiency Savings Efficiency savings of £10.2 million were achieved against a target', 'planning from 2023-24 with an updated financial plan submitted to the Scottish Government in March 2023 covering the period 2023 - 2026. The Board has also updated the five year Medium Term Financial Strategy. The Core Revenue Resource Limit for 2022/23 was also adjusted to include the £0.131 million surplus carried forward from 2021/22. 3.2.1 Efficiency Savings Efficiency savings of £10.2 million were achieved against a target of £5.4 million for NHS Grampian services. The main savings achieved were in the areas of travel costs, review of old orders, reduction of untaken annual leave accrual, procurement, cross boundary charges and skill mix in non-clinical areas. Recurring savings amounted to £2.5 million and non-recurring of £7.7 million. 3.2.2 Financial impact of the COVID-19 Pandemic The impact of the pandemic was less severe on services in 2022/23 than in 2021/22 but significant costs were still incurred across a range of services, including the COVID vaccination programme and the provision of sustainability payments to social care providers. Expenditure of £23.1 million was incurred on non-delegated Board services. The main areas incurring additional costs were in additional Personal Protective equipment, vaccinations programmes, testing and contact tracing and staffing and other costs to support infection control measures. The level of expenditure was fully funded by']","£1,292,491 (£000)","['£1,292,491 (£000)']",Q_2023_FIN_01,Grampian-2022-2023,MOD,number,[23],skipped
What was the actual Core Revenue Resource outturn in 2022/23?,Grampian Health Board has successfully achieved all three financial targets for the year reporting an outturn against these set limits as follows: Statutory Financial Targets Limit as set Actual Variance by SGHSCD Outturn (Deficit)/Sur plus,"['Health Boards are required to contain their net expenditure within these limits, and report on any variation. Grampian Health Board has successfully achieved all three financial targets for the year reporting an outturn against these set limits as follows: Statutory Financial Targets Limit as set Actual Variance by SGHSCD Outturn (Deficit)/Sur plus Core Revenue Resource Limit 1,292,491 1,291,879 612 Non-Core Revenue Resource Limit 46,200 46,200 - Total Revenue Resource Limit 1,338,691 1,338,079 612 Core Capital Resource Limit 104,268 104,268 - Non-Core Capital Resource Limit 1,068 1,068 - Total Capital Resource Limit 105,336 105,336 - Cash Requirement 1,546,903 1,546,903 - Memorandum for In Year Out-turn £000', 'PERFORMANCE REPORT B PERFORMANCE ANALYSIS Financial flexibility: funding banked with/(provided by) 0 Scottish Government Underlying Surplus against Core Revenue Resource Limit 612 0% Further details on non-core elements of expenditure, typically comprising items of a technical accounting nature, can be found in the Summary of Resource Outturn. The Board is reporting an underspend of £0.612 million against a target of breakeven on the revenue resource limit for 2022/23. A one year financial plan was submitted to Scottish Government by NHS Grampian on 21 March 2022. Due to the impact of the COVID-19 pandemic, the normal Scottish Government three year Annual Operating and financial planning process was amended. NHS Boards were required to submit three year financial plans to the Scottish Government in August 2022 covering the period April 2022 - March 2025. Subsequently there has been a return of formal three year financial planning from 2023-24 with an updated financial plan submitted to the Scottish Government in March 2023 covering the period 2023 - 2026. The Board has also updated the five year Medium Term Financial Strategy. The Core Revenue Resource Limit for 2022/23 was also adjusted to include the £0.131 million surplus carried forward from 2021/22. 3.2.1 Efficiency Savings Efficiency savings of £10.2 million were achieved against a target', ""an independent valuer, The Valuation Office Agency, as at 31/03/2023 on the basis of fair value (market value or depreciated replacement costs where appropriate). The values were computed in accordance with the Royal Institute of Chartered Surveyors Statement of Asset Valuation Practice and Guidance notes, subject to the special accounting practices of the NHS. The net impact of the revaluation was an increase of £22.931m (2021-22: an increase of £28.544m) which was credited to the revaluation reserve. Impairment Reversal of (£0.657m) (2021-22 Impairment of £0.403m) was credited to the Statement of Comprehensive Net Expenditure and Summary of Resource Outturn. In addition to the annual revaluation review, an Impairment review was carried out on projects with expenditure held as 'Assets under construction'. This review resulted in an assessed Impairment of £8.274m, which was debited to the Statement of Comprehensive Net Expenditure and summary of resource outturn."", 'planning from 2023-24 with an updated financial plan submitted to the Scottish Government in March 2023 covering the period 2023 - 2026. The Board has also updated the five year Medium Term Financial Strategy. The Core Revenue Resource Limit for 2022/23 was also adjusted to include the £0.131 million surplus carried forward from 2021/22. 3.2.1 Efficiency Savings Efficiency savings of £10.2 million were achieved against a target of £5.4 million for NHS Grampian services. The main savings achieved were in the areas of travel costs, review of old orders, reduction of untaken annual leave accrual, procurement, cross boundary charges and skill mix in non-clinical areas. Recurring savings amounted to £2.5 million and non-recurring of £7.7 million. 3.2.2 Financial impact of the COVID-19 Pandemic The impact of the pandemic was less severe on services in 2022/23 than in 2021/22 but significant costs were still incurred across a range of services, including the COVID vaccination programme and the provision of sustainability payments to social care providers. Expenditure of £23.1 million was incurred on non-delegated Board services. The main areas incurring additional costs were in additional Personal Protective equipment, vaccinations programmes, testing and contact tracing and staffing and other costs to support infection control measures. The level of expenditure was fully funded by', 'PERFORMANCE REPORT B PERFORMANCE ANALYSIS 3.2 Grampian Health Board performance against statutory financial targets The results of each of the partner organisations, although consolidated with the main Board accounts for group accounting purposes, do not form part of the statutory financial target set for NHS Boards by the Scottish Government Health and Social Care Directorates (SGHSCD) and are, therefore, not taken in to account when considering the rmance. NHS Boards have the ability to manage small under/overspends (within 1% of resource) within an overall breakeven position across a three year period (2022-25). The Scottish Government require NHS Boards to meet three key financial targets: Revenue Resource Limit (RRL) a resource budget for ongoing activity; Capital Resource Limit (CRL) a resource budget for net capital investment; and Cash Requirement a financing requirement to fund the cash consequences of ongoing activity and net capital investment. Health Boards are required to contain their net expenditure within these limits, and report on any variation. Grampian Health Board has successfully achieved all three financial targets for the year reporting an outturn against these set limits as follows: Statutory Financial Targets Limit as set Actual Variance by SGHSCD Outturn (Deficit)/Sur plus Core Revenue Resource Limit 1,292,491 1,291,879 612 Non-Core Revenue Resource Limit 46,200 46,200 - Total']","£1,291,879 (£000)","['£1,291,879 (£000)']",Q_2023_FIN_02,Grampian-2022-2023,LEX,number,[23],skipped
What was the surplus variance against the Core Revenue Resource Limit in 2022/23?,£0.131 million,"['PERFORMANCE REPORT B PERFORMANCE ANALYSIS Financial flexibility: funding banked with/(provided by) 0 Scottish Government Underlying Surplus against Core Revenue Resource Limit 612 0% Further details on non-core elements of expenditure, typically comprising items of a technical accounting nature, can be found in the Summary of Resource Outturn. The Board is reporting an underspend of £0.612 million against a target of breakeven on the revenue resource limit for 2022/23. A one year financial plan was submitted to Scottish Government by NHS Grampian on 21 March 2022. Due to the impact of the COVID-19 pandemic, the normal Scottish Government three year Annual Operating and financial planning process was amended. NHS Boards were required to submit three year financial plans to the Scottish Government in August 2022 covering the period April 2022 - March 2025. Subsequently there has been a return of formal three year financial planning from 2023-24 with an updated financial plan submitted to the Scottish Government in March 2023 covering the period 2023 - 2026. The Board has also updated the five year Medium Term Financial Strategy. The Core Revenue Resource Limit for 2022/23 was also adjusted to include the £0.131 million surplus carried forward from 2021/22. 3.2.1 Efficiency Savings Efficiency savings of £10.2 million were achieved against a target', 'Health Boards are required to contain their net expenditure within these limits, and report on any variation. Grampian Health Board has successfully achieved all three financial targets for the year reporting an outturn against these set limits as follows: Statutory Financial Targets Limit as set Actual Variance by SGHSCD Outturn (Deficit)/Sur plus Core Revenue Resource Limit 1,292,491 1,291,879 612 Non-Core Revenue Resource Limit 46,200 46,200 - Total Revenue Resource Limit 1,338,691 1,338,079 612 Core Capital Resource Limit 104,268 104,268 - Non-Core Capital Resource Limit 1,068 1,068 - Total Capital Resource Limit 105,336 105,336 - Cash Requirement 1,546,903 1,546,903 - Memorandum for In Year Out-turn £000', 'planning from 2023-24 with an updated financial plan submitted to the Scottish Government in March 2023 covering the period 2023 - 2026. The Board has also updated the five year Medium Term Financial Strategy. The Core Revenue Resource Limit for 2022/23 was also adjusted to include the £0.131 million surplus carried forward from 2021/22. 3.2.1 Efficiency Savings Efficiency savings of £10.2 million were achieved against a target of £5.4 million for NHS Grampian services. The main savings achieved were in the areas of travel costs, review of old orders, reduction of untaken annual leave accrual, procurement, cross boundary charges and skill mix in non-clinical areas. Recurring savings amounted to £2.5 million and non-recurring of £7.7 million. 3.2.2 Financial impact of the COVID-19 Pandemic The impact of the pandemic was less severe on services in 2022/23 than in 2021/22 but significant costs were still incurred across a range of services, including the COVID vaccination programme and the provision of sustainability payments to social care providers. Expenditure of £23.1 million was incurred on non-delegated Board services. The main areas incurring additional costs were in additional Personal Protective equipment, vaccinations programmes, testing and contact tracing and staffing and other costs to support infection control measures. The level of expenditure was fully funded by', 'PERFORMANCE REPORT B PERFORMANCE ANALYSIS 3.2 Grampian Health Board performance against statutory financial targets The results of each of the partner organisations, although consolidated with the main Board accounts for group accounting purposes, do not form part of the statutory financial target set for NHS Boards by the Scottish Government Health and Social Care Directorates (SGHSCD) and are, therefore, not taken in to account when considering the rmance. NHS Boards have the ability to manage small under/overspends (within 1% of resource) within an overall breakeven position across a three year period (2022-25). The Scottish Government require NHS Boards to meet three key financial targets: Revenue Resource Limit (RRL) a resource budget for ongoing activity; Capital Resource Limit (CRL) a resource budget for net capital investment; and Cash Requirement a financing requirement to fund the cash consequences of ongoing activity and net capital investment. Health Boards are required to contain their net expenditure within these limits, and report on any variation. Grampian Health Board has successfully achieved all three financial targets for the year reporting an outturn against these set limits as follows: Statutory Financial Targets Limit as set Actual Variance by SGHSCD Outturn (Deficit)/Sur plus Core Revenue Resource Limit 1,292,491 1,291,879 612 Non-Core Revenue Resource Limit 46,200 46,200 - Total', 'is provided in Note 1 to the Accounts and disclosure of the costs is shown within Note 19 and the Remuneration Report. 3.2.7 Infrastructure and Non-Current Assets The Board delivered a programme of infrastructure investment totalling £109.7 million during 2022/23. Within this, a total of £105.605 million of capital expenditure was incurred (see note 7d) and a further £4.05 million was classed as revenue expenditure in nature. The overall programme was resourced using a combination of capital funding from the SGHSCD (£104.3 million, see note 7d), income from donations (£0.3 million), financial transactions funding from the Scottish Government for a GP sustainability Loan (£0.7 million), NBV benefit from disposal of equipment (£0.26 million) and various revenue funding sources (£4.05 million) Major investments during the year include: Ongoing Construction of the Baird Family Hospital and the ANCHOR Cancer Centre (£85.1 million) with ANCHOR due to open in 2023/24 and Baird the following year. The Baird Family Hospital will replace the existing maternity hospital, breast screening, gynaecology and neo-natal facilities. The Anchor Cancer centre will be located adjacent to the existing radiotherapy building on the Aberdeen Royal Infirmary site. Forecast expenditure £261.1 million with expenditure to 31 March 2023 £150.8 million. Ongoing design and development costs in support of the National Treatment']",£612 (£000),['£612 (£000)'],Q_2023_FIN_03,Grampian-2022-2023,LEX,number,[23],skipped
What was the approved cash financing requirement for NHS Grampian in 2022/23?,The Scottish Government require NHS Boards to meet three key financial targets: Revenue Resource Limit (RRL) a resource budget for ongoing activity; Capital Resource Limit (CRL) a resource budget for net capital investment; and Cash Require,"['PERFORMANCE REPORT B PERFORMANCE ANALYSIS 3.2 Grampian Health Board performance against statutory financial targets The results of each of the partner organisations, although consolidated with the main Board accounts for group accounting purposes, do not form part of the statutory financial target set for NHS Boards by the Scottish Government Health and Social Care Directorates (SGHSCD) and are, therefore, not taken in to account when considering the rmance. NHS Boards have the ability to manage small under/overspends (within 1% of resource) within an overall breakeven position across a three year period (2022-25). The Scottish Government require NHS Boards to meet three key financial targets: Revenue Resource Limit (RRL) a resource budget for ongoing activity; Capital Resource Limit (CRL) a resource budget for net capital investment; and Cash Requirement a financing requirement to fund the cash consequences of ongoing activity and net capital investment. Health Boards are required to contain their net expenditure within these limits, and report on any variation. Grampian Health Board has successfully achieved all three financial targets for the year reporting an outturn against these set limits as follows: Statutory Financial Targets Limit as set Actual Variance by SGHSCD Outturn (Deficit)/Sur plus Core Revenue Resource Limit 1,292,491 1,291,879 612 Non-Core Revenue Resource Limit 46,200 46,200 - Total', ""TABLE_TYPE: financial_core_cash_flow\nPAGE: 151\nROTATION: 0\nNHS GRAMPIAN\nANNUAL REPORT AND ACCOUNTS FOR YEAR ENDED 31 MARCH 2023\nFINANCIAL STATEMENTS\nNote 23(c) CONSOLIDATED CASH FLOW STATEMENT FOR THE YEAR ENDED 31 MARCH 2023\nCash flows from operating activities\nNet operating cost\nAdjustments for non-cash transactions\nAdd back: interest payable recognised in net operating cost\nInvestment Income\n(Increase)/decrease in trade and other receivables\n(Increase)/decrease in inventories\nIncrease/(decrease) in trade and other payables\nIncrease/(decrease) in provisions\nNet cash outflow from operating activities\nCash flows from investing activities\nPurchase of property, plant and equipment\nPurchase of intangible assets\nInvestment Additions\nTransfer of assets to/(from) other NHS bodies\nProceeds of disposal of property, plant and equipment\nReceipts from sale of investments\nInterest and dividends received\nNet cash outflow from investing activities\nCash flows from financing activities\nFunding\nMovement in general fund working capital\nCash drawn down\nCapital element of payments in respect of on-balance sheet PFI and Hub\ncontracts\nCapital element of payments in respect of leases\nIFRS 16 - 2022-23 cash lease payment\nInterest element of finance leases and on-balance sheet PFI/PPP contracts\nNet Financing\nNet increase/(decrease) in cash and cash equivalents in the period\nCash and cash equivalents at the beginning of the period\nCash and cash equivalents at the end of the period\nNote\n2b\n2b\n2c\n2c\n2c\n2c\n10\n2c\n2b\n11\nCharitable\nEndowment Intra Group\nNHS Grampian Funds Adjustments Aberdeen City | Aberdeenshire Moray Group\n2022/23 2022/23 2022/23 2022/23 2022/23 2022/23 2022/23\n£000 £000 £000 £'000 £'000 £'000 £000\n(1,409,216) 110 0 (12,123) (16,067) (6,169) (1,443,465)\n39,973 0 0 12,123 16,067 6,169 74,332\n3,139 0 0 0 0 0 3,139\n0 (1,816) 0 0 0 0 (1,816)\n(62,945) 10 220 0 0 0 (62,715)\n(483) 0 0 0 0 0 (483)\n(61,844) 61 (220) 0 0 0 (62,003)\n54,434 593 0 0 0 0 55,027\n(1,436,942) (1,042) 0 0 0 0 (1,437,984)\n(100,286) 0 0 0 0 0 (100,286)\n(298) 0 0 0 0 0 (298)\n(748) (10,370) 0 0 0 0 (11,118)\n0 0 0 0 0 0 0\n906 0 0 0 0 0 906\n0 10,217 0 0 0 0 10,217\n0 1,816 0 0 0 0 1,816\n(100,426) 1,663 0 0 0 0 (98,763)\n1,544,689 0 0 0 0 0 1,544,689\n2,214 0 0 0 0 0 2,214\n1,546,903 0 0 0 0 0 1,546,903\n(923) 0 0 0 0 0 (923)\n(469) (469)\n(2,790) 0 0 0 0 0 (2,790)\n(3,139) 0 0 0 0 0 (3,139)\n1,539,582 0 0 0 0 0 1,539,582\n2,214 621 0 0 0 0 2,835\n8,198 1,979 0 0 0 0 10,177\n10,412 2,600 0 0 0 0 13,012\n150"", 'Health Boards are required to contain their net expenditure within these limits, and report on any variation. Grampian Health Board has successfully achieved all three financial targets for the year reporting an outturn against these set limits as follows: Statutory Financial Targets Limit as set Actual Variance by SGHSCD Outturn (Deficit)/Sur plus Core Revenue Resource Limit 1,292,491 1,291,879 612 Non-Core Revenue Resource Limit 46,200 46,200 - Total Revenue Resource Limit 1,338,691 1,338,079 612 Core Capital Resource Limit 104,268 104,268 - Non-Core Capital Resource Limit 1,068 1,068 - Total Capital Resource Limit 105,336 105,336 - Cash Requirement 1,546,903 1,546,903 - Memorandum for In Year Out-turn £000', ""TABLE_TYPE: financial_core_balance_sheet\nPAGE: 126\nROTATION: 0\nNHS GRAMPIAN\nANNUAL REPORT AND ACCOUNTS FOR YEAR ENDED 31 MARCH 2023\nFINANCIAL STATEMENTS\nNote 11. CASH AND CASH EQUIVALENTS\n11. CASH AND CASH EQUIVALENTS\nGovernment Banking Service account balance\nCash at bank and in hand\nCash investments and deposits\nTotal cash and cash equivalents - balance sheet\nCASH AND CASH EQUIVALENTS - PRIOR YEAR\nGovernment Banking Service account balance\nCash at bank and in hand\nCash investments and deposits\nTotal cash and cash equivalents - balance sheet\nCash at bank is with major UK banks. The credit risk associated with cash at bank is therefore considered to be low.\nNHS GRAMPIAN\nCHARITABLE ENDOWMENT FUNDS\nAt Net At\n01/04/22 Change 31/03/23\n£000 £7000 £7000\n8,081 2,191 10,272\n117 23 140\n0 ie) 0\n8,198 2,214 10,412\nAt Net At\n01/04/21 Change 31/03/22\n£000 £000 £7000\n604 7,477 8,081\n87 30 117\n0 0 0\n691 7,507 8,198\nAt Net At\n01/04/22 Change 31/03/23\n£000 £7000 £000\n1,979 621 2,600\n0 0 0\n0 0 te)\n1,979 621 2,600\nAt Net At\n01/04/21 Change 31/03/22\n£7000 £7000 £000\n1,859 120 1,979\n0 0 0\n0 0 0\n1,859 120 1,979\nINTRA GROUP ADJUSTMENTS CONSOLIDATED\nAt Net At At Net At\n01/04/22 Change 31/03/23 01/04/22 Change 31/03/23\n£7000 £'000 £7000 £'000 £'000 £'000\n0 0 0 10,060 2,812 12,872\n0 0 0 117 23 140\n0 0 0 0 0 0\n0 0 0 10,177 2,835 13,012\nAt Net At At Net At\n01/04/21 Change 31/03/22 01/04/21 Change 31/03/22\n£7000 £'000 £7000 £'000 £7000 £7000\n0 0 0 2,463 7,597 10,060\n0 0 0 87 30 117\n0 0 i) 0 0 0\n0 0 0 2,550 7,627 10,177\n125"", 'for Specialist Registration in a discipline with enduring Consultant vacancies. (This supports those with the knowledge, skills and experience in a medical specialty to meet the approved curriculum and are then eligible to apply for consultant posts). During 2022/23 NHS Grampian responded to the results of the Best Practice Australia (BPA) culture survey across the Nursing and Midwifery and the Facilities and Estates workforce, approximately half of NHS Grampian employees. This was undertaken to support work towards Magnet recognition for excellence in Nursing, supporting attraction, recruitment and retention, and to enable colleagues in these areas to share their views on']","£1,546,903 (£000)","['£1,546,903 (£000)']",Q_2023_FIN_04,Grampian-2022-2023,MOD,number,[23],skipped
What was the Total Revenue Resource Limit for 2022/23?,"1,292,491","['Health Boards are required to contain their net expenditure within these limits, and report on any variation. Grampian Health Board has successfully achieved all three financial targets for the year reporting an outturn against these set limits as follows: Statutory Financial Targets Limit as set Actual Variance by SGHSCD Outturn (Deficit)/Sur plus Core Revenue Resource Limit 1,292,491 1,291,879 612 Non-Core Revenue Resource Limit 46,200 46,200 - Total Revenue Resource Limit 1,338,691 1,338,079 612 Core Capital Resource Limit 104,268 104,268 - Non-Core Capital Resource Limit 1,068 1,068 - Total Capital Resource Limit 105,336 105,336 - Cash Requirement 1,546,903 1,546,903 - Memorandum for In Year Out-turn £000', 'PERFORMANCE REPORT B PERFORMANCE ANALYSIS Financial flexibility: funding banked with/(provided by) 0 Scottish Government Underlying Surplus against Core Revenue Resource Limit 612 0% Further details on non-core elements of expenditure, typically comprising items of a technical accounting nature, can be found in the Summary of Resource Outturn. The Board is reporting an underspend of £0.612 million against a target of breakeven on the revenue resource limit for 2022/23. A one year financial plan was submitted to Scottish Government by NHS Grampian on 21 March 2022. Due to the impact of the COVID-19 pandemic, the normal Scottish Government three year Annual Operating and financial planning process was amended. NHS Boards were required to submit three year financial plans to the Scottish Government in August 2022 covering the period April 2022 - March 2025. Subsequently there has been a return of formal three year financial planning from 2023-24 with an updated financial plan submitted to the Scottish Government in March 2023 covering the period 2023 - 2026. The Board has also updated the five year Medium Term Financial Strategy. The Core Revenue Resource Limit for 2022/23 was also adjusted to include the £0.131 million surplus carried forward from 2021/22. 3.2.1 Efficiency Savings Efficiency savings of £10.2 million were achieved against a target', 'planning from 2023-24 with an updated financial plan submitted to the Scottish Government in March 2023 covering the period 2023 - 2026. The Board has also updated the five year Medium Term Financial Strategy. The Core Revenue Resource Limit for 2022/23 was also adjusted to include the £0.131 million surplus carried forward from 2021/22. 3.2.1 Efficiency Savings Efficiency savings of £10.2 million were achieved against a target of £5.4 million for NHS Grampian services. The main savings achieved were in the areas of travel costs, review of old orders, reduction of untaken annual leave accrual, procurement, cross boundary charges and skill mix in non-clinical areas. Recurring savings amounted to £2.5 million and non-recurring of £7.7 million. 3.2.2 Financial impact of the COVID-19 Pandemic The impact of the pandemic was less severe on services in 2022/23 than in 2021/22 but significant costs were still incurred across a range of services, including the COVID vaccination programme and the provision of sustainability payments to social care providers. Expenditure of £23.1 million was incurred on non-delegated Board services. The main areas incurring additional costs were in additional Personal Protective equipment, vaccinations programmes, testing and contact tracing and staffing and other costs to support infection control measures. The level of expenditure was fully funded by', 'PERFORMANCE REPORT B PERFORMANCE ANALYSIS 3.2 Grampian Health Board performance against statutory financial targets The results of each of the partner organisations, although consolidated with the main Board accounts for group accounting purposes, do not form part of the statutory financial target set for NHS Boards by the Scottish Government Health and Social Care Directorates (SGHSCD) and are, therefore, not taken in to account when considering the rmance. NHS Boards have the ability to manage small under/overspends (within 1% of resource) within an overall breakeven position across a three year period (2022-25). The Scottish Government require NHS Boards to meet three key financial targets: Revenue Resource Limit (RRL) a resource budget for ongoing activity; Capital Resource Limit (CRL) a resource budget for net capital investment; and Cash Requirement a financing requirement to fund the cash consequences of ongoing activity and net capital investment. Health Boards are required to contain their net expenditure within these limits, and report on any variation. Grampian Health Board has successfully achieved all three financial targets for the year reporting an outturn against these set limits as follows: Statutory Financial Targets Limit as set Actual Variance by SGHSCD Outturn (Deficit)/Sur plus Core Revenue Resource Limit 1,292,491 1,291,879 612 Non-Core Revenue Resource Limit 46,200 46,200 - Total', 'is provided in Note 1 to the Accounts and disclosure of the costs is shown within Note 19 and the Remuneration Report. 3.2.7 Infrastructure and Non-Current Assets The Board delivered a programme of infrastructure investment totalling £109.7 million during 2022/23. Within this, a total of £105.605 million of capital expenditure was incurred (see note 7d) and a further £4.05 million was classed as revenue expenditure in nature. The overall programme was resourced using a combination of capital funding from the SGHSCD (£104.3 million, see note 7d), income from donations (£0.3 million), financial transactions funding from the Scottish Government for a GP sustainability Loan (£0.7 million), NBV benefit from disposal of equipment (£0.26 million) and various revenue funding sources (£4.05 million) Major investments during the year include: Ongoing Construction of the Baird Family Hospital and the ANCHOR Cancer Centre (£85.1 million) with ANCHOR due to open in 2023/24 and Baird the following year. The Baird Family Hospital will replace the existing maternity hospital, breast screening, gynaecology and neo-natal facilities. The Anchor Cancer centre will be located adjacent to the existing radiotherapy building on the Aberdeen Royal Infirmary site. Forecast expenditure £261.1 million with expenditure to 31 March 2023 £150.8 million. Ongoing design and development costs in support of the National Treatment']","£1,338,691 (£000)","['£1,338,691 (£000)']",Q_2023_FIN_05,Grampian-2022-2023,LEX,number,[23],skipped
What was the Core Capital Resource Limit for 2022/23?,Grampian Health Board has successfully achieved all three financial targets for the year reporting an outturn against these set limits as follows: Statutory Financial Targets Limit as set Actual Variance by SGHSCD Outturn (Deficit)/Sur plus,"['Health Boards are required to contain their net expenditure within these limits, and report on any variation. Grampian Health Board has successfully achieved all three financial targets for the year reporting an outturn against these set limits as follows: Statutory Financial Targets Limit as set Actual Variance by SGHSCD Outturn (Deficit)/Sur plus Core Revenue Resource Limit 1,292,491 1,291,879 612 Non-Core Revenue Resource Limit 46,200 46,200 - Total Revenue Resource Limit 1,338,691 1,338,079 612 Core Capital Resource Limit 104,268 104,268 - Non-Core Capital Resource Limit 1,068 1,068 - Total Capital Resource Limit 105,336 105,336 - Cash Requirement 1,546,903 1,546,903 - Memorandum for In Year Out-turn £000', 'PERFORMANCE REPORT B PERFORMANCE ANALYSIS Financial flexibility: funding banked with/(provided by) 0 Scottish Government Underlying Surplus against Core Revenue Resource Limit 612 0% Further details on non-core elements of expenditure, typically comprising items of a technical accounting nature, can be found in the Summary of Resource Outturn. The Board is reporting an underspend of £0.612 million against a target of breakeven on the revenue resource limit for 2022/23. A one year financial plan was submitted to Scottish Government by NHS Grampian on 21 March 2022. Due to the impact of the COVID-19 pandemic, the normal Scottish Government three year Annual Operating and financial planning process was amended. NHS Boards were required to submit three year financial plans to the Scottish Government in August 2022 covering the period April 2022 - March 2025. Subsequently there has been a return of formal three year financial planning from 2023-24 with an updated financial plan submitted to the Scottish Government in March 2023 covering the period 2023 - 2026. The Board has also updated the five year Medium Term Financial Strategy. The Core Revenue Resource Limit for 2022/23 was also adjusted to include the £0.131 million surplus carried forward from 2021/22. 3.2.1 Efficiency Savings Efficiency savings of £10.2 million were achieved against a target', 'planning from 2023-24 with an updated financial plan submitted to the Scottish Government in March 2023 covering the period 2023 - 2026. The Board has also updated the five year Medium Term Financial Strategy. The Core Revenue Resource Limit for 2022/23 was also adjusted to include the £0.131 million surplus carried forward from 2021/22. 3.2.1 Efficiency Savings Efficiency savings of £10.2 million were achieved against a target of £5.4 million for NHS Grampian services. The main savings achieved were in the areas of travel costs, review of old orders, reduction of untaken annual leave accrual, procurement, cross boundary charges and skill mix in non-clinical areas. Recurring savings amounted to £2.5 million and non-recurring of £7.7 million. 3.2.2 Financial impact of the COVID-19 Pandemic The impact of the pandemic was less severe on services in 2022/23 than in 2021/22 but significant costs were still incurred across a range of services, including the COVID vaccination programme and the provision of sustainability payments to social care providers. Expenditure of £23.1 million was incurred on non-delegated Board services. The main areas incurring additional costs were in additional Personal Protective equipment, vaccinations programmes, testing and contact tracing and staffing and other costs to support infection control measures. The level of expenditure was fully funded by', 'PERFORMANCE REPORT B PERFORMANCE ANALYSIS 3.2 Grampian Health Board performance against statutory financial targets The results of each of the partner organisations, although consolidated with the main Board accounts for group accounting purposes, do not form part of the statutory financial target set for NHS Boards by the Scottish Government Health and Social Care Directorates (SGHSCD) and are, therefore, not taken in to account when considering the rmance. NHS Boards have the ability to manage small under/overspends (within 1% of resource) within an overall breakeven position across a three year period (2022-25). The Scottish Government require NHS Boards to meet three key financial targets: Revenue Resource Limit (RRL) a resource budget for ongoing activity; Capital Resource Limit (CRL) a resource budget for net capital investment; and Cash Requirement a financing requirement to fund the cash consequences of ongoing activity and net capital investment. Health Boards are required to contain their net expenditure within these limits, and report on any variation. Grampian Health Board has successfully achieved all three financial targets for the year reporting an outturn against these set limits as follows: Statutory Financial Targets Limit as set Actual Variance by SGHSCD Outturn (Deficit)/Sur plus Core Revenue Resource Limit 1,292,491 1,291,879 612 Non-Core Revenue Resource Limit 46,200 46,200 - Total', 'TABLE_TYPE: financial_core_balance_sheet\nPAGE: 113\nROTATION: 0\nNHS GRAMPIAN\nANNUAL REPORT AND ACCOUNTS FOR YEAR ENDED 31 MARCH 2023\nFINANCIAL STATEMENTS\n2c. CONSOLIDATED MOVEMENT IN WORKING CAPITAL BALANCES\nNHS GRAMPIAN CHARITABLE ENDOWMENT FUNDS INTRA GROUP ADJUSTMENTS CONSOLIDATED TOTAL\nNote Opening Closing Net Opening Closing Net Opening Closing Net Opening Closing Net\nBalances Balances Movement Balances Balances Movement Balances Balances Movement Balances Balances Movement\n2022/23 2022/23 2022/23 2022/23 2022/23 2022/23 2022/23 . 2022/23 2022/23 2022/23 2022/23 2022/23\n£000 £7000 £000 £7000 £000 £000 £000 £000 £000 £000 £7000 £7000\nINVENTORIES\nBalance Sheet 7,590 8,073 7,590 8,073\nNet Decrease 483 0 0 (483)\nTRADE AND OTHER RECEIVABLES\nDue within one year 81,227 85,897 126 116 (734) (954) 80,619 85,059\nDue after more than one year 62,938 120,341 62,938 120,341\nLess: Property, Plant & Equipment (Capital) included in above (871) 1 (871) 1\n143,294 206,239 126 116 (734) (954) 142,686 205,401\nNet (Increase)/Decrease 62,945) 10 220 (62,715)\nTRADE AND OTHER PAYABLES\nDue within one year 251,054 194,134 1,002 1,063 (734) (954) 251,322 194,243\nDue after more than one year 40,717 34,691 40,717 34,691\nLess: Property, Plant & Equipment (Capital) included in above (7,110) (10,229) (7,110) (10,229)\nLess: Intangible Assets (Capital) included in above (20) 0 (20) 0\nLess: General Fund Creditor included in above (8,198) (10,412) (8,198) (10,412)\nLess: Lease and PFI Creditors included in above (42,109) (35,694) (42,109) (35,694)\n234,334 172,490 1,002 1,063 (734) (954) 234,602 172,599\nNet Increase/(Decrease) 61,844) 61 220) (62,003)\nPROVISIONS\nBalance Sheet 170,615 225,049 5,015, 5,608 0 0 175,630 230,657\nNet Increase 54,434 593 Qo 55,027\nNET MOVEMENT (Decrease)/Increase (70,838) 664 (!) (70,174)\n112']","£104,268 (£000)","['£104,268 (£000)']",Q_2023_FIN_06,Grampian-2022-2023,LEX,number,[23],skipped
By how much did NHS Grampian's total spending on health and care services grow between 2021/22 and 2022/23?,4.112,"['PERFORMANCE REPORT B PERFORMANCE ANALYSIS The Charity relies upon the generosity of patients, their relatives and friends, who have experienced the care of Grampian Health Board, and other donors who are generous in their support of the Charity. Total income for the year was £4.112 million (2021/22 £2.799 million) and this is analysed between donations, legacies and income from investments in the chart below. NHS Grampian Endowment Funds Income analysis 1,816 1,509 1,314 930 789 734 674 622 600 570 401 0 12 263 255 200 0 0 OTHER COVID NHS CHARITIES CAPITAL LEGACIES INVESTMENT DONATIONS DONATIONS TOGETHER FUNDRAISING 2022/23 2021/22 2020/21 Restated Total expenditure for the year was £4.002 million (2021/22 £2.476 million), £3.471 million relating to grants for charitable activities (2021/22 £2.050 million), £0.334 million on staffing and support costs (2021/22 £0.203 million) and £0.197 million on investment management fees (2021/22 £0.223 million). The net effect was a surplus of income over expenditure for the year of £0.110 million. The charity will continue to work closely with all relevant Health and related services as they re- mobilise and return to a more normal footing, to ensure that available funds are utilised effectively, improving the health and wellbeing of patients and staff in line with the wishes of our', 'payroll of that partner organisation. All Board members deemed to have significant financial responsibility during the year were 9. Exit packages There were 15 exit packages agreed during the year which were compulsory redundancies. 2022/23 2021/22 Exit Package cost band Total number of exit Total number of exit packages by cost band packages by cost band £0 - £10,000 15 0 36 0 10. Expenditure on consultancy Expenditure on external consultancy during 2022/23 was £2,916.69 (2021/22 £24,635.70). NHS Grampian has used 1 consultancy firm during 2022/23 (2 in 2021/22). These suppliers provided consultancy services in a number of areas including capital projects, construction and building infrastructure planning and infection control issues. Consultancy services are used for the provision of specialist expertise which is not available from NHS employment of specialist staff.', 'TABLE_TYPE: scan_table_other\nPAGE: 117\nROTATION: 0\nNHS GRAMPIAN\nANNUAL REPORT AND ACCOUNTS FOR YEAR ENDED 31 MARCH 2023\nFINANCIAL STATEMENTS\nNote 5. SEGMENTAL REPORTING\nSegmental information as required under IFRS has been reported for each sector as follows :\nAberdeen City Aberdeenshire Mental Health & Centrally Managed Nhsg Capital Non Clinical Operational\nH&SCP H&SCP Moray H&SCP_ Learning Disab AME Provisions Dental Servs Charges Services Provisions\n£’000 £’000 £000 £’000 £’000 £’000 £000 £000 £000\nGrampian Health Board Net operating cost 2022/23 203,208 205,995 83,304 47,317 12,719 34,715 33,826 165,081 (7,086)\nPRIOR YEAR\nRestated Grampian Health Board Net operating cost 2021/22 241,574 237,600 101,189 41,202 2,594 30,679 26,910 157,630 (1,579)\nPrimary Care\nPharmacy & Retained Service Dr Grays Family MUSC\nServices Primary Care Public Health Purchasing Hospital Portfolio Portfolio ISCS Portfolio Total\n£000 £7000\nGrampian Health Board Net operating cost 2022/23 32,154 10,953 28,742 (17,982) 41,770 80,032 134,547 319,919 1,409,214\nPRIOR YEAR\nRestated Grampian Health Board Net operating cost 2021/22 30,022 11,434 68,136 (15,500) 36,236 74,233 117,662 292,716 1,452,739\nIn 2022/23 NHS Grampian continued with the portfolio and system leadership approach endorsed by the Board in August 2021 and financial reporting has been developed to mirror this with the addition of\nadditional reporting segments.\n116', 'TABLE_TYPE: financial_core_net_expenditure\nPAGE: 149\nROTATION: 0\nNHS GRAMPIAN\nANNUAL REPORT AND ACCOUNTS FOR YEAR ENDED 31 MARCH 2023\n| FINANCIAL STATEMENTS\nNote 23(a) CONSOLIDATED STATEMENT OF COMPREHENSIVE NET EXPENDITURE FOR YEAR TO 31 MARCH 2023\nStaff Costs 3a\nOther Operating Expenditure 3b\nIndependent Primary Care Services\nDrugs and Medical Supplies\nOther Health Care expenditure\nGross expenditure for the year\nLess : Operating Income 4\nJoint Ventures accounted for on an equity basis\nNet expenditure for the year\nOTHER COMPREHENSIVE NET EXPENDITURE\nNet Loss/(gain) on revaluation of Property Plant and Equipment\nNet Loss/(gain) on revaluation of financial assets\nTotal Comprehensive Net Expenditure/(Income)\nCharitable\nNHS Endowment IntraGroup Aberdeen\nGrampian Funds Adjustments City Aberdeenshire Moray Group Group\n2022/23 ° 2022/23 2022/23 ° 2022/23 2022/23 "" 2022/23 2022/23 2021/22\n£7000 £’000 £’000 £\'000 £\'000 £\'000 £’000 £’000\n904,590 0 0 0 0 0 904,590 849,820\n175,002 0 0 0 0 0 175,002 166,179\n275,536 0 0 0 0 0 275,536 257,501\n954,282 4,002 (2,110) 0 0 0 956,174 999,271\n2,309,410 4,002 (2,110) 0 0 0 2,311,302 2,272,771\n(900,194) (4,112) 2,110 0 0 0 (902,196) (820,835)\n0 0 0 12,123 16,067 6,169 34,359 (36,166)\n1,409,216 (110) 0 12,123 16,067 6,169 1,443,465 1,415,770\n(22,931) 0 0 0 0 0 (22,931) (28,544)\n0° 4,166 0 0 0 0 4,166 (3,064)\n1,386,285 4,056 0 12,123 16,067 6,169 1,424,700 1,384,162\n148', 'B REMUNERATION AND STAFF REPORT Making equality duty an integral part of the way NHS Grampian functions - progress Report for the period April 2019 to March 2022; An NHS Grampian Equal Pay Monitoring Report, June 2022; and An NHS Grampian Equality and Diversity Workforce Monitoring Report 2021/22. NHS Grampian also has a range of other policies developed in partnership with Trade Unions and Professional Organisation representatives to cover all employee matters including health and safety, employee consultation, trade union relationships, employability and pay policy. 8. Off-payroll engagements The use of locum agency medical and nursing staff throughout the year is disclosed in section 2 above. All other staff engaged by NHS Grampian to provide services during the year for a period of longer than six months were remunerated through either NHS Gr university or a local authority, they were remunerated through the payroll of that partner organisation. All Board members deemed to have significant financial responsibility during the year were 9. Exit packages There were 15 exit packages agreed during the year which were compulsory redundancies. 2022/23 2021/22 Exit Package cost band Total number of exit Total number of exit packages by cost band packages by cost band £0 - £10,000 15 0 36 0 10. Expenditure on consultancy']","£1,443 million","['£1,443 million']",Q_2023_FIN_07,Grampian-2022-2023,STR,number,[25],skipped
How did net expenditure in 2022/23 compare to 2021/22?,"£1,443 million","['TABLE_TYPE: financial_core_net_expenditure\nPAGE: 149\nROTATION: 0\nNHS GRAMPIAN\nANNUAL REPORT AND ACCOUNTS FOR YEAR ENDED 31 MARCH 2023\n| FINANCIAL STATEMENTS\nNote 23(a) CONSOLIDATED STATEMENT OF COMPREHENSIVE NET EXPENDITURE FOR YEAR TO 31 MARCH 2023\nStaff Costs 3a\nOther Operating Expenditure 3b\nIndependent Primary Care Services\nDrugs and Medical Supplies\nOther Health Care expenditure\nGross expenditure for the year\nLess : Operating Income 4\nJoint Ventures accounted for on an equity basis\nNet expenditure for the year\nOTHER COMPREHENSIVE NET EXPENDITURE\nNet Loss/(gain) on revaluation of Property Plant and Equipment\nNet Loss/(gain) on revaluation of financial assets\nTotal Comprehensive Net Expenditure/(Income)\nCharitable\nNHS Endowment IntraGroup Aberdeen\nGrampian Funds Adjustments City Aberdeenshire Moray Group Group\n2022/23 ° 2022/23 2022/23 ° 2022/23 2022/23 "" 2022/23 2022/23 2021/22\n£7000 £’000 £’000 £\'000 £\'000 £\'000 £’000 £’000\n904,590 0 0 0 0 0 904,590 849,820\n175,002 0 0 0 0 0 175,002 166,179\n275,536 0 0 0 0 0 275,536 257,501\n954,282 4,002 (2,110) 0 0 0 956,174 999,271\n2,309,410 4,002 (2,110) 0 0 0 2,311,302 2,272,771\n(900,194) (4,112) 2,110 0 0 0 (902,196) (820,835)\n0 0 0 12,123 16,067 6,169 34,359 (36,166)\n1,409,216 (110) 0 12,123 16,067 6,169 1,443,465 1,415,770\n(22,931) 0 0 0 0 0 (22,931) (28,544)\n0° 4,166 0 0 0 0 4,166 (3,064)\n1,386,285 4,056 0 12,123 16,067 6,169 1,424,700 1,384,162\n148', 'PERFORMANCE REPORT B PERFORMANCE ANALYSIS NHS Grampian Integration Joint Total (£million) Boards (£million) (£million) 0.37 Public Health Capacity 0.37 0 3.97 Test & Protect 3.97 0 9.96 Vaccinations 9.96 0 5.15 Workforce & Capacity 2.98 2.16 PPE, Equipment & 6.26 Infection Prevention 5.56 0.7 Social Care & 14.75 Community Capacity 0 14.75 0.03 Primary Care 0 0.03 0.55 Other Miscellaneous 0.22 0.33 Total 23.06 17.97 41.04 3.2.3 Expenditure Analysis Net expenditure for the year was £1,443 million (2021/22 £1,453 million), a decrease of £11 million over the prior year. The Consolidated Statement of Comprehensive Net Expenditure can be found on Page 85, a more detailed analysis of Expenditure in note 3 on Page 114 and a more detailed analysis of income in note 4 on Page 115. Staff Costs increased by £54.7 million mainly due to the annual pay uplift (2021/22 £56 million) which was an average of 4.5% for Medical & Dental staff and 7.5% for Agenda for Change staff and national insurance increases (£4 million), partially offset by a reduction in the annual leave accrual (2021/22 £8.4 million) as staff were able to utilise leave following the pandemic. Drugs and Medical supplies increased by £21 million mainly due to volume and price increases across both primary and secondary', 'PERFORMANCE REPORT B PERFORMANCE ANALYSIS The Charity relies upon the generosity of patients, their relatives and friends, who have experienced the care of Grampian Health Board, and other donors who are generous in their support of the Charity. Total income for the year was £4.112 million (2021/22 £2.799 million) and this is analysed between donations, legacies and income from investments in the chart below. NHS Grampian Endowment Funds Income analysis 1,816 1,509 1,314 930 789 734 674 622 600 570 401 0 12 263 255 200 0 0 OTHER COVID NHS CHARITIES CAPITAL LEGACIES INVESTMENT DONATIONS DONATIONS TOGETHER FUNDRAISING 2022/23 2021/22 2020/21 Restated Total expenditure for the year was £4.002 million (2021/22 £2.476 million), £3.471 million relating to grants for charitable activities (2021/22 £2.050 million), £0.334 million on staffing and support costs (2021/22 £0.203 million) and £0.197 million on investment management fees (2021/22 £0.223 million). The net effect was a surplus of income over expenditure for the year of £0.110 million. The charity will continue to work closely with all relevant Health and related services as they re- mobilise and return to a more normal footing, to ensure that available funds are utilised effectively, improving the health and wellbeing of patients and staff in line with the wishes of our', 'PERFORMANCE REPORT B PERFORMANCE ANALYSIS The overall increase in property value reflects an increase in construction industry prices during the year, impacted by rising demand and a range of economic and geopolitical factors causing supply bottlenecks, labour shortages and increased materials costs. IAS 36 requires that impairments charged to the Statement of Comprehensive Net Expenditure (SOCNE) in prior years should be reversed to offset any subsequent increase in value relating to that particular asset. The net value of impairment reversal on those assets subject to an upward movement in valuation, was £0.657 million (2021/22 £0.403 million impairment) and this was credited to net operating expenditure within the Statement of Comprehensive Net Expenditure. Further information is available in the section on key sources of judgement, estimation and uncertainty in note 1 accounting policies, on Page 90. 3.2.6 Pension Liabilities The accounting policy for pensions is provided in Note 1 to the Accounts and disclosure of the costs is shown within Note 19 and the Remuneration Report. 3.2.7 Infrastructure and Non-Current Assets The Board delivered a programme of infrastructure investment totalling £109.7 million during 2022/23. Within this, a total of £105.605 million of capital expenditure was incurred (see note 7d) and a further £4.05 million was classed as revenue expenditure in nature.', 'Moray IJB 602,821 580,541 461,044 Consolidated Net Assets 3.1.1 Grampian Health Board Endowment Funds Charity (the Charity) The Charity had net assets of £45.252 million at 31 March 2023 (£49.308 million at 31 March 2022). Overall, the funds available to the charity decreased by £4.055 million over the previous year (2021/22 increase of £3.387 million). This decrease related to a net loss on the valuation of investments of £4.165 million (2021/22 gain £3.064 million) combined with a surplus on charitable activities of £0.110 million for the year (2021/22 £0.323 million). The charity had no direct investments in Russian Companies during the year. investment strategy targets investments to deliver sustainable long-term capital growth and consistent income generation, and income generation has been maintained during 2022/23,']","Decreased by £11 million from £1,453 million in 2021/22","['Decreased by £11 million from £1,453 million in 2021/22']",Q_2023_FIN_08,Grampian-2022-2023,LEX,number,[25],skipped
Did NHS Grampian overspend or underspend its Core Revenue Resource Limit in 2022/23?,,"['PERFORMANCE REPORT B PERFORMANCE ANALYSIS Financial flexibility: funding banked with/(provided by) 0 Scottish Government Underlying Surplus against Core Revenue Resource Limit 612 0% Further details on non-core elements of expenditure, typically comprising items of a technical accounting nature, can be found in the Summary of Resource Outturn. The Board is reporting an underspend of £0.612 million against a target of breakeven on the revenue resource limit for 2022/23. A one year financial plan was submitted to Scottish Government by NHS Grampian on 21 March 2022. Due to the impact of the COVID-19 pandemic, the normal Scottish Government three year Annual Operating and financial planning process was amended. NHS Boards were required to submit three year financial plans to the Scottish Government in August 2022 covering the period April 2022 - March 2025. Subsequently there has been a return of formal three year financial planning from 2023-24 with an updated financial plan submitted to the Scottish Government in March 2023 covering the period 2023 - 2026. The Board has also updated the five year Medium Term Financial Strategy. The Core Revenue Resource Limit for 2022/23 was also adjusted to include the £0.131 million surplus carried forward from 2021/22. 3.2.1 Efficiency Savings Efficiency savings of £10.2 million were achieved against a target', 'Health Boards are required to contain their net expenditure within these limits, and report on any variation. Grampian Health Board has successfully achieved all three financial targets for the year reporting an outturn against these set limits as follows: Statutory Financial Targets Limit as set Actual Variance by SGHSCD Outturn (Deficit)/Sur plus Core Revenue Resource Limit 1,292,491 1,291,879 612 Non-Core Revenue Resource Limit 46,200 46,200 - Total Revenue Resource Limit 1,338,691 1,338,079 612 Core Capital Resource Limit 104,268 104,268 - Non-Core Capital Resource Limit 1,068 1,068 - Total Capital Resource Limit 105,336 105,336 - Cash Requirement 1,546,903 1,546,903 - Memorandum for In Year Out-turn £000', 'PERFORMANCE REPORT B PERFORMANCE ANALYSIS 3.2 Grampian Health Board performance against statutory financial targets The results of each of the partner organisations, although consolidated with the main Board accounts for group accounting purposes, do not form part of the statutory financial target set for NHS Boards by the Scottish Government Health and Social Care Directorates (SGHSCD) and are, therefore, not taken in to account when considering the rmance. NHS Boards have the ability to manage small under/overspends (within 1% of resource) within an overall breakeven position across a three year period (2022-25). The Scottish Government require NHS Boards to meet three key financial targets: Revenue Resource Limit (RRL) a resource budget for ongoing activity; Capital Resource Limit (CRL) a resource budget for net capital investment; and Cash Requirement a financing requirement to fund the cash consequences of ongoing activity and net capital investment. Health Boards are required to contain their net expenditure within these limits, and report on any variation. Grampian Health Board has successfully achieved all three financial targets for the year reporting an outturn against these set limits as follows: Statutory Financial Targets Limit as set Actual Variance by SGHSCD Outturn (Deficit)/Sur plus Core Revenue Resource Limit 1,292,491 1,291,879 612 Non-Core Revenue Resource Limit 46,200 46,200 - Total', 'planning from 2023-24 with an updated financial plan submitted to the Scottish Government in March 2023 covering the period 2023 - 2026. The Board has also updated the five year Medium Term Financial Strategy. The Core Revenue Resource Limit for 2022/23 was also adjusted to include the £0.131 million surplus carried forward from 2021/22. 3.2.1 Efficiency Savings Efficiency savings of £10.2 million were achieved against a target of £5.4 million for NHS Grampian services. The main savings achieved were in the areas of travel costs, review of old orders, reduction of untaken annual leave accrual, procurement, cross boundary charges and skill mix in non-clinical areas. Recurring savings amounted to £2.5 million and non-recurring of £7.7 million. 3.2.2 Financial impact of the COVID-19 Pandemic The impact of the pandemic was less severe on services in 2022/23 than in 2021/22 but significant costs were still incurred across a range of services, including the COVID vaccination programme and the provision of sustainability payments to social care providers. Expenditure of £23.1 million was incurred on non-delegated Board services. The main areas incurring additional costs were in additional Personal Protective equipment, vaccinations programmes, testing and contact tracing and staffing and other costs to support infection control measures. The level of expenditure was fully funded by', 'The Accounts are prepared on a historical cost basis, as modified by the revaluation of property, plant and equipment, intangible assets, inventories and financial assets and liabilities (including derivative instruments) at fair value as determined by the relevant accounting standards and the FReM. 6) Funding 6 (a) Grampian Health Board Most of the expenditure of the Health Board as Commissioner is met from funds advanced by the Scottish Government within an approved revenue resource limit (RRL). Cash drawn down to fund expenditure within this approved revenue resource limit is credited to the general fund. All other income receivable by the board that is not classed as funding is recognised when the transfer of goods or services (the performance obligation) is satisfied. Where income is received for goods or services that will not be delivered in the current financial year, that income is deferred. Income from the sale of non-current assets is recognised only when all material conditions of sale have been met, and is measured as the sums due under the sale contract. Non-discretionary funding out-with the RRL is allocated to match actual expenditure incurred for the provision of specific pharmaceutical, dental or ophthalmic services identified by the Scottish Government. Non-discretionary expenditure is disclosed in the accounts and deducted from']",Underspend of £0.612 million against a target of breakeven,['Underspend of £0.612 million against a target of breakeven'],Q_2023_FIN_P1,Grampian-2022-2023,MOD,text,[24],skipped
How much in efficiency savings did NHS Grampian deliver in 2022/23?,24,"['planning from 2023-24 with an updated financial plan submitted to the Scottish Government in March 2023 covering the period 2023 - 2026. The Board has also updated the five year Medium Term Financial Strategy. The Core Revenue Resource Limit for 2022/23 was also adjusted to include the £0.131 million surplus carried forward from 2021/22. 3.2.1 Efficiency Savings Efficiency savings of £10.2 million were achieved against a target of £5.4 million for NHS Grampian services. The main savings achieved were in the areas of travel costs, review of old orders, reduction of untaken annual leave accrual, procurement, cross boundary charges and skill mix in non-clinical areas. Recurring savings amounted to £2.5 million and non-recurring of £7.7 million. 3.2.2 Financial impact of the COVID-19 Pandemic The impact of the pandemic was less severe on services in 2022/23 than in 2021/22 but significant costs were still incurred across a range of services, including the COVID vaccination programme and the provision of sustainability payments to social care providers. Expenditure of £23.1 million was incurred on non-delegated Board services. The main areas incurring additional costs were in additional Personal Protective equipment, vaccinations programmes, testing and contact tracing and staffing and other costs to support infection control measures. The level of expenditure was fully funded by', 'we have already made will provide a greater level of care in our communities and build on the excellent foundations established through the integration of health and social care. Our operational performance has been impacted by the health debt generated over the last three years, however, I am pleased that during the financial year 2022/23 we have been able to balance our revenue budget using one-off income and savings. This income and savings will unfortunately not be available in future years and I do not underestimate the challenge facing NHS Grampian in balancing future budgets. In this regard a significant amount of work has been undertaken during the last quarter of 2022/23 to prepare a local value and sustainability programme. The purpose of this programme is to develop and deliver short term efficiency savings and over the medium to longer term work on how we make sustainable services and pathways of care. During this period of preparing for the future your input and support will be important, and I would thank you in advance for working with colleagues and services as we make the necessary changes over the coming months. It is a privilege to be the Chief Executive at this time and I am incredibly grateful for your support.', 'PERFORMANCE REPORT B PERFORMANCE ANALYSIS Financial flexibility: funding banked with/(provided by) 0 Scottish Government Underlying Surplus against Core Revenue Resource Limit 612 0% Further details on non-core elements of expenditure, typically comprising items of a technical accounting nature, can be found in the Summary of Resource Outturn. The Board is reporting an underspend of £0.612 million against a target of breakeven on the revenue resource limit for 2022/23. A one year financial plan was submitted to Scottish Government by NHS Grampian on 21 March 2022. Due to the impact of the COVID-19 pandemic, the normal Scottish Government three year Annual Operating and financial planning process was amended. NHS Boards were required to submit three year financial plans to the Scottish Government in August 2022 covering the period April 2022 - March 2025. Subsequently there has been a return of formal three year financial planning from 2023-24 with an updated financial plan submitted to the Scottish Government in March 2023 covering the period 2023 - 2026. The Board has also updated the five year Medium Term Financial Strategy. The Core Revenue Resource Limit for 2022/23 was also adjusted to include the £0.131 million surplus carried forward from 2021/22. 3.2.1 Efficiency Savings Efficiency savings of £10.2 million were achieved against a target', 'PERFORMANCE REPORT A OVERVIEW 4. Stabilisation, Living with COVID and Creating Conditions for Change Over the last three years the organisation, like other organisations have continued to respond to COVID-19, have taken steps to recover from the impacts whilst considering how we stabilise and transform to ensure sustainable health and care services in both the short and longer term. Our approach and key priorities for taking this forward are contained within the NHS Grampian Delivery Plan for 2022/23 which was adopted by the Board in October 2022. The Grampian Delivery Plan covering the period August 2022 to March 2023 has been developed jointly with our three Health and Social Care Partnerships, colleagues, citizens and wider partners. Given the ongoing high pressures experienced across the health and care system and the negative impact this is having on both those accessing and delivering services, the Board has deliberately focused on three specific objectives, underpinned by a number of priority actions. The priorities aim to make the biggest impact in relation to stabilisation, navigating winter well and creating the conditions to deliver the significant changes required to achieve the ambitions set out in our strategy - Plan for the Future 2022-28 This Plan responds to the six priorities set out in the Scottish', 'PERFORMANCE REPORT A OVERVIEW 1. Purpose This Overview aims to provide the reader with sufficient information to understand the purpose of the NHS Grampian, the key risks to the achievement of its objectives and how it has performed during the year. Should you wish to find out more detailed information we have provided this in the rest of the Performance Report, the Accountability Report and the financial statements. NHS Grampian publishes a wide range of information on its services and activities on its website which you can find at: https://www.nhsgrampian.org/ 2. Statement from the Chief Executive Looking back on 2022/23, I am proud of our achievements, as a health and care system. This has been enabled by the continued support of our colleagues, partners and the public during an exceptional period of uncertainty and challenge for us all. I am extremely grateful for everything that people in communities across Grampian have done and continue to do to support each other and NHS Grampian and all those providing care services on our behalf. We are also thankful for the patience, kind messages and gratitude shown, which has lifted our colleagues during a very busy and difficult time. However, I know the significant impact this year has had and continues to have']",£10.2 million,['£10.2 million'],Q_2023_SAV_01,Grampian-2022-2023,MOD,number,[24],skipped
What was the efficiency savings target for 2022/23?,3.2.1 Efficiency Savings Efficiency savings of £10.2 million were achieved against a target of £5.4 million for NHS Grampian services.,"['planning from 2023-24 with an updated financial plan submitted to the Scottish Government in March 2023 covering the period 2023 - 2026. The Board has also updated the five year Medium Term Financial Strategy. The Core Revenue Resource Limit for 2022/23 was also adjusted to include the £0.131 million surplus carried forward from 2021/22. 3.2.1 Efficiency Savings Efficiency savings of £10.2 million were achieved against a target of £5.4 million for NHS Grampian services. The main savings achieved were in the areas of travel costs, review of old orders, reduction of untaken annual leave accrual, procurement, cross boundary charges and skill mix in non-clinical areas. Recurring savings amounted to £2.5 million and non-recurring of £7.7 million. 3.2.2 Financial impact of the COVID-19 Pandemic The impact of the pandemic was less severe on services in 2022/23 than in 2021/22 but significant costs were still incurred across a range of services, including the COVID vaccination programme and the provision of sustainability payments to social care providers. Expenditure of £23.1 million was incurred on non-delegated Board services. The main areas incurring additional costs were in additional Personal Protective equipment, vaccinations programmes, testing and contact tracing and staffing and other costs to support infection control measures. The level of expenditure was fully funded by', 'PERFORMANCE REPORT B PERFORMANCE ANALYSIS Financial flexibility: funding banked with/(provided by) 0 Scottish Government Underlying Surplus against Core Revenue Resource Limit 612 0% Further details on non-core elements of expenditure, typically comprising items of a technical accounting nature, can be found in the Summary of Resource Outturn. The Board is reporting an underspend of £0.612 million against a target of breakeven on the revenue resource limit for 2022/23. A one year financial plan was submitted to Scottish Government by NHS Grampian on 21 March 2022. Due to the impact of the COVID-19 pandemic, the normal Scottish Government three year Annual Operating and financial planning process was amended. NHS Boards were required to submit three year financial plans to the Scottish Government in August 2022 covering the period April 2022 - March 2025. Subsequently there has been a return of formal three year financial planning from 2023-24 with an updated financial plan submitted to the Scottish Government in March 2023 covering the period 2023 - 2026. The Board has also updated the five year Medium Term Financial Strategy. The Core Revenue Resource Limit for 2022/23 was also adjusted to include the £0.131 million surplus carried forward from 2021/22. 3.2.1 Efficiency Savings Efficiency savings of £10.2 million were achieved against a target', 'we have already made will provide a greater level of care in our communities and build on the excellent foundations established through the integration of health and social care. Our operational performance has been impacted by the health debt generated over the last three years, however, I am pleased that during the financial year 2022/23 we have been able to balance our revenue budget using one-off income and savings. This income and savings will unfortunately not be available in future years and I do not underestimate the challenge facing NHS Grampian in balancing future budgets. In this regard a significant amount of work has been undertaken during the last quarter of 2022/23 to prepare a local value and sustainability programme. The purpose of this programme is to develop and deliver short term efficiency savings and over the medium to longer term work on how we make sustainable services and pathways of care. During this period of preparing for the future your input and support will be important, and I would thank you in advance for working with colleagues and services as we make the necessary changes over the coming months. It is a privilege to be the Chief Executive at this time and I am incredibly grateful for your support.', 'PERFORMANCE REPORT B PERFORMANCE ANALYSIS Performance Psychological Therapies performance has not met the 90% target during 2022/23 2.2 Hospital Occupancy Occupancy levels across hospital sites has continued at high levels through the year, reflecting the whole system pressures that have been experienced. The diagram below highlights the bed capacity pressures at ARI over the last year compared to previous years. Source: Tableau (Hospital Occupancy)', 'a valuation was carried out as at 31 March 2016, work on the cost cap valuation was suspended by the UK Government following the decision by the Court of Appeal (McCloud provided as part of the 2015 reforms unlawfully discriminated on the grounds of age. Following consultation and an announcement in February 2021 on proposals to remedy the discrimination, the UK Government confirmed that the cost control element of the 2016 valuations could be completed. The UK Government has also asked the Government Actuary to review whether, and to what extent, the cost control mechanism is meeting its The interim report is complete (restricted) and is currently being finalised with a consultation. Alongside these announcements, the UK Government confirmed that current employer contribution rates would stay in force until 1 April 2024. employer contributions paid in 2021-22. From 1 April 2022 all NHS members will become members of the 2015 pension scheme and the pre-reform schemes will be closed to any further pension build-up. Eligible members who choose to retire after 1 April 2022, will be entitled to both legacy and reformed scheme benefits. The new NHS Pension Scheme (Scotland) 2015 From 1 April 2015 the NHS Pension Scheme (Scotland) 2015 was introduced. This scheme is a Career Average Re-valued']",£5.4 million,['£5.4 million'],Q_2023_SAV_02,Grampian-2022-2023,LEX,number,[24],skipped
What portion of the 2022/23 efficiency savings were of a recurring nature?,3.2.1 Efficiency Savings Efficiency savings of £10.2 million were achieved against a target of £5.4 million for NHS Grampian services.,"['planning from 2023-24 with an updated financial plan submitted to the Scottish Government in March 2023 covering the period 2023 - 2026. The Board has also updated the five year Medium Term Financial Strategy. The Core Revenue Resource Limit for 2022/23 was also adjusted to include the £0.131 million surplus carried forward from 2021/22. 3.2.1 Efficiency Savings Efficiency savings of £10.2 million were achieved against a target of £5.4 million for NHS Grampian services. The main savings achieved were in the areas of travel costs, review of old orders, reduction of untaken annual leave accrual, procurement, cross boundary charges and skill mix in non-clinical areas. Recurring savings amounted to £2.5 million and non-recurring of £7.7 million. 3.2.2 Financial impact of the COVID-19 Pandemic The impact of the pandemic was less severe on services in 2022/23 than in 2021/22 but significant costs were still incurred across a range of services, including the COVID vaccination programme and the provision of sustainability payments to social care providers. Expenditure of £23.1 million was incurred on non-delegated Board services. The main areas incurring additional costs were in additional Personal Protective equipment, vaccinations programmes, testing and contact tracing and staffing and other costs to support infection control measures. The level of expenditure was fully funded by', 'PERFORMANCE REPORT B PERFORMANCE ANALYSIS Financial flexibility: funding banked with/(provided by) 0 Scottish Government Underlying Surplus against Core Revenue Resource Limit 612 0% Further details on non-core elements of expenditure, typically comprising items of a technical accounting nature, can be found in the Summary of Resource Outturn. The Board is reporting an underspend of £0.612 million against a target of breakeven on the revenue resource limit for 2022/23. A one year financial plan was submitted to Scottish Government by NHS Grampian on 21 March 2022. Due to the impact of the COVID-19 pandemic, the normal Scottish Government three year Annual Operating and financial planning process was amended. NHS Boards were required to submit three year financial plans to the Scottish Government in August 2022 covering the period April 2022 - March 2025. Subsequently there has been a return of formal three year financial planning from 2023-24 with an updated financial plan submitted to the Scottish Government in March 2023 covering the period 2023 - 2026. The Board has also updated the five year Medium Term Financial Strategy. The Core Revenue Resource Limit for 2022/23 was also adjusted to include the £0.131 million surplus carried forward from 2021/22. 3.2.1 Efficiency Savings Efficiency savings of £10.2 million were achieved against a target', 'we have already made will provide a greater level of care in our communities and build on the excellent foundations established through the integration of health and social care. Our operational performance has been impacted by the health debt generated over the last three years, however, I am pleased that during the financial year 2022/23 we have been able to balance our revenue budget using one-off income and savings. This income and savings will unfortunately not be available in future years and I do not underestimate the challenge facing NHS Grampian in balancing future budgets. In this regard a significant amount of work has been undertaken during the last quarter of 2022/23 to prepare a local value and sustainability programme. The purpose of this programme is to develop and deliver short term efficiency savings and over the medium to longer term work on how we make sustainable services and pathways of care. During this period of preparing for the future your input and support will be important, and I would thank you in advance for working with colleagues and services as we make the necessary changes over the coming months. It is a privilege to be the Chief Executive at this time and I am incredibly grateful for your support.', 'Moray IJB reported a deficit for the year of £12.338 million (2021/22 surplus £10.679 million) decreasing the retained reserves carried forward to £4.683 million (2021/22 £17.021 million). The core deficit is due to the recurring deficit from the start of the MIJB. The recurring deficit has increased this year mainly due to the increase in prescribing and the cost of care packages. The reserves are as follows: General reserves of £0 million ( 2021/22 £1.257 million) towards the impact of unexpected events or emergencies; and Earmarked reserves of £4.683 million (2021/22 £15.764 million) due to the allocation', 'PERFORMANCE REPORT B PERFORMANCE ANALYSIS 2012, as amended, and published reports including the following key updates on progress in 2022/23. a) NHS Grampian Equality Outcomes Update Report 2021 to 2025, as at February 2023 This Report give a 2 year update on progress to achieve the objectives set out in the 4 year Equality Outcomes Report. The Update can be found at: https://www.nhsgrampian.org/about-us/equality-and-diversity/equality-outcomes/ b) NHS Grampian Equality and Diversity Workforce Monitoring Report in June 2022 This comprises o Applicants for posts, shortlisted candidates and those offered posts o The ethnic makeup of the NHS Grampian workforce o Leavers and new starts o Training opportunities o Promotions o Disciplinary action o Information on the Gender balance for qualifying non-Executive Health Board posts. This details what NHS Grampian has done in the last 2 years to make equality and diversity an integral part of the way we function as an organisation. The involvement and consultation requirements for each report were met in full. The Reports are available on the NHS Grampian website, to facilitate public scrutiny, as required by law. NHS Grampian has also published a range of other non-Statutory Equality and Diversity Monitoring Reports on a wide range of topics. Equality and Diversity Staff Training During 2022/23, 1,987 NHS Grampian staff']",£2.5 million,['£2.5 million'],Q_2023_SAV_03,Grampian-2022-2023,MOD,number,[24],skipped
How much of the 2022/23 efficiency savings were non-recurring?,24,"['planning from 2023-24 with an updated financial plan submitted to the Scottish Government in March 2023 covering the period 2023 - 2026. The Board has also updated the five year Medium Term Financial Strategy. The Core Revenue Resource Limit for 2022/23 was also adjusted to include the £0.131 million surplus carried forward from 2021/22. 3.2.1 Efficiency Savings Efficiency savings of £10.2 million were achieved against a target of £5.4 million for NHS Grampian services. The main savings achieved were in the areas of travel costs, review of old orders, reduction of untaken annual leave accrual, procurement, cross boundary charges and skill mix in non-clinical areas. Recurring savings amounted to £2.5 million and non-recurring of £7.7 million. 3.2.2 Financial impact of the COVID-19 Pandemic The impact of the pandemic was less severe on services in 2022/23 than in 2021/22 but significant costs were still incurred across a range of services, including the COVID vaccination programme and the provision of sustainability payments to social care providers. Expenditure of £23.1 million was incurred on non-delegated Board services. The main areas incurring additional costs were in additional Personal Protective equipment, vaccinations programmes, testing and contact tracing and staffing and other costs to support infection control measures. The level of expenditure was fully funded by', 'PERFORMANCE REPORT B PERFORMANCE ANALYSIS Financial flexibility: funding banked with/(provided by) 0 Scottish Government Underlying Surplus against Core Revenue Resource Limit 612 0% Further details on non-core elements of expenditure, typically comprising items of a technical accounting nature, can be found in the Summary of Resource Outturn. The Board is reporting an underspend of £0.612 million against a target of breakeven on the revenue resource limit for 2022/23. A one year financial plan was submitted to Scottish Government by NHS Grampian on 21 March 2022. Due to the impact of the COVID-19 pandemic, the normal Scottish Government three year Annual Operating and financial planning process was amended. NHS Boards were required to submit three year financial plans to the Scottish Government in August 2022 covering the period April 2022 - March 2025. Subsequently there has been a return of formal three year financial planning from 2023-24 with an updated financial plan submitted to the Scottish Government in March 2023 covering the period 2023 - 2026. The Board has also updated the five year Medium Term Financial Strategy. The Core Revenue Resource Limit for 2022/23 was also adjusted to include the £0.131 million surplus carried forward from 2021/22. 3.2.1 Efficiency Savings Efficiency savings of £10.2 million were achieved against a target', 'we have already made will provide a greater level of care in our communities and build on the excellent foundations established through the integration of health and social care. Our operational performance has been impacted by the health debt generated over the last three years, however, I am pleased that during the financial year 2022/23 we have been able to balance our revenue budget using one-off income and savings. This income and savings will unfortunately not be available in future years and I do not underestimate the challenge facing NHS Grampian in balancing future budgets. In this regard a significant amount of work has been undertaken during the last quarter of 2022/23 to prepare a local value and sustainability programme. The purpose of this programme is to develop and deliver short term efficiency savings and over the medium to longer term work on how we make sustainable services and pathways of care. During this period of preparing for the future your input and support will be important, and I would thank you in advance for working with colleagues and services as we make the necessary changes over the coming months. It is a privilege to be the Chief Executive at this time and I am incredibly grateful for your support.', 'member of an IJB that required disclosure in the accounts under IAS 24. 9. Disclosure of Information to Auditor The directors who held office at the date of approval of this Directors Report confirm that, so far as they are each aware, there is no relevan auditor is unaware; and each director has taken all the steps that he/she ought reasonably to have taken as a director to make himself/herself aware of any relevant audit information s auditor is aware of that information. 10. Remuneration for Non-Audit Work Grant Thornton UK LLP -audit work during 2022/23 (2021/22 n/a). PricewaterhouseCoopers LLP who provide an Internal Audit Service to NHS Grampian received no fees for non-audit work during 2022/23 (2021/22 £0). 11. Public Services Reform (Scotland) Act 2010 Sections 31 and 32 of the Public Services Reform (Scotland) Act 2010 impose duties on NHS Grampian to publish information on expenditure, economic sustainability and efficiency as soon as is reasonably practicable after the end of each financial year. The information required to comply with these disclosure requirements is not an integral part of the Annual', 'payroll of that partner organisation. All Board members deemed to have significant financial responsibility during the year were 9. Exit packages There were 15 exit packages agreed during the year which were compulsory redundancies. 2022/23 2021/22 Exit Package cost band Total number of exit Total number of exit packages by cost band packages by cost band £0 - £10,000 15 0 36 0 10. Expenditure on consultancy Expenditure on external consultancy during 2022/23 was £2,916.69 (2021/22 £24,635.70). NHS Grampian has used 1 consultancy firm during 2022/23 (2 in 2021/22). These suppliers provided consultancy services in a number of areas including capital projects, construction and building infrastructure planning and infection control issues. Consultancy services are used for the provision of specialist expertise which is not available from NHS employment of specialist staff.']",£7.7 million,['£7.7 million'],Q_2023_SAV_04,Grampian-2022-2023,LEX,number,[24],skipped
What were the main sources of efficiency savings in 2022/23?,3.2.1 Efficiency Savings Efficiency savings of £10.2 million were achieved against a target of £5.4 million for NHS Grampian services.,"['planning from 2023-24 with an updated financial plan submitted to the Scottish Government in March 2023 covering the period 2023 - 2026. The Board has also updated the five year Medium Term Financial Strategy. The Core Revenue Resource Limit for 2022/23 was also adjusted to include the £0.131 million surplus carried forward from 2021/22. 3.2.1 Efficiency Savings Efficiency savings of £10.2 million were achieved against a target of £5.4 million for NHS Grampian services. The main savings achieved were in the areas of travel costs, review of old orders, reduction of untaken annual leave accrual, procurement, cross boundary charges and skill mix in non-clinical areas. Recurring savings amounted to £2.5 million and non-recurring of £7.7 million. 3.2.2 Financial impact of the COVID-19 Pandemic The impact of the pandemic was less severe on services in 2022/23 than in 2021/22 but significant costs were still incurred across a range of services, including the COVID vaccination programme and the provision of sustainability payments to social care providers. Expenditure of £23.1 million was incurred on non-delegated Board services. The main areas incurring additional costs were in additional Personal Protective equipment, vaccinations programmes, testing and contact tracing and staffing and other costs to support infection control measures. The level of expenditure was fully funded by', 'PERFORMANCE REPORT B PERFORMANCE ANALYSIS Financial flexibility: funding banked with/(provided by) 0 Scottish Government Underlying Surplus against Core Revenue Resource Limit 612 0% Further details on non-core elements of expenditure, typically comprising items of a technical accounting nature, can be found in the Summary of Resource Outturn. The Board is reporting an underspend of £0.612 million against a target of breakeven on the revenue resource limit for 2022/23. A one year financial plan was submitted to Scottish Government by NHS Grampian on 21 March 2022. Due to the impact of the COVID-19 pandemic, the normal Scottish Government three year Annual Operating and financial planning process was amended. NHS Boards were required to submit three year financial plans to the Scottish Government in August 2022 covering the period April 2022 - March 2025. Subsequently there has been a return of formal three year financial planning from 2023-24 with an updated financial plan submitted to the Scottish Government in March 2023 covering the period 2023 - 2026. The Board has also updated the five year Medium Term Financial Strategy. The Core Revenue Resource Limit for 2022/23 was also adjusted to include the £0.131 million surplus carried forward from 2021/22. 3.2.1 Efficiency Savings Efficiency savings of £10.2 million were achieved against a target', 'we have already made will provide a greater level of care in our communities and build on the excellent foundations established through the integration of health and social care. Our operational performance has been impacted by the health debt generated over the last three years, however, I am pleased that during the financial year 2022/23 we have been able to balance our revenue budget using one-off income and savings. This income and savings will unfortunately not be available in future years and I do not underestimate the challenge facing NHS Grampian in balancing future budgets. In this regard a significant amount of work has been undertaken during the last quarter of 2022/23 to prepare a local value and sustainability programme. The purpose of this programme is to develop and deliver short term efficiency savings and over the medium to longer term work on how we make sustainable services and pathways of care. During this period of preparing for the future your input and support will be important, and I would thank you in advance for working with colleagues and services as we make the necessary changes over the coming months. It is a privilege to be the Chief Executive at this time and I am incredibly grateful for your support.', 'incurred across a range of services, including the COVID vaccination programme and the provision of sustainability payments to social care providers. Expenditure of £23.1 million was incurred on non-delegated Board services. The main areas incurring additional costs were in additional Personal Protective equipment, vaccinations programmes, testing and contact tracing and staffing and other costs to support infection control measures. The level of expenditure was fully funded by the Scottish Government. 0 million (2021/22 £62.4 million). The largest element of this was on support payments for Social Care providers. The expenditure was funded from the earmarked Covid reserve held by', 'PERFORMANCE REPORT B PERFORMANCE ANALYSIS 2012, as amended, and published reports including the following key updates on progress in 2022/23. a) NHS Grampian Equality Outcomes Update Report 2021 to 2025, as at February 2023 This Report give a 2 year update on progress to achieve the objectives set out in the 4 year Equality Outcomes Report. The Update can be found at: https://www.nhsgrampian.org/about-us/equality-and-diversity/equality-outcomes/ b) NHS Grampian Equality and Diversity Workforce Monitoring Report in June 2022 This comprises o Applicants for posts, shortlisted candidates and those offered posts o The ethnic makeup of the NHS Grampian workforce o Leavers and new starts o Training opportunities o Promotions o Disciplinary action o Information on the Gender balance for qualifying non-Executive Health Board posts. This details what NHS Grampian has done in the last 2 years to make equality and diversity an integral part of the way we function as an organisation. The involvement and consultation requirements for each report were met in full. The Reports are available on the NHS Grampian website, to facilitate public scrutiny, as required by law. NHS Grampian has also published a range of other non-Statutory Equality and Diversity Monitoring Reports on a wide range of topics. Equality and Diversity Staff Training During 2022/23, 1,987 NHS Grampian staff']","Travel costs, review of old orders, reduction of untaken annual leave accrual, procurement, cross boundary charges and skill mix in non-clinical areas","['Travel costs, review of old orders, reduction of untaken annual leave accrual, procurement, cross boundary charges and skill mix in non-clinical areas']",Q_2023_SAV_P1,Grampian-2022-2023,MOD,text,[24],skipped
"What was the overall financial outcome for Aberdeen City's integrated partnership in 2022/23, and how had its financial buffer changed?",24.246,"['Aberdeen City IJB reported an overall deficit of £24.246 million for the year (2021/22 surplus £33.156 million), reducing the retained reserves carried forward to £27.146 million (2021/22 £51.392 million). This reflects: A general risk fund of £2.5 million ( 2021/22 £2.5 million) towards the impact of unexpected events or emergencies; and Earmarked reserves of £24.646 million (2021/22 £48.892 million) due to the allocation', 'operating model aimed at strengthening integration between hospital and community based services was introduced in shadow form in April 2021 and subsequently endorsed by the Board in August 2021. Services are delivered based on a portfolio management structure covering Family services, Surgical and Clinical Support Services, Medical and Unscheduled Care, Mental Health and wellbeing, Population Health and services in Moray. The portfolio arrangements also include, a range of Primary and Community Care services delegated to the three Integration Joint Boards (IJBs) covering Aberdeen City, Aberdeenshire and Moray. All our direct clinical services are supported by corporate functions such as Facilities, E- Health, Finance and Human Resources. The IJBs are legally constituted cross-sector bodies providing a focus for NHS Grampian to work in partnership with other agencies, including Local Authorities and Primary Healthcare contractors, in the provision of integrated services to the local communities. Executive Director and Non-Executive members of the NHS Grampian Board are members of the Integration Joint Boards which provide the strategic direction for the integration of adult health and social care.', 'NHS GRAMPIAN ANNUAL REPORT AND ACCOUNTS FOR YEAR ENDED 31 MARCH 2023 | ACCOUNTABILITY REPORT A CORPORATE GOVERNANCE REPORT Our Plan for the Future “Healthier Together 2022 — 2028” Childrenare given the best start, to live healthy, happy lives No citizens in Grampian will beleft behind Population Health Portfolio Exec Lead: Susan Webb Exec Lead: Exec Lead: Exec Lead: Exec Lead: Exec Lead: Exec Lead: Geraldine Fraser Paul Bachoo Sandra Macleod Sandra Macleod Pamela Milliken Simon Bokor-Ingram Shared PortfolioObjectives and Outcomes <——<p Shared PortfolioObjectivesand Outcomes <—q—_—_—<g Shared Portfolio Objectives and Outcomes Aberdeenshire Services Portfolio Aberdeen City & Mental Health/ Learning Disability Portfolio Adult Medical/ Unscheduled Care Integrated Integrated Family Specialist Care Portfolio Services Portfolio Portfolio f= Aberdeenshire Services Dr Gray’s ff : Mental Health / Women & Children Surgery /CSS Medicine / Unscheduled Learning Disability me 52', 'is provided in Note 1 to the Accounts and disclosure of the costs is shown within Note 19 and the Remuneration Report. 3.2.7 Infrastructure and Non-Current Assets The Board delivered a programme of infrastructure investment totalling £109.7 million during 2022/23. Within this, a total of £105.605 million of capital expenditure was incurred (see note 7d) and a further £4.05 million was classed as revenue expenditure in nature. The overall programme was resourced using a combination of capital funding from the SGHSCD (£104.3 million, see note 7d), income from donations (£0.3 million), financial transactions funding from the Scottish Government for a GP sustainability Loan (£0.7 million), NBV benefit from disposal of equipment (£0.26 million) and various revenue funding sources (£4.05 million) Major investments during the year include: Ongoing Construction of the Baird Family Hospital and the ANCHOR Cancer Centre (£85.1 million) with ANCHOR due to open in 2023/24 and Baird the following year. The Baird Family Hospital will replace the existing maternity hospital, breast screening, gynaecology and neo-natal facilities. The Anchor Cancer centre will be located adjacent to the existing radiotherapy building on the Aberdeen Royal Infirmary site. Forecast expenditure £261.1 million with expenditure to 31 March 2023 £150.8 million. Ongoing design and development costs in support of the National Treatment', 'Aberdeen City, 500 in Aberdeenshire and a further 2,000 are expected in 2023/24. A great deal of work has been ongoing to meet the needs of recent refugees and asylum seekers We have provided multi-lingual presentations in their hotels and have explained about NHS services and how and supported by translated materials. Appropriate information and healthcare support has also been provided to these groups, in co-operation with Aberdeen Health and Social Care Partnership (HSCP). We have included the topic of social cohesion at every training session for the last 6 years. Consultation and involvement events with our local ethnic minority communities Since 2008, NHS Grampian has carried out at least 5 involvement and consultation events with our local ethnic communities every year. These have been carried out on a joint basis with the Grampian Regional Equality Council. On average, over 170 members of our local ethnic communities have attended. The events are advertised and presented in over 14 different local ethnic community languages. Our research has shown that over 95% of our local ethnic community members are non-English speaking when they first arrive in Grampian. Due to COVID-19, the involvement and consultation events since 2020 have gone online, but have still continued. It events in October 2023. This work is']",£24.246 million,['£24.246 million'],Q_2023_IJB_01,Grampian-2022-2023,STR,number,[21],skipped
What was the Core Revenue Resource Limit for NHS Grampian in 2023/24?,"NHS Grampian’s 2023/24 performance against these three key financial targets is shown in the table below: Statutory Financial Targets Limit as set Actual Variance by SGHSCD Outturn (Deficit)/Sur plus £000’s £000’s £000’s 1,440,632 1,440,535","['consequences of ongoing activity and net capital investment. Health Boards are required to contain their net expenditure within these limits, and report on any variation. NHS Grampian’s 2023/24 performance against these three key financial targets is shown in the table below: Statutory Financial Targets Limit as set Actual Variance by SGHSCD Outturn (Deficit)/Sur plus £000’s £000’s £000’s 1,440,632 1,440,535 97 Core Revenue Resource Limit 48,416 48,416 0 Non-Core Revenue Resource Limit 1,489,048 1,488,951 97 Total Revenue Resource Limit Core Capital Resource Limit 113,641 113,641 - Non-Core Capital Resource Limit 3,465 3,465 - Total Capital Resource Limit 117,106 117,106 - Cash Requirement 1,649,045 1,649,045 -', 'support, the Board’s final outturn would have been an overspend of £24.703 million (equivalent to 1.66% of the Revenue Resource Limit). A surplus of £0.97 million against the Core Revenue Resource Limit is reported for 2023/24 reflecting this financial support. In November 2023, Scottish Government also informed NHS Grampian that the Board had been escalated from Stage 1 to Stage 2 of the NHS Scotland Support and Intervention Framework as a result of the Board’s financial position. This means that scheduled engagement and review of performance between the Scottish Government and the Board will continue through the usual channels. NHS Grampian submitted its 2024/25 Financial Plan to the Scottish Government in March 2024. The plan does not present a break-even position, recognising the significant work to', 'PERFORMANCE REPORT B PERFORMANCE ANALYSIS Memorandum for In Year Out-turn £000 Core Revenue Resource Variance Surplus in 2023/24 97 Financial flexibility: funding banked with/(provided by) -24,800 Scottish Government Underlying Deficit against Core Revenue Resource Limit -24,703 1.66% Further details on non-core elements of expenditure, typically comprising items of a technical accounting nature, can be found in the Summary of Resource Outturn. NHS Grampian was not able to set a balanced revenue budget for the 2023/24 financial year. The financial plan submitted to Scottish Government in March 2023 projected a £60.627 million deficit for the year after assuming savings achievement for the year of £16.557 million. Scottish Government confirmed additional funding for Health Boards in May which reduced the projected deficit to £42.936 million and further additional funding in February which has reduced the projected deficit to £25.103 million. The deficit highlights the level of financial challenge experienced during the year driven mainly by a combination of continuing service pressures and high levels of general inflation. Difficulties in recruitment and high demand for services have resulted in significant cost pressures in a number of areas, with the costs of supplementary staffing being a particular driver. Formal monthly reporting of the Board’s financial position to the Scottish Government commenced from quarter 1', 'PERFORMANCE REPORT B PERFORMANCE ANALYSIS 3.2 NHS Grampian performance against statutory financial targets The results of each of the partner organisations, although consolidated with the main Board accounts for group accounting purposes, do not form part of the statutory financial target set for NHS Boards by the Scottish Government Health and Social Care Directorates (SGHSCD) and are, therefore, not taken into account when considering the Board’s in year financial performance. NHS Boards have the ability to manage small under/overspends (within 1% of resource) of an overall breakeven position across a three- year period (2023-26). The Scottish Government require NHS Boards to meet three key financial targets: ➢ Revenue Resource Limit (RRL) – a resource budget for ongoing activity; ➢ Capital Resource Limit (CRL) – a resource budget for net capital investment; and ➢ Cash Requirement – a financing requirement to fund the cash consequences of ongoing activity and net capital investment. Health Boards are required to contain their net expenditure within these limits, and report on any variation. NHS Grampian’s 2023/24 performance against these three key financial targets is shown in the table below: Statutory Financial Targets Limit as set Actual Variance by SGHSCD Outturn (Deficit)/Sur plus £000’s £000’s £000’s 1,440,632 1,440,535 97 Core Revenue Resource Limit 48,416 48,416 0', 'of financial challenge experienced during the year driven mainly by a combination of continuing service pressures and high levels of general inflation. Difficulties in recruitment and high demand for services have resulted in significant cost pressures in a number of areas, with the costs of supplementary staffing being a particular driver. Formal monthly reporting of the Board’s financial position to the Scottish Government commenced from quarter 1 with ongoing dialogue throughout the year relating to funding allocations and other shorter term cost control measures that could be implemented to mitigate the Boards financial position. In order to achieve in-year financial balance Scottish Government has provided the Board with financial support in the form of repayable brokerage of £24.800 million. The brokerage is repayable to the Scottish Government at the point in the future when the Board returns to financial balance. Without this additional support, the Board’s final outturn would have been an overspend of £24.703 million (equivalent to 1.66% of the Revenue Resource Limit). A surplus of £0.97 million against the Core Revenue Resource Limit is reported for 2023/24 reflecting this financial support. In November 2023, Scottish Government also informed NHS Grampian that the Board had been escalated from Stage 1 to Stage 2 of the NHS Scotland Support and']","£1,440,632 thousand","['£1,440,632 thousand']",Q_2024_FIN_01,Grampian-2023-2024,LEX,number,[26],skipped
What gap existed between the resource ceiling and actual spend on core NHS Grampian services in 2023/24?,"NHS Grampian’s 2023/24 performance against these three key financial targets is shown in the table below: Statutory Financial Targets Limit as set Actual Variance by SGHSCD Outturn (Deficit)/Sur plus £000’s £000’s £000’s 1,440,632 1,440,535","['consequences of ongoing activity and net capital investment. Health Boards are required to contain their net expenditure within these limits, and report on any variation. NHS Grampian’s 2023/24 performance against these three key financial targets is shown in the table below: Statutory Financial Targets Limit as set Actual Variance by SGHSCD Outturn (Deficit)/Sur plus £000’s £000’s £000’s 1,440,632 1,440,535 97 Core Revenue Resource Limit 48,416 48,416 0 Non-Core Revenue Resource Limit 1,489,048 1,488,951 97 Total Revenue Resource Limit Core Capital Resource Limit 113,641 113,641 - Non-Core Capital Resource Limit 3,465 3,465 - Total Capital Resource Limit 117,106 117,106 - Cash Requirement 1,649,045 1,649,045 -', 'PERFORMANCE REPORT B PERFORMANCE ANALYSIS 3.2 NHS Grampian performance against statutory financial targets The results of each of the partner organisations, although consolidated with the main Board accounts for group accounting purposes, do not form part of the statutory financial target set for NHS Boards by the Scottish Government Health and Social Care Directorates (SGHSCD) and are, therefore, not taken into account when considering the Board’s in year financial performance. NHS Boards have the ability to manage small under/overspends (within 1% of resource) of an overall breakeven position across a three- year period (2023-26). The Scottish Government require NHS Boards to meet three key financial targets: ➢ Revenue Resource Limit (RRL) – a resource budget for ongoing activity; ➢ Capital Resource Limit (CRL) – a resource budget for net capital investment; and ➢ Cash Requirement – a financing requirement to fund the cash consequences of ongoing activity and net capital investment. Health Boards are required to contain their net expenditure within these limits, and report on any variation. NHS Grampian’s 2023/24 performance against these three key financial targets is shown in the table below: Statutory Financial Targets Limit as set Actual Variance by SGHSCD Outturn (Deficit)/Sur plus £000’s £000’s £000’s 1,440,632 1,440,535 97 Core Revenue Resource Limit 48,416 48,416 0', 'support, the Board’s final outturn would have been an overspend of £24.703 million (equivalent to 1.66% of the Revenue Resource Limit). A surplus of £0.97 million against the Core Revenue Resource Limit is reported for 2023/24 reflecting this financial support. In November 2023, Scottish Government also informed NHS Grampian that the Board had been escalated from Stage 1 to Stage 2 of the NHS Scotland Support and Intervention Framework as a result of the Board’s financial position. This means that scheduled engagement and review of performance between the Scottish Government and the Board will continue through the usual channels. NHS Grampian submitted its 2024/25 Financial Plan to the Scottish Government in March 2024. The plan does not present a break-even position, recognising the significant work to', 'PERFORMANCE REPORT B PERFORMANCE ANALYSIS Memorandum for In Year Out-turn £000 Core Revenue Resource Variance Surplus in 2023/24 97 Financial flexibility: funding banked with/(provided by) -24,800 Scottish Government Underlying Deficit against Core Revenue Resource Limit -24,703 1.66% Further details on non-core elements of expenditure, typically comprising items of a technical accounting nature, can be found in the Summary of Resource Outturn. NHS Grampian was not able to set a balanced revenue budget for the 2023/24 financial year. The financial plan submitted to Scottish Government in March 2023 projected a £60.627 million deficit for the year after assuming savings achievement for the year of £16.557 million. Scottish Government confirmed additional funding for Health Boards in May which reduced the projected deficit to £42.936 million and further additional funding in February which has reduced the projected deficit to £25.103 million. The deficit highlights the level of financial challenge experienced during the year driven mainly by a combination of continuing service pressures and high levels of general inflation. Difficulties in recruitment and high demand for services have resulted in significant cost pressures in a number of areas, with the costs of supplementary staffing being a particular driver. Formal monthly reporting of the Board’s financial position to the Scottish Government commenced from quarter 1', 'of financial challenge experienced during the year driven mainly by a combination of continuing service pressures and high levels of general inflation. Difficulties in recruitment and high demand for services have resulted in significant cost pressures in a number of areas, with the costs of supplementary staffing being a particular driver. Formal monthly reporting of the Board’s financial position to the Scottish Government commenced from quarter 1 with ongoing dialogue throughout the year relating to funding allocations and other shorter term cost control measures that could be implemented to mitigate the Boards financial position. In order to achieve in-year financial balance Scottish Government has provided the Board with financial support in the form of repayable brokerage of £24.800 million. The brokerage is repayable to the Scottish Government at the point in the future when the Board returns to financial balance. Without this additional support, the Board’s final outturn would have been an overspend of £24.703 million (equivalent to 1.66% of the Revenue Resource Limit). A surplus of £0.97 million against the Core Revenue Resource Limit is reported for 2023/24 reflecting this financial support. In November 2023, Scottish Government also informed NHS Grampian that the Board had been escalated from Stage 1 to Stage 2 of the NHS Scotland Support and']","£1,440,535 thousand","['£1,440,535 thousand']",Q_2024_FIN_02,Grampian-2023-2024,STR,number,"[26, 118]",skipped
What surplus did NHS Grampian report against the Core Revenue Resource Limit in 2023/24?,"-24,800","['consequences of ongoing activity and net capital investment. Health Boards are required to contain their net expenditure within these limits, and report on any variation. NHS Grampian’s 2023/24 performance against these three key financial targets is shown in the table below: Statutory Financial Targets Limit as set Actual Variance by SGHSCD Outturn (Deficit)/Sur plus £000’s £000’s £000’s 1,440,632 1,440,535 97 Core Revenue Resource Limit 48,416 48,416 0 Non-Core Revenue Resource Limit 1,489,048 1,488,951 97 Total Revenue Resource Limit Core Capital Resource Limit 113,641 113,641 - Non-Core Capital Resource Limit 3,465 3,465 - Total Capital Resource Limit 117,106 117,106 - Cash Requirement 1,649,045 1,649,045 -', 'support, the Board’s final outturn would have been an overspend of £24.703 million (equivalent to 1.66% of the Revenue Resource Limit). A surplus of £0.97 million against the Core Revenue Resource Limit is reported for 2023/24 reflecting this financial support. In November 2023, Scottish Government also informed NHS Grampian that the Board had been escalated from Stage 1 to Stage 2 of the NHS Scotland Support and Intervention Framework as a result of the Board’s financial position. This means that scheduled engagement and review of performance between the Scottish Government and the Board will continue through the usual channels. NHS Grampian submitted its 2024/25 Financial Plan to the Scottish Government in March 2024. The plan does not present a break-even position, recognising the significant work to', 'PERFORMANCE REPORT B PERFORMANCE ANALYSIS Memorandum for In Year Out-turn £000 Core Revenue Resource Variance Surplus in 2023/24 97 Financial flexibility: funding banked with/(provided by) -24,800 Scottish Government Underlying Deficit against Core Revenue Resource Limit -24,703 1.66% Further details on non-core elements of expenditure, typically comprising items of a technical accounting nature, can be found in the Summary of Resource Outturn. NHS Grampian was not able to set a balanced revenue budget for the 2023/24 financial year. The financial plan submitted to Scottish Government in March 2023 projected a £60.627 million deficit for the year after assuming savings achievement for the year of £16.557 million. Scottish Government confirmed additional funding for Health Boards in May which reduced the projected deficit to £42.936 million and further additional funding in February which has reduced the projected deficit to £25.103 million. The deficit highlights the level of financial challenge experienced during the year driven mainly by a combination of continuing service pressures and high levels of general inflation. Difficulties in recruitment and high demand for services have resulted in significant cost pressures in a number of areas, with the costs of supplementary staffing being a particular driver. Formal monthly reporting of the Board’s financial position to the Scottish Government commenced from quarter 1', 'PERFORMANCE REPORT B PERFORMANCE ANALYSIS 3.2 NHS Grampian performance against statutory financial targets The results of each of the partner organisations, although consolidated with the main Board accounts for group accounting purposes, do not form part of the statutory financial target set for NHS Boards by the Scottish Government Health and Social Care Directorates (SGHSCD) and are, therefore, not taken into account when considering the Board’s in year financial performance. NHS Boards have the ability to manage small under/overspends (within 1% of resource) of an overall breakeven position across a three- year period (2023-26). The Scottish Government require NHS Boards to meet three key financial targets: ➢ Revenue Resource Limit (RRL) – a resource budget for ongoing activity; ➢ Capital Resource Limit (CRL) – a resource budget for net capital investment; and ➢ Cash Requirement – a financing requirement to fund the cash consequences of ongoing activity and net capital investment. Health Boards are required to contain their net expenditure within these limits, and report on any variation. NHS Grampian’s 2023/24 performance against these three key financial targets is shown in the table below: Statutory Financial Targets Limit as set Actual Variance by SGHSCD Outturn (Deficit)/Sur plus £000’s £000’s £000’s 1,440,632 1,440,535 97 Core Revenue Resource Limit 48,416 48,416 0', 'of financial challenge experienced during the year driven mainly by a combination of continuing service pressures and high levels of general inflation. Difficulties in recruitment and high demand for services have resulted in significant cost pressures in a number of areas, with the costs of supplementary staffing being a particular driver. Formal monthly reporting of the Board’s financial position to the Scottish Government commenced from quarter 1 with ongoing dialogue throughout the year relating to funding allocations and other shorter term cost control measures that could be implemented to mitigate the Boards financial position. In order to achieve in-year financial balance Scottish Government has provided the Board with financial support in the form of repayable brokerage of £24.800 million. The brokerage is repayable to the Scottish Government at the point in the future when the Board returns to financial balance. Without this additional support, the Board’s final outturn would have been an overspend of £24.703 million (equivalent to 1.66% of the Revenue Resource Limit). A surplus of £0.97 million against the Core Revenue Resource Limit is reported for 2023/24 reflecting this financial support. In November 2023, Scottish Government also informed NHS Grampian that the Board had been escalated from Stage 1 to Stage 2 of the NHS Scotland Support and']",£97 thousand,['£97 thousand'],Q_2024_FIN_03,Grampian-2023-2024,LEX,number,[26],skipped
What was the underlying deficit against the Core Revenue Resource Limit for 2023/24?,£0.97 million,"['PERFORMANCE REPORT B PERFORMANCE ANALYSIS Memorandum for In Year Out-turn £000 Core Revenue Resource Variance Surplus in 2023/24 97 Financial flexibility: funding banked with/(provided by) -24,800 Scottish Government Underlying Deficit against Core Revenue Resource Limit -24,703 1.66% Further details on non-core elements of expenditure, typically comprising items of a technical accounting nature, can be found in the Summary of Resource Outturn. NHS Grampian was not able to set a balanced revenue budget for the 2023/24 financial year. The financial plan submitted to Scottish Government in March 2023 projected a £60.627 million deficit for the year after assuming savings achievement for the year of £16.557 million. Scottish Government confirmed additional funding for Health Boards in May which reduced the projected deficit to £42.936 million and further additional funding in February which has reduced the projected deficit to £25.103 million. The deficit highlights the level of financial challenge experienced during the year driven mainly by a combination of continuing service pressures and high levels of general inflation. Difficulties in recruitment and high demand for services have resulted in significant cost pressures in a number of areas, with the costs of supplementary staffing being a particular driver. Formal monthly reporting of the Board’s financial position to the Scottish Government commenced from quarter 1', 'consequences of ongoing activity and net capital investment. Health Boards are required to contain their net expenditure within these limits, and report on any variation. NHS Grampian’s 2023/24 performance against these three key financial targets is shown in the table below: Statutory Financial Targets Limit as set Actual Variance by SGHSCD Outturn (Deficit)/Sur plus £000’s £000’s £000’s 1,440,632 1,440,535 97 Core Revenue Resource Limit 48,416 48,416 0 Non-Core Revenue Resource Limit 1,489,048 1,488,951 97 Total Revenue Resource Limit Core Capital Resource Limit 113,641 113,641 - Non-Core Capital Resource Limit 3,465 3,465 - Total Capital Resource Limit 117,106 117,106 - Cash Requirement 1,649,045 1,649,045 -', 'PERFORMANCE REPORT B PERFORMANCE ANALYSIS 3.2 NHS Grampian performance against statutory financial targets The results of each of the partner organisations, although consolidated with the main Board accounts for group accounting purposes, do not form part of the statutory financial target set for NHS Boards by the Scottish Government Health and Social Care Directorates (SGHSCD) and are, therefore, not taken into account when considering the Board’s in year financial performance. NHS Boards have the ability to manage small under/overspends (within 1% of resource) of an overall breakeven position across a three- year period (2023-26). The Scottish Government require NHS Boards to meet three key financial targets: ➢ Revenue Resource Limit (RRL) – a resource budget for ongoing activity; ➢ Capital Resource Limit (CRL) – a resource budget for net capital investment; and ➢ Cash Requirement – a financing requirement to fund the cash consequences of ongoing activity and net capital investment. Health Boards are required to contain their net expenditure within these limits, and report on any variation. NHS Grampian’s 2023/24 performance against these three key financial targets is shown in the table below: Statutory Financial Targets Limit as set Actual Variance by SGHSCD Outturn (Deficit)/Sur plus £000’s £000’s £000’s 1,440,632 1,440,535 97 Core Revenue Resource Limit 48,416 48,416 0', 'support, the Board’s final outturn would have been an overspend of £24.703 million (equivalent to 1.66% of the Revenue Resource Limit). A surplus of £0.97 million against the Core Revenue Resource Limit is reported for 2023/24 reflecting this financial support. In November 2023, Scottish Government also informed NHS Grampian that the Board had been escalated from Stage 1 to Stage 2 of the NHS Scotland Support and Intervention Framework as a result of the Board’s financial position. This means that scheduled engagement and review of performance between the Scottish Government and the Board will continue through the usual channels. NHS Grampian submitted its 2024/25 Financial Plan to the Scottish Government in March 2024. The plan does not present a break-even position, recognising the significant work to', 'of financial challenge experienced during the year driven mainly by a combination of continuing service pressures and high levels of general inflation. Difficulties in recruitment and high demand for services have resulted in significant cost pressures in a number of areas, with the costs of supplementary staffing being a particular driver. Formal monthly reporting of the Board’s financial position to the Scottish Government commenced from quarter 1 with ongoing dialogue throughout the year relating to funding allocations and other shorter term cost control measures that could be implemented to mitigate the Boards financial position. In order to achieve in-year financial balance Scottish Government has provided the Board with financial support in the form of repayable brokerage of £24.800 million. The brokerage is repayable to the Scottish Government at the point in the future when the Board returns to financial balance. Without this additional support, the Board’s final outturn would have been an overspend of £24.703 million (equivalent to 1.66% of the Revenue Resource Limit). A surplus of £0.97 million against the Core Revenue Resource Limit is reported for 2023/24 reflecting this financial support. In November 2023, Scottish Government also informed NHS Grampian that the Board had been escalated from Stage 1 to Stage 2 of the NHS Scotland Support and']","£-24,703 thousand (1.66% of the Revenue Resource Limit)","['£-24,703 thousand (1.66% of the Revenue Resource Limit)']",Q_2024_FIN_04,Grampian-2023-2024,LEX,number,[27],skipped
How much brokerage did Scottish Government provide NHS Grampian in 2023/24?,1,"['of financial challenge experienced during the year driven mainly by a combination of continuing service pressures and high levels of general inflation. Difficulties in recruitment and high demand for services have resulted in significant cost pressures in a number of areas, with the costs of supplementary staffing being a particular driver. Formal monthly reporting of the Board’s financial position to the Scottish Government commenced from quarter 1 with ongoing dialogue throughout the year relating to funding allocations and other shorter term cost control measures that could be implemented to mitigate the Boards financial position. In order to achieve in-year financial balance Scottish Government has provided the Board with financial support in the form of repayable brokerage of £24.800 million. The brokerage is repayable to the Scottish Government at the point in the future when the Board returns to financial balance. Without this additional support, the Board’s final outturn would have been an overspend of £24.703 million (equivalent to 1.66% of the Revenue Resource Limit). A surplus of £0.97 million against the Core Revenue Resource Limit is reported for 2023/24 reflecting this financial support. In November 2023, Scottish Government also informed NHS Grampian that the Board had been escalated from Stage 1 to Stage 2 of the NHS Scotland Support and', 'PERFORMANCE REPORT A OVERVIEW The financial challenges NHS Grampian faced in 2023/24 are highlighted in the Annual Report and Accounts for this year. The Accounts show a small underspend against the revenue budget, but this was only achieved due to additional repayable financial support (known as “brokerage”) being provided to the Board by the Scottish Government. This highlights the severe financial pressures currently being faced by the health system in the North East. This challenging financial position is anticipated to continue into future years. The Chief Executive Team of the Board have been working to implement a risk based approach to managing this challenge which involves achieving an appropriate balance between our financial position, clinical governance matters, staff wellbeing and prevention. During the year a significant amount of work has been undertaken to further develop and implement a local value and sustainability programme engaging widely with colleagues across the system. The purpose of this programme is to deliver short term efficiency savings and over the medium to longer term work on how we transform services and pathways of care to make them sustainable in terms of quality of care, staffing and finance. I recognise the significant financial and workforce challenges not only facing NHS Grampian but impacting on the whole', 'A CORPORATE GOVERNANCE REPORT i) THE DIRECTORS’ REPORT CORPORATE GOVERNANCE REPORT THE DIRECTORS’ REPORT 1. Naming Convention NHS Grampian is the common name of Grampian Health Board. NHS Grampian Charity is the common name for the Grampian Health Board Endowment Funds. 2. Date of Issue The Accountable Officer authorised these financial statements for issue on 28 June 2024. 3. Going Concern After making enquiries, the Board has a reasonable expectation that the organisation has adequate resources to continue in operational existence for the foreseeable future. The Board expects to record a further revenue deficit in the 2024/25 financial year but is planning for the level of deficit to reduce over the following subsequent financial years as outlined in the Medium Term Financial Plan. Discussions will continue with the Scottish Government over the provision of further funding cover (known as “brokerage”) to support the projected revenue deficit. It is expected NHS Board will continue in operational existence for the foreseeable future and continue to provide services, with no indication by Scottish Ministers of any intention for dissolution without transfer of services or functions to another entity with associated funding arrangements. Accordingly the Board continues to adopt the going concern basis in preparing the financial statements. Further details regarding the adoption of', 'Plan is structured around People, Places and Pathways, with priority areas aligned to each of these strands, with a central overarching objective to balance enabling wellness with responding to illness, as illustrated in the following graphic: In support of this, a Three Year delivery plan 2023-2026 was agreed by the Board in August 2023 as part of a single coherent plan including the Annual Delivery Plan and Medium Term Financial Plan for NHS Grampian. This Delivery plan sets out how NHS Grampian will make progress against the priority areas and strategic intent within the Plan for the Future for 2023 – 2026 in response to the 10 recovery priority areas of the Scottish Government. The Delivery Plan 2023 – 2026 was endorsed by the Board in August 2023, approved by', 'financial performance on the IJB given challenging operating environment. Significant work to be undertaken to bring the Board back into sustainable financial balance. Discussions will continue with the Scottish Government over the provision of further funding cover (known as “brokerage”) to support the projected revenue deficit. 11. Disclosures At the date of issue on 28 June 2024 based on the evidence considered during my review of the effectiveness of the internal control environment operating within NHS Grampian and group during 2023/24, I am not aware of any outstanding significant control weaknesses or other failures to achieve the standards set out in the guidance on governance, risk management and control.']","£24,800 thousand","['£24,800 thousand']",Q_2024_FIN_05,Grampian-2023-2024,LEX,number,[27],skipped
What share of the total revenue resource ceiling related to non-core technical accounting items in 2023/24?,24,"['consequences of ongoing activity and net capital investment. Health Boards are required to contain their net expenditure within these limits, and report on any variation. NHS Grampian’s 2023/24 performance against these three key financial targets is shown in the table below: Statutory Financial Targets Limit as set Actual Variance by SGHSCD Outturn (Deficit)/Sur plus £000’s £000’s £000’s 1,440,632 1,440,535 97 Core Revenue Resource Limit 48,416 48,416 0 Non-Core Revenue Resource Limit 1,489,048 1,488,951 97 Total Revenue Resource Limit Core Capital Resource Limit 113,641 113,641 - Non-Core Capital Resource Limit 3,465 3,465 - Total Capital Resource Limit 117,106 117,106 - Cash Requirement 1,649,045 1,649,045 -', 'PERFORMANCE REPORT B PERFORMANCE ANALYSIS Memorandum for In Year Out-turn £000 Core Revenue Resource Variance Surplus in 2023/24 97 Financial flexibility: funding banked with/(provided by) -24,800 Scottish Government Underlying Deficit against Core Revenue Resource Limit -24,703 1.66% Further details on non-core elements of expenditure, typically comprising items of a technical accounting nature, can be found in the Summary of Resource Outturn. NHS Grampian was not able to set a balanced revenue budget for the 2023/24 financial year. The financial plan submitted to Scottish Government in March 2023 projected a £60.627 million deficit for the year after assuming savings achievement for the year of £16.557 million. Scottish Government confirmed additional funding for Health Boards in May which reduced the projected deficit to £42.936 million and further additional funding in February which has reduced the projected deficit to £25.103 million. The deficit highlights the level of financial challenge experienced during the year driven mainly by a combination of continuing service pressures and high levels of general inflation. Difficulties in recruitment and high demand for services have resulted in significant cost pressures in a number of areas, with the costs of supplementary staffing being a particular driver. Formal monthly reporting of the Board’s financial position to the Scottish Government commenced from quarter 1', 'should be reversed to offset any subsequent increase in value relating to that particular asset. The net value of impairment reversal on those assets subject to an upward movement in valuation, was £0.728 million (2022/23 £0.657 million upward impairment) and this was credited to net operating expenditure within the Statement of Comprehensive Net Expenditure. Further information is available in the section on key sources of judgement, estimation, and uncertainty in note 1 accounting policies, on Page 97. 3.2.6 Pension Liabilities The accounting policy for pensions is provided in Note 1 to the Accounts and disclosure of the costs is shown within Note 19 and the Remuneration Report. 3.2.7 Infrastructure and Non-Current Assets The Board delivered a programme of infrastructure investment totalling £121.3 million during 2023/24. Within this, a total of £117.442 million of capital expenditure was incurred (see note 7d) and a further £3.87 million was classed as revenue expenditure in nature. The overall programme was resourced using a combination of capital funding from the SGHSCD (£113.6 million, see note 7d), income from donations (£1.25 million), financial transactions funding from the Scottish Government for GP sustainability Loans (£2.24 million), NBV benefit from disposal of equipment (£0.31 million) and various revenue funding sources (£3.87 million) Major investments during the year include:', ""Financial table on page 118 (Cash Flow) Contains 64 line items across 10 columns. Row labels: SUMMARYOFCOREREVENUERESOURCEOUTTURN; Netexpenditure; TotalNon-CoreExpenditure(seebelow); FHSNonDiscretionaryAllocation. Key items: SUMMARYOFCOREREVENUERESOURCEOUTTURN | 20 | 23/24 | 2023/24; £’ | 000 | £’000 | £’000; Netexpenditure | 1,583,114 | 1,443,465; TotalNon-CoreExpenditure(seebelow) | (48,416) | (46,200); FHSNonDiscretionaryAllocation | (76,258) | (71,137).\n\nTable (header-injected facts):\n\n- Netexpenditure > 4 2023/24 : 1,583,114\n- Netexpenditure > 9 2022/23 : 1,443,465\n- TotalNon-CoreExpenditure(seebelow) > 4 2023/24 : (48,416)\n- TotalNon-CoreExpenditure(seebelow) > 9 2022/23 : (46,200)\n- FHSNonDiscretionaryAllocation > 4 2023/24 : (76,258)\n- FHSNonDiscretionaryAllocation > 9 2022/23 : (71,137)\n- EndowmentNetOperatingCosts > 4 2023/24 : 546\n- EndowmentNetOperatingCosts > 9 2022/23 : 110\n- JointVenturesaccountedforonanequitybasis > 4 2023/24 : (18,451)\n- JointVenturesaccountedforonanequitybasis > 9 2022/23 : (34,359)\n- TotalCoreExpenditure > 4 2023/24 : 1,440,535\n- TotalCoreExpenditure > 9 2022/23 : 1,291,879\n- CoreRevenueResourceLimit > 4 2023/24 : 1,440,632\n- CoreRevenueResourceLimit > 9 2022/23 : 1,292,491\n- Saving/(excess)againstCoreRevenueResourceLimit > 4 2023/24 : 97\n- Saving/(excess)againstCoreRevenueResourceLimit > 9 2022/23 : 612\n- Capitalgrantsto/(from)otherbodies > 3 23/24 : 22\n- Capitalgrantsto/(from)otherbodies > 8 2022/23 : 854\n- Depreciation/Amortisation > 3 23/24 : 26,050\n- Depreciation/Amortisation > 8 2022/23 : 30,751\n- AnnuallyManagedExpenditure-Impairments > 3 23/24 : 13,221\n- AnnuallyManagedExpenditure-Impairments > 8 2022/23 : 7,617\n- AnnuallyManagedExpenditure-CreationofProvisions > 3 23/24 : 2,290\n- AnnuallyManagedExpenditure-CreationofProvisions > 8 2022/23 : 5,077\n- AnnuallyManagedExpenditure-DepreciationofDonatedAssets > 3 23/24 : 1,401\n- AnnuallyManagedExpenditure-DepreciationofDonatedAssets > 8 2022/23 : 1,328\n- AnnuallyManagedExpenditure-pensionvaluation > 3 23/24 : (28)\n- AnnuallyManagedExpenditure-pensionvaluation > 8 2022/23 : 0\n- AnnuallyManagedExpenditure-FairValueAdjustments > 3 23/24 : 680\n- AnnuallyManagedExpenditure-FairValueAdjustments > 8 2022/23 : 0\n- DonatedAssetsIncome > 3 23/24 : (1,248)\n- DonatedAssetsIncome > 8 2022/23 : (320)\n- IFRSPFIexpenditure > 3 23/24 : 1,014\n- IFRSPFIexpenditure > 8 2022/23 : 893\n- RightofUse(RoU)Interest > 3 23/24 : 4,932\n- RightofUse(RoU)Interest > 8 2022/23 : 0\n- RightofUse(RoU)PeppercornLeasesDepreciation > 3 23/24 : 82\n- RightofUse(RoU)PeppercornLeasesDepreciation > 8 2022/23 : 0\n- TotalNonCoreExpenditure > 4 2023/24 : 48,416\n- TotalNonCoreExpenditure > 9 2022/23 : 46,200\n- Non-CoreRevenueResourceLimit > 4 2023/24 : 48,416\n- Non-CoreRevenueResourceLimit > 9 2022/23 : 46,200\n- Saving/(excess)againstNonCoreRevenueResourceLimit > 4 2023/24 : 0\n- Saving/(excess)againstNonCoreRevenueResourceLimit > 9 2022/23 : 0\n- SUMMARYRESOURCEOUTTURN > 1 : Resourc\n- SUMMARYRESOURCEOUTTURN > 2 20 : eExpe\n- SUMMARYRESOURCEOUTTURN > 3 23/24 : nditure\n- SUMMARYRESOURCEOUTTURN > 4 2023/24 : Saving/(excess)\n- SUMMARYRESOURCEOUTTURN > 6 : Reso\n- SUMMARYRESOURCEOUTTURN > 7 : urce\n- SUMMARYRESOURCEOUTTURN > 8 2022/23 : Expenditure\n- SUMMARYRESOURCEOUTTURN > 9 2022/23 : s)\n- Core > 1 : 1,440\n- Core > 2 20 : ,632\n- Core > 3 23/24 : 1,440,535\n- Core > 4 2023/24 : 97\n- Core > 7 : 1,292,491\n- Core > 8 2022/23 : 1,291,879\n- Core > 9 2022/23 : 612\n- Non-Core > 1 : 48\n- Non-Core > 2 20 : ,416\n- Non-Core > 3 23/24 : 48,416\n- Non-Core > 4 2023/24 : 0\n- Non-Core > 7 : 46,200\n- Non-Core > 8 2022/23 : 46,200\n- Non-Core > 9 2022/23 : 0\n- Column headers: Row label > 1 : 1\n- Column headers: Row label > 2 20 : 2 20\n- Column headers: Row label > 3 23/24 : 3 23/24\n- Column headers: Row label > 4 2023/24 : 4 2023/24\n- Column headers: Row label > 5 : 5\n- Column headers: Row label > 6 : 6\n- Column headers: Row label > 7 : 7\n- Column headers: Row label > 8 2022/23 : 8 2022/23\n- Column headers: Row label > 9 2022/23 : 9 2022/23\n\nTable (markdown):\n\n| 0 | 1 | 2 | 3 | 4 | 5 | 6 | 7 | 8 | 9 |\n| --- | --- | --- | --- | --- | --- | --- | --- | --- | --- |\n| SUMMARYOFCOREREVENUERESOURCEOUTTURN |  | 20 | 23/24 | 2023/24 |  |  |  | 2022/23 | 2022/23 |\n|  |  | £’ | 000 | £’000 |  |  |  | £’000 | £’000 |\n| Netexpenditure |  |  |  | 1,583,114 |  |  |  |  | 1,443,465 |\n| TotalNon-CoreExpenditure(seebelow) |  |  |  | (48,416) |  |  |  |  | (46,200) |\n| FHSNonDiscretionaryAllocation |  |  |  | (76,258) |  |  |  |  | (71,137) |\n| EndowmentNetOperatingCosts |  |  |  | 546 |  |  |  |  | 110 |\n| JointVenturesaccountedforonanequitybasis |  |  |  | (18,451) |  |  |  |  | (34,359) |\n| TotalCoreExpenditure |  |  |  | 1,440,535 |  |  |  |  | 1,291,879 |\n| CoreRevenueResourceLimit |  |  |  | 1,440,632 |  |  |  |  | 1,292,491 |\n| Saving/(excess)againstCoreRevenueResourceLimit |  |  |  | 97 |  |  |  |  | 612 |\n| SUMMARYOFNONCOREREVENUERESOURCEOUTTURN |  |  |  |  |  |  |  |  |  |\n| Capitalgrantsto/(from)otherbodies |  |  | 22 |  |  |  |  | 854 |  |\n| Depreciation/Amortisation |  |  | 26,050 |  |  |  |  | 30,751 |  |\n| AnnuallyManagedExpenditure-Impairments |  |  | 13,221 |  |  |  |  | 7,617 |  |\n| AnnuallyManagedExpenditure-CreationofProvisions |  |  | 2,290 |  |  |  |  | 5,077 |  |\n| AnnuallyManagedExpenditure-DepreciationofDonatedAssets |  |  | 1,401 |  |  |  |  | 1,328 |  |\n| AnnuallyManagedExpenditure-pensionvaluation |  |  | (28) |  |  |  |  | 0 |  |\n| AnnuallyManagedExpenditure-FairValueAdjustments |  |  | 680 |  |  |  |  | 0 |  |\n| DonatedAssetsIncome |  |  | (1,248) |  |  |  |  | (320) |  |\n| IFRSPFIexpenditure |  |  | 1,014 |  |  |  |  | 893 |  |\n| RightofUse(RoU)Interest |  |  | 4,932 |  |  |  |  | 0 |  |\n| RightofUse(RoU)PeppercornLeasesDepreciation |  |  | 82 |  |  |  |  | 0 |  |\n| TotalNonCoreExpenditure |  |  |  | 48,416 |  |  |  |  | 46,200 |\n| Non-CoreRevenueResourceLimit |  |  |  | 48,416 |  |  |  |  | 46,200 |\n| Saving/(excess)againstNonCoreRevenueResourceLimit |  |  |  | 0 |  |  |  |  | 0 |\n|  |  |  |  |  |  |  |  | S | aving/(exces |\n| SUMMARYRESOURCEOUTTURN | Resourc | eExpe | nditure | Saving/(excess) |  | Reso | urce | Expenditure | s) |\n|  |  | £'000 | £'000 | £'000 |  |  | £'000 | £'000 | £'000 |\n| Core | 1,440 | ,632 | 1,440,535 | 97 |  |  | 1,292,491 | 1,291,879 | 612 |\n| Non-Core | 48 | ,416 | 48,416 | 0 |  |  | 46,200 | 46,200 | 0 |\nColumn headers: Row label | 1 | 2 20 | 3 23/24 | 4 2023/24 | 5 | 6 | 7 | 8 2022/23 | 9 2022/23\nRow map:\n- Netexpenditure -> col_4=1,583,114 ; col_9=1,443,465\n- TotalNon-CoreExpenditure(seebelow) -> col_4=(48,416) ; col_9=(46,200)\n- FHSNonDiscretionaryAllocation -> col_4=(76,258) ; col_9=(71,137)\n- EndowmentNetOperatingCosts -> col_4=546 ; col_9=110\n- JointVenturesaccountedforonanequitybasis -> col_4=(18,451) ; col_9=(34,359)\n- TotalCoreExpenditure -> col_4=1,440,535 ; col_9=1,291,879\n- CoreRevenueResourceLimit -> col_4=1,440,632 ; col_9=1,292,491\n- Saving/(excess)againstCoreRevenueResourceLimit -> col_4=97 ; col_9=612\n- Capitalgrantsto/(from)otherbodies -> col_3=22 ; col_8=854\n- Depreciation/Amortisation -> col_3=26,050 ; col_8=30,751\n- AnnuallyManagedExpenditure-Impairments -> col_3=13,221 ; col_8=7,617\n- AnnuallyManagedExpenditure-CreationofProvisions -> col_3=2,290 ; col_8=5,077\n- AnnuallyManagedExpenditure-DepreciationofDonatedAssets -> col_3=1,401 ; col_8=1,328\n- AnnuallyManagedExpenditure-pensionvaluation -> col_3=(28) ; col_8=0\n- AnnuallyManagedExpenditure-FairValueAdjustments -> col_3=680 ; col_8=0\n- DonatedAssetsIncome -> col_3=(1,248) ; col_8=(320)\n- IFRSPFIexpenditure -> col_3=1,014 ; col_8=893\n- RightofUse(RoU)Interest -> col_3=4,932 ; col_8=0\n- RightofUse(RoU)PeppercornLeasesDepreciation -> col_3=82 ; col_8=0\n- TotalNonCoreExpenditure -> col_4=48,416 ; col_9=46,200\n- Non-CoreRevenueResourceLimit -> col_4=48,416 ; col_9=46,200\n- Saving/(excess)againstNonCoreRevenueResourceLimit -> col_4=0 ; col_9=0\n- Core -> col_1=1,440 ; col_2=,632 ; col_3=1,440,535 ; col_4=97 ; col_7=1,292,491 ; col_8=1,291,879 ; col_9=612\n- Non-Core -> col_1=48 ; col_2=,416 ; col_3=48,416 ; col_4=0 ; col_7=46,200 ; col_8=46,200 ; col_9=0"", 'PERFORMANCE REPORT B PERFORMANCE ANALYSIS 3.2 NHS Grampian performance against statutory financial targets The results of each of the partner organisations, although consolidated with the main Board accounts for group accounting purposes, do not form part of the statutory financial target set for NHS Boards by the Scottish Government Health and Social Care Directorates (SGHSCD) and are, therefore, not taken into account when considering the Board’s in year financial performance. NHS Boards have the ability to manage small under/overspends (within 1% of resource) of an overall breakeven position across a three- year period (2023-26). The Scottish Government require NHS Boards to meet three key financial targets: ➢ Revenue Resource Limit (RRL) – a resource budget for ongoing activity; ➢ Capital Resource Limit (CRL) – a resource budget for net capital investment; and ➢ Cash Requirement – a financing requirement to fund the cash consequences of ongoing activity and net capital investment. Health Boards are required to contain their net expenditure within these limits, and report on any variation. NHS Grampian’s 2023/24 performance against these three key financial targets is shown in the table below: Statutory Financial Targets Limit as set Actual Variance by SGHSCD Outturn (Deficit)/Sur plus £000’s £000’s £000’s 1,440,632 1,440,535 97 Core Revenue Resource Limit 48,416 48,416 0']","Limit: £1,489,048 thousand; Actual: £1,488,951 thousand","['Limit: £1,489,048 thousand; Actual: £1,488,951 thousand']",Q_2024_FIN_06,Grampian-2023-2024,STR,number,[26],skipped
What was the net expenditure for NHS Grampian in 2023/24 and by how much did it increase from the prior year?,£12.38 million,"['PERFORMANCE REPORT B PERFORMANCE ANALYSIS Recurring savings amounted to £12.38 million (2022/23 £2.5 million) and non-recurring of £5.14 million (2022/23 £7.7 million). 3.2.3 Expenditure Analysis Net expenditure for the year was £1,565 million (2022/23 £1,409 million), an increase of £156 million from the prior year. The Consolidated Statement of Comprehensive Net Expenditure can be found on Page 93, a more detailed analysis of Expenditure in note 3 on Page 120 and a more detailed analysis of income in note 4 on Page 122. Staff Costs increased by £100.6 million due to the annual pay uplift (2022/23 £54.7 million) which was an average between 6-12% for Medical & Dental staff and 6.5% for Agenda for Change staff alongside national insurance increases. These were offset by a reduction in the accrual for untaken annual leave of £8.24 million (2022/23 £5.6 million) System pressures resulted in additional expenditure to support staffing levels with spend on agency locum costs increasing by £2.7 million, agency nursing costs by £2.7 million and £2 million increase in supplementary payments for non-compliant junior medical rotas. Drugs and Medical supplies increased by £28.3 million (£21 million 2022/23) due to price and volume increases. This impacted both the primary and secondary care sectors and reflected the volatility in the pricing', 'million). During the year payments totalling £2.826 million (2022/23 £1.891 million) were made to NHS Grampian by the NHS Grampian Charity to enable a range of research and other activities including infrastructure improvement for the benefit of patients and staff. The NHS Charity received £0.07 million (2022/23 £0.219 million) from NHS Grampian mainly from income for research activities. Chest, Heart & Stroke Scotland Mrs A Anderson, Non-Executive Board Member (up to 30/11/23) was also Chair of Chest, Heart & Stroke Scotland during 2023/24. NHS Grampian had the following transactions in 2023/24; income £0, expenditure £72,940 (2022/23 expenditure of £202,020). Aberdeen in Recovery Mrs L Grugeon, Non Executive Board Member (up to 16/10/23) was also a Trustee of Aberdeen In Recovery during 2023/24. NHS Grampian had the following transactions in 2023/24; income £0, expenditure £114,873 (2022/23 expenditure of £20,000).', 'should be reversed to offset any subsequent increase in value relating to that particular asset. The net value of impairment reversal on those assets subject to an upward movement in valuation, was £0.728 million (2022/23 £0.657 million upward impairment) and this was credited to net operating expenditure within the Statement of Comprehensive Net Expenditure. Further information is available in the section on key sources of judgement, estimation, and uncertainty in note 1 accounting policies, on Page 97. 3.2.6 Pension Liabilities The accounting policy for pensions is provided in Note 1 to the Accounts and disclosure of the costs is shown within Note 19 and the Remuneration Report. 3.2.7 Infrastructure and Non-Current Assets The Board delivered a programme of infrastructure investment totalling £121.3 million during 2023/24. Within this, a total of £117.442 million of capital expenditure was incurred (see note 7d) and a further £3.87 million was classed as revenue expenditure in nature. The overall programme was resourced using a combination of capital funding from the SGHSCD (£113.6 million, see note 7d), income from donations (£1.25 million), financial transactions funding from the Scottish Government for GP sustainability Loans (£2.24 million), NBV benefit from disposal of equipment (£0.31 million) and various revenue funding sources (£3.87 million) Major investments during the year include:', 'PERFORMANCE REPORT B PERFORMANCE ANALYSIS The effect of this revaluation on individual assets was some gained value while others were impaired. The impact of those assets subject to an upward movement in valuation was an increase in the revaluation reserve of £48.457 million and assets subject to a downwards valuation seeing a reduction in the revaluation reserve of £4.032 million. Write down of previous increases of £5.748 million also undertaken. Thus making the overall net impact on the revaluation reserve an increase of £38.677 million (2022/23 £10.065 million increase). The overall increase in property value reflects an increase in construction industry prices during the year, impacted by rising demand and a range of economic and geopolitical factors causing supply bottlenecks, labour shortages and increased materials costs. IAS 36 requires that impairments charged to the Statement of Comprehensive Net Expenditure (SOCNE) in prior years should be reversed to offset any subsequent increase in value relating to that particular asset. The net value of impairment reversal on those assets subject to an upward movement in valuation, was £0.728 million (2022/23 £0.657 million upward impairment) and this was credited to net operating expenditure within the Statement of Comprehensive Net Expenditure. Further information is available in the section on key sources of judgement, estimation,', 'closely with other organisations, including NHS Scotland Counter Fraud Services (CFS) and other government agencies to combat fraud. This includes participation in the bi-annual National Fraud Initiative which is a data matching exercise. The Board also takes part in a post payment patient exemption eligibility verification system, which covers all Family Health Service expenditure. 5. Payment Policy NHS Grampian is committed to supporting the Scottish Government in helping businesses during the current economic situation by paying bills more quickly. The intention is to achieve payment of all undisputed invoices within 10 working days, across all public bodies and NHS Grampian is actively working towards achievement of this accelerated payment target. - In 2023/24, the average credit taken was 14 days (2022/23 15 days). - In 2023/24 93% of invoices by value (2022/23 91%) and 90% of invoices by volume (2022/23 86%) were paid within 30 days. - In 2023/24 87% of invoices by value (2022/23 85%) and 79% of invoices by volume (2022/23 73%) were paid within 10 days. The small improvement in payment performance compared to the prior year reflects work to support the purchase to pay process during the year despite challenges around the impact of wider system pressures on support teams. 6. Social Matters NHS Grampian promotes']","£1,565 million, an increase of £156 million from 2022/23 (£1,409 million)","['£1,565 million, an increase of £156 million from 2022/23 (£1,409 million)']",Q_2024_FIN_07,Grampian-2023-2024,LEX,number,[29],skipped
"What was the total annual cost of running NHS Grampian's health and care operations in 2023/24, and how did the cost base shift year-on-year?",19,"['engaging widely with colleagues across the system. The purpose of this programme is to deliver short term efficiency savings and over the medium to longer term work on how we transform services and pathways of care to make them sustainable in terms of quality of care, staffing and finance. I recognise the significant financial and workforce challenges not only facing NHS Grampian but impacting on the whole public sector. We will continue to work with our partners, citizens, and colleagues to explore opportunities for greater collaboration locally, regionally and nationally to ensure provision of high quality, safe, efficient and sustainable services which meet the needs of the population. Our operational performance has been impacted by the health debt generated over the recent years of the COVID-19 pandemic and recovery and our low bed base. During the financial year 2023/24 we have not been able to balance our revenue budget and have relied on using one-off income, savings and additional funding to support the financial position. These income and savings will unfortunately not be available in future years, and I do not underestimate the challenge facing NHS Grampian in balancing future budgets. In 2023/24 NHS Grampian has also been escalated from Stage 1 to Stage 2 of the Scottish Government’s support', 'partner organisation e.g. a university or a local authority, they were remunerated through the payroll of that partner organisation. All Board members deemed to have significant financial responsibility during the year were remunerated through NHS Grampian’s payroll. 9. Exit packages There were 6 exit packages agreed during the year which were compulsory redundancies. 2023/24 2022/23 Exit Package cost band Total number of exit Total number of exit packages by cost band packages by cost band £0 - £10,000 6 15 Total Resource Cost (£’000) 21 36 10. Expenditure on consultancy Expenditure on external consultancy during 2023/24 was £3,800 (2022/23 £2,917).', 'PERFORMANCE REPORT A OVERVIEW The financial challenges NHS Grampian faced in 2023/24 are highlighted in the Annual Report and Accounts for this year. The Accounts show a small underspend against the revenue budget, but this was only achieved due to additional repayable financial support (known as “brokerage”) being provided to the Board by the Scottish Government. This highlights the severe financial pressures currently being faced by the health system in the North East. This challenging financial position is anticipated to continue into future years. The Chief Executive Team of the Board have been working to implement a risk based approach to managing this challenge which involves achieving an appropriate balance between our financial position, clinical governance matters, staff wellbeing and prevention. During the year a significant amount of work has been undertaken to further develop and implement a local value and sustainability programme engaging widely with colleagues across the system. The purpose of this programme is to deliver short term efficiency savings and over the medium to longer term work on how we transform services and pathways of care to make them sustainable in terms of quality of care, staffing and finance. I recognise the significant financial and workforce challenges not only facing NHS Grampian but impacting on the whole', 'A CORPORATE GOVERNANCE REPORT further action if required. The HIS Public Interest Disclosure Act (PIDA) process has increased in frequency. ➢ Governance processes exist to ensure dissemination of Scottish Intercollegiate Guideline Network Guidelines (SIGN), Scottish Health Technology Group (SHTG) Publications, Healthcare Improvement Scotland (HIS) External Reviews and Inspections, Mental Welfare Commission (MWC) and Death Certification Review Service (DCRS). It is noted that the Quality Improvement and Assurance Team (QIAT) also registers National Audits and supports participation by NHS Grampian clinicians and services in the Scottish National Audit Programme (SNAP). Annual Report 2023 was published in November 2023 and shows the outliers for 2022. The governance process concluded and reported on a total of 129 outliers, of which 57 were positive and 72 were negative of which 39 required a full investigation and action plan. NHS Grampian position was 8 outliers, of which 6 were positive and 2 negative of which 2 required an action plan. The next notification of all SNAP audits will be for 2023 and will be reported in next year’s update. ➢ Healthcare Improvement Scotland (HIS) o To 31 March 2024, there has been one HIS Safe Delivery of Care inspection reports published in relation to NHS Grampian. Inspection of Aberdeen Royal Infirmary (ARI) and Dr Gray’s', 'Plan is structured around People, Places and Pathways, with priority areas aligned to each of these strands, with a central overarching objective to balance enabling wellness with responding to illness, as illustrated in the following graphic: In support of this, a Three Year delivery plan 2023-2026 was agreed by the Board in August 2023 as part of a single coherent plan including the Annual Delivery Plan and Medium Term Financial Plan for NHS Grampian. This Delivery plan sets out how NHS Grampian will make progress against the priority areas and strategic intent within the Plan for the Future for 2023 – 2026 in response to the 10 recovery priority areas of the Scottish Government. The Delivery Plan 2023 – 2026 was endorsed by the Board in August 2023, approved by']",Staff costs increased by £100.6 million; uplift was 6-12% for Medical & Dental and 6.5% for Agenda for Change staff,['Staff costs increased by £100.6 million; uplift was 6-12% for Medical & Dental and 6.5% for Agenda for Change staff'],Q_2024_FIN_08,Grampian-2023-2024,STR,number,[29],skipped
What was the projected deficit in the financial plan submitted in March 2023 before additional funding was confirmed?,"-24,800","['PERFORMANCE REPORT B PERFORMANCE ANALYSIS Memorandum for In Year Out-turn £000 Core Revenue Resource Variance Surplus in 2023/24 97 Financial flexibility: funding banked with/(provided by) -24,800 Scottish Government Underlying Deficit against Core Revenue Resource Limit -24,703 1.66% Further details on non-core elements of expenditure, typically comprising items of a technical accounting nature, can be found in the Summary of Resource Outturn. NHS Grampian was not able to set a balanced revenue budget for the 2023/24 financial year. The financial plan submitted to Scottish Government in March 2023 projected a £60.627 million deficit for the year after assuming savings achievement for the year of £16.557 million. Scottish Government confirmed additional funding for Health Boards in May which reduced the projected deficit to £42.936 million and further additional funding in February which has reduced the projected deficit to £25.103 million. The deficit highlights the level of financial challenge experienced during the year driven mainly by a combination of continuing service pressures and high levels of general inflation. Difficulties in recruitment and high demand for services have resulted in significant cost pressures in a number of areas, with the costs of supplementary staffing being a particular driver. Formal monthly reporting of the Board’s financial position to the Scottish Government commenced from quarter 1', 'A CORPORATE GOVERNANCE REPORT NHS Grampian submitted its 2024/2025 financial plan to the Scottish Government in March 2024. The Board expects to record a further revenue deficit in the 2024/25 financial year but is planning for the level of deficit to reduce over the following subsequent financial years as outlined in the Medium Term Financial Plan. Specific financial risks forecast to materialise include implementation of the non-pay elements of the 2023 pay deal and the', 'PERFORMANCE REPORT B PERFORMANCE ANALYSIS The Board expects to record a further revenue deficit in the 2024/25 financial year but is planning for the level of deficit to reduce over the following subsequent financial years as outlined in the Medium-Term Financial Plan. It recognises the significant work to be undertaken to bring the Board back into sustainable financial balance. The plan takes a risk-based approach recognising the need to identify and contain operational overspends without compromising on the level and quality of services NHS Grampian provides. Discussions will continue with the Scottish Government over the provision of further funding cover (known as “brokerage”) to support the projected revenue deficit. It is expected NHS Grampian will continue in operational existence for the foreseeable future, with no indication by Scottish Ministers of any intention for dissolution without transfer of services or functions to another entity with associated funding arrangements. 3.2.1 Delivering Sustainable Healthcare – Finding Balance This was the first time that NHS Grampian has overspent against its revenue budget and highlights the severe pressures that the health system faces in the North East of Scotland. A number of actions were taken to combat this overspend including the development in the year. These included amongst other measures: Development of an Integrated Performance', 'confirmed that an increase in the employer contribution rate from 14.9% to 20.9% was required from 1 April 2019 to 31 March 2023. The UK Government since confirmed that these employer rates would remain in place until 31 March 2024. In addition, member pension contributions over the period to 30 September 2023 have been paid within a range of 5.2% to 14.7% and have been anticipated to deliver a yield of 9.6%. The valuation carried out as at 31 March 2020 confirmed that an increase in the employer contribution rate from 20.9% to 22.5% will be required from 1 April 2024 to 31 March 2027. In addition, member pension contributions since 1 October 2023 have been paid within a range of 5.7% to 13.7% and have been anticipated to deliver a yield of 9.8%. NHS Grampian has no liability for other employers’ obligations to the multi-employer scheme and as the scheme is unfunded there can be no deficit or surplus to distribute on the wind-up of the scheme or withdrawal from the scheme. The Scheme is an unfunded multi-employer defined benefit scheme and it is accepted that the scheme can be treated for accounting purposes as a defined contribution scheme in circumstances where NHS Grampian is unable to identify its', 'A CORPORATE GOVERNANCE REPORT i) THE DIRECTORS’ REPORT CORPORATE GOVERNANCE REPORT THE DIRECTORS’ REPORT 1. Naming Convention NHS Grampian is the common name of Grampian Health Board. NHS Grampian Charity is the common name for the Grampian Health Board Endowment Funds. 2. Date of Issue The Accountable Officer authorised these financial statements for issue on 28 June 2024. 3. Going Concern After making enquiries, the Board has a reasonable expectation that the organisation has adequate resources to continue in operational existence for the foreseeable future. The Board expects to record a further revenue deficit in the 2024/25 financial year but is planning for the level of deficit to reduce over the following subsequent financial years as outlined in the Medium Term Financial Plan. Discussions will continue with the Scottish Government over the provision of further funding cover (known as “brokerage”) to support the projected revenue deficit. It is expected NHS Board will continue in operational existence for the foreseeable future and continue to provide services, with no indication by Scottish Ministers of any intention for dissolution without transfer of services or functions to another entity with associated funding arrangements. Accordingly the Board continues to adopt the going concern basis in preparing the financial statements. Further details regarding the adoption of']",£60.627 million,['£60.627 million'],Q_2024_FIN_09,Grampian-2023-2024,LEX,number,[27],skipped
By what amount did drugs and medical supplies expenditure increase in 2023/24?,£12.38 million,"['PERFORMANCE REPORT B PERFORMANCE ANALYSIS Recurring savings amounted to £12.38 million (2022/23 £2.5 million) and non-recurring of £5.14 million (2022/23 £7.7 million). 3.2.3 Expenditure Analysis Net expenditure for the year was £1,565 million (2022/23 £1,409 million), an increase of £156 million from the prior year. The Consolidated Statement of Comprehensive Net Expenditure can be found on Page 93, a more detailed analysis of Expenditure in note 3 on Page 120 and a more detailed analysis of income in note 4 on Page 122. Staff Costs increased by £100.6 million due to the annual pay uplift (2022/23 £54.7 million) which was an average between 6-12% for Medical & Dental staff and 6.5% for Agenda for Change staff alongside national insurance increases. These were offset by a reduction in the accrual for untaken annual leave of £8.24 million (2022/23 £5.6 million) System pressures resulted in additional expenditure to support staffing levels with spend on agency locum costs increasing by £2.7 million, agency nursing costs by £2.7 million and £2 million increase in supplementary payments for non-compliant junior medical rotas. Drugs and Medical supplies increased by £28.3 million (£21 million 2022/23) due to price and volume increases. This impacted both the primary and secondary care sectors and reflected the volatility in the pricing', 'additional expenditure to support staffing levels with spend on agency locum costs increasing by £2.7 million, agency nursing costs by £2.7 million and £2 million increase in supplementary payments for non-compliant junior medical rotas. Drugs and Medical supplies increased by £28.3 million (£21 million 2022/23) due to price and volume increases. This impacted both the primary and secondary care sectors and reflected the volatility in the pricing of medicines in the year along with new treatment pathways. Medical specialties within secondary care were particularly impacted due to activity growth. Increases in expenditure was also experienced in the independent primary care sector of £11.8m due to increases in activity and uplifts to national contract values. Increases in other non-pay costs for the year of £7.5 million, reflecting increased spend on utilities, equipment, and service contracts. These were driven by increases in planned care activities and inflationary pressures throughout the year as a number of service contracts were retendered. Contributions to IJBs increased during the year by to £7.7', 'B REMUNERATION AND STAFF REPORT years relates to the relative increase in remuneration earned by those in the 75 th percentile compared to the Acute Medical Director in 2023/24. This relates mainly to pay award. The increase in median pay and also at the 25 th and 75 th percentile is broadly as expected, in line with the 2023/24 pay award.', 'April 2012 and were within 10 years of their normal retirement age. Some members who were close to retirement but did not qualify for full protection will remain in their current section beyond 1 April 2015 and join the 2015 scheme at a later date. The Board is unable to identify its share of the underlying notional assets and liabilities of the scheme on a consistent and reasonable basis and therefore accounts for the scheme as if it were a defined contribution scheme, as required by IAS 19 ‘Employee Benefits’. As a result, the amount charged to the Statement of Comprehensive Net Expenditure represents the Board’s employer contributions payable to the scheme in respect of the year. The contributions deducted from employees are reflected in the gross salaries charged and are similarly remitted to Exchequer. The pension cost is assessed every four years by the Government Actuary who determines the rate of contributions required. The most recent actuarial valuation is published by the Scottish Public Pensions Agency and is available on their website. Additional pension liabilities arising from early retirements are not funded by the scheme except where the retirement is due to ill-health. The full amount of the liability for the additional costs is charged to the Statement of', 'by the Government Actuary who determines the rate of contributions required. The most recent actuarial valuation is published by the Scottish Public Pensions Agency and is available on their website. Additional pension liabilities arising from early retirements are not funded by the scheme except where the retirement is due to ill-health. The full amount of the liability for the additional costs is charged to the Statement of Comprehensive Net Expenditure at the time the Board commits itself to the retirement, regardless of the method of payment. 18) Clinical and Medical Negligence Costs Employing health bodies in Scotland are responsible for meeting medical negligence costs up to a threshold per claim. Costs above this threshold are reimbursed to Boards from a central fund held as part of the Clinical Negligence and Other Risks Indemnity Scheme (CNORIS) by the Scottish Government. NHS Grampian provide for all claims notified to the NHS Central Legal Office according to the value of the claim and the probability of settlement. Claims assessed as ‘Category 3’ are deemed most likely and provided for in full, those in ‘Category 2’ at 50% of the claim and those in ‘Category 1’ at nil. The balance of the value of claims not provided for is disclosed as a contingent liability.']",£28.3 million,['£28.3 million'],Q_2024_FIN_10,Grampian-2023-2024,LEX,number,[29],skipped
What was NHS Grampian's clinical negligence and employer liability provision at year end 2023/24?,"CONTINGENT LIABILITIES AND ASSETS The following quantifiable contingent liabilities have not been provided for in the Accounts: CONTINGENT LIABILITIES* 2023/24 2022/23 £000 £000 Clinical and medical compensation payments 69,736 70,418 Emplo","['FINANCIAL STATEMENTS Note 14. CONTINGENT LIABILITIES AND ASSETS The following quantifiable contingent liabilities have not been provided for in the Accounts: CONTINGENT LIABILITIES* 2023/24 2022/23 £000 £000 Clinical and medical compensation payments 69,736 70,418 Employers Liability payments 230 110 CONTINGENT ASSETS** Clinical and medical compensation payments 67,622 68,072 Employers Liability payments 65 30 *The contingent liability represents a number of claims for clinical negligence and employer’s liability against NHS Grampian, which have not been fully provided for in note 13, and for which the Central Legal Office of the Scottish Government Health Directorates estimates that there is a medium or low risk of NHS Grampian having to make settlement. **The contingent asset reflects the corresponding entitlement to recover the costs of any claim settlement through the Clinical Negligence and Other Risks Indemnity Scheme (CNORIS) which is explained in more detail in note 13 above. The following unquantified contingent liabilities existed at the Balance Sheet date: There are also further claims for clinical negligence and employer’s liability against NHS Grampian that the Central Legal Office of the Scottish Government Health Directorates estimates that there is a low risk of NHS Grampian having to make a settlement. NHS Grampian operates services from a number of leased premises which carry an obligation for', 'concerning the future. The resulting accounting estimates will, by definition, seldom equal the related actual results. The Board makes judgements in applying accounting policies. The estimates, assumptions and judgements that have a significant risk of causing a material adjustment to the carrying amounts of assets and liabilities within the financial statements within the next financial year are addressed below. Clinical and Medical Negligence Provision: The clinical and medical negligence provision is calculated using information received from the Central Legal Office regarding claims they have received relating to NHS Grampian. The provision covers all claims classified as category 3 and 50% of the value of claims in category 2 which have been assessed as having a probability of settlement. The share of the NHS Scotland CNORIS liability is estimated based on actual settlement trends in prior years. The carrying value of both the provision and receivable is as shown below: 2023/24 2022/23* £000’s £000’s Provision recognising individual claims 175,012 154,579 against the NHS Board at 31 March (*) Associated CNORIS receivable at 31 March -173,829 -153,782 *corrected The element of claims in Categories 1 and 2 not covered by the provision is recorded as a contingent liability under Note 14. The sensitivities regarding the categorisation of claims is set out as', 'and receivable is as shown below: 2023/24 2022/23* £000’s £000’s Provision recognising individual claims 175,012 154,579 against the NHS Board at 31 March (*) Associated CNORIS receivable at 31 March -173,829 -153,782 *corrected The element of claims in Categories 1 and 2 not covered by the provision is recorded as a contingent liability under Note 14. The sensitivities regarding the categorisation of claims is set out as follows: Increase in Decrease in Sensitivities at 31 March 2024 Provision Contingent Liability £000’s £000’s 5% increase in claims needing 3,998 -3,998 to be fully provided for Further detail on the Clinical and Medical Negligence Provision is detailed in section 18 above. Pension Provision: The pension provision is calculated using information received from the Scottish Public Pension Agency (SPPA) relating to former NHS Grampian employees for whom NHS Grampian have an ongoing pension liability. Estimation of the liability to pay pensions for these staff depends on a number of complex judgements relating to the discount rates used, the rate at which salaries are projected to increase, changes in retirement ages, mortality rates and expected returns on pension fund assets. Reliance is placed on significant details provided by the actuary of the Pension Fund to establish the value of this liability. The carrying value', 'PERFORMANCE REPORT B PERFORMANCE ANALYSIS provision is reviewed regularly by management considering the risk profile by class of debt. At the year end, the Board provided £65.6 million for legal obligations arising from clinical negligence and other employer liability claims (2022/23 £63.7 million). Details are provided in note 13 on Page 134. 3.2.4 Impact of IJBs on Health Board Accounts – pre-consolidation Each of the three IJBs in Grampian (Aberdeen City, Aberdeenshire and Moray) are established as a separate legal organisation under the terms of the Public Bodies (Joint Working) (Scotland) Act 2014 and have full delegation of functions and resources, acting as principal, to enable integration of primary and community health and social care services. Accordingly, the Health Board is required to', 'above. The following unquantified contingent liabilities existed at the Balance Sheet date: There are also further claims for clinical negligence and employer’s liability against NHS Grampian that the Central Legal Office of the Scottish Government Health Directorates estimates that there is a low risk of NHS Grampian having to make a settlement. NHS Grampian operates services from a number of leased premises which carry an obligation for the costs of dilapidation of the premises on expiry of the lease term. For those premises which have an unexpired lease term of five years or more, the nature and extent of the dilapidation and therefore the associated liability cannot be quantified until the lease is close to expiry. Assets: Band 5 Nursing Regrade: NHS Scotland implemented Agenda for Change (AfC) in 2004. It aimed to modernise pay structures and harmonise terms and conditions across various roles ensuing fairness and consistency in pay and career progression. The Cabinet Secretary has agreed a nursing review starting from 1 April 2024 as there is an expectation that that some Band 5 nurses are now working beyond their pay grade. Staff may self-']",£65.6 million (2022/23 £63.7 million),['£65.6 million (2022/23 £63.7 million)'],Q_2024_FIN_11,Grampian-2023-2024,MOD,number,[30],skipped
What was the total income and expenditure for NHS Grampian Charity in 2023/24?,£3.7M,"[""PERFORMANCE REPORT B PERFORMANCE ANALYSIS The charity’s investment strategy targets investments to deliver sustainable long-term capital growth and consistent income generation, and income generation has been maintained during 2023/24. The national and international economic and political environment was extremely volatile during 2022-23 leading to a reduction in the value of the investment portfolio of circa 7% (£3.7M). Market conditions have been more favourable during 2023-24 with the result that the previous reduction in value has been almost reversed with the portfolio growing in value by just over £3.0 million throughout the year to a current level of £52.3 million. The Charity relies upon the generosity of patients, their relatives, and friends, who have experienced the care of NHS Grampian, and other donors who are generous in their support of the Charity. Total income for the year was £3.905 million (2022/23 £4.112 million) and this is analysed between donations, legacies, and income from investments in the chart below: NHS Grampian Charity Income analysis 1,816 1,609 1,539 1,509 £000's 789 674 634 570 569 401 188 263 255 0 0 OTHER DONATIONS NHS CHARITIES CAPITAL LEGACIES INVESTMENT TOGETHER FUNDRAISING 2023-24 2022/23 2021/22 Total expenditure for the year was £3.359 million (2022/23 £4.002 million), £2.738 million relating to grants for charitable activities (2022/23"", 'following transactions with each IJB in 2023/24: ➢ Aberdeen City – Income £295.7 million, expenditure £288.2 million and a retained creditor balance of £9.7 million. (2022/23 income £279.1 million, expenditure £255.9 million and a retained creditor balance of £17.2million). ➢ Aberdeenshire – Income £285.8 million, expenditure £279.2 million and a retained creditor balance of £4.9 million. (2022/23 Income £270.1 million, expenditure £240.5 million and a retained creditor balance of £11.5 million). ➢ Moray – Income £119.4 million, expenditure £115.8 million and a retained creditor balance of £1.7 million. (2022/23 Income £110.1 million, expenditure £97.2 million and a retained creditor balance of £2.8 million). NHS Grampian Endowment Funds (Operating as NHS Grampian Charity) All members of the NHS Grampian Board also function as Trustees of the NHS Grampian Charity. The total NHS Grampian Charity balance at 31 March 2024 was £48.848 million (2022/23 £45.253 million). During the year payments totalling £2.826 million (2022/23 £1.891 million) were made to NHS Grampian by the NHS Grampian Charity to enable a range of research and other activities including infrastructure improvement for the benefit of patients and staff. The NHS Charity received £0.07 million (2022/23 £0.219 million) from NHS Grampian mainly from income for research activities. Chest, Heart & Stroke Scotland Mrs A Anderson, Non-Executive', 'million). During the year payments totalling £2.826 million (2022/23 £1.891 million) were made to NHS Grampian by the NHS Grampian Charity to enable a range of research and other activities including infrastructure improvement for the benefit of patients and staff. The NHS Charity received £0.07 million (2022/23 £0.219 million) from NHS Grampian mainly from income for research activities. Chest, Heart & Stroke Scotland Mrs A Anderson, Non-Executive Board Member (up to 30/11/23) was also Chair of Chest, Heart & Stroke Scotland during 2023/24. NHS Grampian had the following transactions in 2023/24; income £0, expenditure £72,940 (2022/23 expenditure of £202,020). Aberdeen in Recovery Mrs L Grugeon, Non Executive Board Member (up to 16/10/23) was also a Trustee of Aberdeen In Recovery during 2023/24. NHS Grampian had the following transactions in 2023/24; income £0, expenditure £114,873 (2022/23 expenditure of £20,000).', ""this is analysed between donations, legacies, and income from investments in the chart below: NHS Grampian Charity Income analysis 1,816 1,609 1,539 1,509 £000's 789 674 634 570 569 401 188 263 255 0 0 OTHER DONATIONS NHS CHARITIES CAPITAL LEGACIES INVESTMENT TOGETHER FUNDRAISING 2023-24 2022/23 2021/22 Total expenditure for the year was £3.359 million (2022/23 £4.002 million), £2.738 million relating to grants for charitable activities (2022/23 £3.471 million), £0.419 million on staffing and support costs (2022/23 £0.334 million) and £0.202 million on investment management fees (2022/23 £0.197 million). The net effect was a surplus of income over expenditure for the year of £0.546 million The charity will continue to work closely with all relevant Health and related services, to ensure that available funds are utilised effectively, improving the health and wellbeing of patients and staff in line with the wishes of our donors. 3.1.2 Integration Joint Boards (IJBs)"", 'partner organisation e.g. a university or a local authority, they were remunerated through the payroll of that partner organisation. All Board members deemed to have significant financial responsibility during the year were remunerated through NHS Grampian’s payroll. 9. Exit packages There were 6 exit packages agreed during the year which were compulsory redundancies. 2023/24 2022/23 Exit Package cost band Total number of exit Total number of exit packages by cost band packages by cost band £0 - £10,000 6 15 Total Resource Cost (£’000) 21 36 10. Expenditure on consultancy Expenditure on external consultancy during 2023/24 was £3,800 (2022/23 £2,917).']",Total income: £3.905 million; total expenditure: £3.359 million,['Total income: £3.905 million; total expenditure: £3.359 million'],Q_2024_FIN_12,Grampian-2023-2024,MOD,number,[23],skipped
How many directly employed staff did NHS Grampian have in 2023/24?,3,"['and any employees who become disabled can continue to contribute to the work of the Board. During 2023/24 NHS Grampian employed an average 76.1WTE (headcount 92) staff with a disability compared to 71.8WTE (headcount 102) in 2022/23. The NHS Grampian Equality, Diversity and Human Rights Policy can be accessed at the following link https://www.nhsgrampian.org/about-us/equality-and-diversity/. This covers, in detail, the employment of disabled persons including recruitment and selection, treatment during employment and monitoring arrangements. The policy also lists the other NHS Grampian Policies which are in place to ensure that applicants for posts with a disability and staff in post with a disability are treated fairly and that everything reasonably possible is done to meet their needs. This includes providing appropriate support and making reasonable adjustments, training, career development and promotion of disabled persons. 7. Other employee matters such as diversity and equal treatment NHS Grampian fully complies with the requirements of the Equality Act (Specific Duties) (Scotland) Regulations 2012. More information, including the key reports listed below, can be accessed at the following link https://www.nhsgrampian.org/about-us/equality-and-', 'ongoing to meet the needs of recent refugees and asylum seekers. We provided multi-lingual presentations in their hotels and have explained about NHS services and how to access them, facilitated by ""face to face” interpreters and supported by translated materials. Appropriate information and healthcare support has also been provided to these groups, in co-operation with Health and Social Care Partnership (HSCP) and local authorities. Staff continue to use the “Health Passport” where non-English speaking patients can record details about their communication needs, general information about their health condition and contact details of health providers (e.g. GP, dentist etc.). Consultation and engagements with our local ethnic minority communities Since 2008, NHS Grampian has carried out at least 5 involvement and consultation events with our local ethnic communities every year. These have been carried out on a joint basis with the Grampian Regional Equality Council (GREC). NHS Grampian and GREC continue to work together to ensure ethnic communities can access key information on health issues including mental health and wellbeing, active lifestyle, screening and vaccination. Information has been made widely available in our main local ethnic community languages for -non-English speaking people. It has also been made widely available in many different formats to assist our local disability communities. NHS Services provide', 'PERFORMANCE REPORT A OVERVIEW The financial challenges NHS Grampian faced in 2023/24 are highlighted in the Annual Report and Accounts for this year. The Accounts show a small underspend against the revenue budget, but this was only achieved due to additional repayable financial support (known as “brokerage”) being provided to the Board by the Scottish Government. This highlights the severe financial pressures currently being faced by the health system in the North East. This challenging financial position is anticipated to continue into future years. The Chief Executive Team of the Board have been working to implement a risk based approach to managing this challenge which involves achieving an appropriate balance between our financial position, clinical governance matters, staff wellbeing and prevention. During the year a significant amount of work has been undertaken to further develop and implement a local value and sustainability programme engaging widely with colleagues across the system. The purpose of this programme is to deliver short term efficiency savings and over the medium to longer term work on how we transform services and pathways of care to make them sustainable in terms of quality of care, staffing and finance. I recognise the significant financial and workforce challenges not only facing NHS Grampian but impacting on the whole', 'engaging widely with colleagues across the system. The purpose of this programme is to deliver short term efficiency savings and over the medium to longer term work on how we transform services and pathways of care to make them sustainable in terms of quality of care, staffing and finance. I recognise the significant financial and workforce challenges not only facing NHS Grampian but impacting on the whole public sector. We will continue to work with our partners, citizens, and colleagues to explore opportunities for greater collaboration locally, regionally and nationally to ensure provision of high quality, safe, efficient and sustainable services which meet the needs of the population. Our operational performance has been impacted by the health debt generated over the recent years of the COVID-19 pandemic and recovery and our low bed base. During the financial year 2023/24 we have not been able to balance our revenue budget and have relied on using one-off income, savings and additional funding to support the financial position. These income and savings will unfortunately not be available in future years, and I do not underestimate the challenge facing NHS Grampian in balancing future budgets. In 2023/24 NHS Grampian has also been escalated from Stage 1 to Stage 2 of the Scottish Government’s support', 'PERFORMANCE REPORT A OVERVIEW 3. Background and Principal Activities Grampian Health Board is responsible for leading efforts to improve the health of the people in Grampian, and for providing the health care services that people need. We also provide some specialist clinical and support services to other NHS Boards within the North of Scotland and some national services for the whole of Scotland. 17,000 directly employed staff and a range of independent primary care practices (69 General Medical, 130 Pharmacy, 91 Dental and 54 Opticians) provide the full range of primary, community and specialist health services to the over half-million people who live in Grampian. Services are provided at over 100 locations and where possible in people’s own homes across an area covering 3,000 square miles of city, town and village and rural communities. We are the fourth largest health board in Scotland by general funding allocation. Services are delivered based on a portfolio management structure covering Family services, Surgical and Clinical Support Services, Medical and Unscheduled Care, Mental Health and wellbeing, Population Health and services across Aberdeen City, Aberdeenshire, and Moray. The portfolio arrangements include, a range of Primary and Community Care services delegated to the three Integration Joint Boards (IJBs) covering Aberdeen City, Aberdeenshire, and Moray. All our']","17,000","['17,000']",Q_2024_FIN_13,Grampian-2023-2024,LEX,number,[5],skipped
What was the net expenditure figure in Note 2A Summary of Core Revenue Resource Outturn for 2023/24?,£60.627 million,"['PERFORMANCE REPORT B PERFORMANCE ANALYSIS Memorandum for In Year Out-turn £000 Core Revenue Resource Variance Surplus in 2023/24 97 Financial flexibility: funding banked with/(provided by) -24,800 Scottish Government Underlying Deficit against Core Revenue Resource Limit -24,703 1.66% Further details on non-core elements of expenditure, typically comprising items of a technical accounting nature, can be found in the Summary of Resource Outturn. NHS Grampian was not able to set a balanced revenue budget for the 2023/24 financial year. The financial plan submitted to Scottish Government in March 2023 projected a £60.627 million deficit for the year after assuming savings achievement for the year of £16.557 million. Scottish Government confirmed additional funding for Health Boards in May which reduced the projected deficit to £42.936 million and further additional funding in February which has reduced the projected deficit to £25.103 million. The deficit highlights the level of financial challenge experienced during the year driven mainly by a combination of continuing service pressures and high levels of general inflation. Difficulties in recruitment and high demand for services have resulted in significant cost pressures in a number of areas, with the costs of supplementary staffing being a particular driver. Formal monthly reporting of the Board’s financial position to the Scottish Government commenced from quarter 1', 'consequences of ongoing activity and net capital investment. Health Boards are required to contain their net expenditure within these limits, and report on any variation. NHS Grampian’s 2023/24 performance against these three key financial targets is shown in the table below: Statutory Financial Targets Limit as set Actual Variance by SGHSCD Outturn (Deficit)/Sur plus £000’s £000’s £000’s 1,440,632 1,440,535 97 Core Revenue Resource Limit 48,416 48,416 0 Non-Core Revenue Resource Limit 1,489,048 1,488,951 97 Total Revenue Resource Limit Core Capital Resource Limit 113,641 113,641 - Non-Core Capital Resource Limit 3,465 3,465 - Total Capital Resource Limit 117,106 117,106 - Cash Requirement 1,649,045 1,649,045 -', 'should be reversed to offset any subsequent increase in value relating to that particular asset. The net value of impairment reversal on those assets subject to an upward movement in valuation, was £0.728 million (2022/23 £0.657 million upward impairment) and this was credited to net operating expenditure within the Statement of Comprehensive Net Expenditure. Further information is available in the section on key sources of judgement, estimation, and uncertainty in note 1 accounting policies, on Page 97. 3.2.6 Pension Liabilities The accounting policy for pensions is provided in Note 1 to the Accounts and disclosure of the costs is shown within Note 19 and the Remuneration Report. 3.2.7 Infrastructure and Non-Current Assets The Board delivered a programme of infrastructure investment totalling £121.3 million during 2023/24. Within this, a total of £117.442 million of capital expenditure was incurred (see note 7d) and a further £3.87 million was classed as revenue expenditure in nature. The overall programme was resourced using a combination of capital funding from the SGHSCD (£113.6 million, see note 7d), income from donations (£1.25 million), financial transactions funding from the Scottish Government for GP sustainability Loans (£2.24 million), NBV benefit from disposal of equipment (£0.31 million) and various revenue funding sources (£3.87 million) Major investments during the year include:', 'support, the Board’s final outturn would have been an overspend of £24.703 million (equivalent to 1.66% of the Revenue Resource Limit). A surplus of £0.97 million against the Core Revenue Resource Limit is reported for 2023/24 reflecting this financial support. In November 2023, Scottish Government also informed NHS Grampian that the Board had been escalated from Stage 1 to Stage 2 of the NHS Scotland Support and Intervention Framework as a result of the Board’s financial position. This means that scheduled engagement and review of performance between the Scottish Government and the Board will continue through the usual channels. NHS Grampian submitted its 2024/25 Financial Plan to the Scottish Government in March 2024. The plan does not present a break-even position, recognising the significant work to', 'PERFORMANCE REPORT B PERFORMANCE ANALYSIS 3.2 NHS Grampian performance against statutory financial targets The results of each of the partner organisations, although consolidated with the main Board accounts for group accounting purposes, do not form part of the statutory financial target set for NHS Boards by the Scottish Government Health and Social Care Directorates (SGHSCD) and are, therefore, not taken into account when considering the Board’s in year financial performance. NHS Boards have the ability to manage small under/overspends (within 1% of resource) of an overall breakeven position across a three- year period (2023-26). The Scottish Government require NHS Boards to meet three key financial targets: ➢ Revenue Resource Limit (RRL) – a resource budget for ongoing activity; ➢ Capital Resource Limit (CRL) – a resource budget for net capital investment; and ➢ Cash Requirement – a financing requirement to fund the cash consequences of ongoing activity and net capital investment. Health Boards are required to contain their net expenditure within these limits, and report on any variation. NHS Grampian’s 2023/24 performance against these three key financial targets is shown in the table below: Statutory Financial Targets Limit as set Actual Variance by SGHSCD Outturn (Deficit)/Sur plus £000’s £000’s £000’s 1,440,632 1,440,535 97 Core Revenue Resource Limit 48,416 48,416 0']","£1,583,114 thousand","['£1,583,114 thousand']",Q_2024_FIN_14,Grampian-2023-2024,STR,number,[118],skipped
What efficiency savings did NHS Grampian achieve in 2023/24 against its target?,These included amongst other measures: Development of an Integrated Performance Assurance Framework - Vacancy Controls - Review and control agency nursing and locum spend - Efficiency savings programme - Value and sustainability programme -,"['with associated funding arrangements. 3.2.1 Delivering Sustainable Healthcare – Finding Balance This was the first time that NHS Grampian has overspent against its revenue budget and highlights the severe pressures that the health system faces in the North East of Scotland. A number of actions were taken to combat this overspend including the development in the year. These included amongst other measures: Development of an Integrated Performance Assurance Framework - Vacancy Controls - Review and control agency nursing and locum spend - Efficiency savings programme - Value and sustainability programme - 3.2.2 Efficiency Savings Efficiency savings of £17.52 million (2022/23 £10.2 million) were achieved against a target of £16.51 million (2022/23 £5.4 million) for NHS Grampian services. The scale of these savings was significantly higher than in the previous year and the delivery of these savings was supported by the development of an assurance and performance framework. A Programme Management Office was implemented to support this along with other elements of value and sustainability work. The main savings achieved were in the areas of agency spend including medical locum and nursing costs, hospital drug costs from switching from branded medicines to generic alternatives, procurement, cross boundary charges, energy efficiency and overtime costs.', 'engaging widely with colleagues across the system. The purpose of this programme is to deliver short term efficiency savings and over the medium to longer term work on how we transform services and pathways of care to make them sustainable in terms of quality of care, staffing and finance. I recognise the significant financial and workforce challenges not only facing NHS Grampian but impacting on the whole public sector. We will continue to work with our partners, citizens, and colleagues to explore opportunities for greater collaboration locally, regionally and nationally to ensure provision of high quality, safe, efficient and sustainable services which meet the needs of the population. Our operational performance has been impacted by the health debt generated over the recent years of the COVID-19 pandemic and recovery and our low bed base. During the financial year 2023/24 we have not been able to balance our revenue budget and have relied on using one-off income, savings and additional funding to support the financial position. These income and savings will unfortunately not be available in future years, and I do not underestimate the challenge facing NHS Grampian in balancing future budgets. In 2023/24 NHS Grampian has also been escalated from Stage 1 to Stage 2 of the Scottish Government’s support', 'PERFORMANCE REPORT A OVERVIEW The financial challenges NHS Grampian faced in 2023/24 are highlighted in the Annual Report and Accounts for this year. The Accounts show a small underspend against the revenue budget, but this was only achieved due to additional repayable financial support (known as “brokerage”) being provided to the Board by the Scottish Government. This highlights the severe financial pressures currently being faced by the health system in the North East. This challenging financial position is anticipated to continue into future years. The Chief Executive Team of the Board have been working to implement a risk based approach to managing this challenge which involves achieving an appropriate balance between our financial position, clinical governance matters, staff wellbeing and prevention. During the year a significant amount of work has been undertaken to further develop and implement a local value and sustainability programme engaging widely with colleagues across the system. The purpose of this programme is to deliver short term efficiency savings and over the medium to longer term work on how we transform services and pathways of care to make them sustainable in terms of quality of care, staffing and finance. I recognise the significant financial and workforce challenges not only facing NHS Grampian but impacting on the whole', 'closely with other organisations, including NHS Scotland Counter Fraud Services (CFS) and other government agencies to combat fraud. This includes participation in the bi-annual National Fraud Initiative which is a data matching exercise. The Board also takes part in a post payment patient exemption eligibility verification system, which covers all Family Health Service expenditure. 5. Payment Policy NHS Grampian is committed to supporting the Scottish Government in helping businesses during the current economic situation by paying bills more quickly. The intention is to achieve payment of all undisputed invoices within 10 working days, across all public bodies and NHS Grampian is actively working towards achievement of this accelerated payment target. - In 2023/24, the average credit taken was 14 days (2022/23 15 days). - In 2023/24 93% of invoices by value (2022/23 91%) and 90% of invoices by volume (2022/23 86%) were paid within 30 days. - In 2023/24 87% of invoices by value (2022/23 85%) and 79% of invoices by volume (2022/23 73%) were paid within 10 days. The small improvement in payment performance compared to the prior year reflects work to support the purchase to pay process during the year despite challenges around the impact of wider system pressures on support teams. 6. Social Matters NHS Grampian promotes', ""A CORPORATE GOVERNANCE REPORT 10. Remuneration for Non-Audit Work Grant Thornton UK LLP, the Board’s external auditor, received no fees for non-audit work during 2023/24 (2022/23 £0). PricewaterhouseCoopers LLP who provide an Internal Audit Service to NHS Grampian received no fees for non-audit work during 2023/24 (2022/23 £0). 11. Public Services Reform (Scotland) Act 2010 Sections 31 and 32 of the Public Services Reform (Scotland) Act 2010 impose duties on NHS Grampian to publish information on expenditure, economic sustainability and efficiency as soon as is reasonably practicable after the end of each financial year. The information required to comply with these disclosure requirements is not an integral part of the Annual Accounts and is displayed on the NHS Grampian website at the following link: https://www.nhsgrampian.org/about-us/corporate-documents-and-commitments/public- services-reform/ 12. Personal Data Related Incidents NHS Grampian reported personal data related incidents to the Information Commissioners Office (ICO) on 25 occasions during 2023/24 (2022/23 - 21). Of these, six did not meet the threshold for notification but NHS Grampian notified the Information Commissioner's Office voluntarily for their awareness. Recommendations were made and considered, but no enforcement action or penalties were applied by ICO. 13. Financial Instruments Information in respect of the financial risk management objectives and policies of the Board and the exposure of""]",£17.52 million achieved against a target of £16.51 million,['£17.52 million achieved against a target of £16.51 million'],Q_2024_SAV_01,Grampian-2023-2024,LEX,number,[28],skipped
What ceiling did the Scottish Government place on NHS Grampian's core operational spending for 2024/25?,000,"['PERFORMANCE REPORT B PERFORMANCE ANALYSIS Memorandum for In Year Out-turn £000 Core Revenue Resource Variance Surplus in 2024/25 253 Financial flexibility: funding banked with/(provided by) -65,200 Scottish Government Underlying Deficit against Core Revenue Resource Limit -64,947 4.17% Further details on non-core elements of expenditure, typically comprising items of a technical accounting nature, can be found in the Summary of Resource Outturn see page 127. NHS Grampian was not able to set a balanced revenue budget for the 2024/25 financial year. The financial plan submitted to Scottish Government in March 2024 projected a £59.1 million deficit for the year after forecasting savings of £34.9 million. Scottish Government confirmed additional funding for Health Boards across the year of £17 million, also cost pressures of £22.8 million of which £21.4', 'This was compounded by the requirement to provide deficit funding to the three IJBs which largely relates to social care. Formal monthly reporting of the Board’s financial position to the Scottish Government is in place with ongoing dialogue throughout the year relating to funding allocations and other cost control measures that have been progressed during the year to mitigate the Boards financial position. In order to achieve in-year financial balance Scottish Government has provided the Board with financial support in the form of repayable brokerage of £65.2 million for a second year (2023/24 £24.8 million). The brokerage is repayable to the Scottish Government at the point in the future when the Board returns to financial balance. Without this additional support, the Board’s final outturn would have been an overspend of £64.948 million (equivalent to 4.17% of the Revenue Resource Limit). A surplus of £0.253 million against the Core Revenue Resource Limit is reported for 2024/25 reflecting this financial support.', 'PERFORMANCE REPORT B PERFORMANCE ANALYSIS NHS Grampian has been receiving support from the Scottish Government since November 2023, when the Board was escalated to Stage 2 of the Scottish Government’s Support and Intervention Framework. Further escalation took place in January 2025, when NHS Grampian was escalated to Stage 3 of the framework based on the deterioration in the financial position of the Board during 2024/25 and the recommendation of the National Planning and Performance Oversight Group. Senior officers from within NHS Grampian continue to work closely with the Scottish Government to identify and implement solutions to return the Board to financial balance. In 2024/25 NHS Grampian has also been escalated from Stage 2 to Stage 3 of the Scottish Government’s Support & Intervention Framework because of the Board’s financial position and have benefited from additional support and scrutiny. Escalation to Stage 4 was confirmed on 12 May 2025 due to financial sustainability and the deterioration of the Board’s financial position during 2024/25; and Leadership and Governance, it will bring enhanced scrutiny and support from the Scottish Government to develop and deliver a Recovery Plan. NHS Grampian submitted its’ 2025/26 Financial Plan to the Scottish Government in March 2025. The plan does not present a break-even position, recognising the significant work', 'saving targets in place for this financial year have been met. - Workforce, finance, and system pressures in general continue as enduring risks affecting NHS Grampian’s ability to maintain momentum towards delivery of our identified strategic objectives. 5. Going Concern Assessment Grampian Health Board is a statutory body and was established in 1972 under the National Health Services (Scotland) Act 1972 and is responsible for commissioning services for the residents of Grampian. NHS Grampian submitted its 2025/2026 financial plan to the Scottish Government in March 2025. The plan does not represent a break-even position recognising the significant work to be undertaken to bring the Board back into sustainable financial balance. However, despite these financial performance challenges it is assumed the organisation has adequate support from the Scottish Government to continue in operational existence for the foreseeable future. There are no material uncertainties relating to events or conditions to date that, individually or collectively, may cast significant doubt on the ability of the board to continue in its operation. The accounts have been prepared on a going concern basis, as the NHS Board will continue in operational existence and continue to provide services for the foreseeable future, with no indication by Scottish Ministers of any intention for dissolution.', 'confirmed on 12 May 2025 due to financial sustainability and the deterioration of the Board’s financial position during 2024/25; and Leadership and Governance, it will bring enhanced scrutiny and support from the Scottish Government to develop and deliver a Recovery Plan. NHS Grampian submitted its’ 2025/26 Financial Plan to the Scottish Government in March 2025. The plan does not present a break-even position, recognising the significant work to be undertaken to bring the Board back into sustainable financial balance. Scottish Government has instructed NHS Grampian to reduce the scale of the deficit in both 2025/26 and the remainder of this plan and a Recovery Plan will reflect this. The Board expects to record a further revenue deficit in the 2025/26 financial year but is planning for the level of deficit to reduce over the following subsequent financial years as outlined in the Medium-Term Financial Plan. It recognises the significant work to be undertaken to bring the Board back into sustainable financial balance. The plan takes a risk-based approach recognising the need to identify and contain operational overspends without compromising on the level and quality of services NHS Grampian provides. Discussions will continue with the Scottish Government over the provision of further funding cover (known as “brokerage”) to support the projected']","£1,559,285 (£000)","['£1,559,285 (£000)']",Q_2025_FIN_01,Grampian-2024-2025,STR,number,[28],skipped
How much did NHS Grampian actually spend against its core resource budget in 2024/25?,3.2,"['PERFORMANCE REPORT B PERFORMANCE ANALYSIS Memorandum for In Year Out-turn £000 Core Revenue Resource Variance Surplus in 2024/25 253 Financial flexibility: funding banked with/(provided by) -65,200 Scottish Government Underlying Deficit against Core Revenue Resource Limit -64,947 4.17% Further details on non-core elements of expenditure, typically comprising items of a technical accounting nature, can be found in the Summary of Resource Outturn see page 127. NHS Grampian was not able to set a balanced revenue budget for the 2024/25 financial year. The financial plan submitted to Scottish Government in March 2024 projected a £59.1 million deficit for the year after forecasting savings of £34.9 million. Scottish Government confirmed additional funding for Health Boards across the year of £17 million, also cost pressures of £22.8 million of which £21.4', 'PERFORMANCE REPORT B PERFORMANCE ANALYSIS 3.2 NHS Grampian performance against statutory financial targets The results of each of the partner organisations, although consolidated with the main Board accounts for group accounting purposes, do not form part of the statutory financial target set for NHS Boards by the Scottish Government Health and Social Care Directorates (SGHSCD) and are, therefore, not taken into account when considering the Board’s in year financial performance. NHS Boards have the ability to manage small under/overspends (within 1% of resource) of an overall breakeven position across a three- year period (2024-27). The Scottish Government require NHS Boards to meet three key financial targets: \uf0d8 Revenue Resource Limit (RRL) – a resource budget for ongoing activity; \uf0d8 Capital Resource Limit (CRL) – a resource budget for net capital investment; and \uf0d8 Cash Requirement – a financing requirement to fund the cash consequences of ongoing activity and net capital investment. Health Boards are required to contain their net expenditure within these limits, and report on any variation. NHS Grampian’s 2024/25 performance against these three key financial targets is shown in the table below: Statutory Financial Targets Limit as set Actual Variance by SGHSCD Outturn (Deficit)/Sur plus £000’s £000’s £000’s Core Revenue Resource Limit 1,559,285 1,559,032 253 Non-Core Revenue Resource', 'consequences of ongoing activity and net capital investment. Health Boards are required to contain their net expenditure within these limits, and report on any variation. NHS Grampian’s 2024/25 performance against these three key financial targets is shown in the table below: Statutory Financial Targets Limit as set Actual Variance by SGHSCD Outturn (Deficit)/Sur plus £000’s £000’s £000’s Core Revenue Resource Limit 1,559,285 1,559,032 253 Non-Core Revenue Resource Limit 40,219 40,219 0 Total Revenue Resource Limit 1,599,504 1,599,251 253 Core Capital Resource Limit 86,909 86,909 - Non-Core Capital Resource Limit 623 623 - Total Capital Resource Limit 87,532 87,532 - Cash Requirement 1,706,002 1,706,002 -', 'Financial Plan. It recognises the significant work to be undertaken to bring the Board back into sustainable financial balance. The plan takes a risk-based approach recognising the need to identify and contain operational overspends without compromising on the level and quality of services NHS Grampian provides. Discussions will continue with the Scottish Government over the provision of further funding cover (known as “brokerage”) to support the projected revenue deficit. It is expected NHS Grampian will continue in operational existence for the foreseeable future, with no indication by Scottish Ministers of any intention for dissolution without transfer of services or functions to another entity with associated funding arrangements. 3.2.1 Delivering Sustainable Healthcare – Finding Balance This was the second successive year that NHS Grampian has overspent against its revenue budget and highlights the severe pressures that the health system faces in the North East of Scotland. A number of actions were taken to combat this overspend including the development in the year. These included amongst other measures: Embedding of an Integrated Performance Assurance Framework \uf0b7 Enhanced Vacancy and Non-Pay Controls \uf0b7', 'PERFORMANCE REPORT A OVERVIEW Together with our colleagues, partners and the public we are committed to planning for a better future and transforming our services in support of the delivery of safe, high quality, person-centred and sustainable health services over the next five years and beyond. The financial challenges NHS Grampian faced in 2024/25 are highlighted in the Annual Report and Accounts for this year. This challenging financial position is anticipated to continue into future years and work continues to seek financial savings to support our financial recovery. The Accounts show a small underspend against the revenue budget, but this was only achieved due to additional repayable financial support (known as “brokerage”) being provided to the Board, for a second year, by the Scottish Government. This highlights the severe financial pressures currently being faced by the health system in the North East. In 2024/25 NHS Grampian has also been escalated from Stage 2 to Stage 3 of the Scottish Government’s Support & Intervention Framework because of the Board’s financial position and have benefited from additional support and scrutiny. Escalation to Stage 4 was confirmed on 12 May 2025 due to financial sustainability and the deterioration of the Board’s financial position during 2024/25; and Leadership and Governance following rising concerns about']","£1,559,032 (£000)","['£1,559,032 (£000)']",Q_2025_FIN_02,Grampian-2024-2025,MOD,number,[28],skipped
By how much did NHS Grampian's actual core expenditure differ from its revenue resource limit in 2024/25?,"1,559,285","['consequences of ongoing activity and net capital investment. Health Boards are required to contain their net expenditure within these limits, and report on any variation. NHS Grampian’s 2024/25 performance against these three key financial targets is shown in the table below: Statutory Financial Targets Limit as set Actual Variance by SGHSCD Outturn (Deficit)/Sur plus £000’s £000’s £000’s Core Revenue Resource Limit 1,559,285 1,559,032 253 Non-Core Revenue Resource Limit 40,219 40,219 0 Total Revenue Resource Limit 1,599,504 1,599,251 253 Core Capital Resource Limit 86,909 86,909 - Non-Core Capital Resource Limit 623 623 - Total Capital Resource Limit 87,532 87,532 - Cash Requirement 1,706,002 1,706,002 -', 'PERFORMANCE REPORT B PERFORMANCE ANALYSIS 3.2 NHS Grampian performance against statutory financial targets The results of each of the partner organisations, although consolidated with the main Board accounts for group accounting purposes, do not form part of the statutory financial target set for NHS Boards by the Scottish Government Health and Social Care Directorates (SGHSCD) and are, therefore, not taken into account when considering the Board’s in year financial performance. NHS Boards have the ability to manage small under/overspends (within 1% of resource) of an overall breakeven position across a three- year period (2024-27). The Scottish Government require NHS Boards to meet three key financial targets: \uf0d8 Revenue Resource Limit (RRL) – a resource budget for ongoing activity; \uf0d8 Capital Resource Limit (CRL) – a resource budget for net capital investment; and \uf0d8 Cash Requirement – a financing requirement to fund the cash consequences of ongoing activity and net capital investment. Health Boards are required to contain their net expenditure within these limits, and report on any variation. NHS Grampian’s 2024/25 performance against these three key financial targets is shown in the table below: Statutory Financial Targets Limit as set Actual Variance by SGHSCD Outturn (Deficit)/Sur plus £000’s £000’s £000’s Core Revenue Resource Limit 1,559,285 1,559,032 253 Non-Core Revenue Resource', 'PERFORMANCE REPORT B PERFORMANCE ANALYSIS Memorandum for In Year Out-turn £000 Core Revenue Resource Variance Surplus in 2024/25 253 Financial flexibility: funding banked with/(provided by) -65,200 Scottish Government Underlying Deficit against Core Revenue Resource Limit -64,947 4.17% Further details on non-core elements of expenditure, typically comprising items of a technical accounting nature, can be found in the Summary of Resource Outturn see page 127. NHS Grampian was not able to set a balanced revenue budget for the 2024/25 financial year. The financial plan submitted to Scottish Government in March 2024 projected a £59.1 million deficit for the year after forecasting savings of £34.9 million. Scottish Government confirmed additional funding for Health Boards across the year of £17 million, also cost pressures of £22.8 million of which £21.4', '6) Funding 6 (a) Grampian Health Board Most of the expenditure of the Health Board as Commissioner is met from funds advanced by the Scottish Government within an approved revenue resource limit (RRL) . Cash drawn down to fund expenditure within this approved revenue resource limit is credited to the general fund. All other income receivable by the board that is not classed as funding is recognised when the transfer of goods or services (the performance obligation) is satisfied. Where income is received for goods or services that will not be delivered in the current financial year, that income is deferred. Income from the sale of non-current assets is recognised only when all material conditions of sale have been met, and is measured as the sums due under the sale contract. Non-discretionary funding out-with the RRL is allocated to match actual expenditure incurred for the provision of specific pharmaceutical, dental or ophthalmic services identified by the Scottish Government. Non-discretionary expenditure is disclosed in the accounts and deducted from operating costs charged against the RRL in the Statement of Resource Outturn. Funding for the acquisition of capital assets received from the Scottish Government is credited to the general fund when cash is drawn down. Expenditure on goods and services is recognised', 'for the provision of specific pharmaceutical, dental or ophthalmic services identified by the Scottish Government. Non-discretionary expenditure is disclosed in the accounts and deducted from operating costs charged against the RRL in the Statement of Resource Outturn. Funding for the acquisition of capital assets received from the Scottish Government is credited to the general fund when cash is drawn down. Expenditure on goods and services is recognised when, and to the extent that they have been received, and is measured at the fair value of those goods and services. Expenditure is recognised in the Statement of Comprehensive Net Expenditure except where it results in the creation of a non-current asset such as property, plant and equipment in which case it is recognised in the Balance Sheet. 6(b) NHS Grampian Endowment Funds (operating as NHS Grampian Charity) All incoming resources are recognised once the NHS Grampian Charity Funds has received its entitlement to the resources, it is probable that the resources will be received and the monetary value of incoming resources can be measured with sufficient reliability. Legacies and donations to the NHS Grampian Charity Funds are accounted for as incoming resources upon confirmation of legal entitlement and classified as restricted or unrestricted based on the donors stated wishes. Income from']",£253 (£000),['£253 (£000)'],Q_2025_FIN_03,Grampian-2024-2025,MOD,number,[28],skipped
What was the Cash Requirement limit for NHS Grampian in 2024/25?,NHS Grampian’s 2024/25 performance against these three key financial targets is shown in the table below: Statutory Financial Targets Limit as set Actual Variance by SGHSCD Outturn (Deficit)/Sur plus £000’s £000’s £000’s Core Revenue Resour,"['consequences of ongoing activity and net capital investment. Health Boards are required to contain their net expenditure within these limits, and report on any variation. NHS Grampian’s 2024/25 performance against these three key financial targets is shown in the table below: Statutory Financial Targets Limit as set Actual Variance by SGHSCD Outturn (Deficit)/Sur plus £000’s £000’s £000’s Core Revenue Resource Limit 1,559,285 1,559,032 253 Non-Core Revenue Resource Limit 40,219 40,219 0 Total Revenue Resource Limit 1,599,504 1,599,251 253 Core Capital Resource Limit 86,909 86,909 - Non-Core Capital Resource Limit 623 623 - Total Capital Resource Limit 87,532 87,532 - Cash Requirement 1,706,002 1,706,002 -', 'PERFORMANCE REPORT B PERFORMANCE ANALYSIS 3.2 NHS Grampian performance against statutory financial targets The results of each of the partner organisations, although consolidated with the main Board accounts for group accounting purposes, do not form part of the statutory financial target set for NHS Boards by the Scottish Government Health and Social Care Directorates (SGHSCD) and are, therefore, not taken into account when considering the Board’s in year financial performance. NHS Boards have the ability to manage small under/overspends (within 1% of resource) of an overall breakeven position across a three- year period (2024-27). The Scottish Government require NHS Boards to meet three key financial targets: \uf0d8 Revenue Resource Limit (RRL) – a resource budget for ongoing activity; \uf0d8 Capital Resource Limit (CRL) – a resource budget for net capital investment; and \uf0d8 Cash Requirement – a financing requirement to fund the cash consequences of ongoing activity and net capital investment. Health Boards are required to contain their net expenditure within these limits, and report on any variation. NHS Grampian’s 2024/25 performance against these three key financial targets is shown in the table below: Statutory Financial Targets Limit as set Actual Variance by SGHSCD Outturn (Deficit)/Sur plus £000’s £000’s £000’s Core Revenue Resource Limit 1,559,285 1,559,032 253 Non-Core Revenue Resource', 'PERFORMANCE REPORT B PERFORMANCE ANALYSIS Memorandum for In Year Out-turn £000 Core Revenue Resource Variance Surplus in 2024/25 253 Financial flexibility: funding banked with/(provided by) -65,200 Scottish Government Underlying Deficit against Core Revenue Resource Limit -64,947 4.17% Further details on non-core elements of expenditure, typically comprising items of a technical accounting nature, can be found in the Summary of Resource Outturn see page 127. NHS Grampian was not able to set a balanced revenue budget for the 2024/25 financial year. The financial plan submitted to Scottish Government in March 2024 projected a £59.1 million deficit for the year after forecasting savings of £34.9 million. Scottish Government confirmed additional funding for Health Boards across the year of £17 million, also cost pressures of £22.8 million of which £21.4', 'B REMUNERATION AND STAFF REPORT 10. Expenditure on consultancy Expenditure on external consultancy during 2024/25 was £185,315 (2023/24 £3,800). NHS Grampian has used 3 consultancy firm during 2024/25 (1 in 2023/24). These suppliers provided consultancy services in a number of areas including capital projects, construction and building infrastructure planning and infection control issues. Consultancy services are used for the provision of specialist expertise which is not available from NHS Grampian’s own staff and therefore represent a value for money alternative to the direct employment of specialist staff. 11. Trade Union (Facility Time Publication Requirements) Regulations 2017 The Trade Union (Facility Time Publication Requirements) Regulations 2017 requirement relevant public sector employers to publish, a range of data on the amount and cost of facility time. The following information relating to NHS Grampian is also published on the NHS Grampian website at https://www.nhsgrampian.org/about-us/annual-accounts/ Number of employees who were relevant Full-time equivalent employee union officials during the period 1 April number 2024 to 31 March 2025 108 89.07 Percentage of time spent on facility time Percentage of time Number of representatives 0% 69 1 - 50% 28 51-99% 5 100% 6 Percentage of pay bill spent on facility time Total cost of facility time £0.539 million Total pay bill £1,064.7 million Percentage of', 'This was compounded by the requirement to provide deficit funding to the three IJBs which largely relates to social care. Formal monthly reporting of the Board’s financial position to the Scottish Government is in place with ongoing dialogue throughout the year relating to funding allocations and other cost control measures that have been progressed during the year to mitigate the Boards financial position. In order to achieve in-year financial balance Scottish Government has provided the Board with financial support in the form of repayable brokerage of £65.2 million for a second year (2023/24 £24.8 million). The brokerage is repayable to the Scottish Government at the point in the future when the Board returns to financial balance. Without this additional support, the Board’s final outturn would have been an overspend of £64.948 million (equivalent to 4.17% of the Revenue Resource Limit). A surplus of £0.253 million against the Core Revenue Resource Limit is reported for 2024/25 reflecting this financial support.']","£1,706,002 (£000)","['£1,706,002 (£000)']",Q_2025_FIN_04,Grampian-2024-2025,LEX,number,[28],skipped
What was the underlying deficit against the Core Revenue Resource Limit in 2024/25?,£0.253 million,"['PERFORMANCE REPORT B PERFORMANCE ANALYSIS Memorandum for In Year Out-turn £000 Core Revenue Resource Variance Surplus in 2024/25 253 Financial flexibility: funding banked with/(provided by) -65,200 Scottish Government Underlying Deficit against Core Revenue Resource Limit -64,947 4.17% Further details on non-core elements of expenditure, typically comprising items of a technical accounting nature, can be found in the Summary of Resource Outturn see page 127. NHS Grampian was not able to set a balanced revenue budget for the 2024/25 financial year. The financial plan submitted to Scottish Government in March 2024 projected a £59.1 million deficit for the year after forecasting savings of £34.9 million. Scottish Government confirmed additional funding for Health Boards across the year of £17 million, also cost pressures of £22.8 million of which £21.4', 'consequences of ongoing activity and net capital investment. Health Boards are required to contain their net expenditure within these limits, and report on any variation. NHS Grampian’s 2024/25 performance against these three key financial targets is shown in the table below: Statutory Financial Targets Limit as set Actual Variance by SGHSCD Outturn (Deficit)/Sur plus £000’s £000’s £000’s Core Revenue Resource Limit 1,559,285 1,559,032 253 Non-Core Revenue Resource Limit 40,219 40,219 0 Total Revenue Resource Limit 1,599,504 1,599,251 253 Core Capital Resource Limit 86,909 86,909 - Non-Core Capital Resource Limit 623 623 - Total Capital Resource Limit 87,532 87,532 - Cash Requirement 1,706,002 1,706,002 -', 'This was compounded by the requirement to provide deficit funding to the three IJBs which largely relates to social care. Formal monthly reporting of the Board’s financial position to the Scottish Government is in place with ongoing dialogue throughout the year relating to funding allocations and other cost control measures that have been progressed during the year to mitigate the Boards financial position. In order to achieve in-year financial balance Scottish Government has provided the Board with financial support in the form of repayable brokerage of £65.2 million for a second year (2023/24 £24.8 million). The brokerage is repayable to the Scottish Government at the point in the future when the Board returns to financial balance. Without this additional support, the Board’s final outturn would have been an overspend of £64.948 million (equivalent to 4.17% of the Revenue Resource Limit). A surplus of £0.253 million against the Core Revenue Resource Limit is reported for 2024/25 reflecting this financial support.', 'PERFORMANCE REPORT B PERFORMANCE ANALYSIS 3.2 NHS Grampian performance against statutory financial targets The results of each of the partner organisations, although consolidated with the main Board accounts for group accounting purposes, do not form part of the statutory financial target set for NHS Boards by the Scottish Government Health and Social Care Directorates (SGHSCD) and are, therefore, not taken into account when considering the Board’s in year financial performance. NHS Boards have the ability to manage small under/overspends (within 1% of resource) of an overall breakeven position across a three- year period (2024-27). The Scottish Government require NHS Boards to meet three key financial targets: \uf0d8 Revenue Resource Limit (RRL) – a resource budget for ongoing activity; \uf0d8 Capital Resource Limit (CRL) – a resource budget for net capital investment; and \uf0d8 Cash Requirement – a financing requirement to fund the cash consequences of ongoing activity and net capital investment. Health Boards are required to contain their net expenditure within these limits, and report on any variation. NHS Grampian’s 2024/25 performance against these three key financial targets is shown in the table below: Statutory Financial Targets Limit as set Actual Variance by SGHSCD Outturn (Deficit)/Sur plus £000’s £000’s £000’s Core Revenue Resource Limit 1,559,285 1,559,032 253 Non-Core Revenue Resource', 'is available in the section on key sources of judgement, estimation, and uncertainty in note 1 accounting policies, on Page 106. 3.2.6 Pension Liabilities The accounting policy for pensions is provided in Note 1 to the Accounts and disclosure of the costs is shown within Note 19 and the Remuneration Report. 3.2.7 Infrastructure and Non-Current Assets The Board delivered a programme of infrastructure investment totalling £88.9 million during 2024/25. Within this, a total of £84.42 million of capital expenditure was incurred (see note 7d) and a further £4.47 million was classed as revenue expenditure in nature. The overall programme was resourced using a combination of capital funding from the SGHSCD (£83.469 million, see note 7d), income from donations (£0.41 million), benefit from disposal of assets (£0.02 million) and various revenue funding sources (£5 million)']","£64,947 (£000), 4.17%","['£64,947 (£000), 4.17%']",Q_2025_FIN_05,Grampian-2024-2025,LEX,number,[29],skipped
What fraction of the core resource allocation did NHS Grampian's structural financial shortfall represent in 2024/25?,"-65,200","['PERFORMANCE REPORT B PERFORMANCE ANALYSIS Memorandum for In Year Out-turn £000 Core Revenue Resource Variance Surplus in 2024/25 253 Financial flexibility: funding banked with/(provided by) -65,200 Scottish Government Underlying Deficit against Core Revenue Resource Limit -64,947 4.17% Further details on non-core elements of expenditure, typically comprising items of a technical accounting nature, can be found in the Summary of Resource Outturn see page 127. NHS Grampian was not able to set a balanced revenue budget for the 2024/25 financial year. The financial plan submitted to Scottish Government in March 2024 projected a £59.1 million deficit for the year after forecasting savings of £34.9 million. Scottish Government confirmed additional funding for Health Boards across the year of £17 million, also cost pressures of £22.8 million of which £21.4', 'consequences of ongoing activity and net capital investment. Health Boards are required to contain their net expenditure within these limits, and report on any variation. NHS Grampian’s 2024/25 performance against these three key financial targets is shown in the table below: Statutory Financial Targets Limit as set Actual Variance by SGHSCD Outturn (Deficit)/Sur plus £000’s £000’s £000’s Core Revenue Resource Limit 1,559,285 1,559,032 253 Non-Core Revenue Resource Limit 40,219 40,219 0 Total Revenue Resource Limit 1,599,504 1,599,251 253 Core Capital Resource Limit 86,909 86,909 - Non-Core Capital Resource Limit 623 623 - Total Capital Resource Limit 87,532 87,532 - Cash Requirement 1,706,002 1,706,002 -', 'PERFORMANCE REPORT B PERFORMANCE ANALYSIS 3.2 NHS Grampian performance against statutory financial targets The results of each of the partner organisations, although consolidated with the main Board accounts for group accounting purposes, do not form part of the statutory financial target set for NHS Boards by the Scottish Government Health and Social Care Directorates (SGHSCD) and are, therefore, not taken into account when considering the Board’s in year financial performance. NHS Boards have the ability to manage small under/overspends (within 1% of resource) of an overall breakeven position across a three- year period (2024-27). The Scottish Government require NHS Boards to meet three key financial targets: \uf0d8 Revenue Resource Limit (RRL) – a resource budget for ongoing activity; \uf0d8 Capital Resource Limit (CRL) – a resource budget for net capital investment; and \uf0d8 Cash Requirement – a financing requirement to fund the cash consequences of ongoing activity and net capital investment. Health Boards are required to contain their net expenditure within these limits, and report on any variation. NHS Grampian’s 2024/25 performance against these three key financial targets is shown in the table below: Statutory Financial Targets Limit as set Actual Variance by SGHSCD Outturn (Deficit)/Sur plus £000’s £000’s £000’s Core Revenue Resource Limit 1,559,285 1,559,032 253 Non-Core Revenue Resource', 'This was compounded by the requirement to provide deficit funding to the three IJBs which largely relates to social care. Formal monthly reporting of the Board’s financial position to the Scottish Government is in place with ongoing dialogue throughout the year relating to funding allocations and other cost control measures that have been progressed during the year to mitigate the Boards financial position. In order to achieve in-year financial balance Scottish Government has provided the Board with financial support in the form of repayable brokerage of £65.2 million for a second year (2023/24 £24.8 million). The brokerage is repayable to the Scottish Government at the point in the future when the Board returns to financial balance. Without this additional support, the Board’s final outturn would have been an overspend of £64.948 million (equivalent to 4.17% of the Revenue Resource Limit). A surplus of £0.253 million against the Core Revenue Resource Limit is reported for 2024/25 reflecting this financial support.', 'pay policy. 8. Off-payroll engagements The use of locum agency medical and nursing staff throughout the year is disclosed in section 2 above. All other staff engaged by NHS Grampian to provide services during the year for a period of longer than six months were remunerated through either NHS Grampian’s payroll or where those staff were seconded from a partner organisation e.g. a university or a local authority, they were remunerated through the payroll of that partner organisation. All Board members deemed to have significant financial responsibility during the year were remunerated through NHS Grampian’s payroll. 9. Exit packages There were 11 exit packages agreed during the year which were compulsory redundancies. 2024/25 2023/24 Exit Package cost band Total number of exit Total number of exit packages by cost band packages by cost band £0 - £10,000 10 6 £10,000 - £25,000 1 0 Total Resource Cost (£’000) 80 21']",4.17%,['4.17%'],Q_2025_FIN_06,Grampian-2024-2025,STR,number,[29],skipped
How much repayable brokerage was provided by the Scottish Government in 2024/25?,65.2,"['This was compounded by the requirement to provide deficit funding to the three IJBs which largely relates to social care. Formal monthly reporting of the Board’s financial position to the Scottish Government is in place with ongoing dialogue throughout the year relating to funding allocations and other cost control measures that have been progressed during the year to mitigate the Boards financial position. In order to achieve in-year financial balance Scottish Government has provided the Board with financial support in the form of repayable brokerage of £65.2 million for a second year (2023/24 £24.8 million). The brokerage is repayable to the Scottish Government at the point in the future when the Board returns to financial balance. Without this additional support, the Board’s final outturn would have been an overspend of £64.948 million (equivalent to 4.17% of the Revenue Resource Limit). A surplus of £0.253 million against the Core Revenue Resource Limit is reported for 2024/25 reflecting this financial support.', 'PERFORMANCE REPORT A OVERVIEW Together with our colleagues, partners and the public we are committed to planning for a better future and transforming our services in support of the delivery of safe, high quality, person-centred and sustainable health services over the next five years and beyond. The financial challenges NHS Grampian faced in 2024/25 are highlighted in the Annual Report and Accounts for this year. This challenging financial position is anticipated to continue into future years and work continues to seek financial savings to support our financial recovery. The Accounts show a small underspend against the revenue budget, but this was only achieved due to additional repayable financial support (known as “brokerage”) being provided to the Board, for a second year, by the Scottish Government. This highlights the severe financial pressures currently being faced by the health system in the North East. In 2024/25 NHS Grampian has also been escalated from Stage 2 to Stage 3 of the Scottish Government’s Support & Intervention Framework because of the Board’s financial position and have benefited from additional support and scrutiny. Escalation to Stage 4 was confirmed on 12 May 2025 due to financial sustainability and the deterioration of the Board’s financial position during 2024/25; and Leadership and Governance following rising concerns about', 'PERFORMANCE REPORT B PERFORMANCE ANALYSIS Memorandum for In Year Out-turn £000 Core Revenue Resource Variance Surplus in 2024/25 253 Financial flexibility: funding banked with/(provided by) -65,200 Scottish Government Underlying Deficit against Core Revenue Resource Limit -64,947 4.17% Further details on non-core elements of expenditure, typically comprising items of a technical accounting nature, can be found in the Summary of Resource Outturn see page 127. NHS Grampian was not able to set a balanced revenue budget for the 2024/25 financial year. The financial plan submitted to Scottish Government in March 2024 projected a £59.1 million deficit for the year after forecasting savings of £34.9 million. Scottish Government confirmed additional funding for Health Boards across the year of £17 million, also cost pressures of £22.8 million of which £21.4', 'A CORPORATE GOVERNANCE REPORT In support of this, a Three Year delivery plan 2024-2027 was agreed by the Board as part of a single coherent plan including the Annual Delivery Plan and Medium Term Financial Plan for NHS Grampian. This Delivery plan sets out how NHS Grampian will make progress against the priority areas and strategic intent within the Plan for the Future for 2024 – 2027 in response to the 10 recovery priority areas of the Scottish Government. The Delivery Plan 2024 – 2027 was formally adopted by the Board in June 2024, approved by Scottish Government by letter dated 28 May 2024. The Plan for the Future strategic intent will be delivered through a rolling programme of priority projects and actions, with defined milestones, articulated in a five year rolling Delivery Plan. The Medium Term Financial Framework details the financial position for the next 5 years, reflects our route map to recovering the deficit position. As a result of the continued significant operational pressures being experienced across the health and social care system, plus the high level of inflation, it will not be possible to return to financial balance without significant redesign of the whole health and social care system. In addition the plan recognised that this will', 'confirmed on 12 May 2025 due to financial sustainability and the deterioration of the Board’s financial position during 2024/25; and Leadership and Governance, it will bring enhanced scrutiny and support from the Scottish Government to develop and deliver a Recovery Plan. NHS Grampian submitted its’ 2025/26 Financial Plan to the Scottish Government in March 2025. The plan does not present a break-even position, recognising the significant work to be undertaken to bring the Board back into sustainable financial balance. Scottish Government has instructed NHS Grampian to reduce the scale of the deficit in both 2025/26 and the remainder of this plan and a Recovery Plan will reflect this. The Board expects to record a further revenue deficit in the 2025/26 financial year but is planning for the level of deficit to reduce over the following subsequent financial years as outlined in the Medium-Term Financial Plan. It recognises the significant work to be undertaken to bring the Board back into sustainable financial balance. The plan takes a risk-based approach recognising the need to identify and contain operational overspends without compromising on the level and quality of services NHS Grampian provides. Discussions will continue with the Scottish Government over the provision of further funding cover (known as “brokerage”) to support the projected']","£65,200 (£000)","['£65,200 (£000)']",Q_2025_FIN_07,Grampian-2024-2025,LEX,number,[29],skipped
What was the projected deficit in the financial plan submitted to the Scottish Government for 2024/25?,"-65,200","['PERFORMANCE REPORT B PERFORMANCE ANALYSIS Memorandum for In Year Out-turn £000 Core Revenue Resource Variance Surplus in 2024/25 253 Financial flexibility: funding banked with/(provided by) -65,200 Scottish Government Underlying Deficit against Core Revenue Resource Limit -64,947 4.17% Further details on non-core elements of expenditure, typically comprising items of a technical accounting nature, can be found in the Summary of Resource Outturn see page 127. NHS Grampian was not able to set a balanced revenue budget for the 2024/25 financial year. The financial plan submitted to Scottish Government in March 2024 projected a £59.1 million deficit for the year after forecasting savings of £34.9 million. Scottish Government confirmed additional funding for Health Boards across the year of £17 million, also cost pressures of £22.8 million of which £21.4', 'confirmed on 12 May 2025 due to financial sustainability and the deterioration of the Board’s financial position during 2024/25; and Leadership and Governance, it will bring enhanced scrutiny and support from the Scottish Government to develop and deliver a Recovery Plan. NHS Grampian submitted its’ 2025/26 Financial Plan to the Scottish Government in March 2025. The plan does not present a break-even position, recognising the significant work to be undertaken to bring the Board back into sustainable financial balance. Scottish Government has instructed NHS Grampian to reduce the scale of the deficit in both 2025/26 and the remainder of this plan and a Recovery Plan will reflect this. The Board expects to record a further revenue deficit in the 2025/26 financial year but is planning for the level of deficit to reduce over the following subsequent financial years as outlined in the Medium-Term Financial Plan. It recognises the significant work to be undertaken to bring the Board back into sustainable financial balance. The plan takes a risk-based approach recognising the need to identify and contain operational overspends without compromising on the level and quality of services NHS Grampian provides. Discussions will continue with the Scottish Government over the provision of further funding cover (known as “brokerage”) to support the projected', 'PERFORMANCE REPORT B PERFORMANCE ANALYSIS NHS Grampian has been receiving support from the Scottish Government since November 2023, when the Board was escalated to Stage 2 of the Scottish Government’s Support and Intervention Framework. Further escalation took place in January 2025, when NHS Grampian was escalated to Stage 3 of the framework based on the deterioration in the financial position of the Board during 2024/25 and the recommendation of the National Planning and Performance Oversight Group. Senior officers from within NHS Grampian continue to work closely with the Scottish Government to identify and implement solutions to return the Board to financial balance. In 2024/25 NHS Grampian has also been escalated from Stage 2 to Stage 3 of the Scottish Government’s Support & Intervention Framework because of the Board’s financial position and have benefited from additional support and scrutiny. Escalation to Stage 4 was confirmed on 12 May 2025 due to financial sustainability and the deterioration of the Board’s financial position during 2024/25; and Leadership and Governance, it will bring enhanced scrutiny and support from the Scottish Government to develop and deliver a Recovery Plan. NHS Grampian submitted its’ 2025/26 Financial Plan to the Scottish Government in March 2025. The plan does not present a break-even position, recognising the significant work', 'A CORPORATE GOVERNANCE REPORT In support of this, a Three Year delivery plan 2024-2027 was agreed by the Board as part of a single coherent plan including the Annual Delivery Plan and Medium Term Financial Plan for NHS Grampian. This Delivery plan sets out how NHS Grampian will make progress against the priority areas and strategic intent within the Plan for the Future for 2024 – 2027 in response to the 10 recovery priority areas of the Scottish Government. The Delivery Plan 2024 – 2027 was formally adopted by the Board in June 2024, approved by Scottish Government by letter dated 28 May 2024. The Plan for the Future strategic intent will be delivered through a rolling programme of priority projects and actions, with defined milestones, articulated in a five year rolling Delivery Plan. The Medium Term Financial Framework details the financial position for the next 5 years, reflects our route map to recovering the deficit position. As a result of the continued significant operational pressures being experienced across the health and social care system, plus the high level of inflation, it will not be possible to return to financial balance without significant redesign of the whole health and social care system. In addition the plan recognised that this will', 'Financial Plan. It recognises the significant work to be undertaken to bring the Board back into sustainable financial balance. The plan takes a risk-based approach recognising the need to identify and contain operational overspends without compromising on the level and quality of services NHS Grampian provides. Discussions will continue with the Scottish Government over the provision of further funding cover (known as “brokerage”) to support the projected revenue deficit. It is expected NHS Grampian will continue in operational existence for the foreseeable future, with no indication by Scottish Ministers of any intention for dissolution without transfer of services or functions to another entity with associated funding arrangements. 3.2.1 Delivering Sustainable Healthcare – Finding Balance This was the second successive year that NHS Grampian has overspent against its revenue budget and highlights the severe pressures that the health system faces in the North East of Scotland. A number of actions were taken to combat this overspend including the development in the year. These included amongst other measures: Embedding of an Integrated Performance Assurance Framework \uf0b7 Enhanced Vacancy and Non-Pay Controls \uf0b7']",£59.1 million deficit after forecasting savings of £34.9 million,['£59.1 million deficit after forecasting savings of £34.9 million'],Q_2025_FIN_P1,Grampian-2024-2025,MOD,number,[29],skipped
How much was NHS Grampian's total net expenditure across all services in 2024/25?,£1.269 million,"[""PERFORMANCE REPORT B PERFORMANCE ANALYSIS maintained during 2024/25. The charity investment portfolio traded above prior year levels for the majority of the year. Geopolitical turmoil saw a shock in the market at the financial year-end, which resulted in the investment portfolio ending the year with a net reduction in value of £1.269 million (2.4%) at a level of £51.015 million. The Charity relies upon the generosity of patients, their relatives, and friends, who have experienced the care of NHS Grampian, and other donors who are generous in their support of the Charity. Total income for the year was £3.557 million (2023/24 £3.905 million) and this is analysed between donations, legacies, and income from investments in the chart below: NHS Grampian Charity Income analysis 1,816 1,714 1,609 1,539 £000's 933 910 789 674 570 569 0 188 263 0 0 OTHER DONATIONS NHS CHARITIES CAPITAL LEGACIES INVESTMENT TOGETHER FUNDRAISING 2024-25 2023-24 2022/23 Total expenditure for the year was £3.583 million (2023/24 £3.359 million), £2.785 million relating to grants for charitable activities (2023/24 £2.738 million), £0.587 million on staffing and support costs (2023/24 £0.419 million) and £0.211 million on investment management fees (2023/24 £0.202 million). The net effect was a small net outflow of funds for the year of £0.026 million. The"", 'B REMUNERATION AND STAFF REPORT 10. Expenditure on consultancy Expenditure on external consultancy during 2024/25 was £185,315 (2023/24 £3,800). NHS Grampian has used 3 consultancy firm during 2024/25 (1 in 2023/24). These suppliers provided consultancy services in a number of areas including capital projects, construction and building infrastructure planning and infection control issues. Consultancy services are used for the provision of specialist expertise which is not available from NHS Grampian’s own staff and therefore represent a value for money alternative to the direct employment of specialist staff. 11. Trade Union (Facility Time Publication Requirements) Regulations 2017 The Trade Union (Facility Time Publication Requirements) Regulations 2017 requirement relevant public sector employers to publish, a range of data on the amount and cost of facility time. The following information relating to NHS Grampian is also published on the NHS Grampian website at https://www.nhsgrampian.org/about-us/annual-accounts/ Number of employees who were relevant Full-time equivalent employee union officials during the period 1 April number 2024 to 31 March 2025 108 89.07 Percentage of time spent on facility time Percentage of time Number of representatives 0% 69 1 - 50% 28 51-99% 5 100% 6 Percentage of pay bill spent on facility time Total cost of facility time £0.539 million Total pay bill £1,064.7 million Percentage of', 'works closely with other organisations, including NHS Scotland Counter Fraud Services (CFS) and other government agencies to combat fraud. This includes participation in the bi-annual National Fraud Initiative which is a data matching exercise. The Board also takes part in a post payment patient exemption eligibility verification system, which covers all Family Health Service expenditure. 5. Payment Policy NHS Grampian is committed to supporting the Scottish Government in helping businesses during the current economic situation by paying bills more quickly. The intention is to achieve payment of all undisputed invoices within 10 working days, across all public bodies and NHS Grampian is actively working towards achievement of this accelerated payment target. \uf0b7 In 2024/25, the average credit taken was 12 days (2023/24 14 days). \uf0b7 In 2024/25 95% of invoices by value (2023/24 93%) and 94% of invoices by volume (2023/24 90%) were paid within 30 days. \uf0b7 In 2024/25 90% of invoices by value (2023/24 87%) and 88% of invoices by volume (2023/24 79%) were paid within 10 days. The small improvement in payment performance compared to the prior year reflects work to support the purchase to pay process during the year despite challenges around the impact of wider system pressures on support teams. 6. Social Matters NHS Grampian', 'following transactions with each IJB in 2024/25: \uf0d8 Aberdeen City – Income £302.2 million, expenditure £311.5 million and a retained creditor balance of £19.0 million. (2023/24 Income £295.7 million, expenditure £288.2 million and a retained creditor balance of £9.7 million). \uf0d8 Aberdeenshire – Income £289.9 million, expenditure £300.2 million and a retained creditor balance of £10.3 million. (2023/24 Income £285.8 million, expenditure £279.2 million and a retained creditor balance of £4.9 million). \uf0d8 Moray – Income £124.2 million, expenditure £121.6 million and a retained creditor balance of £1.2 million. (Income £119.4 million, expenditure £115.8 million and a retained creditor balance of £1.7 million). NHS Grampian Endowment Funds (Operating as NHS Grampian Charity) All members of the NHS Grampian Board also function as Trustees of the NHS Grampian Charity. The total NHS Grampian Charity balance at 31 March 2025 was £47.576 million (2023/24 £48.848 million). During the year payments totalling £2.006 million (2023/24 £2.826 million) were made to NHS Grampian by the NHS Grampian Charity to enable a range of research and other activities including infrastructure improvement for the benefit of patients and staff. The NHS Charity received £0.13 million (2023/24 £0.07 million) from NHS Grampian mainly from income for research activities.', 'pay policy. 8. Off-payroll engagements The use of locum agency medical and nursing staff throughout the year is disclosed in section 2 above. All other staff engaged by NHS Grampian to provide services during the year for a period of longer than six months were remunerated through either NHS Grampian’s payroll or where those staff were seconded from a partner organisation e.g. a university or a local authority, they were remunerated through the payroll of that partner organisation. All Board members deemed to have significant financial responsibility during the year were remunerated through NHS Grampian’s payroll. 9. Exit packages There were 11 exit packages agreed during the year which were compulsory redundancies. 2024/25 2023/24 Exit Package cost band Total number of exit Total number of exit packages by cost band packages by cost band £0 - £10,000 10 6 £10,000 - £25,000 1 0 Total Resource Cost (£’000) 80 21']","£1,681 million","['£1,681 million']",Q_2025_FIN_08,Grampian-2024-2025,MOD,number,[31],skipped
By how much did net expenditure increase compared to 2023/24?,£28.6m,"['£5.748 million also undertaken. Thus making the overall net impact on the revaluation reserve in relation to the revaluation completed by the VOA of an increase of £9.723 million (2023/24 £44.791 million increase). The overall increase in property value reflects an increase in construction industry prices during the year, impacted by rising demand and a range of economic and geopolitical factors causing supply bottlenecks, labour shortages and increased materials costs. IAS 36 requires that impairments charged to the Statement of Comprehensive Net Expenditure (SOCNE) in prior years should be reversed to offset any subsequent increase in value relating to that particular asset. The net value of impairment reversal on those assets subject to an upward movement in valuation, was £5.951 million (2023/24 £0.728 million upward impairment) and this was credited to net operating expenditure within the Statement of Comprehensive Net Expenditure. Further information is available in the section on key sources of judgement, estimation, and uncertainty in note 1 accounting policies, on Page 106. 3.2.6 Pension Liabilities The accounting policy for pensions is provided in Note 1 to the Accounts and disclosure of the costs is shown within Note 19 and the Remuneration Report. 3.2.7 Infrastructure and Non-Current Assets The Board delivered a programme of infrastructure investment totalling £88.9 million', 'maintain financial balance through effective management, control, innovation, quality and best practice. The main savings achieved in addition to technical adjustments (£28.6m) were in the areas of agency spend including medical locum and nursing costs, hospital drug costs from switching from branded medicines to generic alternatives, staff cost control measures including vacancy freeze and reduction of overtime, procurement and increased charges for catering. Recurring savings amounted to £25.2 million (2023/24 £12.38 million) and non-recurring of £25.3 million (2023/24 £5.14 million). 3.2.3 Expenditure Analysis Net expenditure for the year was £1,681 million (2023/24 £1,565 million), an increase of £116 million from the prior year. The Consolidated Statement of Comprehensive Net Expenditure can be found on Page 102, a more detailed analysis of Expenditure in note 3 on Page 130 and a more detailed analysis of income in note 4 on Page 133. System pressures continue to result in additional expenditure. Staff Costs increased by £97.2 million due to the annual pay uplift (2023/24 £100.6 million) which was an average between 8.5-10.5% for Medical & Dental staff and 5.5% for Agenda for Change staff, the impact of addition non-pay aspect of the pay award. Drugs and Medical supplies increased by £15.3 million (£28.3 million 2023/24) due to price and volume increases. This', 'Moray IJB 1,450 725 1,012 Consolidated Net Assets 723,423 722,698 700,580 3.1.1 NHS Grampian Charity Fund Operating as NHS Grampian Charity (the Charity) The Charity had net assets of £47.576 million at 31 March 2025 (£48.848 million at 31 March 2024). Overall, the funds available to the charity decreased by £1.272 million over the previous year (2023/24 increase of £3.596 million). This decrease is represented by a net loss on the valuation of investments of £1.246 million (2023/24 gain of £3.049 million) combined with a net outflow of funds on charitable activities of £0.026 million for the year (2023/24 surplus of £0.546 million).', 'Financial table on page 130 (Balance Sheet) Contains 24 line items across 14 columns. Column headers:  | Balances | BalancesM | ovement | Balances | Balances. Row labels: INVENTORIES; BalanceSheet; NetDecrease. Key items: 2023/24 | 2023/24 | 2023/24 | 2023/24; £’000 | £’000 | £’000 | £’000; BalanceSheet | 8,073 | 9,356 | 8,073; NetDecrease | (1,283) | 0 | 0.\n\nTable (header-injected facts):\n\n- BalanceSheet > 2023/24 Balances £’000 : 8,073\n- BalanceSheet > BalancesM 2023/24 £’000 : 9,356\n- NetDecrease > 2023/24 ovement £’000 : (1,283)\n- NetDecrease > 2023/24 Movement £’000 : 0\n- Duewithinoneyear > 2023/24 Balances £’000 : 85,897\n- Duewithinoneyear > BalancesM 2023/24 £’000 : 131,618\n- Duewithinoneyear > 2023/24 Balances £’000 : 116\n- Duewithinoneyear > 2023/24 Balances £’000 : 812\n- Duewithinoneyear > 2023/24 Balances £’000 : (954)\n- Duewithinoneyear > 2023/24 Balances £’000 : (529)\n- Dueaftermorethanoneyear > 2023/24 Balances £’000 : 120,341\n- Dueaftermorethanoneyear > BalancesM 2023/24 £’000 : 94,672\n- Less:Property,Plant&Equipment(Capital)includedinabove > 2023/24 Balances £’000 : 1\n- Less:Property,Plant&Equipment(Capital)includedinabove > BalancesM 2023/24 £’000 : (253)\n- Net(Increase)/Decrease > 2023/24 ovement £’000 : (19,798)\n- Net(Increase)/Decrease > 2023/24 Movement £’000 : (696)\n- Duewithinoneyear > 2023/24 Balances £’000 : 197,228\n- Duewithinoneyear > BalancesM 2023/24 £’000 : 174,163\n- Duewithinoneyear > 2023/24 Balances £’000 : 1,063\n- Duewithinoneyear > 2023/24 Balances £’000 : 944\n- Duewithinoneyear > 2023/24 Balances £’000 : (954)\n- Duewithinoneyear > 2023/24 Balances £’000 : (529)\n- Dueaftermorethanoneyear > 2023/24 Balances £’000 : 64,051\n- Dueaftermorethanoneyear > BalancesM 2023/24 £’000 : 62,041\n- Less:Property,Plant&Equipment(Capital)includedinabove > 2023/24 Balances £’000 : (10,229)\n- Less:Property,Plant&Equipment(Capital)includedinabove > BalancesM 2023/24 £’000 : (7,899)\n- Less:IntangibleAssets(Capital)includedinabove > 2023/24 Balances £’000 : 0\n- Less:IntangibleAssets(Capital)includedinabove > BalancesM 2023/24 £’000 : 0\n- Less:GeneralFundCreditorincludedinabove > 2023/24 Balances £’000 : (10,412)\n- Less:GeneralFundCreditorincludedinabove > BalancesM 2023/24 £’000 : (5,302)\n- Less:LeaseandPFICreditorsincludedinabove > 2023/24 Balances £’000 : (68,148)\n- Less:LeaseandPFICreditorsincludedinabove > BalancesM 2023/24 £’000 : (66,248)\n- NetIncrease/(Decrease) > 2023/24 ovement £’000 : (15,735)\n- NetIncrease/(Decrease) > 2023/24 Movement £’000 : (119)\n- BalanceSheet > 2023/24 Balances £’000 : 225,049\n- BalanceSheet > BalancesM 2023/24 £’000 : 247,662\n- BalanceSheet > 2023/24 Balances £’000 : 5,608\n- BalanceSheet > 2023/24 Balances £’000 : 4,544\n- BalanceSheet > 2023/24 Balances £’000 : 0\n- BalanceSheet > 2023/24 Balances £’000 : 0\n- NetIncrease > 2023/24 ovement £’000 : 22,613\n- NetIncrease > 2023/24 Movement £’000 : (1,064)\n- NETMOVEMENT(Decrease)/Increase > 2023/24 ovement £’000 : (14,203)\n- NETMOVEMENT(Decrease)/Increase > 2023/24 Movement £’000 : (1,879)\n- Column headers: Row label > 2023/24 Balances £’000 : 2023/24 Balances £’000\n- Column headers: Row label > BalancesM 2023/24 £’000 : BalancesM 2023/24 £’000\n- Column headers: Row label > 2023/24 ovement £’000 : 2023/24 ovement £’000\n- Column headers: Row label > 2023/24 Balances £’000 : 2023/24 Balances £’000\n- Column headers: Row label > 2023/24 Balances £’000 : 2023/24 Balances £’000\n- Column headers: Row label > 2023/24 Movement £’000 : 2023/24 Movement £’000\n- Column headers: Row label > 2023/24 Balances £’000 : 2023/24 Balances £’000\n- Column headers: Row label > 2023/24 Balances £’000 : 2023/24 Balances £’000\n- Column headers: Row label > 2023/2 Moveme £’000 : 2023/2 Moveme £’000\n\nTable (markdown):\n\n| col_1 | Balances | BalancesM | ovement | Balances | Balances | Movement | Balances | Balances | Moveme |\n| --- | --- | --- | --- | --- | --- | --- | --- | --- | --- |\n|  | 2023/24 | 2023/24 | 2023/24 | 2023/24 | 2023/24 | 2023/24 | 2023/24 | 2023/24 | 2023/2 |\n|  | £’000 | £’000 | £’000 | £’000 | £’000 | £’000 | £’000 | £’000 | £’000 |\n| INVENTORIES |  |  |  |  |  |  |  |  |  |\n| BalanceSheet | 8,073 | 9,356 |  |  |  |  |  |  |  |\n| NetDecrease |  |  | (1,283) |  |  | 0 |  |  |  |\n| TRADEANDOTHERRECEIVABLES |  |  |  |  |  |  |  |  |  |\n| Duewithinoneyear | 85,897 | 131,618 |  | 116 | 812 |  | (954) | (529) |  |\n| Dueaftermorethanoneyear | 120,341 | 94,672 |  |  |  |  |  |  |  |\n| Less:Property,Plant&Equipment(Capital)includedinabove | 1 | (253) |  |  |  |  |  |  |  |\n|  | 206,239 | 226,037 |  | 116 | 812 |  | (954) | (529) |  |\n| Net(Increase)/Decrease |  |  | (19,798) |  |  | (696) |  |  |  |\n| TRADEANDOTHERPAYABLES |  |  |  |  |  |  |  |  |  |\n| Duewithinoneyear | 197,228 | 174,163 |  | 1,063 | 944 |  | (954) | (529) |  |\n| Dueaftermorethanoneyear | 64,051 | 62,041 |  |  |  |  |  |  |  |\n| Less:Property,Plant&Equipment(Capital)includedinabove | (10,229) | (7,899) |  |  |  |  |  |  |  |\n| Less:IntangibleAssets(Capital)includedinabove | 0 | 0 |  |  |  |  |  |  |  |\n| Less:GeneralFundCreditorincludedinabove | (10,412) | (5,302) |  |  |  |  |  |  |  |\n| Less:LeaseandPFICreditorsincludedinabove | (68,148) | (66,248) |  |  |  |  |  |  |  |\n|  | 172,490 | 156,755 |  | 1,063 | 944 |  | (954) | (529) |  |\n| NetIncrease/(Decrease) |  |  | (15,735) |  |  | (119) |  |  |  |\n| PROVISIONS |  |  |  |  |  |  |  |  |  |\n| BalanceSheet | 225,049 | 247,662 |  | 5,608 | 4,544 |  | 0 | 0 |  |\n| NetIncrease |  |  | 22,613 |  |  | (1,064) |  |  |  |\n| NETMOVEMENT(Decrease)/Increase |  |  | (14,203) |  |  | (1,879) |  |  |  |\nColumn headers: Row label | 2023/24 Balances £’000 | BalancesM 2023/24 £’000 | 2023/24 ovement £’000 | 2023/24 Balances £’000 | 2023/24 Balances £’000 | 2023/24 Movement £’000 | 2023/24 Balances £’000 | 2023/24 Balances £’000 | 2023/2 Moveme £’000\nRow map:\n- BalanceSheet -> col_1=8,073 ; col_2=9,356\n- NetDecrease -> col_3=(1,283) ; col_6=0\n- Duewithinoneyear -> col_1=85,897 ; col_2=131,618 ; col_4=116 ; col_5=812 ; col_7=(954) ; col_8=(529)\n- Dueaftermorethanoneyear -> col_1=120,341 ; col_2=94,672\n- Less:Property,Plant&Equipment(Capital)includedinabove -> col_1=1 ; col_2=(253)\n- Net(Increase)/Decrease -> col_3=(19,798) ; col_6=(696)\n- Duewithinoneyear -> col_1=197,228 ; col_2=174,163 ; col_4=1,063 ; col_5=944 ; col_7=(954) ; col_8=(529)\n- Dueaftermorethanoneyear -> col_1=64,051 ; col_2=62,041\n- Less:Property,Plant&Equipment(Capital)includedinabove -> col_1=(10,229) ; col_2=(7,899)\n- Less:IntangibleAssets(Capital)includedinabove -> col_1=0 ; col_2=0\n- Less:GeneralFundCreditorincludedinabove -> col_1=(10,412) ; col_2=(5,302)\n- Less:LeaseandPFICreditorsincludedinabove -> col_1=(68,148) ; col_2=(66,248)\n- NetIncrease/(Decrease) -> col_3=(15,735) ; col_6=(119)\n- BalanceSheet -> col_1=225,049 ; col_2=247,662 ; col_4=5,608 ; col_5=4,544 ; col_7=0 ; col_8=0\n- NetIncrease -> col_3=22,613 ; col_6=(1,064)\n- NETMOVEMENT(Decrease)/Increase -> col_3=(14,203) ; col_6=(1,879)', 'PERFORMANCE REPORT B PERFORMANCE ANALYSIS Increases in expenditure was also experienced in the independent primary care sector of £23.1 million due to increases in activity and uplifts to national contract values. Reduction in other non-pay costs for the year of £9.4 million, reflecting reduced spend in relation legal obligations arising from clinical negligence and other employer liability claims and other reductions driven by the savings initiatives adopted by the Board. Contribution to IJBs increased during the year by £50.6m, inclusive of a contribution to overspends incurred. The above increases in expenditure were partly offset by an increase in services commissioned through the Health Board by the Integration Joint Boards of £15.4 million. Contributions to IJBs overspends increased during the year to £22.45 million (2023/24 £7.7']","£116 million (from £1,565 million in 2023/24)","['£116 million (from £1,565 million in 2023/24)']",Q_2025_FIN_09,Grampian-2024-2025,LEX,number,[31],skipped
