user_input,retrieved_contexts,response,reference,answer_relevancy,faithfulness,context_precision,context_recall
What resource budget ceiling was set for NHS Grampian's core ongoing activities in 2020/21?,"['7. Financial Performance and Position (cont) 7.2 Grampian Health Board performance against statutory financial targets The results of each of the partner organisations, although consolidated with the main Board accounts for group accounting purposes, do not form part of the statutory financial target set for NHS Boards by the (SGHSCD) and are therefore not taken in to account when considering the Board’s in year financial performance. The three annual financial targets set for each Health Board by the SGHSCD are: ➢ Revenue Resource Limit (RRL)– a resource budget for ongoing activity; ➢ Capital Resource Limit (CRL) – a resource budget for net capital investment; and ➢ Cash Requirement – a financing requirement to fund the cash consequences of ongoing activity and net capital investment. Health Boards are required to contain their net expenditure within these limits, and report on any variation. Grampian Health Board has successfully achieved all three financial targets for the year reporting an outturn against these set limits as follows: Statutory Financial Targets Limit as set by Actual Variance Under SGHSCD Outturn £000’s', 'these limits, and report on any variation. Grampian Health Board has successfully achieved all three financial targets for the year reporting an outturn against these set limits as follows: Statutory Financial Targets Limit as set by Actual Variance Under SGHSCD Outturn £000’s £000’s £000’s Core Revenue Resource Limit 1,278,771 1,278,002 769 Non-Core Revenue Resource Limit 32,340 32,340 - Total 1,311,111 1,310,342 769 Core Capital Resource Limit 42,246 42,246 - Non-Core Capital Resource Limit 1,070 1,070 - Total 43,316 43,316 - Cash Requirement 1,298,124 1,298,124 - Memorandum for In Year Out-turn £000 Core Revenue Resource Variance Surplus in 2020/21 769 Financial flexibility : funding banked with Scottish Government 0 Underlying Surplus against Core Revenue Resource Limit 769 0% The Board is reporting an underspend of £0.769m against', '£000 Core Revenue Resource Variance Surplus in 2020/21 769 Financial flexibility : funding banked with Scottish Government 0 Underlying Surplus against Core Revenue Resource Limit 769 0% The Board is reporting an underspend of £0.769m against a target of breakeven on the revenue resource limit for 2020/21. Due to the impact of the COVID-19 pandemic, the Scottish Government paused the Annual Operating and financial planning process. Recognising the exceptional nature of 2020-21 and the impact on delivery of financial plans, additional non- repayable funding was provided to support in-year financial balance across all NHS Boards. NHS Grampian received £47.3m. The flexibility allowed within the previously agreed three-year financial planning and performance cycle, allowed NHS Grampian to bank £1m from the reported surplus in 2019/20, with the Scottish Government, for use in 2021/22.', 'and published reports including the following key updates on progress in 20/21: - An NHS Grampian Equality Outcomes Report 2021-2025, detailing what NHS Grampian wishes to achieve in the sphere of each of the 9 “protected characteristics” over the next 4 years. - An NHS Grampian “Mainstreaming” Report detailing what NHS Grampian has done in the last 2 years to make equality and diversity an integral part of the way we function as an organisation. NHS Grampian has also published a range of other non-Statutory Equality and Diversity Monitoring Reports on a wide range of topics. During 2020/21, over 1,500 NHS Grampian staff received Equality and Diversity Training by TEAMS at a level appropriate to their role in the organisation. Over the last three years, over 5,000 NHS Grampian staff have received this training. All of the Seminars include a section on Human Trafficking.', '7. Internal Control Matters (cont) 7.8 Involvement and Engagement (cont) ➢ The Board’s assurance framework recognises the role of staff side and the advisory structure in supporting the work of Board sub committees and to clarify the role and importance of the Engagement and Participation Committee as a core governance committee of the Board. 7.9 Collaborative Working ➢ Agreement to share, reciprocally, all relevant internal audit reports with the Audit Committees of the IJBs and partner organisations, and where appropriate, to co- ordinate internal audit activity across sectors. In line with this principle NHS Grampian’s internal audit programme for 2020/21 included dedicated audit time in support of Health and Social Care Integration activities with the scope agreed jointly by the three IJB Chief Officers. 8.0 Best Value I can confirm that Grampian Health Board is committed to ensuring that its activities are undertaken in a manner that will secure best value in the use of public funds in line with the arrangements set out in the Scottish Public Finance Manual. The Board incorporates the principles of best value within']",The three annual financial targets set for each Health Board by the SGHSCD are: ➢ Revenue Resource Limit (RRL)– a resource budget for ongoing activity; ➢ Capital Resource Limit (CRL) – a resource budget for net capital investment; and ➢ Cas,"£1,278,771 (£000)",0.5020984360862848,1.0,0.49999999995,1.0
How much did NHS Grampian actually spend against its core resource budget in 2020/21?,"['£000 Core Revenue Resource Variance Surplus in 2020/21 769 Financial flexibility : funding banked with Scottish Government 0 Underlying Surplus against Core Revenue Resource Limit 769 0% The Board is reporting an underspend of £0.769m against a target of breakeven on the revenue resource limit for 2020/21. Due to the impact of the COVID-19 pandemic, the Scottish Government paused the Annual Operating and financial planning process. Recognising the exceptional nature of 2020-21 and the impact on delivery of financial plans, additional non- repayable funding was provided to support in-year financial balance across all NHS Boards. NHS Grampian received £47.3m. The flexibility allowed within the previously agreed three-year financial planning and performance cycle, allowed NHS Grampian to bank £1m from the reported surplus in 2019/20, with the Scottish Government, for use in 2021/22.', 'these limits, and report on any variation. Grampian Health Board has successfully achieved all three financial targets for the year reporting an outturn against these set limits as follows: Statutory Financial Targets Limit as set by Actual Variance Under SGHSCD Outturn £000’s £000’s £000’s Core Revenue Resource Limit 1,278,771 1,278,002 769 Non-Core Revenue Resource Limit 32,340 32,340 - Total 1,311,111 1,310,342 769 Core Capital Resource Limit 42,246 42,246 - Non-Core Capital Resource Limit 1,070 1,070 - Total 43,316 43,316 - Cash Requirement 1,298,124 1,298,124 - Memorandum for In Year Out-turn £000 Core Revenue Resource Variance Surplus in 2020/21 769 Financial flexibility : funding banked with Scottish Government 0 Underlying Surplus against Core Revenue Resource Limit 769 0% The Board is reporting an underspend of £0.769m against', '7. Financial Performance and Position (cont) 7.2 Grampian Health Board performance against statutory financial targets The results of each of the partner organisations, although consolidated with the main Board accounts for group accounting purposes, do not form part of the statutory financial target set for NHS Boards by the (SGHSCD) and are therefore not taken in to account when considering the Board’s in year financial performance. The three annual financial targets set for each Health Board by the SGHSCD are: ➢ Revenue Resource Limit (RRL)– a resource budget for ongoing activity; ➢ Capital Resource Limit (CRL) – a resource budget for net capital investment; and ➢ Cash Requirement – a financing requirement to fund the cash consequences of ongoing activity and net capital investment. Health Boards are required to contain their net expenditure within these limits, and report on any variation. Grampian Health Board has successfully achieved all three financial targets for the year reporting an outturn against these set limits as follows: Statutory Financial Targets Limit as set by Actual Variance Under SGHSCD Outturn £000’s', '7. Financial Performance and Position (cont) 7.2.1 Efficiency Savings Efficiency savings of £6.7 million were achieved against a target of £12.2 million for NHS Grampian services, mainly from the reduction in the use of agency medical and nursing staff compared to 2019/20. Recurring savings amounted to £6.05 million and non-recurring of £0.65 million. The gap of £5.5 million was covered non-recurringly by the Scottish Government through their COVID-19 supplementary funding allocation, recognising that the focus of budget managers was not in the delivery of savings during the period of the Board being on an emergency footing. 7.2 Grampian Health Board performance against statutory financial targets 7.2.2 Financial impact of the COVID-19 Pandemic It is important to recognise that, although there were additional direct costs incurred as a result of specific initiatives, the Board’s COVID-19 recovery and remobilisation response was a whole system effort delivered under emergency provisions with the majority of our core services reconfigured to manage the impact.', 'OVERVIEW 1. Purpose This Overview aims to provide the reader with sufficient information to understand the purpose of the NHS Grampian Board, the key risks to the achievement of its objectives and how it has performed during the year. Should you wish to find out more detailed information we have provided this in the rest of the Performance Report, the Accountability Report and the financial statements. NHS Grampian publishes a wide range of information on its services and activities on its website which you can find at: https://www.nhsgrampian.org/ 2. Statement from the Chief Executive Looking back on 2020/21, it is difficult not to view the year just past as being anything other than exceptional in terms of its impact on our staff, the NHS and the population as a whole. Since taking up the role as Chief Executive at the beginning of November and in my previous role as the Director of Nursing, Midwifery and Allied Health Professionals I have been very proud of the outstanding response from our staff, partners and the public in addressing the challenges that COVID-19 has presented, often in the most']",000,"£1,278,002 (£000)",0.11552721545041195,0.0,0.0,1.0
By how much did NHS Grampian's actual core expenditure differ from its revenue resource limit in 2020/21?,"['these limits, and report on any variation. Grampian Health Board has successfully achieved all three financial targets for the year reporting an outturn against these set limits as follows: Statutory Financial Targets Limit as set by Actual Variance Under SGHSCD Outturn £000’s £000’s £000’s Core Revenue Resource Limit 1,278,771 1,278,002 769 Non-Core Revenue Resource Limit 32,340 32,340 - Total 1,311,111 1,310,342 769 Core Capital Resource Limit 42,246 42,246 - Non-Core Capital Resource Limit 1,070 1,070 - Total 43,316 43,316 - Cash Requirement 1,298,124 1,298,124 - Memorandum for In Year Out-turn £000 Core Revenue Resource Variance Surplus in 2020/21 769 Financial flexibility : funding banked with Scottish Government 0 Underlying Surplus against Core Revenue Resource Limit 769 0% The Board is reporting an underspend of £0.769m against', '£000 Core Revenue Resource Variance Surplus in 2020/21 769 Financial flexibility : funding banked with Scottish Government 0 Underlying Surplus against Core Revenue Resource Limit 769 0% The Board is reporting an underspend of £0.769m against a target of breakeven on the revenue resource limit for 2020/21. Due to the impact of the COVID-19 pandemic, the Scottish Government paused the Annual Operating and financial planning process. Recognising the exceptional nature of 2020-21 and the impact on delivery of financial plans, additional non- repayable funding was provided to support in-year financial balance across all NHS Boards. NHS Grampian received £47.3m. The flexibility allowed within the previously agreed three-year financial planning and performance cycle, allowed NHS Grampian to bank £1m from the reported surplus in 2019/20, with the Scottish Government, for use in 2021/22.', '7. Financial Performance and Position (cont) 7.2 Grampian Health Board performance against statutory financial targets The results of each of the partner organisations, although consolidated with the main Board accounts for group accounting purposes, do not form part of the statutory financial target set for NHS Boards by the (SGHSCD) and are therefore not taken in to account when considering the Board’s in year financial performance. The three annual financial targets set for each Health Board by the SGHSCD are: ➢ Revenue Resource Limit (RRL)– a resource budget for ongoing activity; ➢ Capital Resource Limit (CRL) – a resource budget for net capital investment; and ➢ Cash Requirement – a financing requirement to fund the cash consequences of ongoing activity and net capital investment. Health Boards are required to contain their net expenditure within these limits, and report on any variation. Grampian Health Board has successfully achieved all three financial targets for the year reporting an outturn against these set limits as follows: Statutory Financial Targets Limit as set by Actual Variance Under SGHSCD Outturn £000’s', 'foreseeable future. 5) Accounting Convention The Accounts are prepared on a historical cost basis, as modified by the revaluation of property, plant and equipment and available for sale financial assets and liabilities. Fair value is defined as the amount for which an asset could be exchanged between knowledgeable, willing parties in an arms-length transaction. 6) Funding 6 (a) Grampian Health Board Most of the expenditure of the Health Board as Commissioner is met from funds advanced by the Scottish Government within an approved revenue resource limit (RRL) . Cash drawn down to fund expenditure within this approved revenue resource limit is credited to the general fund. All other income receivable by the board that is not classed as funding is recognised when the transfer of goods or services (the performance obligation) is satisfied. Where income is received for goods or services that will not be delivered in the current financial year, that income is deferred. Income from the sale of non-current assets is recognised only when all material conditions of sale have been met, and is measured as the sums due under the sale contract. Non-discretionary funding out-with the', 'OVERVIEW 1. Purpose This Overview aims to provide the reader with sufficient information to understand the purpose of the NHS Grampian Board, the key risks to the achievement of its objectives and how it has performed during the year. Should you wish to find out more detailed information we have provided this in the rest of the Performance Report, the Accountability Report and the financial statements. NHS Grampian publishes a wide range of information on its services and activities on its website which you can find at: https://www.nhsgrampian.org/ 2. Statement from the Chief Executive Looking back on 2020/21, it is difficult not to view the year just past as being anything other than exceptional in terms of its impact on our staff, the NHS and the population as a whole. Since taking up the role as Chief Executive at the beginning of November and in my previous role as the Director of Nursing, Midwifery and Allied Health Professionals I have been very proud of the outstanding response from our staff, partners and the public in addressing the challenges that COVID-19 has presented, often in the most']",£0.769m,£769 (£000) surplus,0.41439787607526674,1.0,0.99999999995,1.0
